COD. ÚNICO,VIGENCIA,AÑO,AÑO PRESP.,BIP,DV,NOMBRE INICIATIVA,TIPO,PROVINCIA,COMUNA,ETAPA,TIPOLOGÍA,Categoría GORE,SUBT,ITEM,ASIG,FORMULADOR,ORIGEN,UNIDAD TÉCNICA,DIVISIÓN VINCULADA,MONTO INICIATIVA,MONTO FNDR,MONTO FINAL APROB.,GASTO VIGENTE,ESTADO ACTUAL,FECHA ESTADO ACTUAL,RATE ACTUAL,FECHA ULTIMO RATE,OBSERVACIONES GENERALES,_source_file,_cleaned_at
40010057-2019,NO VIGENTE,2019,2019,40010057,0,CONSTRUCCION RUEDO Y CORRALES MUNICIPALIDAD EL CARMEN,PROYECTO,DIGUILLIN,EL CARMEN,EJECUCIÓN,FRIL,,33,3,125,MUNICIP. EL CARMEN,MUNICIPIO,,,"$59,989","$59,989",,"M$59,989",NO RECOMEN,,OT,17-12-2019,"// SE ENVÍA CORREO A FORMULADOR 17-12-2019 PARA SUBSANACIÓN DE OBSERVACIONES //POR ORD. 812 DEL 07-11-19 (SIN EXPEDIENTE POR ERROR EN DISTRIBUCIÓN) ALCALDE INFORMA SUBSANACION DE OBSERVACIONES, DERIVADO ANALISTA PARA REVISION POR CORREO 10-12-19 // POR ORD.",ANÁLISIS.csv,2025-12-23T05:39:40.004653
40010065-2019,NO VIGENTE,2019,2019,40010065,0,"ADQUISICION MINI CARGADOR FRONTAL, CHILLAN VIEJO",PROYECTO,DIGUILLIN,CHILLAN VIEJO,EJECUCIÓN,C-33,,29,5,2,MUNICIP. CHILLÁN VIEJO,MUNICIPIO,,,"$29,077","$29,077",,"M$29,077",REVISAR,,,,// EN REVISIÓN ANALISTA,ANÁLISIS.csv,2025-12-23T05:39:40.004721
40010076-2019,NO VIGENTE,2019,2019,40010076,0,"ADQUISICION EQUIPO PSICOTECNICO PARA LA DIRECCIÓN DE TRANSITO, CHILLAN VIEJO",PROYECTO,DIGUILLIN,CHILLAN VIEJO,EJECUCIÓN,C-33,,29,4,,MUNICIP. CHILLÁN VIEJO,MUNICIPIO,,,"$12,747","$12,747",,"M$12,747",REVISAR,,,,// EN REVISIÓN ANALISTA,ANÁLISIS.csv,2025-12-23T05:39:40.004832
40010082-2019,NO VIGENTE,2019,2019,40010082,0,"ADQUISICIÓN CAMIÓN LIMPIA FOSAS, CHILLAN VIEJO",PROYECTO,DIGUILLIN,CHILLAN VIEJO,EJECUCIÓN,C-33,,29,3,,MUNICIP. CHILLÁN VIEJO,MUNICIPIO,,,"$93,876","$93,876",,"M$93,876",REV SUB OBSE,,FI,26-04-2019,"// POR ORD. 266 DEL 29-04-19 E2161/2019 FORMULADOR INFORMA SUBSANACIÓN DE OBSERVACIONES, DERIVADO ANALISTA PARA REVISIÓN // FI DEL 26-04-19 INFORMADO POR CORREO MISMO DIA // POR ORD. 215 DEL 03-04-19 E1796/2019 FORMULADOR INFORMA SUBSANACIÓN DE OBSERVACIONES",ANÁLISIS.csv,2025-12-23T05:39:40.004904
40010083-2019,NO VIGENTE,2019,2019,40010083,0,"ADQUISICION MAQUINA BACHADORA, CHILLAN VIEJO",PROYECTO,DIGUILLIN,CHILLAN VIEJO,EJECUCIÓN,C-33,,29,5,2,MUNICIP. CHILLÁN VIEJO,MUNICIPIO,,,"$75,503","$75,503",,"M$75,503",NO RECOMEN,,INADMISIBLE,08-03-2019,// INADMISIBLE 08-03-19 INFORMADO POR CORREO MISMO DIA // EN REVISIÓN ANALISTA,ANÁLISIS.csv,2025-12-23T05:39:40.005065
40010084-2019,NO VIGENTE,2019,2019,40010084,0,CONSTRUCCION MULTICANCHA SECTOR EL PEUMO,PROYECTO,PUNILLA,SAN NICOLÁS,EJECUCIÓN,FRIL,,33,3,125,MUNICIP. SAN NICOLÁS,MUNICIPIO,,,"$59,671","$59,671",,"M$59,671",REVISAR,,ADMISIBLE,26-04-2019,// ENTREGADO ANALISTA GORE PARA REVISIÓN 27-12-18,ANÁLISIS.csv,2025-12-23T05:39:40.005136
40010086-2019,NO VIGENTE,2019,2019,40010086,0,"TRANSFERENCIA RENOVACIÓN BUSES, MINIBUSES, TROLEBUSES, TAXIBUSES Y TAXIS COLECTIVOS",PROGRAMA,REGIONAL,REGIONAL,EJECUCIÓN,GLOSA 5.1,,33,3,,TRANSPORTES,SECTORIAL / OTRO,,,"$1,678,661","$1,678,661",,"M$1,678,661",APRO CORE,,RS,27-12-2018,// SE ENVIA A TABLA DE CORE 28-12-18 / RS GORE ÑUBLE 26-12-18 / FI GORE ÑUBLE 20-12-18,ANÁLISIS.csv,2025-12-23T05:39:40.005401
40010087-2019,NO VIGENTE,2019,2019,40010087,0,CONSTRUCCION SEÑALETICA TURÍSTICA PARA LA ZONA URBANA DE QUIRIHUE.,PROYECTO,ITATA,QUIRIHUE,EJECUCIÓN,FRIL,,33,3,125,MUNICIP. QUIRIHUE,MUNICIPIO,,,"$29,999","$29,999",,"M$29,999",REVISAR,,ADMISIBLE,26-04-2019,// EN REVISIÓN ADMISIBILIDAD GORE ÑUBLE,ANÁLISIS.csv,2025-12-23T05:39:40.005671
40010091-2019,NO VIGENTE,2019,2019,40010091,0,ADQUISICION IMPLEMENTACION SISTEMA TECNOLOGICO VIGILANCIA SILVOAGROPECUARIA,PROYECTO,REGIONAL,REGIONAL,EJECUCIÓN,C-33,,29,4,,SAG,SECTORIAL / OTRO,,,"$22,000","$22,000",,"M$22,000",REVISAR,,,,// REASIGNADO ANALISTA 19-02-19 // ADMISIBLE GORE ÑUBLE COMITÉ N°9 DEL 19-12-18 / NUEVO,ANÁLISIS.csv,2025-12-23T05:39:40.005984
40010092-2019,NO VIGENTE,2019,2019,40010092,0,CONSTRUCCION SEDE SOCIAL LAS ARAUCARIAS EL CARMEN,PROYECTO,DIGUILLIN,EL CARMEN,EJECUCIÓN,FRIL,,33,3,125,MUNICIP. EL CARMEN,MUNICIPIO,,,"$59,442","$59,442",,"M$59,442",REVISAR,,ADMISIBLE,26-04-2019,"// REPOSTULADO POR ORD. 235 DEL 29-03-19 E1647/2019, DERIVADO ANALISTA PARA REVISIÓN // EN REVISIÓN ANALISTA / ANALISTAS ELIAS Y VICTOR CON PERMISO 28-12, SE DISTRIBUIRAN EL LUNES 31-12-18",ANÁLISIS.csv,2025-12-23T05:39:40.006074
40010093-2019,NO VIGENTE,2019,2019,40010093,0,CONSTRUCCION MULTICANCHA Y CIERRE SECTOR BADILLO EL CARMEN,PROYECTO,DIGUILLIN,EL CARMEN,EJECUCIÓN,FRIL,,33,3,125,MUNICIP. EL CARMEN,MUNICIPIO,,,"$58,355","$58,355",,"M$58,355",NO RECOMEN,,FI,26-12-2019,"// POR ORD 958 E6874/2019 DEL 30-12-2019 FORMULADOR INFORMA SUBSANACION DE OBSERVACIONES //FI DEL 26-12-19 INFORMADO POR CORREO MISMO DIA AL FORMULADOR PARA SUBSANAR OBSERVACIONES, EL ANALISTA LE DA UN PLAZO DE 3 DIAS PARA SUBSANACION//POR ORD. 810 DEL 07-11",ANÁLISIS.csv,2025-12-23T05:39:40.007023
40010094-2019,NO VIGENTE,2019,2019,40010094,0,CONSTRUCCION GRADERIAS CANCHA EL ARBOLITO COMUNA EL CARMEN,PROYECTO,DIGUILLIN,EL CARMEN,EJECUCIÓN,FRIL,,33,3,125,MUNICIP. EL CARMEN,MUNICIPIO,,,"$59,977","$59,977",,"M$59,977",REV SUB OBSE,,FI,28-11-2019,"// POR ORD. 887 DEL 09-12-19 E6391/2019 FORMULADOR INFORMA SUBSANACION DE OBSERVACIONES, DERIVADO ANALISTA PARA REVISION 09-12-19 // FI DEL 28-11-19 INFORMADO POR CORREO MISMO DIA // REASIGNADO ANALISTA 11-11-19 // REPOSTULADO POR ORD. 231 DE FECHA 28-03-19",ANÁLISIS.csv,2025-12-23T05:39:40.007228
40010111-2019,NO VIGENTE,2019,2019,40010111,0,TRANSFERENCIA MEDIDA DE MITIGACIÓN FRENTE AL IMPACTO DE LA CONSTRUCCION DE EMBALSE PUNILLA,PROGRAMA,REGIONAL,REGIONAL,EJECUCIÓN,GLOSA 5.1,,33,3,,INDAP,SECTORIAL / OTRO,,,"$288,000","$288,000",,"M$144,000",REV SUB OBSE,,FI,29-01-2019,"// POR ORD. 11533 DEL 07-03-19 E1187/2019 FORMULADOR INFORMA SUBSANACIÓN DE OBSERVACIONES, EN REVISIÓN POR ANALISTA // FI 29-01-19 / FI 07-01-19 / ADMISIBLE GORE ÑUBLE N°9 19-12-18 / NUEVO",ANÁLISIS.csv,2025-12-23T05:39:40.007425
40010121-2019,NO VIGENTE,2019,2019,40010121,0,"ADQUISICION VEHICULO CON BRAZO ARTICULADO, COMUNA DE SAN CARLOS",PROYECTO,PUNILLA,SAN CARLOS,EJECUCIÓN,C-33,,29,5,2,MUNICIP. SAN CARLOS,MUNICIPIO,,,"$83,455","$83,455",,"M$83,455",NO RECOMEN,,OT,07-02-2019,"// SE ENVÍA CORREO A FORMULADOR 31-07-19 // OT 07-02-19 SE INFORMA POR CORREO MISMO DIA / POR ORD. 236 DEL 29-01-19 E676/2019 SE INFORMA RESPUESTA A OBSERVACIONES, DERIVADO ANALISTA 05-02-19 / OT 21-01-19 ACTA ENVIADA POR CORREO 21-01-19 JORGE OÑATE / EN REV",ANÁLISIS.csv,2025-12-23T05:39:40.007506
40010136-2019,NO VIGENTE,2019,2019,40010136,0,TRANSFERENCIA CONSTRUCCIÓN/INSTALACIÓN DE SISTEMAS SOLARES TÉRMICOS PARA HOGARES DE ANCIANOS,PROGRAMA,REGIONAL,REGIONAL,EJECUCIÓN,GLOSA 5.1,,33,3,,ENERGIA,SECTORIAL / OTRO,,,"$184,387","$184,387",,"M$184,387",REEMPL,,RS,20-02-2019,// POR ORD. 038 DEL 26-06-19 E3281/2019 FORMULADOR REEMPLAZA INICIATIVA POR BIP 40015466 // PROYECTO RECHAZADO POR DIPRESS POR GLOSA 5.1// APROBADO CORE E1277/2019 // PRESENTADO A CORE MEDIANTE ORD. 91 DE FECHA 22-02-19 E993/2019 // RS DE FECHA 20-02-19 INFO,ANÁLISIS.csv,2025-12-23T05:39:40.007580
40010183-2019,NO VIGENTE,2019,2019,40010183,0,TRANSFERENCIA CONSTRUCCIÓN DE TECHOS SOLARES EN COLEGIOS Y LICEOS PÚBLICOS,PROGRAMA,REGIONAL,REGIONAL,EJECUCIÓN,GLOSA 5.1,,33,3,,ENERGIA,SECTORIAL / OTRO,,,"$422,121","$422,121",,"M$422,121",REEMPL,,OT,28-01-2019,"// MEDIANTE CORREO DE FECHA 25-02-19 DE PATRICIA VILLARROEL MONTOYA <PVILLARROEL@MINENERGIA.CL, SE INFORMA EL DESISTIMIENTO DEL PROYECTO // OT DEL 28-01-19 SE ENVÍA POR CORREO / ENTREGADO ANALISTA GORE PARA REVISIÓN 27-12-18",ANÁLISIS.csv,2025-12-23T05:39:40.007684
40010187-2019,NO VIGENTE,2019,2019,40010187,0,TRANSFERENCIA CONSTRUCCION/INSTALACION DE SISTEMAS SOLARES TÉRMICOS PARA ESCUELAS RURALES,PROGRAMA,REGIONAL,REGIONAL,EJECUCIÓN,GLOSA 5.12,,33,3,,ENERGIA,SECTORIAL / OTRO,,,"$375,062","$375,062",,"M$375,062",REV SUB OBSE,,RE,06-06-2019,"// RETIRADO DE CORE POR ORD. 302 DE FECHA 04-07-19 E3421/2019 // POR ORD. 041 DEL 26-06-19 E3282/2019 FORMULADOR SOLICITA RETIRAR INICIATIVA DEL CORE PARA REFORMULAR, DERIVADO ANALISTA 01-07-19 // POR ORD. 037 DEL 26-06-19 E3280/2019 FORMULADOR ENVIA ANTECED",ANÁLISIS.csv,2025-12-23T05:39:40.007870
40010197-2019,NO VIGENTE,2019,2019,40010197,0,"REPOSICION SEDE SOCIAL LOS TILOS, BULNES",PROYECTO,DIGUILLIN,BULNES,EJECUCIÓN,FRIL,,33,3,125,MUNICIP. BULNES,MUNICIPIO,,,"$59,990","$59,990",,"M$59,990",REVISAR,,ADMISIBLE,26-04-2019,// ENTREGADO ANALISTA GORE PARA REVISIÓN 27-12-18,ANÁLISIS.csv,2025-12-23T05:39:40.008005
40010205-2019,NO VIGENTE,2019,2019,40010205,0,"CONSTRUCCION MULTICANCHA PASTO SINTÉTICO VILLA CORDILLERA, BULNES",PROYECTO,DIGUILLIN,BULNES,EJECUCIÓN,FRIL,,33,3,125,MUNICIP. BULNES,MUNICIPIO,,,"$59,990","$59,990",,"M$59,990",REVISAR,,ADMISIBLE,26-04-2019,// ENTREGADO ANALISTA GORE PARA REVISIÓN 27-12-18,ANÁLISIS.csv,2025-12-23T05:39:40.008486
40010206-2019,NO VIGENTE,2019,2019,40010206,0,"CONSTRUCCION MULTICANCHA PASTO SINTÉTICO TRES ESQUINAS , BULNES",PROYECTO,DIGUILLIN,BULNES,EJECUCIÓN,FRIL,,33,3,125,MUNICIP. BULNES,MUNICIPIO,,,"$59,990","$59,990",,"M$59,990",REVISAR,,ADMISIBLE,26-04-2019,// ENTREGADO ANALISTA GORE PARA REVISIÓN 27-12-18,ANÁLISIS.csv,2025-12-23T05:39:40.009709
40010207-2019,NO VIGENTE,2019,2019,40010207,0,TRANSFERENCIA FORTALECIMIENTO A LA INVERSIÓN PRODUCTIVA Y DESARROLLO DE NUEVOS EMPRENDIMIENTOS (IPRO Y PAR),PROGRAMA,REGIONAL,REGIONAL,EJECUCIÓN,GLOSA 5.1,,33,3,,CORFO,SECTORIAL / OTRO,,,"$3,316,000","$2,216,000",,"M$2,215,997",APRO CORE,,RS,06-05-2019,// APROBADO CORE POR CERTIFICADO 125 DEL 03-06-19 E2980/2019// APROBADO COMISIÓN CORE ÑUBLE 15-05-19 // ENIVADO A CORE POR ORD. 184 DEL 07-05-19 E2296/2019 // PRIORIZANDO PARA FIRMA DE OFICIO PARA ENVÍO A CORE 06-05-19 // RS DEL 06-05-19 INFORMADO POR CORREO,ANÁLISIS.csv,2025-12-23T05:39:40.009945
40010220-2019,NO VIGENTE,2019,2019,40010220,0,"REPOSICION DOS CAMIONES RDS, COMUNA DE PINTO",PROYECTO,DIGUILLIN,PINTO,EJECUCIÓN,C-33,,29,3,,MUNICIP. PINTO,MUNICIPIO,,,"$192,520","$192,520",,"M$192,520",APRO CORE,,RS,05-04-2019,"// APROBADO CORE SEGUN CERTIFICADO 88 DEL 24-05-19 E2121/2019 // ENVIADO A CORE POR ORD. 142 DEL 05-04-19 // RS DEL 05-04-19 INFORMADO POR CORREO MISMO DIA // POR ORD. 240 DEL 04-04-19 E1801/2019 FORMULADOR INFORMA SUBSANACION DE OBSERVACIONES, DERIVADO ANAL",ANÁLISIS.csv,2025-12-23T05:39:40.010191
40010235-2019,NO VIGENTE,2019,2019,40010235,0,DIAGNOSTICO DISEÑO ESTRATEGIA REGIONAL DE ELECTROMOVILIDAD Y PLAN DE DESARR,ESTUDIO,REGIONAL,REGIONAL,EJECUCIÓN,MIDESO,,31,1,,ENERGIA,SECTORIAL / OTRO,,,"$40,000","$40,000",,"M$20,000",REV MDS,,OT,11-03-2019,"// INICIATIVA NO CONTINUARÁ PROCESO 2020 SEGÚN LO INFORMADO POR CORREO DE FECHA 10-01-20, RATIFICADO EN CORREO DEL 17-01-20 // ADMISIBLE MIDESO 25-02-19 // PROBLEMA AL CARGAR OFICIO, SE CARGA NUEVAMENTE EN BIP 15-02-19 / ORD. 12 DEL 04-01-19 CARGADO EN BIP 09-01-19 / ENTREGADO ANALISTA GORE PARA REVISIÓN 27-12-18",ANÁLISIS.csv,2025-12-23T05:39:40.013190
40010241-2019,NO VIGENTE,2019,2019,40010241,0,ACTUALIZACION PLAN ENERGÉTICO REGIONAL ÑUBLE,ESTUDIO,REGIONAL,REGIONAL,EJECUCIÓN,MIDESO,,31,1,,ENERGIA,SECTORIAL / OTRO,,,"$80,900","$80,900",,"M$80,900",REV MDS,,FI,25-01-2019,// ADMISIBLE MIDESO 11-01-19 / ENVIADO A REVISIÓN MIDESO 04-01-19 / ENTREGADO ANALISTA GORE PARA REVISIÓN 26-12-18,ANÁLISIS.csv,2025-12-23T05:39:40.013259
40010250-2019,NO VIGENTE,2019,2019,40010250,0,"ADQUISICION MATERIAL MENOR BOMBEROS, ASOCIACION PUNILLA",PROYECTO,PUNILLA,PUNILLA,EJECUCIÓN,C-33,,29,4,,ASOCIACIÓN PUNILLA,MUNICIPIO,,,"$724,657","$724,657",,"M$724,657",REEMPL,,,,"// POR ORD. 018/2019 DEL 11-03-19 E1265/2019 SE INGRESA NUEVO PROYECTO BIP 40012176 CON EL MISMO PROPOSITO, EN REVISIÓN ANALISTA // EN REVISIÓN ANALISTA / ANALISTAS ELIAS Y VICTOR CON PERMISO 28-12, SE DISTRIBUIRAN EL LUNES 31-12-18, REMPLAZA A BIP BIO BIO",ANÁLISIS.csv,2025-12-23T05:39:40.013348
40010255-2019,NO VIGENTE,2019,2019,40010255,0,"REPOSICION CAMION RECOLECTOR DE RESIDUOS DOMICILIARIOS, COMUNA DE ÑIQUÉN",PROYECTO,PUNILLA,ÑIQUÉN,EJECUCIÓN,C-33,,29,3,,MUNICIP. ÑIQUÉN,MUNICIPIO,,,"$126,383","$126,383",,"M$126,383",APRO CORE,,RS,08-04-2019,// APROBADO CORE SEGUN CERTIFICADO 91 DEL 24-04-19 E2129/2019// PRESENTADO CORE POR ORD. 146 DEL 09-04-19 E1862/2019 // RS DEL 08-04-19 INFORMADO POR CORREO MISMO DIA // SE ENVÍA CORREO 08-04-19 A FORMULADOR PARA CORRECCIÓN DE IDI // POR ORD. 105/2019 DEL 26,ANÁLISIS.csv,2025-12-23T05:39:40.013405
40010256-2019,NO VIGENTE,2019,2019,40010256,0,"ADQUISICION MOBILIARIO ORGANIZACIONES SOCIALES, ASOCIACION PUNILLA",PROYECTO,PUNILLA,PUNILLA,EJECUCIÓN,C-33,,29,4,,ASOCIACIÓN PUNILLA,MUNICIPIO,,,"$44,688","$44,688",,"M$44,688",REVISAR,,,,"// EN REVISIÓN ANALISTA / ANALISTAS ELIAS Y VICTOR CON PERMISO 28-12, SE DISTRIBUIRAN EL LUNES 31-12-18, REMPLAZA A BIP BIO BIO 40000929",ANÁLISIS.csv,2025-12-23T05:39:40.013455
40010260-2020,NO VIGENTE,2019,2020,40010260,0,CONSTRUCCION ESTRUCTURA DE SEGURIDAD PERIFÉRICA EN CENTRO PENITENCIARIO CHILLAN,PROYECTO,DIGUILLIN,CHILLÁN,EJECUCIÓN,MIDESO,,31,2,,GENDARMERIA,SECTORIAL / OTRO,,,"$277,971","$277,971",,"M$277,971",APRO CORE,,RS,10-06-2019,"// APROBADO CORE SEGÚN CERTIFICADO 137 DE FECHA 20-06-19 // INCLUIDO EN COMISION DEL 18-06-19 // ENVIADO A CORE POR ORD. 267 DEL 11-06-19 E2977/2019 // OFICIO PARA FIRMA ENVÍO A CORE 11-06-19 // ENVIADO A REVISIÓN MIDESO POR ORD. 195 DEL 10-05-19 E2366/2019,",ANÁLISIS.csv,2025-12-23T05:39:40.013512
40010264-2019,NO VIGENTE,2019,2019,40010264,0,"MEJORAMIENTO SEGMENTACION POBLACION PENAL FEMENINA, C.C.P. CHILLAN",PROYECTO,REGIONAL,REGIONAL,EJECUCIÓN,MIDESO,,31,2,,GENDARMERIA,SECTORIAL / OTRO,,,"$1,166,856","$1,166,856",,"M$1,166,856",NO PRIO INTEN MDS,,ADMISIBLE,,// NO SE FIRMA OFICIO PARA ENVÍO A MIDESO 05-02-19 / EN VALIDACIÓN CON SEREMÍA AL 04-01-19 SEGÚN CORREO DE ELIAS JARA / ENTREGADO ANALISTA GORE PARA REVISIÓN 26-12-18,ANÁLISIS.csv,2025-12-23T05:39:40.013564
40010268-2019,NO VIGENTE,2019,2019,40010268,0,"REPOSICION MAQUINARIA MUNICIPAL PARA MANTENCION DE RED VIAL, COMUNA DE COIHUECO",PROYECTO,PUNILLA,COIHUECO,EJECUCIÓN,C-33,,29,5,2,ASOCIACIÓN PUNILLA,MUNICIPIO,,,"$505,026","$505,026",,"M$505,026",APRO CORE,,RS,24-04-2019,// APROBADO CORE SEGÚN CERTIFICADO 99 DEL 17-05-19 E2583/2019// PRESENTADO A CORE POR ORD. 164 DEL 25-04-19 E2081/2019// RS DEL 24-04-19 INFORMADO POR CORREO MISMO DIA // POR ORD. 040/2019 DEL 23-04-19 E2045/2019 FORMULADOR INFORMA SUBSANACIÓN DE OBSERVACION,ANÁLISIS.csv,2025-12-23T05:39:40.013627
40010269-2019,NO VIGENTE,2019,2019,40010269,0,"REPOSICION MAQUINARIA MUNICIPAL PARA MANTENCION DE LA RED VIAL, COMUNA DE ÑIQUEN",PROYECTO,PUNILLA,ÑIQUÉN,EJECUCIÓN,C-33,,29,5,2,ASOCIACIÓN PUNILLA,MUNICIPIO,,,"$200,365","$200,365",,"M$200,365",REEMPL,,RS,19-03-2019,// APROBADO CORE ÑUBLE DE ACUERDO A CERTIFICADO 79 DEL 08-04-19 // POR ORD. 129 DEL 25-03-19 E1498/2019 SE ENVIA A CORE // RS DEL 19-03-19 INFORMADO POR CORREO MISMO DIA // POR ORD. 020/2019 DEL 14-03-19 E1328/2019 MUNICIPIO INFORMA SUBSANACIÓN DE OBSERVACIO,ANÁLISIS.csv,2025-12-23T05:39:40.013679
Admisible el 13-08-21 //Modifica oficio 596 del 29-07-21 por oficio 643 del 12-08-21 // Derivado a Mathías para revisión,NO VIGENTE,2020,2019,40010270,0,"CONSTRUCCION CANCHA DE TENIS, EL CARMEN",PROYECTO,DIGUILLIN,EL CARMEN,EJECUCIÓN,FRIL,,33,3,125,MUNICIP. EL CARMEN,MUNICIPIO,,,"$59,978","$59,978",,"M$59,978",REV SUB OBSE,,FI,17-12-2019,"// POR ORD 939 E6720/2019 DEL 23-12-2019 FORMULADOR INFORMA SUBSANACIÓN DE OBSERVACIONES, DERIVADO ANALISTA PARA REVISIÓN 23-12-19 //SE ENVIA CORREO A FORMULADOR EL 17-12-2019 PARA SUBSANACION DE OBSERVACIONES.//POR ORD. 811 DEL 07-11-19 (SIN EXPEDIENTE POR",ANÁLISIS.csv,2025-12-23T05:39:40.013731
40010274-2019,NO VIGENTE,2019,2019,40010274,0,CAPACITACION IMPLEMENTACIÓM DEL MÉTODO SINGAPUR PARA LA IMPLEMENTACIÓN CURRICULAR,PROGRAMA,ITATA,ITATA,EJECUCIÓN,GLOSA 5.1,,33,3,,ASOCIACIÓN ITATA,MUNICIPIO,,,"$4,600,000","$4,600,000",,"M$1,150,000",NO RECOMEN,,INADMISIBLE,21-02-2019,// POR ORD. 63 DEL 21-02-19 SE INFORMA INADMISIBILIDAD DE INICIATIVA E980/2019 // REASIGNADO ANALISTA 19-02-19 // EN REVISIÓN ANALISTA,ANÁLISIS.csv,2025-12-23T05:39:40.013926
40010277-2019,NO VIGENTE,2019,2019,40010277,0,"ADQUISICION EQUIPO RAYOS X OSTEOPULMONAR DIGITAL DEPTO. DE SALUD, COMUNA DE SAN IGNACIO",PROYECTO,DIGUILLIN,SAN IGNACIO,EJECUCIÓN,C-33,,29,,,MUNICIP. SAN IGNACIO,MUNICIPIO,,,"$110,849","$110,849",,"M$110,849",REVISAR,,,,"// EN REVISIÓN ANALISTA / ANALISTAS ELIAS Y VICTOR CON PERMISO 28-12, SE DISTRIBUIRAN EL LUNES 31-12-18",ANÁLISIS.csv,2025-12-23T05:39:40.013983
40010287-2019,NO VIGENTE,2019,2019,40010287,0,"REPOSICION MAQUINARIA MUNICIPAL PARA MANTENCION DE RED VIAL, COMUNA DE SAN CARLOS",PROYECTO,PUNILLA,SAN CARLOS,EJECUCIÓN,C-33,,29,5,2,ASOCIACIÓN PUNILLA,MUNICIPIO,,,"$168,922","$168,922",,"M$168,922",APRO CORE,,RS,24-04-2019,// APROBADO CORE SEGÚN CERTIFICADO 105 DEL 17-05-19 E2612/2019 // PRESENTADO A CORE POR ORD. 163 DEL 25-04-19 E2079/2019// RS DEL 24-04-19 INFORMADO POR CORREO MISMO DIA // FI DEL 23-04-19 INFORMADO POR CORREO MISMO DIA // POR ORD. 033/2019 DEL 16-04-19 E196,ANÁLISIS.csv,2025-12-23T05:39:40.014038
40010288-2019,NO VIGENTE,2019,2019,40010288,0,"REPOSICION MAQUINARIA MUNICIPAL PARA MANTENCION DE RED VIAL, COMUNA DE SAN FABIAN",PROYECTO,PUNILLA,SAN FABIAN,EJECUCIÓN,C-33,,29,5,2,ASOCIACIÓN PUNILLA,MUNICIPIO,,,"$370,140","$370,140",,"M$370,140",APRO CORE,,RS,24-04-2019,// APROBADO CORE SEGÚN CERTIFICADO 98 DEL 17-05-19 E2584/2019// PRESENTADO A CORE POR ORD. 162 DEL 25-04-19 E2078/2019//RS DEL 24-04-19 INFORMADO POR CORREO MISMO DIA // POR ORD. 034/2019 DEL 16-04-19 E1964/2019 FORMULADOR INFORMA SUBSANACIÓN DE OBSERVACIONE,ANÁLISIS.csv,2025-12-23T05:39:40.014092
40010308-2019,NO VIGENTE,2019,2019,40010308,0,"CONSTRUCCION VEREDAS RURALES, COMUNAS ASOC. PUNILLA",PROYECTO,PUNILLA,PUNILLA,EJECUCIÓN,MIDESO,,31,2,,ASOCIACIÓN PUNILLA,MUNICIPIO,,,"$2,102,679","$2,102,679",,"M$204,616",NO PRIO INTEN MDS,,ADMISIBLE,14-01-2019,"// NO SE DIO PRIORIDAD PARA ENVÍO A REVISIÓN DE MIDESO 14-01-19 / EN REVISIÓN ANALISTA / ANALISTAS ELIAS Y VICTOR CON PERMISO 28-12, SE DISTRIBUIRAN EL LUNES 31-12-18, REMPLAZA A BIP BIO BIO 40000929",ANÁLISIS.csv,2025-12-23T05:39:40.014141
40010309-2019,NO VIGENTE,2019,2019,40010309,0,"CONSTRUCCION POZO, TORRE Y RED DE AGUA POTABLE SECTOR LA FERIA DE QUIRIHUE",PROYECTO,ITATA,QUIRIHUE,EJECUCIÓN,FRIL,,33,3,125,MUNICIP. QUIRIHUE,MUNICIPIO,,,"$96,500","$96,500",,"M$96,500",NO RECOMEN,,OT,30-04-2019,"// 11-10-19 REASIGNADO ANALISTA // OT DEL 30-04-19 INFORMADO POR CORREO MISMO DIA, APR EN SECTOR URBANO // POR ORD. 251 DEL 13/0319 E1320/2019 FORMULADOR ENVÍA RESPUESTA A OBSERVACIONES, EN REVISIÓN ANALISTA // OT 30-01-19 / EN REVISIÓN ADMISIBILIDAD GORE ÑU",ANÁLISIS.csv,2025-12-23T05:39:40.014191
40010312-2019,NO VIGENTE,2019,2019,40010312,0,CONSTRUCCION RED DE DISTRIBUCIÓN DE AGUA POTABLE SECTOR VUELTA LA RAMA DE QUIRIHUE,PROYECTO,ITATA,QUIRIHUE,EJECUCIÓN,FRIL,,33,3,125,MUNICIP. QUIRIHUE,MUNICIPIO,,,"$48,000","$48,000",,"M$48,000",NO RECOMEN,,FI,30-04-2019,"// 11-10-19 REASIGNADO ANALISTA // FI DEL 30-04-19 INFORMADO POR CORREO MISMO DIA // POR ORD. 250 DEL 13-03-19 E1319/2019 FORMULADOR ENVÍA RESPUESTA A OBSERVACIONES, EN REVISIÓN ANALISTA // OT 31-01-19 INFORMADO POR CORREO DEL 31-01-19 / EN REVISIÓN ADMISIBI",ANÁLISIS.csv,2025-12-23T05:39:40.014241
40010314-2019,NO VIGENTE,2019,2019,40010314,0,"CONSTRUCCION DE POZO, TORRE Y RED DE AGUA POTABLE SECTOR LA HORCA DE QUIRIHUE.",PROYECTO,ITATA,QUIRIHUE,EJECUCIÓN,FRIL,,33,3,125,MUNICIP. QUIRIHUE,MUNICIPIO,,,"$96,500","$96,500",,"M$96,500",NO RECOMEN,,OT,04-11-2019,"// SOLICITA POR CORREO ELECTRONICO DEL 18-12-2019 AUMENTO DE PLAZO HASTA EL 31-12-2019//POR CORREO DEL 21-11-19 FORMULADOR SOLICITA AUMENTO DE PLAZO PARA RESPONDER A OBSERVACIONES, PLAZO 16-12-19 // OT DEL 04-11-19 INFORMADO POR CORREO MISMO DIA // 11-10-19",ANÁLISIS.csv,2025-12-23T05:39:40.014290
40010317-2019,NO VIGENTE,2019,2019,40010317,0,"CONSTRUCCION SEDE VECINAL, VILLA EL PORVENIR DE LA COMUNA DE QUIRIHUE",PROYECTO,ITATA,QUIRIHUE,EJECUCIÓN,FRIL,,33,3,125,MUNICIP. QUIRIHUE,MUNICIPIO,,,"$59,990","$59,990",,"M$59,990",REVISAR,,ADMISIBLE,26-04-2019,// EN REVISIÓN ADMISIBILIDAD GORE ÑUBLE,ANÁLISIS.csv,2025-12-23T05:39:40.014373
40010319-2020,NO VIGENTE,2019,2020,40010319,0,MEJORAMIENTO ACCESO CEMENTERIO DE BULNES.,PROYECTO,DIGUILLIN,BULNES,EJECUCIÓN,FRIL,,33,3,125,MUNICIP. BULNES,MUNICIPIO,,,"$59,990","$59,990",,"M$59,990",APRO CORE,,RS,07-11-2019,// CERTIFICADO LLEGA POR ORD. 4/2020 DEL 14-02-20 E7922/2020 // AROBADO POR SESION CORE 04-12-19//FALTA CERTIFICADO CORE //APROBADO COMISIÓN CORE 19-11-19 // EN COMISION CORE 19-11-19// ENVIADO A CORE POR ORD. 435 DEL 14-11-19 E5914/2019// MEMO 52 DEL 12-11-19 E5865/2019 ENVIADO A INTENDENTE PARA GESTIONAR SU FIRMA PO,ANÁLISIS.csv,2025-12-23T05:39:40.014595
40010322-2021,NO VIGENTE,2019,2021,40010322,0,"CONSTRUCCION PATIO TECHADO ESCUELA EL PAL PAL DE SANTA CLARA, COMUNA DE BULNES",PROYECTO,DIGUILLIN,BULNES,EJECUCIÓN,FRIL,,33,3,125,MUNICIP. BULNES,MUNICIPIO,,,"$59,225","$59,225",,"M$59,225",APRO CORE,,RS,25-10-2019,// CERTIFICADO LLEGA POR ORD. 4/2020 DE FECHA 14-02-20 E7922/2020 // APROBADO POR SESION CORE 04-12-19//FALTA CERTIFICADO CORE //APROBADO COMISIÓN CORE 19-11-19 // EN COMISION CORE 19-11-19 // ENVIADO A CORE POR ORD. 434 DEL 14-11-19 E5913/2019// MEMO 52 DEL 12-11-19 E5865/2019 ENVIADO A INTENDENTE PARA GESTIONAR SU FIRMA P,ANÁLISIS.csv,2025-12-23T05:39:40.014944
40010323-2021,NO VIGENTE,2019,2021,40010323,0,"CONSTRUCCION PATIO TECHADO ESCUELA EVARISTA OGALDE DE TRES ESQUINAS, COMUNA DE BULNES",PROYECTO,DIGUILLIN,BULNES,EJECUCIÓN,FRIL,,33,3,125,MUNICIP. BULNES,MUNICIPIO,,,"$59,225","$59,225",,"M$59,225",CORE ÑUBLE,,RS,19-11-2019,// ENVIADO A CORE ÑUBLE ORD 501 DEL 30-12-2019 E6902/2020//MEMO S/N ENTREGADO A JEFE DE GABINETE DEL 27-12-2019//OFICIO DE INTENDENTE A CORE PARA VISACIÓN JEFE DIPLADE 19-11-19 // RS DEL 19-11-19 INFORMADO POR CORREO MISMO DIA // POR ORD.824/69/2019 DEL 08-1,ANÁLISIS.csv,2025-12-23T05:39:40.015166
40010331-2019,NO VIGENTE,2019,2019,40010331,0,"CONSTRUCCION E INSTALACION SEÑALES RURALES, ASOCIACION PUNILLLA",PROYECTO,PUNILLA,PUNILLA,EJECUCIÓN,MIDESO,,31,2,,ASOCIACIÓN PUNILLA,MUNICIPIO,,,"$673,693","$673,693",,"M$122,600",NO PRIO INTEN MDS,,ADMISIBLE,14-01-2019,"// NO SE DIO PRIORIZACIÓN PARA ENVÍO REVISIÓN MIDESO 14-01-19 / EN REVISIÓN ANALISTA / ANALISTAS ELIAS Y VICTOR CON PERMISO 28-12, SE DISTRIBUIRAN EL LUNES 31-12-18",ANÁLISIS.csv,2025-12-23T05:39:40.015298
40010351-2019,NO VIGENTE,2019,2019,40010351,0,CONSTRUCCION RESIDENCIA ESTUDIANTIL PARA EL VALLE DEL ITATA,PROYECTO,REGIONAL,REGIONAL,EJECUCIÓN,MIDESO,,31,,,ASOCIACIÓN ITATA,MUNICIPIO,,,"$2,573,687","$2,573,687",,"M$2,573,687",REVISAR,,,,"// POR ORD. 086 DEL 29-07-19 E4097/2019 FORMULADOR SOLICITA DAR PRIORIDAD A REVISIÓN DE INICIATIVA, SE ENVÍA CORREO A JEFES 09-08-19 CON CONSULTA DE PRIORIZACIÓN // REEMPLAZA A CODIGO 40002176, EN REVISIÓN ANALISTA",ANÁLISIS.csv,2025-12-23T05:39:40.015380
40010359-2019,NO VIGENTE,2019,2019,40010359,0,"CONSTRUCCION ALUMBRADO PUBLICO RUTA N-65 SECTOR VARIANTE SAN IGNACIO, COMUNA DE SAN",PROYECTO,DIGUILLIN,SAN IGNACIO,EJECUCIÓN,FRIL,,33,3,125,MUNICIP. SAN IGNACIO,MUNICIPIO,,,"$70,824","$70,824",,"M$70,824",APRO CORE,,RS,26-04-2019,"// APROBADO CORE SEGÚN CERTIFICADO 107 DEL 17-05-19 // ENVIADO A CORE POR ORD. 172 DEL 26-04-19 E2125/2019 // RS DEL 26-04-19 INFORMADO POR CORREO MISMO DIA // POR CORREO DEL 26-04-19 FORMULADOR INFORMA SUBSANACIÓN DE OBSERVACIONES, EN REVISIÓN ANALISTA // 2",ANÁLISIS.csv,2025-12-23T05:39:40.015454
40010369-2019,NO VIGENTE,2019,2019,40010369,0,CAPACITACION MANEJO FORESTAL SUSTENTABLE,PROGRAMA,REGIONAL,REGIONAL,EJECUCIÓN,GLOSA 5.1,,33,3,,INFOR,SECTORIAL / OTRO,,,"$638,456","$638,456",,"M$209,804",REVISAR,,FI,06-02-2019,"// POR CORREO DEL 05-06-19 DE JEFE DIPLADE SE INFORMA PRIORIZACIÓN DE PROYECTOS INFOR, SE POSTERGA REVISIÓN DE ESTA INICIATIVA // FORMULADOR INFORMA POR CORREO DEL 08-02-19 SUBSANACIÓN DE OBSERVACIONES, EN REVISIÓN ANALISTA // FI 01-02-19 / OT 01-02-19 SE IN",ANÁLISIS.csv,2025-12-23T05:39:40.015535
40010388-2019,NO VIGENTE,2019,2019,40010388,0,CAPACITACION PROGRAMA DE APOYO AL EMPRENDIMIENTO FOSIS ÑUBLE,PROGRAMA,REGIONAL,REGIONAL,EJECUCIÓN,GLOSA 5.1,,33,3,,FOSIS,SECTORIAL / OTRO,,,"$508,439","$508,439",,"M$451,036",REV SUB OBSE,,FI,07-02-2019,"// PROYECTO INGRESA FICHA 2020 PARA EVALUACION DE PRESUPUESTO 2020//POR ORD. 399 DEL 17-12-19 E6605/2019 FORMULADOR INFORMA SUBSANACIÓN DE OBSERVACIONES, EN REVISIÓN ANALISTA//POR ORD. 110 DEL 04-03-19 E1130/2019 FORMULADOR INFORMA SUBSANACION DE OBSERVACIONES, EN REVISIÓN ANALISTA //  FI DEL 07-02-19 INFORMADO POR CORREO",ANÁLISIS.csv,2025-12-23T05:39:40.015807
40010398-2019,NO VIGENTE,2019,2019,40010398,0,CONSTRUCCION LABORATORIO SAG ÑUBLE,PROYECTO,REGIONAL,REGIONAL,DISEÑO,MIDESO,,31,,,SAG,SECTORIAL / OTRO,,,"$100,000","$100,000",,"M$100,000",REV MDS,,INADMISIBLE,23-01-2019,"// INADMISIBLE MIDESO 23-01-19 / EN REVISIÓN MIDESO ORD. 30 DEL 11-01-19, SE CARGA EN BIP 15-01-19 / ENTREGADO ANALISTA GORE PARA REVISIÓN 26-12-18",ANÁLISIS.csv,2025-12-23T05:39:40.018555
40010399-2019,NO VIGENTE,2019,2019,40010399,0,CAPACITACION PARA LA MEJORA DE COMPETENCIAS A PERSONAS SECTOR TURISMO DEL VALLE DE ITATA,PROGRAMA,ITATA,ITATA,EJECUCIÓN,GLOSA 5.1,,33,3,,SENCE,SECTORIAL / OTRO,,,"$679,754","$679,754",,"M$199,662",APRO CORE,,RS,28-06-2019,// APROBADO CORE SEGÚN CERTIFICADO 161 DEL 30-07-19 E3969/2019// ENVIADO A CORE POR ORD. 292 DEL 03-07-19 E3393/2019 // OFICIO ENVÍO A CORE PARA FIRMA DE JEFE DIVISIÓN 28-06-19 // RS DEL 28-06-19 INFORMADO POR CORREO MISMO DIA // POR ORD. 220 DEL 24-06-19 E3,ANÁLISIS.csv,2025-12-23T05:39:40.018763
