COD. ÚNICO,VIGENCIA,AÑO,AÑO PRESP.,BIP,DV,NOMBRE INICIATIVA,TIPO,PROVINCIA,COMUNA,ETAPA,TIPOLOGÍA,Categoría GORE,SUBT,ITEM,ASIG,FORMULADOR,ORIGEN,UNIDAD TÉCNICA,DIVISIÓN VINCULADA,MONTO INICIATIVA,MONTO FNDR,MONTO FINAL APROB.,GASTO VIGENTE,ESTADO ACTUAL,FECHA ESTADO ACTUAL,RATE ACTUAL,FECHA ULTIMO RATE,OBSERVACIONES GENERALES,_source_file,_cleaned_at
40044413-2022,EN PRESUPUESTO,2022,2022,40044413,0,TRANSFERENCIA ESCALAMIENTO NIVEL PILOTO PARA LA EXTRACCIÓN DE BIOACTIVOS MEDIANTE ULTRASONIDO,PROGRAMA,REGIONAL,REGIONAL,EJECUCIÓN,GLOSAS COMUNES,AGRICULTURA,33,3,,UDEC,SECTORIAL / OTRO,UDEC,DIFOI,"M$370,000","M$370,000","M$370,000","M$12,020",APROBADO TÉCNICAMENTE,,APROBADO,30-06-2022,SIN OBSERVACIONES,ANÁLISIS.csv,2025-12-23T05:39:40.884395
40044426-2022,EN PRESUPUESTO,2022,2022,40044426,0,TRANSFERENCIA PLAN ESTRATÉGICO DE INNOVACIÓN SOSTENIBLE PARA LA MOVILIDAD URBANA,PROGRAMA,REGIONAL,REGIONAL,EJECUCIÓN,GLOSAS COMUNES,TRANSPORTE,33,3,,GORE-DIDESO,SECTORIAL / OTRO,GORE-DIDESO,DIFOI,"M$287,502","M$287,502","M$287,502","M$143,751",APROBADO TÉCNICAMENTE,,APROBADO,30-06-2022,SIN OBSERVACIONES,ANÁLISIS.csv,2025-12-23T05:39:40.884977
40044432-2022,EN PRESUPUESTO,2022,2022,40044432,0,TRANSFERENCIA IMPLEMENTACIÓN DE PLANTA PILOTO PARA LA OBTENCIÓN DE JUGO DE FRUTA EN LA COMUNA,PROGRAMA,REGIONAL,REGIONAL,EJECUCIÓN,GLOSAS COMUNES,AGRICULTURA,33,3,,UDEC,SECTORIAL / OTRO,UDEC,DIFOI,"M$270,000","M$270,000","M$270,000","M$269,997",APROBADO TÉCNICAMENTE,,APROBADO,,SIN OBSERVACIONES,ANÁLISIS.csv,2025-12-23T05:39:40.885339
40044437-2022,EN PRESUPUESTO,2022,2022,40044437,0,TRANSFERENCIA: DISEÑO Y FORTALECIMIENTO DE UN ECOSISTEMA DE INNOVACIÓN SOCIAL PARA LA ARTICULA,PROGRAMA,REGIONAL,REGIONAL,EJECUCIÓN,GLOSAS COMUNES,SOCIAL,33,3,,GORE-DIDESO,SECTORIAL / OTRO,GORE-DIDESO,DIFOI,"M$287,211","M$287,211","M$287,211","M$143,605",APROBADO TÉCNICAMENTE,,APROBADO,30-06-2022,SIN OBSERVACIONES,ANÁLISIS.csv,2025-12-23T05:39:40.885530
40044441-2022,EN PRESUPUESTO,2022,2022,40044441,0,TRANSFERENCIA IMPLEMENTACIÓN DE ESTRATEGIAS DE INNOVACIÓN SOCIAL Y COMPETITIVIDAD EN ORGANIZAC,PROGRAMA,REGIONAL,REGIONAL,EJECUCIÓN,GLOSAS COMUNES,EDUCACION,33,3,,UBB,SECTORIAL / OTRO,UBB,,"M$370,000","M$370,000","M$370,000","M$172,600",APROBADO TÉCNICAMENTE,,APROBADO,30-06-2022,SIN OBSERVACIONES,ANÁLISIS.csv,2025-12-23T05:39:40.887523
40044450-2022,EN PRESUPUESTO,2022,2022,40044450,0,TRANSFERENCIA DISTRITO INNOVACIÓN ÑUBLE: HERRAMIENTA DE DESARROLLO REGIONAL,PROGRAMA,REGIONAL,REGIONAL,EJECUCIÓN,GLOSAS COMUNES,FOMENTO/TURISMO/INNOVACIÓN,33,3,,UDEC,SECTORIAL / OTRO,UDEC,DIFOI,"M$286,936","M$286,936","M$286,936","M$152,293",APROBADO TÉCNICAMENTE,,APROBADO,30-06-2022,SIN OBSERVACIONES,ANÁLISIS.csv,2025-12-23T05:39:40.887612
40044489-2022,EN PRESUPUESTO,2022,2022,40044489,0,ADQUISICION CAMION LIMPIA FOSAS PARA LA COMUNA DE COELEMU,PROYECTO,ITATA,COELEMU,EJECUCIÓN,C-33,VEHÍCULOS Y MAQUINARIAS,29,3,,MUNICIP. COELEMU,MUNICIPIO,MUNICIP. COELEMU,,"M$110,872","M$110,872","M$110,872","M$110,872",CONVENIO APROBADO,,RS,04-07-2022,GORE: MARCO PRESUPUESTARIO RES. EXENTA N°455,ANÁLISIS.csv,2025-12-23T05:39:40.887857
40044541-2022,VIGENTE,2022,2022,40044541,0,"REPOSICION CUATRO FURGONES ESCOLARES, COMUNA COBQUECURA",PROYECTO,ITATA,COBQUECURA,EJECUCIÓN,C-33,EDUCACION,29,3,,MUNICIP. COBQUECURA,MUNICIPIO,MUNICIP. COBQUECURA,,"M$220,000","M$220,000","M$220,000","M$220,000",INGRESADO A PREINVERSIÓN,,SIN RATE,,SIN OBSERVACIONES,ANÁLISIS.csv,2025-12-23T05:39:40.888302
40044639-2022,VIGENTE,2022,2022,40044639,0,ADQUISICION VEHICULO PARA PERSONAS CON DISCAPACIDAD Y/O MOVILIDAD REDUCIDA. QUIRIHUE,PROYECTO,ITATA,QUIRIHUE,EJECUCIÓN,C-33,VEHÍCULOS Y MAQUINARIAS,29,3,,MUNICIP. QUIRIHUE,MUNICIPIO,MUNICIP. QUIRIHUE,,"M$43,500","M$43,500","M$43,500","M$43,500",INGRESADO A PREINVERSIÓN,,SIN RATE,,SIN OBSERVACIONES,ANÁLISIS.csv,2025-12-23T05:39:40.889042
40044665-2022,VIGENTE,2022,2022,40044665,0,"CONSERVACION CAMINO BÁSICO, SECTOR RURAL LA QUEBRADA, COMUNA DE QUILLÓN",PROYECTO,DIGUILLÍN,QUILLÓN,EJECUCIÓN,C-33,CAMINOS/CALLES/VEREDAS,31,2,,MUNICIP. QUILLÓN,MUNICIPIO,MUNICIP. QUILLÓN,,"M$1,294,286","M$1,294,286","M$1,294,286","M$161,786",INGRESADO A PREINVERSIÓN,,SIN RATE,,SIN OBSERVACIONES,ANÁLISIS.csv,2025-12-23T05:39:40.889332
40044668-2022,VIGENTE,2022,2022,40044668,0,"CONSERVACION CAMINO BÁSICO, SECTOR RURAL LA ESMERALDA, COMUNA DE QUILLÓN",PROYECTO,DIGUILLÍN,QUILLÓN,EJECUCIÓN,C-33,CAMINOS/CALLES/VEREDAS,31,2,,MUNICIP. QUILLÓN,MUNICIPIO,MUNICIP. QUILLÓN,,"M$749,091","M$749,091","M$749,091","M$93,636",INGRESADO A PREINVERSIÓN,,SIN RATE,,SIN OBSERVACIONES,ANÁLISIS.csv,2025-12-23T05:39:40.889431
40044669-2022,VIGENTE,2022,2022,40044669,0,"CONSERVACION CAMINO BÁSICO, SECTOR RURAL QUEIME, COMUNA DE QUILLÓN",PROYECTO,DIGUILLÍN,QUILLÓN,EJECUCIÓN,C-33,CAMINOS/CALLES/VEREDAS,31,2,,MUNICIP. QUILLÓN,MUNICIPIO,MUNICIP. QUILLÓN,,"M$792,646","M$792,646","M$792,646","M$99,081",INGRESADO A PREINVERSIÓN,,SIN RATE,,SIN OBSERVACIONES,ANÁLISIS.csv,2025-12-23T05:39:40.897204
40044749-2022,VIGENTE,2022,2022,40044749,0,"ADQUISICION CAMION PARA RECOLECCIÓN DIFERENCIADA DE RESIDUOS ORGÁNICOS, COMUNA DE SAN FABIAN",PROYECTO,PUNILLA,SAN FABIÁN,EJECUCIÓN,C-33,VEHÍCULOS Y MAQUINARIAS,29,3,,ASOCIACIÓN PUNILLA,MUNICIPIO,ASOCIACIÓN PUNILLA,,"M$130,900","M$130,900","M$130,900","M$130,900",INGRESADO A PREINVERSIÓN,,SIN RATE,,SIN OBSERVACIONES,ANÁLISIS.csv,2025-12-23T05:39:40.897346
40044762-2022,VIGENTE,2022,2022,40044762,0,"REPOSICION 2 CAMIONES TOLVA MUNICIPALES, COMUNA DE PINTO",PROYECTO,DIGUILLÍN,PINTO,EJECUCIÓN,C-33,VEHÍCULOS Y MAQUINARIAS,29,3,,MUNICIP. PINTO,MUNICIPIO,MUNICIP. PINTO,,"M$194,922","M$194,922","M$194,922","M$194,922",INGRESADO A PREINVERSIÓN,,SIN RATE,,SIN OBSERVACIONES,ANÁLISIS.csv,2025-12-23T05:39:40.897607
40044785-2022,VIGENTE,2022,2022,40044785,0,ADQUISICION VEHÍCULO PARA TRANSPORTE DE DISCAPACITADOS COMUNA DE QUILLÓN,PROYECTO,DIGUILLÍN,QUILLÓN,EJECUCIÓN,C-33,VEHÍCULOS Y MAQUINARIAS,29,3,,MUNICIP. QUILLÓN,MUNICIPIO,MUNICIP. QUILLÓN,,"M$54,000","M$54,000","M$54,000","M$54,000",INGRESADO A PREINVERSIÓN,,SIN RATE,,SIN OBSERVACIONES,ANÁLISIS.csv,2025-12-23T05:39:40.897810
40045015-2022,VIGENTE,2022,2022,40045015,0,"REPOSICIÓN PAVIMENTACIÓN Y ACERAS CALLE ARTURO PRAT, COMUNA DE NINHUE",PROYECTO,ITATA,NINHUE,EJECUCIÓN,MIDESO,CAMINOS/CALLES/VEREDAS,33,,,MUNICIP. NINHUE,MUNICIPIO,MUNICIP. NINHUE,,"M$2,275,774","M$2,275,774","M$2,275,774",M$0,ADMISIBLE,13.09.2022,ADMISIBLE,13.09.2022,,ANÁLISIS.csv,2025-12-23T05:39:40.897957
40045061-2022,VIGENTE,2022,2022,40045061,0,"CONSTRUCCION CANCHA PASTO SINTETICO Y CIERRE PERIMETRAL-GUARILIHUE CENTRO, COMUNA DE COELEMU",PROYECTO,ITATA,COELEMU,EJECUCIÓN,MIDESO,DEPORTIVO,33,3,125,MUNICIP. COELEMU,MUNICIPIO,MUNICIP. COELEMU,,"M$379,533","M$379,533","M$379,533","M$79,533",ADMISIBLE,8/19/2022,ADMISIBLE,8/19/2022,SIN OBSERVACIONES,ANÁLISIS.csv,2025-12-23T05:39:40.904921
40045132-2022,VIGENTE,2022,2022,40045132,0,"ADQUISICION DE UNA MOTONIVELADORA, COMUNA DE PINTO",PROYECTO,DIGUILLÍN,PINTO,EJECUCIÓN,C-33,VEHÍCULOS Y MAQUINARIAS,29,5,,MUNICIP. PINTO,MUNICIPIO,MUNICIP. PINTO,,"M$250,695","M$250,695","M$250,695","M$250,695",INGRESADO A PREINVERSIÓN,,SIN RATE,,SIN OBSERVACIONES,ANÁLISIS.csv,2025-12-23T05:39:40.978825
40045199-2022,VIGENTE,2022,2022,40045199,0,"REPOSICIÓN Y ADQUISICIÓN EQUIPOS INFORMÁTICOS, REGIÓN POLICIAL DEL ÑUBLE PDI",PROGRAMA,REGIONAL,REGIONAL,EJECUCIÓN,C-33,SOFTWARE/EQUIPAMIENTO/EQUIPOS,29,5,,PDI,SECTORIAL / OTRO,PDI,DIPIR,,,,,APROBADO TÉCNICAMENTE,20.10.2022,RS,20.10.2022,RS,ANÁLISIS.csv,2025-12-23T05:39:41.020355
40045248-2023,VIGENTE,2022,2023,40045248,0,"CONSTRUCCION SEDE SOCIAL LA DEFENSA, CHILLÁN",PROYECTO,DIGUILLÍN,CHILLÁN,EJECUCIÓN,FRIL,SOCIAL,33,3,125,MUNICIP. CHILLÁN,MUNICIPIO,MUNICIP. CHILLÁN,,"M$79,994","M$79,994","M$79,994",M$0,APROBADO TÉCNICAMENTE,12/6/2022,RS,12/5/2022,CONVENIO,ANÁLISIS.csv,2025-12-23T05:39:41.020462
40045280-2023,VIGENTE,2022,2023,40045280,0,"MEJORAMIENTO  INFRAESTRUCTURA APS, PSR CUCHA COX, COMUNA DE PORTEZUELO",PROYECTO,PUNILLA,PORTEZUELO,EJECUCIÓN,FRIL,INFRAESTRUCTURA PÚBLICA,33,3,125,MUNICIP. PORTEZUELO,MUNICIPIO,MUNICIP. PORTEZUELO,,"M$117,483","M$117,483","M$117,483",M$0,APROBADO TÉCNICAMENTE,1/10/2023,RS,30/12/2022,CONVENIO,ANÁLISIS.csv,2025-12-23T05:39:41.020527
40045291-2023,VIGENTE,2022,2023,40045291,0,CONSTRUCCION CUBIERTA MULTICANCHA TAUCU COMUNA DE COBQUECURA,PROYECTO,ITATA,COBQUECURA,EJECUCIÓN,FRIL,MULTICANCHA/RECINTO,33,3,125,MUNICIP. COBQUECURA,MUNICIPIO,MUNICIP. COBQUECURA,,"M$122,500","M$122,500","M$122,500",M$0,APROBADO TÉCNICAMENTE,16/1/2023,RS,30/12/2022,CONVENIO,ANÁLISIS.csv,2025-12-23T05:39:41.020589
40045313-2022,VIGENTE,2022,2022,40045313,0,"MEJORAMIENTO MULTICANCHA, SECTORES PANGUILEMU, CHUDAL Y MEMBRILLAR",PROYECTO,ITATA,PORTEZUELO,EJECUCIÓN,FRIL,DEPORTIVO,33,3,125,MUNICIP. PORTEZUELO,MUNICIPIO,MUNICIP. PORTEZUELO,,"M$121,406","M$121,406","M$121,406",M$0,REVISANDO PREINVERSIÓN,03.10.2022,FI,26/12.2022,,ANÁLISIS.csv,2025-12-23T05:39:41.020647
40045314-2022,VIGENTE,2022,2022,40045314,0,"MEJORAMIENTO MULTICANCHA, SECTORES POB. FUENZALIDA Y CUCHA URREJOLA",PROYECTO,ITATA,PORTEZUELO,EJECUCIÓN,FRIL,DEPORTIVO,33,3,125,MUNICIP. PORTEZUELO,MUNICIPIO,MUNICIP. PORTEZUELO,,"M$119,970","M$119,970","M$119,970",M$0,REVISANDO PREINVERSIÓN,03.10.2022,FI,21/12/2022,,ANÁLISIS.csv,2025-12-23T05:39:41.020702
40045315-2022,VIGENTE,2022,2022,40045315,0,"MEJORAMIENTO MULTICANCHAS SECTORES LLAHUEN Y EL SAUCE, COMUNA DE PORTEZUELO",PROYECTO,ITATA,PORTEZUELO,EJECUCIÓN,FRIL,DEPORTIVO,33,3,125,MUNICIP. PORTEZUELO,MUNICIPIO,MUNICIP. PORTEZUELO,,"M$117,244","M$117,244","M$117,244",M$0,REVISANDO PREINVERSIÓN,26.12.2022,FI,22/12/2022,,ANÁLISIS.csv,2025-12-23T05:39:41.020755
40045330-2022,VIGENTE,2022,2022,40045330,0,"SANEAMIENTO Y REGULARIZACION DE TITULOS DE DOMINIO DE TERRENOS, MUNICIPIOS PERTENECIENTES",PROGRAMA,PUNILLA,PUNILLA,EJECUCIÓN,GLOSAS COMUNES,SANEAMIENTO DOMINIO (PEQUEÑAS PROPIEDADES),33,3,,ASOCIACIÓN PUNILLA,MUNICIPIO,ASOCIACIÓN PUNILLA,,"M$364,320","M$364,320","M$364,320",M$0,APROBADO TÉCNICAMENTE,12/6/2022,RS,12/6/2022,RS,ANÁLISIS.csv,2025-12-23T05:39:41.020824
40045331-2023,VIGENTE,2022,2023,40045331,0,TRANSFERENCIA TRANSFERENCIA DE CAPACIDADES A LOS PEQUEÑOS Y MEDIANOS PRODUCTORES AGRÍCOLAS DE,PROGRAMA,REGIONAL,REGIONAL,EJECUCIÓN,GLOSAS COMUNES,AGRICULTURA,33,3,,CORPARAUCO,SECTORIAL / OTRO,GORE-DIFOI,,"M$270,300","M$270,300","M$270,300","M$270,297",APROBADO TÉCNICAMENTE,30-12-2022,RS,30-12-2023,RS,ANÁLISIS.csv,2025-12-23T05:39:41.023839
40045340-2023,VIGENTE,2022,2023,40045340,0,"CONSTRUCCION CESFAM PUENTE ÑUBLE, COMUNA SAN NICOLÁS",PROYECTO,DIGUILLÍN,SAN NICOLÁS,DISEÑO,MIDESO,SALUD,,,,MUNICIP. SAN NICOLÁS,MUNICIPIO,MUNICIP. SAN NICOLÁS,,"M$64,500","M$64,500","M$64,500",M$0,INGRESADO A PREINVERSIÓN,04.10.2022,SIN RATE,04.10.2022,,ANÁLISIS.csv,2025-12-23T05:39:41.024278
40045403-2022,VIGENTE,2022,2022,40045403,0,TRANSFERENCIA PROGRAMA DE INNOVACIÓN PARA EL DESARROLLO DE UNA CULTURA CENTRADA EN EL APRENDIZ,PROGRAMA,REGIONAL,REGIONAL,EJECUCIÓN,GLOSAS COMUNES,EDUCACION,33,3,,GORE-DIFOI,SECTORIAL / OTRO,GORE-DIFOI,,"M$287,574","M$287,574","M$287,574","M$287,574",APROBADO TÉCNICAMENTE,30-12-2022,RS,30-12-2022,RS,ANÁLISIS.csv,2025-12-23T05:39:41.024395
40045424-2022,VIGENTE,2022,2022,40045424,0,TRANSFERENCIA TECNOLÓGICA EN LA PRODUCCIÓN DE HORTALIZAS BAJO TECHO,PROGRAMA,DIGUILLÍN,CHILLÁN,EJECUCIÓN,GLOSAS COMUNES,AGRICULTURA,33,3,,MUNICIP. CHILLÁN,MUNICIPIO,MUNICIP. CHILLÁN,,"M$91,440","M$91,440","M$91,440","M$65,240",INGRESADO A PREINVERSIÓN,,SIN RATE,,SIN OBSERVACIONES,ANÁLISIS.csv,2025-12-23T05:39:41.024473
40045437-2022,VIGENTE,2022,2022,40045437,0,"PROGRAMA DE CAPACITACIÓN PARA LA INNOVACIÓN DE LA GESTIÓN CLÍNICA Y LA SATISFACCIÓN USUARIA EN EL HOSPITAL REGIONAL DE ÑUBLE, CON ENFOQUE DE RED ( PRIMERA VERSIÓN)",PROGRAMA,REGIONAL,REGIONAL,EJECUCIÓN,GLOSAS COMUNES,SALUD,,,,UBB,SECTORIAL / OTRO,GORE-DIPIR,,"M$82,963","M$82,963","M$82,963",M$0,INGRESADO A PREINVERSIÓN,03.10.2022,SIN RATE,03.10.2022,,ANÁLISIS.csv,2025-12-23T05:39:41.024573
40045447-2022,VIGENTE,2022,2022,40045447,0,"MEJORAMIENTO CANCHA DE FÚTBOL TALQUIPÉN, COMUNA DE COIHUECO",PROYECTO,PUNILLA,COIHUECO,EJECUCIÓN,MIDESO,DEPORTIVO,,,,MUNICIP. COIHUECO,MUNICIPIO,MUNICIP. COIHUECO,,"M$380,000","M$380,000","M$380,000",M$0,ADMISIBLE,13.10.2022,ADMISIBLE,13.10.2022,,ANÁLISIS.csv,2025-12-23T05:39:41.024635
40045497-2022,VIGENTE,2022,2022,40045497,0,ADQUISICIÓN CENTRAL DE MONITOREO H SAN CARLOS Y VENTILADORES MECÁNICOS SAMU,PROYECTO,PUNILLA,SAN CARLOS,EJECUCIÓN,C-33,SALUD,,,,S.SALUD ÑUBLE,SECTORIAL / OTRO,S.SALUD ÑUBLE,,"M$68,387","M$68,387","M$68,387",M$0,INADMISIBLE,07.12.2022,INADMISIBLE,07.12.2022,INADMISIBLE,ANÁLISIS.csv,2025-12-23T05:39:41.024735
40045516-2022,VIGENTE,2022,2022,40045516,0,CONSTRUCCIÓN ILUMINACIÓN SUSTENTABLE EN CAMINO RURAL CASA BLANCA,PROYECTO,ITATA,QUIRIHUE,EJECUCIÓN,FRIL,ENERGÍA,33,3,125,MUNICIP. QUIRIHUE,MUNICIPIO,MUNICIP. QUIRIHUE,,"M$29,999","M$29,999","M$29,999",M$0,INGRESADO A PREINVERSIÓN,26.09.2022,SIN RATE,26.09.2022,,ANÁLISIS.csv,2025-12-23T05:39:41.024790
40045518-2022,VIGENTE,2022,2022,40045518,0,REPOSICIÓN REFUGIOS PEATONALES E ILUMINACIÓN SUSTENTABLE SECTOR RISCO DEL LEÓN,PROYECTO,ITATA,QUIRIHUE,EJECUCIÓN,FRIL,INFRAESTRUCTURA PÚBLICA,33,3,125,MUNICIP. QUIRIHUE,MUNICIPIO,MUNICIP. QUIRIHUE,,"M$29,999","M$29,999","M$29,999",M$0,REVISANDO PREINVERSIÓN,26.09.2022,FI,14/12/2022,,ANÁLISIS.csv,2025-12-23T05:39:41.024907
40045524-2022,VIGENTE,2022,2022,40045524,0,PROGRAMA DE RECUPERACIÓN DE LA ASISTENCIA ESCOLAR EN EL VALLE DEL ITATA,PROGRAMA,ITATA,ITATA,EJECUCIÓN,GLOSAS COMUNES,EDUCACION,,,,ASOCIACIÓN ITATA,MUNICIPIO,ASOCIACIÓN ITATA,,"M$354,706","M$354,706","M$354,706",M$0,APROBADO TÉCNICAMENTE,28.09.2022,RS,28.09.2022,,ANÁLISIS.csv,2025-12-23T05:39:41.025086
40045553-2023,VIGENTE,2022,2023,40045553,0,"REPOSICIÓN SEDE SOCIAL EL PORVENIR, COMUNA DE QUIRIHUE",PROYECTO,ITATA,QUIRIHUE,EJECUCIÓN,FRIL,EQUIPAMIENTO,33,3,125,MUNICIP. QUIRIHUE,MUNICIPIO,MUNICIP. QUIRIHUE,,"M$79,998","M$79,998","M$79,998",M$0,APROBADO TÉCNICAMENTE,14/12/2022,RS,14/12/2022,CONVENIO,ANÁLISIS.csv,2025-12-23T05:39:41.027570
40045554-2023,VIGENTE,2023,2023,40045554,0,"CONSTRUCCION SOLUCIONES SANITARIAS, VILLA PADRE HURTADO, COMUNA DE PINTO",PROYECTO,DIGUILLÍN,PINTO,EJECUCIÓN,MIDESO,SANEAMIENTO SANITARIO,,,,MUNICIP. PINTO,MUNICIPIO,MUNICIP. PINTO,,"M$1,942,846","M$1,942,846","M$1,942,846",M$0,REVISANDO MDS,10-04-2023,FI,10-04-2023,,ANÁLISIS.csv,2025-12-23T05:39:41.027724
40045607-2022,VIGENTE,2022,2022,40045607,0,"MEJORAMIENTO ENTORNO ESPACIO PUBLICO VERTIENTE SANTA ELVIRA, CHILLÁN",PROYECTO,DIGUILLÍN,CHILLÁN,EJECUCIÓN,FRIL,PLAZAS/PARQUES,33,3,125,MUNICIP. CHILLÁN,MUNICIPIO,MUNICIP. CHILLÁN,,"M$119,053","M$119,053","M$119,053",M$0,REVISANDO PREINVERSIÓN,06.10.2022,SIN RATE,06.10.2022,,ANÁLISIS.csv,2025-12-23T05:39:41.027814
40045695-2022,VIGENTE,2022,2022,40045695,0,"ADQUISICION CAMIÓN RECOLECTOR DE RESIDUOS SOLIDOS DOMICILIARIOS,",PROYECTO,ITATA,TREHUACO,EJECUCIÓN,C-33,VEHÍCULOS Y MAQUINARIAS,29,3,,MUNICIP. TREHUACO,MUNICIPIO,MUNICIP. TREHUACO,,"M$237,292","M$237,292","M$237,292",M$0,APROBADO TÉCNICAMENTE,07.10.2022,RS,07.10.2022,RS,ANÁLISIS.csv,2025-12-23T05:39:41.027890
40045701-2022,VIGENTE,2022,2022,40045701,0,"TRANSFERENCIA PARA EL MEJORAMIENTO DE LA CALIDAD EN LA EDUCACIÓN ESCOLAR RURAL, COMUNAS INTEGRANTES ASOCIACIÓN PUNILLA, PROVINCIA DE PUNILLA, REGIÓN DE ÑUBLE",PROGRAMA,PUNILLA,PUNILLA,EJECUCIÓN,TRANSFERENCIAS,EDUCACIÓN,33,3,,ASOCIACIÓN PUNILLA,MUNICIPIO,ASOCIACIÓN PUNILLA,,"M$454,583","M$424,563","M$439,249",M$0,APROBADO CORE,26.09.2022,RS,26.09.2022,,ANÁLISIS.csv,2025-12-23T05:39:41.027944
40045762-2022,VIGENTE,2022,2022,40045762,0,TRANSFERENCIA SUBVENCIÓN DE APOYO A LA RETENCIÓN ESCOLAR Y MEJORAMIENTO DE ASISTENCIA MEDIA EN,PROGRAMA,DIGUILLÍN,EL CARMEN,EJECUCIÓN,TRANSFERENCIAS,EDUCACION,,,,MUNICIP. EL CARMEN,MUNICIPIO,MUNICIP. EL CARMEN,,"M$60,221","M$60,221","M$60,221",M$0,INADMISIBLE,03.10.2022,INADMISIBLE,03.10.2022,,ANÁLISIS.csv,2025-12-23T05:39:41.028041
40045787-2022,VIGENTE,2022,2022,40045787,0,"CONSTRUCCIÓN CANCHA PASTO SINTÉTICO Y CIERRE PERIMETRAL, SECTOR COYANCO, COMUNA DE NINHUE",PROYECTO,ITATA,NINHUE,DISEÑO,MIDESO,DEPORTIVO,31,1,,MUNICIP. NINHUE,MUNICIPIO,MUNICIP. NINHUE,,M$25,M$25,M$25,M$0,APROBADO TÉCNICAMENTE,15/12/2022,RS,15/12/2022,RS,ANÁLISIS.csv,2025-12-23T05:39:41.048533
40045793-2023,VIGENTE,2022,2023,40045793,0,"CONSTRUCCIÓN SALA DE ESTIMULACIÓN CENTRO DE EQUINOTERAPIA, COMUNA DE SAN IGNACIO",PROYECTO,DIGUILLÍN,SAN IGNACIO,EJECUCIÓN,FRIL,SALUD,33,3,125,MUNICIP. SAN IGNACIO,MUNICIPIO,MUNICIP. SAN IGNACIO,,"M$122,490","M$122,490","M$122,490",M$0,APROBADO TÉCNICAMENTE,21/12/2022,RS,21/12/2022,CONVENIO,ANÁLISIS.csv,2025-12-23T05:39:41.048642
40045842-2022,VIGENTE,2022,2022,40045842,0,TRANSFERENCIA MECANIZACION Y MODERNIZACION PRODUCTIVA PARA AGRICULTORES DE LA REGION DE ÑUBLE,PROGRAMA,REGIONAL,REGIONAL,EJECUCIÓN,GLOSAS COMUNES,FOMENTO/TURISMO/INNOVACIÓN,33,,,INDAP,SECTORIAL / OTRO,INDAP,,"M$4,100","M$4,100","M$4,100",M$0,APROBADO TÉCNICAMENTE,24/11/2022,RS,24/11/2022,RS,ANÁLISIS.csv,2025-12-23T05:39:41.058709
40045879-2022,VIGENTE,2022,2022,40045879,0,REPOSICION EQUIPO RAYOS OSTEOPULMONAR DIGITAL HOSPITAL QUIRIHUE,PROYECTO,ITATA,QUIRIHUE,EJECUCIÓN,C-33,SALUD,,,,S.SALUD ÑUBLE,SECTORIAL / OTRO,S.SALUD ÑUBLE,,"M$176,330","M$176,330","M$176,330",M$0,INGRESADO A PREINVERSIÓN,28.10.2022,SIN RATE,28.10.2022,,ANÁLISIS.csv,2025-12-23T05:39:41.059128
40045883-2022,VIGENTE,2022,2022,40045883,0,"MEJORAMIENTO BANDEJON COLON ENTRE CALLES VALDES LECARO Y ESTACION, COMUNA DE PEMUCO",PROYECTO,DIGUILLÍN,PEMUCO,EJECUCIÓN,FRIL,CAMINOS/CALLES/VEREDAS,33,3,125,MUNICIP. PEMUCO,MUNICIPIO,MUNICIP. PEMUCO,,"M$30,000","M$30,000","M$30,000",M$0,REVISANDO PREINVERSIÓN,23.11.2022,FI,23.11.2022,,ANÁLISIS.csv,2025-12-23T05:39:41.059411
40045884-2022,VIGENTE,2022,2022,40045884,0,"MEJORAMIENTO PLAZOLETA VILLA ESTEFANIA I, COMUNA DE PEMUCO",PROYECTO,DIGUILLÍN,PEMUCO,EJECUCIÓN,FRIL,PLAZAS/PARQUES,33,3,125,MUNICIP. PEMUCO,MUNICIPIO,MUNICIP. PEMUCO,,"M$29,999","M$29,999","M$29,999",M$0,APROBADO TÉCNICAMENTE,3/23/2023,RS,2/20/2023,CONVENIO,ANÁLISIS.csv,2025-12-23T05:39:41.063760
40045885-2022,VIGENTE,2022,2022,40045885,0,"MEJORAMIENTO MULTICANCHA VILLA ESTEFANIA I, COMUNA DE PEMUCO",PROYECTO,DIGUILLÍN,PEMUCO,EJECUCIÓN,FRIL,DEPORTIVO,33,3,125,MUNICIP. PEMUCO,MUNICIPIO,MUNICIP. PEMUCO,,"M$117,736","M$117,736","M$117,736",M$0,REVISANDO PREINVERSIÓN,05.10.2022,FI,12/12/2022,,ANÁLISIS.csv,2025-12-23T05:39:41.063891
40045901-2023,VIGENTE,2022,2023,40045901,0,"MEJORAMIENTO EN MULTICANCHAS VILLAS, LAGOS DE CHILE Y PUESTADEL SOL, SAN CARLOS.",PROYECTO,PUNILLA,SAN CARLOS,EJECUCIÓN,FRIL,DEPORTIVO,33,3,125,MUNICIP. SAN CARLOS,MUNICIPIO,MUNICIP. SAN CARLOS,,"M$121,984","M$121,984","M$121,984",M$0,APROBADO TÉCNICAMENTE,3/1/2023,RS,12/30/2022,CONVENIO,ANÁLISIS.csv,2025-12-23T05:39:41.063982
40045918-2023,VIGENTE,2022,2023,40045918,0,REPOSICIÓN MOTOCICLETAS TODO TERRENO POLICIAL PARA LA XVI ZONA DE CARABINEROS ÑUBLE,PROYECTO,REGIONAL,REGIONAL,EJECUCIÓN,C-33,SEGURIDAD,29,3,,CARABINEROS,SECTORIAL / OTRO,GORE-DIPIR,,"M$186,030","M$186,030","M$186,030",M$0,NO PRIORIZADO FINANCIAMIENTO,22.09.2022,SIN RATE,22.09.2022,,ANÁLISIS.csv,2025-12-23T05:39:41.064062
40045945-2022,VIGENTE,2022,2022,40045945,0,TRANSFERENCIA PROGRAMA MEJORAMIENTO DE LOS SERVICIOS EDUCATIVOS DE LA COMUNA DE BULNES,PROGRAMA,DIGUILLÍN,BULNES,EJECUCIÓN,TRANSFERENCIAS,EDUCACIÓN,,,,MUNICIP. BULNES,MUNICIPIO,MUNICIP. BULNES,,"M$78,288","M$78,288","M$78,288",M$0,APROBADO TÉCNICAMENTE,05.10.2022,RS,05.10.2022,,ANÁLISIS.csv,2025-12-23T05:39:41.064363
40045973-2023,VIGENTE,2022,2023,40045973,0,"ADQUISICION EQUIPAMIENTO DIDÁCTICO PARA ESTABLECIMIENTOS EDUCACIONALES MUNICIPALES, QUIRIHUE",PROGRAMA,ITATA,QUIRIHUE,EJECUCIÓN,C-33,EDUCACION,,,,MUNICIP. QUIRIHUE,MUNICIPIO,MUNICIP. CHILLÁN,,"M$377,300","M$377,300","M$377,300",M$0,INGRESADO A PREINVERSIÓN,06.10.2022,SIN RATE,06.10.2022,,ANÁLISIS.csv,2025-12-23T05:39:41.064757
40045974-2022,VIGENTE,2022,2022,40045974,0,"AMPLIACION DE PLANTA DE TRATAMIENTO DE AGUAS SERVIDAS DE PUEBLO SECO,
COMUNA DE SAN IGNACIO",ESTUDIO,DIGUILLÍN,SAN IGNACIO,DISEÑO,MIDESO,ALCANTARILLADO,,,,MUNICIP. SAN IGNACIO,MUNICIPIO,MUNICIP. SAN IGNACIO,,"M$120,000","M$120,000","M$120,000",M$0,INGRESADO A PREINVERSIÓN,07.10.2022,SIN RATE,07.10.2022,,ANÁLISIS.csv,2025-12-23T05:39:41.064877
40045982-2022,VIGENTE,2022,2022,40045982,0,"CONSTRUCCIÓN DE POZOS PROFUNDOS SECTORES DE SAN JOSÉ Y RELOCA, COMUNA DE NINHUE",PROYECTO,ITATA,NINHUE,EJECUCIÓN,FRIL,AGUAS Y APR,33,3,125,MUNICIP. NINHUE,MUNICIPIO,MUNICIP. NINHUE,,"M$127,828","M$127,828","M$127,828",M$0,APROBADO TÉCNICAMENTE,28/11/2022,RS,25/11/2022,CONVENIO,ANÁLISIS.csv,2025-12-23T05:39:41.065041
40045983-2022,VIGENTE,2022,2022,40045983,0,"CONSTRUCCIÓN DE POZOS PROFUNDOS SECTORES DE CEMENTERIO Y LA POSTA, COMUNA DE NINHUE",PROYECTO,ITATA,NINHUE,EJECUCIÓN,FRIL,AGUAS Y APR,33,3,125,MUNICIP. NINHUE,MUNICIPIO,MUNICIP. NINHUE,,"M$127,828","M$127,828","M$127,828",M$0,APROBADO TÉCNICAMENTE,07.12.2022,RS,07.12.2022,CONVENIO,ANÁLISIS.csv,2025-12-23T05:39:41.065144
40045990-2023,VIGENTE,2022,2023,40045990,0,"CONSTRUCCION MULTICANCHA ESCUELA AMANDA CHÁVEZ NAVARRETE, COMUNA DE QUILLÓN",PROYECTO,DIGUILLÍN,QUILLÓN,EJECUCIÓN,FRIL,CAMINOS/CALLES/VEREDAS,33,3,125,MUNICIP. QUILLÓN,MUNICIPIO,MUNICIP. QUILLÓN,,"M$78,530","M$102,633","M$102,633",M$0,APROBADO TÉCNICAMENTE,21/12/2022,RS,21/12/2022,CONVENIO,ANÁLISIS.csv,2025-12-23T05:39:41.065232
40045992-2022,NO VIGENTE,2022,2022,40045992,0,CONSTRUCCION INSTITUTO REHABILITACION INFANTIL TELETON ÑUBLE (NO VIGENTE),PROYECTO,REGIONAL,CHILLÁN,EJECUCIÓN,MIDESO,SALUD,,,,GORE-DIPLADE,SECTORIAL / OTRO,GORE-DIPLADE,,"M$9,386,509","M$9,386,509","M$9,386,509",M$0,ADMISIBLE,25.10.2022,ADMISIBLE,25.10.2022,MIDESO,ANÁLISIS.csv,2025-12-23T05:39:41.065342
40046008-2022,VIGENTE,2022,2022,40046008,0,PREVENCIÓN DEL AUSENTISMO ESCOLAR APRENDER A TIEMPO% - CADA DÍA SUMA,PROGRAMA,DIGUILLÍN,YUNGAY,EJECUCIÓN,TRANSFERENCIAS,EDUCACION,,,,MUNICIP. YUNGAY,MUNICIPIO,MUNICIP. YUNGAY,,"M$101,775","M$101,775","M$101,775",M$0,INADMISIBLE,06.10.2022,INADMISIBLE,06.10.2022,,ANÁLISIS.csv,2025-12-23T05:39:41.065401
40046028-2023,VIGENTE,2022,2023,40046028,0,"CONSTRUCCION SEDE SOCIAL POBLACION EL ROBLE , SAN CARLOS",PROYECTO,PUNILLA,SAN CARLOS,EJECUCIÓN,FRIL,SOCIAL,33,3,125,MUNICIP. SAN CARLOS,MUNICIPIO,MUNICIP. SAN CARLOS,,"M$63,907","M$63,907","M$63,907",M$0,APROBADO TÉCNICAMENTE,28/12/2022,RS,28/12/2022,CONVENIO,ANÁLISIS.csv,2025-12-23T05:39:41.065458
40046078-2023,VIGENTE,2022,2023,40046078,0,"INSTALACIÓN SEÑALÉTICA, COMUNA DE QUIRIHUE",PROYECTO,ITATA,QUIRIHUE,EJECUCIÓN,FRIL,SEMÁFORO/SEÑALÉTICA/REFUGIOS,33,3,125,MUNICIP. QUIRIHUE,MUNICIPIO,MUNICIP. QUIRIHUE,,"M$23,896","M$23,896","M$23,896",M$0,APROBADO TÉCNICAMENTE,15/12/2022,RS,15/12/2022,CONVENIO,ANÁLISIS.csv,2025-12-23T05:39:41.077189
40046084-2023,VIGENTE,2022,2023,40046084,0,"CONSTRUCCION PUESTOS DE VENTA AGRÍCOLA, SECTOR NUEVA ALDEA",PROYECTO,ITATA,RÁNQUIL,EJECUCIÓN,FRIL,COMERCIO,33,3,125,MUNICIP. RÁNQUIL,MUNICIPIO,MUNICIP. RÁNQUIL,,"M$30,000","M$30,000","M$30,000",M$0,APROBADO TÉCNICAMENTE,22/12/2022,RS,22/12/2022,CONVENIO,ANÁLISIS.csv,2025-12-23T05:39:41.077361
40046141-2022,VIGENTE,2022,2022,40046141,0,"AMPLIACION RED DE ALUMBRADO PÚBLICO, DISTINTOS SECTORES DE LA COMUNA",PROYECTO,ITATA,RÁNQUIL,EJECUCIÓN,FRIL,ENERGÍA,33,3,125,MUNICIP. RÁNQUIL,MUNICIPIO,MUNICIP. RÁNQUIL,,"M$122,000","M$122,000","M$122,000",M$0,APROBADO TÉCNICAMENTE,29/11/2023,RS,29/11/2023,RS,ANÁLISIS.csv,2025-12-23T05:39:41.083190
40046144-2022,VIGENTE,2022,2022,40046144,0,"MEJORAMIENTO MEJORAMIENTO Y AMPLIACIÓN CANCHA DE RAYUELA SECTOR SAN
MIGUEL, COMUNA DE SAN IGN",PROYECTO,DIGUILLÍN,SAN IGNACIO,EJECUCIÓN,FRIL,DEPORTIVO,33,3,125,MUNICIP. SAN IGNACIO,MUNICIPIO,MUNICIP. SAN IGNACIO,,"M$119,391","M$119,391","M$119,391",M$0,INGRESADO A PREINVERSIÓN,03.10.2022,SIN RATE,03.10.2022,,ANÁLISIS.csv,2025-12-23T05:39:41.095087
40046161-2023,VIGENTE,2022,2023,40046161,0,HABILITACIÓN BAÑOS CONSTRUCCIÓN COMEDORES PROFESORES LICEO BICENTENARIO STA. CRUZ DE LARQUI,PROYECTO,DIGUILLÍN,BULNES,EJECUCIÓN,FRIL,EDUCACION,33,3,125,MUNICIP. BULNES,MUNICIPIO,MUNICIP. BULNES,,"M$81,559","M$81,559","M$81,559",M$0,APROBADO TÉCNICAMENTE,29/12/2022,RS,3/1/2023,,ANÁLISIS.csv,2025-12-23T05:39:41.095628
40046199-2022,VIGENTE,2022,2022,40046199,0,"CONSTRUCCION MULTICANCHA Y CAMARINES LICEO DE CAMPANARIO, COMUNA DE
YUNGAY",PROYECTO,DIGUILLÍN,YUNGAY,EJECUCIÓN,FRIL,DEPORTIVO,33,3,125,MUNICIP. YUNGAY,MUNICIPIO,MUNICIP. YUNGAY,,"M$122,450","M$122,450","M$122,450",M$0,INGRESADO A PREINVERSIÓN,04.10.2022,SIN RATE,04.10.2022,,ANÁLISIS.csv,2025-12-23T05:39:41.095734
40046205-2022,VIGENTE,2022,2022,40046205,0,"CONSTRUCCION ILUMINACIÓN ESTADIO PUENTE ÑUBLE, COMUNA DE SAN NICOLÁS",PROYECTO,DIGUILLÍN,SAN NICOLÁS,EJECUCIÓN,FRIL,DEPORTIVO,33,3,125,MUNICIP. SAN NICOLÁS,MUNICIPIO,MUNICIP. SAN NICOLÁS,DIDESO,"M$121,964","M$121,964","M$121,964",M$0,INGRESADO A PREINVERSIÓN,04.10.2002,SIN RATE,04.10.2022,,ANÁLISIS.csv,2025-12-23T05:39:41.095833
40046207-2022,VIGENTE,2022,2022,40046207,0,"CONSTRUCCION ILUMINACIÓN ESTADIO ISMAEL MARTÍN, COMUNA DE SAN NICOLÁS",PROYECTO,DIGUILLÍN,SAN NICOLÁS,EJECUCIÓN,FRIL,DEPORTIVO,33,3,125,MUNICIP. SAN NICOLÁS,MUNICIPIO,MUNICIP. SAN NICOLÁS,DIDESO,"M$121,472","M$121,472","M$121,472",M$0,REVISANDO PREINVERSIÓN,14/11/2022,SIN RATE,04.10.2022,,ANÁLISIS.csv,2025-12-23T05:39:41.095938
