id,convenio_id,tipo_evento_id,numero_documento,fecha_documento,tipo_resolucion_norm,observacion_raw,columna_fuente
a8b29718-090d-4be2-9a4c-0d26e66636d8,27badf17-a6da-4f9b-959f-71930aad86d2,ef4bda38-f2b2-4c54-ac7a-6d0d3b52cb04,708/15.05.2025,,,708/15.05.2025,Nº  Y FECHA OFICIO ENVIA CONVENIO
4971d540-cb0f-4079-9af1-7e6bfbfb2b84,27badf17-a6da-4f9b-959f-71930aad86d2,f5dca104-f319-43d3-be4d-41e6ff8a1a02,708/15.05.2025,,,708/15.05.2025,Nº  Y FECHA OFICIO ENVIA CONVENIO
4a3ec755-8dad-4af0-882c-b661f33abfe6,27badf17-a6da-4f9b-959f-71930aad86d2,d5a008d4-cdd7-4ca2-b14e-484c6011385f,708/15.05.2025,,,708/15.05.2025,Nº  Y FECHA OFICIO ENVIA CONVENIO
1e958434-f6df-4acd-8b0d-05b4971a697f,27badf17-a6da-4f9b-959f-71930aad86d2,95b43090-bfe5-41ac-b905-1b06d0490d6e,708/15.05.2025,,,708/15.05.2025,Nº  Y FECHA OFICIO ENVIA CONVENIO
d2676cb0-2352-4280-aceb-64514a209fc4,27badf17-a6da-4f9b-959f-71930aad86d2,7829044c-ff69-4867-9ef3-086056e276b6,708/15.05.2025,,,708/15.05.2025,Nº  Y FECHA OFICIO ENVIA CONVENIO
39c1f3c9-0570-4c0c-9177-88445b04f0cb,27badf17-a6da-4f9b-959f-71930aad86d2,70f8df47-02e5-4fdc-8201-572c25e54089,708/15.05.2025,,,708/15.05.2025,Nº  Y FECHA OFICIO ENVIA CONVENIO
af5b4461-9893-480c-85b4-d8331d911569,27badf17-a6da-4f9b-959f-71930aad86d2,b834311e-a83e-4167-88f3-148814355189,708/15.05.2025,,,708/15.05.2025,Nº  Y FECHA OFICIO ENVIA CONVENIO
6bc6a4cd-f9b0-43ee-a399-b10af28bde98,78d84648-506b-4fe4-8b23-7e8eda9b641d,ef4bda38-f2b2-4c54-ac7a-6d0d3b52cb04,326/21.02.2025,,,326/21.02.2025,Nº  Y FECHA OFICIO ENVIA CONVENIO
77b1ed55-5e38-44e3-874f-f483a7e3a72c,78d84648-506b-4fe4-8b23-7e8eda9b641d,f5dca104-f319-43d3-be4d-41e6ff8a1a02,326/21.02.2025,,,326/21.02.2025,Nº  Y FECHA OFICIO ENVIA CONVENIO
3e3a6b0c-bbad-465e-90b0-fbebb89ae569,78d84648-506b-4fe4-8b23-7e8eda9b641d,d5a008d4-cdd7-4ca2-b14e-484c6011385f,326/21.02.2025,,,326/21.02.2025,Nº  Y FECHA OFICIO ENVIA CONVENIO
bf5a5b38-3132-4d32-91f0-d211d745fd33,78d84648-506b-4fe4-8b23-7e8eda9b641d,95b43090-bfe5-41ac-b905-1b06d0490d6e,326/21.02.2025,,,326/21.02.2025,Nº  Y FECHA OFICIO ENVIA CONVENIO
07f2503d-12b2-4082-8221-3d3216da72ab,78d84648-506b-4fe4-8b23-7e8eda9b641d,7829044c-ff69-4867-9ef3-086056e276b6,326/21.02.2025,,,326/21.02.2025,Nº  Y FECHA OFICIO ENVIA CONVENIO
de5159d8-898d-48c7-a6b4-bc698ba5ae4e,78d84648-506b-4fe4-8b23-7e8eda9b641d,70f8df47-02e5-4fdc-8201-572c25e54089,326/21.02.2025,,,326/21.02.2025,Nº  Y FECHA OFICIO ENVIA CONVENIO
0bdd9ca8-4ce0-4537-8ea9-637baa834fda,78d84648-506b-4fe4-8b23-7e8eda9b641d,b834311e-a83e-4167-88f3-148814355189,326/21.02.2025,,,326/21.02.2025,Nº  Y FECHA OFICIO ENVIA CONVENIO
9b688a32-f172-4e89-b0ad-5c6a9198b395,8ee91458-9e70-434e-a513-719abfb963c1,ef4bda38-f2b2-4c54-ac7a-6d0d3b52cb04,326/21.02.2025,,,326/21.02.2025,Nº  Y FECHA OFICIO ENVIA CONVENIO
42368e38-2df2-43db-999b-eb10626ac318,8ee91458-9e70-434e-a513-719abfb963c1,f5dca104-f319-43d3-be4d-41e6ff8a1a02,326/21.02.2025,,,326/21.02.2025,Nº  Y FECHA OFICIO ENVIA CONVENIO
5ecffd7c-e01c-4b27-9e6c-6343ae6a307c,8ee91458-9e70-434e-a513-719abfb963c1,d5a008d4-cdd7-4ca2-b14e-484c6011385f,326/21.02.2025,,,326/21.02.2025,Nº  Y FECHA OFICIO ENVIA CONVENIO
ec571b14-99eb-4568-9bc3-5de7c9bb40ef,8ee91458-9e70-434e-a513-719abfb963c1,95b43090-bfe5-41ac-b905-1b06d0490d6e,326/21.02.2025,,,326/21.02.2025,Nº  Y FECHA OFICIO ENVIA CONVENIO
9a60252e-1899-45cc-b0c3-d259886b2a47,8ee91458-9e70-434e-a513-719abfb963c1,7829044c-ff69-4867-9ef3-086056e276b6,326/21.02.2025,,,326/21.02.2025,Nº  Y FECHA OFICIO ENVIA CONVENIO
8e7586aa-706a-47f4-a203-5d84f47081a3,8ee91458-9e70-434e-a513-719abfb963c1,70f8df47-02e5-4fdc-8201-572c25e54089,326/21.02.2025,,,326/21.02.2025,Nº  Y FECHA OFICIO ENVIA CONVENIO
ffe03abc-f97b-4700-83ba-fae9a79d45cf,8ee91458-9e70-434e-a513-719abfb963c1,b834311e-a83e-4167-88f3-148814355189,326/21.02.2025,,,326/21.02.2025,Nº  Y FECHA OFICIO ENVIA CONVENIO
2ec41310-9c9c-4e3e-af64-952ec91da9cf,05bf12b8-d454-478e-97a4-81e11b06ce51,ef4bda38-f2b2-4c54-ac7a-6d0d3b52cb04,709/15.05.2025,,,709/15.05.2025,Nº  Y FECHA OFICIO ENVIA CONVENIO
06094c14-ab8a-432d-b176-91f02f5c639c,05bf12b8-d454-478e-97a4-81e11b06ce51,f5dca104-f319-43d3-be4d-41e6ff8a1a02,709/15.05.2025,,,709/15.05.2025,Nº  Y FECHA OFICIO ENVIA CONVENIO
511f7dd4-61da-497b-a932-cac775d36813,05bf12b8-d454-478e-97a4-81e11b06ce51,d5a008d4-cdd7-4ca2-b14e-484c6011385f,709/15.05.2025,,,709/15.05.2025,Nº  Y FECHA OFICIO ENVIA CONVENIO
5496df63-6cc6-446d-99a8-c41914103903,05bf12b8-d454-478e-97a4-81e11b06ce51,95b43090-bfe5-41ac-b905-1b06d0490d6e,709/15.05.2025,,,709/15.05.2025,Nº  Y FECHA OFICIO ENVIA CONVENIO
466c5b3b-06fa-4890-b666-1f3e73efb901,05bf12b8-d454-478e-97a4-81e11b06ce51,7829044c-ff69-4867-9ef3-086056e276b6,709/15.05.2025,,,709/15.05.2025,Nº  Y FECHA OFICIO ENVIA CONVENIO
6c7cce9d-1840-44ea-b882-be4e3ee3ad57,05bf12b8-d454-478e-97a4-81e11b06ce51,70f8df47-02e5-4fdc-8201-572c25e54089,709/15.05.2025,,,709/15.05.2025,Nº  Y FECHA OFICIO ENVIA CONVENIO
addce9c5-5aea-4b68-b7cd-2f292b1dc742,05bf12b8-d454-478e-97a4-81e11b06ce51,b834311e-a83e-4167-88f3-148814355189,709/15.05.2025,,,709/15.05.2025,Nº  Y FECHA OFICIO ENVIA CONVENIO
9fbca22b-c82e-4c10-847d-7facfa2645e4,ee94c06c-e109-4a2a-a67e-452d23866893,ef4bda38-f2b2-4c54-ac7a-6d0d3b52cb04,709/15.05.2025,,,709/15.05.2025,Nº  Y FECHA OFICIO ENVIA CONVENIO
ac9c26d1-9dbd-4436-9444-8d79a5e8b55d,ee94c06c-e109-4a2a-a67e-452d23866893,f5dca104-f319-43d3-be4d-41e6ff8a1a02,709/15.05.2025,,,709/15.05.2025,Nº  Y FECHA OFICIO ENVIA CONVENIO
93ffd15d-469e-41a1-9c65-41a37d712e15,ee94c06c-e109-4a2a-a67e-452d23866893,d5a008d4-cdd7-4ca2-b14e-484c6011385f,709/15.05.2025,,,709/15.05.2025,Nº  Y FECHA OFICIO ENVIA CONVENIO
1a6bda2b-8e5e-46eb-84ac-d50147d401e0,ee94c06c-e109-4a2a-a67e-452d23866893,95b43090-bfe5-41ac-b905-1b06d0490d6e,709/15.05.2025,,,709/15.05.2025,Nº  Y FECHA OFICIO ENVIA CONVENIO
6f8c8486-10ee-49d9-830c-457d438d2d5b,ee94c06c-e109-4a2a-a67e-452d23866893,7829044c-ff69-4867-9ef3-086056e276b6,709/15.05.2025,,,709/15.05.2025,Nº  Y FECHA OFICIO ENVIA CONVENIO
b9c9378a-903e-40be-9e6a-bd42d77cb6fe,ee94c06c-e109-4a2a-a67e-452d23866893,70f8df47-02e5-4fdc-8201-572c25e54089,709/15.05.2025,,,709/15.05.2025,Nº  Y FECHA OFICIO ENVIA CONVENIO
0b49b4fa-f342-4c8b-8463-500e63e8a096,ee94c06c-e109-4a2a-a67e-452d23866893,b834311e-a83e-4167-88f3-148814355189,709/15.05.2025,,,709/15.05.2025,Nº  Y FECHA OFICIO ENVIA CONVENIO
75a75459-7d7a-485b-ba9f-bee4cd79f30d,25460cf3-f0b1-402b-b301-0f290b11937a,ef4bda38-f2b2-4c54-ac7a-6d0d3b52cb04,709/15.05.2025,,,709/15.05.2025,Nº  Y FECHA OFICIO ENVIA CONVENIO
d62e48e5-4889-47a2-a0ef-e933b99e3f72,25460cf3-f0b1-402b-b301-0f290b11937a,f5dca104-f319-43d3-be4d-41e6ff8a1a02,709/15.05.2025,,,709/15.05.2025,Nº  Y FECHA OFICIO ENVIA CONVENIO
4ba9c727-cb08-4b76-986b-187c5ddb20e0,25460cf3-f0b1-402b-b301-0f290b11937a,d5a008d4-cdd7-4ca2-b14e-484c6011385f,709/15.05.2025,,,709/15.05.2025,Nº  Y FECHA OFICIO ENVIA CONVENIO
8bd00a79-2c2d-420d-85ab-1e7b809ab1ef,25460cf3-f0b1-402b-b301-0f290b11937a,95b43090-bfe5-41ac-b905-1b06d0490d6e,709/15.05.2025,,,709/15.05.2025,Nº  Y FECHA OFICIO ENVIA CONVENIO
da916e27-0b9e-42c2-b059-abc1f598329e,25460cf3-f0b1-402b-b301-0f290b11937a,7829044c-ff69-4867-9ef3-086056e276b6,709/15.05.2025,,,709/15.05.2025,Nº  Y FECHA OFICIO ENVIA CONVENIO
5d90a558-d3fe-4d06-bf85-ccaeb289730a,25460cf3-f0b1-402b-b301-0f290b11937a,70f8df47-02e5-4fdc-8201-572c25e54089,709/15.05.2025,,,709/15.05.2025,Nº  Y FECHA OFICIO ENVIA CONVENIO
c7eae403-711a-440a-a1b5-cf6220f2bb72,25460cf3-f0b1-402b-b301-0f290b11937a,b834311e-a83e-4167-88f3-148814355189,709/15.05.2025,,,709/15.05.2025,Nº  Y FECHA OFICIO ENVIA CONVENIO
2da8264e-0a57-4e71-80ba-6ee29183660d,c32a590d-7617-406d-a2d1-1c3c181f78cc,ef4bda38-f2b2-4c54-ac7a-6d0d3b52cb04,709/15.05.2025,,,709/15.05.2025,Nº  Y FECHA OFICIO ENVIA CONVENIO
9f09aaa2-633b-4579-8f98-72a2b37b1ecf,c32a590d-7617-406d-a2d1-1c3c181f78cc,f5dca104-f319-43d3-be4d-41e6ff8a1a02,709/15.05.2025,,,709/15.05.2025,Nº  Y FECHA OFICIO ENVIA CONVENIO
2700f938-0f93-4e48-a242-c06a2995336a,c32a590d-7617-406d-a2d1-1c3c181f78cc,d5a008d4-cdd7-4ca2-b14e-484c6011385f,709/15.05.2025,,,709/15.05.2025,Nº  Y FECHA OFICIO ENVIA CONVENIO
fe144c8d-8c5e-4675-bc58-c41fd7e90f19,c32a590d-7617-406d-a2d1-1c3c181f78cc,95b43090-bfe5-41ac-b905-1b06d0490d6e,709/15.05.2025,,,709/15.05.2025,Nº  Y FECHA OFICIO ENVIA CONVENIO
be750bdc-d759-40f4-9d60-98d3ba361e25,c32a590d-7617-406d-a2d1-1c3c181f78cc,7829044c-ff69-4867-9ef3-086056e276b6,709/15.05.2025,,,709/15.05.2025,Nº  Y FECHA OFICIO ENVIA CONVENIO
61badcbf-18c8-4a07-beec-ba70a1622ad6,c32a590d-7617-406d-a2d1-1c3c181f78cc,70f8df47-02e5-4fdc-8201-572c25e54089,709/15.05.2025,,,709/15.05.2025,Nº  Y FECHA OFICIO ENVIA CONVENIO
f85427d5-f5ed-4736-a1f6-8cdde5c41d67,c32a590d-7617-406d-a2d1-1c3c181f78cc,b834311e-a83e-4167-88f3-148814355189,709/15.05.2025,,,709/15.05.2025,Nº  Y FECHA OFICIO ENVIA CONVENIO
90d9f313-dc0e-4c88-8214-c3fe33ddd546,c169df48-a300-4358-b04b-9454ef24ee9c,ef4bda38-f2b2-4c54-ac7a-6d0d3b52cb04,709/15.05.2025,,,709/15.05.2025,Nº  Y FECHA OFICIO ENVIA CONVENIO
34e2ccfb-fd75-4aaa-9588-1d52cdc43762,c169df48-a300-4358-b04b-9454ef24ee9c,f5dca104-f319-43d3-be4d-41e6ff8a1a02,709/15.05.2025,,,709/15.05.2025,Nº  Y FECHA OFICIO ENVIA CONVENIO
71ec4edc-11b2-4921-aced-859fc03fc757,c169df48-a300-4358-b04b-9454ef24ee9c,d5a008d4-cdd7-4ca2-b14e-484c6011385f,709/15.05.2025,,,709/15.05.2025,Nº  Y FECHA OFICIO ENVIA CONVENIO
ea878e5c-d941-4b1b-a311-461130518e80,c169df48-a300-4358-b04b-9454ef24ee9c,95b43090-bfe5-41ac-b905-1b06d0490d6e,709/15.05.2025,,,709/15.05.2025,Nº  Y FECHA OFICIO ENVIA CONVENIO
5b25b55d-cb33-4cc0-ade9-491582ea2d52,c169df48-a300-4358-b04b-9454ef24ee9c,7829044c-ff69-4867-9ef3-086056e276b6,709/15.05.2025,,,709/15.05.2025,Nº  Y FECHA OFICIO ENVIA CONVENIO
c828c0c8-903b-43c2-819d-eaf95934842a,c169df48-a300-4358-b04b-9454ef24ee9c,70f8df47-02e5-4fdc-8201-572c25e54089,709/15.05.2025,,,709/15.05.2025,Nº  Y FECHA OFICIO ENVIA CONVENIO
4fa9d609-8e71-4be0-981b-c8d68638427f,c169df48-a300-4358-b04b-9454ef24ee9c,b834311e-a83e-4167-88f3-148814355189,709/15.05.2025,,,709/15.05.2025,Nº  Y FECHA OFICIO ENVIA CONVENIO
92c15d46-94d9-4f05-904a-56fc90ca90cf,62bcd900-fc0e-4910-bef2-8305dd59fcb4,ef4bda38-f2b2-4c54-ac7a-6d0d3b52cb04,320/20.02.2025,,,320/20.02.2025,Nº  Y FECHA OFICIO ENVIA CONVENIO
f2108d79-c1c0-43aa-aa67-752fac55180c,62bcd900-fc0e-4910-bef2-8305dd59fcb4,f5dca104-f319-43d3-be4d-41e6ff8a1a02,320/20.02.2025,,,320/20.02.2025,Nº  Y FECHA OFICIO ENVIA CONVENIO
03fbfeb8-9bcb-43de-ad82-e4f7eca05013,62bcd900-fc0e-4910-bef2-8305dd59fcb4,d5a008d4-cdd7-4ca2-b14e-484c6011385f,320/20.02.2025,,,320/20.02.2025,Nº  Y FECHA OFICIO ENVIA CONVENIO
7a1b254b-0a8e-4310-b61c-95b0f3f8edcc,62bcd900-fc0e-4910-bef2-8305dd59fcb4,95b43090-bfe5-41ac-b905-1b06d0490d6e,320/20.02.2025,,,320/20.02.2025,Nº  Y FECHA OFICIO ENVIA CONVENIO
05b4ff74-7257-4b75-80f6-6e2dac6fb1c1,62bcd900-fc0e-4910-bef2-8305dd59fcb4,7829044c-ff69-4867-9ef3-086056e276b6,320/20.02.2025,,,320/20.02.2025,Nº  Y FECHA OFICIO ENVIA CONVENIO
2ef13fff-53fc-47f4-8426-fafd2c3a2270,62bcd900-fc0e-4910-bef2-8305dd59fcb4,70f8df47-02e5-4fdc-8201-572c25e54089,320/20.02.2025,,,320/20.02.2025,Nº  Y FECHA OFICIO ENVIA CONVENIO
a6117cc2-b06c-4069-bf32-cb5d1274e5fd,62bcd900-fc0e-4910-bef2-8305dd59fcb4,b834311e-a83e-4167-88f3-148814355189,320/20.02.2025,,,320/20.02.2025,Nº  Y FECHA OFICIO ENVIA CONVENIO
3cc9ee67-44c8-482d-89b2-ddecc116668e,fc141434-e849-42d5-b75c-5965a7dc6456,ef4bda38-f2b2-4c54-ac7a-6d0d3b52cb04,321/20.02.2025,,,321/20.02.2025,Nº  Y FECHA OFICIO ENVIA CONVENIO
0a5565d0-c0c2-4135-b142-a92cfc01eb06,fc141434-e849-42d5-b75c-5965a7dc6456,f5dca104-f319-43d3-be4d-41e6ff8a1a02,321/20.02.2025,,,321/20.02.2025,Nº  Y FECHA OFICIO ENVIA CONVENIO
3b201032-8d84-45bc-9385-051e0f33ce80,fc141434-e849-42d5-b75c-5965a7dc6456,d5a008d4-cdd7-4ca2-b14e-484c6011385f,321/20.02.2025,,,321/20.02.2025,Nº  Y FECHA OFICIO ENVIA CONVENIO
eedd647b-85f8-4971-922b-9dd5be73c8fc,fc141434-e849-42d5-b75c-5965a7dc6456,95b43090-bfe5-41ac-b905-1b06d0490d6e,321/20.02.2025,,,321/20.02.2025,Nº  Y FECHA OFICIO ENVIA CONVENIO
2e383766-269a-44da-b655-8c907128ba53,fc141434-e849-42d5-b75c-5965a7dc6456,7829044c-ff69-4867-9ef3-086056e276b6,321/20.02.2025,,,321/20.02.2025,Nº  Y FECHA OFICIO ENVIA CONVENIO
2d084ccc-77da-4302-8307-c51d7615e762,fc141434-e849-42d5-b75c-5965a7dc6456,70f8df47-02e5-4fdc-8201-572c25e54089,321/20.02.2025,,,321/20.02.2025,Nº  Y FECHA OFICIO ENVIA CONVENIO
78618cc4-f2e6-48da-bb78-ff2dc40388ee,fc141434-e849-42d5-b75c-5965a7dc6456,b834311e-a83e-4167-88f3-148814355189,321/20.02.2025,,,321/20.02.2025,Nº  Y FECHA OFICIO ENVIA CONVENIO
1c2b498c-6017-445a-b805-aea41b40d040,05d10009-5fae-4b78-8c9d-b12d05f65b82,ef4bda38-f2b2-4c54-ac7a-6d0d3b52cb04,320/20.02.2025,,,320/20.02.2025,Nº  Y FECHA OFICIO ENVIA CONVENIO
ce87a24e-2c62-466b-8a3b-ae61cb266303,05d10009-5fae-4b78-8c9d-b12d05f65b82,f5dca104-f319-43d3-be4d-41e6ff8a1a02,320/20.02.2025,,,320/20.02.2025,Nº  Y FECHA OFICIO ENVIA CONVENIO
e1f1b704-fe81-45b1-8139-e3b74cb5cb45,05d10009-5fae-4b78-8c9d-b12d05f65b82,d5a008d4-cdd7-4ca2-b14e-484c6011385f,320/20.02.2025,,,320/20.02.2025,Nº  Y FECHA OFICIO ENVIA CONVENIO
b889c651-22b5-4a8f-b78a-9ea0d36aaffe,05d10009-5fae-4b78-8c9d-b12d05f65b82,95b43090-bfe5-41ac-b905-1b06d0490d6e,320/20.02.2025,,,320/20.02.2025,Nº  Y FECHA OFICIO ENVIA CONVENIO
70152dee-e33d-4a53-941f-b52591f58736,05d10009-5fae-4b78-8c9d-b12d05f65b82,7829044c-ff69-4867-9ef3-086056e276b6,320/20.02.2025,,,320/20.02.2025,Nº  Y FECHA OFICIO ENVIA CONVENIO
91617cec-5d7e-488f-b4e2-fcb87912da39,05d10009-5fae-4b78-8c9d-b12d05f65b82,70f8df47-02e5-4fdc-8201-572c25e54089,320/20.02.2025,,,320/20.02.2025,Nº  Y FECHA OFICIO ENVIA CONVENIO
b52c63bf-7539-4a14-97a0-24b2c5309956,05d10009-5fae-4b78-8c9d-b12d05f65b82,b834311e-a83e-4167-88f3-148814355189,320/20.02.2025,,,320/20.02.2025,Nº  Y FECHA OFICIO ENVIA CONVENIO
f8aa09ef-9966-422e-b739-e930da984374,8829eebb-2b6e-4ed4-b637-73d418bd7632,ef4bda38-f2b2-4c54-ac7a-6d0d3b52cb04,326/21.02.2025,,,326/21.02.2025,Nº  Y FECHA OFICIO ENVIA CONVENIO
fdc4920a-3b38-4abc-9ab9-c7576f90ef1b,8829eebb-2b6e-4ed4-b637-73d418bd7632,f5dca104-f319-43d3-be4d-41e6ff8a1a02,326/21.02.2025,,,326/21.02.2025,Nº  Y FECHA OFICIO ENVIA CONVENIO
525ffb37-d06a-45a2-8271-dd38d01e2e59,8829eebb-2b6e-4ed4-b637-73d418bd7632,d5a008d4-cdd7-4ca2-b14e-484c6011385f,326/21.02.2025,,,326/21.02.2025,Nº  Y FECHA OFICIO ENVIA CONVENIO
81897c36-bced-40b3-9d39-3919bf33121f,8829eebb-2b6e-4ed4-b637-73d418bd7632,95b43090-bfe5-41ac-b905-1b06d0490d6e,326/21.02.2025,,,326/21.02.2025,Nº  Y FECHA OFICIO ENVIA CONVENIO
d41f4960-af1d-48ab-92f5-b0b1f4ba334a,8829eebb-2b6e-4ed4-b637-73d418bd7632,7829044c-ff69-4867-9ef3-086056e276b6,326/21.02.2025,,,326/21.02.2025,Nº  Y FECHA OFICIO ENVIA CONVENIO
f1af9185-97d1-448a-8267-c7d81cc799fa,8829eebb-2b6e-4ed4-b637-73d418bd7632,70f8df47-02e5-4fdc-8201-572c25e54089,326/21.02.2025,,,326/21.02.2025,Nº  Y FECHA OFICIO ENVIA CONVENIO
ce86d0ef-93cb-4b4c-857f-2812a3cd0524,8829eebb-2b6e-4ed4-b637-73d418bd7632,b834311e-a83e-4167-88f3-148814355189,326/21.02.2025,,,326/21.02.2025,Nº  Y FECHA OFICIO ENVIA CONVENIO
bbf9c804-5fd3-4271-86ec-bca04622cd7b,bd247587-9671-4e3e-bb48-50efed5aa5a5,ef4bda38-f2b2-4c54-ac7a-6d0d3b52cb04,346/27.02.2025,,,346/27.02.2025,Nº  Y FECHA OFICIO ENVIA CONVENIO
6be29db8-583a-4aba-92b3-61f160e5b178,bd247587-9671-4e3e-bb48-50efed5aa5a5,f5dca104-f319-43d3-be4d-41e6ff8a1a02,346/27.02.2025,,,346/27.02.2025,Nº  Y FECHA OFICIO ENVIA CONVENIO
6fcd4b2f-9dfd-4005-a264-7d0e65ae0880,bd247587-9671-4e3e-bb48-50efed5aa5a5,d5a008d4-cdd7-4ca2-b14e-484c6011385f,346/27.02.2025,,,346/27.02.2025,Nº  Y FECHA OFICIO ENVIA CONVENIO
9d97a01a-acd0-4737-a44a-5bdbab4a05b7,bd247587-9671-4e3e-bb48-50efed5aa5a5,95b43090-bfe5-41ac-b905-1b06d0490d6e,346/27.02.2025,,,346/27.02.2025,Nº  Y FECHA OFICIO ENVIA CONVENIO
ddc4b12e-5288-498c-99a3-f9f2ed8c207e,bd247587-9671-4e3e-bb48-50efed5aa5a5,7829044c-ff69-4867-9ef3-086056e276b6,346/27.02.2025,,,346/27.02.2025,Nº  Y FECHA OFICIO ENVIA CONVENIO
6a949656-364d-4564-aef6-ca488176c3fe,bd247587-9671-4e3e-bb48-50efed5aa5a5,70f8df47-02e5-4fdc-8201-572c25e54089,346/27.02.2025,,,346/27.02.2025,Nº  Y FECHA OFICIO ENVIA CONVENIO
4c3c5e86-7693-4673-aa9e-d0f745b187f6,bd247587-9671-4e3e-bb48-50efed5aa5a5,b834311e-a83e-4167-88f3-148814355189,346/27.02.2025,,,346/27.02.2025,Nº  Y FECHA OFICIO ENVIA CONVENIO
3447a80a-875a-457d-9120-170800875b8f,d07d89e4-7934-4fd7-b3aa-82c93858d1cc,ef4bda38-f2b2-4c54-ac7a-6d0d3b52cb04,321/20.02.2025,,,321/20.02.2025,Nº  Y FECHA OFICIO ENVIA CONVENIO
60e350d0-0f13-40ac-8c65-0222f3fb5a92,d07d89e4-7934-4fd7-b3aa-82c93858d1cc,f5dca104-f319-43d3-be4d-41e6ff8a1a02,321/20.02.2025,,,321/20.02.2025,Nº  Y FECHA OFICIO ENVIA CONVENIO
7f55acb0-d251-43c5-8948-ee9d03bb69c8,d07d89e4-7934-4fd7-b3aa-82c93858d1cc,d5a008d4-cdd7-4ca2-b14e-484c6011385f,321/20.02.2025,,,321/20.02.2025,Nº  Y FECHA OFICIO ENVIA CONVENIO
01e1a599-bb06-4ad9-9270-bcf75eaf7acc,d07d89e4-7934-4fd7-b3aa-82c93858d1cc,95b43090-bfe5-41ac-b905-1b06d0490d6e,321/20.02.2025,,,321/20.02.2025,Nº  Y FECHA OFICIO ENVIA CONVENIO
e723e444-b1a7-4e22-94b3-5695f2909236,d07d89e4-7934-4fd7-b3aa-82c93858d1cc,7829044c-ff69-4867-9ef3-086056e276b6,321/20.02.2025,,,321/20.02.2025,Nº  Y FECHA OFICIO ENVIA CONVENIO
6a2bba67-d53c-41fe-b0de-b1b547226d0f,d07d89e4-7934-4fd7-b3aa-82c93858d1cc,70f8df47-02e5-4fdc-8201-572c25e54089,321/20.02.2025,,,321/20.02.2025,Nº  Y FECHA OFICIO ENVIA CONVENIO
901be15d-c4f8-4d8d-8c24-f79538637c30,d07d89e4-7934-4fd7-b3aa-82c93858d1cc,b834311e-a83e-4167-88f3-148814355189,321/20.02.2025,,,321/20.02.2025,Nº  Y FECHA OFICIO ENVIA CONVENIO
cbddae3e-bb6f-4994-9819-67be4920e496,beb80578-1e13-4391-8599-16877d142b71,ef4bda38-f2b2-4c54-ac7a-6d0d3b52cb04,708/15.05.2025,,,708/15.05.2025,Nº  Y FECHA OFICIO ENVIA CONVENIO
9436c425-fd80-4d62-950a-88abc9bee12b,beb80578-1e13-4391-8599-16877d142b71,f5dca104-f319-43d3-be4d-41e6ff8a1a02,708/15.05.2025,,,708/15.05.2025,Nº  Y FECHA OFICIO ENVIA CONVENIO
312910cb-92e9-4470-86eb-4331cdf940e2,beb80578-1e13-4391-8599-16877d142b71,d5a008d4-cdd7-4ca2-b14e-484c6011385f,708/15.05.2025,,,708/15.05.2025,Nº  Y FECHA OFICIO ENVIA CONVENIO
92bd9a51-0c86-41f5-bb7d-d9b483104ab8,beb80578-1e13-4391-8599-16877d142b71,95b43090-bfe5-41ac-b905-1b06d0490d6e,708/15.05.2025,,,708/15.05.2025,Nº  Y FECHA OFICIO ENVIA CONVENIO
330d4217-46fc-4252-b606-3e18cf57c21a,beb80578-1e13-4391-8599-16877d142b71,7829044c-ff69-4867-9ef3-086056e276b6,708/15.05.2025,,,708/15.05.2025,Nº  Y FECHA OFICIO ENVIA CONVENIO
8b2a045a-b482-4c16-a86c-f483e99143a5,beb80578-1e13-4391-8599-16877d142b71,70f8df47-02e5-4fdc-8201-572c25e54089,708/15.05.2025,,,708/15.05.2025,Nº  Y FECHA OFICIO ENVIA CONVENIO
88fdae23-860c-4dcd-a462-a04f2bd71320,beb80578-1e13-4391-8599-16877d142b71,b834311e-a83e-4167-88f3-148814355189,708/15.05.2025,,,708/15.05.2025,Nº  Y FECHA OFICIO ENVIA CONVENIO
b7355639-e718-4da6-841c-e9776b41f8ee,adfb6d97-e38f-4a14-8828-fe3f40194f9c,ef4bda38-f2b2-4c54-ac7a-6d0d3b52cb04,481/25.03.2025,,,481/25.03.2025,Nº  Y FECHA OFICIO ENVIA CONVENIO
add6ea6e-dd18-44f1-bf67-23287d2107c8,adfb6d97-e38f-4a14-8828-fe3f40194f9c,f5dca104-f319-43d3-be4d-41e6ff8a1a02,481/25.03.2025,,,481/25.03.2025,Nº  Y FECHA OFICIO ENVIA CONVENIO
02aee612-49e8-421d-a9d8-b43eeceff501,adfb6d97-e38f-4a14-8828-fe3f40194f9c,d5a008d4-cdd7-4ca2-b14e-484c6011385f,481/25.03.2025,,,481/25.03.2025,Nº  Y FECHA OFICIO ENVIA CONVENIO
c022734d-c742-4c54-9773-60e922f2bde4,adfb6d97-e38f-4a14-8828-fe3f40194f9c,95b43090-bfe5-41ac-b905-1b06d0490d6e,481/25.03.2025,,,481/25.03.2025,Nº  Y FECHA OFICIO ENVIA CONVENIO
18b88f41-5269-499a-8a60-31c4c239bd31,adfb6d97-e38f-4a14-8828-fe3f40194f9c,7829044c-ff69-4867-9ef3-086056e276b6,481/25.03.2025,,,481/25.03.2025,Nº  Y FECHA OFICIO ENVIA CONVENIO
76b8b0d0-e7db-4ab9-816a-0ef009e08981,adfb6d97-e38f-4a14-8828-fe3f40194f9c,70f8df47-02e5-4fdc-8201-572c25e54089,481/25.03.2025,,,481/25.03.2025,Nº  Y FECHA OFICIO ENVIA CONVENIO
159391bc-99f7-4da2-9d74-654846f7242d,adfb6d97-e38f-4a14-8828-fe3f40194f9c,b834311e-a83e-4167-88f3-148814355189,481/25.03.2025,,,481/25.03.2025,Nº  Y FECHA OFICIO ENVIA CONVENIO
7a6d7e73-da8f-47d6-b4e2-e5d31ad367f8,776050d9-2302-4739-a72b-44df43316f97,ef4bda38-f2b2-4c54-ac7a-6d0d3b52cb04,482/25.03.2025,,,482/25.03.2025,Nº  Y FECHA OFICIO ENVIA CONVENIO
ea72b3b8-a21c-40ee-8620-7b1f092e8f8c,776050d9-2302-4739-a72b-44df43316f97,f5dca104-f319-43d3-be4d-41e6ff8a1a02,482/25.03.2025,,,482/25.03.2025,Nº  Y FECHA OFICIO ENVIA CONVENIO
2278f46f-4d6c-4baa-a36b-b34860ccc49e,776050d9-2302-4739-a72b-44df43316f97,d5a008d4-cdd7-4ca2-b14e-484c6011385f,482/25.03.2025,,,482/25.03.2025,Nº  Y FECHA OFICIO ENVIA CONVENIO
0a9b52f1-5af0-41b1-8abc-529698734be0,776050d9-2302-4739-a72b-44df43316f97,95b43090-bfe5-41ac-b905-1b06d0490d6e,482/25.03.2025,,,482/25.03.2025,Nº  Y FECHA OFICIO ENVIA CONVENIO
ff42205c-c2c3-4c0d-a38d-05a2ef2554e9,776050d9-2302-4739-a72b-44df43316f97,7829044c-ff69-4867-9ef3-086056e276b6,482/25.03.2025,,,482/25.03.2025,Nº  Y FECHA OFICIO ENVIA CONVENIO
0937b688-d006-41e6-8e8f-3b72cb954e04,776050d9-2302-4739-a72b-44df43316f97,70f8df47-02e5-4fdc-8201-572c25e54089,482/25.03.2025,,,482/25.03.2025,Nº  Y FECHA OFICIO ENVIA CONVENIO
d9f9f478-2e57-493a-b0ba-d26c1fab90b4,776050d9-2302-4739-a72b-44df43316f97,b834311e-a83e-4167-88f3-148814355189,482/25.03.2025,,,482/25.03.2025,Nº  Y FECHA OFICIO ENVIA CONVENIO
786152c6-a327-4a1c-bee2-4fd8cb6a45fb,16eab661-a70a-4f8b-b9ed-3c0f1d260779,ef4bda38-f2b2-4c54-ac7a-6d0d3b52cb04,483/25.03.2025,,,483/25.03.2025,Nº  Y FECHA OFICIO ENVIA CONVENIO
fad6ea42-9621-4b09-ae2d-8442cbf367d8,16eab661-a70a-4f8b-b9ed-3c0f1d260779,f5dca104-f319-43d3-be4d-41e6ff8a1a02,483/25.03.2025,,,483/25.03.2025,Nº  Y FECHA OFICIO ENVIA CONVENIO
07f82453-77a9-4523-b384-ed125729241d,16eab661-a70a-4f8b-b9ed-3c0f1d260779,d5a008d4-cdd7-4ca2-b14e-484c6011385f,483/25.03.2025,,,483/25.03.2025,Nº  Y FECHA OFICIO ENVIA CONVENIO
19283fef-be4a-4432-b8bf-1ad8659d3b17,16eab661-a70a-4f8b-b9ed-3c0f1d260779,95b43090-bfe5-41ac-b905-1b06d0490d6e,483/25.03.2025,,,483/25.03.2025,Nº  Y FECHA OFICIO ENVIA CONVENIO
2453fefe-f9b9-41c3-8faa-438703f6e4b5,16eab661-a70a-4f8b-b9ed-3c0f1d260779,7829044c-ff69-4867-9ef3-086056e276b6,483/25.03.2025,,,483/25.03.2025,Nº  Y FECHA OFICIO ENVIA CONVENIO
64964f8c-47ec-425d-a310-7680776f06c3,16eab661-a70a-4f8b-b9ed-3c0f1d260779,70f8df47-02e5-4fdc-8201-572c25e54089,483/25.03.2025,,,483/25.03.2025,Nº  Y FECHA OFICIO ENVIA CONVENIO
e5f7cb2d-e3c3-466c-8e1b-558fa43c9730,16eab661-a70a-4f8b-b9ed-3c0f1d260779,b834311e-a83e-4167-88f3-148814355189,483/25.03.2025,,,483/25.03.2025,Nº  Y FECHA OFICIO ENVIA CONVENIO
10d7fbd3-c4da-4740-8af1-066206ebf339,3de056bc-e35a-4089-a3da-392aef594634,ef4bda38-f2b2-4c54-ac7a-6d0d3b52cb04,429/14.03.2025,,,429/14.03.2025,Nº  Y FECHA OFICIO ENVIA CONVENIO
9f1a4353-5736-428f-aefb-f9be705f3eb8,3de056bc-e35a-4089-a3da-392aef594634,f5dca104-f319-43d3-be4d-41e6ff8a1a02,429/14.03.2025,,,429/14.03.2025,Nº  Y FECHA OFICIO ENVIA CONVENIO
12fbe755-a4af-4f2f-a03d-530c42058c38,3de056bc-e35a-4089-a3da-392aef594634,d5a008d4-cdd7-4ca2-b14e-484c6011385f,429/14.03.2025,,,429/14.03.2025,Nº  Y FECHA OFICIO ENVIA CONVENIO
0342b89f-bb86-4f9b-9def-fc3840652a81,3de056bc-e35a-4089-a3da-392aef594634,95b43090-bfe5-41ac-b905-1b06d0490d6e,429/14.03.2025,,,429/14.03.2025,Nº  Y FECHA OFICIO ENVIA CONVENIO
bc4096f3-02dc-4b9c-85b3-531c65e68515,3de056bc-e35a-4089-a3da-392aef594634,7829044c-ff69-4867-9ef3-086056e276b6,429/14.03.2025,,,429/14.03.2025,Nº  Y FECHA OFICIO ENVIA CONVENIO
55077ec8-1016-47e7-a4fa-79fa47d99e8c,3de056bc-e35a-4089-a3da-392aef594634,70f8df47-02e5-4fdc-8201-572c25e54089,429/14.03.2025,,,429/14.03.2025,Nº  Y FECHA OFICIO ENVIA CONVENIO
e89574bd-3f2f-4b8f-8532-901dda3eccdb,3de056bc-e35a-4089-a3da-392aef594634,b834311e-a83e-4167-88f3-148814355189,429/14.03.2025,,,429/14.03.2025,Nº  Y FECHA OFICIO ENVIA CONVENIO
89ea394a-9d66-4cb3-9c39-23ee27f133b0,e401ed15-e4b2-43f3-93a5-58db8103f73a,95b43090-bfe5-41ac-b905-1b06d0490d6e,775,,,5/24/2024,Nº OFICIO ENVIA CONVENIO
84d9d2bd-1c10-4296-9dfb-ac092bf14297,e401ed15-e4b2-43f3-93a5-58db8103f73a,7829044c-ff69-4867-9ef3-086056e276b6,,,,,FECHA TOMA DE RAZON DE CGR
4150f238-1ecd-4148-a673-a53714331a72,e401ed15-e4b2-43f3-93a5-58db8103f73a,b834311e-a83e-4167-88f3-148814355189,351,,EXENTA,5/24/2024, Nº RESOLUCION 
035e10c3-ad2d-468f-a3cc-962b20ce567c,7042ceea-092e-40f4-9ef5-bb83a0b1c224,95b43090-bfe5-41ac-b905-1b06d0490d6e,775,,,5/24/2024,Nº OFICIO ENVIA CONVENIO
1bee151b-2b89-4d33-83b8-19755bf762fe,7042ceea-092e-40f4-9ef5-bb83a0b1c224,7829044c-ff69-4867-9ef3-086056e276b6,,,,,FECHA TOMA DE RAZON DE CGR
0ad19fcc-e8f7-4558-b04f-53f26a2a9e68,7042ceea-092e-40f4-9ef5-bb83a0b1c224,b834311e-a83e-4167-88f3-148814355189,355,,EXENTA,5/24/2024, Nº RESOLUCION 
6c8a14b3-92ac-4cc1-8633-e21eb9bc4232,07fe7f65-709d-40eb-aaf7-71cc96b34419,95b43090-bfe5-41ac-b905-1b06d0490d6e,774,,,5/24/2024,Nº OFICIO ENVIA CONVENIO
2643c64f-923b-46ed-b89c-ef85035ad6a9,07fe7f65-709d-40eb-aaf7-71cc96b34419,7829044c-ff69-4867-9ef3-086056e276b6,,,,,FECHA TOMA DE RAZON DE CGR
30cf464f-7cf4-463b-a2f3-a331153edbb0,07fe7f65-709d-40eb-aaf7-71cc96b34419,b834311e-a83e-4167-88f3-148814355189,356,,EXENTA,5/24/2024, Nº RESOLUCION 
8a2c311e-9e44-460b-91f8-032ecad40232,e4f629f9-e728-481b-9a45-61876f756e5c,95b43090-bfe5-41ac-b905-1b06d0490d6e,774,,,5/24/2024,Nº OFICIO ENVIA CONVENIO
e2bbbb11-b666-4a2f-bb56-6bf485a9bec2,e4f629f9-e728-481b-9a45-61876f756e5c,7829044c-ff69-4867-9ef3-086056e276b6,,,,,FECHA TOMA DE RAZON DE CGR
540c4775-2308-4a08-b66b-be9e1cd6d0d9,e4f629f9-e728-481b-9a45-61876f756e5c,b834311e-a83e-4167-88f3-148814355189,353,,EXENTA,5/24/2024, Nº RESOLUCION 
815ad48c-7e26-4b7e-a68e-078f37ba054d,442fc821-6e0f-4741-9623-c63ddfac9072,b834311e-a83e-4167-88f3-148814355189,257,,EXENTA,, Nº RESOLUCION 
6c9bbe6e-bd8c-4f89-bfa5-b91ae98b1751,714d86d3-cd37-431b-9736-acb8c866da95,95b43090-bfe5-41ac-b905-1b06d0490d6e,656,,,4/30/2024,Nº OFICIO ENVIA CONVENIO
9d8988c8-0c03-4d0f-b79f-5b7f0423efa0,714d86d3-cd37-431b-9736-acb8c866da95,7829044c-ff69-4867-9ef3-086056e276b6,,,,,FECHA TOMA DE RAZON DE CGR
1fce63ba-b973-4a56-8296-e2888c7c270d,714d86d3-cd37-431b-9736-acb8c866da95,b834311e-a83e-4167-88f3-148814355189,263,,EXENTA,4/30/2024, Nº RESOLUCION 
a6adbe8f-3051-4381-b13b-3d097ddc6db9,83291dc0-209c-4b9e-ab4b-e59b1de0dfbc,95b43090-bfe5-41ac-b905-1b06d0490d6e,774,,,5/24/2024,Nº OFICIO ENVIA CONVENIO
6c1857bd-78d0-4e1a-a050-0d22f5d46932,83291dc0-209c-4b9e-ab4b-e59b1de0dfbc,7829044c-ff69-4867-9ef3-086056e276b6,,,,,FECHA TOMA DE RAZON DE CGR
4f01b508-e851-4171-b315-494aef30c7f8,83291dc0-209c-4b9e-ab4b-e59b1de0dfbc,b834311e-a83e-4167-88f3-148814355189,354,,EXENTA,5/24/2024, Nº RESOLUCION 
d13ea82c-99a0-45df-b979-93b3ef79dd04,cfbc3236-3dd1-497f-97de-d39eacd8cf4d,95b43090-bfe5-41ac-b905-1b06d0490d6e,655,,,4/30/2024,Nº OFICIO ENVIA CONVENIO
46a57fcd-ea37-45a8-8ffe-91a68753e8f4,cfbc3236-3dd1-497f-97de-d39eacd8cf4d,7829044c-ff69-4867-9ef3-086056e276b6,,,,,FECHA TOMA DE RAZON DE CGR
1d7b2cce-a52d-4815-90a0-eca2d75aa081,cfbc3236-3dd1-497f-97de-d39eacd8cf4d,b834311e-a83e-4167-88f3-148814355189,262,,EXENTA,4/30/2024, Nº RESOLUCION 
344f7383-dffa-401b-8cfa-437264432fa0,20aa0fd7-bb0b-441f-9ad7-7ace0e8facc2,95b43090-bfe5-41ac-b905-1b06d0490d6e,773,,,5/24/2024,Nº OFICIO ENVIA CONVENIO
f28b8365-0127-4e60-a666-d90c30117703,20aa0fd7-bb0b-441f-9ad7-7ace0e8facc2,7829044c-ff69-4867-9ef3-086056e276b6,,,,,FECHA TOMA DE RAZON DE CGR
d0e7e850-807c-466d-85ed-8299d47e8367,20aa0fd7-bb0b-441f-9ad7-7ace0e8facc2,b834311e-a83e-4167-88f3-148814355189,339,,EXENTA,5/24/2024, Nº RESOLUCION 
45a1acc4-2c99-4a81-a221-333b105005f2,32aafa16-c4cb-4dce-b6d3-bacbbf32136d,95b43090-bfe5-41ac-b905-1b06d0490d6e,773,,,5/24/2024,Nº OFICIO ENVIA CONVENIO
927fee2f-ff24-4b83-85f9-bc7c5b20fae3,32aafa16-c4cb-4dce-b6d3-bacbbf32136d,7829044c-ff69-4867-9ef3-086056e276b6,,,,,FECHA TOMA DE RAZON DE CGR
eac5c3c2-1bc4-46c4-affd-367b6ff5c27e,32aafa16-c4cb-4dce-b6d3-bacbbf32136d,b834311e-a83e-4167-88f3-148814355189,352,,EXENTA,5/24/2024, Nº RESOLUCION 
101d8640-464e-4ca5-85cc-0bf935464151,291975f9-f590-48f4-814e-99675ec3de76,b834311e-a83e-4167-88f3-148814355189,320,,EXENTA,, Nº RESOLUCION 
5dbd7948-ca8f-4b6a-b366-3d13bd5f667f,f9ef9106-0756-41bc-a74d-b41822e4aad8,95b43090-bfe5-41ac-b905-1b06d0490d6e,633,,,4/23/2024,Nº OFICIO ENVIA CONVENIO
3370ca92-6e48-479b-a1a5-04415e84a832,f9ef9106-0756-41bc-a74d-b41822e4aad8,7829044c-ff69-4867-9ef3-086056e276b6,,,,,FECHA TOMA DE RAZON DE CGR
da06a64a-9455-4331-bc42-b7bd830623f5,f9ef9106-0756-41bc-a74d-b41822e4aad8,b834311e-a83e-4167-88f3-148814355189,265,,EXENTA,4/23/2024, Nº RESOLUCION 
94995068-6fea-4388-b1ec-6c51f3cfbbe3,ecd0033b-e188-492e-86f1-12a4330a4ecc,95b43090-bfe5-41ac-b905-1b06d0490d6e,615,,,4/22/2024,Nº OFICIO ENVIA CONVENIO
7a3b0770-c2ef-42ce-b41a-2aa5d6024e1c,ecd0033b-e188-492e-86f1-12a4330a4ecc,b834311e-a83e-4167-88f3-148814355189,255,,EXENTA,4/22/2024, Nº RESOLUCION 
bb17ce36-aea5-426a-b0ad-c14369e96a0d,6a7d5279-a454-419f-b713-24e29b0386c9,7829044c-ff69-4867-9ef3-086056e276b6,5/27/2024,,,5/27/2024,FECHA TOMA DE RAZON DE CGR
70b75ef8-35e0-4665-8774-b605e83155ce,6a7d5279-a454-419f-b713-24e29b0386c9,b834311e-a83e-4167-88f3-148814355189,35,,AFECTA,, Nº RESOLUCION 
aa963bb6-e82e-44b1-9070-1ef5029ef14e,31bac930-2120-4454-882d-843ed60d56f9,b834311e-a83e-4167-88f3-148814355189,31,,,, Nº RESOLUCION 
0b5409c2-31bb-4db1-9a6a-f7dd1e8c086e,c4eedd04-6d4d-4b4f-8b65-cde34d601f90,95b43090-bfe5-41ac-b905-1b06d0490d6e,616,,,4/22/2024,Nº OFICIO ENVIA CONVENIO
9a05291b-3fa5-4dfd-b580-d58c180738ae,c4eedd04-6d4d-4b4f-8b65-cde34d601f90,7829044c-ff69-4867-9ef3-086056e276b6,,,,,FECHA TOMA DE RAZON DE CGR
79a027f8-eb26-4aa6-9c86-038f0923f992,c4eedd04-6d4d-4b4f-8b65-cde34d601f90,b834311e-a83e-4167-88f3-148814355189,228,,EXENTA,4/22/2024, Nº RESOLUCION 
02a5925e-4dbc-472f-903c-364b38e23813,2c888a25-ec6a-4591-b16f-c126d719be28,95b43090-bfe5-41ac-b905-1b06d0490d6e,712,2024-10-05T00:00:00,,,Nº OFICIO ENVIA CONVENIO
6743c699-c0aa-4464-9d76-dd394253011e,2c888a25-ec6a-4591-b16f-c126d719be28,7829044c-ff69-4867-9ef3-086056e276b6,,,,,FECHA TOMA DE RAZON DE CGR
5bdbfcc8-b9fb-4673-9d86-aab6824a087e,2c888a25-ec6a-4591-b16f-c126d719be28,b834311e-a83e-4167-88f3-148814355189,303,2024-10-05T00:00:00,EXENTA,, Nº RESOLUCION 
6bc925ba-7045-47e2-9099-ecffbbc669c4,15e574b2-8731-49ec-a9c4-5c5a174f7cdc,95b43090-bfe5-41ac-b905-1b06d0490d6e,686,2024-07-05T00:00:00,,,Nº OFICIO ENVIA CONVENIO
efe283e9-5ff1-4a24-8681-a6c156c15612,15e574b2-8731-49ec-a9c4-5c5a174f7cdc,7829044c-ff69-4867-9ef3-086056e276b6,,,,,FECHA TOMA DE RAZON DE CGR
faadc4eb-38b3-41e6-9f86-69d4ecf3d3db,15e574b2-8731-49ec-a9c4-5c5a174f7cdc,b834311e-a83e-4167-88f3-148814355189,284,2024-07-05T00:00:00,EXENTA,, Nº RESOLUCION 
1f0d5a66-7b86-4f06-87b8-bc758da720a8,25bfa9ee-e3bb-4b0c-82c1-9b24711574fd,7829044c-ff69-4867-9ef3-086056e276b6,,,,,FECHA TOMA DE RAZON DE CGR
b6b81495-7bf6-4e56-aa18-06e7f9c18ada,25bfa9ee-e3bb-4b0c-82c1-9b24711574fd,b834311e-a83e-4167-88f3-148814355189,282,,EXENTA,, Nº RESOLUCION 
ec637ab9-0b58-4f0a-a091-047e3b5d43e8,aaeaf68a-03bf-4054-9bd3-322ff793567e,7829044c-ff69-4867-9ef3-086056e276b6,5/6/2024,2024-06-05T00:00:00,,,FECHA TOMA DE RAZON DE CGR
bce443d4-2535-4c92-a536-34764adb3af5,aaeaf68a-03bf-4054-9bd3-322ff793567e,b834311e-a83e-4167-88f3-148814355189,23,,AFECTA,, Nº RESOLUCION 
009a13cf-480b-4fe1-be8e-c530d235309c,12b38b3a-fe2b-43cb-97be-355797940213,95b43090-bfe5-41ac-b905-1b06d0490d6e,872,2024-06-13T00:00:00,,,Nº OFICIO ENVIA CONVENIO
1904ca0a-2b2b-49fa-84c7-648e63442903,12b38b3a-fe2b-43cb-97be-355797940213,b834311e-a83e-4167-88f3-148814355189,45,2024-06-13T00:00:00,AFECTA,, Nº RESOLUCION 
67408eda-7979-4c8e-adfa-1631fafbe25c,e9d151cc-ad22-4a95-a042-a69a282d6d16,b834311e-a83e-4167-88f3-148814355189,70,,AFECTA,, Nº RESOLUCION 
93d11124-b98c-4bd8-be99-9d5c424b88df,b4ecac87-3a4d-4628-b074-bee24290a892,b834311e-a83e-4167-88f3-148814355189,67,,AFECTA,, Nº RESOLUCION 
5f8b8eab-4ee4-4cfa-86a4-b248263d0892,0d444b3d-2cd9-4568-87bb-0a458cecae7a,ef4bda38-f2b2-4c54-ac7a-6d0d3b52cb04,907/2024,2024-03-21T00:00:00,,,Nº RES INCORPORA/ CERT CORE
0be4102c-c215-4ba2-b6ce-a3ccb1e50fc5,0d444b3d-2cd9-4568-87bb-0a458cecae7a,f5dca104-f319-43d3-be4d-41e6ff8a1a02,46,2024-04-16T00:00:00,,,Nº RES CREA ASIGNACIÓN
6c44d485-4c93-45d8-b973-076fc82e3a9c,0d444b3d-2cd9-4568-87bb-0a458cecae7a,d5a008d4-cdd7-4ca2-b14e-484c6011385f,1,2024-06-12T00:00:00,AFECTA,,Nº RES APRUEBA CONVENIO 
f56e96a8-87dc-4f51-9d7f-03a5e4830166,0d444b3d-2cd9-4568-87bb-0a458cecae7a,7829044c-ff69-4867-9ef3-086056e276b6,08/08/2024,2024-08-08T00:00:00,,,FECHA TOMA DE RAZON DE CGR
1583afe9-0d8e-4202-a4c8-75d19f8c5ce6,0d444b3d-2cd9-4568-87bb-0a458cecae7a,70f8df47-02e5-4fdc-8201-572c25e54089,RES EN TRAMITE,,,RES EN TRAMITE,Nº RES REFERENTE TECNICO
a065eead-a4c7-4ff3-8989-9a57364c44cb,d307fa39-7a88-44e2-b221-6a67048a3ba3,ef4bda38-f2b2-4c54-ac7a-6d0d3b52cb04,963,2023-09-05T00:00:00,,,Nº RES INCORPORA/ CERT CORE
829582d2-d05b-4b27-9cd9-13c841e06f4c,d307fa39-7a88-44e2-b221-6a67048a3ba3,f5dca104-f319-43d3-be4d-41e6ff8a1a02,963,2023-09-05T00:00:00,,,Nº RES CREA ASIGNACIÓN
c3b2f446-3b1d-41fe-be9c-7ac32dfe4c40,d307fa39-7a88-44e2-b221-6a67048a3ba3,d5a008d4-cdd7-4ca2-b14e-484c6011385f,7,2024-02-14T00:00:00,AFECTA,,Nº RES APRUEBA CONVENIO 
18dc59e4-0be9-41b0-8668-2b67ea8308ad,d307fa39-7a88-44e2-b221-6a67048a3ba3,7829044c-ff69-4867-9ef3-086056e276b6,27/02/2024,2024-02-27T00:00:00,,,FECHA TOMA DE RAZON DE CGR
50d14763-4503-4bbe-8769-7019e0f9d42a,d307fa39-7a88-44e2-b221-6a67048a3ba3,70f8df47-02e5-4fdc-8201-572c25e54089,312/09.05.2024,,,312/09.05.2024,Nº RES REFERENTE TECNICO
89d22e72-bdad-44a4-a429-2960d0566efd,0ea84d4e-1510-4861-80ca-ad328f03ff7d,ef4bda38-f2b2-4c54-ac7a-6d0d3b52cb04,963,2023-09-05T00:00:00,,,Nº RES INCORPORA/ CERT CORE
7257cc69-da40-45d1-aa1d-564bf2f7faa5,0ea84d4e-1510-4861-80ca-ad328f03ff7d,f5dca104-f319-43d3-be4d-41e6ff8a1a02,963,2023-09-05T00:00:00,,,Nº RES CREA ASIGNACIÓN
f12ee140-9456-4d30-ae61-820c84bf2ded,0ea84d4e-1510-4861-80ca-ad328f03ff7d,d5a008d4-cdd7-4ca2-b14e-484c6011385f,8,2024-02-14T00:00:00,AFECTA,,Nº RES APRUEBA CONVENIO 
70c86b67-4505-406c-984a-39b55ee7efd0,0ea84d4e-1510-4861-80ca-ad328f03ff7d,7829044c-ff69-4867-9ef3-086056e276b6,28/02/2024,2024-02-28T00:00:00,,,FECHA TOMA DE RAZON DE CGR
9a4281c9-69b4-4afd-9420-a76df1b2ba3d,0ea84d4e-1510-4861-80ca-ad328f03ff7d,70f8df47-02e5-4fdc-8201-572c25e54089,312/09.05.2024,,,312/09.05.2024,Nº RES REFERENTE TECNICO
10c07ef7-9aec-4e8e-8abe-fb80e9978d88,3188e6a4-2fa3-4f28-a590-ba30ee7ff0f7,ef4bda38-f2b2-4c54-ac7a-6d0d3b52cb04,,,,,Nº RES INCORPORA/ CERT CORE
4fa8f8f6-bc57-4345-b225-6c3ad947b22d,3188e6a4-2fa3-4f28-a590-ba30ee7ff0f7,f5dca104-f319-43d3-be4d-41e6ff8a1a02,10,2024-01-10T00:00:00,,,Nº RES CREA ASIGNACIÓN
60895e7e-d5db-47c1-a92a-d02f385caa41,3188e6a4-2fa3-4f28-a590-ba30ee7ff0f7,d5a008d4-cdd7-4ca2-b14e-484c6011385f,16,2024-03-22T00:00:00,AFECTA,,Nº RES APRUEBA CONVENIO 
ad586b5f-6248-445e-b957-3281fc7d08b8,3188e6a4-2fa3-4f28-a590-ba30ee7ff0f7,7829044c-ff69-4867-9ef3-086056e276b6,05-04-2024,2024-04-05T00:00:00,,,FECHA TOMA DE RAZON DE CGR
6e02759d-a196-430d-a6b1-bc263b57af24,3188e6a4-2fa3-4f28-a590-ba30ee7ff0f7,70f8df47-02e5-4fdc-8201-572c25e54089,436/24.06.2024,,,436/24.06.2024,Nº RES REFERENTE TECNICO
f04d7892-3ede-42fc-bfba-5fc060707967,fbc616cb-a6be-40ae-8701-8b94958095c6,ef4bda38-f2b2-4c54-ac7a-6d0d3b52cb04,838/2023,2023-12-21T00:00:00,,,Nº RES INCORPORA/ CERT CORE
601e22a1-a023-45d1-9196-318989224bc2,fbc616cb-a6be-40ae-8701-8b94958095c6,f5dca104-f319-43d3-be4d-41e6ff8a1a02,6,2024-02-13T00:00:00,,,Nº RES CREA ASIGNACIÓN
b9155e8a-bbe4-44f8-8dc5-92f3cb796072,fbc616cb-a6be-40ae-8701-8b94958095c6,d5a008d4-cdd7-4ca2-b14e-484c6011385f,18,2024-03-28T00:00:00,AFECTA,,Nº RES APRUEBA CONVENIO 
b8c94185-20f6-4b7e-a265-c96957ce9c76,fbc616cb-a6be-40ae-8701-8b94958095c6,95b43090-bfe5-41ac-b905-1b06d0490d6e,581,,,4/17/2024,Nº OFICIO ENVIA CONVENIO
c61a675b-0345-45cb-9acb-9f09dd4bbfa8,fbc616cb-a6be-40ae-8701-8b94958095c6,7829044c-ff69-4867-9ef3-086056e276b6,15/04/2024,2024-04-15T00:00:00,,,FECHA TOMA DE RAZON DE CGR
4bcb19ce-f036-4aa1-82ea-42bf9a694977,fbc616cb-a6be-40ae-8701-8b94958095c6,70f8df47-02e5-4fdc-8201-572c25e54089,317/10.05.2024,,,317/10.05.2024,Nº RES REFERENTE TECNICO
cae38e81-70d0-4841-b8d9-6dd7d8803b44,fbc616cb-a6be-40ae-8701-8b94958095c6,b834311e-a83e-4167-88f3-148814355189,,,,4/17/2024,FECHA OFICIO ENVIA CONVENIO
13044a24-c980-4e34-8382-604a596cc540,1848eb65-1862-4b49-a96d-ca3b38471894,ef4bda38-f2b2-4c54-ac7a-6d0d3b52cb04,648/2023,2023-04-14T00:00:00,,,Nº RES INCORPORA/ CERT CORE
e9257f16-b5a1-4b51-8d9a-6c7b2fd74271,1848eb65-1862-4b49-a96d-ca3b38471894,f5dca104-f319-43d3-be4d-41e6ff8a1a02,6,2024-02-13T00:00:00,,,Nº RES CREA ASIGNACIÓN
7f344202-f768-4eb0-ac4e-9c569b7ea1ad,1848eb65-1862-4b49-a96d-ca3b38471894,d5a008d4-cdd7-4ca2-b14e-484c6011385f,20,2024-04-08T00:00:00,AFECTA,,Nº RES APRUEBA CONVENIO 
ffc7d515-7f44-4cbd-9f76-4c6e24e3ce53,1848eb65-1862-4b49-a96d-ca3b38471894,95b43090-bfe5-41ac-b905-1b06d0490d6e,687,2024-05-07T00:00:00,,,Nº OFICIO ENVIA CONVENIO
b34ae615-7f55-40cb-8ec7-39bfd08743f9,1848eb65-1862-4b49-a96d-ca3b38471894,7829044c-ff69-4867-9ef3-086056e276b6,30-04-2024,2024-04-30T00:00:00,,,FECHA TOMA DE RAZON DE CGR
8fa665de-21f7-4332-be70-6ad854ba9661,1848eb65-1862-4b49-a96d-ca3b38471894,70f8df47-02e5-4fdc-8201-572c25e54089,317/10.05.2024,,,317/10.05.2024,Nº RES REFERENTE TECNICO
48f94e79-b58e-4da0-9c7d-0c437d16830d,1848eb65-1862-4b49-a96d-ca3b38471894,b834311e-a83e-4167-88f3-148814355189,,2024-05-07T00:00:00,,,FECHA OFICIO ENVIA CONVENIO
fedd1a60-049e-4e35-b694-a0977b123bd4,4d7debc4-decc-42b9-9771-3385bf4a0c7f,ef4bda38-f2b2-4c54-ac7a-6d0d3b52cb04,842/2023,2023-12-21T00:00:00,,,Nº RES INCORPORA/ CERT CORE
80755da2-e481-4305-b4d5-00e80d364d44,4d7debc4-decc-42b9-9771-3385bf4a0c7f,f5dca104-f319-43d3-be4d-41e6ff8a1a02,6,2024-02-13T00:00:00,,,Nº RES CREA ASIGNACIÓN
edf21c65-6c39-40df-9e49-7b5b8e99dc9b,4d7debc4-decc-42b9-9771-3385bf4a0c7f,d5a008d4-cdd7-4ca2-b14e-484c6011385f,24,2024-04-15T00:00:00,AFECTA,,Nº RES APRUEBA CONVENIO 
c9504b31-bf9a-4ee0-b653-206f465ef812,4d7debc4-decc-42b9-9771-3385bf4a0c7f,95b43090-bfe5-41ac-b905-1b06d0490d6e,734,,,5/14/2024,Nº OFICIO ENVIA CONVENIO
c6eca35e-d409-4881-9ae2-539c97d387c3,4d7debc4-decc-42b9-9771-3385bf4a0c7f,7829044c-ff69-4867-9ef3-086056e276b6,10/05/2024,2024-05-10T00:00:00,,,FECHA TOMA DE RAZON DE CGR
c37d19e8-1977-4b3d-85b9-4cddd0b283cc,4d7debc4-decc-42b9-9771-3385bf4a0c7f,b834311e-a83e-4167-88f3-148814355189,,,,5/14/2024,FECHA OFICIO ENVIA CONVENIO
76f1dc3a-890c-4225-9be0-dab5a625c86a,f1f5ee2e-48d7-4423-8f56-29b354d2df94,ef4bda38-f2b2-4c54-ac7a-6d0d3b52cb04,796/2023,2023-11-06T00:00:00,,,Nº RES INCORPORA/ CERT CORE
f50a3bbd-db17-44b6-8e08-65edefaf37ee,f1f5ee2e-48d7-4423-8f56-29b354d2df94,f5dca104-f319-43d3-be4d-41e6ff8a1a02,6,2024-02-13T00:00:00,,,Nº RES CREA ASIGNACIÓN
b30cb59e-380b-49f9-bd77-874aa12f4736,f1f5ee2e-48d7-4423-8f56-29b354d2df94,d5a008d4-cdd7-4ca2-b14e-484c6011385f,25,2024-04-15T00:00:00,AFECTA,,Nº RES APRUEBA CONVENIO 
b4516be7-65b0-4a35-babd-a08a526e8846,f1f5ee2e-48d7-4423-8f56-29b354d2df94,95b43090-bfe5-41ac-b905-1b06d0490d6e,692,2024-07-05T00:00:00,,,Nº OFICIO ENVIA CONVENIO
5565fc86-7187-4bae-93e9-753e15e827c6,f1f5ee2e-48d7-4423-8f56-29b354d2df94,7829044c-ff69-4867-9ef3-086056e276b6,02/05/2024,2024-05-02T00:00:00,,,FECHA TOMA DE RAZON DE CGR
c4ae8804-f73d-4fbb-a262-2757a912991f,f1f5ee2e-48d7-4423-8f56-29b354d2df94,b834311e-a83e-4167-88f3-148814355189,,2024-07-05T00:00:00,,,FECHA OFICIO ENVIA CONVENIO
79f1bb42-b180-46f3-95b0-e0e7f73fd43e,ee1099ed-229f-44f1-95ac-5fe899bd5900,ef4bda38-f2b2-4c54-ac7a-6d0d3b52cb04,915,2023-08-22T00:00:00,,,Nº RES INCORPORA/ CERT CORE
0136be6d-fea3-40ef-bab4-067773cc672b,ee1099ed-229f-44f1-95ac-5fe899bd5900,f5dca104-f319-43d3-be4d-41e6ff8a1a02,915,2023-08-22T00:00:00,,,Nº RES CREA ASIGNACIÓN
cceb2b25-4274-4673-900f-1b6bf05031ca,ee1099ed-229f-44f1-95ac-5fe899bd5900,d5a008d4-cdd7-4ca2-b14e-484c6011385f,26,2024-04-15T00:00:00,AFECTA,,Nº RES APRUEBA CONVENIO 
4c7770e6-6344-4ef4-be39-3c9be608b57f,ee1099ed-229f-44f1-95ac-5fe899bd5900,95b43090-bfe5-41ac-b905-1b06d0490d6e,740,,,5/15/2024,Nº OFICIO ENVIA CONVENIO
6f65f6b8-0f2b-48c8-8b07-764020cf08c2,ee1099ed-229f-44f1-95ac-5fe899bd5900,7829044c-ff69-4867-9ef3-086056e276b6,09/05/2024,2024-05-09T00:00:00,,,FECHA TOMA DE RAZON DE CGR
a6fdbcfe-01a4-4e18-886b-b21381a49fa8,ee1099ed-229f-44f1-95ac-5fe899bd5900,70f8df47-02e5-4fdc-8201-572c25e54089,312/09.05.2024,,,312/09.05.2024,Nº RES REFERENTE TECNICO
8f1392bd-195c-4157-91dd-cb5870c877e0,ee1099ed-229f-44f1-95ac-5fe899bd5900,b834311e-a83e-4167-88f3-148814355189,,,,5/15/2024,FECHA OFICIO ENVIA CONVENIO
d2b33339-4418-4a61-99fd-bb8a9bf03428,8f252b30-6169-46f7-904a-d3953d9b24b7,ef4bda38-f2b2-4c54-ac7a-6d0d3b52cb04,136,2024-03-22T00:00:00,,,Nº RES INCORPORA/ CERT CORE
601aaf10-7201-4c84-ae43-c23d3fb76d33,8f252b30-6169-46f7-904a-d3953d9b24b7,f5dca104-f319-43d3-be4d-41e6ff8a1a02,136,2024-03-22T00:00:00,,,Nº RES CREA ASIGNACIÓN
28b29523-b0e2-4d90-9b02-1c28ded04b1e,8f252b30-6169-46f7-904a-d3953d9b24b7,d5a008d4-cdd7-4ca2-b14e-484c6011385f,27,2024-04-15T00:00:00,AFECTA,,Nº RES APRUEBA CONVENIO 
c5506efc-9e15-4a35-ba59-1f6f324be971,8f252b30-6169-46f7-904a-d3953d9b24b7,95b43090-bfe5-41ac-b905-1b06d0490d6e,735,,,5/14/2024,Nº OFICIO ENVIA CONVENIO
3ac7678c-3a88-49a3-ae5a-f1d4855c3f0a,8f252b30-6169-46f7-904a-d3953d9b24b7,7829044c-ff69-4867-9ef3-086056e276b6,09/05/2024,2024-05-09T00:00:00,,,FECHA TOMA DE RAZON DE CGR
8ddd189b-e7a1-425e-bffc-286f14fdcd6d,8f252b30-6169-46f7-904a-d3953d9b24b7,b834311e-a83e-4167-88f3-148814355189,,,,5/14/2024,FECHA OFICIO ENVIA CONVENIO
c72481b0-3fb4-46f2-af72-7e2864d2a96d,6ba86ac2-c720-4cff-ae94-cf29468a75aa,ef4bda38-f2b2-4c54-ac7a-6d0d3b52cb04,143,2024-03-26T00:00:00,,,Nº RES INCORPORA/ CERT CORE
d62d37d5-d45a-4880-953e-74d6906b9802,6ba86ac2-c720-4cff-ae94-cf29468a75aa,f5dca104-f319-43d3-be4d-41e6ff8a1a02,6,2024-02-13T00:00:00,,,Nº RES CREA ASIGNACIÓN
fdc8fae4-9213-490a-b139-d3f1b60b7602,6ba86ac2-c720-4cff-ae94-cf29468a75aa,d5a008d4-cdd7-4ca2-b14e-484c6011385f,28,2024-04-16T00:00:00,AFECTA,,Nº RES APRUEBA CONVENIO 
aa8923ab-1e55-4d6d-a56f-55109e4df395,6ba86ac2-c720-4cff-ae94-cf29468a75aa,95b43090-bfe5-41ac-b905-1b06d0490d6e,666,2024-03-05T00:00:00,,,Nº OFICIO ENVIA CONVENIO
d9710899-7fed-44bb-9915-73860aaaf441,6ba86ac2-c720-4cff-ae94-cf29468a75aa,7829044c-ff69-4867-9ef3-086056e276b6,02/05/2024,2024-05-02T00:00:00,,,FECHA TOMA DE RAZON DE CGR
c3f4daab-c64d-4d52-81e9-5609f188d4c1,6ba86ac2-c720-4cff-ae94-cf29468a75aa,70f8df47-02e5-4fdc-8201-572c25e54089,317/10.05.2024,,,317/10.05.2024,Nº RES REFERENTE TECNICO
bfccb67f-1288-4a60-bf46-0a3bbc358d05,6ba86ac2-c720-4cff-ae94-cf29468a75aa,b834311e-a83e-4167-88f3-148814355189,,2024-03-05T00:00:00,,,FECHA OFICIO ENVIA CONVENIO
01f649a4-c31a-4096-a9ff-816331b411a0,d01d29f9-294d-4b74-a802-48e5679f33f1,ef4bda38-f2b2-4c54-ac7a-6d0d3b52cb04,,,,,Nº RES INCORPORA/ CERT CORE
cae68d98-05c1-4658-ba00-4a110d7b7a9a,d01d29f9-294d-4b74-a802-48e5679f33f1,f5dca104-f319-43d3-be4d-41e6ff8a1a02,109,2023-08-21T00:00:00,,,Nº RES CREA ASIGNACIÓN
d8a5fe3b-3f3f-4bb3-8499-aa30cdda1924,d01d29f9-294d-4b74-a802-48e5679f33f1,d5a008d4-cdd7-4ca2-b14e-484c6011385f,32,2024-04-22T00:00:00,AFECTA,,Nº RES APRUEBA CONVENIO 
cc5ec450-b08f-4627-8a7c-40372df4937f,d01d29f9-294d-4b74-a802-48e5679f33f1,95b43090-bfe5-41ac-b905-1b06d0490d6e,620,2024-04-22T00:00:00,,,Nº OFICIO ENVIA CONVENIO
7ae8c349-efa4-4c76-a178-21a802b6985a,d01d29f9-294d-4b74-a802-48e5679f33f1,7829044c-ff69-4867-9ef3-086056e276b6,14-05-2024,2024-05-14T00:00:00,,,FECHA TOMA DE RAZON DE CGR
70ab45e8-86d3-4b0a-ad57-c305660b8133,d01d29f9-294d-4b74-a802-48e5679f33f1,b834311e-a83e-4167-88f3-148814355189,,2024-04-22T00:00:00,,,FECHA OFICIO ENVIA CONVENIO
632d947c-e5b7-4eb2-ba0c-e05ba2a00e8b,910a96dc-b155-49b9-ae88-40e2a8ba49ac,ef4bda38-f2b2-4c54-ac7a-6d0d3b52cb04,142,2024-03-26T00:00:00,,,Nº RES INCORPORA/ CERT CORE
f39cd8d5-0d8e-4164-9ff3-aa5109dd86c2,910a96dc-b155-49b9-ae88-40e2a8ba49ac,f5dca104-f319-43d3-be4d-41e6ff8a1a02,6,2024-02-13T00:00:00,,,Nº RES CREA ASIGNACIÓN
84be9eaf-d549-479f-8f18-ea0033e5099f,910a96dc-b155-49b9-ae88-40e2a8ba49ac,d5a008d4-cdd7-4ca2-b14e-484c6011385f,34,2024-04-29T00:00:00,AFECTA,,Nº RES APRUEBA CONVENIO 
06dfec33-72ef-4612-a6f6-1b3d0f47fe84,910a96dc-b155-49b9-ae88-40e2a8ba49ac,95b43090-bfe5-41ac-b905-1b06d0490d6e,750,,,5/16/2024,Nº OFICIO ENVIA CONVENIO
eafbebb9-28c1-4913-8c32-f4c4d57c2052,910a96dc-b155-49b9-ae88-40e2a8ba49ac,7829044c-ff69-4867-9ef3-086056e276b6,14/05/2024,2024-05-14T00:00:00,,,FECHA TOMA DE RAZON DE CGR
754c2e4d-134e-423c-bc60-8d18bf7cbda7,910a96dc-b155-49b9-ae88-40e2a8ba49ac,b834311e-a83e-4167-88f3-148814355189,,,,5/16/2024,FECHA OFICIO ENVIA CONVENIO
c796e96d-3fd2-442b-9fbc-c0e768d261b5,cc7feda6-456f-4575-b401-f0bebd9ec436,ef4bda38-f2b2-4c54-ac7a-6d0d3b52cb04,143,2024-03-26T00:00:00,,,Nº RES INCORPORA/ CERT CORE
04217b55-d3cc-4c2c-9b3b-7f561fa83b6e,cc7feda6-456f-4575-b401-f0bebd9ec436,f5dca104-f319-43d3-be4d-41e6ff8a1a02,19,2024-04-01T00:00:00,,,Nº RES CREA ASIGNACIÓN
3df21c12-989c-49dd-9263-52e58754b869,cc7feda6-456f-4575-b401-f0bebd9ec436,d5a008d4-cdd7-4ca2-b14e-484c6011385f,39,2024-05-10T00:00:00,AFECTA,,Nº RES APRUEBA CONVENIO 
d30cedbd-1a24-41c4-88a1-d56fe10bda78,cc7feda6-456f-4575-b401-f0bebd9ec436,95b43090-bfe5-41ac-b905-1b06d0490d6e,871,2024-06-13T00:00:00,,,Nº OFICIO ENVIA CONVENIO
4578cf94-400f-4a07-b30c-65b227bebf09,cc7feda6-456f-4575-b401-f0bebd9ec436,7829044c-ff69-4867-9ef3-086056e276b6,10/06/2024,2024-06-10T00:00:00,,,FECHA TOMA DE RAZON DE CGR
e150209a-6880-4014-bdfa-6928b35f4184,cc7feda6-456f-4575-b401-f0bebd9ec436,b834311e-a83e-4167-88f3-148814355189,,2024-06-13T00:00:00,,,FECHA OFICIO ENVIA CONVENIO
7fec1e62-cbc8-40a2-bb87-b7b257c516d7,9fe6c1a3-e728-42f1-8e23-7a8e0219f5f6,ef4bda38-f2b2-4c54-ac7a-6d0d3b52cb04,775,2023-07-11T00:00:00,,,Nº RES INCORPORA/ CERT CORE
7b087b40-4f4f-46c9-891a-76a511fc13d9,9fe6c1a3-e728-42f1-8e23-7a8e0219f5f6,f5dca104-f319-43d3-be4d-41e6ff8a1a02,775,2023-07-11T00:00:00,,,Nº RES CREA ASIGNACIÓN
53262cc5-d20c-41e6-aa7b-5e03d04dac8c,9fe6c1a3-e728-42f1-8e23-7a8e0219f5f6,d5a008d4-cdd7-4ca2-b14e-484c6011385f,898,2023-08-17T00:00:00,EXENTA,,Nº RES APRUEBA CONVENIO 
a045beb4-0289-4896-a705-d5b01e1e458e,9fe6c1a3-e728-42f1-8e23-7a8e0219f5f6,7829044c-ff69-4867-9ef3-086056e276b6,,,,,FECHA TOMA DE RAZON DE CGR
dfa42b38-f9f6-48dd-8c9b-a9b608851d56,9fe6c1a3-e728-42f1-8e23-7a8e0219f5f6,70f8df47-02e5-4fdc-8201-572c25e54089,279/02.05.2024,,,279/02.05.2024,Nº RES REFERENTE TECNICO
7eb97a3c-d3a4-4f98-93b8-1d196d894c1f,ee2d3191-36eb-4614-8062-f620410bc57c,ef4bda38-f2b2-4c54-ac7a-6d0d3b52cb04,775,2023-07-11T00:00:00,,,Nº RES INCORPORA/ CERT CORE
013f1856-ceb5-4e9c-86ab-519df64183c0,ee2d3191-36eb-4614-8062-f620410bc57c,f5dca104-f319-43d3-be4d-41e6ff8a1a02,775,2023-07-11T00:00:00,,,Nº RES CREA ASIGNACIÓN
e2849632-7c45-4faf-90d5-7d4ac875696c,ee2d3191-36eb-4614-8062-f620410bc57c,d5a008d4-cdd7-4ca2-b14e-484c6011385f,897,2023-08-17T00:00:00,EXENTA,,Nº RES APRUEBA CONVENIO 
8a94e397-7db2-4a00-9095-bc33dac35e8d,ee2d3191-36eb-4614-8062-f620410bc57c,7829044c-ff69-4867-9ef3-086056e276b6,,,,,FECHA TOMA DE RAZON DE CGR
3fa7961a-0731-429a-ae9b-73f712cf025c,ee2d3191-36eb-4614-8062-f620410bc57c,70f8df47-02e5-4fdc-8201-572c25e54089,279/02.05.2024,,,279/02.05.2024,Nº RES REFERENTE TECNICO
4737f406-db70-4cb8-b8d1-5771269d1f14,86bfd363-6b4d-4c2a-b68f-42ce4d58f68e,ef4bda38-f2b2-4c54-ac7a-6d0d3b52cb04,775,2023-07-11T00:00:00,,,Nº RES INCORPORA/ CERT CORE
b9c45c09-76d8-452c-a92a-94dfa2702ad8,86bfd363-6b4d-4c2a-b68f-42ce4d58f68e,f5dca104-f319-43d3-be4d-41e6ff8a1a02,775,2023-07-11T00:00:00,,,Nº RES CREA ASIGNACIÓN
eb17e8a2-eaf9-4b12-bafe-59470c115356,86bfd363-6b4d-4c2a-b68f-42ce4d58f68e,d5a008d4-cdd7-4ca2-b14e-484c6011385f,908,2023-08-18T00:00:00,EXENTA,,Nº RES APRUEBA CONVENIO 
872a085f-f43a-44bb-bb70-950901aef8e2,86bfd363-6b4d-4c2a-b68f-42ce4d58f68e,7829044c-ff69-4867-9ef3-086056e276b6,,,,,FECHA TOMA DE RAZON DE CGR
30f1f81a-6011-4d38-b4bc-1af77fb790b4,86bfd363-6b4d-4c2a-b68f-42ce4d58f68e,70f8df47-02e5-4fdc-8201-572c25e54089,1291/19.12.2023,,,1291/19.12.2023,Nº RES REFERENTE TECNICO
bd0ca493-a99d-4ff0-989f-2c04695b415c,17545cfa-25de-4b96-a8c9-bfced1c01df0,ef4bda38-f2b2-4c54-ac7a-6d0d3b52cb04,775,2023-07-11T00:00:00,,,Nº RES INCORPORA/ CERT CORE
2a614479-bb80-4396-bcf0-f69e6e8afab7,17545cfa-25de-4b96-a8c9-bfced1c01df0,f5dca104-f319-43d3-be4d-41e6ff8a1a02,775,2023-07-11T00:00:00,,,Nº RES CREA ASIGNACIÓN
2682c676-6f31-4d36-9a8c-116580ff485a,17545cfa-25de-4b96-a8c9-bfced1c01df0,d5a008d4-cdd7-4ca2-b14e-484c6011385f,986,2023-09-21T00:00:00,EXENTA,,Nº RES APRUEBA CONVENIO 
12535a1d-4285-4313-a343-692c606ae9d3,17545cfa-25de-4b96-a8c9-bfced1c01df0,7829044c-ff69-4867-9ef3-086056e276b6,,,,,FECHA TOMA DE RAZON DE CGR
a97b99c6-a508-4559-afa1-e4a0c9819c1e,17545cfa-25de-4b96-a8c9-bfced1c01df0,70f8df47-02e5-4fdc-8201-572c25e54089,1291/19.12.2023,,,1291/19.12.2023,Nº RES REFERENTE TECNICO
8ab30773-c3b7-4b0d-8d37-f8123fc85570,19d3ae18-25cf-42c0-815c-ac54a1fe236f,ef4bda38-f2b2-4c54-ac7a-6d0d3b52cb04,775,2023-07-11T00:00:00,,,Nº RES INCORPORA/ CERT CORE
aea61127-6a2f-4667-9965-e0e9ff46d9b5,19d3ae18-25cf-42c0-815c-ac54a1fe236f,f5dca104-f319-43d3-be4d-41e6ff8a1a02,775,2023-07-11T00:00:00,,,Nº RES CREA ASIGNACIÓN
a466739e-5dac-4cb3-bf70-afb331b1bb73,19d3ae18-25cf-42c0-815c-ac54a1fe236f,d5a008d4-cdd7-4ca2-b14e-484c6011385f,909,2023-08-18T00:00:00,EXENTA,,Nº RES APRUEBA CONVENIO 
bf7c24b0-8cad-41a2-a877-aa3e71efb405,19d3ae18-25cf-42c0-815c-ac54a1fe236f,7829044c-ff69-4867-9ef3-086056e276b6,,,,,FECHA TOMA DE RAZON DE CGR
a40ffbb5-57e0-4a70-858d-3dfec6c50f3d,19d3ae18-25cf-42c0-815c-ac54a1fe236f,70f8df47-02e5-4fdc-8201-572c25e54089,1291/19.12.2023,,,1291/19.12.2023,Nº RES REFERENTE TECNICO
cdcfc079-9eb2-4636-85dd-9493ed17a115,de3b2247-0249-4a69-b74a-d6ccd217484b,ef4bda38-f2b2-4c54-ac7a-6d0d3b52cb04,775,2023-07-11T00:00:00,,,Nº RES INCORPORA/ CERT CORE
b5d137a9-0514-47e5-ab4b-0a575e937206,de3b2247-0249-4a69-b74a-d6ccd217484b,f5dca104-f319-43d3-be4d-41e6ff8a1a02,775,2023-07-11T00:00:00,,,Nº RES CREA ASIGNACIÓN
3624cb24-3ab8-408d-8ada-1d59cc3b255f,de3b2247-0249-4a69-b74a-d6ccd217484b,d5a008d4-cdd7-4ca2-b14e-484c6011385f,842,2023-08-01T00:00:00,EXENTA,,Nº RES APRUEBA CONVENIO 
00e1af84-7e1d-4cd6-bc5f-c4c22bf4e5f2,de3b2247-0249-4a69-b74a-d6ccd217484b,7829044c-ff69-4867-9ef3-086056e276b6,,,,,FECHA TOMA DE RAZON DE CGR
198bbc38-6254-4fe0-9600-6232f7046e61,de3b2247-0249-4a69-b74a-d6ccd217484b,70f8df47-02e5-4fdc-8201-572c25e54089,1291/19.12.2023,,,1291/19.12.2023,Nº RES REFERENTE TECNICO
7d5e4fcd-d856-4e93-8e6e-b828350db655,4cd013ca-3e48-4d39-b031-df17037ac74a,ef4bda38-f2b2-4c54-ac7a-6d0d3b52cb04,775,2023-07-11T00:00:00,,,Nº RES INCORPORA/ CERT CORE
5e0043aa-f4e0-4e31-9afa-7dbe8e9e660b,4cd013ca-3e48-4d39-b031-df17037ac74a,f5dca104-f319-43d3-be4d-41e6ff8a1a02,775,2023-07-11T00:00:00,,,Nº RES CREA ASIGNACIÓN
b8db31c5-f922-48fe-8db2-507364adf91b,4cd013ca-3e48-4d39-b031-df17037ac74a,d5a008d4-cdd7-4ca2-b14e-484c6011385f,797,2023-07-24T00:00:00,EXENTA,,Nº RES APRUEBA CONVENIO 
3b88c660-946e-4b43-a10e-38ab6725c682,4cd013ca-3e48-4d39-b031-df17037ac74a,7829044c-ff69-4867-9ef3-086056e276b6,,,,,FECHA TOMA DE RAZON DE CGR
b3fde37a-7b24-4dec-9d2d-8efbaf8cb5b1,4cd013ca-3e48-4d39-b031-df17037ac74a,70f8df47-02e5-4fdc-8201-572c25e54089,1291/19.12.2023,,,1291/19.12.2023,Nº RES REFERENTE TECNICO
ee4eba47-5d61-45ff-b74b-e05c8ea4ee5e,adbf71e3-ec39-491b-ab26-b847053aa28a,ef4bda38-f2b2-4c54-ac7a-6d0d3b52cb04,775,2023-07-11T00:00:00,,,Nº RES INCORPORA/ CERT CORE
a5424e38-e0fb-4a00-84ba-0e3beec201bf,adbf71e3-ec39-491b-ab26-b847053aa28a,f5dca104-f319-43d3-be4d-41e6ff8a1a02,775,2023-07-11T00:00:00,,,Nº RES CREA ASIGNACIÓN
589e65be-e39c-4162-b989-5d344f2b86db,adbf71e3-ec39-491b-ab26-b847053aa28a,d5a008d4-cdd7-4ca2-b14e-484c6011385f,796,2023-07-24T00:00:00,EXENTA,,Nº RES APRUEBA CONVENIO 
7a1405c9-f559-4a1e-98bc-2df6eeb8af31,adbf71e3-ec39-491b-ab26-b847053aa28a,7829044c-ff69-4867-9ef3-086056e276b6,,,,,FECHA TOMA DE RAZON DE CGR
bfc6bfeb-aa97-45bc-bc45-5e8519244e74,adbf71e3-ec39-491b-ab26-b847053aa28a,70f8df47-02e5-4fdc-8201-572c25e54089,1291/19.12.2023,,,1291/19.12.2023,Nº RES REFERENTE TECNICO
701564b6-0e1e-43db-8209-890f1673e26d,7c321c9c-5d7f-4d7e-b7dc-7e29697a46ee,ef4bda38-f2b2-4c54-ac7a-6d0d3b52cb04,775,2023-07-11T00:00:00,,,Nº RES INCORPORA/ CERT CORE
5c9dcdd9-a9ee-495c-b937-fea4a8798605,7c321c9c-5d7f-4d7e-b7dc-7e29697a46ee,f5dca104-f319-43d3-be4d-41e6ff8a1a02,775,2023-07-11T00:00:00,,,Nº RES CREA ASIGNACIÓN
803a53e5-f76b-44b2-b24f-f9f30d17e968,7c321c9c-5d7f-4d7e-b7dc-7e29697a46ee,d5a008d4-cdd7-4ca2-b14e-484c6011385f,798,2023-07-24T00:00:00,EXENTA,,Nº RES APRUEBA CONVENIO 
88e743b5-772a-4165-98bc-ca3bc5c9e179,7c321c9c-5d7f-4d7e-b7dc-7e29697a46ee,7829044c-ff69-4867-9ef3-086056e276b6,,,,,FECHA TOMA DE RAZON DE CGR
65777050-28e7-4d7f-b054-9e3958c3adc2,7c321c9c-5d7f-4d7e-b7dc-7e29697a46ee,70f8df47-02e5-4fdc-8201-572c25e54089,1291/19.12.2023,,,1291/19.12.2023,Nº RES REFERENTE TECNICO
1473264b-817c-4709-abf4-d258974e60f6,f43758a1-78a0-44de-99e5-a47d9df8ba00,ef4bda38-f2b2-4c54-ac7a-6d0d3b52cb04,775,2023-07-11T00:00:00,,,Nº RES INCORPORA/ CERT CORE
b0932481-e45c-4c32-bda5-b8d86bbf4e59,f43758a1-78a0-44de-99e5-a47d9df8ba00,f5dca104-f319-43d3-be4d-41e6ff8a1a02,775,2023-07-11T00:00:00,,,Nº RES CREA ASIGNACIÓN
c2df476d-f65e-4ad9-9d6c-f0e87df361e2,f43758a1-78a0-44de-99e5-a47d9df8ba00,d5a008d4-cdd7-4ca2-b14e-484c6011385f,839,2023-08-01T00:00:00,EXENTA,,Nº RES APRUEBA CONVENIO 
4666260c-a047-4267-a0e7-73c33ffefd89,f43758a1-78a0-44de-99e5-a47d9df8ba00,7829044c-ff69-4867-9ef3-086056e276b6,,,,,FECHA TOMA DE RAZON DE CGR
c6d63944-bbab-41dd-9ac3-a2feeb3b6e86,f43758a1-78a0-44de-99e5-a47d9df8ba00,70f8df47-02e5-4fdc-8201-572c25e54089,1291/19.12.2023,,,1291/19.12.2023,Nº RES REFERENTE TECNICO
804d948a-30ef-4bb0-9985-1f9b360fa963,b49de23e-3bf0-4415-b460-e6f0a0765d7d,ef4bda38-f2b2-4c54-ac7a-6d0d3b52cb04,775,2023-07-11T00:00:00,,,Nº RES INCORPORA/ CERT CORE
4d05ba92-8761-4494-a819-73e0d3fa6eb2,b49de23e-3bf0-4415-b460-e6f0a0765d7d,f5dca104-f319-43d3-be4d-41e6ff8a1a02,775,2023-07-11T00:00:00,,,Nº RES CREA ASIGNACIÓN
2d1eddd8-319e-42d3-b286-b2d0b0b35ce5,b49de23e-3bf0-4415-b460-e6f0a0765d7d,d5a008d4-cdd7-4ca2-b14e-484c6011385f,837,2023-07-31T00:00:00,EXENTA,,Nº RES APRUEBA CONVENIO 
ea42340c-53ab-44be-84dd-2a7dd452e71c,b49de23e-3bf0-4415-b460-e6f0a0765d7d,7829044c-ff69-4867-9ef3-086056e276b6,,,,,FECHA TOMA DE RAZON DE CGR
c02fdb9b-a8dc-4a5f-9f82-739e764500fe,b49de23e-3bf0-4415-b460-e6f0a0765d7d,70f8df47-02e5-4fdc-8201-572c25e54089,1291/19.12.2023,,,1291/19.12.2023,Nº RES REFERENTE TECNICO
f92baeac-9d61-4780-b5ee-bf563189351d,de7aaf21-dcb2-476f-ba86-322f361bf047,ef4bda38-f2b2-4c54-ac7a-6d0d3b52cb04,775,2023-07-11T00:00:00,,,Nº RES INCORPORA/ CERT CORE
a42e3d2c-c3c3-4669-a71c-ab5ac46fd5eb,de7aaf21-dcb2-476f-ba86-322f361bf047,f5dca104-f319-43d3-be4d-41e6ff8a1a02,775,2023-07-11T00:00:00,,,Nº RES CREA ASIGNACIÓN
b6db6871-909b-443d-a2c3-2706ba10a2fb,de7aaf21-dcb2-476f-ba86-322f361bf047,d5a008d4-cdd7-4ca2-b14e-484c6011385f,906,2023-08-18T00:00:00,EXENTA,,Nº RES APRUEBA CONVENIO 
a8dc672a-357a-49ed-bb46-55ca5d4ffb1c,de7aaf21-dcb2-476f-ba86-322f361bf047,7829044c-ff69-4867-9ef3-086056e276b6,,,,,FECHA TOMA DE RAZON DE CGR
f90c8bc1-452b-4ba2-b3b2-9ec307bd314d,de7aaf21-dcb2-476f-ba86-322f361bf047,70f8df47-02e5-4fdc-8201-572c25e54089,1291/19.12.2023,,,1291/19.12.2023,Nº RES REFERENTE TECNICO
fab1c65a-8964-4c4c-a9dc-c722029f9791,f4ea0da1-b2c9-4457-a9b7-c9f5821273fc,ef4bda38-f2b2-4c54-ac7a-6d0d3b52cb04,775,2023-07-11T00:00:00,,,Nº RES INCORPORA/ CERT CORE
2522c10a-30d7-4176-8c02-a3ddb45c23c5,f4ea0da1-b2c9-4457-a9b7-c9f5821273fc,f5dca104-f319-43d3-be4d-41e6ff8a1a02,775,2023-07-11T00:00:00,,,Nº RES CREA ASIGNACIÓN
e3de785a-734f-407e-ad1d-3a78de826036,f4ea0da1-b2c9-4457-a9b7-c9f5821273fc,d5a008d4-cdd7-4ca2-b14e-484c6011385f,807,2023-07-24T00:00:00,EXENTA,,Nº RES APRUEBA CONVENIO 
71c797f8-b2d0-48b8-ab17-3bbd35369922,f4ea0da1-b2c9-4457-a9b7-c9f5821273fc,7829044c-ff69-4867-9ef3-086056e276b6,,,,,FECHA TOMA DE RAZON DE CGR
92a8ed65-b5f5-46ac-a4e8-9eba959243ba,f4ea0da1-b2c9-4457-a9b7-c9f5821273fc,70f8df47-02e5-4fdc-8201-572c25e54089,1291/19.12.2023,,,1291/19.12.2023,Nº RES REFERENTE TECNICO
e9c67ce2-52e1-44da-a5ac-f725382f2a57,a37b4ed7-ec2e-40aa-bcc8-65b5e16d66cf,ef4bda38-f2b2-4c54-ac7a-6d0d3b52cb04,775,2023-07-11T00:00:00,,,Nº RES INCORPORA/ CERT CORE
0a2b25c0-d246-4fd3-a9ee-3fb46dcc9aec,a37b4ed7-ec2e-40aa-bcc8-65b5e16d66cf,f5dca104-f319-43d3-be4d-41e6ff8a1a02,775,2023-07-11T00:00:00,,,Nº RES CREA ASIGNACIÓN
033f8ad5-ddde-4059-9bb7-9ec6274a1d98,a37b4ed7-ec2e-40aa-bcc8-65b5e16d66cf,d5a008d4-cdd7-4ca2-b14e-484c6011385f,791,2023-07-24T00:00:00,EXENTA,,Nº RES APRUEBA CONVENIO 
8429b0a8-b62d-4f1e-9734-14ff1f90a049,a37b4ed7-ec2e-40aa-bcc8-65b5e16d66cf,7829044c-ff69-4867-9ef3-086056e276b6,,,,,FECHA TOMA DE RAZON DE CGR
2e00ec6c-ae02-4ad4-bc2d-e923a495255f,a37b4ed7-ec2e-40aa-bcc8-65b5e16d66cf,70f8df47-02e5-4fdc-8201-572c25e54089,1291/19.12.2023,,,1291/19.12.2023,Nº RES REFERENTE TECNICO
f82feffe-b656-4855-8f35-933b3ba96c32,35b2bba2-c699-47a4-915a-2287b19439f8,ef4bda38-f2b2-4c54-ac7a-6d0d3b52cb04,775,2023-07-11T00:00:00,,,Nº RES INCORPORA/ CERT CORE
c5c3ca47-c5a0-4250-8e26-7391136d485a,35b2bba2-c699-47a4-915a-2287b19439f8,f5dca104-f319-43d3-be4d-41e6ff8a1a02,775,2023-07-11T00:00:00,,,Nº RES CREA ASIGNACIÓN
1d5b9782-07e7-40a4-a380-0e18281fca77,35b2bba2-c699-47a4-915a-2287b19439f8,d5a008d4-cdd7-4ca2-b14e-484c6011385f,795,2023-07-24T00:00:00,EXENTA,,Nº RES APRUEBA CONVENIO 
7aff4ead-0b8f-4be1-9f5d-e026512d7787,35b2bba2-c699-47a4-915a-2287b19439f8,7829044c-ff69-4867-9ef3-086056e276b6,,,,,FECHA TOMA DE RAZON DE CGR
4520e31d-146b-45f4-864e-24395da05c53,35b2bba2-c699-47a4-915a-2287b19439f8,70f8df47-02e5-4fdc-8201-572c25e54089,1291/19.12.2023,,,1291/19.12.2023,Nº RES REFERENTE TECNICO
3af1121c-8b6c-48b7-94e0-ce0e64b0decd,8bd30b8b-8be3-448a-a46b-92dfb140ecd9,ef4bda38-f2b2-4c54-ac7a-6d0d3b52cb04,775,2023-07-11T00:00:00,,,Nº RES INCORPORA/ CERT CORE
bce1919f-3a3b-4ed4-9838-474b921cb461,8bd30b8b-8be3-448a-a46b-92dfb140ecd9,f5dca104-f319-43d3-be4d-41e6ff8a1a02,775,2023-07-11T00:00:00,,,Nº RES CREA ASIGNACIÓN
2710e629-d87c-4ce0-8e23-272976612ec2,8bd30b8b-8be3-448a-a46b-92dfb140ecd9,d5a008d4-cdd7-4ca2-b14e-484c6011385f,805,2023-07-24T00:00:00,EXENTA,,Nº RES APRUEBA CONVENIO 
2d4d534f-6e42-4c97-815f-cb00b24cb75a,8bd30b8b-8be3-448a-a46b-92dfb140ecd9,7829044c-ff69-4867-9ef3-086056e276b6,,,,,FECHA TOMA DE RAZON DE CGR
c6fb2a5a-c95e-497a-89b3-77eef62bc7d5,8bd30b8b-8be3-448a-a46b-92dfb140ecd9,70f8df47-02e5-4fdc-8201-572c25e54089,1291/19.12.2023,,,1291/19.12.2023,Nº RES REFERENTE TECNICO
c99746e6-16bd-4864-b301-c70a6d23841e,f16854d6-b32c-4525-8c16-a3851397f0b0,ef4bda38-f2b2-4c54-ac7a-6d0d3b52cb04,775,2023-07-11T00:00:00,,,Nº RES INCORPORA/ CERT CORE
14587b38-a525-40d1-8fa2-fe69a68a0ea3,f16854d6-b32c-4525-8c16-a3851397f0b0,f5dca104-f319-43d3-be4d-41e6ff8a1a02,775,2023-07-11T00:00:00,,,Nº RES CREA ASIGNACIÓN
d8e5d74f-00b6-4a62-9a4b-6cebc761b67f,f16854d6-b32c-4525-8c16-a3851397f0b0,d5a008d4-cdd7-4ca2-b14e-484c6011385f,803,2023-07-24T00:00:00,EXENTA,,Nº RES APRUEBA CONVENIO 
f123c686-0e19-43d2-abb5-a1beacc41d9e,f16854d6-b32c-4525-8c16-a3851397f0b0,7829044c-ff69-4867-9ef3-086056e276b6,,,,,FECHA TOMA DE RAZON DE CGR
e29b11d2-26cc-494f-8b92-7d346ef4139c,f16854d6-b32c-4525-8c16-a3851397f0b0,70f8df47-02e5-4fdc-8201-572c25e54089,1291/19.12.2023,,,1291/19.12.2023,Nº RES REFERENTE TECNICO
90fce080-7b83-4885-b059-576901f1a9c7,a47c9784-a588-4ea7-abc4-d8178a78f2ec,ef4bda38-f2b2-4c54-ac7a-6d0d3b52cb04,775,2023-07-11T00:00:00,,,Nº RES INCORPORA/ CERT CORE
8252f6c6-9ae2-4140-ab6d-9da85dd54c79,a47c9784-a588-4ea7-abc4-d8178a78f2ec,f5dca104-f319-43d3-be4d-41e6ff8a1a02,50,2024-02-05T00:00:00,,,Nº RES CREA ASIGNACIÓN
f5c5bb5f-99af-4ff1-8ddb-fbc27985cde5,a47c9784-a588-4ea7-abc4-d8178a78f2ec,d5a008d4-cdd7-4ca2-b14e-484c6011385f,804,2023-07-24T00:00:00,EXENTA,,Nº RES APRUEBA CONVENIO 
69bbc480-1a3c-447c-a67c-5f278492fca6,a47c9784-a588-4ea7-abc4-d8178a78f2ec,7829044c-ff69-4867-9ef3-086056e276b6,,,,,FECHA TOMA DE RAZON DE CGR
d4e895f6-7d2e-4d5e-8ad6-c5350028f4f0,a8f47b0f-bd0a-4a19-a46e-b84ea3449314,ef4bda38-f2b2-4c54-ac7a-6d0d3b52cb04,775,2023-07-11T00:00:00,,,Nº RES INCORPORA/ CERT CORE
327ff39c-fedd-49cf-8a1c-539f9b12848c,a8f47b0f-bd0a-4a19-a46e-b84ea3449314,f5dca104-f319-43d3-be4d-41e6ff8a1a02,775,2023-07-11T00:00:00,,,Nº RES CREA ASIGNACIÓN
d45cf95d-afb0-479e-89e0-7271b0717eaa,a8f47b0f-bd0a-4a19-a46e-b84ea3449314,d5a008d4-cdd7-4ca2-b14e-484c6011385f,794,2023-07-24T00:00:00,EXENTA,,Nº RES APRUEBA CONVENIO 
b2605e32-53de-4151-b766-955e07f4865e,a8f47b0f-bd0a-4a19-a46e-b84ea3449314,7829044c-ff69-4867-9ef3-086056e276b6,,,,,FECHA TOMA DE RAZON DE CGR
aabb5b5a-2e3e-44f6-9890-64070be4209a,a8f47b0f-bd0a-4a19-a46e-b84ea3449314,70f8df47-02e5-4fdc-8201-572c25e54089,1291/19.12.2023,,,1291/19.12.2023,Nº RES REFERENTE TECNICO
a7aae488-5be1-4fb7-8038-b9601f91cbf6,9ebe39f8-cf67-4fe4-bea9-1af76bfa97a5,ef4bda38-f2b2-4c54-ac7a-6d0d3b52cb04,775,2023-07-11T00:00:00,,,Nº RES INCORPORA/ CERT CORE
e6a2a3c2-cd49-42a3-ab3e-784b17947cd2,9ebe39f8-cf67-4fe4-bea9-1af76bfa97a5,f5dca104-f319-43d3-be4d-41e6ff8a1a02,775,2023-07-11T00:00:00,,,Nº RES CREA ASIGNACIÓN
ab064a2a-1bcf-4e33-a608-eb1fb752ca2f,9ebe39f8-cf67-4fe4-bea9-1af76bfa97a5,d5a008d4-cdd7-4ca2-b14e-484c6011385f,788,2023-07-24T00:00:00,EXENTA,,Nº RES APRUEBA CONVENIO 
c409af92-c1b5-4ec3-8720-513596195edb,9ebe39f8-cf67-4fe4-bea9-1af76bfa97a5,7829044c-ff69-4867-9ef3-086056e276b6,,,,,FECHA TOMA DE RAZON DE CGR
6d891852-4cdd-4a74-8634-73c97c4fd53c,9ebe39f8-cf67-4fe4-bea9-1af76bfa97a5,70f8df47-02e5-4fdc-8201-572c25e54089,279/02.05.2024,,,279/02.05.2024,Nº RES REFERENTE TECNICO
ca4879fd-0790-40c2-9b4f-684da33b6660,bcf00199-42c4-48d1-9466-4905a69c8a93,ef4bda38-f2b2-4c54-ac7a-6d0d3b52cb04,775,2023-07-11T00:00:00,,,Nº RES INCORPORA/ CERT CORE
e4384c73-e26b-469b-b2bc-e2b144ef68af,bcf00199-42c4-48d1-9466-4905a69c8a93,f5dca104-f319-43d3-be4d-41e6ff8a1a02,775,2023-07-11T00:00:00,,,Nº RES CREA ASIGNACIÓN
d53c0dab-6039-459c-85e7-a36b745a1b23,bcf00199-42c4-48d1-9466-4905a69c8a93,d5a008d4-cdd7-4ca2-b14e-484c6011385f,789,2023-07-24T00:00:00,EXENTA,,Nº RES APRUEBA CONVENIO 
4b07518f-0fb1-4974-9963-1164569ba089,bcf00199-42c4-48d1-9466-4905a69c8a93,7829044c-ff69-4867-9ef3-086056e276b6,,,,,FECHA TOMA DE RAZON DE CGR
6f4c3c68-16c8-45be-b14f-a99a63ca19a5,bcf00199-42c4-48d1-9466-4905a69c8a93,70f8df47-02e5-4fdc-8201-572c25e54089,279/02.05.2024,,,279/02.05.2024,Nº RES REFERENTE TECNICO
f9fe0ce6-a004-4d0b-9a12-53637e747577,8989226d-fb33-4c3a-b7de-64856da58d8c,ef4bda38-f2b2-4c54-ac7a-6d0d3b52cb04,775,2023-07-11T00:00:00,,,Nº RES INCORPORA/ CERT CORE
8e04f3cd-3bfe-470b-aae4-830d034550f2,8989226d-fb33-4c3a-b7de-64856da58d8c,f5dca104-f319-43d3-be4d-41e6ff8a1a02,775,2023-07-11T00:00:00,,,Nº RES CREA ASIGNACIÓN
c7b83fdf-1fb7-4008-bcbf-e28834afdd2a,8989226d-fb33-4c3a-b7de-64856da58d8c,d5a008d4-cdd7-4ca2-b14e-484c6011385f,907,2023-08-18T00:00:00,EXENTA,,Nº RES APRUEBA CONVENIO 
28a03301-caf9-4dfb-b884-c59a2ba8e8f0,8989226d-fb33-4c3a-b7de-64856da58d8c,7829044c-ff69-4867-9ef3-086056e276b6,,,,,FECHA TOMA DE RAZON DE CGR
433a0b80-380a-492f-8910-d889bf97b1ac,8989226d-fb33-4c3a-b7de-64856da58d8c,70f8df47-02e5-4fdc-8201-572c25e54089,1291/19.12.2023,,,1291/19.12.2023,Nº RES REFERENTE TECNICO
48cbdbd9-f521-446b-8ded-5661c90e19eb,20abccf6-1e7a-42de-9828-f7f41939a311,ef4bda38-f2b2-4c54-ac7a-6d0d3b52cb04,775,2023-07-11T00:00:00,,,Nº RES INCORPORA/ CERT CORE
4513b20f-996b-4b2b-ad4e-6c96e667a838,20abccf6-1e7a-42de-9828-f7f41939a311,f5dca104-f319-43d3-be4d-41e6ff8a1a02,775,2023-07-11T00:00:00,,,Nº RES CREA ASIGNACIÓN
15f4194d-db18-4c18-8acc-276710263d78,20abccf6-1e7a-42de-9828-f7f41939a311,d5a008d4-cdd7-4ca2-b14e-484c6011385f,799,2023-07-24T00:00:00,EXENTA,,Nº RES APRUEBA CONVENIO 
6d4cbc5c-44a2-4cab-92a3-5d6f8b76b0ab,20abccf6-1e7a-42de-9828-f7f41939a311,7829044c-ff69-4867-9ef3-086056e276b6,,,,,FECHA TOMA DE RAZON DE CGR
942336f3-0388-4880-af31-9a0975d02830,20abccf6-1e7a-42de-9828-f7f41939a311,70f8df47-02e5-4fdc-8201-572c25e54089,1291/19.12.2023,,,1291/19.12.2023,Nº RES REFERENTE TECNICO
1f21bd81-527e-4ff2-948d-b7c424055e5e,53f424af-614c-413e-89a4-860c39a41673,ef4bda38-f2b2-4c54-ac7a-6d0d3b52cb04,775,2023-07-11T00:00:00,,,Nº RES INCORPORA/ CERT CORE
b5d2064a-1b5d-4e57-af48-a52b6a04ce71,53f424af-614c-413e-89a4-860c39a41673,f5dca104-f319-43d3-be4d-41e6ff8a1a02,775,2023-07-11T00:00:00,,,Nº RES CREA ASIGNACIÓN
7e0d05ba-256a-4ebe-800d-e434ef57124c,53f424af-614c-413e-89a4-860c39a41673,d5a008d4-cdd7-4ca2-b14e-484c6011385f,806,2023-07-24T00:00:00,EXENTA,,Nº RES APRUEBA CONVENIO 
fbbab0f3-e977-49a7-957d-934d7a871dfa,53f424af-614c-413e-89a4-860c39a41673,7829044c-ff69-4867-9ef3-086056e276b6,,,,,FECHA TOMA DE RAZON DE CGR
174386e1-6a2e-4372-a64c-bcdcdbd652a8,53f424af-614c-413e-89a4-860c39a41673,70f8df47-02e5-4fdc-8201-572c25e54089,279/02.05.2024,,,279/02.05.2024,Nº RES REFERENTE TECNICO
69d81845-34c5-4604-87f3-ffb7527bb822,7543631e-ed63-4403-9b25-8cc55bf0ef66,ef4bda38-f2b2-4c54-ac7a-6d0d3b52cb04,775,2023-07-11T00:00:00,,,Nº RES INCORPORA/ CERT CORE
ca02b7c2-6c35-4cc9-a52b-bc4dc44e6841,7543631e-ed63-4403-9b25-8cc55bf0ef66,f5dca104-f319-43d3-be4d-41e6ff8a1a02,775,2023-07-11T00:00:00,,,Nº RES CREA ASIGNACIÓN
b338ab9a-3257-4e80-a3b7-7e722b9c3e9c,7543631e-ed63-4403-9b25-8cc55bf0ef66,d5a008d4-cdd7-4ca2-b14e-484c6011385f,896,2023-08-17T00:00:00,EXENTA,,Nº RES APRUEBA CONVENIO 
fac566bb-555e-4982-a97f-e06e107b60c3,7543631e-ed63-4403-9b25-8cc55bf0ef66,7829044c-ff69-4867-9ef3-086056e276b6,,,,,FECHA TOMA DE RAZON DE CGR
d26cb175-160c-4ba7-8a4c-a9787710b631,7543631e-ed63-4403-9b25-8cc55bf0ef66,70f8df47-02e5-4fdc-8201-572c25e54089,279/02.05.2024,,,279/02.05.2024,Nº RES REFERENTE TECNICO
d6497e43-16af-4e1a-bd97-acf5cbdfb609,6223f974-3256-48d0-bfd5-16a4352636de,ef4bda38-f2b2-4c54-ac7a-6d0d3b52cb04,775,2023-07-11T00:00:00,,,Nº RES INCORPORA/ CERT CORE
8b14266b-07a9-4902-9db5-390f0f67111f,6223f974-3256-48d0-bfd5-16a4352636de,f5dca104-f319-43d3-be4d-41e6ff8a1a02,775,2023-07-11T00:00:00,,,Nº RES CREA ASIGNACIÓN
3e58116f-69e8-400b-a69d-5fdc068f4ffb,6223f974-3256-48d0-bfd5-16a4352636de,d5a008d4-cdd7-4ca2-b14e-484c6011385f,793,2023-07-24T00:00:00,EXENTA,,Nº RES APRUEBA CONVENIO 
d87b0f39-45a4-47c3-9671-4d1e1c7d25be,6223f974-3256-48d0-bfd5-16a4352636de,7829044c-ff69-4867-9ef3-086056e276b6,,,,,FECHA TOMA DE RAZON DE CGR
29ce4488-eb45-4d62-8dff-806cbea8f381,6223f974-3256-48d0-bfd5-16a4352636de,70f8df47-02e5-4fdc-8201-572c25e54089,1291/19.12.2023,,,1291/19.12.2023,Nº RES REFERENTE TECNICO
222bfbda-b1ab-42c9-be94-02f1660f4bb8,501d6432-b03c-48d6-8d71-3e682ef7b29a,ef4bda38-f2b2-4c54-ac7a-6d0d3b52cb04,775,2023-07-11T00:00:00,,,Nº RES INCORPORA/ CERT CORE
bddcce27-1c78-4bbe-a9a1-6f6879082e80,501d6432-b03c-48d6-8d71-3e682ef7b29a,f5dca104-f319-43d3-be4d-41e6ff8a1a02,775,2023-07-11T00:00:00,,,Nº RES CREA ASIGNACIÓN
ec2e75c5-90d5-4b0c-b569-a23cfa78ee4d,501d6432-b03c-48d6-8d71-3e682ef7b29a,d5a008d4-cdd7-4ca2-b14e-484c6011385f,949,2023-09-01T00:00:00,EXENTA,,Nº RES APRUEBA CONVENIO 
2d12143c-9efe-43dd-80af-ff6404a8e7a6,501d6432-b03c-48d6-8d71-3e682ef7b29a,7829044c-ff69-4867-9ef3-086056e276b6,,,,,FECHA TOMA DE RAZON DE CGR
786b01ba-67e9-414f-8ba9-02012b6bdb65,501d6432-b03c-48d6-8d71-3e682ef7b29a,70f8df47-02e5-4fdc-8201-572c25e54089,279/02.05.2024,,,279/02.05.2024,Nº RES REFERENTE TECNICO
c3c5e713-8ccc-4224-9ad1-dcbd321b146c,2ef11387-84a3-4599-8662-7dc5c983d6a8,ef4bda38-f2b2-4c54-ac7a-6d0d3b52cb04,776,2023-07-11T00:00:00,,,Nº RES INCORPORA/ CERT CORE
0cd4ff79-cd46-47a1-a7e2-c2e3aed4a6d3,2ef11387-84a3-4599-8662-7dc5c983d6a8,f5dca104-f319-43d3-be4d-41e6ff8a1a02,776,2023-07-11T00:00:00,,,Nº RES CREA ASIGNACIÓN
2ad65504-c0ce-4a17-a287-e18eeb49f062,2ef11387-84a3-4599-8662-7dc5c983d6a8,d5a008d4-cdd7-4ca2-b14e-484c6011385f,802,2023-07-24T00:00:00,EXENTA,,Nº RES APRUEBA CONVENIO 
15567ef3-4f67-42f2-93ae-c4f98181697f,2ef11387-84a3-4599-8662-7dc5c983d6a8,7829044c-ff69-4867-9ef3-086056e276b6,,,,,FECHA TOMA DE RAZON DE CGR
a0e0ac05-b72a-4c28-ab4a-90ddbcc565da,2ef11387-84a3-4599-8662-7dc5c983d6a8,70f8df47-02e5-4fdc-8201-572c25e54089,1291/19.12.2023,,,1291/19.12.2023,Nº RES REFERENTE TECNICO
1e37e152-f223-4ca5-b9d4-213d2f7917d2,3d54e40c-5028-47ad-abde-a01f53a3cb08,ef4bda38-f2b2-4c54-ac7a-6d0d3b52cb04,776,2023-07-11T00:00:00,,,Nº RES INCORPORA/ CERT CORE
b5d77c2e-51fb-46bb-84ac-39d97137d451,3d54e40c-5028-47ad-abde-a01f53a3cb08,f5dca104-f319-43d3-be4d-41e6ff8a1a02,776,2023-07-11T00:00:00,,,Nº RES CREA ASIGNACIÓN
52fa0e49-707f-42ac-a803-821cc269c1fb,3d54e40c-5028-47ad-abde-a01f53a3cb08,d5a008d4-cdd7-4ca2-b14e-484c6011385f,800,2023-07-24T00:00:00,EXENTA,,Nº RES APRUEBA CONVENIO 
251cb7ac-cdf1-4693-9711-03927242af33,3d54e40c-5028-47ad-abde-a01f53a3cb08,7829044c-ff69-4867-9ef3-086056e276b6,,,,,FECHA TOMA DE RAZON DE CGR
718d8b11-9613-473c-8952-af3ad36b93c1,3d54e40c-5028-47ad-abde-a01f53a3cb08,70f8df47-02e5-4fdc-8201-572c25e54089,1291/19.12.2023,,,1291/19.12.2023,Nº RES REFERENTE TECNICO
bacf694b-819d-4da3-91f7-ce299cb20fb8,690995f2-5ca9-4b7f-9d0f-4eeda1ba1888,ef4bda38-f2b2-4c54-ac7a-6d0d3b52cb04,776,2023-07-11T00:00:00,,,Nº RES INCORPORA/ CERT CORE
30de60ff-3975-4b71-8754-f2296d153b8f,690995f2-5ca9-4b7f-9d0f-4eeda1ba1888,f5dca104-f319-43d3-be4d-41e6ff8a1a02,776,2023-07-11T00:00:00,,,Nº RES CREA ASIGNACIÓN
93526712-69c4-41b3-b6b9-11aa04322453,690995f2-5ca9-4b7f-9d0f-4eeda1ba1888,d5a008d4-cdd7-4ca2-b14e-484c6011385f,1138,2023-10-31T00:00:00,EXENTA,,Nº RES APRUEBA CONVENIO 
76080d20-ada1-4889-b0c2-15178b2eeb43,690995f2-5ca9-4b7f-9d0f-4eeda1ba1888,7829044c-ff69-4867-9ef3-086056e276b6,,,,,FECHA TOMA DE RAZON DE CGR
07b90740-e775-41b2-a693-a715c9475fc1,690995f2-5ca9-4b7f-9d0f-4eeda1ba1888,70f8df47-02e5-4fdc-8201-572c25e54089,279/02.05.2024,,,279/02.05.2024,Nº RES REFERENTE TECNICO
f40f49eb-1b58-4a2a-adff-2eb1a82fc085,230f1e33-30a1-4d4d-a9b9-0ec7f815335f,ef4bda38-f2b2-4c54-ac7a-6d0d3b52cb04,776,2023-07-11T00:00:00,,,Nº RES INCORPORA/ CERT CORE
4ec72b29-af36-4460-9f5c-aec2fd20b53c,230f1e33-30a1-4d4d-a9b9-0ec7f815335f,f5dca104-f319-43d3-be4d-41e6ff8a1a02,776,2023-07-11T00:00:00,,,Nº RES CREA ASIGNACIÓN
9f5209df-0bec-44b2-b8a0-e4be85fe822d,230f1e33-30a1-4d4d-a9b9-0ec7f815335f,d5a008d4-cdd7-4ca2-b14e-484c6011385f,808,2023-07-24T00:00:00,EXENTA,,Nº RES APRUEBA CONVENIO 
33235cbb-d927-4a6c-a289-ba97289f4cab,230f1e33-30a1-4d4d-a9b9-0ec7f815335f,7829044c-ff69-4867-9ef3-086056e276b6,,,,,FECHA TOMA DE RAZON DE CGR
d4bea770-e5d7-4608-b65e-896442716f16,230f1e33-30a1-4d4d-a9b9-0ec7f815335f,70f8df47-02e5-4fdc-8201-572c25e54089,1291/19.12.2023,,,1291/19.12.2023,Nº RES REFERENTE TECNICO
8279bc78-469e-42c7-9b78-59b2ba40d7db,09856cfc-6622-4a44-b3c4-4295071e55d7,ef4bda38-f2b2-4c54-ac7a-6d0d3b52cb04,776,2023-07-11T00:00:00,,,Nº RES INCORPORA/ CERT CORE
a7e4a3d7-ec88-4c8b-a0fd-84f9cec33196,09856cfc-6622-4a44-b3c4-4295071e55d7,f5dca104-f319-43d3-be4d-41e6ff8a1a02,776,2023-07-11T00:00:00,,,Nº RES CREA ASIGNACIÓN
166dd3dd-0d9d-4ca5-afa0-89ff53136a0d,09856cfc-6622-4a44-b3c4-4295071e55d7,d5a008d4-cdd7-4ca2-b14e-484c6011385f,801,2023-07-24T00:00:00,EXENTA,,Nº RES APRUEBA CONVENIO 
873009f7-72f7-4db6-8490-42091cbc218c,09856cfc-6622-4a44-b3c4-4295071e55d7,7829044c-ff69-4867-9ef3-086056e276b6,,,,,FECHA TOMA DE RAZON DE CGR
d0beec10-b65f-4827-a50d-7e7b8a0529ff,09856cfc-6622-4a44-b3c4-4295071e55d7,70f8df47-02e5-4fdc-8201-572c25e54089,1291/19.12.2023,,,1291/19.12.2023,Nº RES REFERENTE TECNICO
00406f51-2b3c-41cf-819f-94ef34eb20c2,975240ec-2baf-4104-bdb7-d2c5af694256,ef4bda38-f2b2-4c54-ac7a-6d0d3b52cb04,776,2023-07-11T00:00:00,,,Nº RES INCORPORA/ CERT CORE
3f485d34-f373-4bf3-8134-ece38ac4026b,975240ec-2baf-4104-bdb7-d2c5af694256,f5dca104-f319-43d3-be4d-41e6ff8a1a02,776,2023-07-11T00:00:00,,,Nº RES CREA ASIGNACIÓN
1fa771db-1896-42f8-b0b5-5b5891a82a5c,975240ec-2baf-4104-bdb7-d2c5af694256,d5a008d4-cdd7-4ca2-b14e-484c6011385f,790,2023-07-24T00:00:00,EXENTA,,Nº RES APRUEBA CONVENIO 
6489bffb-0b9a-4be5-b591-9adb9a6aa9b5,975240ec-2baf-4104-bdb7-d2c5af694256,7829044c-ff69-4867-9ef3-086056e276b6,,,,,FECHA TOMA DE RAZON DE CGR
576a34d4-7627-4f20-b6da-bc11996b2801,975240ec-2baf-4104-bdb7-d2c5af694256,70f8df47-02e5-4fdc-8201-572c25e54089,1291/19.12.2023,,,1291/19.12.2023,Nº RES REFERENTE TECNICO
b04867d2-87bf-4996-9ea1-e6be5a8a2882,ea41d261-e297-449b-9172-b3e205422fc4,ef4bda38-f2b2-4c54-ac7a-6d0d3b52cb04,776,2023-07-11T00:00:00,,,Nº RES INCORPORA/ CERT CORE
ea654296-5fe6-43ac-bc83-937e358346bd,ea41d261-e297-449b-9172-b3e205422fc4,f5dca104-f319-43d3-be4d-41e6ff8a1a02,776,2023-07-11T00:00:00,,,Nº RES CREA ASIGNACIÓN
9481e4de-ee2e-4a9a-869d-36f8c70f6789,ea41d261-e297-449b-9172-b3e205422fc4,d5a008d4-cdd7-4ca2-b14e-484c6011385f,792,2023-07-24T00:00:00,EXENTA,,Nº RES APRUEBA CONVENIO 
c32a18c2-d268-4bf3-92d2-4eb421ed5c1c,ea41d261-e297-449b-9172-b3e205422fc4,7829044c-ff69-4867-9ef3-086056e276b6,,,,,FECHA TOMA DE RAZON DE CGR
07644e49-e311-409b-97c9-e0b47cb13bcf,ea41d261-e297-449b-9172-b3e205422fc4,70f8df47-02e5-4fdc-8201-572c25e54089,279/02.05.2024,,,279/02.05.2024,Nº RES REFERENTE TECNICO
76371422-33a6-4cbd-9697-0c69df1ae88a,50b50359-7aea-40c3-aa65-2e8f91158db8,ef4bda38-f2b2-4c54-ac7a-6d0d3b52cb04,776,2023-07-11T00:00:00,,,Nº RES INCORPORA/ CERT CORE
3ef8cb32-7efe-426c-bbc8-5be78a8f5afc,50b50359-7aea-40c3-aa65-2e8f91158db8,f5dca104-f319-43d3-be4d-41e6ff8a1a02,776,2023-07-11T00:00:00,,,Nº RES CREA ASIGNACIÓN
d007154c-5060-469a-9eb0-d4551d8396ae,50b50359-7aea-40c3-aa65-2e8f91158db8,d5a008d4-cdd7-4ca2-b14e-484c6011385f,836,2023-07-31T00:00:00,EXENTA,,Nº RES APRUEBA CONVENIO 
8815a166-2a45-4246-aea8-dc50b4912c2a,50b50359-7aea-40c3-aa65-2e8f91158db8,7829044c-ff69-4867-9ef3-086056e276b6,,,,,FECHA TOMA DE RAZON DE CGR
7b4490c0-fa90-4992-86da-b16740610f7f,50b50359-7aea-40c3-aa65-2e8f91158db8,70f8df47-02e5-4fdc-8201-572c25e54089,1291/19.12.2023,,,1291/19.12.2023,Nº RES REFERENTE TECNICO
879c97f8-501f-426a-a2f0-50506b8bc3f4,6ec21d3f-01ab-4711-a7a5-f4f2418539ea,ef4bda38-f2b2-4c54-ac7a-6d0d3b52cb04,143,2024-03-26T00:00:00,,,Nº RES INCORPORA/ CERT CORE
8bfb82e0-b67f-47ed-8d77-e6cdad0b5c93,6ec21d3f-01ab-4711-a7a5-f4f2418539ea,f5dca104-f319-43d3-be4d-41e6ff8a1a02,19,2024-04-01T00:00:00,,,Nº RES CREA ASIGNACIÓN
844ac16a-c0e0-4255-9961-91ffdc9540bc,6ec21d3f-01ab-4711-a7a5-f4f2418539ea,d5a008d4-cdd7-4ca2-b14e-484c6011385f,40,2024-05-13T00:00:00,AFECTA,,Nº RES APRUEBA CONVENIO 
90e3a36f-ef8e-4989-98a8-cd7ea70b44fb,6ec21d3f-01ab-4711-a7a5-f4f2418539ea,95b43090-bfe5-41ac-b905-1b06d0490d6e,792,,,5/28/2024,Nº OFICIO ENVIA CONVENIO
4229bafa-0d87-44cc-af14-b737d6251b40,6ec21d3f-01ab-4711-a7a5-f4f2418539ea,7829044c-ff69-4867-9ef3-086056e276b6,27/05/2024,2024-05-27T00:00:00,,,FECHA TOMA DE RAZON DE CGR
20307360-8b45-4d8f-83c0-124a3cb90424,6ec21d3f-01ab-4711-a7a5-f4f2418539ea,b834311e-a83e-4167-88f3-148814355189,,,,5/28/2024,FECHA OFICIO ENVIA CONVENIO
76e46615-da77-4aac-ba82-a2fedfd990f1,4b5dfad3-f7ff-4c49-9749-fb292c04fa1f,ef4bda38-f2b2-4c54-ac7a-6d0d3b52cb04,136,2024-03-22T00:00:00,,,Nº RES INCORPORA/ CERT CORE
8d7bbd77-ffa9-4575-b8a4-c903dceaf951,4b5dfad3-f7ff-4c49-9749-fb292c04fa1f,f5dca104-f319-43d3-be4d-41e6ff8a1a02,136,2024-03-22T00:00:00,,,Nº RES CREA ASIGNACIÓN
2a7bdedb-fa18-4922-a1eb-a2aba8a790f2,4b5dfad3-f7ff-4c49-9749-fb292c04fa1f,d5a008d4-cdd7-4ca2-b14e-484c6011385f,41,2024-05-15T00:00:00,AFECTA,,Nº RES APRUEBA CONVENIO 
73cd31b5-0dbe-4599-8b40-7437c3174436,4b5dfad3-f7ff-4c49-9749-fb292c04fa1f,95b43090-bfe5-41ac-b905-1b06d0490d6e,856,2024-11-06T00:00:00,,,Nº OFICIO ENVIA CONVENIO
59454661-8ded-458b-a139-136d603895b9,4b5dfad3-f7ff-4c49-9749-fb292c04fa1f,7829044c-ff69-4867-9ef3-086056e276b6,06/06/2024,2024-06-06T00:00:00,,,FECHA TOMA DE RAZON DE CGR
9fcf642f-0760-4fdb-ad24-1cb522312f85,4b5dfad3-f7ff-4c49-9749-fb292c04fa1f,b834311e-a83e-4167-88f3-148814355189,,2024-11-06T00:00:00,,,FECHA OFICIO ENVIA CONVENIO
fa9713dd-94c8-4207-bdb1-615ba4a6914c,3f1adbf9-6ebe-4c88-a215-15943387c048,ef4bda38-f2b2-4c54-ac7a-6d0d3b52cb04,1120,2023-10-25T00:00:00,,,Nº RES INCORPORA/ CERT CORE
20a86348-c123-4f93-b4ef-ca6e7a564828,3f1adbf9-6ebe-4c88-a215-15943387c048,f5dca104-f319-43d3-be4d-41e6ff8a1a02,1120,2023-10-25T00:00:00,,,Nº RES CREA ASIGNACIÓN
4c72b528-9718-49f8-8203-90efaa6b23d8,3f1adbf9-6ebe-4c88-a215-15943387c048,d5a008d4-cdd7-4ca2-b14e-484c6011385f,42,2024-05-15T00:00:00,AFECTA,,Nº RES APRUEBA CONVENIO 
051ce2d1-3cde-421f-b944-feaed5c9b813,3f1adbf9-6ebe-4c88-a215-15943387c048,95b43090-bfe5-41ac-b905-1b06d0490d6e,850,2024-07-06T00:00:00,,,Nº OFICIO ENVIA CONVENIO
b9cf7bd4-591a-4e39-afe0-fc4aa3588bbf,3f1adbf9-6ebe-4c88-a215-15943387c048,7829044c-ff69-4867-9ef3-086056e276b6,06/06/2024,2024-06-06T00:00:00,,,FECHA TOMA DE RAZON DE CGR
7d0a7bdc-9bc7-4d90-9919-62f12a9cc61f,3f1adbf9-6ebe-4c88-a215-15943387c048,70f8df47-02e5-4fdc-8201-572c25e54089,1293/19.12.2023,,,1293/19.12.2023,Nº RES REFERENTE TECNICO
6e29a733-95f1-4ae8-8e0e-0010f68df39f,3f1adbf9-6ebe-4c88-a215-15943387c048,b834311e-a83e-4167-88f3-148814355189,,2024-07-06T00:00:00,,,FECHA OFICIO ENVIA CONVENIO
ea4b19e2-5eee-47b6-a34b-e7356779900b,ddcf1ea2-1e96-42a5-b2f5-db047682b6bb,ef4bda38-f2b2-4c54-ac7a-6d0d3b52cb04,136,2024-03-22T00:00:00,,,Nº RES INCORPORA/ CERT CORE
f6739542-f173-4f3b-801e-aaa3ed081d66,ddcf1ea2-1e96-42a5-b2f5-db047682b6bb,f5dca104-f319-43d3-be4d-41e6ff8a1a02,136,2024-03-22T00:00:00,,,Nº RES CREA ASIGNACIÓN
bfd81379-27fe-424d-9dcc-d28d0afcd419,ddcf1ea2-1e96-42a5-b2f5-db047682b6bb,d5a008d4-cdd7-4ca2-b14e-484c6011385f,44,2024-05-17T00:00:00,AFECTA,,Nº RES APRUEBA CONVENIO 
2470e79c-c86e-4693-80e4-2b113eb5a7a5,ddcf1ea2-1e96-42a5-b2f5-db047682b6bb,95b43090-bfe5-41ac-b905-1b06d0490d6e,856,2024-11-06T00:00:00,,,Nº OFICIO ENVIA CONVENIO
7ad771e4-9155-494f-bb5a-cb1b365ec48a,ddcf1ea2-1e96-42a5-b2f5-db047682b6bb,7829044c-ff69-4867-9ef3-086056e276b6,06/06/2024,2024-06-06T00:00:00,,,FECHA TOMA DE RAZON DE CGR
242b1aac-422c-401a-8ef6-8823612e2437,ddcf1ea2-1e96-42a5-b2f5-db047682b6bb,b834311e-a83e-4167-88f3-148814355189,,2024-11-06T00:00:00,,,FECHA OFICIO ENVIA CONVENIO
6b25f83f-ddb0-4398-9a72-7ca2d1c2e599,b974e503-8ac9-419f-ac23-5f6c1fb34965,ef4bda38-f2b2-4c54-ac7a-6d0d3b52cb04,143,2024-03-26T00:00:00,,,Nº RES INCORPORA/ CERT CORE
b94948dc-1b1b-4f3a-905a-1caf9be178e7,b974e503-8ac9-419f-ac23-5f6c1fb34965,f5dca104-f319-43d3-be4d-41e6ff8a1a02,19,2024-04-01T00:00:00,,,Nº RES CREA ASIGNACIÓN
3e58554a-bbcc-435e-afa3-3e44da61a8ce,b974e503-8ac9-419f-ac23-5f6c1fb34965,d5a008d4-cdd7-4ca2-b14e-484c6011385f,48,2024-05-29T00:00:00,AFECTA,,Nº RES APRUEBA CONVENIO 
cb826a5f-e4c7-4fcc-a21a-afc3ce612336,b974e503-8ac9-419f-ac23-5f6c1fb34965,95b43090-bfe5-41ac-b905-1b06d0490d6e,968,2024-01-07T00:00:00,,,Nº OFICIO ENVIA CONVENIO
d015b6f1-832a-4fe7-95e2-844d12c7a882,b974e503-8ac9-419f-ac23-5f6c1fb34965,7829044c-ff69-4867-9ef3-086056e276b6,18/06/2024,2024-06-18T00:00:00,,,FECHA TOMA DE RAZON DE CGR
aaf34c8b-adfe-4af5-abf8-8f0be2145cea,b974e503-8ac9-419f-ac23-5f6c1fb34965,b834311e-a83e-4167-88f3-148814355189,,2024-01-07T00:00:00,,,FECHA OFICIO ENVIA CONVENIO
22fbe73c-0748-4037-b97d-e260766c0316,ae5f2a9f-4119-44f4-b818-e6781de3e7c7,ef4bda38-f2b2-4c54-ac7a-6d0d3b52cb04,,,,,Nº RES INCORPORA/ CERT CORE
79abc26b-d2c6-409b-8874-cfebf3d264a1,ae5f2a9f-4119-44f4-b818-e6781de3e7c7,f5dca104-f319-43d3-be4d-41e6ff8a1a02,66,2023-05-26T00:00:00,,,Nº RES CREA ASIGNACIÓN
120c5868-752d-4998-b156-74e4c6a13b2b,ae5f2a9f-4119-44f4-b818-e6781de3e7c7,d5a008d4-cdd7-4ca2-b14e-484c6011385f,49,2024-05-30T00:00:00,AFECTA,,Nº RES APRUEBA CONVENIO 
85e81942-b32e-4407-8491-a999d98f23fa,ae5f2a9f-4119-44f4-b818-e6781de3e7c7,7829044c-ff69-4867-9ef3-086056e276b6,24-06-2024,2024-06-24T00:00:00,,,FECHA TOMA DE RAZON DE CGR
33498425-338f-44ba-887d-0cb94c96e83a,ae5f2a9f-4119-44f4-b818-e6781de3e7c7,70f8df47-02e5-4fdc-8201-572c25e54089,432/24.06.2024,,,432/24.06.2024,Nº RES REFERENTE TECNICO
206d5560-679f-49ab-8507-b9db95ccd453,4e9cb875-fb0a-4859-a360-bed13c6a2a2a,ef4bda38-f2b2-4c54-ac7a-6d0d3b52cb04,362,2024-05-24T00:00:00,,,Nº RES INCORPORA/ CERT CORE
c58335fe-42b0-4ae3-98f6-1021be4153a2,4e9cb875-fb0a-4859-a360-bed13c6a2a2a,f5dca104-f319-43d3-be4d-41e6ff8a1a02,362,2024-05-24T00:00:00,,,Nº RES CREA ASIGNACIÓN
cd38817d-ea1b-4fa9-9c50-dcd92da65172,4e9cb875-fb0a-4859-a360-bed13c6a2a2a,d5a008d4-cdd7-4ca2-b14e-484c6011385f,51,2024-06-11T00:00:00,AFECTA,,Nº RES APRUEBA CONVENIO 
e38a45b8-a9e5-4d13-85c9-8a01cd594448,4e9cb875-fb0a-4859-a360-bed13c6a2a2a,95b43090-bfe5-41ac-b905-1b06d0490d6e,962,2024-06-28T00:00:00,,,Nº OFICIO ENVIA CONVENIO
dc12cbb8-f6ba-49bf-809f-f041bdea63df,4e9cb875-fb0a-4859-a360-bed13c6a2a2a,7829044c-ff69-4867-9ef3-086056e276b6,26-06-2024,2024-06-26T00:00:00,,,FECHA TOMA DE RAZON DE CGR
a40a9206-2e7d-4eb0-bcde-6af8a4259481,4e9cb875-fb0a-4859-a360-bed13c6a2a2a,b834311e-a83e-4167-88f3-148814355189,,2024-06-28T00:00:00,,,FECHA OFICIO ENVIA CONVENIO
5758f90f-c6a6-4da5-8bf5-39b857bf65eb,34f3cac0-6bc9-4624-979a-cb55e20d40fb,ef4bda38-f2b2-4c54-ac7a-6d0d3b52cb04,1070,2023-10-13T00:00:00,,,Nº RES INCORPORA/ CERT CORE
74cb99fa-a4ec-4265-bb06-07816ec9a721,34f3cac0-6bc9-4624-979a-cb55e20d40fb,f5dca104-f319-43d3-be4d-41e6ff8a1a02,1070,2023-10-13T00:00:00,,,Nº RES CREA ASIGNACIÓN
8e21107f-9b59-4ba1-a03a-5080f55469e2,34f3cac0-6bc9-4624-979a-cb55e20d40fb,d5a008d4-cdd7-4ca2-b14e-484c6011385f,52,2024-06-11T00:00:00,AFECTA,,Nº RES APRUEBA CONVENIO 
a9514133-2d79-4f8c-83c0-d38922862dad,34f3cac0-6bc9-4624-979a-cb55e20d40fb,95b43090-bfe5-41ac-b905-1b06d0490d6e,953,2024-06-27T00:00:00,,,Nº OFICIO ENVIA CONVENIO
e20eca7b-d16a-4dc2-b5bc-0f504032fb40,34f3cac0-6bc9-4624-979a-cb55e20d40fb,7829044c-ff69-4867-9ef3-086056e276b6,26-06-2024,2024-06-26T00:00:00,,,FECHA TOMA DE RAZON DE CGR
27e70d95-b839-44c8-ae01-5c8e33591159,34f3cac0-6bc9-4624-979a-cb55e20d40fb,b834311e-a83e-4167-88f3-148814355189,,2024-06-27T00:00:00,,,FECHA OFICIO ENVIA CONVENIO
4b89b064-2c99-452d-976d-631043aa734f,9df2e270-26b6-4828-b48e-90f030a159a1,ef4bda38-f2b2-4c54-ac7a-6d0d3b52cb04,136,2024-03-22T00:00:00,,,Nº RES INCORPORA/ CERT CORE
2d8d09f9-b371-4248-b5b1-8e99f6bb00b9,9df2e270-26b6-4828-b48e-90f030a159a1,f5dca104-f319-43d3-be4d-41e6ff8a1a02,136,2024-03-22T00:00:00,,,Nº RES CREA ASIGNACIÓN
1e093630-4734-4e07-a35a-0e7ae0b267b5,9df2e270-26b6-4828-b48e-90f030a159a1,d5a008d4-cdd7-4ca2-b14e-484c6011385f,53,2024-05-17T00:00:00,AFECTA,,Nº RES APRUEBA CONVENIO 
dbbeef0a-c02f-4673-8ba6-19dc9543a41d,9df2e270-26b6-4828-b48e-90f030a159a1,95b43090-bfe5-41ac-b905-1b06d0490d6e,1047,,,7/17/2024,Nº OFICIO ENVIA CONVENIO
78bd0087-1bd2-4915-9a41-33e39994f10f,9df2e270-26b6-4828-b48e-90f030a159a1,7829044c-ff69-4867-9ef3-086056e276b6,12/07/2024,2024-07-12T00:00:00,,,FECHA TOMA DE RAZON DE CGR
b5e7ff62-0386-4f70-a9d4-a525da216b7b,9df2e270-26b6-4828-b48e-90f030a159a1,b834311e-a83e-4167-88f3-148814355189,,,,7/17/2024,FECHA OFICIO ENVIA CONVENIO
ed93411d-10cd-4504-a785-3cd83d7d6fde,6fb3724c-cac8-4c00-ad18-9e3b604ccff1,ef4bda38-f2b2-4c54-ac7a-6d0d3b52cb04,911,2023-08-22T00:00:00,,,Nº RES INCORPORA/ CERT CORE
7e2d165f-8d96-4462-8641-467933e56443,6fb3724c-cac8-4c00-ad18-9e3b604ccff1,f5dca104-f319-43d3-be4d-41e6ff8a1a02,911,2023-08-22T00:00:00,,,Nº RES CREA ASIGNACIÓN
d7609974-d392-478c-9870-985de878b1f7,6fb3724c-cac8-4c00-ad18-9e3b604ccff1,d5a008d4-cdd7-4ca2-b14e-484c6011385f,967,2023-09-05T00:00:00,EXENTA,,Nº RES APRUEBA CONVENIO 
a4cfc94e-5397-445d-b0a2-db3b45e2e8e1,6fb3724c-cac8-4c00-ad18-9e3b604ccff1,7829044c-ff69-4867-9ef3-086056e276b6,,,,,FECHA TOMA DE RAZON DE CGR
fce9726c-432c-433d-92e5-b7d39572c6d7,6fb3724c-cac8-4c00-ad18-9e3b604ccff1,70f8df47-02e5-4fdc-8201-572c25e54089,1291/19.12.2023,,,1291/19.12.2023,Nº RES REFERENTE TECNICO
11f22089-cedf-48a4-9865-8bd002ccf6f1,c9247677-dd23-4394-9093-4112fa3ca18e,ef4bda38-f2b2-4c54-ac7a-6d0d3b52cb04,911,2023-08-22T00:00:00,,,Nº RES INCORPORA/ CERT CORE
61ef93a1-64ec-4870-9132-5899a0f139ab,c9247677-dd23-4394-9093-4112fa3ca18e,f5dca104-f319-43d3-be4d-41e6ff8a1a02,911,2023-08-22T00:00:00,,,Nº RES CREA ASIGNACIÓN
ad444a19-7b0b-47fc-8f7b-4d15a2ba4577,c9247677-dd23-4394-9093-4112fa3ca18e,d5a008d4-cdd7-4ca2-b14e-484c6011385f,1353,2023-12-28T00:00:00,EXENTA,,Nº RES APRUEBA CONVENIO 
c3f87db9-36f4-4adb-8458-7be7443dbc03,c9247677-dd23-4394-9093-4112fa3ca18e,7829044c-ff69-4867-9ef3-086056e276b6,,,,,FECHA TOMA DE RAZON DE CGR
dd677223-b1d1-4215-9374-461d405887d8,c9247677-dd23-4394-9093-4112fa3ca18e,70f8df47-02e5-4fdc-8201-572c25e54089,1291/19.12.2023,,,1291/19.12.2023,Nº RES REFERENTE TECNICO
c9c600d0-fd11-4dc3-ba1f-4baa06f885e2,320e8021-1661-4efe-afd1-c9e1a0f7ed27,ef4bda38-f2b2-4c54-ac7a-6d0d3b52cb04,911,2023-08-22T00:00:00,,,Nº RES INCORPORA/ CERT CORE
23108f3b-9a18-4ebf-950c-8d9936749495,320e8021-1661-4efe-afd1-c9e1a0f7ed27,f5dca104-f319-43d3-be4d-41e6ff8a1a02,911,2023-08-22T00:00:00,,,Nº RES CREA ASIGNACIÓN
b337c69c-f3f3-4c02-9511-d45cac2d86ba,320e8021-1661-4efe-afd1-c9e1a0f7ed27,d5a008d4-cdd7-4ca2-b14e-484c6011385f,946,2023-09-01T00:00:00,EXENTA,,Nº RES APRUEBA CONVENIO 
bbc0a8a1-c42f-4653-b6d6-c479a9911fb1,320e8021-1661-4efe-afd1-c9e1a0f7ed27,7829044c-ff69-4867-9ef3-086056e276b6,,,,,FECHA TOMA DE RAZON DE CGR
05c0eba1-e65b-498b-8a70-c1222b4824ff,320e8021-1661-4efe-afd1-c9e1a0f7ed27,70f8df47-02e5-4fdc-8201-572c25e54089,279/02.05.2024,,,279/02.05.2024,Nº RES REFERENTE TECNICO
4452126b-fa8f-47a6-b83d-ad6595912a16,880e4b52-3668-4525-ae06-c5ab86aa69e4,ef4bda38-f2b2-4c54-ac7a-6d0d3b52cb04,911,2023-08-22T00:00:00,,,Nº RES INCORPORA/ CERT CORE
e9d03b5d-a553-4adc-87d5-3f9dae823f87,880e4b52-3668-4525-ae06-c5ab86aa69e4,f5dca104-f319-43d3-be4d-41e6ff8a1a02,911,2023-08-22T00:00:00,,,Nº RES CREA ASIGNACIÓN
e12366f3-dc3f-42d0-a646-7974495dbf1e,880e4b52-3668-4525-ae06-c5ab86aa69e4,d5a008d4-cdd7-4ca2-b14e-484c6011385f,944,2023-09-01T00:00:00,EXENTA,,Nº RES APRUEBA CONVENIO 
73e28451-2a38-42e7-bec5-63625e88eb22,880e4b52-3668-4525-ae06-c5ab86aa69e4,7829044c-ff69-4867-9ef3-086056e276b6,,,,,FECHA TOMA DE RAZON DE CGR
940b58f9-03de-47e8-9de1-7650a04cc072,880e4b52-3668-4525-ae06-c5ab86aa69e4,70f8df47-02e5-4fdc-8201-572c25e54089,1291/19.12.2023,,,1291/19.12.2023,Nº RES REFERENTE TECNICO
25f6d2b7-43f8-4496-aa34-52639f954c71,b1c4695b-9f47-4143-8caf-9084950bd4bb,ef4bda38-f2b2-4c54-ac7a-6d0d3b52cb04,914,2023-08-22T00:00:00,,,Nº RES INCORPORA/ CERT CORE
58e74727-1e14-418d-bacf-4de485fdb7bb,b1c4695b-9f47-4143-8caf-9084950bd4bb,f5dca104-f319-43d3-be4d-41e6ff8a1a02,914,2023-08-22T00:00:00,,,Nº RES CREA ASIGNACIÓN
b3fddb16-ab21-4b9c-b24a-5cb87f4cdc4b,b1c4695b-9f47-4143-8caf-9084950bd4bb,d5a008d4-cdd7-4ca2-b14e-484c6011385f,1139,2023-10-31T00:00:00,EXENTA,,Nº RES APRUEBA CONVENIO 
cfb200c2-ea26-4226-ae54-4b55cfcfe215,b1c4695b-9f47-4143-8caf-9084950bd4bb,7829044c-ff69-4867-9ef3-086056e276b6,,,,,FECHA TOMA DE RAZON DE CGR
f0e558ae-10ee-4edc-95b9-94b2169823ab,b1c4695b-9f47-4143-8caf-9084950bd4bb,70f8df47-02e5-4fdc-8201-572c25e54089,1291/19.12.2023,,,1291/19.12.2023,Nº RES REFERENTE TECNICO
57d729cb-093c-46f6-9566-f0fa08a3e1f6,4a2335fc-91bf-48fc-acb3-23ab4b0befb3,ef4bda38-f2b2-4c54-ac7a-6d0d3b52cb04,914,2023-08-22T00:00:00,,,Nº RES INCORPORA/ CERT CORE
07105552-2d19-4871-904d-35c920d4cb5f,4a2335fc-91bf-48fc-acb3-23ab4b0befb3,f5dca104-f319-43d3-be4d-41e6ff8a1a02,914,2023-08-22T00:00:00,,,Nº RES CREA ASIGNACIÓN
8e1e20a3-531d-4147-89b6-bae1b293817b,4a2335fc-91bf-48fc-acb3-23ab4b0befb3,d5a008d4-cdd7-4ca2-b14e-484c6011385f,943,2023-09-01T00:00:00,EXENTA,,Nº RES APRUEBA CONVENIO 
5dbfe415-eccf-4a52-8215-da069f54995e,4a2335fc-91bf-48fc-acb3-23ab4b0befb3,7829044c-ff69-4867-9ef3-086056e276b6,,,,,FECHA TOMA DE RAZON DE CGR
dc34d58e-ee8c-4ba5-843e-789b5f91d4c2,4a2335fc-91bf-48fc-acb3-23ab4b0befb3,70f8df47-02e5-4fdc-8201-572c25e54089,279/02.05.2024,,,279/02.05.2024,Nº RES REFERENTE TECNICO
46dd9a5d-4c53-43bc-980c-8d82aa09ad98,fc2b733e-fbed-4a98-a807-d25d14165a52,ef4bda38-f2b2-4c54-ac7a-6d0d3b52cb04,914,2023-08-22T00:00:00,,,Nº RES INCORPORA/ CERT CORE
4f94a035-48d2-487e-be32-05d4d4df1f0e,fc2b733e-fbed-4a98-a807-d25d14165a52,f5dca104-f319-43d3-be4d-41e6ff8a1a02,914,2023-08-22T00:00:00,,,Nº RES CREA ASIGNACIÓN
bcbc8a29-9d39-46c1-9a3e-1d26832139c3,fc2b733e-fbed-4a98-a807-d25d14165a52,d5a008d4-cdd7-4ca2-b14e-484c6011385f,945,2023-09-01T00:00:00,EXENTA,,Nº RES APRUEBA CONVENIO 
aebf4ad5-7faf-45b1-82eb-c72b3494223d,fc2b733e-fbed-4a98-a807-d25d14165a52,7829044c-ff69-4867-9ef3-086056e276b6,,,,,FECHA TOMA DE RAZON DE CGR
cbcc13fe-e9c2-4640-a34c-acb59a8f4c69,fc2b733e-fbed-4a98-a807-d25d14165a52,70f8df47-02e5-4fdc-8201-572c25e54089,1291/19.12.2023,,,1291/19.12.2023,Nº RES REFERENTE TECNICO
6d4a40af-9ef5-4f7a-ba66-dc6039948b17,137477f1-e5d8-4d4a-b66f-98da1b16cdcc,ef4bda38-f2b2-4c54-ac7a-6d0d3b52cb04,914,2023-08-22T00:00:00,,,Nº RES INCORPORA/ CERT CORE
d1562eff-631b-430b-af56-88d6b72e9eda,137477f1-e5d8-4d4a-b66f-98da1b16cdcc,f5dca104-f319-43d3-be4d-41e6ff8a1a02,914,2023-08-22T00:00:00,,,Nº RES CREA ASIGNACIÓN
1673ae1e-243e-4826-835e-64c7be3edcc5,137477f1-e5d8-4d4a-b66f-98da1b16cdcc,d5a008d4-cdd7-4ca2-b14e-484c6011385f,1062,2023-10-13T00:00:00,EXENTA,,Nº RES APRUEBA CONVENIO 
0bda0979-def3-4f6b-a514-aa3317ce75af,137477f1-e5d8-4d4a-b66f-98da1b16cdcc,7829044c-ff69-4867-9ef3-086056e276b6,,,,,FECHA TOMA DE RAZON DE CGR
11ec3104-c3f6-487a-8f24-5ceb50dc2be1,137477f1-e5d8-4d4a-b66f-98da1b16cdcc,70f8df47-02e5-4fdc-8201-572c25e54089,1291/19.12.2023,,,1291/19.12.2023,Nº RES REFERENTE TECNICO
257ba070-18cb-4b0b-8120-f5b8a5ed6fe1,f5c45727-bb6d-4d98-88eb-202f8ee58001,ef4bda38-f2b2-4c54-ac7a-6d0d3b52cb04,143,2024-03-26T00:00:00,,,Nº RES INCORPORA/ CERT CORE
1aff3b52-32e5-4f34-8e9b-4bcd287f8fe9,f5c45727-bb6d-4d98-88eb-202f8ee58001,f5dca104-f319-43d3-be4d-41e6ff8a1a02,19,2024-04-01T00:00:00,,,Nº RES CREA ASIGNACIÓN
d8a10769-ee45-4528-be0b-bfcc94cb7149,f5c45727-bb6d-4d98-88eb-202f8ee58001,d5a008d4-cdd7-4ca2-b14e-484c6011385f,54,2024-06-14T00:00:00,AFECTA,,Nº RES APRUEBA CONVENIO 
735df6c6-588a-4a86-b951-741e1d4574b0,f5c45727-bb6d-4d98-88eb-202f8ee58001,95b43090-bfe5-41ac-b905-1b06d0490d6e,1007,2024-07-08T00:00:00,,,Nº OFICIO ENVIA CONVENIO
04b61a10-d0be-481c-908b-b21ef7ac3b79,f5c45727-bb6d-4d98-88eb-202f8ee58001,7829044c-ff69-4867-9ef3-086056e276b6,03/07/2024,2024-07-03T00:00:00,,,FECHA TOMA DE RAZON DE CGR
e1830cc9-4bfc-4cc3-b11c-e96fd43dbd81,f5c45727-bb6d-4d98-88eb-202f8ee58001,b834311e-a83e-4167-88f3-148814355189,,2024-07-08T00:00:00,,,FECHA OFICIO ENVIA CONVENIO
ee6adcdd-11f2-4582-9eb8-860f2ee4b19f,0ea5ed85-cf32-42de-843d-2b5f7aad83ce,ef4bda38-f2b2-4c54-ac7a-6d0d3b52cb04,136,2024-03-22T00:00:00,,,Nº RES INCORPORA/ CERT CORE
5a0a84ed-5d23-44ce-9028-38f7dcc36561,0ea5ed85-cf32-42de-843d-2b5f7aad83ce,f5dca104-f319-43d3-be4d-41e6ff8a1a02,136,2024-03-22T00:00:00,,,Nº RES CREA ASIGNACIÓN
424af611-a6f8-4adb-b95c-c2f411bc0324,0ea5ed85-cf32-42de-843d-2b5f7aad83ce,d5a008d4-cdd7-4ca2-b14e-484c6011385f,55,2024-06-14T00:00:00,AFECTA,,Nº RES APRUEBA CONVENIO 
8868d20b-1169-4fb3-bafd-0a40ba416da5,0ea5ed85-cf32-42de-843d-2b5f7aad83ce,95b43090-bfe5-41ac-b905-1b06d0490d6e,1046,,,7/17/2024,Nº OFICIO ENVIA CONVENIO
104dbaff-6fb6-4a5e-8e10-69faad1e006f,0ea5ed85-cf32-42de-843d-2b5f7aad83ce,7829044c-ff69-4867-9ef3-086056e276b6,12/07/2024,2024-07-12T00:00:00,,,FECHA TOMA DE RAZON DE CGR
cfea81b9-2983-40b5-8460-63617b09ae86,0ea5ed85-cf32-42de-843d-2b5f7aad83ce,b834311e-a83e-4167-88f3-148814355189,,,,7/17/2024,FECHA OFICIO ENVIA CONVENIO
963a5384-4ada-4d0b-92a0-067efe8db5d6,91a4f931-8d92-4d63-a3c5-d23dfb4d7f62,f5dca104-f319-43d3-be4d-41e6ff8a1a02,5,2024-02-13T00:00:00,,,Nº RES CREA ASIGNACIÓN
9651eea1-d29b-48a6-8204-50b91c77dc52,91a4f931-8d92-4d63-a3c5-d23dfb4d7f62,d5a008d4-cdd7-4ca2-b14e-484c6011385f,56,2024-06-14T00:00:00,AFECTA,,Nº RES APRUEBA CONVENIO 
e0a178fc-eeb8-424e-9cac-31accb4a9d96,91a4f931-8d92-4d63-a3c5-d23dfb4d7f62,7829044c-ff69-4867-9ef3-086056e276b6,12-07-2024,2024-07-12T00:00:00,,,FECHA TOMA DE RAZON DE CGR
219be8f8-83f0-4c65-be55-b6cc9a63a9da,45f28096-7514-4635-ac66-956675edf6fc,ef4bda38-f2b2-4c54-ac7a-6d0d3b52cb04,404,2024-06-05T00:00:00,,,Nº RES INCORPORA/ CERT CORE
8c14d2bb-e326-4305-b6bc-4b7c9d88ba56,45f28096-7514-4635-ac66-956675edf6fc,f5dca104-f319-43d3-be4d-41e6ff8a1a02,6,2024-02-13T00:00:00,,,Nº RES CREA ASIGNACIÓN
e8fe1d9a-6514-45ba-ba26-fc58f492efb3,45f28096-7514-4635-ac66-956675edf6fc,d5a008d4-cdd7-4ca2-b14e-484c6011385f,57,2024-06-14T00:00:00,AFECTA,,Nº RES APRUEBA CONVENIO 
06f58df4-3e17-464d-813f-ed7c40076352,45f28096-7514-4635-ac66-956675edf6fc,95b43090-bfe5-41ac-b905-1b06d0490d6e,696,2024-07-01T00:00:00,,,Nº OFICIO ENVIA CONVENIO
cb9e8ae1-0b44-4e03-b294-9715c72e494f,45f28096-7514-4635-ac66-956675edf6fc,7829044c-ff69-4867-9ef3-086056e276b6,28/06/2024,2024-06-28T00:00:00,,,FECHA TOMA DE RAZON DE CGR
f8365ebb-5d4b-4587-8b68-3d08922c1016,45f28096-7514-4635-ac66-956675edf6fc,b834311e-a83e-4167-88f3-148814355189,,2024-07-01T00:00:00,,,FECHA OFICIO ENVIA CONVENIO
ccd35f18-d697-4d61-9e04-b1dd7869f04d,a1aefed4-eee0-4d8d-bc40-9045cca2c825,ef4bda38-f2b2-4c54-ac7a-6d0d3b52cb04,766/2023,2023-10-05T00:00:00,,,Nº RES INCORPORA/ CERT CORE
8d06a89c-9b1f-4707-90bc-13f083a04279,a1aefed4-eee0-4d8d-bc40-9045cca2c825,f5dca104-f319-43d3-be4d-41e6ff8a1a02,6,2024-02-13T00:00:00,,,Nº RES CREA ASIGNACIÓN
1b1218d1-d04b-4dff-8f93-b338a26b6397,a1aefed4-eee0-4d8d-bc40-9045cca2c825,d5a008d4-cdd7-4ca2-b14e-484c6011385f,58,2024-06-18T00:00:00,AFECTA,,Nº RES APRUEBA CONVENIO 
e2469d51-df2f-409d-9345-b3bb44d31ba9,a1aefed4-eee0-4d8d-bc40-9045cca2c825,95b43090-bfe5-41ac-b905-1b06d0490d6e,1008,2024-07-08T00:00:00,,,Nº OFICIO ENVIA CONVENIO
eebcbcf8-483e-4d9e-b537-07849193a4d6,a1aefed4-eee0-4d8d-bc40-9045cca2c825,7829044c-ff69-4867-9ef3-086056e276b6,03/07/2024,2024-07-03T00:00:00,,,FECHA TOMA DE RAZON DE CGR
e1a5b860-31d7-4f4a-9705-6d6b441baa22,a1aefed4-eee0-4d8d-bc40-9045cca2c825,b834311e-a83e-4167-88f3-148814355189,,2024-07-08T00:00:00,,,FECHA OFICIO ENVIA CONVENIO
c61c88b0-a7f2-4f6c-8418-697ddf270544,93fdefb6-1754-40b4-a6a3-617092e9fe47,ef4bda38-f2b2-4c54-ac7a-6d0d3b52cb04,837/2023,2023-12-21T00:00:00,,,Nº RES INCORPORA/ CERT CORE
dc2b58e5-11b9-4333-848e-87f8c07a20f7,93fdefb6-1754-40b4-a6a3-617092e9fe47,f5dca104-f319-43d3-be4d-41e6ff8a1a02,6,2024-02-13T00:00:00,,,Nº RES CREA ASIGNACIÓN
87e73639-1abe-43ee-98e1-1df9d33df04a,93fdefb6-1754-40b4-a6a3-617092e9fe47,d5a008d4-cdd7-4ca2-b14e-484c6011385f,59,2024-06-18T00:00:00,AFECTA,,Nº RES APRUEBA CONVENIO 
86ebeb82-a704-42f4-897b-242b2b9785fc,93fdefb6-1754-40b4-a6a3-617092e9fe47,7829044c-ff69-4867-9ef3-086056e276b6,12/07/2024,2024-07-12T00:00:00,,,FECHA TOMA DE RAZON DE CGR
2e238c57-37bf-4ad4-a83e-664234da48e0,5e6e8d4f-544d-422d-bbbf-4de6964583e1,ef4bda38-f2b2-4c54-ac7a-6d0d3b52cb04,856/2024,2024-01-18T00:00:00,,,Nº RES INCORPORA/ CERT CORE
d87b6117-c04a-4738-918c-9298f9ae039f,5e6e8d4f-544d-422d-bbbf-4de6964583e1,f5dca104-f319-43d3-be4d-41e6ff8a1a02,6,2024-02-13T00:00:00,,,Nº RES CREA ASIGNACIÓN
3d444e96-8500-46c1-b253-f7651afe6bec,5e6e8d4f-544d-422d-bbbf-4de6964583e1,d5a008d4-cdd7-4ca2-b14e-484c6011385f,60,2024-06-18T00:00:00,AFECTA,,Nº RES APRUEBA CONVENIO 
e75accd0-b7e6-44d2-a8ec-963aaca49d94,93d4b6a1-5e69-46d0-a884-0425e9aa5967,ef4bda38-f2b2-4c54-ac7a-6d0d3b52cb04,964,2023-09-05T00:00:00,,,Nº RES INCORPORA/ CERT CORE
f2710321-e96b-40ee-b25a-693dc6a0eebf,93d4b6a1-5e69-46d0-a884-0425e9aa5967,f5dca104-f319-43d3-be4d-41e6ff8a1a02,964,2023-09-05T00:00:00,,,Nº RES CREA ASIGNACIÓN
d45e8c73-c535-4d4a-a600-fb8a92fbb770,93d4b6a1-5e69-46d0-a884-0425e9aa5967,d5a008d4-cdd7-4ca2-b14e-484c6011385f,1137,2023-10-31T00:00:00,EXENTA,,Nº RES APRUEBA CONVENIO 
3080141f-e9ca-44f8-ae03-e9cbbecd7981,93d4b6a1-5e69-46d0-a884-0425e9aa5967,7829044c-ff69-4867-9ef3-086056e276b6,,,,,FECHA TOMA DE RAZON DE CGR
6307474f-b07d-4acf-bbd5-8291bbcbc2fe,93d4b6a1-5e69-46d0-a884-0425e9aa5967,70f8df47-02e5-4fdc-8201-572c25e54089,279/02.05.2024,,,279/02.05.2024,Nº RES REFERENTE TECNICO
38b1edc6-cbcd-47b7-9358-c1bdf5724d82,79b3d2d8-f022-4703-97a3-e6c27d8935f0,ef4bda38-f2b2-4c54-ac7a-6d0d3b52cb04,964,2023-09-05T00:00:00,,,Nº RES INCORPORA/ CERT CORE
af19e2c0-f4b6-4a86-ac77-8b26e0979435,79b3d2d8-f022-4703-97a3-e6c27d8935f0,f5dca104-f319-43d3-be4d-41e6ff8a1a02,964,2023-09-05T00:00:00,,,Nº RES CREA ASIGNACIÓN
818f2109-aa8b-4f09-82b1-7360340251e8,79b3d2d8-f022-4703-97a3-e6c27d8935f0,d5a008d4-cdd7-4ca2-b14e-484c6011385f,1328,2023-12-22T00:00:00,EXENTA,,Nº RES APRUEBA CONVENIO 
b0182b4d-8c82-4bf4-ab46-c00a0897cca8,79b3d2d8-f022-4703-97a3-e6c27d8935f0,7829044c-ff69-4867-9ef3-086056e276b6,,,,,FECHA TOMA DE RAZON DE CGR
914d49bc-4f7d-4ba0-913e-912109549d9a,79b3d2d8-f022-4703-97a3-e6c27d8935f0,70f8df47-02e5-4fdc-8201-572c25e54089,1291/19.12.2023,,,1291/19.12.2023,Nº RES REFERENTE TECNICO
9fcc153c-2a77-42a9-b994-51c91e576be9,cc0f8664-4437-45e6-8d8d-7740237dbf88,ef4bda38-f2b2-4c54-ac7a-6d0d3b52cb04,964,2023-09-05T00:00:00,,,Nº RES INCORPORA/ CERT CORE
b0f8f4d9-4811-4e41-b7aa-ae72bd6fa277,cc0f8664-4437-45e6-8d8d-7740237dbf88,f5dca104-f319-43d3-be4d-41e6ff8a1a02,964,2023-09-05T00:00:00,,,Nº RES CREA ASIGNACIÓN
dc6eb51f-d015-4664-8c0f-0475b90dd7c5,cc0f8664-4437-45e6-8d8d-7740237dbf88,d5a008d4-cdd7-4ca2-b14e-484c6011385f,1323,2023-12-22T00:00:00,EXENTA,,Nº RES APRUEBA CONVENIO 
99a05799-c034-4a00-a3b3-d598ee52a677,cc0f8664-4437-45e6-8d8d-7740237dbf88,7829044c-ff69-4867-9ef3-086056e276b6,,,,,FECHA TOMA DE RAZON DE CGR
5612e0c9-d217-4704-86c9-8531e4c896e0,cc0f8664-4437-45e6-8d8d-7740237dbf88,70f8df47-02e5-4fdc-8201-572c25e54089,1291/19.12.2023,,,1291/19.12.2023,Nº RES REFERENTE TECNICO
9605a7a6-f9be-4ca6-97d7-9778727d8baa,5c4d1efe-f0d3-494b-9df5-daa9c01e7f95,ef4bda38-f2b2-4c54-ac7a-6d0d3b52cb04,87/2020,2020-04-13T00:00:00,,,Nº RES INCORPORA/ CERT CORE
111530f0-f515-458b-af5d-98d50bf125bb,5c4d1efe-f0d3-494b-9df5-daa9c01e7f95,f5dca104-f319-43d3-be4d-41e6ff8a1a02,145,2023-02-06T00:00:00,,,Nº RES CREA ASIGNACIÓN
f5e8d86d-301d-4dfe-8c38-04a02d67240b,5c4d1efe-f0d3-494b-9df5-daa9c01e7f95,d5a008d4-cdd7-4ca2-b14e-484c6011385f,62,2024-06-24T00:00:00,AFECTA,,Nº RES APRUEBA CONVENIO 
5c9dce49-7e90-4284-be2b-fe4206d524d9,5c4d1efe-f0d3-494b-9df5-daa9c01e7f95,95b43090-bfe5-41ac-b905-1b06d0490d6e,1046,,,7/17/2024,Nº OFICIO ENVIA CONVENIO
bf7513f4-a15f-4f56-a29f-dc931aa93601,5c4d1efe-f0d3-494b-9df5-daa9c01e7f95,7829044c-ff69-4867-9ef3-086056e276b6,12/07/2024,2024-07-12T00:00:00,,,FECHA TOMA DE RAZON DE CGR
376b3648-e314-4f77-9b1a-036bbb8fc34c,5c4d1efe-f0d3-494b-9df5-daa9c01e7f95,b834311e-a83e-4167-88f3-148814355189,,,,7/17/2024,FECHA OFICIO ENVIA CONVENIO
8ca4c4be-8efc-4da7-86fe-39551ba72a42,63268997-fdfa-4d37-8cb9-82ceb3e39219,ef4bda38-f2b2-4c54-ac7a-6d0d3b52cb04,769/2023,2023-10-05T00:00:00,,,Nº RES INCORPORA/ CERT CORE
7b7f90e0-ba19-44cb-b833-5ff5f8dfac28,63268997-fdfa-4d37-8cb9-82ceb3e39219,f5dca104-f319-43d3-be4d-41e6ff8a1a02,6,2024-02-13T00:00:00,,,Nº RES CREA ASIGNACIÓN
e395657c-82fb-4742-af34-c4d61a26c8c5,63268997-fdfa-4d37-8cb9-82ceb3e39219,d5a008d4-cdd7-4ca2-b14e-484c6011385f,63,2024-06-24T00:00:00,AFECTA,,Nº RES APRUEBA CONVENIO 
f78f0069-3ae9-4c51-8917-1b000355f8cd,63268997-fdfa-4d37-8cb9-82ceb3e39219,95b43090-bfe5-41ac-b905-1b06d0490d6e,1067,,,7/22/2024,Nº OFICIO ENVIA CONVENIO
41ac2c5e-b5ce-470a-b9db-a84163d6e9aa,63268997-fdfa-4d37-8cb9-82ceb3e39219,7829044c-ff69-4867-9ef3-086056e276b6,19/07/2024,2024-07-19T00:00:00,,,FECHA TOMA DE RAZON DE CGR
4549e899-b385-4626-9a15-301bceb49cc0,63268997-fdfa-4d37-8cb9-82ceb3e39219,b834311e-a83e-4167-88f3-148814355189,,,,7/22/2024,FECHA OFICIO ENVIA CONVENIO
571c02ce-15d8-42f4-943d-9e805ba91d07,b407bee4-bd13-4917-b453-ecd347149746,ef4bda38-f2b2-4c54-ac7a-6d0d3b52cb04,420,2024-06-18T00:00:00,,,Nº RES INCORPORA/ CERT CORE
cc68f309-e3ba-43d0-9b16-2cd23c844071,b407bee4-bd13-4917-b453-ecd347149746,f5dca104-f319-43d3-be4d-41e6ff8a1a02,420,2024-06-18T00:00:00,,,Nº RES CREA ASIGNACIÓN
cc0ef7ee-8ce4-43e2-8bdb-a25e772aff0f,b407bee4-bd13-4917-b453-ecd347149746,d5a008d4-cdd7-4ca2-b14e-484c6011385f,65,2024-06-28T00:00:00,AFECTA,,Nº RES APRUEBA CONVENIO 
a70165ac-88cc-41e6-bcac-be3d751fb5c2,b407bee4-bd13-4917-b453-ecd347149746,95b43090-bfe5-41ac-b905-1b06d0490d6e,1165,2024-08-06T00:00:00,,,Nº OFICIO ENVIA CONVENIO
