id,convenio_id,tipo_evento_id,numero_documento,fecha_documento,tipo_resolucion_norm,observacion_raw,columna_fuente
b83fa251-99cf-41db-acf2-59642db435dd,97f5f247-ce68-4ede-988d-5a9b652bcbf5,51a42c4b-ae0c-47cb-9b5b-df04c2f96343,708/15.05.2025,,,708/15.05.2025,Nº  Y FECHA OFICIO ENVIA CONVENIO
701b0ef8-f489-4f77-950a-ebfdc76a74cc,97f5f247-ce68-4ede-988d-5a9b652bcbf5,4e8a5aca-2be7-4abc-9ec9-4e16d0357942,708/15.05.2025,,,708/15.05.2025,Nº  Y FECHA OFICIO ENVIA CONVENIO
05a0b8ad-0492-4ba3-b950-9e5477f4fc76,97f5f247-ce68-4ede-988d-5a9b652bcbf5,8d80c2b8-875d-43a9-bb4e-117ed9aab422,708/15.05.2025,,,708/15.05.2025,Nº  Y FECHA OFICIO ENVIA CONVENIO
d5c14d96-0df6-45e5-9c69-aa39858def3d,97f5f247-ce68-4ede-988d-5a9b652bcbf5,ef2a95fc-fe72-4284-85e5-15897c60881c,708/15.05.2025,,,708/15.05.2025,Nº  Y FECHA OFICIO ENVIA CONVENIO
d0064b82-5fe1-48f6-ba98-c7f0575a3f93,97f5f247-ce68-4ede-988d-5a9b652bcbf5,0df1c4b6-ef93-4a00-a85a-acfafe36d421,708/15.05.2025,,,708/15.05.2025,Nº  Y FECHA OFICIO ENVIA CONVENIO
a4cd93d0-ffca-4c8f-a66b-5dc9e544030b,97f5f247-ce68-4ede-988d-5a9b652bcbf5,a2f5100f-2a50-4a51-a795-dde18abad7f9,708/15.05.2025,,,708/15.05.2025,Nº  Y FECHA OFICIO ENVIA CONVENIO
1caac9e3-0e1a-402f-965a-3f7e1a360827,97f5f247-ce68-4ede-988d-5a9b652bcbf5,671a8729-afed-428c-b81b-0dc36733afb8,708/15.05.2025,,,708/15.05.2025,Nº  Y FECHA OFICIO ENVIA CONVENIO
144a8a97-fab9-41b6-85d7-929cb8e2245c,cd84fee2-4846-4546-b243-80edb67d692e,51a42c4b-ae0c-47cb-9b5b-df04c2f96343,326/21.02.2025,,,326/21.02.2025,Nº  Y FECHA OFICIO ENVIA CONVENIO
3154f074-88e1-4b2f-8bf7-d4b0a34b3ad9,cd84fee2-4846-4546-b243-80edb67d692e,4e8a5aca-2be7-4abc-9ec9-4e16d0357942,326/21.02.2025,,,326/21.02.2025,Nº  Y FECHA OFICIO ENVIA CONVENIO
d15fb326-c4ba-4855-9d15-97e64229add8,cd84fee2-4846-4546-b243-80edb67d692e,8d80c2b8-875d-43a9-bb4e-117ed9aab422,326/21.02.2025,,,326/21.02.2025,Nº  Y FECHA OFICIO ENVIA CONVENIO
c4183562-e0ca-4c7b-9910-b0c5936a9258,cd84fee2-4846-4546-b243-80edb67d692e,ef2a95fc-fe72-4284-85e5-15897c60881c,326/21.02.2025,,,326/21.02.2025,Nº  Y FECHA OFICIO ENVIA CONVENIO
07b4068b-b162-4f4c-9168-7285e968921d,cd84fee2-4846-4546-b243-80edb67d692e,0df1c4b6-ef93-4a00-a85a-acfafe36d421,326/21.02.2025,,,326/21.02.2025,Nº  Y FECHA OFICIO ENVIA CONVENIO
59f9f5e5-af9e-446d-8452-6cc769e31918,cd84fee2-4846-4546-b243-80edb67d692e,a2f5100f-2a50-4a51-a795-dde18abad7f9,326/21.02.2025,,,326/21.02.2025,Nº  Y FECHA OFICIO ENVIA CONVENIO
211cfd22-85cf-4a67-9037-c8f47ac2b01d,cd84fee2-4846-4546-b243-80edb67d692e,671a8729-afed-428c-b81b-0dc36733afb8,326/21.02.2025,,,326/21.02.2025,Nº  Y FECHA OFICIO ENVIA CONVENIO
d8a1404d-02b2-4871-85a2-474e0f36d210,6dc32974-3c5e-4bfb-9057-0fcbc1035d7b,51a42c4b-ae0c-47cb-9b5b-df04c2f96343,326/21.02.2025,,,326/21.02.2025,Nº  Y FECHA OFICIO ENVIA CONVENIO
7ffa98a6-fe75-402d-91f5-ee80336d7149,6dc32974-3c5e-4bfb-9057-0fcbc1035d7b,4e8a5aca-2be7-4abc-9ec9-4e16d0357942,326/21.02.2025,,,326/21.02.2025,Nº  Y FECHA OFICIO ENVIA CONVENIO
dfb74133-d85d-462a-bed8-2b1efe68c6bc,6dc32974-3c5e-4bfb-9057-0fcbc1035d7b,8d80c2b8-875d-43a9-bb4e-117ed9aab422,326/21.02.2025,,,326/21.02.2025,Nº  Y FECHA OFICIO ENVIA CONVENIO
b69d67ae-4447-4b2c-ba1e-90e581a6fee7,6dc32974-3c5e-4bfb-9057-0fcbc1035d7b,ef2a95fc-fe72-4284-85e5-15897c60881c,326/21.02.2025,,,326/21.02.2025,Nº  Y FECHA OFICIO ENVIA CONVENIO
5188685b-ddee-4604-8804-78828b75534d,6dc32974-3c5e-4bfb-9057-0fcbc1035d7b,0df1c4b6-ef93-4a00-a85a-acfafe36d421,326/21.02.2025,,,326/21.02.2025,Nº  Y FECHA OFICIO ENVIA CONVENIO
dfb79142-eac6-4fa3-b5cf-d6b30535af6d,6dc32974-3c5e-4bfb-9057-0fcbc1035d7b,a2f5100f-2a50-4a51-a795-dde18abad7f9,326/21.02.2025,,,326/21.02.2025,Nº  Y FECHA OFICIO ENVIA CONVENIO
45f76ece-72ab-4c2c-9b22-58a699b3dc13,6dc32974-3c5e-4bfb-9057-0fcbc1035d7b,671a8729-afed-428c-b81b-0dc36733afb8,326/21.02.2025,,,326/21.02.2025,Nº  Y FECHA OFICIO ENVIA CONVENIO
359c722a-fd3b-4148-81d5-2c78aa3e38f2,8572987c-348d-45c6-95d0-eab960e60c21,51a42c4b-ae0c-47cb-9b5b-df04c2f96343,709/15.05.2025,,,709/15.05.2025,Nº  Y FECHA OFICIO ENVIA CONVENIO
ff2dfb81-2738-48c2-9872-de725d1b4205,8572987c-348d-45c6-95d0-eab960e60c21,4e8a5aca-2be7-4abc-9ec9-4e16d0357942,709/15.05.2025,,,709/15.05.2025,Nº  Y FECHA OFICIO ENVIA CONVENIO
34ffeb46-92ef-4ab1-b599-31405ebda60f,8572987c-348d-45c6-95d0-eab960e60c21,8d80c2b8-875d-43a9-bb4e-117ed9aab422,709/15.05.2025,,,709/15.05.2025,Nº  Y FECHA OFICIO ENVIA CONVENIO
ac221777-da5e-45c3-bdff-7edd0f8710cd,8572987c-348d-45c6-95d0-eab960e60c21,ef2a95fc-fe72-4284-85e5-15897c60881c,709/15.05.2025,,,709/15.05.2025,Nº  Y FECHA OFICIO ENVIA CONVENIO
676ef7df-640e-4ada-a0cf-68fde9a25549,8572987c-348d-45c6-95d0-eab960e60c21,0df1c4b6-ef93-4a00-a85a-acfafe36d421,709/15.05.2025,,,709/15.05.2025,Nº  Y FECHA OFICIO ENVIA CONVENIO
a0da538e-503a-4531-8a03-572f0611ef3e,8572987c-348d-45c6-95d0-eab960e60c21,a2f5100f-2a50-4a51-a795-dde18abad7f9,709/15.05.2025,,,709/15.05.2025,Nº  Y FECHA OFICIO ENVIA CONVENIO
3c2dc0a2-5cce-4dfd-bbe2-9cf73c054d20,8572987c-348d-45c6-95d0-eab960e60c21,671a8729-afed-428c-b81b-0dc36733afb8,709/15.05.2025,,,709/15.05.2025,Nº  Y FECHA OFICIO ENVIA CONVENIO
6e90943f-92e1-46bc-bc1f-a0b76948e25c,a882eeed-b62c-4875-b833-e5c34def310b,51a42c4b-ae0c-47cb-9b5b-df04c2f96343,709/15.05.2025,,,709/15.05.2025,Nº  Y FECHA OFICIO ENVIA CONVENIO
badbc929-feb2-4e9a-a2f7-799a0c1fad6c,a882eeed-b62c-4875-b833-e5c34def310b,4e8a5aca-2be7-4abc-9ec9-4e16d0357942,709/15.05.2025,,,709/15.05.2025,Nº  Y FECHA OFICIO ENVIA CONVENIO
1d2d0e93-b39c-438b-8046-500505eb3db1,a882eeed-b62c-4875-b833-e5c34def310b,8d80c2b8-875d-43a9-bb4e-117ed9aab422,709/15.05.2025,,,709/15.05.2025,Nº  Y FECHA OFICIO ENVIA CONVENIO
20166bcb-da98-4490-9c70-e2f7b2c5eff7,a882eeed-b62c-4875-b833-e5c34def310b,ef2a95fc-fe72-4284-85e5-15897c60881c,709/15.05.2025,,,709/15.05.2025,Nº  Y FECHA OFICIO ENVIA CONVENIO
fb0a67ff-77a3-4d66-987c-b7d778a32eac,a882eeed-b62c-4875-b833-e5c34def310b,0df1c4b6-ef93-4a00-a85a-acfafe36d421,709/15.05.2025,,,709/15.05.2025,Nº  Y FECHA OFICIO ENVIA CONVENIO
d7f6e857-0fd5-43e8-a7a2-523a51e9351b,a882eeed-b62c-4875-b833-e5c34def310b,a2f5100f-2a50-4a51-a795-dde18abad7f9,709/15.05.2025,,,709/15.05.2025,Nº  Y FECHA OFICIO ENVIA CONVENIO
1c8f128c-8a7f-4b0a-aee2-cdd12839f8d4,a882eeed-b62c-4875-b833-e5c34def310b,671a8729-afed-428c-b81b-0dc36733afb8,709/15.05.2025,,,709/15.05.2025,Nº  Y FECHA OFICIO ENVIA CONVENIO
ec909ad5-ab56-4481-949d-1ef884d5de2f,bb951545-1d9b-479e-a32b-9fa45e58074f,51a42c4b-ae0c-47cb-9b5b-df04c2f96343,709/15.05.2025,,,709/15.05.2025,Nº  Y FECHA OFICIO ENVIA CONVENIO
aae220e7-bf30-4892-a439-7a37a39f743c,bb951545-1d9b-479e-a32b-9fa45e58074f,4e8a5aca-2be7-4abc-9ec9-4e16d0357942,709/15.05.2025,,,709/15.05.2025,Nº  Y FECHA OFICIO ENVIA CONVENIO
ea3e96b6-bb3f-4d10-be64-2ff474593f75,bb951545-1d9b-479e-a32b-9fa45e58074f,8d80c2b8-875d-43a9-bb4e-117ed9aab422,709/15.05.2025,,,709/15.05.2025,Nº  Y FECHA OFICIO ENVIA CONVENIO
fbb6221b-eaff-44b6-995f-571c6b428a6f,bb951545-1d9b-479e-a32b-9fa45e58074f,ef2a95fc-fe72-4284-85e5-15897c60881c,709/15.05.2025,,,709/15.05.2025,Nº  Y FECHA OFICIO ENVIA CONVENIO
688ec7ce-c8a1-43cd-9435-ee1c7c9af46f,bb951545-1d9b-479e-a32b-9fa45e58074f,0df1c4b6-ef93-4a00-a85a-acfafe36d421,709/15.05.2025,,,709/15.05.2025,Nº  Y FECHA OFICIO ENVIA CONVENIO
a3898461-6112-4bc3-bba4-ad13dca57e86,bb951545-1d9b-479e-a32b-9fa45e58074f,a2f5100f-2a50-4a51-a795-dde18abad7f9,709/15.05.2025,,,709/15.05.2025,Nº  Y FECHA OFICIO ENVIA CONVENIO
91f12bcd-10ba-4c2f-85a9-b65a02e97b65,bb951545-1d9b-479e-a32b-9fa45e58074f,671a8729-afed-428c-b81b-0dc36733afb8,709/15.05.2025,,,709/15.05.2025,Nº  Y FECHA OFICIO ENVIA CONVENIO
f2467c76-4c1c-48c7-ae37-561b0f2750e2,196ba81e-8a05-4e95-9cfa-9ca03d806b61,51a42c4b-ae0c-47cb-9b5b-df04c2f96343,709/15.05.2025,,,709/15.05.2025,Nº  Y FECHA OFICIO ENVIA CONVENIO
bd404b30-8259-45d1-bf83-fc0af514fd05,196ba81e-8a05-4e95-9cfa-9ca03d806b61,4e8a5aca-2be7-4abc-9ec9-4e16d0357942,709/15.05.2025,,,709/15.05.2025,Nº  Y FECHA OFICIO ENVIA CONVENIO
b6025f99-0740-4b56-9437-4875498635ac,196ba81e-8a05-4e95-9cfa-9ca03d806b61,8d80c2b8-875d-43a9-bb4e-117ed9aab422,709/15.05.2025,,,709/15.05.2025,Nº  Y FECHA OFICIO ENVIA CONVENIO
d8c03428-7bf3-4d63-b724-79ec52efcc1a,196ba81e-8a05-4e95-9cfa-9ca03d806b61,ef2a95fc-fe72-4284-85e5-15897c60881c,709/15.05.2025,,,709/15.05.2025,Nº  Y FECHA OFICIO ENVIA CONVENIO
36c39874-64ef-4493-b87d-54ac21c1968d,196ba81e-8a05-4e95-9cfa-9ca03d806b61,0df1c4b6-ef93-4a00-a85a-acfafe36d421,709/15.05.2025,,,709/15.05.2025,Nº  Y FECHA OFICIO ENVIA CONVENIO
0d9c1176-d049-46a0-bef2-8ff96747b3f8,196ba81e-8a05-4e95-9cfa-9ca03d806b61,a2f5100f-2a50-4a51-a795-dde18abad7f9,709/15.05.2025,,,709/15.05.2025,Nº  Y FECHA OFICIO ENVIA CONVENIO
152a4e46-de75-41d0-9f07-fbbfc64229a9,196ba81e-8a05-4e95-9cfa-9ca03d806b61,671a8729-afed-428c-b81b-0dc36733afb8,709/15.05.2025,,,709/15.05.2025,Nº  Y FECHA OFICIO ENVIA CONVENIO
222072b7-e12c-431d-a961-4408705149fb,b8b2510d-3ecb-4261-8b0b-03867b670f25,51a42c4b-ae0c-47cb-9b5b-df04c2f96343,709/15.05.2025,,,709/15.05.2025,Nº  Y FECHA OFICIO ENVIA CONVENIO
a4b5a9dd-7262-4331-9204-4a39fb65f819,b8b2510d-3ecb-4261-8b0b-03867b670f25,4e8a5aca-2be7-4abc-9ec9-4e16d0357942,709/15.05.2025,,,709/15.05.2025,Nº  Y FECHA OFICIO ENVIA CONVENIO
7ba54f1c-3c2b-4e49-8c65-5d63740fa3fc,b8b2510d-3ecb-4261-8b0b-03867b670f25,8d80c2b8-875d-43a9-bb4e-117ed9aab422,709/15.05.2025,,,709/15.05.2025,Nº  Y FECHA OFICIO ENVIA CONVENIO
4cf94824-5cf7-408b-a6f6-ca2e02b3efbf,b8b2510d-3ecb-4261-8b0b-03867b670f25,ef2a95fc-fe72-4284-85e5-15897c60881c,709/15.05.2025,,,709/15.05.2025,Nº  Y FECHA OFICIO ENVIA CONVENIO
5075fb65-37b4-43ec-b4bc-652622d9e7d6,b8b2510d-3ecb-4261-8b0b-03867b670f25,0df1c4b6-ef93-4a00-a85a-acfafe36d421,709/15.05.2025,,,709/15.05.2025,Nº  Y FECHA OFICIO ENVIA CONVENIO
1955873e-d07c-4f72-babb-dc5575dd0c0c,b8b2510d-3ecb-4261-8b0b-03867b670f25,a2f5100f-2a50-4a51-a795-dde18abad7f9,709/15.05.2025,,,709/15.05.2025,Nº  Y FECHA OFICIO ENVIA CONVENIO
484c4264-1b48-4184-97ea-2f1e6bdc45b2,b8b2510d-3ecb-4261-8b0b-03867b670f25,671a8729-afed-428c-b81b-0dc36733afb8,709/15.05.2025,,,709/15.05.2025,Nº  Y FECHA OFICIO ENVIA CONVENIO
329097e1-52f2-4736-a3e2-5113a4f05222,3f57b913-845b-485f-abcc-f25e1026f06c,51a42c4b-ae0c-47cb-9b5b-df04c2f96343,320/20.02.2025,,,320/20.02.2025,Nº  Y FECHA OFICIO ENVIA CONVENIO
34fce677-d1cf-480a-8527-72d35f9d5898,3f57b913-845b-485f-abcc-f25e1026f06c,4e8a5aca-2be7-4abc-9ec9-4e16d0357942,320/20.02.2025,,,320/20.02.2025,Nº  Y FECHA OFICIO ENVIA CONVENIO
b86abbeb-8f24-4812-ab37-2a31d757b0f4,3f57b913-845b-485f-abcc-f25e1026f06c,8d80c2b8-875d-43a9-bb4e-117ed9aab422,320/20.02.2025,,,320/20.02.2025,Nº  Y FECHA OFICIO ENVIA CONVENIO
359fad6d-96e2-4e0d-b28c-b2425f68ed38,3f57b913-845b-485f-abcc-f25e1026f06c,ef2a95fc-fe72-4284-85e5-15897c60881c,320/20.02.2025,,,320/20.02.2025,Nº  Y FECHA OFICIO ENVIA CONVENIO
0ecb2919-4c1c-4766-b3bf-174197766615,3f57b913-845b-485f-abcc-f25e1026f06c,0df1c4b6-ef93-4a00-a85a-acfafe36d421,320/20.02.2025,,,320/20.02.2025,Nº  Y FECHA OFICIO ENVIA CONVENIO
33902244-2734-4c2d-86fd-07710287da30,3f57b913-845b-485f-abcc-f25e1026f06c,a2f5100f-2a50-4a51-a795-dde18abad7f9,320/20.02.2025,,,320/20.02.2025,Nº  Y FECHA OFICIO ENVIA CONVENIO
f495026c-e802-4af4-871b-53b3d6e772d1,3f57b913-845b-485f-abcc-f25e1026f06c,671a8729-afed-428c-b81b-0dc36733afb8,320/20.02.2025,,,320/20.02.2025,Nº  Y FECHA OFICIO ENVIA CONVENIO
fe029f45-ba1d-4f79-b4f6-67c1556663a8,8c6dccd9-6cde-4a87-8e39-229ef7ff23a1,51a42c4b-ae0c-47cb-9b5b-df04c2f96343,321/20.02.2025,,,321/20.02.2025,Nº  Y FECHA OFICIO ENVIA CONVENIO
b542a1e3-8d4c-4dc9-803c-220838b70098,8c6dccd9-6cde-4a87-8e39-229ef7ff23a1,4e8a5aca-2be7-4abc-9ec9-4e16d0357942,321/20.02.2025,,,321/20.02.2025,Nº  Y FECHA OFICIO ENVIA CONVENIO
5a63c700-bd5c-48a5-9f70-bd8ca9b36025,8c6dccd9-6cde-4a87-8e39-229ef7ff23a1,8d80c2b8-875d-43a9-bb4e-117ed9aab422,321/20.02.2025,,,321/20.02.2025,Nº  Y FECHA OFICIO ENVIA CONVENIO
3a861afc-c5ad-4c9b-99ca-bb1268283524,8c6dccd9-6cde-4a87-8e39-229ef7ff23a1,ef2a95fc-fe72-4284-85e5-15897c60881c,321/20.02.2025,,,321/20.02.2025,Nº  Y FECHA OFICIO ENVIA CONVENIO
5a577eb9-ce52-4d35-86c2-eb3ff52e40d3,8c6dccd9-6cde-4a87-8e39-229ef7ff23a1,0df1c4b6-ef93-4a00-a85a-acfafe36d421,321/20.02.2025,,,321/20.02.2025,Nº  Y FECHA OFICIO ENVIA CONVENIO
749109a6-324b-4c96-9413-7075f8618c65,8c6dccd9-6cde-4a87-8e39-229ef7ff23a1,a2f5100f-2a50-4a51-a795-dde18abad7f9,321/20.02.2025,,,321/20.02.2025,Nº  Y FECHA OFICIO ENVIA CONVENIO
92ad366b-dd63-48ca-bf75-47580e48a7bc,8c6dccd9-6cde-4a87-8e39-229ef7ff23a1,671a8729-afed-428c-b81b-0dc36733afb8,321/20.02.2025,,,321/20.02.2025,Nº  Y FECHA OFICIO ENVIA CONVENIO
abc2beb6-5396-45f3-8658-bfc8ffbf0dce,aa2e3b3f-270c-4a81-ab07-880f335cf6dc,51a42c4b-ae0c-47cb-9b5b-df04c2f96343,320/20.02.2025,,,320/20.02.2025,Nº  Y FECHA OFICIO ENVIA CONVENIO
a0f44b2b-0215-42bf-9446-39d1e1077997,aa2e3b3f-270c-4a81-ab07-880f335cf6dc,4e8a5aca-2be7-4abc-9ec9-4e16d0357942,320/20.02.2025,,,320/20.02.2025,Nº  Y FECHA OFICIO ENVIA CONVENIO
2dc8f3db-7408-4cfb-9e81-f5a45e70b0c1,aa2e3b3f-270c-4a81-ab07-880f335cf6dc,8d80c2b8-875d-43a9-bb4e-117ed9aab422,320/20.02.2025,,,320/20.02.2025,Nº  Y FECHA OFICIO ENVIA CONVENIO
2692b06c-9503-47f6-81dd-08d7b42ed774,aa2e3b3f-270c-4a81-ab07-880f335cf6dc,ef2a95fc-fe72-4284-85e5-15897c60881c,320/20.02.2025,,,320/20.02.2025,Nº  Y FECHA OFICIO ENVIA CONVENIO
462f9e0a-6207-4411-a92c-de444c2455dc,aa2e3b3f-270c-4a81-ab07-880f335cf6dc,0df1c4b6-ef93-4a00-a85a-acfafe36d421,320/20.02.2025,,,320/20.02.2025,Nº  Y FECHA OFICIO ENVIA CONVENIO
76f78122-ffe9-4f10-9635-e41bfdbf0ca0,aa2e3b3f-270c-4a81-ab07-880f335cf6dc,a2f5100f-2a50-4a51-a795-dde18abad7f9,320/20.02.2025,,,320/20.02.2025,Nº  Y FECHA OFICIO ENVIA CONVENIO
8e3cf01b-3c6f-4947-92c3-5ca20a587067,aa2e3b3f-270c-4a81-ab07-880f335cf6dc,671a8729-afed-428c-b81b-0dc36733afb8,320/20.02.2025,,,320/20.02.2025,Nº  Y FECHA OFICIO ENVIA CONVENIO
d9feac18-a044-4a8e-a24b-9369ff0e6386,ff7bbec9-fca1-4695-97c7-8dd174722c5c,51a42c4b-ae0c-47cb-9b5b-df04c2f96343,326/21.02.2025,,,326/21.02.2025,Nº  Y FECHA OFICIO ENVIA CONVENIO
a34cf877-1e9f-469a-9d45-353455bd9e9c,ff7bbec9-fca1-4695-97c7-8dd174722c5c,4e8a5aca-2be7-4abc-9ec9-4e16d0357942,326/21.02.2025,,,326/21.02.2025,Nº  Y FECHA OFICIO ENVIA CONVENIO
e722e489-0a0d-4ece-b8eb-960a9e636a72,ff7bbec9-fca1-4695-97c7-8dd174722c5c,8d80c2b8-875d-43a9-bb4e-117ed9aab422,326/21.02.2025,,,326/21.02.2025,Nº  Y FECHA OFICIO ENVIA CONVENIO
dfb5d157-27f3-4c49-a51f-f65c593fd9bc,ff7bbec9-fca1-4695-97c7-8dd174722c5c,ef2a95fc-fe72-4284-85e5-15897c60881c,326/21.02.2025,,,326/21.02.2025,Nº  Y FECHA OFICIO ENVIA CONVENIO
4dd58411-9dc0-480f-904a-e49141b8a1b0,ff7bbec9-fca1-4695-97c7-8dd174722c5c,0df1c4b6-ef93-4a00-a85a-acfafe36d421,326/21.02.2025,,,326/21.02.2025,Nº  Y FECHA OFICIO ENVIA CONVENIO
165a587a-7e5b-45b1-92ec-9c0b4dbdf1d0,ff7bbec9-fca1-4695-97c7-8dd174722c5c,a2f5100f-2a50-4a51-a795-dde18abad7f9,326/21.02.2025,,,326/21.02.2025,Nº  Y FECHA OFICIO ENVIA CONVENIO
3db0d661-7f3e-42b3-bd3b-ceadb0298cab,ff7bbec9-fca1-4695-97c7-8dd174722c5c,671a8729-afed-428c-b81b-0dc36733afb8,326/21.02.2025,,,326/21.02.2025,Nº  Y FECHA OFICIO ENVIA CONVENIO
26f1d2f2-ff17-4130-bbca-99d768d643fb,406acf32-65fb-436e-8357-832b193e6e10,51a42c4b-ae0c-47cb-9b5b-df04c2f96343,346/27.02.2025,,,346/27.02.2025,Nº  Y FECHA OFICIO ENVIA CONVENIO
9c071003-50bf-47cd-9a1d-550c84394553,406acf32-65fb-436e-8357-832b193e6e10,4e8a5aca-2be7-4abc-9ec9-4e16d0357942,346/27.02.2025,,,346/27.02.2025,Nº  Y FECHA OFICIO ENVIA CONVENIO
e75c39ae-1377-44b4-9d73-d0679a458dcd,406acf32-65fb-436e-8357-832b193e6e10,8d80c2b8-875d-43a9-bb4e-117ed9aab422,346/27.02.2025,,,346/27.02.2025,Nº  Y FECHA OFICIO ENVIA CONVENIO
fec5af73-fd30-4f04-a5ff-41c522430fea,406acf32-65fb-436e-8357-832b193e6e10,ef2a95fc-fe72-4284-85e5-15897c60881c,346/27.02.2025,,,346/27.02.2025,Nº  Y FECHA OFICIO ENVIA CONVENIO
b289d2b8-fdf5-4ee4-9d3e-a35fa370ba29,406acf32-65fb-436e-8357-832b193e6e10,0df1c4b6-ef93-4a00-a85a-acfafe36d421,346/27.02.2025,,,346/27.02.2025,Nº  Y FECHA OFICIO ENVIA CONVENIO
ddf94fbb-1268-4309-bc0a-b53a8e1a1a45,406acf32-65fb-436e-8357-832b193e6e10,a2f5100f-2a50-4a51-a795-dde18abad7f9,346/27.02.2025,,,346/27.02.2025,Nº  Y FECHA OFICIO ENVIA CONVENIO
f485975f-dd71-4537-bcdf-80b9b22812b8,406acf32-65fb-436e-8357-832b193e6e10,671a8729-afed-428c-b81b-0dc36733afb8,346/27.02.2025,,,346/27.02.2025,Nº  Y FECHA OFICIO ENVIA CONVENIO
69fb5702-a32d-47c8-8c49-02359b4f202b,19d7588c-4c32-43a7-a0d8-eb1a313900b9,51a42c4b-ae0c-47cb-9b5b-df04c2f96343,321/20.02.2025,,,321/20.02.2025,Nº  Y FECHA OFICIO ENVIA CONVENIO
1d7cdc43-2bd9-4505-b505-5ae5d7316099,19d7588c-4c32-43a7-a0d8-eb1a313900b9,4e8a5aca-2be7-4abc-9ec9-4e16d0357942,321/20.02.2025,,,321/20.02.2025,Nº  Y FECHA OFICIO ENVIA CONVENIO
3e0a0899-3c66-487e-bbc5-0481b4ee7b99,19d7588c-4c32-43a7-a0d8-eb1a313900b9,8d80c2b8-875d-43a9-bb4e-117ed9aab422,321/20.02.2025,,,321/20.02.2025,Nº  Y FECHA OFICIO ENVIA CONVENIO
89c81af6-57be-4093-bec6-fbeabb16870e,19d7588c-4c32-43a7-a0d8-eb1a313900b9,ef2a95fc-fe72-4284-85e5-15897c60881c,321/20.02.2025,,,321/20.02.2025,Nº  Y FECHA OFICIO ENVIA CONVENIO
89dbe002-b15a-4c83-b7a6-ce6ac4cd593d,19d7588c-4c32-43a7-a0d8-eb1a313900b9,0df1c4b6-ef93-4a00-a85a-acfafe36d421,321/20.02.2025,,,321/20.02.2025,Nº  Y FECHA OFICIO ENVIA CONVENIO
a37a4849-6e62-48ba-992c-7ea533bc6abf,19d7588c-4c32-43a7-a0d8-eb1a313900b9,a2f5100f-2a50-4a51-a795-dde18abad7f9,321/20.02.2025,,,321/20.02.2025,Nº  Y FECHA OFICIO ENVIA CONVENIO
4016aea3-d9a7-4bc2-901e-99f9f0afb3d5,19d7588c-4c32-43a7-a0d8-eb1a313900b9,671a8729-afed-428c-b81b-0dc36733afb8,321/20.02.2025,,,321/20.02.2025,Nº  Y FECHA OFICIO ENVIA CONVENIO
135fc034-8cd8-4885-b437-8f3eacd80d45,e17eecb3-7c15-4c5a-8620-0982488734c7,51a42c4b-ae0c-47cb-9b5b-df04c2f96343,708/15.05.2025,,,708/15.05.2025,Nº  Y FECHA OFICIO ENVIA CONVENIO
2846d3ae-6d4b-43b4-8a4d-c860a5ce8991,e17eecb3-7c15-4c5a-8620-0982488734c7,4e8a5aca-2be7-4abc-9ec9-4e16d0357942,708/15.05.2025,,,708/15.05.2025,Nº  Y FECHA OFICIO ENVIA CONVENIO
e120073b-c67c-4972-a397-320aac3c67ca,e17eecb3-7c15-4c5a-8620-0982488734c7,8d80c2b8-875d-43a9-bb4e-117ed9aab422,708/15.05.2025,,,708/15.05.2025,Nº  Y FECHA OFICIO ENVIA CONVENIO
f85ef2c5-38d8-4331-9770-23d7854b494a,e17eecb3-7c15-4c5a-8620-0982488734c7,ef2a95fc-fe72-4284-85e5-15897c60881c,708/15.05.2025,,,708/15.05.2025,Nº  Y FECHA OFICIO ENVIA CONVENIO
45d1e916-85ea-4c8a-8ac0-96217e2dc8df,e17eecb3-7c15-4c5a-8620-0982488734c7,0df1c4b6-ef93-4a00-a85a-acfafe36d421,708/15.05.2025,,,708/15.05.2025,Nº  Y FECHA OFICIO ENVIA CONVENIO
900cbb56-8507-40bf-a209-edd6de92d895,e17eecb3-7c15-4c5a-8620-0982488734c7,a2f5100f-2a50-4a51-a795-dde18abad7f9,708/15.05.2025,,,708/15.05.2025,Nº  Y FECHA OFICIO ENVIA CONVENIO
7be29d56-fb82-46f8-b536-0acdb3acb30c,e17eecb3-7c15-4c5a-8620-0982488734c7,671a8729-afed-428c-b81b-0dc36733afb8,708/15.05.2025,,,708/15.05.2025,Nº  Y FECHA OFICIO ENVIA CONVENIO
d009f6a7-a7ef-4c72-91a1-0fa2d32ed760,c5b5ca04-0441-4dc6-93ee-df2708c9024d,51a42c4b-ae0c-47cb-9b5b-df04c2f96343,481/25.03.2025,,,481/25.03.2025,Nº  Y FECHA OFICIO ENVIA CONVENIO
cf9fa947-ee8a-4cdc-96b6-297d29c21755,c5b5ca04-0441-4dc6-93ee-df2708c9024d,4e8a5aca-2be7-4abc-9ec9-4e16d0357942,481/25.03.2025,,,481/25.03.2025,Nº  Y FECHA OFICIO ENVIA CONVENIO
1ac58dec-e014-48bb-83ee-e21d001460b9,c5b5ca04-0441-4dc6-93ee-df2708c9024d,8d80c2b8-875d-43a9-bb4e-117ed9aab422,481/25.03.2025,,,481/25.03.2025,Nº  Y FECHA OFICIO ENVIA CONVENIO
0da183b6-45b9-4a45-8b14-0769393a0b1e,c5b5ca04-0441-4dc6-93ee-df2708c9024d,ef2a95fc-fe72-4284-85e5-15897c60881c,481/25.03.2025,,,481/25.03.2025,Nº  Y FECHA OFICIO ENVIA CONVENIO
bc737862-5916-4552-b79c-13fe6fcd81f1,c5b5ca04-0441-4dc6-93ee-df2708c9024d,0df1c4b6-ef93-4a00-a85a-acfafe36d421,481/25.03.2025,,,481/25.03.2025,Nº  Y FECHA OFICIO ENVIA CONVENIO
190b7203-120b-4f1e-a70d-51b27c69c2f8,c5b5ca04-0441-4dc6-93ee-df2708c9024d,a2f5100f-2a50-4a51-a795-dde18abad7f9,481/25.03.2025,,,481/25.03.2025,Nº  Y FECHA OFICIO ENVIA CONVENIO
38f494a5-b2f9-4242-bef2-9ac84b625861,c5b5ca04-0441-4dc6-93ee-df2708c9024d,671a8729-afed-428c-b81b-0dc36733afb8,481/25.03.2025,,,481/25.03.2025,Nº  Y FECHA OFICIO ENVIA CONVENIO
9ccc6c6a-e131-4a0c-812a-a452b26c417c,0ab0ada1-2e75-41de-ac6d-48b28acdd93c,51a42c4b-ae0c-47cb-9b5b-df04c2f96343,482/25.03.2025,,,482/25.03.2025,Nº  Y FECHA OFICIO ENVIA CONVENIO
599edc00-efd4-4529-922d-cf8dde5ab1ec,0ab0ada1-2e75-41de-ac6d-48b28acdd93c,4e8a5aca-2be7-4abc-9ec9-4e16d0357942,482/25.03.2025,,,482/25.03.2025,Nº  Y FECHA OFICIO ENVIA CONVENIO
398bdb8d-ee82-480e-ac17-6afd9de75748,0ab0ada1-2e75-41de-ac6d-48b28acdd93c,8d80c2b8-875d-43a9-bb4e-117ed9aab422,482/25.03.2025,,,482/25.03.2025,Nº  Y FECHA OFICIO ENVIA CONVENIO
809fcc40-2220-4165-9f50-1d60ec6e31fd,0ab0ada1-2e75-41de-ac6d-48b28acdd93c,ef2a95fc-fe72-4284-85e5-15897c60881c,482/25.03.2025,,,482/25.03.2025,Nº  Y FECHA OFICIO ENVIA CONVENIO
d63dcce6-3b59-4e55-842d-cdd065d524bd,0ab0ada1-2e75-41de-ac6d-48b28acdd93c,0df1c4b6-ef93-4a00-a85a-acfafe36d421,482/25.03.2025,,,482/25.03.2025,Nº  Y FECHA OFICIO ENVIA CONVENIO
835b4194-6bfc-40cd-9ec0-2acdf15a8a11,0ab0ada1-2e75-41de-ac6d-48b28acdd93c,a2f5100f-2a50-4a51-a795-dde18abad7f9,482/25.03.2025,,,482/25.03.2025,Nº  Y FECHA OFICIO ENVIA CONVENIO
9ab5eab5-1572-4c7f-ba00-7d6a4e99ee60,0ab0ada1-2e75-41de-ac6d-48b28acdd93c,671a8729-afed-428c-b81b-0dc36733afb8,482/25.03.2025,,,482/25.03.2025,Nº  Y FECHA OFICIO ENVIA CONVENIO
70562519-02a8-4e0d-bdf1-362c6809b8a2,d3cb0802-6de9-446d-86bc-eda1f6f79086,51a42c4b-ae0c-47cb-9b5b-df04c2f96343,483/25.03.2025,,,483/25.03.2025,Nº  Y FECHA OFICIO ENVIA CONVENIO
d0348965-cc41-4de0-af3f-a796e4a23ba0,d3cb0802-6de9-446d-86bc-eda1f6f79086,4e8a5aca-2be7-4abc-9ec9-4e16d0357942,483/25.03.2025,,,483/25.03.2025,Nº  Y FECHA OFICIO ENVIA CONVENIO
8a961c43-c3c1-4d7c-9b7b-2ea32555d8bb,d3cb0802-6de9-446d-86bc-eda1f6f79086,8d80c2b8-875d-43a9-bb4e-117ed9aab422,483/25.03.2025,,,483/25.03.2025,Nº  Y FECHA OFICIO ENVIA CONVENIO
f3a2feca-bc3d-41be-9a93-8fccf6e622f8,d3cb0802-6de9-446d-86bc-eda1f6f79086,ef2a95fc-fe72-4284-85e5-15897c60881c,483/25.03.2025,,,483/25.03.2025,Nº  Y FECHA OFICIO ENVIA CONVENIO
049abf97-cdfe-45e0-9344-3bec3f09f991,d3cb0802-6de9-446d-86bc-eda1f6f79086,0df1c4b6-ef93-4a00-a85a-acfafe36d421,483/25.03.2025,,,483/25.03.2025,Nº  Y FECHA OFICIO ENVIA CONVENIO
d08ef0fb-3af7-4b69-a09d-6dab9f2cf6d2,d3cb0802-6de9-446d-86bc-eda1f6f79086,a2f5100f-2a50-4a51-a795-dde18abad7f9,483/25.03.2025,,,483/25.03.2025,Nº  Y FECHA OFICIO ENVIA CONVENIO
a43048e6-3547-48dd-86f0-3f49e881cbd3,d3cb0802-6de9-446d-86bc-eda1f6f79086,671a8729-afed-428c-b81b-0dc36733afb8,483/25.03.2025,,,483/25.03.2025,Nº  Y FECHA OFICIO ENVIA CONVENIO
e7725774-2002-4130-a69f-d66f63c2e5e8,25dcb296-abdb-4fef-9d14-7257abd364cc,51a42c4b-ae0c-47cb-9b5b-df04c2f96343,429/14.03.2025,,,429/14.03.2025,Nº  Y FECHA OFICIO ENVIA CONVENIO
02c378f1-46aa-4b5e-a127-97738d350a6b,25dcb296-abdb-4fef-9d14-7257abd364cc,4e8a5aca-2be7-4abc-9ec9-4e16d0357942,429/14.03.2025,,,429/14.03.2025,Nº  Y FECHA OFICIO ENVIA CONVENIO
e84b283d-7beb-44db-be2b-a6987f9bfdf7,25dcb296-abdb-4fef-9d14-7257abd364cc,8d80c2b8-875d-43a9-bb4e-117ed9aab422,429/14.03.2025,,,429/14.03.2025,Nº  Y FECHA OFICIO ENVIA CONVENIO
65d7b199-e262-4a28-8373-04288a463e9a,25dcb296-abdb-4fef-9d14-7257abd364cc,ef2a95fc-fe72-4284-85e5-15897c60881c,429/14.03.2025,,,429/14.03.2025,Nº  Y FECHA OFICIO ENVIA CONVENIO
c003e7bf-67a0-4813-bc26-5b0b95bc1adf,25dcb296-abdb-4fef-9d14-7257abd364cc,0df1c4b6-ef93-4a00-a85a-acfafe36d421,429/14.03.2025,,,429/14.03.2025,Nº  Y FECHA OFICIO ENVIA CONVENIO
306100c6-b8f3-4744-a8ed-5c0c58cca51c,25dcb296-abdb-4fef-9d14-7257abd364cc,a2f5100f-2a50-4a51-a795-dde18abad7f9,429/14.03.2025,,,429/14.03.2025,Nº  Y FECHA OFICIO ENVIA CONVENIO
053b5089-22de-46ee-bded-427330644826,25dcb296-abdb-4fef-9d14-7257abd364cc,671a8729-afed-428c-b81b-0dc36733afb8,429/14.03.2025,,,429/14.03.2025,Nº  Y FECHA OFICIO ENVIA CONVENIO
038e63ea-96a0-4686-99d2-b3a0bef78865,157ade5b-461c-4277-b3ab-715e5e156db2,ef2a95fc-fe72-4284-85e5-15897c60881c,775,,,5/24/2024,Nº OFICIO ENVIA CONVENIO
cebf10c0-d495-47c8-9f4a-280b26a6f60c,157ade5b-461c-4277-b3ab-715e5e156db2,0df1c4b6-ef93-4a00-a85a-acfafe36d421,,,,,FECHA TOMA DE RAZON DE CGR
e41e4a33-4b2d-4dd4-8b53-1f1bdebd8f86,157ade5b-461c-4277-b3ab-715e5e156db2,671a8729-afed-428c-b81b-0dc36733afb8,351,,EXENTA,5/24/2024, Nº RESOLUCION 
ffe49f47-c0e5-444d-9b3f-b3400278ba5a,555aeb91-af0d-4e67-b235-e76039ca356f,ef2a95fc-fe72-4284-85e5-15897c60881c,775,,,5/24/2024,Nº OFICIO ENVIA CONVENIO
0031a754-359b-48b6-a43e-02b70cc7f1ad,555aeb91-af0d-4e67-b235-e76039ca356f,0df1c4b6-ef93-4a00-a85a-acfafe36d421,,,,,FECHA TOMA DE RAZON DE CGR
26ab8e23-a348-47f7-b8a7-bca1f7f81ffb,555aeb91-af0d-4e67-b235-e76039ca356f,671a8729-afed-428c-b81b-0dc36733afb8,355,,EXENTA,5/24/2024, Nº RESOLUCION 
6b81352b-9610-41c0-b553-c9aa9dd1573d,f51c0a4b-6de3-4bf5-b6af-7b824b89d211,ef2a95fc-fe72-4284-85e5-15897c60881c,774,,,5/24/2024,Nº OFICIO ENVIA CONVENIO
a50d0949-7b0f-430c-92b1-9bdea3607587,f51c0a4b-6de3-4bf5-b6af-7b824b89d211,0df1c4b6-ef93-4a00-a85a-acfafe36d421,,,,,FECHA TOMA DE RAZON DE CGR
7e3f518a-7427-4803-9678-0f7a7241da35,f51c0a4b-6de3-4bf5-b6af-7b824b89d211,671a8729-afed-428c-b81b-0dc36733afb8,356,,EXENTA,5/24/2024, Nº RESOLUCION 
fb6d4bde-6b78-4340-8e57-eb03acd7c9be,f6733991-0602-4727-b08a-9b8344f33247,ef2a95fc-fe72-4284-85e5-15897c60881c,774,,,5/24/2024,Nº OFICIO ENVIA CONVENIO
1e2af3e5-d013-48dd-93cd-ea82ba95a83c,f6733991-0602-4727-b08a-9b8344f33247,0df1c4b6-ef93-4a00-a85a-acfafe36d421,,,,,FECHA TOMA DE RAZON DE CGR
7b729647-a336-48b3-af4e-4b0c2dc55306,f6733991-0602-4727-b08a-9b8344f33247,671a8729-afed-428c-b81b-0dc36733afb8,353,,EXENTA,5/24/2024, Nº RESOLUCION 
c0665a7c-a4a1-49af-8cff-6db6fda4e6ad,ef28f412-e14e-4afa-aeb5-113b45ad4c41,671a8729-afed-428c-b81b-0dc36733afb8,257,,EXENTA,, Nº RESOLUCION 
7886459b-fc49-4a95-91c0-f3b8f2c28258,edbb8dfa-dbe4-4f22-998e-0f68fa841d9c,ef2a95fc-fe72-4284-85e5-15897c60881c,656,,,4/30/2024,Nº OFICIO ENVIA CONVENIO
d65c94f5-1445-42e5-8d20-d2b9b15e92aa,edbb8dfa-dbe4-4f22-998e-0f68fa841d9c,0df1c4b6-ef93-4a00-a85a-acfafe36d421,,,,,FECHA TOMA DE RAZON DE CGR
8150531f-22f7-468a-b75b-bbdcfdffdd6e,edbb8dfa-dbe4-4f22-998e-0f68fa841d9c,671a8729-afed-428c-b81b-0dc36733afb8,263,,EXENTA,4/30/2024, Nº RESOLUCION 
0077bd6e-d1f9-4057-afc1-657178047809,676f0af5-13c5-46be-8879-c27e029f20cb,ef2a95fc-fe72-4284-85e5-15897c60881c,774,,,5/24/2024,Nº OFICIO ENVIA CONVENIO
30300f6c-042b-470e-88df-086ef1fdf973,676f0af5-13c5-46be-8879-c27e029f20cb,0df1c4b6-ef93-4a00-a85a-acfafe36d421,,,,,FECHA TOMA DE RAZON DE CGR
385a3f0d-fc5d-4e1b-939a-65abc9e2bb2b,676f0af5-13c5-46be-8879-c27e029f20cb,671a8729-afed-428c-b81b-0dc36733afb8,354,,EXENTA,5/24/2024, Nº RESOLUCION 
f3fc5090-c214-4ad3-bfe7-c91223399218,4f8d4f21-d970-4d7c-87cd-6758f9f1f7bd,ef2a95fc-fe72-4284-85e5-15897c60881c,655,,,4/30/2024,Nº OFICIO ENVIA CONVENIO
306059f7-d2f0-4256-8186-2ec3ba0cf588,4f8d4f21-d970-4d7c-87cd-6758f9f1f7bd,0df1c4b6-ef93-4a00-a85a-acfafe36d421,,,,,FECHA TOMA DE RAZON DE CGR
fb99ec6d-846a-4219-96cd-374c396afc86,4f8d4f21-d970-4d7c-87cd-6758f9f1f7bd,671a8729-afed-428c-b81b-0dc36733afb8,262,,EXENTA,4/30/2024, Nº RESOLUCION 
a18e38c0-abcc-459f-974a-db45baf89638,7958b1af-8d8a-4533-919f-77bd1946c9e5,ef2a95fc-fe72-4284-85e5-15897c60881c,773,,,5/24/2024,Nº OFICIO ENVIA CONVENIO
29e51e46-5c52-498f-a286-5ee5dd7a4259,7958b1af-8d8a-4533-919f-77bd1946c9e5,0df1c4b6-ef93-4a00-a85a-acfafe36d421,,,,,FECHA TOMA DE RAZON DE CGR
8a31aef0-d30e-497c-b65b-0fbbfc4ad0b8,7958b1af-8d8a-4533-919f-77bd1946c9e5,671a8729-afed-428c-b81b-0dc36733afb8,339,,EXENTA,5/24/2024, Nº RESOLUCION 
02372d78-a4c3-439e-942d-90747e191bd5,45a55e5f-b5f8-4f38-95b7-aba72d049430,ef2a95fc-fe72-4284-85e5-15897c60881c,773,,,5/24/2024,Nº OFICIO ENVIA CONVENIO
5b54fb21-dac1-4052-82b5-32962e112cc7,45a55e5f-b5f8-4f38-95b7-aba72d049430,0df1c4b6-ef93-4a00-a85a-acfafe36d421,,,,,FECHA TOMA DE RAZON DE CGR
e17d9712-896b-4245-bc94-41f961081559,45a55e5f-b5f8-4f38-95b7-aba72d049430,671a8729-afed-428c-b81b-0dc36733afb8,352,,EXENTA,5/24/2024, Nº RESOLUCION 
54b57d6c-17d3-4c1a-bd1a-6c3b75e19d5b,04444379-4ee5-499a-9d9a-e5a5bdd83eee,671a8729-afed-428c-b81b-0dc36733afb8,320,,EXENTA,, Nº RESOLUCION 
92b2a540-f53d-4151-aca7-7ea8e6057593,232b7e4d-b351-4cac-a158-2829e5f4cd41,ef2a95fc-fe72-4284-85e5-15897c60881c,633,,,4/23/2024,Nº OFICIO ENVIA CONVENIO
d2aa4fb3-b62d-47e1-b54c-929e564442ee,232b7e4d-b351-4cac-a158-2829e5f4cd41,0df1c4b6-ef93-4a00-a85a-acfafe36d421,,,,,FECHA TOMA DE RAZON DE CGR
70508f74-801b-429e-95d6-813200cdf98f,232b7e4d-b351-4cac-a158-2829e5f4cd41,671a8729-afed-428c-b81b-0dc36733afb8,265,,EXENTA,4/23/2024, Nº RESOLUCION 
37da2fa4-ec46-4182-bdcc-70c8a91815e2,ebd34846-0fac-4282-92a0-e50e0fabf3f5,ef2a95fc-fe72-4284-85e5-15897c60881c,615,,,4/22/2024,Nº OFICIO ENVIA CONVENIO
9596412d-30c6-47b8-af00-8affbbd984e7,ebd34846-0fac-4282-92a0-e50e0fabf3f5,671a8729-afed-428c-b81b-0dc36733afb8,255,,EXENTA,4/22/2024, Nº RESOLUCION 
2947ac7a-405a-4419-906a-d3f7e5e5ee17,b64660c0-f5e1-4c19-b3de-c20273220bff,0df1c4b6-ef93-4a00-a85a-acfafe36d421,5/27/2024,,,5/27/2024,FECHA TOMA DE RAZON DE CGR
30c2e9a1-f0ca-4e0a-a8da-72c7104eef8c,b64660c0-f5e1-4c19-b3de-c20273220bff,671a8729-afed-428c-b81b-0dc36733afb8,35,,AFECTA,, Nº RESOLUCION 
08e31821-d452-4279-aee7-b7f295e05982,638313f8-651a-4e0c-b0e6-dc6c3bab9052,671a8729-afed-428c-b81b-0dc36733afb8,31,,,, Nº RESOLUCION 
6b70cd77-9bb3-4ce9-8c16-2b1aeac81bf7,783f451f-cd63-4218-ae0a-768f5b2bcfea,ef2a95fc-fe72-4284-85e5-15897c60881c,616,,,4/22/2024,Nº OFICIO ENVIA CONVENIO
98bf83ef-4907-46cd-b013-f02e8c10aa09,783f451f-cd63-4218-ae0a-768f5b2bcfea,0df1c4b6-ef93-4a00-a85a-acfafe36d421,,,,,FECHA TOMA DE RAZON DE CGR
e827c6b0-95eb-46fb-b2a9-6b12a1edd110,783f451f-cd63-4218-ae0a-768f5b2bcfea,671a8729-afed-428c-b81b-0dc36733afb8,228,,EXENTA,4/22/2024, Nº RESOLUCION 
3d766879-065c-41b2-addc-b7268779c87a,c9f2a7b2-d901-42b1-888e-e9bcc37a3bea,ef2a95fc-fe72-4284-85e5-15897c60881c,712,2024-10-05T00:00:00,,,Nº OFICIO ENVIA CONVENIO
ee2ada0c-fc62-487d-b23b-13c3a9fb5a2f,c9f2a7b2-d901-42b1-888e-e9bcc37a3bea,0df1c4b6-ef93-4a00-a85a-acfafe36d421,,,,,FECHA TOMA DE RAZON DE CGR
6f4fa672-9b0a-49a8-81eb-63725936b724,c9f2a7b2-d901-42b1-888e-e9bcc37a3bea,671a8729-afed-428c-b81b-0dc36733afb8,303,2024-10-05T00:00:00,EXENTA,, Nº RESOLUCION 
19c14ef4-4cc5-4492-8f5e-fd1767f288d3,fe52d4dd-9fc6-45fa-9c2b-39a52838e2fc,ef2a95fc-fe72-4284-85e5-15897c60881c,686,2024-07-05T00:00:00,,,Nº OFICIO ENVIA CONVENIO
c19c138c-1299-4bd7-8926-c8ab322b2936,fe52d4dd-9fc6-45fa-9c2b-39a52838e2fc,0df1c4b6-ef93-4a00-a85a-acfafe36d421,,,,,FECHA TOMA DE RAZON DE CGR
81a29dd5-85df-49c1-b2d9-3a2724c357d8,fe52d4dd-9fc6-45fa-9c2b-39a52838e2fc,671a8729-afed-428c-b81b-0dc36733afb8,284,2024-07-05T00:00:00,EXENTA,, Nº RESOLUCION 
5253a882-febe-4624-b35a-61f0f3003db9,888a90da-1677-4a06-a5c6-4b2e233452b0,0df1c4b6-ef93-4a00-a85a-acfafe36d421,,,,,FECHA TOMA DE RAZON DE CGR
2a699885-15c9-4894-8836-0ccc3ba25d48,888a90da-1677-4a06-a5c6-4b2e233452b0,671a8729-afed-428c-b81b-0dc36733afb8,282,,EXENTA,, Nº RESOLUCION 
193ab11b-a12a-4882-88d3-ea5186c210f5,b85ffd72-c4b7-4ef0-a61a-518271790d45,0df1c4b6-ef93-4a00-a85a-acfafe36d421,5/6/2024,2024-06-05T00:00:00,,,FECHA TOMA DE RAZON DE CGR
2f464920-e44b-40cd-a02e-5f6b12887eba,b85ffd72-c4b7-4ef0-a61a-518271790d45,671a8729-afed-428c-b81b-0dc36733afb8,23,,AFECTA,, Nº RESOLUCION 
67c75815-a85e-4ea3-b218-5207d220bd50,14175d37-efc6-48f7-8fd6-7bb8336bb92e,ef2a95fc-fe72-4284-85e5-15897c60881c,872,2024-06-13T00:00:00,,,Nº OFICIO ENVIA CONVENIO
387902a2-8315-4e73-bd85-14a26aea0c30,14175d37-efc6-48f7-8fd6-7bb8336bb92e,671a8729-afed-428c-b81b-0dc36733afb8,45,2024-06-13T00:00:00,AFECTA,, Nº RESOLUCION 
d7ca0cd7-de96-42ab-9214-391861cb0919,92a891e9-78d5-4ba4-ae37-d9271761394b,671a8729-afed-428c-b81b-0dc36733afb8,70,,AFECTA,, Nº RESOLUCION 
86de56e7-3b5f-4fb6-ba52-b9deb54d8a79,f5a16dce-cd21-4878-8bf9-2fe3dc2d4589,671a8729-afed-428c-b81b-0dc36733afb8,67,,AFECTA,, Nº RESOLUCION 
60e95e1d-5b24-441f-906b-632a5140104e,321ca386-024e-4044-9305-e5a046e300df,51a42c4b-ae0c-47cb-9b5b-df04c2f96343,907/2024,2024-03-21T00:00:00,,,Nº RES INCORPORA/ CERT CORE
d6b682bc-598a-41c9-bdd8-6c5c76c458c8,321ca386-024e-4044-9305-e5a046e300df,4e8a5aca-2be7-4abc-9ec9-4e16d0357942,46,2024-04-16T00:00:00,,,Nº RES CREA ASIGNACIÓN
c912a367-e4fc-420f-a6d3-37237723aa74,321ca386-024e-4044-9305-e5a046e300df,8d80c2b8-875d-43a9-bb4e-117ed9aab422,1,2024-06-12T00:00:00,AFECTA,,Nº RES APRUEBA CONVENIO 
17e2361d-b3cd-438b-ac5e-1d4a4f477854,321ca386-024e-4044-9305-e5a046e300df,0df1c4b6-ef93-4a00-a85a-acfafe36d421,08/08/2024,2024-08-08T00:00:00,,,FECHA TOMA DE RAZON DE CGR
32b6278b-51f1-4df6-9092-2cf4d6477e70,321ca386-024e-4044-9305-e5a046e300df,a2f5100f-2a50-4a51-a795-dde18abad7f9,RES EN TRAMITE,,,RES EN TRAMITE,Nº RES REFERENTE TECNICO
3eead72f-7487-4e01-9cbd-2fc9de863730,56bc240f-2c39-4dff-ba1d-0a9a993be468,51a42c4b-ae0c-47cb-9b5b-df04c2f96343,963,2023-09-05T00:00:00,,,Nº RES INCORPORA/ CERT CORE
bef02179-2520-415f-920b-ec9d084d792f,56bc240f-2c39-4dff-ba1d-0a9a993be468,4e8a5aca-2be7-4abc-9ec9-4e16d0357942,963,2023-09-05T00:00:00,,,Nº RES CREA ASIGNACIÓN
31d9585e-1d46-49de-a865-337cf88eedfd,56bc240f-2c39-4dff-ba1d-0a9a993be468,8d80c2b8-875d-43a9-bb4e-117ed9aab422,7,2024-02-14T00:00:00,AFECTA,,Nº RES APRUEBA CONVENIO 
ef674a1a-01d3-44f6-8741-996cc29a876f,56bc240f-2c39-4dff-ba1d-0a9a993be468,0df1c4b6-ef93-4a00-a85a-acfafe36d421,27/02/2024,2024-02-27T00:00:00,,,FECHA TOMA DE RAZON DE CGR
525d1beb-f8df-40a9-803f-df61969c3227,56bc240f-2c39-4dff-ba1d-0a9a993be468,a2f5100f-2a50-4a51-a795-dde18abad7f9,312/09.05.2024,,,312/09.05.2024,Nº RES REFERENTE TECNICO
eb0bacc3-562f-47af-a04b-bc0b2c594530,8044da58-828a-4039-a7bb-e81eea535417,51a42c4b-ae0c-47cb-9b5b-df04c2f96343,963,2023-09-05T00:00:00,,,Nº RES INCORPORA/ CERT CORE
9cdf8d07-1fe5-44da-a594-775744a8633f,8044da58-828a-4039-a7bb-e81eea535417,4e8a5aca-2be7-4abc-9ec9-4e16d0357942,963,2023-09-05T00:00:00,,,Nº RES CREA ASIGNACIÓN
0fe3121e-2f08-4c71-8aea-30284a76ed58,8044da58-828a-4039-a7bb-e81eea535417,8d80c2b8-875d-43a9-bb4e-117ed9aab422,8,2024-02-14T00:00:00,AFECTA,,Nº RES APRUEBA CONVENIO 
edfe41aa-9ffc-4984-9e5a-8e01817afce6,8044da58-828a-4039-a7bb-e81eea535417,0df1c4b6-ef93-4a00-a85a-acfafe36d421,28/02/2024,2024-02-28T00:00:00,,,FECHA TOMA DE RAZON DE CGR
57878226-8c95-4c3e-85ee-66b3e318a84d,8044da58-828a-4039-a7bb-e81eea535417,a2f5100f-2a50-4a51-a795-dde18abad7f9,312/09.05.2024,,,312/09.05.2024,Nº RES REFERENTE TECNICO
6b35ee95-23f4-48ab-8a0c-3c0b59da7bf1,10a689c7-a566-4a9c-8ac9-f3b67a894597,51a42c4b-ae0c-47cb-9b5b-df04c2f96343,,,,,Nº RES INCORPORA/ CERT CORE
bd38b2d8-e20e-4b1d-91d4-bb1ed41f9a13,10a689c7-a566-4a9c-8ac9-f3b67a894597,4e8a5aca-2be7-4abc-9ec9-4e16d0357942,10,2024-01-10T00:00:00,,,Nº RES CREA ASIGNACIÓN
7b8e42b6-fab7-40c4-ab30-991360a03986,10a689c7-a566-4a9c-8ac9-f3b67a894597,8d80c2b8-875d-43a9-bb4e-117ed9aab422,16,2024-03-22T00:00:00,AFECTA,,Nº RES APRUEBA CONVENIO 
08fed2e2-8893-4c76-9bb4-84f7a3bd6323,10a689c7-a566-4a9c-8ac9-f3b67a894597,0df1c4b6-ef93-4a00-a85a-acfafe36d421,05-04-2024,2024-04-05T00:00:00,,,FECHA TOMA DE RAZON DE CGR
ebc5dc07-0efc-4a8d-8407-fc1ff827ea3f,10a689c7-a566-4a9c-8ac9-f3b67a894597,a2f5100f-2a50-4a51-a795-dde18abad7f9,436/24.06.2024,,,436/24.06.2024,Nº RES REFERENTE TECNICO
1f335c19-fdc3-4d0f-a586-38783e664772,bf82b7d1-7c86-4d0b-9d88-8b3aac2bfa2d,51a42c4b-ae0c-47cb-9b5b-df04c2f96343,838/2023,2023-12-21T00:00:00,,,Nº RES INCORPORA/ CERT CORE
374299cf-cb90-4389-ac5b-788212df5c75,bf82b7d1-7c86-4d0b-9d88-8b3aac2bfa2d,4e8a5aca-2be7-4abc-9ec9-4e16d0357942,6,2024-02-13T00:00:00,,,Nº RES CREA ASIGNACIÓN
ce82f5d5-d7f9-4bd8-a76c-8326c1d27a60,bf82b7d1-7c86-4d0b-9d88-8b3aac2bfa2d,8d80c2b8-875d-43a9-bb4e-117ed9aab422,18,2024-03-28T00:00:00,AFECTA,,Nº RES APRUEBA CONVENIO 
0f8b51d4-2449-431c-88fb-f607ba39a945,bf82b7d1-7c86-4d0b-9d88-8b3aac2bfa2d,ef2a95fc-fe72-4284-85e5-15897c60881c,581,,,4/17/2024,Nº OFICIO ENVIA CONVENIO
3ace1491-f953-49ec-bdf2-a53588134805,bf82b7d1-7c86-4d0b-9d88-8b3aac2bfa2d,0df1c4b6-ef93-4a00-a85a-acfafe36d421,15/04/2024,2024-04-15T00:00:00,,,FECHA TOMA DE RAZON DE CGR
02ca955a-41c4-49f2-83ca-f6beedb02a63,bf82b7d1-7c86-4d0b-9d88-8b3aac2bfa2d,a2f5100f-2a50-4a51-a795-dde18abad7f9,317/10.05.2024,,,317/10.05.2024,Nº RES REFERENTE TECNICO
6aec13f4-b025-4740-a694-e26aa2efcc73,bf82b7d1-7c86-4d0b-9d88-8b3aac2bfa2d,671a8729-afed-428c-b81b-0dc36733afb8,,,,4/17/2024,FECHA OFICIO ENVIA CONVENIO
c2b3bd33-1533-468b-a512-680bede931db,1731c8a8-7a75-40e7-9db3-d845cdeb58dd,51a42c4b-ae0c-47cb-9b5b-df04c2f96343,648/2023,2023-04-14T00:00:00,,,Nº RES INCORPORA/ CERT CORE
876e9688-0858-426a-8969-a9f2db5ec016,1731c8a8-7a75-40e7-9db3-d845cdeb58dd,4e8a5aca-2be7-4abc-9ec9-4e16d0357942,6,2024-02-13T00:00:00,,,Nº RES CREA ASIGNACIÓN
63714b9b-220c-41b6-97b0-2c7ac1fa1863,1731c8a8-7a75-40e7-9db3-d845cdeb58dd,8d80c2b8-875d-43a9-bb4e-117ed9aab422,20,2024-04-08T00:00:00,AFECTA,,Nº RES APRUEBA CONVENIO 
5f061696-0678-4689-8b0d-0e02131c7923,1731c8a8-7a75-40e7-9db3-d845cdeb58dd,ef2a95fc-fe72-4284-85e5-15897c60881c,687,2024-05-07T00:00:00,,,Nº OFICIO ENVIA CONVENIO
ef437697-a08d-49a3-adb5-859c99ca99c4,1731c8a8-7a75-40e7-9db3-d845cdeb58dd,0df1c4b6-ef93-4a00-a85a-acfafe36d421,30-04-2024,2024-04-30T00:00:00,,,FECHA TOMA DE RAZON DE CGR
89ac0fa3-dc4b-4e0f-a2fe-6681974c473c,1731c8a8-7a75-40e7-9db3-d845cdeb58dd,a2f5100f-2a50-4a51-a795-dde18abad7f9,317/10.05.2024,,,317/10.05.2024,Nº RES REFERENTE TECNICO
4ac729ab-efc7-44b4-bc13-08402850b45c,1731c8a8-7a75-40e7-9db3-d845cdeb58dd,671a8729-afed-428c-b81b-0dc36733afb8,,2024-05-07T00:00:00,,,FECHA OFICIO ENVIA CONVENIO
8de310b7-351b-400d-aa7b-0e166b87fd28,96f95160-4072-42fe-8767-67d2a9c664a1,51a42c4b-ae0c-47cb-9b5b-df04c2f96343,842/2023,2023-12-21T00:00:00,,,Nº RES INCORPORA/ CERT CORE
1378e5d9-eb1d-4ee5-878e-d227f2e37f44,96f95160-4072-42fe-8767-67d2a9c664a1,4e8a5aca-2be7-4abc-9ec9-4e16d0357942,6,2024-02-13T00:00:00,,,Nº RES CREA ASIGNACIÓN
7e6f1826-e01b-444e-966f-e07ebf91dd39,96f95160-4072-42fe-8767-67d2a9c664a1,8d80c2b8-875d-43a9-bb4e-117ed9aab422,24,2024-04-15T00:00:00,AFECTA,,Nº RES APRUEBA CONVENIO 
89f457ef-847c-4ed0-ae81-701b83f42bed,96f95160-4072-42fe-8767-67d2a9c664a1,ef2a95fc-fe72-4284-85e5-15897c60881c,734,,,5/14/2024,Nº OFICIO ENVIA CONVENIO
d71166cc-658e-48dd-9f97-97083057c6a9,96f95160-4072-42fe-8767-67d2a9c664a1,0df1c4b6-ef93-4a00-a85a-acfafe36d421,10/05/2024,2024-05-10T00:00:00,,,FECHA TOMA DE RAZON DE CGR
8dc46a6f-15b2-41c5-8e8f-2af055b816cf,96f95160-4072-42fe-8767-67d2a9c664a1,671a8729-afed-428c-b81b-0dc36733afb8,,,,5/14/2024,FECHA OFICIO ENVIA CONVENIO
f85b0dca-c034-443f-b023-8703bdd49864,69f6b5cf-7e83-418c-96bb-f7a45f33b8f0,51a42c4b-ae0c-47cb-9b5b-df04c2f96343,796/2023,2023-11-06T00:00:00,,,Nº RES INCORPORA/ CERT CORE
9ce5f2cf-da46-4938-9853-f2c350c66fc1,69f6b5cf-7e83-418c-96bb-f7a45f33b8f0,4e8a5aca-2be7-4abc-9ec9-4e16d0357942,6,2024-02-13T00:00:00,,,Nº RES CREA ASIGNACIÓN
3f17f26f-d737-448b-b95a-e5e1b300d5e2,69f6b5cf-7e83-418c-96bb-f7a45f33b8f0,8d80c2b8-875d-43a9-bb4e-117ed9aab422,25,2024-04-15T00:00:00,AFECTA,,Nº RES APRUEBA CONVENIO 
b746f231-9d7d-46d5-ba1b-4e35004c20f8,69f6b5cf-7e83-418c-96bb-f7a45f33b8f0,ef2a95fc-fe72-4284-85e5-15897c60881c,692,2024-07-05T00:00:00,,,Nº OFICIO ENVIA CONVENIO
26b45789-aa78-420e-883c-270c23e5ce80,69f6b5cf-7e83-418c-96bb-f7a45f33b8f0,0df1c4b6-ef93-4a00-a85a-acfafe36d421,02/05/2024,2024-05-02T00:00:00,,,FECHA TOMA DE RAZON DE CGR
5e2afd68-d04f-47a9-b831-575e93da1db7,69f6b5cf-7e83-418c-96bb-f7a45f33b8f0,671a8729-afed-428c-b81b-0dc36733afb8,,2024-07-05T00:00:00,,,FECHA OFICIO ENVIA CONVENIO
ccecf62c-db00-48d5-8d81-ce0da34bb2c6,1a37dfa0-aaa2-4899-89a8-60ea16d4e308,51a42c4b-ae0c-47cb-9b5b-df04c2f96343,915,2023-08-22T00:00:00,,,Nº RES INCORPORA/ CERT CORE
9dd488b9-8794-4e48-91d7-487e7a4d9fe3,1a37dfa0-aaa2-4899-89a8-60ea16d4e308,4e8a5aca-2be7-4abc-9ec9-4e16d0357942,915,2023-08-22T00:00:00,,,Nº RES CREA ASIGNACIÓN
019bf52d-0eb5-4d52-92f8-e0621d3f4526,1a37dfa0-aaa2-4899-89a8-60ea16d4e308,8d80c2b8-875d-43a9-bb4e-117ed9aab422,26,2024-04-15T00:00:00,AFECTA,,Nº RES APRUEBA CONVENIO 
24e8de30-0513-44c0-8f56-f11b7f4fb620,1a37dfa0-aaa2-4899-89a8-60ea16d4e308,ef2a95fc-fe72-4284-85e5-15897c60881c,740,,,5/15/2024,Nº OFICIO ENVIA CONVENIO
8df4a4f3-1370-49c6-848a-be42d6707c25,1a37dfa0-aaa2-4899-89a8-60ea16d4e308,0df1c4b6-ef93-4a00-a85a-acfafe36d421,09/05/2024,2024-05-09T00:00:00,,,FECHA TOMA DE RAZON DE CGR
38a1f397-cf20-47c4-b4ae-8cdfb7775dad,1a37dfa0-aaa2-4899-89a8-60ea16d4e308,a2f5100f-2a50-4a51-a795-dde18abad7f9,312/09.05.2024,,,312/09.05.2024,Nº RES REFERENTE TECNICO
1a831e7d-6f2b-4ee8-a666-5b1a0d7cff43,1a37dfa0-aaa2-4899-89a8-60ea16d4e308,671a8729-afed-428c-b81b-0dc36733afb8,,,,5/15/2024,FECHA OFICIO ENVIA CONVENIO
cc079ef5-a92e-4fe4-b33b-029af8e2fdae,0194bf29-40c3-4b99-9848-b9693b95ca7d,51a42c4b-ae0c-47cb-9b5b-df04c2f96343,136,2024-03-22T00:00:00,,,Nº RES INCORPORA/ CERT CORE
23339a49-bf58-415d-b1b6-335d0353f339,0194bf29-40c3-4b99-9848-b9693b95ca7d,4e8a5aca-2be7-4abc-9ec9-4e16d0357942,136,2024-03-22T00:00:00,,,Nº RES CREA ASIGNACIÓN
90373808-eb36-49a6-af64-e593577b5a84,0194bf29-40c3-4b99-9848-b9693b95ca7d,8d80c2b8-875d-43a9-bb4e-117ed9aab422,27,2024-04-15T00:00:00,AFECTA,,Nº RES APRUEBA CONVENIO 
14dc3b39-6664-4e31-ba44-ff869d6edf58,0194bf29-40c3-4b99-9848-b9693b95ca7d,ef2a95fc-fe72-4284-85e5-15897c60881c,735,,,5/14/2024,Nº OFICIO ENVIA CONVENIO
73160b1a-d934-41ba-9ff0-27153cb59a9c,0194bf29-40c3-4b99-9848-b9693b95ca7d,0df1c4b6-ef93-4a00-a85a-acfafe36d421,09/05/2024,2024-05-09T00:00:00,,,FECHA TOMA DE RAZON DE CGR
1cbe2fa2-3878-4b5e-9ef6-c23442d0f68b,0194bf29-40c3-4b99-9848-b9693b95ca7d,671a8729-afed-428c-b81b-0dc36733afb8,,,,5/14/2024,FECHA OFICIO ENVIA CONVENIO
84d34420-e67f-4de9-b261-62ba06adb97e,b2796755-41b7-4e0f-8f3b-681435cd5f93,51a42c4b-ae0c-47cb-9b5b-df04c2f96343,143,2024-03-26T00:00:00,,,Nº RES INCORPORA/ CERT CORE
b4b991f6-90d5-49d5-83a4-97fd899363b8,b2796755-41b7-4e0f-8f3b-681435cd5f93,4e8a5aca-2be7-4abc-9ec9-4e16d0357942,6,2024-02-13T00:00:00,,,Nº RES CREA ASIGNACIÓN
f7926a07-88a2-479a-9fbe-cb3a55a7b4a3,b2796755-41b7-4e0f-8f3b-681435cd5f93,8d80c2b8-875d-43a9-bb4e-117ed9aab422,28,2024-04-16T00:00:00,AFECTA,,Nº RES APRUEBA CONVENIO 
2880010d-3f96-4bea-8e22-3e8a3bbdf2e6,b2796755-41b7-4e0f-8f3b-681435cd5f93,ef2a95fc-fe72-4284-85e5-15897c60881c,666,2024-03-05T00:00:00,,,Nº OFICIO ENVIA CONVENIO
31b8b629-ffdd-4631-9d83-24b3b0782060,b2796755-41b7-4e0f-8f3b-681435cd5f93,0df1c4b6-ef93-4a00-a85a-acfafe36d421,02/05/2024,2024-05-02T00:00:00,,,FECHA TOMA DE RAZON DE CGR
f0284842-b192-45c1-96d9-13692653c186,b2796755-41b7-4e0f-8f3b-681435cd5f93,a2f5100f-2a50-4a51-a795-dde18abad7f9,317/10.05.2024,,,317/10.05.2024,Nº RES REFERENTE TECNICO
636976ab-8664-4fe2-b674-84511f76759e,b2796755-41b7-4e0f-8f3b-681435cd5f93,671a8729-afed-428c-b81b-0dc36733afb8,,2024-03-05T00:00:00,,,FECHA OFICIO ENVIA CONVENIO
99838e60-11f5-4045-87ae-10c1aa374588,32d3124d-7322-4e32-bdc1-774a4c5fedd3,51a42c4b-ae0c-47cb-9b5b-df04c2f96343,,,,,Nº RES INCORPORA/ CERT CORE
22bf8ee2-e98a-41ea-81d7-4b98ff1fdf2a,32d3124d-7322-4e32-bdc1-774a4c5fedd3,4e8a5aca-2be7-4abc-9ec9-4e16d0357942,109,2023-08-21T00:00:00,,,Nº RES CREA ASIGNACIÓN
188c0b55-7aed-4e90-ac2f-5ceb749e88b8,32d3124d-7322-4e32-bdc1-774a4c5fedd3,8d80c2b8-875d-43a9-bb4e-117ed9aab422,32,2024-04-22T00:00:00,AFECTA,,Nº RES APRUEBA CONVENIO 
64501e02-a34f-4608-84a7-09ed960dcc0b,32d3124d-7322-4e32-bdc1-774a4c5fedd3,ef2a95fc-fe72-4284-85e5-15897c60881c,620,2024-04-22T00:00:00,,,Nº OFICIO ENVIA CONVENIO
548413d5-ece3-4298-b003-820d3fc2ca1f,32d3124d-7322-4e32-bdc1-774a4c5fedd3,0df1c4b6-ef93-4a00-a85a-acfafe36d421,14-05-2024,2024-05-14T00:00:00,,,FECHA TOMA DE RAZON DE CGR
6e0990c3-36d6-44bf-9d5b-22ea3115d9e9,32d3124d-7322-4e32-bdc1-774a4c5fedd3,671a8729-afed-428c-b81b-0dc36733afb8,,2024-04-22T00:00:00,,,FECHA OFICIO ENVIA CONVENIO
f0f73dae-a6e2-4a32-ac4b-b8f6256be7b8,9fe8e24a-8115-4613-ab8a-e8808d00295b,51a42c4b-ae0c-47cb-9b5b-df04c2f96343,142,2024-03-26T00:00:00,,,Nº RES INCORPORA/ CERT CORE
00b58ac9-3361-4c7a-b672-a8f3bc5ecdbf,9fe8e24a-8115-4613-ab8a-e8808d00295b,4e8a5aca-2be7-4abc-9ec9-4e16d0357942,6,2024-02-13T00:00:00,,,Nº RES CREA ASIGNACIÓN
a0936ead-4948-4f0c-81c0-9ad4604e174b,9fe8e24a-8115-4613-ab8a-e8808d00295b,8d80c2b8-875d-43a9-bb4e-117ed9aab422,34,2024-04-29T00:00:00,AFECTA,,Nº RES APRUEBA CONVENIO 
cfe16386-1f68-413b-bae4-c4dcfffd85a5,9fe8e24a-8115-4613-ab8a-e8808d00295b,ef2a95fc-fe72-4284-85e5-15897c60881c,750,,,5/16/2024,Nº OFICIO ENVIA CONVENIO
9c297b2e-b514-4446-8591-18358174851b,9fe8e24a-8115-4613-ab8a-e8808d00295b,0df1c4b6-ef93-4a00-a85a-acfafe36d421,14/05/2024,2024-05-14T00:00:00,,,FECHA TOMA DE RAZON DE CGR
6644e445-a411-4f9a-9d3a-34b6845b3bbf,9fe8e24a-8115-4613-ab8a-e8808d00295b,671a8729-afed-428c-b81b-0dc36733afb8,,,,5/16/2024,FECHA OFICIO ENVIA CONVENIO
4a1783c8-2899-4100-8b99-cdd822e35ca9,bf3ebb2d-0d99-4ada-8f58-741219eb8658,51a42c4b-ae0c-47cb-9b5b-df04c2f96343,143,2024-03-26T00:00:00,,,Nº RES INCORPORA/ CERT CORE
fc521a80-f2a3-4053-b471-e84d87b7cc8f,bf3ebb2d-0d99-4ada-8f58-741219eb8658,4e8a5aca-2be7-4abc-9ec9-4e16d0357942,19,2024-04-01T00:00:00,,,Nº RES CREA ASIGNACIÓN
76e805aa-00e7-477c-9dc1-2c0c8b032eea,bf3ebb2d-0d99-4ada-8f58-741219eb8658,8d80c2b8-875d-43a9-bb4e-117ed9aab422,39,2024-05-10T00:00:00,AFECTA,,Nº RES APRUEBA CONVENIO 
2f90c06b-7a59-46c8-8c0b-b949d2101747,bf3ebb2d-0d99-4ada-8f58-741219eb8658,ef2a95fc-fe72-4284-85e5-15897c60881c,871,2024-06-13T00:00:00,,,Nº OFICIO ENVIA CONVENIO
cd1dbf91-5036-4bd7-9761-297e1e7f075e,bf3ebb2d-0d99-4ada-8f58-741219eb8658,0df1c4b6-ef93-4a00-a85a-acfafe36d421,10/06/2024,2024-06-10T00:00:00,,,FECHA TOMA DE RAZON DE CGR
c60931dc-0bef-4303-8851-46761a1dc1d7,bf3ebb2d-0d99-4ada-8f58-741219eb8658,671a8729-afed-428c-b81b-0dc36733afb8,,2024-06-13T00:00:00,,,FECHA OFICIO ENVIA CONVENIO
f853bbea-d8c7-4449-9a32-467f48563e60,55f24cc1-c9c0-4b81-bce4-9be29a9fb067,51a42c4b-ae0c-47cb-9b5b-df04c2f96343,775,2023-07-11T00:00:00,,,Nº RES INCORPORA/ CERT CORE
0cade6c2-42e1-45be-a718-7113cfcd918c,55f24cc1-c9c0-4b81-bce4-9be29a9fb067,4e8a5aca-2be7-4abc-9ec9-4e16d0357942,775,2023-07-11T00:00:00,,,Nº RES CREA ASIGNACIÓN
6a826014-83c4-41d0-b5ef-e6dd6de5c70c,55f24cc1-c9c0-4b81-bce4-9be29a9fb067,8d80c2b8-875d-43a9-bb4e-117ed9aab422,898,2023-08-17T00:00:00,EXENTA,,Nº RES APRUEBA CONVENIO 
eff04daa-5b9e-40bf-8746-5dbb94f12fc7,55f24cc1-c9c0-4b81-bce4-9be29a9fb067,0df1c4b6-ef93-4a00-a85a-acfafe36d421,,,,,FECHA TOMA DE RAZON DE CGR
7ee2b51b-5475-4489-aeaf-5fbad1a371d1,55f24cc1-c9c0-4b81-bce4-9be29a9fb067,a2f5100f-2a50-4a51-a795-dde18abad7f9,279/02.05.2024,,,279/02.05.2024,Nº RES REFERENTE TECNICO
879df83a-33be-4718-9156-26c61d804fc1,9c0b7a74-9f46-4a36-a832-a43638eba873,51a42c4b-ae0c-47cb-9b5b-df04c2f96343,775,2023-07-11T00:00:00,,,Nº RES INCORPORA/ CERT CORE
524bdeb2-5048-458c-83e7-4c91aa0c424c,9c0b7a74-9f46-4a36-a832-a43638eba873,4e8a5aca-2be7-4abc-9ec9-4e16d0357942,775,2023-07-11T00:00:00,,,Nº RES CREA ASIGNACIÓN
cb056a44-1b82-4fe4-bcf7-6371bcc95686,9c0b7a74-9f46-4a36-a832-a43638eba873,8d80c2b8-875d-43a9-bb4e-117ed9aab422,897,2023-08-17T00:00:00,EXENTA,,Nº RES APRUEBA CONVENIO 
acc7996a-6b2c-4d79-8f7b-5e2c2d8028de,9c0b7a74-9f46-4a36-a832-a43638eba873,0df1c4b6-ef93-4a00-a85a-acfafe36d421,,,,,FECHA TOMA DE RAZON DE CGR
55ce23e1-1d65-49d7-b7ef-24f0890d8fed,9c0b7a74-9f46-4a36-a832-a43638eba873,a2f5100f-2a50-4a51-a795-dde18abad7f9,279/02.05.2024,,,279/02.05.2024,Nº RES REFERENTE TECNICO
38c3bea9-0361-4a4e-b6b5-fdb948b9b57f,25d295d9-977c-47f5-abc2-9fa47fc3e937,51a42c4b-ae0c-47cb-9b5b-df04c2f96343,775,2023-07-11T00:00:00,,,Nº RES INCORPORA/ CERT CORE
37b7c8bb-0a37-4dc2-bdd4-d3dd86c78c63,25d295d9-977c-47f5-abc2-9fa47fc3e937,4e8a5aca-2be7-4abc-9ec9-4e16d0357942,775,2023-07-11T00:00:00,,,Nº RES CREA ASIGNACIÓN
15c72978-b493-47a9-9016-9dca2fd22382,25d295d9-977c-47f5-abc2-9fa47fc3e937,8d80c2b8-875d-43a9-bb4e-117ed9aab422,908,2023-08-18T00:00:00,EXENTA,,Nº RES APRUEBA CONVENIO 
36e386ef-e45b-493b-afe5-391899894d3f,25d295d9-977c-47f5-abc2-9fa47fc3e937,0df1c4b6-ef93-4a00-a85a-acfafe36d421,,,,,FECHA TOMA DE RAZON DE CGR
38903c2c-50fa-4022-bf5a-271938f48f6b,25d295d9-977c-47f5-abc2-9fa47fc3e937,a2f5100f-2a50-4a51-a795-dde18abad7f9,1291/19.12.2023,,,1291/19.12.2023,Nº RES REFERENTE TECNICO
181e0f68-43c7-4f17-b6f7-efab46c6a32d,28d57392-8c94-46f4-bb68-0b66db69316a,51a42c4b-ae0c-47cb-9b5b-df04c2f96343,775,2023-07-11T00:00:00,,,Nº RES INCORPORA/ CERT CORE
24f60da5-e32d-48d1-b677-f6e6bce5fa40,28d57392-8c94-46f4-bb68-0b66db69316a,4e8a5aca-2be7-4abc-9ec9-4e16d0357942,775,2023-07-11T00:00:00,,,Nº RES CREA ASIGNACIÓN
dcbd0694-b842-4afa-9a17-418aa3dbbf1b,28d57392-8c94-46f4-bb68-0b66db69316a,8d80c2b8-875d-43a9-bb4e-117ed9aab422,986,2023-09-21T00:00:00,EXENTA,,Nº RES APRUEBA CONVENIO 
b5de5646-c838-451c-9dd4-e53111bd5dc4,28d57392-8c94-46f4-bb68-0b66db69316a,0df1c4b6-ef93-4a00-a85a-acfafe36d421,,,,,FECHA TOMA DE RAZON DE CGR
26b68bd0-bcdf-4303-927a-e9d407047804,28d57392-8c94-46f4-bb68-0b66db69316a,a2f5100f-2a50-4a51-a795-dde18abad7f9,1291/19.12.2023,,,1291/19.12.2023,Nº RES REFERENTE TECNICO
ae3f3fea-e545-4c5a-95b1-00b0033a17f3,74b3d34d-5a89-4a29-8d1f-eee8ffe207b6,51a42c4b-ae0c-47cb-9b5b-df04c2f96343,775,2023-07-11T00:00:00,,,Nº RES INCORPORA/ CERT CORE
9412fb89-3cfc-47a0-8e80-65a8c5dd12d7,74b3d34d-5a89-4a29-8d1f-eee8ffe207b6,4e8a5aca-2be7-4abc-9ec9-4e16d0357942,775,2023-07-11T00:00:00,,,Nº RES CREA ASIGNACIÓN
b5fbfd1b-7d73-4645-bfc1-8ed03f248a57,74b3d34d-5a89-4a29-8d1f-eee8ffe207b6,8d80c2b8-875d-43a9-bb4e-117ed9aab422,909,2023-08-18T00:00:00,EXENTA,,Nº RES APRUEBA CONVENIO 
2d699999-d082-4853-9a99-63288a033354,74b3d34d-5a89-4a29-8d1f-eee8ffe207b6,0df1c4b6-ef93-4a00-a85a-acfafe36d421,,,,,FECHA TOMA DE RAZON DE CGR
eeea3d18-34f5-4d98-a519-b38d8db82ab3,74b3d34d-5a89-4a29-8d1f-eee8ffe207b6,a2f5100f-2a50-4a51-a795-dde18abad7f9,1291/19.12.2023,,,1291/19.12.2023,Nº RES REFERENTE TECNICO
af615a14-024d-4b35-b032-0eab2f029170,20b85350-f287-400f-9142-ebd59c46e3da,51a42c4b-ae0c-47cb-9b5b-df04c2f96343,775,2023-07-11T00:00:00,,,Nº RES INCORPORA/ CERT CORE
b96c1f32-5173-4e82-8d7c-650942399c0c,20b85350-f287-400f-9142-ebd59c46e3da,4e8a5aca-2be7-4abc-9ec9-4e16d0357942,775,2023-07-11T00:00:00,,,Nº RES CREA ASIGNACIÓN
d2c8ef1b-3b71-4d7e-8863-1365a855c490,20b85350-f287-400f-9142-ebd59c46e3da,8d80c2b8-875d-43a9-bb4e-117ed9aab422,842,2023-08-01T00:00:00,EXENTA,,Nº RES APRUEBA CONVENIO 
88d06e46-9d75-4028-bd67-f91a6f639538,20b85350-f287-400f-9142-ebd59c46e3da,0df1c4b6-ef93-4a00-a85a-acfafe36d421,,,,,FECHA TOMA DE RAZON DE CGR
fd0dc54f-78ff-4b56-84bd-6485c4c3108e,20b85350-f287-400f-9142-ebd59c46e3da,a2f5100f-2a50-4a51-a795-dde18abad7f9,1291/19.12.2023,,,1291/19.12.2023,Nº RES REFERENTE TECNICO
aca07218-50aa-4041-8ea1-4d621b6675c5,bcd9355c-8419-41dc-8862-5370728db224,51a42c4b-ae0c-47cb-9b5b-df04c2f96343,775,2023-07-11T00:00:00,,,Nº RES INCORPORA/ CERT CORE
12a80d79-6877-4ba2-987c-b351cb2532de,bcd9355c-8419-41dc-8862-5370728db224,4e8a5aca-2be7-4abc-9ec9-4e16d0357942,775,2023-07-11T00:00:00,,,Nº RES CREA ASIGNACIÓN
995757cc-8b63-4406-a7ba-a2307370f4ac,bcd9355c-8419-41dc-8862-5370728db224,8d80c2b8-875d-43a9-bb4e-117ed9aab422,797,2023-07-24T00:00:00,EXENTA,,Nº RES APRUEBA CONVENIO 
5821a031-9251-4e72-a076-a477d81ba291,bcd9355c-8419-41dc-8862-5370728db224,0df1c4b6-ef93-4a00-a85a-acfafe36d421,,,,,FECHA TOMA DE RAZON DE CGR
ba020e47-e758-47bc-975a-7ba18b5ecc9d,bcd9355c-8419-41dc-8862-5370728db224,a2f5100f-2a50-4a51-a795-dde18abad7f9,1291/19.12.2023,,,1291/19.12.2023,Nº RES REFERENTE TECNICO
6e7d423a-7683-4dca-916b-df75a5f85ed9,34543553-a10c-4654-9090-d8fbb728d9e0,51a42c4b-ae0c-47cb-9b5b-df04c2f96343,775,2023-07-11T00:00:00,,,Nº RES INCORPORA/ CERT CORE
9b81e266-92e0-4e5b-9fb7-e74b6e7520ee,34543553-a10c-4654-9090-d8fbb728d9e0,4e8a5aca-2be7-4abc-9ec9-4e16d0357942,775,2023-07-11T00:00:00,,,Nº RES CREA ASIGNACIÓN
ba5fe2e7-4da9-4ab7-a186-77c57eed6e91,34543553-a10c-4654-9090-d8fbb728d9e0,8d80c2b8-875d-43a9-bb4e-117ed9aab422,796,2023-07-24T00:00:00,EXENTA,,Nº RES APRUEBA CONVENIO 
8ef861d5-b725-4ba1-97ad-d94306a99436,34543553-a10c-4654-9090-d8fbb728d9e0,0df1c4b6-ef93-4a00-a85a-acfafe36d421,,,,,FECHA TOMA DE RAZON DE CGR
df3090d2-6817-4239-97ec-1834820ee1f5,34543553-a10c-4654-9090-d8fbb728d9e0,a2f5100f-2a50-4a51-a795-dde18abad7f9,1291/19.12.2023,,,1291/19.12.2023,Nº RES REFERENTE TECNICO
f907352c-0fd0-4042-afde-81a30c323d7e,d54c4298-c82e-4af1-bbc7-ad81805c330b,51a42c4b-ae0c-47cb-9b5b-df04c2f96343,775,2023-07-11T00:00:00,,,Nº RES INCORPORA/ CERT CORE
465bece6-0df8-4222-9ad6-ecd937338405,d54c4298-c82e-4af1-bbc7-ad81805c330b,4e8a5aca-2be7-4abc-9ec9-4e16d0357942,775,2023-07-11T00:00:00,,,Nº RES CREA ASIGNACIÓN
f3a403a6-d88e-4f96-86b8-5dca4a0c9cf0,d54c4298-c82e-4af1-bbc7-ad81805c330b,8d80c2b8-875d-43a9-bb4e-117ed9aab422,798,2023-07-24T00:00:00,EXENTA,,Nº RES APRUEBA CONVENIO 
a414fae8-2283-41c7-910f-98092644495f,d54c4298-c82e-4af1-bbc7-ad81805c330b,0df1c4b6-ef93-4a00-a85a-acfafe36d421,,,,,FECHA TOMA DE RAZON DE CGR
8a72cbda-472b-4989-8399-5b1081e0a428,d54c4298-c82e-4af1-bbc7-ad81805c330b,a2f5100f-2a50-4a51-a795-dde18abad7f9,1291/19.12.2023,,,1291/19.12.2023,Nº RES REFERENTE TECNICO
a4fe37c0-10cc-46a1-9393-40164f760250,00a5fd8b-689a-491a-80a7-58f1125427c3,51a42c4b-ae0c-47cb-9b5b-df04c2f96343,775,2023-07-11T00:00:00,,,Nº RES INCORPORA/ CERT CORE
a64bcd67-ff9e-46a2-85f0-00fd67dcf892,00a5fd8b-689a-491a-80a7-58f1125427c3,4e8a5aca-2be7-4abc-9ec9-4e16d0357942,775,2023-07-11T00:00:00,,,Nº RES CREA ASIGNACIÓN
d1521845-68bf-4a02-a62f-1cb18479cd4f,00a5fd8b-689a-491a-80a7-58f1125427c3,8d80c2b8-875d-43a9-bb4e-117ed9aab422,839,2023-08-01T00:00:00,EXENTA,,Nº RES APRUEBA CONVENIO 
d709b55e-b3a0-4138-bcd7-e4fdc8c69540,00a5fd8b-689a-491a-80a7-58f1125427c3,0df1c4b6-ef93-4a00-a85a-acfafe36d421,,,,,FECHA TOMA DE RAZON DE CGR
094e6983-8bdc-4456-9501-8eaedb0eeea3,00a5fd8b-689a-491a-80a7-58f1125427c3,a2f5100f-2a50-4a51-a795-dde18abad7f9,1291/19.12.2023,,,1291/19.12.2023,Nº RES REFERENTE TECNICO
c5f39fe3-fd0c-4ac2-b558-a90013a2a746,0d352a22-22b2-4517-b779-1933c938e397,51a42c4b-ae0c-47cb-9b5b-df04c2f96343,775,2023-07-11T00:00:00,,,Nº RES INCORPORA/ CERT CORE
6c85dec8-8c44-4317-908a-7743339ddb24,0d352a22-22b2-4517-b779-1933c938e397,4e8a5aca-2be7-4abc-9ec9-4e16d0357942,775,2023-07-11T00:00:00,,,Nº RES CREA ASIGNACIÓN
54e18635-5100-4d05-8e21-cb02f72d848d,0d352a22-22b2-4517-b779-1933c938e397,8d80c2b8-875d-43a9-bb4e-117ed9aab422,837,2023-07-31T00:00:00,EXENTA,,Nº RES APRUEBA CONVENIO 
f93da496-2c6c-4eb5-9c40-368baf4df97b,0d352a22-22b2-4517-b779-1933c938e397,0df1c4b6-ef93-4a00-a85a-acfafe36d421,,,,,FECHA TOMA DE RAZON DE CGR
a898672e-f01e-46c3-b5ec-239b2b07a304,0d352a22-22b2-4517-b779-1933c938e397,a2f5100f-2a50-4a51-a795-dde18abad7f9,1291/19.12.2023,,,1291/19.12.2023,Nº RES REFERENTE TECNICO
053df685-d0d0-4255-b544-99bf60e8cdf8,2db5ceb8-20b5-4461-bdd7-18a9d8deccf4,51a42c4b-ae0c-47cb-9b5b-df04c2f96343,775,2023-07-11T00:00:00,,,Nº RES INCORPORA/ CERT CORE
1c77762a-fb32-4720-99a2-5c698b2668e1,2db5ceb8-20b5-4461-bdd7-18a9d8deccf4,4e8a5aca-2be7-4abc-9ec9-4e16d0357942,775,2023-07-11T00:00:00,,,Nº RES CREA ASIGNACIÓN
d03d4bd8-9f14-4bf1-aabd-dafc8db4e12c,2db5ceb8-20b5-4461-bdd7-18a9d8deccf4,8d80c2b8-875d-43a9-bb4e-117ed9aab422,906,2023-08-18T00:00:00,EXENTA,,Nº RES APRUEBA CONVENIO 
9a11f1a6-e2d8-4104-8a24-df5334c18594,2db5ceb8-20b5-4461-bdd7-18a9d8deccf4,0df1c4b6-ef93-4a00-a85a-acfafe36d421,,,,,FECHA TOMA DE RAZON DE CGR
a9876fd6-7904-4bda-b835-9cfa45ef42b9,2db5ceb8-20b5-4461-bdd7-18a9d8deccf4,a2f5100f-2a50-4a51-a795-dde18abad7f9,1291/19.12.2023,,,1291/19.12.2023,Nº RES REFERENTE TECNICO
12d762bb-7854-48e6-87eb-9a7283a8869d,ea9b3c80-f61f-479f-a3c1-9b36574b9bad,51a42c4b-ae0c-47cb-9b5b-df04c2f96343,775,2023-07-11T00:00:00,,,Nº RES INCORPORA/ CERT CORE
b1692baf-03d7-4ed6-8e21-da5a932ff0ef,ea9b3c80-f61f-479f-a3c1-9b36574b9bad,4e8a5aca-2be7-4abc-9ec9-4e16d0357942,775,2023-07-11T00:00:00,,,Nº RES CREA ASIGNACIÓN
939996d8-ea0d-45e5-b387-0929be94abd3,ea9b3c80-f61f-479f-a3c1-9b36574b9bad,8d80c2b8-875d-43a9-bb4e-117ed9aab422,807,2023-07-24T00:00:00,EXENTA,,Nº RES APRUEBA CONVENIO 
e627fd0d-7d20-4a01-b10e-6c2397632408,ea9b3c80-f61f-479f-a3c1-9b36574b9bad,0df1c4b6-ef93-4a00-a85a-acfafe36d421,,,,,FECHA TOMA DE RAZON DE CGR
46455bc6-8bf7-43c0-8709-e6824a086c29,ea9b3c80-f61f-479f-a3c1-9b36574b9bad,a2f5100f-2a50-4a51-a795-dde18abad7f9,1291/19.12.2023,,,1291/19.12.2023,Nº RES REFERENTE TECNICO
bdc8b5d2-104c-48f5-be89-4272805cc1d4,449f891b-209b-4ce5-8ade-2d07fe480901,51a42c4b-ae0c-47cb-9b5b-df04c2f96343,775,2023-07-11T00:00:00,,,Nº RES INCORPORA/ CERT CORE
092679af-7982-420b-8ba3-22c4f9a59cb4,449f891b-209b-4ce5-8ade-2d07fe480901,4e8a5aca-2be7-4abc-9ec9-4e16d0357942,775,2023-07-11T00:00:00,,,Nº RES CREA ASIGNACIÓN
cf70e803-99e5-41e1-b16d-93bee453885c,449f891b-209b-4ce5-8ade-2d07fe480901,8d80c2b8-875d-43a9-bb4e-117ed9aab422,791,2023-07-24T00:00:00,EXENTA,,Nº RES APRUEBA CONVENIO 
5336eff9-93b0-4543-b8ac-9e320d965b05,449f891b-209b-4ce5-8ade-2d07fe480901,0df1c4b6-ef93-4a00-a85a-acfafe36d421,,,,,FECHA TOMA DE RAZON DE CGR
59bfec6f-100d-481e-9dc1-609d0d3974d4,449f891b-209b-4ce5-8ade-2d07fe480901,a2f5100f-2a50-4a51-a795-dde18abad7f9,1291/19.12.2023,,,1291/19.12.2023,Nº RES REFERENTE TECNICO
61d902fe-ccfb-4ac5-9d9c-4c838cf27cc5,a3205156-dcba-45f9-8587-6f15ee15d5d1,51a42c4b-ae0c-47cb-9b5b-df04c2f96343,775,2023-07-11T00:00:00,,,Nº RES INCORPORA/ CERT CORE
7b816968-0ac3-4cf9-bd29-03bf44b5c95f,a3205156-dcba-45f9-8587-6f15ee15d5d1,4e8a5aca-2be7-4abc-9ec9-4e16d0357942,775,2023-07-11T00:00:00,,,Nº RES CREA ASIGNACIÓN
2bda91cb-1db1-4c65-accd-05416ca87a99,a3205156-dcba-45f9-8587-6f15ee15d5d1,8d80c2b8-875d-43a9-bb4e-117ed9aab422,795,2023-07-24T00:00:00,EXENTA,,Nº RES APRUEBA CONVENIO 
2de029a3-25a5-4e3d-95bc-9a60d506b719,a3205156-dcba-45f9-8587-6f15ee15d5d1,0df1c4b6-ef93-4a00-a85a-acfafe36d421,,,,,FECHA TOMA DE RAZON DE CGR
f0c595bd-f485-46cc-9de0-894fa488afc8,a3205156-dcba-45f9-8587-6f15ee15d5d1,a2f5100f-2a50-4a51-a795-dde18abad7f9,1291/19.12.2023,,,1291/19.12.2023,Nº RES REFERENTE TECNICO
c2781a7d-a27c-4551-95d1-ead09e7efc9c,75980a1e-dc2a-41ba-bbb4-b34d49518932,51a42c4b-ae0c-47cb-9b5b-df04c2f96343,775,2023-07-11T00:00:00,,,Nº RES INCORPORA/ CERT CORE
bc2b6d4c-0bae-4285-977d-a17ae7a94e58,75980a1e-dc2a-41ba-bbb4-b34d49518932,4e8a5aca-2be7-4abc-9ec9-4e16d0357942,775,2023-07-11T00:00:00,,,Nº RES CREA ASIGNACIÓN
97843e96-9a24-4c4f-9cd9-25058332d6e4,75980a1e-dc2a-41ba-bbb4-b34d49518932,8d80c2b8-875d-43a9-bb4e-117ed9aab422,805,2023-07-24T00:00:00,EXENTA,,Nº RES APRUEBA CONVENIO 
48d112d4-db53-449f-b963-635ea33e5630,75980a1e-dc2a-41ba-bbb4-b34d49518932,0df1c4b6-ef93-4a00-a85a-acfafe36d421,,,,,FECHA TOMA DE RAZON DE CGR
01585e12-510b-4f97-b437-ec437148e89b,75980a1e-dc2a-41ba-bbb4-b34d49518932,a2f5100f-2a50-4a51-a795-dde18abad7f9,1291/19.12.2023,,,1291/19.12.2023,Nº RES REFERENTE TECNICO
0b61ae4c-1375-46c7-8e94-f89691558da0,3402464b-74be-44fb-a8b3-2e72156fcbe8,51a42c4b-ae0c-47cb-9b5b-df04c2f96343,775,2023-07-11T00:00:00,,,Nº RES INCORPORA/ CERT CORE
bd282cb4-cf7b-4bac-8285-8abd055d5291,3402464b-74be-44fb-a8b3-2e72156fcbe8,4e8a5aca-2be7-4abc-9ec9-4e16d0357942,775,2023-07-11T00:00:00,,,Nº RES CREA ASIGNACIÓN
ecfe60da-3168-4836-bf31-62c7311cc5d3,3402464b-74be-44fb-a8b3-2e72156fcbe8,8d80c2b8-875d-43a9-bb4e-117ed9aab422,803,2023-07-24T00:00:00,EXENTA,,Nº RES APRUEBA CONVENIO 
6beedeef-96fc-4e03-98f1-14568d87a0ad,3402464b-74be-44fb-a8b3-2e72156fcbe8,0df1c4b6-ef93-4a00-a85a-acfafe36d421,,,,,FECHA TOMA DE RAZON DE CGR
e06a2526-371f-4883-b274-e53997ca7bb2,3402464b-74be-44fb-a8b3-2e72156fcbe8,a2f5100f-2a50-4a51-a795-dde18abad7f9,1291/19.12.2023,,,1291/19.12.2023,Nº RES REFERENTE TECNICO
69f0d5a2-2fee-459d-9514-57d6ed73e182,00146ab6-ad3f-4846-8dd3-6b730d574c28,51a42c4b-ae0c-47cb-9b5b-df04c2f96343,775,2023-07-11T00:00:00,,,Nº RES INCORPORA/ CERT CORE
1432736e-80fb-4e24-ae89-1b3e4c6fc9a8,00146ab6-ad3f-4846-8dd3-6b730d574c28,4e8a5aca-2be7-4abc-9ec9-4e16d0357942,50,2024-02-05T00:00:00,,,Nº RES CREA ASIGNACIÓN
a3dc6e42-2df5-4291-ab6c-8f84e5e95178,00146ab6-ad3f-4846-8dd3-6b730d574c28,8d80c2b8-875d-43a9-bb4e-117ed9aab422,804,2023-07-24T00:00:00,EXENTA,,Nº RES APRUEBA CONVENIO 
99db8d4a-7184-4560-9ed1-d481a944dbac,00146ab6-ad3f-4846-8dd3-6b730d574c28,0df1c4b6-ef93-4a00-a85a-acfafe36d421,,,,,FECHA TOMA DE RAZON DE CGR
254d3b75-2d74-40aa-bcef-a2f36fea8c48,66e53ab5-2e9f-4580-9c6a-f3a0c7020389,51a42c4b-ae0c-47cb-9b5b-df04c2f96343,775,2023-07-11T00:00:00,,,Nº RES INCORPORA/ CERT CORE
953fa570-99e5-4305-877e-f5a12feff5b1,66e53ab5-2e9f-4580-9c6a-f3a0c7020389,4e8a5aca-2be7-4abc-9ec9-4e16d0357942,775,2023-07-11T00:00:00,,,Nº RES CREA ASIGNACIÓN
c75f2c8b-ae46-403f-9250-195752e697bc,66e53ab5-2e9f-4580-9c6a-f3a0c7020389,8d80c2b8-875d-43a9-bb4e-117ed9aab422,794,2023-07-24T00:00:00,EXENTA,,Nº RES APRUEBA CONVENIO 
6ec9077b-bb55-45fa-ae38-94306753d506,66e53ab5-2e9f-4580-9c6a-f3a0c7020389,0df1c4b6-ef93-4a00-a85a-acfafe36d421,,,,,FECHA TOMA DE RAZON DE CGR
8fb66f67-d3b4-4dfc-9b71-e41861f57f42,66e53ab5-2e9f-4580-9c6a-f3a0c7020389,a2f5100f-2a50-4a51-a795-dde18abad7f9,1291/19.12.2023,,,1291/19.12.2023,Nº RES REFERENTE TECNICO
3f6b0eb7-f966-437b-81b9-d4a816e0c969,f2966ab6-6669-4bee-b0f1-64fd5d396a6e,51a42c4b-ae0c-47cb-9b5b-df04c2f96343,775,2023-07-11T00:00:00,,,Nº RES INCORPORA/ CERT CORE
d492aedc-3ec4-48ee-934a-6839b3e45840,f2966ab6-6669-4bee-b0f1-64fd5d396a6e,4e8a5aca-2be7-4abc-9ec9-4e16d0357942,775,2023-07-11T00:00:00,,,Nº RES CREA ASIGNACIÓN
61c83fec-4947-495b-865f-ccac58d0650b,f2966ab6-6669-4bee-b0f1-64fd5d396a6e,8d80c2b8-875d-43a9-bb4e-117ed9aab422,788,2023-07-24T00:00:00,EXENTA,,Nº RES APRUEBA CONVENIO 
9c2eaff9-160e-4430-bfcd-8026a56d443b,f2966ab6-6669-4bee-b0f1-64fd5d396a6e,0df1c4b6-ef93-4a00-a85a-acfafe36d421,,,,,FECHA TOMA DE RAZON DE CGR
457dd754-556f-4ef5-b354-b94fe7bc29e6,f2966ab6-6669-4bee-b0f1-64fd5d396a6e,a2f5100f-2a50-4a51-a795-dde18abad7f9,279/02.05.2024,,,279/02.05.2024,Nº RES REFERENTE TECNICO
dc474fbf-d3b0-4910-b6e9-00447bb271ba,9fa9e24a-1073-43c2-b4a8-f4c4c0c41994,51a42c4b-ae0c-47cb-9b5b-df04c2f96343,775,2023-07-11T00:00:00,,,Nº RES INCORPORA/ CERT CORE
483d698d-2504-40cc-917a-5f6bae5c3ee0,9fa9e24a-1073-43c2-b4a8-f4c4c0c41994,4e8a5aca-2be7-4abc-9ec9-4e16d0357942,775,2023-07-11T00:00:00,,,Nº RES CREA ASIGNACIÓN
7f266bf5-8ad1-40a3-958d-751be449485c,9fa9e24a-1073-43c2-b4a8-f4c4c0c41994,8d80c2b8-875d-43a9-bb4e-117ed9aab422,789,2023-07-24T00:00:00,EXENTA,,Nº RES APRUEBA CONVENIO 
7a5a754f-2fb5-4420-9be7-e7f89cc6754c,9fa9e24a-1073-43c2-b4a8-f4c4c0c41994,0df1c4b6-ef93-4a00-a85a-acfafe36d421,,,,,FECHA TOMA DE RAZON DE CGR
0abfb139-3b4b-413b-be2a-12e1eb356406,9fa9e24a-1073-43c2-b4a8-f4c4c0c41994,a2f5100f-2a50-4a51-a795-dde18abad7f9,279/02.05.2024,,,279/02.05.2024,Nº RES REFERENTE TECNICO
cee99353-e732-4c91-8a16-03c31657682b,60d79ac7-31b9-4f1f-9631-a5e1159af372,51a42c4b-ae0c-47cb-9b5b-df04c2f96343,775,2023-07-11T00:00:00,,,Nº RES INCORPORA/ CERT CORE
67d18df1-364a-4e0d-bf16-700efa946830,60d79ac7-31b9-4f1f-9631-a5e1159af372,4e8a5aca-2be7-4abc-9ec9-4e16d0357942,775,2023-07-11T00:00:00,,,Nº RES CREA ASIGNACIÓN
8258df3a-b1f6-4cb7-af3c-68a81737ade3,60d79ac7-31b9-4f1f-9631-a5e1159af372,8d80c2b8-875d-43a9-bb4e-117ed9aab422,907,2023-08-18T00:00:00,EXENTA,,Nº RES APRUEBA CONVENIO 
3e9610fe-a139-4ea3-a4fb-42588aaba9dd,60d79ac7-31b9-4f1f-9631-a5e1159af372,0df1c4b6-ef93-4a00-a85a-acfafe36d421,,,,,FECHA TOMA DE RAZON DE CGR
a4d3c4ec-f2f8-479f-894b-5481bd3c74d0,60d79ac7-31b9-4f1f-9631-a5e1159af372,a2f5100f-2a50-4a51-a795-dde18abad7f9,1291/19.12.2023,,,1291/19.12.2023,Nº RES REFERENTE TECNICO
752dbe88-2d66-4919-a21d-65660d0a76d2,4ba2eaae-cc4d-4956-b02b-f5ba91fdc319,51a42c4b-ae0c-47cb-9b5b-df04c2f96343,775,2023-07-11T00:00:00,,,Nº RES INCORPORA/ CERT CORE
5a6818a5-b4a1-4c4a-9eef-3deb2edc3f20,4ba2eaae-cc4d-4956-b02b-f5ba91fdc319,4e8a5aca-2be7-4abc-9ec9-4e16d0357942,775,2023-07-11T00:00:00,,,Nº RES CREA ASIGNACIÓN
5f54a11b-8db3-44df-b7af-06376e660bcb,4ba2eaae-cc4d-4956-b02b-f5ba91fdc319,8d80c2b8-875d-43a9-bb4e-117ed9aab422,799,2023-07-24T00:00:00,EXENTA,,Nº RES APRUEBA CONVENIO 
09ad02ef-3bad-4a7b-af37-bcc313a8cdf6,4ba2eaae-cc4d-4956-b02b-f5ba91fdc319,0df1c4b6-ef93-4a00-a85a-acfafe36d421,,,,,FECHA TOMA DE RAZON DE CGR
0c0e4129-4772-4fb5-a6a7-162c23d98f80,4ba2eaae-cc4d-4956-b02b-f5ba91fdc319,a2f5100f-2a50-4a51-a795-dde18abad7f9,1291/19.12.2023,,,1291/19.12.2023,Nº RES REFERENTE TECNICO
51eb4d8a-aa44-4f8a-8e20-65474f232c22,62a261e7-e297-4707-acbb-5cee0b339044,51a42c4b-ae0c-47cb-9b5b-df04c2f96343,775,2023-07-11T00:00:00,,,Nº RES INCORPORA/ CERT CORE
fa834577-3e9a-4941-8c31-0b17ce3be930,62a261e7-e297-4707-acbb-5cee0b339044,4e8a5aca-2be7-4abc-9ec9-4e16d0357942,775,2023-07-11T00:00:00,,,Nº RES CREA ASIGNACIÓN
54e3d9ee-5e8e-4449-84e5-ced0b6658b92,62a261e7-e297-4707-acbb-5cee0b339044,8d80c2b8-875d-43a9-bb4e-117ed9aab422,806,2023-07-24T00:00:00,EXENTA,,Nº RES APRUEBA CONVENIO 
31b507a8-af33-44eb-b3a7-e87777fe628b,62a261e7-e297-4707-acbb-5cee0b339044,0df1c4b6-ef93-4a00-a85a-acfafe36d421,,,,,FECHA TOMA DE RAZON DE CGR
1ad2eeb9-4a3e-4bef-8f9e-0dc62cb8b5e9,62a261e7-e297-4707-acbb-5cee0b339044,a2f5100f-2a50-4a51-a795-dde18abad7f9,279/02.05.2024,,,279/02.05.2024,Nº RES REFERENTE TECNICO
144106fa-064c-4e1e-aff2-a1735f4196af,f6613b78-9de9-4b14-956b-25041172f4c3,51a42c4b-ae0c-47cb-9b5b-df04c2f96343,775,2023-07-11T00:00:00,,,Nº RES INCORPORA/ CERT CORE
c9b644c1-e460-4faa-8e17-d5c9e0498dca,f6613b78-9de9-4b14-956b-25041172f4c3,4e8a5aca-2be7-4abc-9ec9-4e16d0357942,775,2023-07-11T00:00:00,,,Nº RES CREA ASIGNACIÓN
336e9a03-b240-449a-bc27-a7238cae51ea,f6613b78-9de9-4b14-956b-25041172f4c3,8d80c2b8-875d-43a9-bb4e-117ed9aab422,896,2023-08-17T00:00:00,EXENTA,,Nº RES APRUEBA CONVENIO 
a76fc87d-e13d-4db4-af90-608401728a7a,f6613b78-9de9-4b14-956b-25041172f4c3,0df1c4b6-ef93-4a00-a85a-acfafe36d421,,,,,FECHA TOMA DE RAZON DE CGR
bd3e3f86-0990-46d9-ab8d-52b5456a507d,f6613b78-9de9-4b14-956b-25041172f4c3,a2f5100f-2a50-4a51-a795-dde18abad7f9,279/02.05.2024,,,279/02.05.2024,Nº RES REFERENTE TECNICO
2bea951c-8a9c-4eed-ad2d-58fbefca94a1,f2abfc68-ab7a-42a9-afb2-a4ac4d76da68,51a42c4b-ae0c-47cb-9b5b-df04c2f96343,775,2023-07-11T00:00:00,,,Nº RES INCORPORA/ CERT CORE
591bae85-cbff-4135-acba-63faa2368b0a,f2abfc68-ab7a-42a9-afb2-a4ac4d76da68,4e8a5aca-2be7-4abc-9ec9-4e16d0357942,775,2023-07-11T00:00:00,,,Nº RES CREA ASIGNACIÓN
a8f40190-1d3d-48f5-b364-8dee675b7dc5,f2abfc68-ab7a-42a9-afb2-a4ac4d76da68,8d80c2b8-875d-43a9-bb4e-117ed9aab422,793,2023-07-24T00:00:00,EXENTA,,Nº RES APRUEBA CONVENIO 
20651642-d043-4921-ae82-718afc3ba41f,f2abfc68-ab7a-42a9-afb2-a4ac4d76da68,0df1c4b6-ef93-4a00-a85a-acfafe36d421,,,,,FECHA TOMA DE RAZON DE CGR
7b44e796-e15b-4a99-ad92-681ed4b3bf5c,f2abfc68-ab7a-42a9-afb2-a4ac4d76da68,a2f5100f-2a50-4a51-a795-dde18abad7f9,1291/19.12.2023,,,1291/19.12.2023,Nº RES REFERENTE TECNICO
c67e1bf2-3dbd-402d-a419-df02ac39eb68,5d7e6aac-50ea-41b8-bb75-1ceefb5633b4,51a42c4b-ae0c-47cb-9b5b-df04c2f96343,775,2023-07-11T00:00:00,,,Nº RES INCORPORA/ CERT CORE
c88d7893-2b1e-476c-9340-3ca6a560b0a5,5d7e6aac-50ea-41b8-bb75-1ceefb5633b4,4e8a5aca-2be7-4abc-9ec9-4e16d0357942,775,2023-07-11T00:00:00,,,Nº RES CREA ASIGNACIÓN
f2759aee-293d-4a4d-b451-986da3f5477b,5d7e6aac-50ea-41b8-bb75-1ceefb5633b4,8d80c2b8-875d-43a9-bb4e-117ed9aab422,949,2023-09-01T00:00:00,EXENTA,,Nº RES APRUEBA CONVENIO 
f7333a00-cd45-41bb-b068-8daceb29e1a6,5d7e6aac-50ea-41b8-bb75-1ceefb5633b4,0df1c4b6-ef93-4a00-a85a-acfafe36d421,,,,,FECHA TOMA DE RAZON DE CGR
d6c72bce-d275-4dfe-aaec-6daa84095671,5d7e6aac-50ea-41b8-bb75-1ceefb5633b4,a2f5100f-2a50-4a51-a795-dde18abad7f9,279/02.05.2024,,,279/02.05.2024,Nº RES REFERENTE TECNICO
1e607b5c-2892-42dd-9b72-45f61aae74ab,7debca41-f456-4356-85d1-1d4fe8406128,51a42c4b-ae0c-47cb-9b5b-df04c2f96343,776,2023-07-11T00:00:00,,,Nº RES INCORPORA/ CERT CORE
44ebd224-e928-49db-b237-7ffa57363d8e,7debca41-f456-4356-85d1-1d4fe8406128,4e8a5aca-2be7-4abc-9ec9-4e16d0357942,776,2023-07-11T00:00:00,,,Nº RES CREA ASIGNACIÓN
e97a4e7b-55cc-443a-8a20-2de351557793,7debca41-f456-4356-85d1-1d4fe8406128,8d80c2b8-875d-43a9-bb4e-117ed9aab422,802,2023-07-24T00:00:00,EXENTA,,Nº RES APRUEBA CONVENIO 
a6fab20f-e8a2-44d4-8449-d5e17bd8f51a,7debca41-f456-4356-85d1-1d4fe8406128,0df1c4b6-ef93-4a00-a85a-acfafe36d421,,,,,FECHA TOMA DE RAZON DE CGR
9a3bf23e-965a-4bfb-82e5-5d4898fbff65,7debca41-f456-4356-85d1-1d4fe8406128,a2f5100f-2a50-4a51-a795-dde18abad7f9,1291/19.12.2023,,,1291/19.12.2023,Nº RES REFERENTE TECNICO
e1e0432f-de4a-420b-8b20-ecb442aac850,ef8e821c-9502-4065-baf2-da5d761c36d4,51a42c4b-ae0c-47cb-9b5b-df04c2f96343,776,2023-07-11T00:00:00,,,Nº RES INCORPORA/ CERT CORE
d57910cf-89ff-4527-8658-e33f5a37f594,ef8e821c-9502-4065-baf2-da5d761c36d4,4e8a5aca-2be7-4abc-9ec9-4e16d0357942,776,2023-07-11T00:00:00,,,Nº RES CREA ASIGNACIÓN
ffdea313-8664-4ea5-aa56-34f99c8a5d82,ef8e821c-9502-4065-baf2-da5d761c36d4,8d80c2b8-875d-43a9-bb4e-117ed9aab422,800,2023-07-24T00:00:00,EXENTA,,Nº RES APRUEBA CONVENIO 
97aefec1-6a29-4af0-b7a4-78081d2c90ea,ef8e821c-9502-4065-baf2-da5d761c36d4,0df1c4b6-ef93-4a00-a85a-acfafe36d421,,,,,FECHA TOMA DE RAZON DE CGR
85e1d776-a35f-4e0d-968b-8343e927290d,ef8e821c-9502-4065-baf2-da5d761c36d4,a2f5100f-2a50-4a51-a795-dde18abad7f9,1291/19.12.2023,,,1291/19.12.2023,Nº RES REFERENTE TECNICO
14088eaf-dceb-46d9-af6d-2720eb77f9cd,486b7f38-9f6e-4f8b-902f-31182b013ab7,51a42c4b-ae0c-47cb-9b5b-df04c2f96343,776,2023-07-11T00:00:00,,,Nº RES INCORPORA/ CERT CORE
9d64fdad-7f7b-4bd0-a58a-f0a185340a52,486b7f38-9f6e-4f8b-902f-31182b013ab7,4e8a5aca-2be7-4abc-9ec9-4e16d0357942,776,2023-07-11T00:00:00,,,Nº RES CREA ASIGNACIÓN
9cd542c9-0ab4-463a-86f3-e2cb04a67d70,486b7f38-9f6e-4f8b-902f-31182b013ab7,8d80c2b8-875d-43a9-bb4e-117ed9aab422,1138,2023-10-31T00:00:00,EXENTA,,Nº RES APRUEBA CONVENIO 
228de124-30eb-4142-99ef-e7094706dcc7,486b7f38-9f6e-4f8b-902f-31182b013ab7,0df1c4b6-ef93-4a00-a85a-acfafe36d421,,,,,FECHA TOMA DE RAZON DE CGR
64c7c039-08be-4a14-8756-3ef775a2e876,486b7f38-9f6e-4f8b-902f-31182b013ab7,a2f5100f-2a50-4a51-a795-dde18abad7f9,279/02.05.2024,,,279/02.05.2024,Nº RES REFERENTE TECNICO
fab352f1-fec5-43c1-b4cb-da93d7dcc6f0,46d2ce48-564d-4046-b007-931775ee8968,51a42c4b-ae0c-47cb-9b5b-df04c2f96343,776,2023-07-11T00:00:00,,,Nº RES INCORPORA/ CERT CORE
d3c8917d-c72d-49aa-8ef6-55a898e374e9,46d2ce48-564d-4046-b007-931775ee8968,4e8a5aca-2be7-4abc-9ec9-4e16d0357942,776,2023-07-11T00:00:00,,,Nº RES CREA ASIGNACIÓN
6a587cf4-1316-4b02-9025-174fb14befd7,46d2ce48-564d-4046-b007-931775ee8968,8d80c2b8-875d-43a9-bb4e-117ed9aab422,808,2023-07-24T00:00:00,EXENTA,,Nº RES APRUEBA CONVENIO 
eb2157fb-0f52-4fa1-a619-d1a2a96835bf,46d2ce48-564d-4046-b007-931775ee8968,0df1c4b6-ef93-4a00-a85a-acfafe36d421,,,,,FECHA TOMA DE RAZON DE CGR
ce03f604-3f54-4b70-ac9d-5b311d93a075,46d2ce48-564d-4046-b007-931775ee8968,a2f5100f-2a50-4a51-a795-dde18abad7f9,1291/19.12.2023,,,1291/19.12.2023,Nº RES REFERENTE TECNICO
3a4ac138-fe78-4251-b9b2-d402d29abb59,c6cdece5-d3c5-427f-baa4-eeca6d81bb82,51a42c4b-ae0c-47cb-9b5b-df04c2f96343,776,2023-07-11T00:00:00,,,Nº RES INCORPORA/ CERT CORE
c3525128-8ede-4ba2-9856-efc15cc802e0,c6cdece5-d3c5-427f-baa4-eeca6d81bb82,4e8a5aca-2be7-4abc-9ec9-4e16d0357942,776,2023-07-11T00:00:00,,,Nº RES CREA ASIGNACIÓN
57db9002-a33a-4b84-85e3-48d30f30bc07,c6cdece5-d3c5-427f-baa4-eeca6d81bb82,8d80c2b8-875d-43a9-bb4e-117ed9aab422,801,2023-07-24T00:00:00,EXENTA,,Nº RES APRUEBA CONVENIO 
44b0004c-af70-4e83-998a-64418f48254f,c6cdece5-d3c5-427f-baa4-eeca6d81bb82,0df1c4b6-ef93-4a00-a85a-acfafe36d421,,,,,FECHA TOMA DE RAZON DE CGR
1edce330-3fd3-47e4-8c0b-86a9d8c3e78a,c6cdece5-d3c5-427f-baa4-eeca6d81bb82,a2f5100f-2a50-4a51-a795-dde18abad7f9,1291/19.12.2023,,,1291/19.12.2023,Nº RES REFERENTE TECNICO
1f7888d2-2d48-48dc-ad8c-ae6a9b19fa34,2a61f8fd-9681-4255-9dff-c32a0dec9dd4,51a42c4b-ae0c-47cb-9b5b-df04c2f96343,776,2023-07-11T00:00:00,,,Nº RES INCORPORA/ CERT CORE
71a42667-3343-4d93-be22-8bf6cf1bca96,2a61f8fd-9681-4255-9dff-c32a0dec9dd4,4e8a5aca-2be7-4abc-9ec9-4e16d0357942,776,2023-07-11T00:00:00,,,Nº RES CREA ASIGNACIÓN
24668b07-8386-4c83-a71b-df38370ea61a,2a61f8fd-9681-4255-9dff-c32a0dec9dd4,8d80c2b8-875d-43a9-bb4e-117ed9aab422,790,2023-07-24T00:00:00,EXENTA,,Nº RES APRUEBA CONVENIO 
cf6e79c1-4fb2-462f-b413-44c8bec44d47,2a61f8fd-9681-4255-9dff-c32a0dec9dd4,0df1c4b6-ef93-4a00-a85a-acfafe36d421,,,,,FECHA TOMA DE RAZON DE CGR
925cb7a7-23fe-4a5c-bd4d-27a7cd76719b,2a61f8fd-9681-4255-9dff-c32a0dec9dd4,a2f5100f-2a50-4a51-a795-dde18abad7f9,1291/19.12.2023,,,1291/19.12.2023,Nº RES REFERENTE TECNICO
ab1611c7-4ff4-4199-af13-303629f7a456,d276b4b2-b41f-43b9-b50c-b482b30e4f2e,51a42c4b-ae0c-47cb-9b5b-df04c2f96343,776,2023-07-11T00:00:00,,,Nº RES INCORPORA/ CERT CORE
8c74bf98-89f6-45e6-b823-a073daedbc50,d276b4b2-b41f-43b9-b50c-b482b30e4f2e,4e8a5aca-2be7-4abc-9ec9-4e16d0357942,776,2023-07-11T00:00:00,,,Nº RES CREA ASIGNACIÓN
d0d3e464-0705-4ff8-a68e-4b50565564c0,d276b4b2-b41f-43b9-b50c-b482b30e4f2e,8d80c2b8-875d-43a9-bb4e-117ed9aab422,792,2023-07-24T00:00:00,EXENTA,,Nº RES APRUEBA CONVENIO 
ee936902-fbcd-4d3c-ad31-0026aae54e80,d276b4b2-b41f-43b9-b50c-b482b30e4f2e,0df1c4b6-ef93-4a00-a85a-acfafe36d421,,,,,FECHA TOMA DE RAZON DE CGR
f1073f9c-4fcd-4190-98d8-0462d15f507e,d276b4b2-b41f-43b9-b50c-b482b30e4f2e,a2f5100f-2a50-4a51-a795-dde18abad7f9,279/02.05.2024,,,279/02.05.2024,Nº RES REFERENTE TECNICO
7823ac18-5e7f-4cf4-b176-50066560fe02,547364c3-2727-493e-a63b-258b6434872f,51a42c4b-ae0c-47cb-9b5b-df04c2f96343,776,2023-07-11T00:00:00,,,Nº RES INCORPORA/ CERT CORE
cc4c7290-e6ea-4705-87df-7b58179b5223,547364c3-2727-493e-a63b-258b6434872f,4e8a5aca-2be7-4abc-9ec9-4e16d0357942,776,2023-07-11T00:00:00,,,Nº RES CREA ASIGNACIÓN
f177e7dd-74ea-4e81-9ddf-1cc6f50ccb7e,547364c3-2727-493e-a63b-258b6434872f,8d80c2b8-875d-43a9-bb4e-117ed9aab422,836,2023-07-31T00:00:00,EXENTA,,Nº RES APRUEBA CONVENIO 
92826e5b-069f-43dc-bd3d-7d5ddbd19bb2,547364c3-2727-493e-a63b-258b6434872f,0df1c4b6-ef93-4a00-a85a-acfafe36d421,,,,,FECHA TOMA DE RAZON DE CGR
62bf1725-76f1-4e76-aad8-ecc24a7f4724,547364c3-2727-493e-a63b-258b6434872f,a2f5100f-2a50-4a51-a795-dde18abad7f9,1291/19.12.2023,,,1291/19.12.2023,Nº RES REFERENTE TECNICO
888b6039-c4d3-437c-8014-f742668872d0,6f30f771-dc04-4799-a1e5-c5f506ddd04a,51a42c4b-ae0c-47cb-9b5b-df04c2f96343,143,2024-03-26T00:00:00,,,Nº RES INCORPORA/ CERT CORE
4a3b58f5-5fc9-47a3-be6f-53e70dce85ad,6f30f771-dc04-4799-a1e5-c5f506ddd04a,4e8a5aca-2be7-4abc-9ec9-4e16d0357942,19,2024-04-01T00:00:00,,,Nº RES CREA ASIGNACIÓN
30d93156-67c9-462b-bf65-98d5d3f29fdc,6f30f771-dc04-4799-a1e5-c5f506ddd04a,8d80c2b8-875d-43a9-bb4e-117ed9aab422,40,2024-05-13T00:00:00,AFECTA,,Nº RES APRUEBA CONVENIO 
764684a9-2566-419e-8950-131ada8c700b,6f30f771-dc04-4799-a1e5-c5f506ddd04a,ef2a95fc-fe72-4284-85e5-15897c60881c,792,,,5/28/2024,Nº OFICIO ENVIA CONVENIO
07da43f5-5cf2-47cc-985f-23757987a653,6f30f771-dc04-4799-a1e5-c5f506ddd04a,0df1c4b6-ef93-4a00-a85a-acfafe36d421,27/05/2024,2024-05-27T00:00:00,,,FECHA TOMA DE RAZON DE CGR
984bff45-3cbc-4be0-a96b-98dc6e10bd5f,6f30f771-dc04-4799-a1e5-c5f506ddd04a,671a8729-afed-428c-b81b-0dc36733afb8,,,,5/28/2024,FECHA OFICIO ENVIA CONVENIO
7040d91d-c4f8-40ec-b929-87bf2780f057,e2dc4bf3-92c1-4aea-8d06-8b4dc13ca25c,51a42c4b-ae0c-47cb-9b5b-df04c2f96343,136,2024-03-22T00:00:00,,,Nº RES INCORPORA/ CERT CORE
8a9e609b-bfb3-4fe4-8fbf-db0ae068dc83,e2dc4bf3-92c1-4aea-8d06-8b4dc13ca25c,4e8a5aca-2be7-4abc-9ec9-4e16d0357942,136,2024-03-22T00:00:00,,,Nº RES CREA ASIGNACIÓN
3c1b0beb-cacb-4931-a411-cf50f6f1a05d,e2dc4bf3-92c1-4aea-8d06-8b4dc13ca25c,8d80c2b8-875d-43a9-bb4e-117ed9aab422,41,2024-05-15T00:00:00,AFECTA,,Nº RES APRUEBA CONVENIO 
1a9b3a6e-3605-484b-96a2-b5a90980d958,e2dc4bf3-92c1-4aea-8d06-8b4dc13ca25c,ef2a95fc-fe72-4284-85e5-15897c60881c,856,2024-11-06T00:00:00,,,Nº OFICIO ENVIA CONVENIO
f102d284-1e36-466e-b0f6-714def05c79b,e2dc4bf3-92c1-4aea-8d06-8b4dc13ca25c,0df1c4b6-ef93-4a00-a85a-acfafe36d421,06/06/2024,2024-06-06T00:00:00,,,FECHA TOMA DE RAZON DE CGR
79df461c-931d-43f9-9c64-3076d702bebd,e2dc4bf3-92c1-4aea-8d06-8b4dc13ca25c,671a8729-afed-428c-b81b-0dc36733afb8,,2024-11-06T00:00:00,,,FECHA OFICIO ENVIA CONVENIO
dfcee4d2-4f38-4635-85d2-ad4b35fac6f0,ac1e89c3-f3cf-4daf-b674-4cd8ff64a101,51a42c4b-ae0c-47cb-9b5b-df04c2f96343,1120,2023-10-25T00:00:00,,,Nº RES INCORPORA/ CERT CORE
4905d6d0-19d9-490d-b7de-9a86a0624b87,ac1e89c3-f3cf-4daf-b674-4cd8ff64a101,4e8a5aca-2be7-4abc-9ec9-4e16d0357942,1120,2023-10-25T00:00:00,,,Nº RES CREA ASIGNACIÓN
f2653edc-e3b9-4777-b800-9768ac74c4a9,ac1e89c3-f3cf-4daf-b674-4cd8ff64a101,8d80c2b8-875d-43a9-bb4e-117ed9aab422,42,2024-05-15T00:00:00,AFECTA,,Nº RES APRUEBA CONVENIO 
39205eaf-2520-48ad-94a6-76c1bf165e40,ac1e89c3-f3cf-4daf-b674-4cd8ff64a101,ef2a95fc-fe72-4284-85e5-15897c60881c,850,2024-07-06T00:00:00,,,Nº OFICIO ENVIA CONVENIO
d3c54bdb-64f5-41cf-b393-b375953fb713,ac1e89c3-f3cf-4daf-b674-4cd8ff64a101,0df1c4b6-ef93-4a00-a85a-acfafe36d421,06/06/2024,2024-06-06T00:00:00,,,FECHA TOMA DE RAZON DE CGR
c9ee04b7-2aa3-4fdd-89be-5b226f48f0b8,ac1e89c3-f3cf-4daf-b674-4cd8ff64a101,a2f5100f-2a50-4a51-a795-dde18abad7f9,1293/19.12.2023,,,1293/19.12.2023,Nº RES REFERENTE TECNICO
4ec98763-0eec-41fc-936c-ca425c3b2fe8,ac1e89c3-f3cf-4daf-b674-4cd8ff64a101,671a8729-afed-428c-b81b-0dc36733afb8,,2024-07-06T00:00:00,,,FECHA OFICIO ENVIA CONVENIO
2e05cb19-ffee-46b2-ad27-7ea8ee970e46,4db5246c-4ef6-422c-a176-3ff2f6da6870,51a42c4b-ae0c-47cb-9b5b-df04c2f96343,136,2024-03-22T00:00:00,,,Nº RES INCORPORA/ CERT CORE
b9738ed8-6c68-46e8-96d2-7842778b1d1a,4db5246c-4ef6-422c-a176-3ff2f6da6870,4e8a5aca-2be7-4abc-9ec9-4e16d0357942,136,2024-03-22T00:00:00,,,Nº RES CREA ASIGNACIÓN
f1b761e1-6976-49b3-ac97-5dac98f5aa7c,4db5246c-4ef6-422c-a176-3ff2f6da6870,8d80c2b8-875d-43a9-bb4e-117ed9aab422,44,2024-05-17T00:00:00,AFECTA,,Nº RES APRUEBA CONVENIO 
965f4f67-0f2d-4c97-b44f-b62e554bdf2e,4db5246c-4ef6-422c-a176-3ff2f6da6870,ef2a95fc-fe72-4284-85e5-15897c60881c,856,2024-11-06T00:00:00,,,Nº OFICIO ENVIA CONVENIO
b30c8f7d-144b-41e9-be5b-351891797b78,4db5246c-4ef6-422c-a176-3ff2f6da6870,0df1c4b6-ef93-4a00-a85a-acfafe36d421,06/06/2024,2024-06-06T00:00:00,,,FECHA TOMA DE RAZON DE CGR
ae32902f-7b7d-4250-a1b6-1def1b726190,4db5246c-4ef6-422c-a176-3ff2f6da6870,671a8729-afed-428c-b81b-0dc36733afb8,,2024-11-06T00:00:00,,,FECHA OFICIO ENVIA CONVENIO
3bc0f02c-7445-4823-ac98-2a43d10f2423,4880c622-e8f5-4aa5-8093-35cc44ce6a16,51a42c4b-ae0c-47cb-9b5b-df04c2f96343,143,2024-03-26T00:00:00,,,Nº RES INCORPORA/ CERT CORE
e2de3007-477f-4ac8-a887-b2fa8a466411,4880c622-e8f5-4aa5-8093-35cc44ce6a16,4e8a5aca-2be7-4abc-9ec9-4e16d0357942,19,2024-04-01T00:00:00,,,Nº RES CREA ASIGNACIÓN
33c8291f-8f6c-47b4-b7eb-ea5939d93c6f,4880c622-e8f5-4aa5-8093-35cc44ce6a16,8d80c2b8-875d-43a9-bb4e-117ed9aab422,48,2024-05-29T00:00:00,AFECTA,,Nº RES APRUEBA CONVENIO 
4f7a9543-2838-4f1e-821d-f04c8d9b9964,4880c622-e8f5-4aa5-8093-35cc44ce6a16,ef2a95fc-fe72-4284-85e5-15897c60881c,968,2024-01-07T00:00:00,,,Nº OFICIO ENVIA CONVENIO
2ac03b6f-d073-47dc-8010-ef2a36e2473c,4880c622-e8f5-4aa5-8093-35cc44ce6a16,0df1c4b6-ef93-4a00-a85a-acfafe36d421,18/06/2024,2024-06-18T00:00:00,,,FECHA TOMA DE RAZON DE CGR
f0f50114-0caa-43f6-9b65-afd23839a95d,4880c622-e8f5-4aa5-8093-35cc44ce6a16,671a8729-afed-428c-b81b-0dc36733afb8,,2024-01-07T00:00:00,,,FECHA OFICIO ENVIA CONVENIO
b6a58bcd-747c-46ec-ab0a-644735b9d019,19774114-027a-4f50-9a64-d3368492c244,51a42c4b-ae0c-47cb-9b5b-df04c2f96343,,,,,Nº RES INCORPORA/ CERT CORE
84c4770b-755c-4c46-9f22-e39fe8ce4fe2,19774114-027a-4f50-9a64-d3368492c244,4e8a5aca-2be7-4abc-9ec9-4e16d0357942,66,2023-05-26T00:00:00,,,Nº RES CREA ASIGNACIÓN
af7878d1-d426-4a20-9530-d427ef1fa1c2,19774114-027a-4f50-9a64-d3368492c244,8d80c2b8-875d-43a9-bb4e-117ed9aab422,49,2024-05-30T00:00:00,AFECTA,,Nº RES APRUEBA CONVENIO 
ffb66752-4398-45c1-b3a1-cf0c14f0407e,19774114-027a-4f50-9a64-d3368492c244,0df1c4b6-ef93-4a00-a85a-acfafe36d421,24-06-2024,2024-06-24T00:00:00,,,FECHA TOMA DE RAZON DE CGR
33c0222d-7ef8-4828-be8d-bbf5fb125fb1,19774114-027a-4f50-9a64-d3368492c244,a2f5100f-2a50-4a51-a795-dde18abad7f9,432/24.06.2024,,,432/24.06.2024,Nº RES REFERENTE TECNICO
4e7d7a45-aaf6-475f-ae27-dc7357b44d61,18801391-8b09-4f94-8c57-dd9d23e0d143,51a42c4b-ae0c-47cb-9b5b-df04c2f96343,362,2024-05-24T00:00:00,,,Nº RES INCORPORA/ CERT CORE
c0a557d1-bc60-46c5-8845-e967f0d8b26b,18801391-8b09-4f94-8c57-dd9d23e0d143,4e8a5aca-2be7-4abc-9ec9-4e16d0357942,362,2024-05-24T00:00:00,,,Nº RES CREA ASIGNACIÓN
c8f99cf9-be74-4960-a41a-bf5452631fac,18801391-8b09-4f94-8c57-dd9d23e0d143,8d80c2b8-875d-43a9-bb4e-117ed9aab422,51,2024-06-11T00:00:00,AFECTA,,Nº RES APRUEBA CONVENIO 
4bcb8521-9a9e-47a6-ae1c-7eb20e01f305,18801391-8b09-4f94-8c57-dd9d23e0d143,ef2a95fc-fe72-4284-85e5-15897c60881c,962,2024-06-28T00:00:00,,,Nº OFICIO ENVIA CONVENIO
b7f7f1b4-5b4d-4527-ab01-fb9a1b045ccd,18801391-8b09-4f94-8c57-dd9d23e0d143,0df1c4b6-ef93-4a00-a85a-acfafe36d421,26-06-2024,2024-06-26T00:00:00,,,FECHA TOMA DE RAZON DE CGR
a8692cb1-bb5e-420d-9139-c9ea422e4873,18801391-8b09-4f94-8c57-dd9d23e0d143,671a8729-afed-428c-b81b-0dc36733afb8,,2024-06-28T00:00:00,,,FECHA OFICIO ENVIA CONVENIO
d0958f7c-eac5-473a-bff6-27609c6bec9d,f0837684-5a15-4f47-9da7-c7490db695cd,51a42c4b-ae0c-47cb-9b5b-df04c2f96343,1070,2023-10-13T00:00:00,,,Nº RES INCORPORA/ CERT CORE
52f0667d-6a96-4239-9986-0c60e1b8d127,f0837684-5a15-4f47-9da7-c7490db695cd,4e8a5aca-2be7-4abc-9ec9-4e16d0357942,1070,2023-10-13T00:00:00,,,Nº RES CREA ASIGNACIÓN
da0836a9-e506-4f51-8edf-02ec2822857d,f0837684-5a15-4f47-9da7-c7490db695cd,8d80c2b8-875d-43a9-bb4e-117ed9aab422,52,2024-06-11T00:00:00,AFECTA,,Nº RES APRUEBA CONVENIO 
6b625067-a58d-441d-9c42-908ddc53f58b,f0837684-5a15-4f47-9da7-c7490db695cd,ef2a95fc-fe72-4284-85e5-15897c60881c,953,2024-06-27T00:00:00,,,Nº OFICIO ENVIA CONVENIO
9d8713df-6125-42ec-9ae4-531faa798047,f0837684-5a15-4f47-9da7-c7490db695cd,0df1c4b6-ef93-4a00-a85a-acfafe36d421,26-06-2024,2024-06-26T00:00:00,,,FECHA TOMA DE RAZON DE CGR
7e9d009f-d88d-40e5-82b6-72c044aec64f,f0837684-5a15-4f47-9da7-c7490db695cd,671a8729-afed-428c-b81b-0dc36733afb8,,2024-06-27T00:00:00,,,FECHA OFICIO ENVIA CONVENIO
0bf17172-bf42-4da0-9222-5103c412cd63,78cca406-58f2-4e88-9254-76c160d55a09,51a42c4b-ae0c-47cb-9b5b-df04c2f96343,136,2024-03-22T00:00:00,,,Nº RES INCORPORA/ CERT CORE
f15ce130-56a3-47df-a2ac-5334a312cdc2,78cca406-58f2-4e88-9254-76c160d55a09,4e8a5aca-2be7-4abc-9ec9-4e16d0357942,136,2024-03-22T00:00:00,,,Nº RES CREA ASIGNACIÓN
f4b6f35c-0293-4828-9228-842fabaf5417,78cca406-58f2-4e88-9254-76c160d55a09,8d80c2b8-875d-43a9-bb4e-117ed9aab422,53,2024-05-17T00:00:00,AFECTA,,Nº RES APRUEBA CONVENIO 
8cc97512-be69-40b1-8e6c-9c54368e250b,78cca406-58f2-4e88-9254-76c160d55a09,ef2a95fc-fe72-4284-85e5-15897c60881c,1047,,,7/17/2024,Nº OFICIO ENVIA CONVENIO
c37a1a5e-477b-4b2d-bbcd-3c4edad75088,78cca406-58f2-4e88-9254-76c160d55a09,0df1c4b6-ef93-4a00-a85a-acfafe36d421,12/07/2024,2024-07-12T00:00:00,,,FECHA TOMA DE RAZON DE CGR
f76315d5-4e43-4e0f-a024-d9ffe9ab21e8,78cca406-58f2-4e88-9254-76c160d55a09,671a8729-afed-428c-b81b-0dc36733afb8,,,,7/17/2024,FECHA OFICIO ENVIA CONVENIO
311c16dd-d305-4861-b718-def8016397b6,c90dfd70-953e-4a0a-ae3a-70641b59f0c6,51a42c4b-ae0c-47cb-9b5b-df04c2f96343,911,2023-08-22T00:00:00,,,Nº RES INCORPORA/ CERT CORE
b49fd58e-9938-4b79-8040-ccad43c122d5,c90dfd70-953e-4a0a-ae3a-70641b59f0c6,4e8a5aca-2be7-4abc-9ec9-4e16d0357942,911,2023-08-22T00:00:00,,,Nº RES CREA ASIGNACIÓN
a60a2962-62ad-44fa-b0e5-19665a8fe3c1,c90dfd70-953e-4a0a-ae3a-70641b59f0c6,8d80c2b8-875d-43a9-bb4e-117ed9aab422,967,2023-09-05T00:00:00,EXENTA,,Nº RES APRUEBA CONVENIO 
e9eec500-07ed-494f-a432-5999cad5a976,c90dfd70-953e-4a0a-ae3a-70641b59f0c6,0df1c4b6-ef93-4a00-a85a-acfafe36d421,,,,,FECHA TOMA DE RAZON DE CGR
43b1f899-ae6e-4aea-8124-04a4c64a3077,c90dfd70-953e-4a0a-ae3a-70641b59f0c6,a2f5100f-2a50-4a51-a795-dde18abad7f9,1291/19.12.2023,,,1291/19.12.2023,Nº RES REFERENTE TECNICO
8b74d125-7037-4322-96fb-edb46c5eff4e,f428133c-4cc4-467f-a84c-614859fe2517,51a42c4b-ae0c-47cb-9b5b-df04c2f96343,911,2023-08-22T00:00:00,,,Nº RES INCORPORA/ CERT CORE
d1a43ddb-9ce5-4d5a-a158-b3c764a36ae6,f428133c-4cc4-467f-a84c-614859fe2517,4e8a5aca-2be7-4abc-9ec9-4e16d0357942,911,2023-08-22T00:00:00,,,Nº RES CREA ASIGNACIÓN
bd4d57aa-ea93-433d-8746-43a58f629a54,f428133c-4cc4-467f-a84c-614859fe2517,8d80c2b8-875d-43a9-bb4e-117ed9aab422,1353,2023-12-28T00:00:00,EXENTA,,Nº RES APRUEBA CONVENIO 
ed6ae264-989d-46b7-b800-39c8d9fbec2a,f428133c-4cc4-467f-a84c-614859fe2517,0df1c4b6-ef93-4a00-a85a-acfafe36d421,,,,,FECHA TOMA DE RAZON DE CGR
09f13fb4-b2ec-40ca-a6b8-4b2879123e70,f428133c-4cc4-467f-a84c-614859fe2517,a2f5100f-2a50-4a51-a795-dde18abad7f9,1291/19.12.2023,,,1291/19.12.2023,Nº RES REFERENTE TECNICO
b461a900-6a7f-460b-9250-9b7bf31c626a,b696c722-ee16-4fef-9b96-95de934043cc,51a42c4b-ae0c-47cb-9b5b-df04c2f96343,911,2023-08-22T00:00:00,,,Nº RES INCORPORA/ CERT CORE
c92b4c99-1d17-4961-b7df-1ee127b5a651,b696c722-ee16-4fef-9b96-95de934043cc,4e8a5aca-2be7-4abc-9ec9-4e16d0357942,911,2023-08-22T00:00:00,,,Nº RES CREA ASIGNACIÓN
8164f264-5725-442e-844a-349068c74778,b696c722-ee16-4fef-9b96-95de934043cc,8d80c2b8-875d-43a9-bb4e-117ed9aab422,946,2023-09-01T00:00:00,EXENTA,,Nº RES APRUEBA CONVENIO 
b4571ccf-daff-4cca-b764-2637cc954b9a,b696c722-ee16-4fef-9b96-95de934043cc,0df1c4b6-ef93-4a00-a85a-acfafe36d421,,,,,FECHA TOMA DE RAZON DE CGR
8a4329ab-3fce-42f4-92a2-43789d41cf89,b696c722-ee16-4fef-9b96-95de934043cc,a2f5100f-2a50-4a51-a795-dde18abad7f9,279/02.05.2024,,,279/02.05.2024,Nº RES REFERENTE TECNICO
19b61315-c0fd-4e9a-ade3-a52c2e26d7f4,fbbe3da5-b829-44fb-9b63-37116875da0b,51a42c4b-ae0c-47cb-9b5b-df04c2f96343,911,2023-08-22T00:00:00,,,Nº RES INCORPORA/ CERT CORE
74668e51-3b12-4328-a02d-6a1aaa4e9703,fbbe3da5-b829-44fb-9b63-37116875da0b,4e8a5aca-2be7-4abc-9ec9-4e16d0357942,911,2023-08-22T00:00:00,,,Nº RES CREA ASIGNACIÓN
c5c71ec2-2be1-4525-a412-8329150acc94,fbbe3da5-b829-44fb-9b63-37116875da0b,8d80c2b8-875d-43a9-bb4e-117ed9aab422,944,2023-09-01T00:00:00,EXENTA,,Nº RES APRUEBA CONVENIO 
86568aee-8bed-43fe-b497-017ffd3c4726,fbbe3da5-b829-44fb-9b63-37116875da0b,0df1c4b6-ef93-4a00-a85a-acfafe36d421,,,,,FECHA TOMA DE RAZON DE CGR
9e8f168e-0b0f-4ea6-9537-4c1f360ad93c,fbbe3da5-b829-44fb-9b63-37116875da0b,a2f5100f-2a50-4a51-a795-dde18abad7f9,1291/19.12.2023,,,1291/19.12.2023,Nº RES REFERENTE TECNICO
d8fba1b4-c1a3-490d-ba3a-926e42586dbc,c2a834c5-93ee-49a1-b05f-fd50eb3a6f1f,51a42c4b-ae0c-47cb-9b5b-df04c2f96343,914,2023-08-22T00:00:00,,,Nº RES INCORPORA/ CERT CORE
58adaabc-51cf-4295-ab4f-589760b4b11b,c2a834c5-93ee-49a1-b05f-fd50eb3a6f1f,4e8a5aca-2be7-4abc-9ec9-4e16d0357942,914,2023-08-22T00:00:00,,,Nº RES CREA ASIGNACIÓN
0d997d58-dafe-4bfc-a1a9-1bc6392193f1,c2a834c5-93ee-49a1-b05f-fd50eb3a6f1f,8d80c2b8-875d-43a9-bb4e-117ed9aab422,1139,2023-10-31T00:00:00,EXENTA,,Nº RES APRUEBA CONVENIO 
ff2ae022-9a49-4cac-bd2d-628e8b4a97f6,c2a834c5-93ee-49a1-b05f-fd50eb3a6f1f,0df1c4b6-ef93-4a00-a85a-acfafe36d421,,,,,FECHA TOMA DE RAZON DE CGR
69039a34-007c-40cd-9011-fc7f9ed01125,c2a834c5-93ee-49a1-b05f-fd50eb3a6f1f,a2f5100f-2a50-4a51-a795-dde18abad7f9,1291/19.12.2023,,,1291/19.12.2023,Nº RES REFERENTE TECNICO
d02f321f-62ed-4760-858c-3db0d6b65dbb,4abce010-abb2-48ae-8105-a497b8c67f9a,51a42c4b-ae0c-47cb-9b5b-df04c2f96343,914,2023-08-22T00:00:00,,,Nº RES INCORPORA/ CERT CORE
5bdf48f0-9e55-4550-bfbb-67fe6a3b3f9b,4abce010-abb2-48ae-8105-a497b8c67f9a,4e8a5aca-2be7-4abc-9ec9-4e16d0357942,914,2023-08-22T00:00:00,,,Nº RES CREA ASIGNACIÓN
84d27907-5d78-4d73-84c2-61059b3b0dff,4abce010-abb2-48ae-8105-a497b8c67f9a,8d80c2b8-875d-43a9-bb4e-117ed9aab422,943,2023-09-01T00:00:00,EXENTA,,Nº RES APRUEBA CONVENIO 
ba17e8e0-6d66-4da6-b0c7-5bc18851ba34,4abce010-abb2-48ae-8105-a497b8c67f9a,0df1c4b6-ef93-4a00-a85a-acfafe36d421,,,,,FECHA TOMA DE RAZON DE CGR
f104b24e-fddb-4a23-b32a-462346c518e5,4abce010-abb2-48ae-8105-a497b8c67f9a,a2f5100f-2a50-4a51-a795-dde18abad7f9,279/02.05.2024,,,279/02.05.2024,Nº RES REFERENTE TECNICO
32e46443-f3c4-4862-8c44-a990b45a50ec,e7153c9b-cf9c-4fa3-9ce5-cef49985dc1e,51a42c4b-ae0c-47cb-9b5b-df04c2f96343,914,2023-08-22T00:00:00,,,Nº RES INCORPORA/ CERT CORE
0ec48f99-64b0-4a01-8c36-5819fa169f49,e7153c9b-cf9c-4fa3-9ce5-cef49985dc1e,4e8a5aca-2be7-4abc-9ec9-4e16d0357942,914,2023-08-22T00:00:00,,,Nº RES CREA ASIGNACIÓN
f42c9bca-860d-460f-8b77-a242f653c90f,e7153c9b-cf9c-4fa3-9ce5-cef49985dc1e,8d80c2b8-875d-43a9-bb4e-117ed9aab422,945,2023-09-01T00:00:00,EXENTA,,Nº RES APRUEBA CONVENIO 
b2ae7492-9977-4631-9e02-f19553b37a62,e7153c9b-cf9c-4fa3-9ce5-cef49985dc1e,0df1c4b6-ef93-4a00-a85a-acfafe36d421,,,,,FECHA TOMA DE RAZON DE CGR
6b327923-3f3d-49e0-a603-ef5497ba39a4,e7153c9b-cf9c-4fa3-9ce5-cef49985dc1e,a2f5100f-2a50-4a51-a795-dde18abad7f9,1291/19.12.2023,,,1291/19.12.2023,Nº RES REFERENTE TECNICO
67712ecb-2371-4987-8345-9c74a62e64d4,22a2c7a2-6eb2-44ba-b3bc-648240b62f0b,51a42c4b-ae0c-47cb-9b5b-df04c2f96343,914,2023-08-22T00:00:00,,,Nº RES INCORPORA/ CERT CORE
699d78a8-56cf-4921-af93-5fc41fb9253f,22a2c7a2-6eb2-44ba-b3bc-648240b62f0b,4e8a5aca-2be7-4abc-9ec9-4e16d0357942,914,2023-08-22T00:00:00,,,Nº RES CREA ASIGNACIÓN
0e696dad-a095-49fe-b9ae-28896fb7b2f1,22a2c7a2-6eb2-44ba-b3bc-648240b62f0b,8d80c2b8-875d-43a9-bb4e-117ed9aab422,1062,2023-10-13T00:00:00,EXENTA,,Nº RES APRUEBA CONVENIO 
4366e5db-649e-445b-b5bd-39e89669a50a,22a2c7a2-6eb2-44ba-b3bc-648240b62f0b,0df1c4b6-ef93-4a00-a85a-acfafe36d421,,,,,FECHA TOMA DE RAZON DE CGR
b1eb6cf4-1c4c-497a-8d28-3abe965356f8,22a2c7a2-6eb2-44ba-b3bc-648240b62f0b,a2f5100f-2a50-4a51-a795-dde18abad7f9,1291/19.12.2023,,,1291/19.12.2023,Nº RES REFERENTE TECNICO
324546b4-5d97-4f31-b735-e1bf441f6f22,da5163c5-c2af-42d3-91d9-554c93c10409,51a42c4b-ae0c-47cb-9b5b-df04c2f96343,143,2024-03-26T00:00:00,,,Nº RES INCORPORA/ CERT CORE
a3c63d8b-a746-4aac-8eda-954b0614ee97,da5163c5-c2af-42d3-91d9-554c93c10409,4e8a5aca-2be7-4abc-9ec9-4e16d0357942,19,2024-04-01T00:00:00,,,Nº RES CREA ASIGNACIÓN
e88f9cd3-f6da-4680-b364-963fccbc69fd,da5163c5-c2af-42d3-91d9-554c93c10409,8d80c2b8-875d-43a9-bb4e-117ed9aab422,54,2024-06-14T00:00:00,AFECTA,,Nº RES APRUEBA CONVENIO 
c7410f8c-2733-43b0-b1bc-689fb1fa4ec9,da5163c5-c2af-42d3-91d9-554c93c10409,ef2a95fc-fe72-4284-85e5-15897c60881c,1007,2024-07-08T00:00:00,,,Nº OFICIO ENVIA CONVENIO
bfa3ceaa-fd7d-4539-ad8a-29d123fbdb84,da5163c5-c2af-42d3-91d9-554c93c10409,0df1c4b6-ef93-4a00-a85a-acfafe36d421,03/07/2024,2024-07-03T00:00:00,,,FECHA TOMA DE RAZON DE CGR
7ad371ec-f2df-498a-9ff8-4db3cf8e7786,da5163c5-c2af-42d3-91d9-554c93c10409,671a8729-afed-428c-b81b-0dc36733afb8,,2024-07-08T00:00:00,,,FECHA OFICIO ENVIA CONVENIO
8061d79f-ff21-4a92-a529-2322e10c5a62,c9aecddc-d7fc-44de-9d8c-5e4f5c6d87f9,51a42c4b-ae0c-47cb-9b5b-df04c2f96343,136,2024-03-22T00:00:00,,,Nº RES INCORPORA/ CERT CORE
af90313d-459f-42cd-9be5-9d088952c0d2,c9aecddc-d7fc-44de-9d8c-5e4f5c6d87f9,4e8a5aca-2be7-4abc-9ec9-4e16d0357942,136,2024-03-22T00:00:00,,,Nº RES CREA ASIGNACIÓN
908c5db2-73ce-472d-84a7-a44e1d3a6d9d,c9aecddc-d7fc-44de-9d8c-5e4f5c6d87f9,8d80c2b8-875d-43a9-bb4e-117ed9aab422,55,2024-06-14T00:00:00,AFECTA,,Nº RES APRUEBA CONVENIO 
e1088c07-0b38-4d59-b4ac-6733d0ab1483,c9aecddc-d7fc-44de-9d8c-5e4f5c6d87f9,ef2a95fc-fe72-4284-85e5-15897c60881c,1046,,,7/17/2024,Nº OFICIO ENVIA CONVENIO
98714901-ee5b-4356-9dae-8a14f24841c5,c9aecddc-d7fc-44de-9d8c-5e4f5c6d87f9,0df1c4b6-ef93-4a00-a85a-acfafe36d421,12/07/2024,2024-07-12T00:00:00,,,FECHA TOMA DE RAZON DE CGR
0a976eec-b389-4826-b378-72a397e00e2a,c9aecddc-d7fc-44de-9d8c-5e4f5c6d87f9,671a8729-afed-428c-b81b-0dc36733afb8,,,,7/17/2024,FECHA OFICIO ENVIA CONVENIO
a9f967ef-6238-4c4c-8153-7bfca7489089,08093042-c12e-4dee-8db1-c39d921f6f1d,4e8a5aca-2be7-4abc-9ec9-4e16d0357942,5,2024-02-13T00:00:00,,,Nº RES CREA ASIGNACIÓN
8bae642b-b005-4ef7-8aba-052cda14d120,08093042-c12e-4dee-8db1-c39d921f6f1d,8d80c2b8-875d-43a9-bb4e-117ed9aab422,56,2024-06-14T00:00:00,AFECTA,,Nº RES APRUEBA CONVENIO 
9f221097-9463-4f5f-bf87-2b04bd96425e,08093042-c12e-4dee-8db1-c39d921f6f1d,0df1c4b6-ef93-4a00-a85a-acfafe36d421,12-07-2024,2024-07-12T00:00:00,,,FECHA TOMA DE RAZON DE CGR
d1aace27-7286-4196-a982-67233bd737a2,ac88750b-a1e7-4669-9182-22c5b715c292,51a42c4b-ae0c-47cb-9b5b-df04c2f96343,404,2024-06-05T00:00:00,,,Nº RES INCORPORA/ CERT CORE
3e6e19bc-5b48-42d3-9fb5-15bd7818e2f9,ac88750b-a1e7-4669-9182-22c5b715c292,4e8a5aca-2be7-4abc-9ec9-4e16d0357942,6,2024-02-13T00:00:00,,,Nº RES CREA ASIGNACIÓN
9ea4a076-2cfc-4343-bbc6-b0af15ac40ae,ac88750b-a1e7-4669-9182-22c5b715c292,8d80c2b8-875d-43a9-bb4e-117ed9aab422,57,2024-06-14T00:00:00,AFECTA,,Nº RES APRUEBA CONVENIO 
9182ae42-a6c0-473d-bd90-a469398e2bff,ac88750b-a1e7-4669-9182-22c5b715c292,ef2a95fc-fe72-4284-85e5-15897c60881c,696,2024-07-01T00:00:00,,,Nº OFICIO ENVIA CONVENIO
1a4d68f8-4160-4473-9e72-82d11a3d6ea9,ac88750b-a1e7-4669-9182-22c5b715c292,0df1c4b6-ef93-4a00-a85a-acfafe36d421,28/06/2024,2024-06-28T00:00:00,,,FECHA TOMA DE RAZON DE CGR
32f79eb7-4d9c-44ed-8546-44e2d1fae735,ac88750b-a1e7-4669-9182-22c5b715c292,671a8729-afed-428c-b81b-0dc36733afb8,,2024-07-01T00:00:00,,,FECHA OFICIO ENVIA CONVENIO
e4660463-b5e9-46ca-a46d-8a108f2d7523,41616dcf-a5cb-44ad-af32-790e4d489b38,51a42c4b-ae0c-47cb-9b5b-df04c2f96343,766/2023,2023-10-05T00:00:00,,,Nº RES INCORPORA/ CERT CORE
220ee981-d5f6-4870-816f-755473e06d16,41616dcf-a5cb-44ad-af32-790e4d489b38,4e8a5aca-2be7-4abc-9ec9-4e16d0357942,6,2024-02-13T00:00:00,,,Nº RES CREA ASIGNACIÓN
997469e1-90d9-4689-b4eb-a677d89fe4f7,41616dcf-a5cb-44ad-af32-790e4d489b38,8d80c2b8-875d-43a9-bb4e-117ed9aab422,58,2024-06-18T00:00:00,AFECTA,,Nº RES APRUEBA CONVENIO 
cd6f285e-8eda-419a-8115-36be6ca19146,41616dcf-a5cb-44ad-af32-790e4d489b38,ef2a95fc-fe72-4284-85e5-15897c60881c,1008,2024-07-08T00:00:00,,,Nº OFICIO ENVIA CONVENIO
605f4cfa-4784-467e-9884-12d44fc03200,41616dcf-a5cb-44ad-af32-790e4d489b38,0df1c4b6-ef93-4a00-a85a-acfafe36d421,03/07/2024,2024-07-03T00:00:00,,,FECHA TOMA DE RAZON DE CGR
a2fa308a-c72e-45c7-8974-b7fb77a80512,41616dcf-a5cb-44ad-af32-790e4d489b38,671a8729-afed-428c-b81b-0dc36733afb8,,2024-07-08T00:00:00,,,FECHA OFICIO ENVIA CONVENIO
419e49b0-1618-420d-a0db-a42769f8ae9e,15d07c77-0e75-471d-b4d1-a625e3198d2c,51a42c4b-ae0c-47cb-9b5b-df04c2f96343,837/2023,2023-12-21T00:00:00,,,Nº RES INCORPORA/ CERT CORE
bc5e8c47-c4e5-45c3-a755-ded064487d4d,15d07c77-0e75-471d-b4d1-a625e3198d2c,4e8a5aca-2be7-4abc-9ec9-4e16d0357942,6,2024-02-13T00:00:00,,,Nº RES CREA ASIGNACIÓN
65df6578-1847-4dea-b9d2-52344d9ae1e4,15d07c77-0e75-471d-b4d1-a625e3198d2c,8d80c2b8-875d-43a9-bb4e-117ed9aab422,59,2024-06-18T00:00:00,AFECTA,,Nº RES APRUEBA CONVENIO 
bf10e200-f8f0-46e6-90cd-5eab97bda17b,15d07c77-0e75-471d-b4d1-a625e3198d2c,0df1c4b6-ef93-4a00-a85a-acfafe36d421,12/07/2024,2024-07-12T00:00:00,,,FECHA TOMA DE RAZON DE CGR
578980b3-1cca-4d5e-955f-c194b13c6b49,786d9d61-41b1-4343-b9e7-6b40687297f2,51a42c4b-ae0c-47cb-9b5b-df04c2f96343,856/2024,2024-01-18T00:00:00,,,Nº RES INCORPORA/ CERT CORE
5545e174-76b0-4c18-9d54-7caaf408e329,786d9d61-41b1-4343-b9e7-6b40687297f2,4e8a5aca-2be7-4abc-9ec9-4e16d0357942,6,2024-02-13T00:00:00,,,Nº RES CREA ASIGNACIÓN
8221f442-66d7-4b6f-bf70-0d46843dcfa4,786d9d61-41b1-4343-b9e7-6b40687297f2,8d80c2b8-875d-43a9-bb4e-117ed9aab422,60,2024-06-18T00:00:00,AFECTA,,Nº RES APRUEBA CONVENIO 
d42ffe11-444a-4638-9b0c-7b72813c393e,4274f09d-933a-4f64-bb90-ef76e66d0418,51a42c4b-ae0c-47cb-9b5b-df04c2f96343,964,2023-09-05T00:00:00,,,Nº RES INCORPORA/ CERT CORE
ae7d80d7-641f-49ee-8f1c-a1938e6281d4,4274f09d-933a-4f64-bb90-ef76e66d0418,4e8a5aca-2be7-4abc-9ec9-4e16d0357942,964,2023-09-05T00:00:00,,,Nº RES CREA ASIGNACIÓN
e5c77bd5-7f22-419a-b7d8-f8a1b92a747a,4274f09d-933a-4f64-bb90-ef76e66d0418,8d80c2b8-875d-43a9-bb4e-117ed9aab422,1137,2023-10-31T00:00:00,EXENTA,,Nº RES APRUEBA CONVENIO 
244fbfd7-9546-46d3-a5ad-84f7ba6837e4,4274f09d-933a-4f64-bb90-ef76e66d0418,0df1c4b6-ef93-4a00-a85a-acfafe36d421,,,,,FECHA TOMA DE RAZON DE CGR
1812bd49-13c1-47c1-9586-01ecf4ae6710,4274f09d-933a-4f64-bb90-ef76e66d0418,a2f5100f-2a50-4a51-a795-dde18abad7f9,279/02.05.2024,,,279/02.05.2024,Nº RES REFERENTE TECNICO
65249af2-b0a5-4e88-8492-0704def0eace,665150ea-1ac3-4bcf-a3ab-292344fd0f0b,51a42c4b-ae0c-47cb-9b5b-df04c2f96343,964,2023-09-05T00:00:00,,,Nº RES INCORPORA/ CERT CORE
bf529ac8-8194-45f4-9351-7f502d7a56b7,665150ea-1ac3-4bcf-a3ab-292344fd0f0b,4e8a5aca-2be7-4abc-9ec9-4e16d0357942,964,2023-09-05T00:00:00,,,Nº RES CREA ASIGNACIÓN
556980e6-8d78-456f-9b6a-85f20c1f76e1,665150ea-1ac3-4bcf-a3ab-292344fd0f0b,8d80c2b8-875d-43a9-bb4e-117ed9aab422,1328,2023-12-22T00:00:00,EXENTA,,Nº RES APRUEBA CONVENIO 
ef2ff57e-6061-4fbc-bb40-1966f6e76656,665150ea-1ac3-4bcf-a3ab-292344fd0f0b,0df1c4b6-ef93-4a00-a85a-acfafe36d421,,,,,FECHA TOMA DE RAZON DE CGR
3a80c7e3-ecea-4587-b197-3eab26e3647c,665150ea-1ac3-4bcf-a3ab-292344fd0f0b,a2f5100f-2a50-4a51-a795-dde18abad7f9,1291/19.12.2023,,,1291/19.12.2023,Nº RES REFERENTE TECNICO
ac31a998-9e19-4b2b-b560-31151f5c7f6e,75e46274-3256-4d1b-b748-d4a98a7bba40,51a42c4b-ae0c-47cb-9b5b-df04c2f96343,964,2023-09-05T00:00:00,,,Nº RES INCORPORA/ CERT CORE
a4603892-6b1d-4c2a-b290-9550995fddb7,75e46274-3256-4d1b-b748-d4a98a7bba40,4e8a5aca-2be7-4abc-9ec9-4e16d0357942,964,2023-09-05T00:00:00,,,Nº RES CREA ASIGNACIÓN
5e5cc053-5d66-4235-80cf-b7ff90e56ecd,75e46274-3256-4d1b-b748-d4a98a7bba40,8d80c2b8-875d-43a9-bb4e-117ed9aab422,1323,2023-12-22T00:00:00,EXENTA,,Nº RES APRUEBA CONVENIO 
a3466118-749f-4b06-afad-904c735eb2cf,75e46274-3256-4d1b-b748-d4a98a7bba40,0df1c4b6-ef93-4a00-a85a-acfafe36d421,,,,,FECHA TOMA DE RAZON DE CGR
98da07eb-bc07-4369-a178-0da616ee90d8,75e46274-3256-4d1b-b748-d4a98a7bba40,a2f5100f-2a50-4a51-a795-dde18abad7f9,1291/19.12.2023,,,1291/19.12.2023,Nº RES REFERENTE TECNICO
9573075c-5949-40e4-92f0-3b4314770eab,40771e71-6410-4b3a-9c2d-3a66f5a546a7,51a42c4b-ae0c-47cb-9b5b-df04c2f96343,87/2020,2020-04-13T00:00:00,,,Nº RES INCORPORA/ CERT CORE
2537cb26-9ce3-4aa4-aa63-013a3a5489ea,40771e71-6410-4b3a-9c2d-3a66f5a546a7,4e8a5aca-2be7-4abc-9ec9-4e16d0357942,145,2023-02-06T00:00:00,,,Nº RES CREA ASIGNACIÓN
de97e0e1-8c3f-4d06-99f3-f5aaaf1f4fbf,40771e71-6410-4b3a-9c2d-3a66f5a546a7,8d80c2b8-875d-43a9-bb4e-117ed9aab422,62,2024-06-24T00:00:00,AFECTA,,Nº RES APRUEBA CONVENIO 
73c7ab1f-9e0f-4d4f-9daf-e99373d2e359,40771e71-6410-4b3a-9c2d-3a66f5a546a7,ef2a95fc-fe72-4284-85e5-15897c60881c,1046,,,7/17/2024,Nº OFICIO ENVIA CONVENIO
fd8664de-9b37-4943-83a0-ad22b643878a,40771e71-6410-4b3a-9c2d-3a66f5a546a7,0df1c4b6-ef93-4a00-a85a-acfafe36d421,12/07/2024,2024-07-12T00:00:00,,,FECHA TOMA DE RAZON DE CGR
1df72b66-bbd1-4521-8025-908ccfa14b78,40771e71-6410-4b3a-9c2d-3a66f5a546a7,671a8729-afed-428c-b81b-0dc36733afb8,,,,7/17/2024,FECHA OFICIO ENVIA CONVENIO
bb22ffc3-ac39-4dad-9ad7-b0ac4212764a,420f5c90-6570-4a6a-a939-75574e8dc153,51a42c4b-ae0c-47cb-9b5b-df04c2f96343,769/2023,2023-10-05T00:00:00,,,Nº RES INCORPORA/ CERT CORE
a9289e2a-783f-45da-8829-7fd185fda4ed,420f5c90-6570-4a6a-a939-75574e8dc153,4e8a5aca-2be7-4abc-9ec9-4e16d0357942,6,2024-02-13T00:00:00,,,Nº RES CREA ASIGNACIÓN
14fdd885-9174-4480-ba1f-dc580c7d051a,420f5c90-6570-4a6a-a939-75574e8dc153,8d80c2b8-875d-43a9-bb4e-117ed9aab422,63,2024-06-24T00:00:00,AFECTA,,Nº RES APRUEBA CONVENIO 
19235b6a-cac1-4707-9518-af56323c8aef,420f5c90-6570-4a6a-a939-75574e8dc153,ef2a95fc-fe72-4284-85e5-15897c60881c,1067,,,7/22/2024,Nº OFICIO ENVIA CONVENIO
8399e21f-bab8-4b0f-8d6e-5fb52cc137a5,420f5c90-6570-4a6a-a939-75574e8dc153,0df1c4b6-ef93-4a00-a85a-acfafe36d421,19/07/2024,2024-07-19T00:00:00,,,FECHA TOMA DE RAZON DE CGR
d1d24a29-81dc-48ed-a56d-3afc0793e817,420f5c90-6570-4a6a-a939-75574e8dc153,671a8729-afed-428c-b81b-0dc36733afb8,,,,7/22/2024,FECHA OFICIO ENVIA CONVENIO
c8d046ef-b284-44a3-ac07-81677ca84543,6ca8092f-4b70-4152-842a-34f344dc8e69,51a42c4b-ae0c-47cb-9b5b-df04c2f96343,420,2024-06-18T00:00:00,,,Nº RES INCORPORA/ CERT CORE
4fc04289-4426-42e1-bcec-8a3167f62cb3,6ca8092f-4b70-4152-842a-34f344dc8e69,4e8a5aca-2be7-4abc-9ec9-4e16d0357942,420,2024-06-18T00:00:00,,,Nº RES CREA ASIGNACIÓN
235011c1-e73d-40ed-affe-c7917c645360,6ca8092f-4b70-4152-842a-34f344dc8e69,8d80c2b8-875d-43a9-bb4e-117ed9aab422,65,2024-06-28T00:00:00,AFECTA,,Nº RES APRUEBA CONVENIO 
6a4d1996-03fe-49db-9786-428361038639,6ca8092f-4b70-4152-842a-34f344dc8e69,ef2a95fc-fe72-4284-85e5-15897c60881c,1165,2024-08-06T00:00:00,,,Nº OFICIO ENVIA CONVENIO
