NUMERO DOCUMENTO,SOLICITA,FECHA DCTO,FECHA RECEPCIÓN,FECHA ENTREGA,REMITENTE,DESTINATARIO,MATERIA,DISTRIBUCIÓN,DERIVADO A: (DIVISIÓN),LINK AL DOCUMENTO
,,,,,,,,,,
00004,mel,22-10-2024,22-10-2024,22-10-2024,ALICIA DEL CARMEN CONTRERAS VIELMA,"SUBSECRETARÍA DE CIENCIA, TECNOLOGÍA, CONOCIMIENTO E INNOVACIÓN. MINISTERIO DE CIENCIA TECNOLOGÍA CONOCIMIENTO E INNOVACIÓN",CARTA DE APOYO E INTERES,EMAIL ,,https://drive.google.com/file/d/1wE6SwdgXa3EDuaX1TEsiexX-Gzr2uNkZ/view?usp=drive_link
00003,dtb,21-10-2024,21-10-2024,22-10-2024,ALICIA DEL CARMEN CONTRERAS VIELMA,SEÑOR LUIS MARCELO CARVAJAL HERRERA,"RESPUETA A: CARTA PRESENTADA POR USTED EL 10 DE SEPTIEMBRE DE 2024, EN LA QUE RELATA HECHOS DE DETENCION IRREGULAR.",CARTA CERTIFICADA,,https://drive.google.com/file/d/19eO3-cvevX0-6UaMXHhwrTQzYPtuAFiK/view?usp=drive_link
00002,eja,01-10-2024,01-10-2024,01-10-2024,ALICIA DEL CARMEN CONTRERAS VIELMA,SRES. BANCO ITAU CHILE,PLAZO DE VENCIMIENTO DE LA BOLETA DE GARANTÍA,EMAIL ,,https://drive.google.com/file/d/1JlvDcU95xyU_GZ0XRYMW1e1fNO6K-9Kb/view?usp=drive_link
00001,mel,11-09-2024,11-09-2024,11-09-2024,OSCAR CRISOSTOMO LLANOS GOBERNADOR REGIONAL DE ÑUBLE ,SUBDIRECCION DE INVESTIGACION APLICADA,CARTA DE COMPROMISO ENTIDAD ASOCIADA SRA. JULIA FAWAZ.,EMAIL ,,https://drive.google.com/file/d/1wqrdNr6iM39_e3EwO45wcVFVk0aa9uRR/view?usp=drive_link
2,smf,10-09-2024,10-09-2024,10-09-2024,SUSANA MOLINA FUENTES PRESIDENTE ASOCIACION,ADMINISTRADORA REGIONAL DE ÑUBLE ,CARTA ADMINISTRADORA SOLICITA CREACIÓN SERVICIO BIENESTAR GORE ÑUBLE 10.09.2024,DOC DIGITAL ,ADM ,https://drive.google.com/file/d/1PBmbDYT8KBtmxVHCkx8BLb4FZr_2OYmj/view?usp=drive_link