id,nombre_original,nombre_normalizado,nombre_nlp,rut,fuente_original,tipo_institucion
59c733e1-62d3-4540-9957-e9948369876e,CLUB DE ADULTOS MAYORES NUEVO DESPERTAR,CLUB DE ADULTOS MAYORES NUEVO DESPERTAR,CLUB ADULTOS MAYORES NUEVO DESPERTAR,65.338.720-2,PROGS,OSC
3e78019f-b207-440c-be73-0adbc8854108,CLUB ADULTO MAYOR SAN FRANCISCO DE ASIS,CLUB ADULTO MAYOR SAN FRANCISCO DE ASIS,CLUB SAN FRANCISCO ASIS,65.514.200-2,PROGS,OSC
3553e861-8d03-4a05-a1e7-e2f01a88ed4e,CLUD ADULTO MAYOR MARÍA EUGENIA - HUAPE,CLUD ADULTO MAYOR MARÍA EUGENIA - HUAPE,CLUD MARÍA EUGENIA HUAPE,65.883.500-9,PROGS,OTROS
6cd1af4b-4f7f-487e-adc0-894336f9156a,CLUB DE ADULTO MAYOR RENOVANDO JUVENTUD,CLUB DE ADULTO MAYOR RENOVANDO JUVENTUD,CLUB RENOVANDO JUVENTUD,65.063.072-6,PROGS,OSC
11c70ad8-9723-4406-a63c-a12a3955acf0,ASOCIACION INDIGENA MAPUCHE MAPU TRAFÜN,ASOC INDIGENA MAPUCHE MAPU TRAFÜN,ASOC INDIGENA MAPUCHE MAPU TRAFÜN,65.099.946-0,PROGS,OSC
2468b7d3-6308-4678-ba39-fa38cb38e9e5,ASOCIACION DE DISCAPACITADOS DE QUILLON,ASOC DISCAPACITADOS DE QUILLON,ASOC DISCAPACITADOS QUILLON,73.721.500-8,PROGS,OSC
6cb38a3a-3c47-4e31-8fb5-8e6c5538c6fa,CONJUNTO FOLCORICO RAICES Y TRADICIONES,CONJUNTO FOLCORICO RAICES Y TRADICIONES,CONJUNTO FOLCORICO RAICES TRADICIONES,69.275.400-K,PROGS,OTROS
a0f2e030-ff7e-4590-9a76-1f9117695b7e,CENTRO DE PADRE Y APODERADOS DE TALHUÁN,CENTRO DE PADRE Y APODERADOS DE TALHUÁN,CENTRO PADRE APODERADOS TALHUÁN,75.555.400-6,PROGS,OTROS
40f1224b-e5cd-4f6c-9946-42bc8d9edfe9,CÁMARA DE TURISMO Y CULTURA DE TREHUACO,CÁMARA DE TURISMO Y CULTURA DE TREHUACO,CÁMARA TURISMO CULTURA TREHUACO,65.191.555-4,PROGS,OTROS
3390daff-4c4f-4c5e-a9f3-639e0a68b426,COMITE DE AGUA POTABLE RURAL MANQUE SUR,COMITE DE AGUA POTABLE RURAL MANQUE SUR,COMITE AGUA POTABLE RURAL MANQUE SUR,65.301.910-6,PROGS,OSC
30a4b806-a965-4a5a-b789-e4afc5b0fd2e,JUNTA DE VECINOS EL ESFUERZO EL ARRAYAN,JV EL ESFUERZO EL ARRAYAN,JV ESFUERZO ARRAYAN,65.101.631-2,PROGS,OSC
34f1352d-db73-43c9-b2b6-ef88c7f26537,CLUB DEPORTIVO SAN IGNACIO DE PALOMARES,CD SAN IGNACIO DE PALOMARES,CD SAN IGNACIO PALOMARES,65.114.520-1,PROGS,OSC
df1aaa06-1d0d-4a6d-9477-474ee5ebae2f,ASOCIACIÓN DE ÁRBITROS SAN CARLOS ÑUBLE,ASOCIACIÓN DE ÁRBITROS SAN CARLOS ÑUBLE,ASOCIACIÓN ÁRBITROS SAN CARLOS,65.039.736-3,PROGS,OSC
48a3cbca-e87e-4942-a4ae-a957e6a0340c,CLUB DEPORTIVO LOS HALCONES DE TOQUIHUA,CD LOS HALCONES DE TOQUIHUA,CD HALCONES TOQUIHUA,65.050.280-9,PROGS,OSC
317ee72f-81f0-4dae-958a-550cfa76374e,CLUB DEPORTIVO DE CAZA Y PESCA JAGUARES,CD DE CAZA Y PESCA JAGUARES,CD CAZA PESCA JAGUARES,65.122.873-5,PROGS,OSC
6af5ad27-61fc-438e-adbd-863bda205be4,"COMITÉ DE MUJERES LAS NIEVES, SAN PEDRO","COMITÉ DE MUJERES LAS NIEVES, SAN PEDRO",COMITÉ MUJERES NIEVES SAN PEDRO,65.110.367-3,PROGS,OSC
22f11321-e109-4c76-84ae-543e210b8ac0,GRUPO DE MUJERES LAS ROSITAS DE CHEQUÉN,GRUPO DE MUJERES LAS ROSITAS DE CHEQUÉN,GRUPO MUJERES ROSITAS CHEQUÉN,65.215.041-5,PROGS,OTROS
34a32ddd-531e-4362-bd8a-2c9ede6ee15f,TALLER DE MUJERES VIDA NUEVA DE COYANCO,TALLER DE MUJERES VIDA NUEVA DE COYANCO,TALLER MUJERES VIDA NUEVA COYANCO,73.476.100-1,PROGS,OSC
da966d29-1066-4d6b-ab14-69859cf67a69,ORGANIZACIÓN DE LA MUJER RURAL DE PINTO,ORGANIZACIÓN DE LA MUJER RURAL DE PINTO,ORGANIZACIÓN MUJER RURAL PINTO,65.122.745-3,PROGS,OTROS
00ecee09-dd97-43c5-bede-7defa374187e,COMITÉ FEMENINO LAS ARAÑITAS DE LA VEGA,COMITÉ FEMENINO LAS ARAÑITAS DE LA VEGA,COMITÉ FEMENINO ARAÑITAS VEGA,65.039.560-3,PROGS,OSC
23dfebe6-5645-40c2-9418-3ee52a3e2912,AGRUPACION DE MUJERES FLOR DE PRIMAVERA,AGRUPACION DE MUJERES FLOR DE PRIMAVERA,AGRUPACION MUJERES FLOR PRIMAVERA,65.585.490-8,PROGS,OSC
fcb7205b-2605-4202-934f-3f5e1664427b,ASOCIACIÓN DE MUJERES MIRANDO EL FUTURO,ASOCIACIÓN DE MUJERES MIRANDO EL FUTURO,ASOCIACIÓN MUJERES MIRANDO FUTURO,65.151.764-8,PROGS,OSC
416c961e-618f-4e23-a711-2f8f29f84f48,JUNTA DE VECINOS EL CRISTO LA ESPERANZA,JV EL CRISTO LA ESPERANZA,JV CRISTO ESPERANZA,65.060.628-0,PROGS,OSC
314dfc53-d485-466a-8d46-37438282ab71,COMITE DE AGUA POTABLE RURAL LAS TOSCAS,COMITE DE AGUA POTABLE RURAL LAS TOSCAS,COMITE AGUA POTABLE RURAL TOSCAS,65.187.892-6,PROGS,OSC
a51e86ca-acdb-4386-8cd9-6be88bdae90f,JUNTA DE VECINOS LA MORENITA EL CHIVATO,JV LA MORENITA EL CHIVATO,JV MORENITA CHIVATO,65.215.435-2,PROGS,OSC
99575cf4-06a9-400a-a286-389e751b4b86,JUNTA DE VECINOS VILLA LOMAS DE PUYARAL,JV VILLA LOMAS DE PUYARAL,JV VILLA LOMAS PUYARAL,65.823.520-6,PROGS,OSC
979c68df-f01b-425d-ae7c-ee572ca8cb80,JUNTA DE VECINOS LOS CARDONES AGUA FRIA,JV LOS CARDONES AGUA FRIA,JV CARDONES AGUA FRIA,74.590.200-6,PROGS,OSC
584e2647-4a42-4c2c-a922-57dc211512ce,COMITE AGUA POTABLE RURAL AGUAS LIMPIAS,COMITE AGUA POTABLE RURAL AGUAS LIMPIAS,COMITE AGUA POTABLE RURAL AGUAS LIMPIAS,65.170.239-9,PROGS,OSC
e92ef50b-c3b0-4322-bdcf-89920fd9f86a,COMITÉ DE AGUA POTABLE RURAL LOS MONTES,COMITÉ DE AGUA POTABLE RURAL LOS MONTES,COMITÉ AGUA POTABLE RURAL MONTES,65.071.735-K,PROGS,OSC
f903c53c-4903-4538-8deb-3b965cbbfda1,JUNTA DE VECINOS VILLA EDUARDO FREI N°8,JV VILLA EDUARDO FREI N°8,JV VILLA EDUARDO FREI N°8,65.152.620-5,PROGS,OSC
247aea9e-7be0-43f1-8a32-4021e8a128c1,JUNTA DE VECINOS VILLA MANUEL RODRÍGUEZ,JV VILLA MANUEL RODRÍGUEZ,JV VILLA MANUEL RODRÍGUEZ,65.242.740-5,PROGS,OSC
d3076d92-6072-4223-a490-d254d45fda93,JUNTA DE VECINOS VILLA LOS LIBERTADORES,JV VILLA LOS LIBERTADORES,JV VILLA LIBERTADORES,65.041.117-K,PROGS,OSC
65e0672b-ac26-4cf5-bb62-84b35ae7365a,COMITE DE ADELANTO ALTYOS DEL PAJONAL65,COMITE DE ADELANTO ALTYOS DEL PAJONAL65,COMITE ADELANTO ALTYOS PAJONAL65,65.209.145-8,PROGS,OSC
f7543557-aac0-42f8-99fa-227909feaca0,JUNTA DE VECINOS SAN MANUEL DE VERQUICÓ,JV SAN MANUEL DE VERQUICÓ,JV SAN MANUEL VERQUICÓ,74.091.200-3,PROGS,OSC
dbaea54f-313c-4711-b5b7-9b1725325ebe,VECINOS LA ESPERANZA DE PATAGUAL PUAHUN,VECINOS LA ESPERANZA DE PATAGUAL PUAHUN,VECINOS ESPERANZA PATAGUAL PUAHUN,74.787.100-0,PROGS,OTROS
fa55b97a-8dcf-4d85-94b4-07f83cdc3f15,COMITE DE AGUA POTABLE RURAL DE DENECAN,COMITE DE AGUA POTABLE RURAL DE DENECAN,COMITE AGUA POTABLE RURAL DENECAN,74.642.700-K,PROGS,OSC
a4df6416-1006-4591-b5b1-e631a076d1a1,COMITE DE DESARROLLO VECINAL LAS RAICES,COMITE DE DESARROLLO VECINAL LAS RAICES,COMITE DESARROLLO RAICES,65.982.900-2,PROGS,OSC
ff74190c-9459-4bd5-ba76-bd86f03ca10c,COMITÉ DE AGUAS VILLA EL SOL DE CARTAGO,COMITÉ DE AGUAS VILLA EL SOL DE CARTAGO,COMITÉ AGUAS VILLA SOL CARTAGO,65.307.380-1,PROGS,OSC
89fa1420-8b0c-4b99-b26a-300a91522ce7,FUNDACIÓN HABILIDADES PARA LA VIDA DOWN,FUNDACIÓN HABILIDADES PARA LA VIDA DOWN,FUNDACIÓN HABILIDADES VIDA DOWN,65.214.026-2,PROGS,OSC
b97390d8-5763-4d91-a598-ccb852ceee1a,HOGAR DE ANCIANOS SAN FRANCISCO DE ASIS,HOGAR DE ANCIANOS SAN FRANCISCO DE ASIS,HOGAR ANCIANOS SAN FRANCISCO ASIS,71.737.700-1,PROGS,OTROS
4babbcd4-df3a-4ffb-8ee7-ff48fe1a2878,AGRUPACIÓN DISCAPACITADOS PRECORDILLERA,AGRUPACIÓN DISCAPACITADOS PRECORDILLERA,AGRUPACIÓN DISCAPACITADOS PRECORDILLERA,65.021.430-7,PROGS,OSC
9b9ffb15-28d2-4592-a049-97962d2eb491,CLUB DE ADULTO MAYOR NUESTRA PRIMAVERA,CLUB DE ADULTO MAYOR NUESTRA PRIMAVERA,CLUB NUESTRA PRIMAVERA,65.162.657-9,PROGS,OSC
d0b55de5-ef69-46ad-8414-ff3f5980c629,CLUB ADULTO MAYOR LOS MEJORES CRÓNICOS,CLUB ADULTO MAYOR LOS MEJORES CRÓNICOS,CLUB MEJORES CRÓNICOS,65.115.358-1,PROGS,OSC
6fa8a112-5043-4dd7-b755-57c04d7e80d2,CLUB DE ADULTO MAYOR LOS EMPRENDEDORES,CLUB DE ADULTO MAYOR LOS EMPRENDEDORES,CLUB EMPRENDEDORES,65.219.767-1,PROGS,OSC
ebc935c8-4192-4f7e-89a1-1b89df7ed8db,CLUB ADULTO MAYOR PROFESORES EN RECREO,CLUB ADULTO MAYOR PROFESORES EN RECREO,CLUB PROFESORES EN RECREO,65.117.649-2,PROGS,OSC
5c9cffa6-3e1d-4c72-bdec-5a00e4beeea9,CLUB DE ADULTO MAYOR GIRASOL DE HUALTE,CLUB DE ADULTO MAYOR GIRASOL DE HUALTE,CLUB GIRASOL HUALTE,65.640.650-K,PROGS,OSC
7854dfc4-7388-44ff-8c7f-3e270c2c07fa,"CLUB DE ADULTO MAYOR ""BELLO HORIZONTE""","CLUB DE ADULTO MAYOR ""BELLO HORIZONTE""",CLUB BELLO HORIZONTE,65.738.280-9,PROGS,OSC
a019c709-dfcf-4cad-8be1-a21abf6f0a71,CLUB DE ADULTO MAYOR FLOR EN PRIMAVERA,CLUB DE ADULTO MAYOR FLOR EN PRIMAVERA,CLUB FLOR EN PRIMAVERA,65.499.260-6,PROGS,OSC
cd3fd5ad-539b-41f6-94c9-ef33cafcd3d1,CLUB DEL ADULTO MAYOR DR. ISIDORO TOHA,CLUB DEL ADULTO MAYOR DR. ISIDORO TOHA,CLUB DR ISIDORO TOHA,65.879.220-2,PROGS,OSC
d137c290-91f4-4502-9738-ff7939e9e16d,CLUB ADULTO MAYOR ARBOL DE LA JUVENTUD,CLUB ADULTO MAYOR ARBOL DE LA JUVENTUD,CLUB ARBOL JUVENTUD,65.095.471-8,PROGS,OSC
70269921-1812-497a-a6ae-f556c3bb137f,CLUB DE ADULTO MAYOR SAN PEDRO NOLASCO,CLUB DE ADULTO MAYOR SAN PEDRO NOLASCO,CLUB SAN PEDRO NOLASCO,65.495.660-K,PROGS,OSC
4714cfd3-a99d-4944-9cfb-e3cf21589470,CLUB ADULTO MAYOR RENACIENDO A LA VIDA,CLUB ADULTO MAYOR RENACIENDO A LA VIDA,CLUB RENACIENDO A VIDA,65.023.949-0,PROGS,OSC
915cf075-6e95-47a3-acca-1dc8a0b57600,CLUB DE ADULTO MAYOR GRACIAS A LA VIDA,CLUB DE ADULTO MAYOR GRACIAS A LA VIDA,CLUB GRACIAS A VIDA,65.013.451-6,PROGS,OSC
656813ca-a3a2-43a2-8ad4-59590a9c3ff3,CLUB DE ANSIANOS SOR TERESA DE CALCUTA,CLUB DE ANSIANOS SOR TERESA DE CALCUTA,CLUB ANSIANOS SOR TERESA CALCUTA,75.964.300-3,PROGS,OSC
5d8ee788-1bf0-438e-a1a1-03c73366c333,TALLER LABORAL Y CULTURAL LA ESPERANZA,TALLER LABORAL Y CULTURAL LA ESPERANZA,TALLER LABORAL ESPERANZA,65.561.980-1,PROGS,OSC
bdbc5c55-764b-47e1-8322-ee43f19ebb74,CONJUNTO FOLCLORICO AMANECER CAMPESINO,CONJUNTO FOLCLORICO AMANECER CAMPESINO,CONJUNTO AMANECER,65.765.980-0,PROGS,OTROS
6aaf21d1-0fd7-4539-b70e-a2439aa29d70,CORPORACION EDUCACIONAL CREANDO SUEÑOS,CORPORACION EDUCACIONAL CREANDO SUEÑOS,CORPORACION EDUCACIONAL CREANDO SUEÑOS,65.124.845-0,PROGS,OSC
72f8fd1b-b2d9-470a-b10e-96a7919e9faa,AGRUPACIÓN CULTURAL CON MANOS DE MUJER,AGRUPACIÓN CULTURAL CON MANOS DE MUJER,AGRUPACIÓN CON MANOS MUJER,65.162.206-9,PROGS,OSC
c6f58c6c-a1a1-4f73-91a8-f30185865bea,CLUB DE RAYUELA DOMINGO ORTIZ DE ROZAS,CLUB DE RAYUELA DOMINGO ORTIZ DE ROZAS,CLUB RAYUELA DOMINGO ORTIZ ROZAS,65.458.060-K,PROGS,OSC
7abb70f1-0871-4767-a4ab-e3be77ad2063,GRUPO DEPORTIVO FEMENINO LAS PALOMITAS,GRUPO DEPORTIVO FEMENINO LAS PALOMITAS,GRUPO FEMENINO PALOMITAS,65.055.635-6,PROGS,OTROS
94625519-52fe-4017-bae4-8e30d93c39ba,CLUB DEPORTIVO Y SOCIAL VIRGINIO ARIAS,CD Y SOCIAL VIRGINIO ARIAS,CD VIRGINIO ARIAS,65.559.290-3,PROGS,OSC
2ed18b28-9084-449a-afe7-4105604fee15,ASOCIACION DE FUTBOL RURAL SANTA CLARA,ASOC FUTBOL RURAL SANTA CLARA,ASOC FUTBOL RURAL SANTA CLARA,65.821.650-3,PROGS,OSC
1353ffe3-3129-4163-8663-dd4121c8e8fc,CLUB DE PATINAJE ARTÍSTICO SAN IGNACIO,CLUB DE PATINAJE ARTÍSTICO SAN IGNACIO,CLUB PATINAJE ARTÍSTICO SAN IGNACIO,65.167.831-5,PROGS,OSC
aee98b28-a4b1-409a-ac87-3ab97bba8c1f,ASOCIACIÓN TENIS DE MESA CHILLÁN VIEJO,ASOCIACIÓN TENIS DE MESA CHILLÁN VIEJO,ASOCIACIÓN TENIS MESA CHILLÁN VIEJO,65.099.156-7,PROGS,OSC
e7820ae3-8209-4dcc-8523-7208e8c30b9b,ASOCIACION DEPORTIVA KARATE-DO CHILLAN,ASOC DEPORTIVA KARATE-DO CHILLAN,ASOC KARATE DO CHILLAN,65.038.339-7,PROGS,OSC
22086ca5-6cd4-45d7-8389-9dec27f72319,CLUB DEPORTIVO JUVENIL DE GENERAL CRUZ,CD JUVENIL DE GENERAL CRUZ,CD CRUZ,74.094.900-4,PROGS,OSC
857140d6-ea18-4efb-a63e-7dea47b90035,CLUB DEPORTIVO REAL SOCIEDAD DE PEMUCO,CD REAL SOCIEDAD DE PEMUCO,CD REAL SOCIEDAD PEMUCO,73.945.700-9,PROGS,OSC
63b8a6f4-c626-4e7c-92dd-5979ef6abb48,ASOCIACIÓN REGIONAL DE BALONMANO ÑUBLE,ASOCIACIÓN REGIONAL DE BALONMANO ÑUBLE,ASOCIACIÓN REGIONAL BALONMANO,65.203.909-K,PROGS,OSC
86c73dc9-8f77-43a9-877d-473d1867c9a1,COMITE DE AGRO PROCESADOS CUNA DE PRAT,COMITE DE AGRO PROCESADOS CUNA DE PRAT,COMITE AGRO PROCESADOS CUNA PRAT,65.218.207-0,PROGS,OSC
706fba89-fd8b-47a7-84c6-f60125a42781,AGRUPACIÓN DE MUJERES ELY DE AGUA FRÍA,AGRUPACIÓN DE MUJERES ELY DE AGUA FRÍA,AGRUPACIÓN MUJERES ELY AGUA FRÍA,65.114.413-2,PROGS,OSC
58acf50a-e5ca-4e7a-afe2-5e2aae8e784b,UNION COMUNAL DE GRUPOS AGROECOLOGICOS,UNION COMUNAL DE GRUPOS AGROECOLOGICOS,UNION COMUNAL GRUPOS AGROECOLOGICOS,65.796.770-K,PROGS,OSC
9794eca8-8c45-4955-8fc1-3e118e5b892d,JUNTA DE VECINOS VILLA LATINOAMERICANA,JV VILLA LATINOAMERICANA,JV VILLA LATINOAMERICANA,65.095.459-9,PROGS,OSC
5f2902d7-c65e-4d9d-ad0f-c549e19d5273,COMITE DE AGUA POTABLE RURAL EL ARROYO,COMITE DE AGUA POTABLE RURAL EL ARROYO,COMITE AGUA POTABLE RURAL ARROYO,65.041.569-8,PROGS,OSC
8505cd93-ceac-41ae-89c8-054914811f3d,JUNTA DE VECINOS VILLA LOS DOMINICOS 8,JV VILLA LOS DOMINICOS 8,JV VILLA DOMINICOS 8,65.217.615-1,PROGS,OSC
c6f6df1e-1ca7-436a-909e-dec8b02c84f3,JUNTA DE VECINOS VILLA EL CONQUISTADOR,JV VILLA EL CONQUISTADOR,JV VILLA CONQUISTADOR,65.463.160-3,PROGS,OSC
f8c2280f-c87e-4e5d-9166-502a6bcc29ba,JUNTA DE VECINOS DESARROLLO Y ESFUERZO,JV DESARROLLO Y ESFUERZO,JV DESARROLLO ESFUERZO,65.003.782-0,PROGS,OSC
d1120d10-c3b8-461a-8f82-faf40af67c18,COMITE DE ADELANTO BOSQUE LAS CAMELIAS,COMITE DE ADELANTO BOSQUE LAS CAMELIAS,COMITE ADELANTO BOSQUE CAMELIAS,65.207.928-8,PROGS,OSC
28dafccc-2200-4104-a9be-7d6aba48a421,JUNTA DE VECINOS LAS VEGAS DE SAN JUAN,JV LAS VEGAS DE SAN JUAN,JV VEGAS SAN JUAN,73.984.200-K,PROGS,OSC
1cc101f2-98c5-46da-90f2-21c59a4d4e60,JUNTA DE VECINOS CUADRAPANGUE QUILELTO,JV CUADRAPANGUE QUILELTO,JV CUADRAPANGUE QUILELTO,65.267.450-K,PROGS,OSC
b118b02b-51d4-4ee4-9978-deea23e2116a,JUNTA DE VECINOS AGUA BUENA - EL PEÑÓN,JV AGUA BUENA - EL PEÑÓN,JV AGUA BUENA PEÑÓN,75.977.690-9,PROGS,OSC
470388eb-67e7-41c2-a30d-f954cd907115,COMITE DE ADELANTO TRABUNCURA LA BALSA,COMITE DE ADELANTO TRABUNCURA LA BALSA,COMITE ADELANTO TRABUNCURA BALSA,65.065.095-6,PROGS,OSC
b5353acf-9674-4bc4-8822-b293ceafb48d,JUNTA DE VECINOS LA UNIÓN DE TALQUIPEN,JV LA UNIÓN DE TALQUIPEN,JV UNIÓN TALQUIPEN,65.051.883-7,PROGS,OSC
639afe45-a32f-4cb8-8e62-ed8b575ac87e,COMITE DE AGUA POTABLE RURAL NINQUIHUE,COMITE DE AGUA POTABLE RURAL NINQUIHUE,COMITE AGUA POTABLE RURAL NINQUIHUE,71.724.400-1,PROGS,OSC
fa1fb1f8-e2d2-430b-9186-86e73b40a739,JUNTA DE VECINOS LOMA BLANCA EL CARDAL,JV LOMA BLANCA EL CARDAL,JV LOMA BLANCA CARDAL,65.450.780-5,PROGS,OSC
3b029fe1-71c4-4628-9145-f5de30a5a6ce,JUNTA DE VECINOS VILLA LAS ARAUCARIAS.,JV VILLA LAS ARAUCARIAS.,JV VILLA ARAUCARIAS,65.556.760-7,PROGS,OSC
3d7c059d-e48c-414c-afc6-eab4012e010a,JUNTA DE VECINOS LOS ALTOS DE TREHUACO,JV LOS ALTOS DE TREHUACO,JV ALTOS TREHUACO,65.182.185-1,PROGS,OSC
daad2c08-88c2-40a6-a86c-f48231b77bdd,COMITÉ DE VIVIENDA LOMAS DE SAN DAMIAN,COMITÉ DE VIVIENDA LOMAS DE SAN DAMIAN,COMITÉ VIVIENDA LOMAS SAN DAMIAN,65.034.791-9,PROGS,OSC
7b955e69-0c96-48f3-97a1-d1a86479bf3b,JUNTA DE VECINOS VILLA LOMAS DE MAIPON,JV VILLA LOMAS DE MAIPON,JV VILLA LOMAS MAIPON,65.916.640-2,PROGS,OSC
242caa18-e904-4218-b511-9c2e2b0f8f7c,JUNTA DE VECINOS PORTAL DEL LIBERTADOR,JV PORTAL DEL LIBERTADOR,JV PORTAL LIBERTADOR,65.172.731-6,PROGS,OSC
e748cbbf-e1c1-449e-bddf-9a55e47a8dc1,DISCAPACITADOS RENACER EN LA ESPERANZA,DISCAPACITADOS RENACER EN LA ESPERANZA,DISCAPACITADOS RENACER EN ESPERANZA,74.151.600-4,PROGS,OTROS
e8e0ebda-de82-4249-9836-5657cdf0baff,UNION COMUNAL JUNTA DE VECINOS COELEMU,UNION COMUNAL JUNTA DE VECINOS COELEMU,UNION COMUNAL JUNTA VECINOS COELEMU,74.850.300-5,PROGS,OSC
916f163f-ccf4-4601-905d-e0555ac18d40,JUNTA DE VECINOS VILLA UNION DE RELBUN,JV VILLA UNION DE RELBUN,JV VILLA UNION RELBUN,65.148.550-9,PROGS,OSC
f2239a3c-034a-42e0-a9c3-637f8c3a78ba,JUNTA DE VECINOS EL ÁLAMO DE TRANCOYAN,JV EL ÁLAMO DE TRANCOYAN,JV ÁLAMO TRANCOYAN,65.239.590-2,PROGS,OSC
7b24bf70-f65b-44c8-a3d8-10bab19ea295,COMITE AGUA POTABLE RURAL VILLA EL SOL,COMITE AGUA POTABLE RURAL VILLA EL SOL,COMITE AGUA POTABLE RURAL VILLA SOL,65.735.230-6,PROGS,OSC
6df2168a-aa02-4dcf-8421-281d88826ca9,JUNTA DE VECINOS TRES ESQUINAS DE CATO,JV TRES ESQUINAS DE CATO,JV TRES ESQUINAS CATO,75.646.000-5,PROGS,OSC
35527395-1f6e-4974-8cb2-2c39cf42c734,TALLER LABORAL MUJERES DE PASO PERALES,TALLER LABORAL MUJERES DE PASO PERALES,TALLER LABORAL MUJERES PASO PERALES,65.199.554-K,PROGS,OSC
6074d4b9-ccb6-4939-93d3-6d063fa08bd2,COMITÉ DE MUJERES CREACIÓN SELVA NEGRA,COMITÉ DE MUJERES CREACIÓN SELVA NEGRA,COMITÉ MUJERES CREACIÓN SELVA NEGRA,65.163.793-7,PROGS,OSC
c866f41c-83f2-474b-b831-af0be8b2dcdd,JUNTA DE VECINOS EDUARDO FREI MONTALBA,JV EDUARDO FREI MONTALBA,JV EDUARDO FREI MONTALBA,73.369.600-1,PROGS,OSC
440717bb-b5cd-4721-9ec5-cb3c8f759e93,FUNDACIÓN CHILENA PARA LA DISCAPACIDAD,FUNDACIÓN CHILENA PARA LA DISCAPACIDAD,FUNDACIÓN CHILENA DISCAPACIDAD,65.060.229-3,PROGS,OSC
58644e8b-337e-4862-bda9-930e43c0f1b7,COMITÉ DE MANUALIDADES LAS HORMIGUITAS,COMITÉ DE MANUALIDADES LAS HORMIGUITAS,COMITÉ MANUALIDADES HORMIGUITAS,65.094.222-1,PROGS,OSC
5fffd5d6-c22b-4582-aa1c-0c34e948b3d7,CLUB ADULTO MAYOR JUAN DE DIOS DAVILA,CLUB ADULTO MAYOR JUAN DE DIOS DAVILA,CLUB JUAN DIOS DAVILA,65.242.060-5,PROGS,OSC
b1376387-f877-4da3-be40-82b4b7caeafd,CLUB ADULTO MAYOR DESPERTAR A LA VIDA,CLUB ADULTO MAYOR DESPERTAR A LA VIDA,CLUB DESPERTAR A VIDA,65.653.240-8,PROGS,OSC
da5d02a4-9618-4ee7-8526-dd30cb197968,CLUB DEL ADULTO MAYOR MANOS CREADORAS,CLUB DEL ADULTO MAYOR MANOS CREADORAS,CLUB MANOS CREADORAS,65.023.718-8,PROGS,OSC
51b81b49-ad5f-41cc-9cc3-5a17b43c150e,GRUPO DE LA TERCERA EDAD FUTURO FELIZ,GRUPO DE LA TERCERA EDAD FUTURO FELIZ,GRUPO TERCERA EDAD FUTURO FELIZ,74.908.700-5,PROGS,OTROS
7098a1a8-deea-4ae7-8a60-a1e37baf8335,AGRUPACION DE ADULTO MAYOR LA AMISTAD,AGRUPACION DE ADULTO MAYOR LA AMISTAD,AGRUPACION AMISTAD,65.127.257-2,PROGS,OSC
cafc7ad5-4b90-42f7-af5e-82d6288bc04f,CLUB ADULTO MAYOR MULTITALLER ANGELES,CLUB ADULTO MAYOR MULTITALLER ANGELES,CLUB MULTITALLER ANGELES,65.020.447-6,PROGS,OSC
3929d487-761b-4f26-9579-ca4a3720dab3,CLUB ADULTO MAYOR LA RIBERA DEL ITATA,CLUB ADULTO MAYOR LA RIBERA DEL ITATA,CLUB RIBERA ITATA,65.340.210-4,PROGS,OSC
fe3c4dec-02af-4273-afb6-8971f4617adb,"CLUB ADULTO MAYOR ""HORIZONTE"" CHILLAN","CLUB ADULTO MAYOR ""HORIZONTE"" CHILLAN",CLUB HORIZONTE CHILLAN,65.188.762-3,PROGS,OSC
6dd24fde-3a8a-4312-be10-ca9d61c51b76,CLUB ADULTO MAYOR SEMBRANDO ESPERANZA,CLUB ADULTO MAYOR SEMBRANDO ESPERANZA,CLUB SEMBRANDO ESPERANZA,65.054.375-0,PROGS,OSC
1e434b8c-5336-4a73-8c0e-0dc7a86930e3,AGRUPACION CULTURAL ROSALBA NAVARRETE,AGRUPACION CULTURAL ROSALBA NAVARRETE,AGRUPACION ROSALBA NAVARRETE,65.105.434-6,PROGS,OSC
e2e681cd-3dc9-46d3-be31-d9b729dccb8d,COMITÉ CAMPESINO ESMERALDA DE LONQUÉN,COMITÉ CAMPESINO ESMERALDA DE LONQUÉN,COMITÉ ESMERALDA LONQUÉN,65.820.090-1,PROGS,OSC
00e36072-a450-4cfd-b5b9-8aed64976761,COMITÉ CAMPESINO FRUTOS DE SAN FABIÁN,COMITÉ CAMPESINO FRUTOS DE SAN FABIÁN,COMITÉ FRUTOS SAN FABIÁN,65.152.233-1,PROGS,OSC
6702025e-c04e-4b4f-bd46-e6ea4d099647,BANDA ESCOLAR PUERTA DE LA CORDILLERA,BANDA ESCOLAR PUERTA DE LA CORDILLERA,BANDA ESCOLAR PUERTA CORDILLERA,65.040.574-9,PROGS,OTROS
cf99d453-5cd9-4df1-9a8f-7a7ef655be1d,CLUB DEPORTIVO LAS CANCHAS BUCHUPUREO,CD LAS CANCHAS BUCHUPUREO,CD CANCHAS BUCHUPUREO,73.622.700-2,PROGS,OSC
5fc8d1f1-e1e6-45d1-8f0f-92777a902feb,CLUB DEPORTIVO TAEKWONDO FENIX BULNES,CD TAEKWONDO FENIX BULNES,CD TAEKWONDO FENIX BULNES,65.039.687-1,PROGS,OSC
6c2958a3-c88b-4a9a-9fda-d17ec3cc4b5c,CLUB DEPORTIVO CULTURAL Y SOCIAL ANTÜ,CD CULTURAL Y SOCIAL ANTÜ,CD ANTÜ,65.183.297-7,PROGS,OSC
57c6c2e4-2a39-4ebf-88ea-3a693dbe6267,CLUB DEPORTIVO DE AJEDREZ SAN NICOLÁS,CD DE AJEDREZ SAN NICOLÁS,CD AJEDREZ SAN NICOLÁS,65.154.211-1,PROGS,OSC
ac56ed7d-95f9-46d1-8b5f-90de13396d93,CLUB DEPORTIVO SAN FERNANDO DE ZEMITA,CD SAN FERNANDO DE ZEMITA,CD SAN FERNANDO ZEMITA,65.285.640-3,PROGS,OSC
13e97005-e94b-4876-9dd7-3d24b8d8e18e,CLUB DEPORTIVO HOCKEY TORNADO CHILLAN,CD HOCKEY TORNADO CHILLAN,CD HOCKEY TORNADO CHILLAN,65.142.889-0,PROGS,OSC
76e14bad-6037-4768-a090-57b8efb0352d,CLUB DEPORTIVO MAXIBASQUETBOL CHILLAN,CD MAXIBASQUETBOL CHILLAN,CD MAXIBASQUETBOL CHILLAN,65.000.308-K,PROGS,OSC
2360c12b-38bc-47ba-a2b3-21b39e6554c9,CLUB DEPORTIVO SAN PEDRO DE LAS ROSAS,CD SAN PEDRO DE LAS ROSAS,CD SAN PEDRO ROSAS,65.009.485-9,PROGS,OSC
686326d1-25ba-4154-a05c-a58daff7a3dc,COMITÉ DE MUJERES CAMPESINAS LA GREDA,COMITÉ DE MUJERES CAMPESINAS LA GREDA,COMITÉ MUJERES CAMPESINAS GREDA,73.902.700-4,PROGS,OSC
b3f6ba27-4b2b-4093-b41a-a5ea620091d2,JUNTA DE VECINOS GUILLERMO FUENZALIDA,JV GUILLERMO FUENZALIDA,JV GUILLERMO FUENZALIDA,75.851.900-7,PROGS,OSC
28ae42af-0e3a-41ce-8044-6570d76a8711,JUNTA DE VECINOS LOS MAITENES EL YUGO,JV LOS MAITENES EL YUGO,JV MAITENES YUGO,65.738.700-2,PROGS,OSC
ee1675ae-9c01-410d-9b46-844a06f8a990,JUNTA DE VECINOS VILLA LAGOS DE CHILE,JV VILLA LAGOS DE CHILE,JV VILLA LAGOS CHILE,65.048.249-8,PROGS,OSC
8ff7cc90-379d-4516-86cd-ac3e9e823833,COMITE DE ADELANTO VILLA LOS MAITENES,COMITE DE ADELANTO VILLA LOS MAITENES,COMITE ADELANTO VILLA MAITENES,65.889.690-3,PROGS,OSC
3673c57c-fa52-4f9c-b0fe-85bb5b340faf,COMITÉ DE ADELANTO AVENIDA LOS AROMOS,COMITÉ DE ADELANTO AVENIDA LOS AROMOS,COMITÉ ADELANTO AVENIDA AROMOS,65.177.083-1,PROGS,OSC
c6407854-72ec-4fa5-8f73-e1804e669c91,JUNTA DE VECINOS POBLACION EL ENCANTO,JV POBLACION EL ENCANTO,JV POBLACION ENCANTO,73.624.300-8,PROGS,OSC
205a2496-f3f1-4bc2-95e9-d2b4a32d18bb,JUNTA DE VECINOS JOSE CAMPOS ORELLANA,JV JOSE CAMPOS ORELLANA,JV JOSE CAMPOS ORELLANA,71.967.700-2,PROGS,OSC
9a189e1b-632e-4504-b2c6-f5c6ce925c7e,JUNTA DE VECINOS RINCONADA LA CAPILLA,JV RINCONADA LA CAPILLA,JV RINCONADA CAPILLA,65.845.620-2,PROGS,OSC
8b812411-0350-4c17-93d9-582210e3f8d0,JUNTA DE VECINOS LA CRUZADA RANGUELMO,JV LA CRUZADA RANGUELMO,JV CRUZADA RANGUELMO,73.577.600-2,PROGS,OSC
c8d0ee74-dd5c-457b-9ba2-f1def0eae814,JUNTA DE VECINOS VILLA DIEGO PORTALES,JV VILLA DIEGO PORTALES,JV VILLA DIEGO PORTALES,65.911.630-8,PROGS,OSC
9717cac2-65e1-457e-9b9d-a42985b9c4e6,JUNTA DE VECINOS RENACER CAMINO VIEJO,JV RENACER CAMINO VIEJO,JV RENACER CAMINO VIEJO,65.177.081-5,PROGS,OSC
0696c0ff-3e03-4e13-8ef6-4d576eb58a9b,COMITE DE AGUA POTABLE RURAL VERQUICO,COMITE DE AGUA POTABLE RURAL VERQUICO,COMITE AGUA POTABLE RURAL VERQUICO,65.174.256-0,PROGS,OSC
a0b4d041-88eb-4d9f-be16-bc7a576a1cab,JUNTA DE VECINOS EDUARDO FREI MONTANA,JV EDUARDO FREI MONTANA,JV EDUARDO FREI MONTANA,65.141.730-9,PROGS,OSC
74e74589-6f7c-4d70-8a88-1bb2b0d73f47,COMITÉ DE AGUA POTABLE RURAL BUCALEMU,COMITÉ DE AGUA POTABLE RURAL BUCALEMU,COMITÉ AGUA POTABLE RURAL BUCALEMU,65.557.630-4,PROGS,OSC
2ea197ba-e410-43b7-a776-9ede5c37cbb0,JUNTA DE VECINOS VILLA PARQUE ALAMEDA,JV VILLA PARQUE ALAMEDA,JV VILLA PARQUE ALAMEDA,65.206.214-8,PROGS,OSC
fe453087-4905-4720-897f-368efdfb0394,AGRUPACION DE ADELANTO VUELTA LA RAMA,AGRUPACION DE ADELANTO VUELTA LA RAMA,AGRUPACION ADELANTO VUELTA RAMA,75.604.700-0,PROGS,OSC
0a4fa692-53b2-462d-ac79-48e42308a7b7,JUNTA DE VECINOS SAN PEDRO DE LILAHUE,JV SAN PEDRO DE LILAHUE,JV SAN PEDRO LILAHUE,75.716.200-8,PROGS,OSC
13835282-98ee-41df-b6fe-df00dfd9f02c,JUNTA DE VECINOS LLAHUIMAVIDA ORIENTE,JV LLAHUIMAVIDA ORIENTE,JV LLAHUIMAVIDA ORIENTE,65.476.300-3,PROGS,OSC
acf6a4d0-86df-4955-92d7-0bbb004354a5,JUNTA DE VECINOS LA TORRE DE HUENUTIL,JV LA TORRE DE HUENUTIL,JV TORRE HUENUTIL,65.770.600-0,PROGS,OSC
abcf66c6-c8cb-427a-aa15-836f5d2ee12a,JUNTA DE VECINOS PUEBLO SECO PONIENTE,JV PUEBLO SECO PONIENTE,JV PUEBLO SECO PONIENTE,65.216.312-2,PROGS,OSC
571cdeb4-15a9-4877-9e83-ad1e9548e71f,CUARTA COMPAÑÍA DE BOMBEROS DE YUNGAY,CUARTA COMPAÑÍA DE BOMBEROS DE YUNGAY,CUARTA COMPAÑÍA BOMBEROS YUNGAY,65.499.420-K,PROGS,OSC
aa61650c-08dc-4819-8361-1d5cd6f08e79,JUNTA DE VECINOS COMULLAUN MALLOCAVEN,JV COMULLAUN MALLOCAVEN,JV COMULLAUN MALLOCAVEN,65.169.568-6,PROGS,OSC
7542463c-87fc-47dd-8007-f262c5747712,JUNTA DE VECINOS N°13 ROSITA OHIGGINS,JV N°13 ROSITA OHIGGINS,JV N°13 ROSITA OHIGGINS,74.141.200-4,PROGS,OSC
4c9d5205-ed3b-42a3-8eeb-3f7fe1ddb673,CENTRO DE MADRES LA ALEGRIA DE RELBÚN,CENTRO DE MADRES LA ALEGRIA DE RELBÚN,CENTRO MADRES ALEGRIA RELBÚN,65.107.095-3,PROGS,OTROS
2c31d7e5-d3d6-4ff5-8677-ca8732d229e5,JUNTA DE VECINOS AGUAS AZULES ORIENTE,JV AGUAS AZULES ORIENTE,JV AGUAS AZULES ORIENTE,65.192.210-0,PROGS,OSC
c3676f67-7c44-40a6-a187-b66cc7e2a9e8,MISIÓN EVANGÉLICA IGLESIAS CRISTIANAS,MISIÓN EVANGÉLICA IGLESIAS CRISTIANAS,MISIÓN EVANGÉLICA IGLESIAS CRISTIANAS,65.269.270-2,PROGS,OTROS
bf4157ef-9b19-46eb-9e5e-81e5d58755d8,CLUB ADULTO MAYOR LOS BUENOS VECINOS,CLUB ADULTO MAYOR LOS BUENOS VECINOS,CLUB BUENOS VECINOS,65.064.546-4,PROGS,OSC
766214f7-3cd5-47ba-bc9d-797b7b09e3e0,CLUB DE ADULTO MAYOR ETERNA JUVENTUD,CLUB DE ADULTO MAYOR ETERNA JUVENTUD,CLUB ETERNA JUVENTUD,65.044.332-2,PROGS,OSC
f97dc936-911d-4cf7-acd2-ea910c1d63f1,CLUB ADULTO MAYOR MARIA DE LA MARCED,CLUB ADULTO MAYOR MARIA DE LA MARCED,CLUB MARIA MARCED,75.921.100-6,PROGS,OSC
7834ec47-e83c-46f8-aa81-664fd95334f4,CLUB DE ADULTO MAYOR DULCE ATARDECER,CLUB DE ADULTO MAYOR DULCE ATARDECER,CLUB DULCE ATARDECER,65.033.684-4,PROGS,OSC
bc9b0097-8c4e-4fdb-a09a-8bafff01de73,CLUB DE ADULTO MAYOR ATARDECER FELIZ,CLUB DE ADULTO MAYOR ATARDECER FELIZ,CLUB ATARDECER FELIZ,65.183.659-K,PROGS,OSC
0bec1eed-0ff4-42f3-91a2-2cd79bfe59a9,GRUPO ADULTO MAYOR PIEDRA DE LIUCURA,GRUPO ADULTO MAYOR PIEDRA DE LIUCURA,GRUPO PIEDRA LIUCURA,65.492.480-5,PROGS,OTROS
003edf38-37b0-4964-bb30-e3872c0d68e5,COMITE COORDINADOR CAMPESINO COMUNAL,COMITE COORDINADOR CAMPESINO COMUNAL,COMITE COORDINADOR COMUNAL,65.703.200-K,PROGS,OSC
867e3e7b-5bde-43d7-9566-de0e89538797,JUNTA DE VECINOS GENÉTICA EL TORREÓN,JV GENÉTICA EL TORREÓN,JV GENÉTICA TORREÓN,65.008.641-4,PROGS,OSC
a12a85e5-68d2-478f-a9f0-caa8a058371a,CLUB DE HUASOS CAMPO LINDO DE COIPIN,CLUB DE HUASOS CAMPO LINDO DE COIPIN,CLUB HUASOS CAMPO LINDO COIPIN,65.017.017-2,PROGS,OSC
77b5904a-aa5f-41c9-89c8-e8c285dd124e,CLUB DE HUASOS TRADICIONES DE HUALTE,CLUB DE HUASOS TRADICIONES DE HUALTE,CLUB HUASOS TRADICIONES HUALTE,65.203.941-3,PROGS,OSC
db129f72-7480-462b-ad17-27798f6959a9,JUNTA DE VECINOS LARQUI PONIENTE 9-R,JV LARQUI PONIENTE 9-R,JV LARQUI PONIENTE 9 R,75.260.900-4,PROGS,OSC
22c33237-bda3-48ff-afc5-421f5d36c2e0,JUNTA DE VECINOS N° 29 PIEDRAS MAULE,JV N° 29 PIEDRAS MAULE,JV N° 29 PIEDRAS MAULE,65.302.200-K,PROGS,OSC
d5ba4fa6-d336-44dc-9215-bbc29d050068,CLUB DEPORTIVO Y CULTURAL SYS TALENT,CD Y CULTURAL SYS TALENT,CD SYS TALENT,65.228.294-6,PROGS,OSC
