id,codigo_normalizado,cod_unico_idis,codigo_convenios,codigo_fril,codigo_progs,nombre_iniciativa,bip,tipologia,etapa,origen,unidad_tecnica,provincia,comuna,fuente_principal,tipo_ipr,mecanismo_id
1084a59c-0270-4d77-8af7-6004e3292a46,40032564,40032564-2021,,,,FORTALECIMIENTO RED DE SERVICIOS DE INFORMACIÓN Y ACOGIDA AL TURISTA PARA LA REACTIVACIÓN DEL TURISMO EN LA REGIÓN DE ÑUBLE,40032564,GLOSA 5.1,EJECUCIÓN,SECTORIAL / OTRO,,REGIONAL,REGIONAL,IDIS,PROYECTO,MEC-001
f557d2b3-1bc5-4411-8113-fb13d44cb9de,40032568,40032568-2021,,,,FORTALECIMIENTO PARA LA FORMALIZACIÓN DE PRESTADORES DE SERVICIOS TURÍSTICOS DE LA REGIÓN DE ÑUBLE,40032568,GLOSA 5.1,EJECUCIÓN,SECTORIAL / OTRO,,REGIONAL,REGIONAL,IDIS,PROYECTO,MEC-001
38113e54-a41c-45af-89ca-d9e5f71f56c3,40032570,40032570-2021,,,,MEJORAMIENTO PARA LA COMPETITIVIDAD DE GUÍAS DE TURISMO AVENTURA DE LA REGIÓN DE ÑUBLE,40032570,GLOSA 5.1,EJECUCIÓN,SECTORIAL / OTRO,,REGIONAL,REGIONAL,IDIS,PROYECTO,MEC-001
c5b672e0-305b-4488-bcee-6ace32b5cb70,40032664,40032664-2021,,,,"CONSTRUCCIÓN PAVIMENTO CAMINO A SAN BERNARDO, CHILLÁN",40032664,FRIL,EJECUCIÓN,MUNICIPIO,,DIGUILLÍN,CHILLÁN,IDIS,PROYECTO,MEC-001
8d052066-a592-4a8a-b922-346724352594,40032789,40032789-2021,,,,REPOSICIÓN LICEO POLIVALENTE SAN GREGORIO DE ÑIQUEN,40032789,MIDESO,DISEÑO,MUNICIPIO,,PUNILLA,ÑIQUÉN,IDIS,PROYECTO,MEC-001
9544285e-facc-4700-9089-dcefd6685e4f,40032913,40032913-2021,,,,TRANSFERENCIA FORTALECIMIENTO DEL TURISMO DE NEGOCIOS REGIÓN DE ÑUBLE,40032913,GLOSA 5.1,EJECUCIÓN,SECTORIAL / OTRO,,REGIONAL,REGIONAL,IDIS,PROGRAMA,MEC-005
c0b955ac-bf60-4780-8dce-65e745ffa864,40033061,40033061-2021,,,,FORTALECIMIENTO COMPETITIVO Y PRODUCTIVO A FUNCIONARIOS DAEM REGIÓN DE ÑUBLE,40033061,GLOSA 5.1,EJECUCIÓN,SECTORIAL / OTRO,,REGIONAL,REGIONAL,IDIS,PROYECTO,MEC-001
89d57980-155b-4e57-bee1-05e37392f5d6,40033075,40033075-2021,,,,"CONSTRUCCIÓN REVESTIMIENTO DE PISO PATINÓDROMO SECTOR BUSTAMANTE, COMUNA DE COIHUECO",40033075,FRIL,EJECUCIÓN,MUNICIPIO,,PUNILLA,COIHUECO,IDIS,PROYECTO,MEC-001
cbf1942d-6917-4636-8991-b4c52d773424,40033091,40033091-2021,,,,PROMOCIÓN DE INVERSIÓN TECNOLÓGICA Y PRODUCCIÓN LIMPIA EN SECTOR AGROALIMENTARIO DE ÑUBLE,40033091,GLOSA 5.1,EJECUCIÓN,SECTORIAL / OTRO,,REGIONAL,REGIONAL,IDIS,PROYECTO,MEC-001
238738ec-613c-4700-8801-2ab2c0932b4e,40033167,40033167-2021,,,,TRANSFERENCIA FONDO DE DESARROLLO DE LAS TELECOMUNICACIONES FON ÑUBLE - ULTIMA MILLA,40033167,GLOSA 5.1,EJECUCIÓN,SECTORIAL / OTRO,,REGIONAL,REGIONAL,IDIS,PROGRAMA,MEC-005
2ff243e2-d990-4625-94d4-a3c2017fba7c,40033282,40033282-2021,,,,"[FUERA PLAZO] MEJORAMIENTO ACCESO CEMENTERIO RURAL CERRO NEGRO, QUILLÓN",40033282,FRIL,EJECUCIÓN,MUNICIPIO,,DIGUILLÍN,QUILLÓN,IDIS,PROYECTO,MEC-001
831f5cb7-d595-4946-80f2-755d00e8ccfd,40033288,40033288-2021,40033288,,,"[FUERA PLAZO] CONSTRUCCIÓN MURO DE CONTENCIÓN CALLE 18 DE SEPTIEMBRE, QUILLÓN",40033288,FRIL,EJECUCIÓN,MUNICIPIO,,DIGUILLÍN,QUILLÓN,IDIS,PROYECTO,MEC-001
541aea70-1afa-4004-8333-619abf6c0af9,40033289,40033289-2021,,,,REPOSICIÓN DE VEHÍCULOS Y MAQUINARIAS DIRECCIÓN REGIONAL DE VIALIDAD ÑUBLE,40033289,C-33,EJECUCIÓN,SECTORIAL / OTRO,,REGIONAL,REGIONAL,IDIS,PROYECTO,MEC-001
b1c31255-8060-4314-976d-c724523a7175,40033291,40033291-2021,,,,"REPOSICIÓN AMBULANCIA AEB 4X2, COMUNA DE SAN IGNACIO",40033291,C-33,EJECUCIÓN,MUNICIPIO,,DIGUILLÍN,SAN IGNACIO,IDIS,PROYECTO,MEC-001
cb8792ab-a769-49bb-9bab-4fab176da639,40033511,40033511-2022,,,,"CONSTRUCCIÓN EXTENSIÓN RED APR QUIRIQUINA, SECTOR LOURDES, COMUNA DE SAN IGNACIO",40033511,FRIL,EJECUCIÓN,MUNICIPIO,,DIGUILLÍN,SAN IGNACIO,IDIS,PROYECTO,MEC-001
585c02a4-3cf7-441b-927c-0f3479595173,40033513,40033513-2021,,,,ADQUISICIÓN VEHÍCULO POLICIAL PARA EL RETÉN DE LA COMUNA DE NINHUE,40033513,C-33,EJECUCIÓN,MUNICIPIO,,ITATA,NINHUE,IDIS,PROYECTO,MEC-001
aee98e87-6784-4f19-8399-54df0a9d02b4,40033553,40033553-2021,,,,"ADQUISICIÓN CAMIÓN RECOLECTOR DE RESIDUOS DOMICILIARIOS, PARA LA COMUNA DE PORTEZUELO",40033553,C-33,EJECUCIÓN,MUNICIPIO,,ITATA,PORTEZUELO,IDIS,PROYECTO,MEC-001
b39d8abb-9dcd-4bad-9a37-d658da960c26,40033554,40033554-2023,40033554,,,ADQUISICIÓN RETROEXCAVADORA COMUNA DE PORTEZUELO,40033554,C-33,EJECUCIÓN,MUNICIPIO,,ITATA,PORTEZUELO,IDIS,PROYECTO,MEC-001
961a0086-d00c-44d7-acb4-b38a21d23f12,40033555,40033555-2023,40033555,,,"ADQUISICIÓN CLÍNICA MÓVIL, COMUNA DE PORTEZUELO",40033555,C-33,EJECUCIÓN,MUNICIPIO,,ITATA,PORTEZUELO,IDIS,PROYECTO,MEC-001
f3c5cbb1-2acb-43b3-a112-ad1aadcabd47,40033556,40033556-2021,,,,"ADQUISICIÓN MINIBUS TRASLADO PERSONAS CON MOVILIDAD REDUCIDA, COMUNA DE PORTEZUELO",40033556,C-33,EJECUCIÓN,MUNICIPIO,,ITATA,PORTEZUELO,IDIS,PROYECTO,MEC-001
cc83845f-0f9c-4619-b20c-60c0c52b7140,40033609,40033609-2021,,,,"AMPLIACIÓN CESFAM, COMUNA DE COBQUECURA",40033609,FRIL,EJECUCIÓN,MUNICIPIO,,ITATA,COBQUECURA,IDIS,PROYECTO,MEC-001
dba81428-2154-4311-91c7-f661e9985c19,40033680,40033680-2021,,,,"MEJORAMIENTO POSTA RURAL CIRUELITO, COMUNA DE PINTO",40033680,FRIL,EJECUCIÓN,MUNICIPIO,,DIGUILLÍN,PINTO,IDIS,PROYECTO,MEC-001
55230802-852b-42c6-9a21-b19ca225af4c,40033685,40033685-2021,,,,MEJORAMIENTO BIBLIOTECA MUNICIPAL DE PINTO,40033685,FRIL,EJECUCIÓN,MUNICIPIO,,DIGUILLÍN,PINTO,IDIS,PROYECTO,MEC-001
17c91485-8f4c-4eb8-9a9f-412ea4d2900b,40033723,40033723-2021,,,,TRANSFERENCIA CONTROL DE DROSOPHILA SUZUKI,40033723,GLOSA 5.1,EJECUCIÓN,SECTORIAL / OTRO,,REGIONAL,REGIONAL,IDIS,PROGRAMA,MEC-005
ee475a5e-d5f8-42ea-9229-e4008faed0b3,40033865,40033865-2021,,,,ADQUISICIÓN EQUIPAMIENTO CRÍTICO PARA EL HOSPITAL CLÍNICO HERMINDA MARTIN,40033865,C-33,EJECUCIÓN,SECTORIAL / OTRO,,REGIONAL,REGIONAL,IDIS,PROYECTO,MEC-001
e388feac-c6f7-4c07-91b3-bd6cbe46a3a0,40033942,40033942-2021,,,,ADQUISICIÓN CAMIÓN LIMPIAFOSAS MUNICIPALIDAD DE RÁNQUIL,40033942,C-33,EJECUCIÓN,MUNICIPIO,,ITATA,RÁNQUIL,IDIS,PROYECTO,MEC-001
e3b51f48-1463-47ac-80e6-a4dae99599ea,40034052,40034052-2021,,,,"CONSTRUCCIÓN GRADERIAS Y HABILITACIÓN DE CAMARINES PARA CANCHA EN SECTOR SAN ROQUE, ÑIQUEN",40034052,FRIL,EJECUCIÓN,MUNICIPIO,,PUNILLA,ÑIQUÉN,IDIS,PROYECTO,MEC-001
774b0297-3130-4ace-83a2-57902d796208,40034065,40034065-2021,,,,"NORMALIZACIÓN CUARTEL 3° CIA DE BOMBEROS LAS TRANCAS, COMUNA DE PINTO",40034065,FRIL,EJECUCIÓN,MUNICIPIO,,DIGUILLÍN,PINTO,IDIS,PROYECTO,MEC-001
6b7e3a64-e176-45fd-a31e-262b8f1d572f,40034082,40034082-2021,,,,REPARACIÓN CASA DEL ADULTO MAYOR Y ÁREAS DE CIRCULACIÓN RANQUIL,40034082,FRIL,EJECUCIÓN,MUNICIPIO,,ITATA,RÁNQUIL,IDIS,PROYECTO,MEC-001
b61ee9d1-c32c-431b-9a91-92fba7ad767f,40034083,40034083-2021,,,,"CONSTRUCCIÓN MULTICANCHA VILLA PORTAL DEL SUR, SAN CARLOS",40034083,FRIL,EJECUCIÓN,MUNICIPIO,,PUNILLA,SAN CARLOS,IDIS,PROYECTO,MEC-001
22365bb3-54c4-4f4b-bd44-dd6f37afa8b0,40034094,40034094-2021,,,,"CONSTRUCCIÓN PLAZA ACTIVA PORTAL DE LA LUNA, COMUNA DE SAN NICOLAS",40034094,FRIL,EJECUCIÓN,MUNICIPIO,,PUNILLA,SAN NICOLÁS,IDIS,PROYECTO,MEC-001
68e42b85-33c8-49ca-9d35-7b7bbdd4f880,40034100,40034100-2021,,,,"CONSTRUCCIÓN PLAZA ACTIVA ESCUELA LAJUELAS, COMUNA SAN NICOLAS",40034100,FRIL,EJECUCIÓN,MUNICIPIO,,PUNILLA,SAN NICOLÁS,IDIS,PROYECTO,MEC-001
4b0a2a33-86d5-45f5-ba12-7268246a1360,40034102,40034102-2021,40034102,,,"CONSTRUCCIÓN PATIO TECHADO ESCUELA CELIA URRUTIA, COMUNA DE BULNES",40034102,FRIL,EJECUCIÓN,MUNICIPIO,,DIGUILLÍN,BULNES,IDIS,PROYECTO,MEC-001
f0a51120-995b-47b0-bf5b-3d1ec7fb91a8,40034103,40034103-2021,,,,"CONSTRUCCIÓN PATIO TECHADO CORRALÓN MUNICIPAL, COMUNA DE BULNES",40034103,FRIL,EJECUCIÓN,MUNICIPIO,,DIGUILLÍN,BULNES,IDIS,PROYECTO,MEC-001
e4e5b25a-522e-484c-8c9b-aa01e841cc13,40034119,40034119-2021,,,,"CONSTRUCCIÓN VEREDAS SECTOR PORTAL DE LA LUNA, COMUNA DE SAN NICOLAS",40034119,FRIL,EJECUCIÓN,MUNICIPIO,,PUNILLA,SAN NICOLÁS,IDIS,PROYECTO,MEC-001
543a0e02-6b6a-4425-bd20-b9bc00d45801,40034121,40034121-2021,,,,"CONSTRUCCIÓN VEREDAS SECTOR LOS AROMOS, COMUNA SAN NICOLAS",40034121,FRIL,EJECUCIÓN,MUNICIPIO,,PUNILLA,SAN NICOLÁS,IDIS,PROYECTO,MEC-001
1f5e9d73-ee3a-4426-85c5-3167af1b8aad,40034122,40034122-2021,,,,CONSTRUCCIÓN REFUGIOS PEATONALES VARIOS SECTORES COMUNA SAN NICOLAS,40034122,FRIL,EJECUCIÓN,MUNICIPIO,,PUNILLA,SAN NICOLÁS,IDIS,PROYECTO,MEC-001
f251fe86-3cb8-4124-aa49-e307a784235a,40034123,40034123-2021,,,,"REPOSICIÓN PLAZA RICARDO TRONCOSO, COMUNA DE BULNES",40034123,FRIL,EJECUCIÓN,MUNICIPIO,,DIGUILLÍN,BULNES,IDIS,PROYECTO,MEC-001
646ae0b7-ccfc-44d1-8c7f-909778b6cf1e,40034126,40034126-2021,,,,"MEJORAMIENTO AREA VERDE VILLA EL PROGRESO, COMUNA DE BULNES",40034126,FRIL,EJECUCIÓN,MUNICIPIO,,DIGUILLÍN,BULNES,IDIS,PROYECTO,MEC-001
0a1b41f5-41e1-4cde-8b5e-eb1eb5db083b,40034146,40034146-2022,,,,ADQUISICION EQUIPO RAYOS OSTEOPULMONAR DIGITAL CESFAM MICHELLE CHANDIA COMUNA COIHUECO,40034146,C-33,EJECUCIÓN,SECTORIAL / OTRO,S.SALUD ÑUBLE,PUNILLA,COIHUECO,IDIS,PROYECTO,MEC-001
dc1938c0-7e11-4fca-857e-3736f21b6c0a,40034148,40034148-2021,,,,AMPLIACIÓN ALUMBRADO PÚBLICO CALLE SAN BARTOLOME Y OTRAS,40034148,FRIL,EJECUCIÓN,MUNICIPIO,,DIGUILLÍN,CHILLÁN VIEJO,IDIS,PROYECTO,MEC-001
7209dac1-6ada-4f60-a867-e9277a640bc0,40034151,40034151-2021,,,,"CONSTRUCCIÓN SALA MULTIUSO CESFAM DAVID BENAVENTE, COMUNA DE NINHUE",40034151,FRIL,EJECUCIÓN,MUNICIPIO,,ITATA,NINHUE,IDIS,PROYECTO,MEC-001
46605148-1da1-4669-9f39-b18e0bd32f2f,40034153,40034153-2021,40034153,,,MEJORAMIENTO VIALIDAD URBANA SECTOR NUEVA ALDEA,40034153,FRIL,EJECUCIÓN,MUNICIPIO,,ITATA,RÁNQUIL,IDIS,PROYECTO,MEC-001
58857c63-e6be-48e2-9114-5be8c57bb6b9,40034154,40034154-2021,40034154,,,AMPLIACIÓN EDIFICIO CONSISTORIAL COMUNA DE RANQUIL,40034154,FRIL,EJECUCIÓN,MUNICIPIO,,ITATA,RÁNQUIL,IDIS,PROYECTO,MEC-001
92a1790d-4c54-4ff9-91fc-5e9b2a9fbc97,40034163,40034163-2021,,,,"REPOSICIÓN ALUMBRADO PÚBLICO SECTOR PUAHUN, BOCA ITATA Y MELA DE LA COMUNA DE TREHUACO",40034163,FRIL,EJECUCIÓN,MUNICIPIO,,ITATA,TREGUACO,IDIS,PROYECTO,MEC-001
6931c1c3-36e4-4009-882d-81649075dc20,40034164,40034164-2022,,,,"REPOSICIÓN ALUMBRADO PÚBLICO SECTOR MINAS DE LEUQUE, CAÑA DULCE Y PURALIHUE DE LA COMUNA DE TREHUACO",40034164,FRIL,EJECUCIÓN,MUNICIPIO,,ITATA,TREGUACO,IDIS,PROYECTO,MEC-001
dd4c01ab-01ca-4a3e-a2ed-a64636b2302b,40034165,40034165-2021,,,,REPOSICIÓN ALUMBRADO PÚBLICO SECTOR MAITENCO Y DENECAN DE LA COMUNA DE TREHUACO,40034165,FRIL,EJECUCIÓN,MUNICIPIO,,ITATA,TREGUACO,IDIS,PROYECTO,MEC-001
5a540332-e012-40e1-8247-69f50dc1d2d9,40034175,40034175-2021,,,,REPOSICIÓN ALUMBRADO PÚBLICO PLAZA DE ARMAS SAN IGNACIO,40034175,FRIL,EJECUCIÓN,MUNICIPIO,,DIGUILLÍN,SAN IGNACIO,IDIS,PROYECTO,MEC-001
28d70da0-883f-485c-b1c1-2513e5781a5c,40034186,40034186-2021,,,,"CONSTRUCCIÓN POZO PROFUNDO PARA APR SECTOR SANTA LUCÍA BAJO, COMUNA DE YUNGAY",40034186,FRIL,EJECUCIÓN,MUNICIPIO,,DIGUILLÍN,YUNGAY,IDIS,PROYECTO,MEC-001
abe04451-618e-457f-8ff2-0f8ed4739296,40034204,40034204-2021,,,,"MEJORAMIENTO Y AMPLIACIÓN UNIDAD DE BODEGAS CESFAM SAN IGNACIO, COMUNA DE SAN IGNACIO",40034204,FRIL,EJECUCIÓN,MUNICIPIO,,DIGUILLÍN,SAN IGNACIO,IDIS,PROYECTO,MEC-001
81f72314-243e-4ee4-bc5a-64b343f9dd74,40034205,40034205-2021,,,,CONSTRUCCIÓN ALUMBRADO PÚBLICO SECTOR PUEBLO SECO Y PASO LOS ROSALES,40034205,FRIL,EJECUCIÓN,MUNICIPIO,,DIGUILLÍN,SAN IGNACIO,IDIS,PROYECTO,MEC-001
565af0df-3808-4485-89ad-1f9898d4ff8b,40034213,40034213-2021,,,,"CONSTRUCCIÓN MULTICANCHA ESCUELA CARACOL, COMUNA SAN FABIAN",40034213,FRIL,EJECUCIÓN,MUNICIPIO,,PUNILLA,SAN FABIÁN,IDIS,PROYECTO,MEC-001
977f5436-930e-43bc-94f4-e7bae44177ec,40034214,40034214-2021,,,,"CONSTRUCCIÓN CANCHA DE TENIS, COMUNA DE SAN FABIÁN",40034214,FRIL,EJECUCIÓN,MUNICIPIO,,PUNILLA,SAN FABIÁN,IDIS,PROYECTO,MEC-001
b91cbb1e-06a8-4b41-805b-2ff6451da791,40034216,40034216-2021,,,,"CONSTRUCCIÓN SEÑALETICA Y SEGURIDAD VIAL, COMUNA DE RANQUIL",40034216,FRIL,EJECUCIÓN,MUNICIPIO,,ITATA,RÁNQUIL,IDIS,PROYECTO,MEC-001
fa582f0f-b568-4e90-a262-4b7b3a9c7cf8,40034217,40034217-2021,,,,"RECUPERACIÓN ESPACIOS PÚBLICOS, COMUNA DE RANQUIL",40034217,FRIL,EJECUCIÓN,MUNICIPIO,,ITATA,RÁNQUIL,IDIS,PROYECTO,MEC-001
5d13db1f-fca6-478a-b751-22e27ba3f5b8,40034223,40034223-2021,,,,"CONSTRUCCIÓN ALUMBRADO PÚBLICO LED SECTOR CHUDAL Y OTROS, COMUNA DE PORTEZUELO",40034223,FRIL,EJECUCIÓN,MUNICIPIO,,ITATA,PORTEZUELO,IDIS,PROYECTO,MEC-001
4620f9d6-8d37-4210-bf4d-17201ae5ac99,40034225,40034225-2021,,,,ADQUISICIÓN DE EQUIPOS PARA LABORATORIO REGIONAL DE VIALIDAD ÑUBLE,40034225,C-33,EJECUCIÓN,SECTORIAL / OTRO,,REGIONAL,REGIONAL,IDIS,PROYECTO,MEC-001
207c6774-dbbe-439c-8f50-dd01619892d7,40034228,40034228-2021,,,,"REPOSICIÓN VEREDAS SECTOR URBANO, COMUNA DE PORTEZUELO",40034228,FRIL,EJECUCIÓN,MUNICIPIO,,ITATA,PORTEZUELO,IDIS,PROYECTO,MEC-001
b3a9e144-afe4-429f-97e4-b9a430c6fe33,40034233,40034233-2021,,,,CONSTRUCCIÓN 64 NICHOS CEMENTERIO MUNICIPAL DE QUILLÓN,40034233,FRIL,EJECUCIÓN,MUNICIPIO,,DIGUILLÍN,QUILLÓN,IDIS,PROYECTO,MEC-001
61bf106a-74b9-46e9-82e4-fbd43293e3a9,40034244,40034244-2021,,,,"ACTUALIZACIÓN PLAN REGULADOR, ZONA TÍPICA Y PLANOS DE DETALLE DE COBQUECURA",40034244,MIDESO,EJECUCIÓN,MUNICIPIO,,ITATA,COBQUECURA,IDIS,PROYECTO,MEC-001
8e61b321-0fe1-4ba1-a868-b8e5f7a6a908,40034258,40034258-2021,,,,"CONSTRUCCIÓN REFUGIOS PEATONALES RURALES, COMUNA COELEMU",40034258,FRIL,EJECUCIÓN,MUNICIPIO,,ITATA,COELEMU,IDIS,PROYECTO,MEC-001
a3a21b3e-af9b-4b9d-bfd9-a2e6819c664e,40034261,40034261-2021,,,,CONSTRUCCIÓN PLAZA DE JUEGOS SECTOR MAGDALENA COELEMU,40034261,FRIL,EJECUCIÓN,MUNICIPIO,,ITATA,COELEMU,IDIS,PROYECTO,MEC-001
348fffbf-b9ea-4a70-b4cf-3d3a78704074,40034268,40034268-2021,,,,"CONSTRUCCIÓN ALCANTARILLAS RURALES DIVERSOS SECTORES, COMUNA DE PORTEZUELO",40034268,FRIL,EJECUCIÓN,MUNICIPIO,,ITATA,PORTEZUELO,IDIS,PROYECTO,MEC-001
cd60a1c8-1642-4f79-a479-f197a936e6a7,40034276,40034276-2021,,,,"CONSTRUCCIÓN SISTEMA DE RIEGO BANDEJÓN CENTRAL AVDA O'HIGGINS, CHILLAN VIEJO",40034276,FRIL,EJECUCIÓN,MUNICIPIO,,DIGUILLÍN,CHILLÁN VIEJO,IDIS,PROYECTO,MEC-001
e5c77729-463e-4880-a70f-4780534dec3c,40034280,40034280-2021,,,,NORMALIZACIÓN PRIMERA CÍA DE BOMBEROS DE LA COMUNA DE PORTEZUELO,40034280,FRIL,EJECUCIÓN,MUNICIPIO,,ITATA,PORTEZUELO,IDIS,PROYECTO,MEC-001
53f37612-4da5-4a9c-8a78-2d6f91077ba6,40034288,40034288-2021,,,,"CONSTRUCCIÓN PUENTE LAS NIÑAS, COMUNA DE COBQUECURA",40034288,FRIL,EJECUCIÓN,MUNICIPIO,,ITATA,COBQUECURA,IDIS,PROYECTO,MEC-001
84f58df9-7d4d-4f0d-96ad-6f44be9c1a47,40034290,40034290-2021,,,,"REPOSICIÓN TORRE Y ESTANQUE APR SECTOR SAN VICENTE, COMUNA DE ÑIQUÉN",40034290,FRIL,EJECUCIÓN,MUNICIPIO,,PUNILLA,ÑIQUÉN,IDIS,PROYECTO,MEC-001
d02eb5a7-025a-4d8e-ae3d-612a3bed7688,40034293,40034293-2022,,,,"MEJORAMIENTO DE AREAS VERDES EN POBLACIÓN EL ROBLE, COMUNA DE YUNGAY",40034293,FRIL,EJECUCIÓN,MUNICIPIO,,DIGUILLÍN,YUNGAY,IDIS,PROYECTO,MEC-001
9ff5add9-7166-4e06-943d-b19fd0211001,40034296,40034296-2021,,,,"CONSTRUCCIÓN CIERRE PERIMETRAL Y HABILITACIÓN TERRENO DESTINADO A BOMBEROS, YUNGAY",40034296,FRIL,EJECUCIÓN,MUNICIPIO,,DIGUILLÍN,YUNGAY,IDIS,PROYECTO,MEC-001
cab775e9-4b3a-44dc-99d5-b7cc983e1326,40034297,40034297-2021,,,,"CONSTRUCCIÓN TORRE Y ESTANQUE APR HUENUTIL DEL PEUMO, COMUNA DE ÑIQUEN",40034297,FRIL,EJECUCIÓN,MUNICIPIO,,PUNILLA,ÑIQUÉN,IDIS,PROYECTO,MEC-001
c6a004bf-b2bd-419d-b308-80fe65932ccd,40034300,40034300-2021,,,,MEJORAMIENTO BAÑOS PÚBLICOS ESTADIO MUNICIPAL DE YUNGAY,40034300,FRIL,EJECUCIÓN,MUNICIPIO,,DIGUILLÍN,YUNGAY,IDIS,PROYECTO,MEC-001
826b5d2d-c6b5-4e0a-917c-733692579f52,40034302,40034302-2021,,,,"AMPLIACIÓN CESFAM CAMPANARIO, COMUNA DE YUNGAY",40034302,FRIL,EJECUCIÓN,MUNICIPIO,,DIGUILLÍN,YUNGAY,IDIS,PROYECTO,MEC-001
4271afeb-f3c5-461b-9e43-05cf591f7a92,40034310,40034310-2021,,,,CONSTUCCIÓN CAMARINES ESTADIO FISCAL DE QUIRIHUE,40034310,FRIL,EJECUCIÓN,MUNICIPIO,,ITATA,QUIRIHUE,IDIS,PROYECTO,MEC-001
2f2c6486-5e1e-4143-950b-725426b9fc8a,40034404,40034404-2022,,,,"NORMALIZACION LICEO BICENTENARIO SANTA CRUZ DE LARQUI, COMUNA BULNES",40034404,MIDESO,DISEÑO,MUNICIPIO,MUNICIP. BULNES,DIGUILLÍN,BULNES,IDIS,PROYECTO,MEC-001
0b5ad38e-a512-461c-b7e0-505c6b3e85e2,40034898,40034898-2022,,,,"CONSTRUCCION CENTRO CULTURAL, NINHUE",40034898,MIDESO,DISEÑO,MUNICIPIO,MUNICIP. NINHUE,ITATA,NINHUE,IDIS,PROYECTO,MEC-001
1d2e8a59-2668-4984-88ad-6ef9a83a0dd0,40035024,40035024-2021,40035024,,,"REPOSICIÓN CAMIÓN ALJIBE COMUNA DE SAN FABIÁN, ASOCIACIÓN PUNILLA",40035024,C-33,EJECUCIÓN,MUNICIPIO,,PUNILLA,SAN FABIÁN,IDIS,PROYECTO,MEC-001
16be3e1e-c81e-46a0-a272-a1cf898e7551,40035156,40035156-2021,,,,REVALORIZACIÓN Y TRANSFERENCIA DE LA VITIVINICULTURA DEL VALLE DEL ITATA,40035156,GLOSA 5.1,EJECUCIÓN,SECTORIAL / OTRO,,ITATA,ITATA,IDIS,PROGRAMA,MEC-005
4915d31e-91d5-4538-bb65-0ee7b8922ef1,40035204,40035204-2021,,,,"REPOSICIÓN CAMIÓN LIMPIA FOSAS, COMUNA DE SAN FABIÁN, ASOCIACIÓN PUNILLA",40035204,C-33,EJECUCIÓN,MUNICIPIO,,PUNILLA,SAN FABIÁN,IDIS,PROYECTO,MEC-001
319d67a4-478a-4097-b829-b505c1249c31,40035207,40035207-2022,,,,"CONSTRUCCION SISTEMA DE AGUA POTABLE Y ALCANTARILLADO SECTOR LAS TRANCAS, COMUNA DE PINTO",40035207,MIDESO,PREFACTIBILIDAD,MUNICIPIO,MUNICIP. PINTO,DIGUILLÍN,PINTO,IDIS,PROYECTO,MEC-001
60bf42bc-c5fa-4565-bbfe-18c9e1d43eb9,40035220,40035220-2021,,,,"ADQUISICIÓN CAMIÓN PARA TRANSFERENCIA DE RSD, COMUNA DE SAN FABIAN, ASOCIACIÓN PUNILLA",40035220,C-33,EJECUCIÓN,MUNICIPIO,,PUNILLA,SAN FABIÁN,IDIS,PROGRAMA,MEC-005
3804251b-7c8b-4013-b18b-dc9cea228df0,40035264,40035264-2021,40035264,,,"ADQUISICIÓN LABORATORIOS DE IDIOMAS LICEO BICENTENARIO SANTA CRUZ DE LARQUI, BULNES",40035264,C-33,EJECUCIÓN,MUNICIPIO,,DIGUILLÍN,BULNES,IDIS,PROYECTO,MEC-001
a6973b04-ddf8-47c5-a5aa-ed1c399a2aa7,40035346,40035346-2021,,,,REPOSICIÓN CAMÓN RECOLECTOR DE RSD COMUNA DE NINHUE,40035346,C-33,EJECUCIÓN,MUNICIPIO,,ITATA,NINHUE,IDIS,PROYECTO,MEC-001
0b4db5fa-e9a2-418f-bc31-a6449ff3c13f,40035458,40035458-2021,,,,"ADQUISICIÓN CAMIÓN LIMPIA FOSAS, COMUNA DE NINHUE",40035458,C-33,EJECUCIÓN,MUNICIPIO,,ITATA,NINHUE,IDIS,PROYECTO,MEC-001
5f50cf6c-3795-430c-a5f9-a048259c6d9d,40035735,40035735-2021,,,,ADQUISICION Y REPOSICIÓN 21 UNIDADES DE ESPECIALIDAD PARA LOS BOMBEROS DE LA REGIÓN DE ÑUBLE,40035735,C-33,EJECUCIÓN,SECTORIAL / OTRO,,REGIONAL,REGIONAL,IDIS,PROYECTO,MEC-001
36482dff-7e2b-4086-9f74-901c0a9da3a1,40035819,40035819-2023,,,,"CONSTRUCCION CONSTRUCCION MUELLE FLOTANTE LAGUNA AVENDAÑO, QUILLON",40035819,FRIL,EJECUCIÓN,MUNICIPIO,MUNICIP. QUILLÓN,DIGUILLÍN,QUILLÓN,IDIS,PROYECTO,MEC-001
2414c488-a624-4103-82ac-982592df8a3a,40035830,40035830-2021,,,,TRANSFERENCIA PROGRAMA DE GESTIÓN AMBIENTAL SUSTENTABLE DE LA RESERVA DE BIOSFERA EN LA REGIÓN,40035830,,EJECUCIÓN,SECTORIAL / OTRO,,ÑUBLE,GORE,IDIS,PROGRAMA,MEC-005
b28b8270-529e-42fc-a87b-6bfb4161bed4,40035831,40035831-2021,,,,"TRANSFERENCIA INNOVACIÓN PRODUCTIVA Y DESARROLLO TERRITORIAL DE LA RESERVA DE LA BIÓSFERA, UDEC",40035831,,EJECUCIÓN,SECTORIAL / OTRO,,ÑUBLE,GORE,IDIS,PROGRAMA,MEC-005
49c0f339-3db3-4b9b-8d25-9254ee8ee830,40035832,40035832-2021,,,,"TRANSFERENCIA POTENCIANDO EL DESARROLLO SOSTENIBLE DE LA COSTA DE ÑUBLE: GESTIÓN INTEGRADA, EN",40035832,,EJECUCIÓN,SECTORIAL / OTRO,,ÑUBLE,GORE,IDIS,PROGRAMA,MEC-005
881c93c6-0385-40d8-8238-d6d166466f05,40035950,40035950-2022,40035950,,,REPOSICION EDIFICIO CONSISTORIAL NINHUE,40035950,MIDESO,DISEÑO,MUNICIPIO,MUNICIP. NINHUE,ITATA,NINHUE,IDIS,PROYECTO,MEC-001
21602a15-6f1b-4124-98a0-f4acadbfc91a,40036127,40036127-2022,,,,DIFUSION PROMOCION INTERNACIONAL DE LA OFERTA EXPORTABLE DE ÑUBLE,40036127,GLOSAS COMUNES,EJECUCIÓN,SECTORIAL / OTRO,PROCHILE,REGIONAL,REGIONAL,IDIS,PROGRAMA,MEC-005
1c68b4c4-12c4-4d11-9163-68d37d710609,40036215,40036215-2022,,,,TRANSFERENCIA DESARROLLO Y FORTALECIMIENTO DEL EMPRENDIMIENTO EN TURISMO Y AGROALIMENTARIO,40036215,GLOSA 5.1,EJECUCIÓN,SECTORIAL / OTRO,ADRA,REGIONAL,REGIONAL,IDIS,PROGRAMA,MEC-005
36ca4a84-8f26-4d3a-a4e2-cbdf6f67fff6,40036474,40036474-2022,,,,"CONSTRUCCION PATINÓDROMO MUNICIPAL, QUILLÓN",40036474,MIDESO,DISEÑO,MUNICIPIO,MUNICIP. QUILLÓN,DIGUILLÍN,QUILLÓN,IDIS,PROYECTO,MEC-001
6d0a2720-14a9-4e28-b141-ad203bf49540,40036490,40036490-2022,,,,"ADQUISICION EXCAVADORA Y CAMA BAJA MUNICIPALIDAD DE COIHUECO, ASOC PUNILLA",40036490,C-33,EJECUCIÓN,MUNICIPIO,MUNICIP. COIHUECO,PUNILLA,COIHUECO,IDIS,PROYECTO,MEC-001
fa7e82df-2541-4d70-a986-a77c6ded0fd7,40036548,40036548-2022,,,,"ADQUISICION CAMION ALZA HOMBRE, COMUNA DE COIHUECO, ASOCIACION PUNILLA",40036548,C-33,EJECUCIÓN,MUNICIPIO,MUNICIP. COIHUECO,PUNILLA,COIHUECO,IDIS,PROYECTO,MEC-001
d80cbe6b-c86c-478b-83aa-52020951833e,40036580,40036580-2023,,,,CONSTRUCCION PARQUE DE CALISTENIA STREETWORKOUT QUILLÓN,40036580,FRIL,EJECUCIÓN,MUNICIPIO,MUNICIP. QUILLÓN,DIGUILLÍN,QUILLÓN,IDIS,PROYECTO,MEC-001
f9840533-3725-4e4c-8bf2-b57e7fd6472f,40036614,40036614-2022,,,,REPOSICION BIBLIOTECA MUNICIPAL COMUNA DE NINHUE,40036614,MIDESO,DISEÑO,MUNICIPIO,MUNICIP. NINHUE,ITATA,NINHUE,IDIS,PROYECTO,MEC-001
bd4c14b9-a430-4c63-8961-17cc443dfbda,40036642,40036642-2022,,,,REPOSICION EQUIPOS DE ALUMBRADO PUBLICO COMUNA DE QUIRIHUE,40036642,MIDESO,EJECUCIÓN,MUNICIPIO,MUNICIP. QUIRIHUE,ITATA,QUIRIHUE,IDIS,PROYECTO,MEC-001
434b7153-5d61-48df-be09-17452ab91d62,40036654,40036654-2022,,,,"ADQUISICION RODILLO COMPACTADOR, MOTONIVELADORA Y CAMIÓN TOLVA 15M3 6X4, CHILLÁN",40036654,C-33,EJECUCIÓN,MUNICIPIO,MUNICIP. CHILLÁN,DIGUILLÍN,CHILLÁN,IDIS,PROYECTO,MEC-001
e9adf762-07c0-4f99-b442-12106760ce4f,40036667,40036667-2022,,,,"ADQUISICION TRES CAMIONES LIMPIAFOSAS PARA LAS COMUNAS DE NINHUE, SAN NICOLÁS Y QUILLÓN",40036667,C-33,EJECUCIÓN,MUNICIPIO,GORE-DIDESO,ITATA,ITATA,IDIS,PROYECTO,MEC-001
bd3c3a34-a5e5-48b9-8e91-9318dbfc7241,40036794,40036794-2022,,,,ADQUISICION ADQUISICIÓN DE RODILLO COMPACTADOR MÁS CARRO DE ARRASTRE COMUNA DE QUILLÓN,40036794,C-33,EJECUCIÓN,MUNICIPIO,MUNICIP. QUILLÓN,DIGUILLÍN,QUILLÓN,IDIS,PROYECTO,MEC-001
e7d43461-a37f-4fc2-8353-f89d744fa543,40036838,40036838-2022,,,,ADQUISICION TRACTOR COMUNA DE COBQUECURA,40036838,C-33,EJECUCIÓN,MUNICIPIO,MUNICIP. COBQUECURA,ITATA,COBQUECURA,IDIS,PROYECTO,MEC-001
77c3d2d2-431c-45ce-907c-66b9d72c7d29,40036902,40036902-2022,40036902,,,"CONSERVACION VEREDAS POBLACIÓN SIMÓN BOLÍVAR, CHILLÁN",40036902,C-33,EJECUCIÓN,MUNICIPIO,MUNICIP. CHILLÁN,DIGUILLÍN,CHILLÁN,IDIS,PROYECTO,MEC-001
01148476-851c-4f24-89c8-f68b71e801ef,40036905,40036905-2022,,,,"CONSERVACION VEREDAS VILLA MAGISTERIO, CHILLÁN",40036905,C-33,EJECUCIÓN,MUNICIPIO,MUNICIP. CHILLÁN,DIGUILLÍN,CHILLÁN,IDIS,PROYECTO,MEC-001
fd66fa4d-5c86-44b2-b606-a52440f09893,40037071,40037071-2022,,,,REPOSICION BIBLIOTECA MUNICIPAL DE QUILLON,40037071,MIDESO,DISEÑO,MUNICIPIO,MUNICIP. QUILLÓN,DIGUILLÍN,QUILLÓN,IDIS,PROYECTO,MEC-001
d874fb14-278c-4f7f-91f6-c02aec99681e,40037303,40037303-2022,40037303,,,ADQUISICION CAMION ALJIBE COMUNA DE QUILLON,40037303,C-33,EJECUCIÓN,MUNICIPIO,MUNICIP. QUILLÓN,DIGUILLÍN,QUILLÓN,IDIS,PROYECTO,MEC-001
681c1479-1ce1-4786-ba37-8c12385010d4,40037329,40037329-2022,,,,"REPOSICION DE ESTANQUE SEMIENTERRADO Y OBRAS COMPLEMENTARIAS APR HERNAN BRAÑAS, TREHUACO",40037329,FRIL,EJECUCIÓN,MUNICIPIO,MUNICIP. TREHUACO,ITATA,TREGUACO,IDIS,PROYECTO,MEC-001
40ea32bb-5487-47ba-9eb2-b5f80601d878,40037349,40037349-2022,40037349,,,"REPOSICION CENTRO DE SALUD FAMILIAR DR. DAVID BENAVENTE, NINHUE",40037349,MIDESO,DISEÑO,MUNICIPIO,MUNICIP. NINHUE,ITATA,NINHUE,IDIS,PROYECTO,MEC-001
e098bbfb-e819-456c-9a07-cb28022cce92,40037404,40037404-2022,40037404,,,"ADQUISICION CAMIONETA PRIMERA INTERVENCION, COMUNA DE QUILLON",40037404,C-33,EJECUCIÓN,MUNICIPIO,MUNICIP. QUILLÓN,DIGUILLÍN,QUILLÓN,IDIS,PROYECTO,MEC-001
362cfcc6-4943-49ef-90ab-88c7c1f811e9,40037472,40037472-2022,,,,ADQUISICION RETROEXCAVADORA COMUNA DE RANQUIL,40037472,C-33,EJECUCIÓN,MUNICIPIO,MUNICIP. RÁNQUIL,ITATA,RÁNQUIL,IDIS,PROYECTO,MEC-001
ad42567f-a3a7-4943-a516-4240afdac1e3,40037476,40037476-2022,40037476,,,ADQUISICION MOTONIVELADORA COMUNA DE RANQUIL,40037476,C-33,EJECUCIÓN,MUNICIPIO,MUNICIP. RÁNQUIL,ITATA,RÁNQUIL,IDIS,PROYECTO,MEC-001
7fc93b1a-0c55-4eef-aa8d-fa9be223719c,40037635,40037635-2022,40037635,,,"ADQUISISCION RECOLECTOR DE RESIDUOS DOMICILIARIOS, COMUNA DE SAN IGNACIO",40037635,C-33,EJECUCIÓN,MUNICIPIO,MUNICIP. SAN IGNACIO,DIGUILLÍN,SAN IGNACIO,IDIS,PROYECTO,MEC-001
ae6ff320-b1e7-4259-a548-25718d9d23e6,40037679,40037679-2021,,,,"ADQUISICION CAMIONETA DEPTO DE SALUD, COMUNA DE RANQUIL",40037679,,EJECUCIÓN,MUNICIPIO,,ITATA,RÁNQUIL,IDIS,PROYECTO,MEC-001
0098b1af-a994-427b-b2b1-43cebf38613a,40037763,40037763-2022,40037763,,,"ADQUISICION UN MINIBUS PARA TRASLADO DE PACIENTES, COMUNA DE SAN IGNACIO",40037763,C-33,EJECUCIÓN,MUNICIPIO,MUNICIP. SAN IGNACIO,DIGUILLÍN,SAN IGNACIO,IDIS,PROYECTO,MEC-001
5ecff072-3f8b-4a54-8596-e2fbebfb2a30,40037764,40037764-2022,,,,"ADQUISICION BUS PARA TRASLADO ESTUDIANTES, COMUNA DE SAN IGNACIO",40037764,C-33,EJECUCIÓN,MUNICIPIO,MUNICIP. SAN IGNACIO,DIGUILLÍN,SAN IGNACIO,IDIS,PROYECTO,MEC-001
607bd4ac-e4e4-4895-a246-608590427921,40037767,40037767-2022,,,,"CONSERVACION CAMINO BASICO RUTA N-14-O, COMUNA DE COELEMU, REGION DE ÑUBLE",40037767,C-33,EJECUCIÓN,SECTORIAL / OTRO,MOP-VIALIDAD,ITATA,COELEMU,IDIS,PROYECTO,MEC-001
ba2fa6c4-b169-4034-90dd-6574569be4b5,40037858,40037858-2022,,,,"TRANSFERENCIA PROGRAMA DE APOYO A NIÑAS, NIÑOS Y ADOLESCENTES CON TEA DE ÑUBLE",40037858,GLOSA 5.1,EJECUCIÓN,SECTORIAL / OTRO,GORE-DIDESO,REGIONAL,REGIONAL,IDIS,PROGRAMA,MEC-005
c783f4db-2fe0-4659-8f45-c2330ddf3ab2,40037864,40037864-2022,,,,CONSERVACION SEQUIA 2022-2023 REGION ÑUBLE,40037864,MIDESO,EJECUCIÓN,SECTORIAL / OTRO,MOP,REGIONAL,REGIONAL,IDIS,PROYECTO,MEC-001
91661e8c-5668-44b0-8450-b2fc89535c99,40037866,40037866-2023,,,,"MEJORAMIENTO INTERNADO ESC. JOSE TOHA SOLDEVILLA, RECINTO, COMUNA DE PINTO",40037866,FRIL,EJECUCIÓN,MUNICIPIO,MUNICIP. PINTO,DIGUILLÍN,PINTO,IDIS,PROYECTO,MEC-001
d6490a5d-3928-4c98-9937-9dad6eb76723,40037931,40037931-2022,,,,HABILITACION UNIDAD DE BIOLOGIA MOLECULAR HOSPITAL SAN CARLOS,40037931,MIDESO,DISEÑO,SECTORIAL / OTRO,S.SALUD ÑUBLE,PUNILLA,SAN CARLOS,IDIS,PROYECTO,MEC-001
