id,nombre_original,nombre_normalizado,nombre_nlp,rut,fuente_original,tipo_institucion
d8c89f36-9255-4f1d-96bc-fbaab231b5e2,"ESCUELA DE FUTBOL SOCIAL Y CULTURAL ""BALÓN DORADO""","ESCUELA DE FUTBOL SOCIAL Y CULTURAL ""BALÓN DORADO""",ESCUELA FUTBOL BALÓN DORADO,65.177.346-6,PROGS,OTROS
bdbd0538-78b8-45bd-9c27-6e45095b4301,AGRUPACIÓN DE MUJERES LAS FRUTILLITAS DE LA GLORIA,AGRUPACIÓN DE MUJERES LAS FRUTILLITAS DE LA GLORIA,AGRUPACIÓN MUJERES FRUTILLITAS GLORIA,65.099.084-6,PROGS,OSC
87f97c93-58f0-40ed-84e9-4f51cd65e77e,AGRUPACIÓN DE MUJERES LAS DULZURAS DE LAS HIGUERAS,AGRUPACIÓN DE MUJERES LAS DULZURAS DE LAS HIGUERAS,AGRUPACIÓN MUJERES DULZURAS HIGUERAS,65.077.792-1,PROGS,OSC
653accdf-e286-42a2-97cb-2c1ef5cbe153,AGRUPACION DE MUJERES GUILLERMINA ACEVEDO CARDENAS,AGRUPACION DE MUJERES GUILLERMINA ACEVEDO CARDENAS,AGRUPACION MUJERES GUILLERMINA ACEVEDO CARDENAS,65.759.610-8,PROGS,OSC
b12921ed-a9e8-42e6-ba19-8c2fccd0a1dd,JUNTA DE VECINOS CONJUNTO HABITACIONAL RIO CHILLAN,JV CONJUNTO HABITACIONAL RIO CHILLAN,JV CONJUNTO HABITACIONAL RIO CHILLAN,65.017.405-4,PROGS,OSC
ca42065e-5e99-4c71-b4ac-f1294384ed2b,COMITÉ DE ADELANTO Y DESARROLLO VILLA FERNANDO MAY,COMITÉ DE ADELANTO Y DESARROLLO VILLA FERNANDO MAY,COMITÉ ADELANTO DESARROLLO VILLA FERNANDO MAY,65.071.459-8,PROGS,OSC
92daf206-8991-406d-b0b1-e111e6447983,COMITE DE AGUA POTABLE RURAL DE CANCHA LOS BOTONES,COMITE DE AGUA POTABLE RURAL DE CANCHA LOS BOTONES,COMITE AGUA POTABLE RURAL CANCHA BOTONES,65.996.600-K,PROGS,OSC
7f8e24da-73e2-47e0-826c-8f167eaff7e1,CENTRO INTEGRAL DE DISCAPACIDTADOS LUZ Y ESPERANZA,CENTRO INTEGRAL DE DISCAPACIDTADOS LUZ Y ESPERANZA,CENTRO INTEGRAL DISCAPACIDTADOS LUZ ESPERANZA,74.473.900-4,PROGS,OTROS
2ddd9cae-569c-40e6-a9bb-73cb02b2d197,TALLER FEMENINO LAS GOLONDRINAS SECTOR NUEVA ALDEA,TALLER FEMENINO LAS GOLONDRINAS SECTOR NUEVA ALDEA,TALLER FEMENINO GOLONDRINAS SECTOR NUEVA ALDEA,75.966.960-6,PROGS,OSC
0736afaa-2efb-4f98-9e36-a7a6aa373073,GRUPO DE ADULTO MAYOR EL PROGRESO SECTOR MANZANAL,GRUPO DE ADULTO MAYOR EL PROGRESO SECTOR MANZANAL,GRUPO PROGRESO SECTOR MANZANAL,65.028.916-1,PROGS,OTROS
5cbb98df-0df1-4a76-b90e-ef5c533ab3e6,CLUB DE ADULTO MAYOR LOS QUINCEAÑEROS DE MAITENES,CLUB DE ADULTO MAYOR LOS QUINCEAÑEROS DE MAITENES,CLUB QUINCEAÑEROS MAITENES,65.290.850-0,PROGS,OSC
4f3be399-4968-4944-ae0e-0c7f59efae9d,"CLUB ADULTO MAYOR ""ARCOIRIS DE NUESTRO ATARDECER""","CLUB ADULTO MAYOR ""ARCOIRIS DE NUESTRO ATARDECER""",CLUB ARCOIRIS NUESTRO ATARDECER,65.179.835-3,PROGS,OSC
c902480e-a714-4ae6-9cb8-79dc8074b605,CLUB DEL ADULTO MAYOR LAS ENCINAS DE LLAHUIMÁVIDA,CLUB DEL ADULTO MAYOR LAS ENCINAS DE LLAHUIMÁVIDA,CLUB ENCINAS LLAHUIMÁVIDA,65.097.245-7,PROGS,OSC
514c7102-3e63-41b3-9872-1bfbd778dece,ACADEMIA DE ADULTO MAYOR REVIVIR TANILVORO CENTRO,ACADEMIA DE ADULTO MAYOR REVIVIR TANILVORO CENTRO,ACADEMIA REVIVIR TANILVORO CENTRO,65.030.810-7,PROGS,OTROS
e92e18d0-4eda-43a0-99a6-29abe368257a,CLUB DEL ADULTO MAYOR BLANCA AURORA DE SAN MIGUEL,CLUB DEL ADULTO MAYOR BLANCA AURORA DE SAN MIGUEL,CLUB BLANCA AURORA SAN MIGUEL,65.585.950-0,PROGS,OSC
ab6f98e8-a776-44c2-b76e-af5fc9a9bdbe,CLUB DEPORTIVO EL LUCERO DE LA UNIDAD VECINAL N12,CD EL LUCERO DE LA UNIDAD VECINAL N12,CD LUCERO UNIDAD N12,65.221.861-K,PROGS,OSC
983759bb-a083-4e25-a749-64c1384f565c,CENTRO GENERAL DE PADRES Y APODERADOS SELVA NEGRA,CENTRO GENERAL DE PADRES Y APODERADOS SELVA NEGRA,CENTRO PADRES APODERADOS SELVA NEGRA,65.261.490-6,PROGS,OTROS
2da43c45-7368-4685-ae32-a8ed0f729df0,CENTRO DE PADRES Y APODERADOS LICEO MANUEL BULNES,CENTRO DE PADRES Y APODERADOS LICEO MANUEL BULNES,CENTRO PADRES APODERADOS LICEO MANUEL BULNES,65.595.280-2,PROGS,OSC
69e8c9e6-9d63-481a-b2b5-0b63314e3825,CLUB DEPORTIVO CAUPOLICAN DE SAN CARLOS DE ITIHUE,CD CAUPOLICAN DE SAN CARLOS DE ITIHUE,CD CAUPOLICAN SAN CARLOS ITIHUE,71.315.800-3,PROGS,OSC
1e729245-3e11-4eeb-8018-2316564e7634,ASOCIACIÓN COMUNAL DE CLUBES DEPORTIVOS DE BULNES,ASOCIACIÓN COMUNAL DE CLUBES DEPORTIVOS DE BULNES,ASOCIACIÓN COMUNAL CLUBES DEPORTIVOS BULNES,72.305.300-5,PROGS,OSC
d17f09c4-f3fd-4cdc-a41d-d091f4acf94f,ASOCIACIÓN DE FUTBOL CULTURAL Y DEPORTIVA COIQUEN,ASOCIACIÓN DE FUTBOL CULTURAL Y DEPORTIVA COIQUEN,ASOCIACIÓN FUTBOL COIQUEN,65.015.642-0,PROGS,OSC
94a2e078-9e90-4a6e-95f6-55db87165137,AGRUPACIÓN DE MUJERES LAS EMPRENDEDORAS DE QUIRAO,AGRUPACIÓN DE MUJERES LAS EMPRENDEDORAS DE QUIRAO,AGRUPACIÓN MUJERES EMPRENDEDORAS QUIRAO,65.083.869-6,PROGS,OSC
1d1f2597-a5df-408f-a90b-862172babe3a,COMITÉ AVES CAMPESINAS JUNTAS VOLAREMOS MAYULERMO,COMITÉ AVES CAMPESINAS JUNTAS VOLAREMOS MAYULERMO,COMITÉ AVES CAMPESINAS JUNTAS VOLAREMOS MAYULERMO,65.212.977-3,PROGS,OSC
6e416d91-5a1a-4c63-9fe9-4f728d594488,COMITE DE DAMAS LAS MARGARITAS DE MAGDALENA ALTO.,COMITE DE DAMAS LAS MARGARITAS DE MAGDALENA ALTO.,COMITE DAMAS MARGARITAS MAGDALENA ALTO,65.996.870-3,PROGS,OSC
7b466661-ee39-487b-b2c0-bc2ec24d976f,COMITÉ DE AGUA POTABLE SOLUCIÓN COLECTIVA TALHUÁN,COMITÉ DE AGUA POTABLE SOLUCIÓN COLECTIVA TALHUÁN,COMITÉ AGUA POTABLE SOLUCIÓN COLECTIVA TALHUÁN,65.215.999-0,PROGS,OSC
6f3e2d7a-f0e9-4bf8-bcef-8b809a0f0f0b,JUNTA DE VECINOS GUARILIHUE CENTRO SECTOR ESTADIO,JV GUARILIHUE CENTRO SECTOR ESTADIO,JV GUARILIHUE CENTRO SECTOR ESTADIO,65.211.033-9,PROGS,OSC
3ff0aa49-7fb2-475e-99f5-3cb521759829,SEGUNDA COMPAÑÍA DEL CUERPO DE BOMBEROS DE YUNGAY,SEGUNDA COMPAÑÍA DEL CUERPO DE BOMBEROS DE YUNGAY,SEGUNDA COMPAÑÍA CUERPO BOMBEROS YUNGAY,65.517.910-0,PROGS,OSC
7c9e1cc4-69ed-4939-a172-8b2e67557be4,COMITÉ DE ADELANTO Y DESARROLLO RURAL LA VICTORIA,COMITÉ DE ADELANTO Y DESARROLLO RURAL LA VICTORIA,COMITÉ ADELANTO DESARROLLO RURAL VICTORIA,65.202.565-K,PROGS,OSC
7377bc4f-4b5c-4a0d-beba-2a2eb6679827,COMITE DE AGUA POTABLE RURAL EL CENTRO CEMENTERIO,COMITE DE AGUA POTABLE RURAL EL CENTRO CEMENTERIO,COMITE AGUA POTABLE RURAL CENTRO CEMENTERIO,71.177.900-0,PROGS,OSC
244a4517-58b0-4a8c-a35a-022d4d0919f2,COMITÉ DE AGUA POTABLE RURAL VILLA LAS ARAUCARIAS,COMITÉ DE AGUA POTABLE RURAL VILLA LAS ARAUCARIAS,COMITÉ AGUA POTABLE RURAL VILLA ARAUCARIAS,65.391.440-1,PROGS,OSC
647aeeb0-1ce1-42e4-8eef-7a4a34c221c5,JUNTA DE VECINOS VILLA LOS CAMPOS DE DOÑA BEATRIZ,JV VILLA LOS CAMPOS DE DOÑA BEATRIZ,JV VILLA CAMPOS DOÑA BEATRIZ,75.158.400-8,PROGS,OSC
b5d33051-b1f3-4120-9f27-0f316d290d7c,COMITE DE ADELANTO Y DESARROLLO VILLA LAS ACACIAS,COMITE DE ADELANTO Y DESARROLLO VILLA LAS ACACIAS,COMITE ADELANTO DESARROLLO VILLA ACACIAS,65.073.506-4,PROGS,OSC
8026c4ec-4090-45f5-8c8e-1d8c2a4c09dc,CLUB DE ADULTO MAYOR LOS AÑOS DORADOS DE COELEMU,CLUB DE ADULTO MAYOR LOS AÑOS DORADOS DE COELEMU,CLUB AÑOS DORADOS COELEMU,75.402.558-0,PROGS,OSC
82928d14-0714-480f-a76f-cbf1ba2f9242,CLUB DE ADULTO MAYOR PADRE JUAN CARLOS RODRÍGUEZ,CLUB DE ADULTO MAYOR PADRE JUAN CARLOS RODRÍGUEZ,CLUB PADRE JUAN CARLOS RODRÍGUEZ,74.271.600-7,PROGS,OSC
a60c29d6-274f-48f3-a651-83e8acea8be1,"CLUB DEL ADULTO MAYOR""LAS ARAÑITAS LABORIOSAS S""","CLUB DEL ADULTO MAYOR""LAS ARAÑITAS LABORIOSAS S""",CLUB ARAÑITAS LABORIOSAS S,65.074.092-0,PROGS,OSC
1a7c179a-3130-4381-a365-2edf0a4763bc,JUNTA DE VECINOS LA QUEBRADA PACHAGUA U.V Nº16-R,JV LA QUEBRADA PACHAGUA U.V Nº16-R,JV QUEBRADA PACHAGUA U V Nº16 R,75.314.900-7,PROGS,OSC
a49c122f-6c78-497a-a9e0-3860566133ab,GRUPO CULTURAL SOCIAL RECREATIVO AMIGOS DE LA FE,GRUPO CULTURAL SOCIAL RECREATIVO AMIGOS DE LA FE,GRUPO AMIGOS FE,65.177.861-1,PROGS,OTROS
b620428c-eb00-48cf-a875-0edd70e22c15,AGRUPACIÓN DE DISCAPACITADOS TU DERECHO Y EL MÍO,AGRUPACIÓN DE DISCAPACITADOS TU DERECHO Y EL MÍO,AGRUPACIÓN DISCAPACITADOS TU DERECHO MÍO,65.022.170-2,PROGS,OSC
4c1daec7-79b9-43ee-8bf9-aeadc56d5239,"CLUB DEPORTIVO, SOCIAL Y CULTURAL DOÑA FRANCISCA","CLUB DEPORTIVO, SOCIAL Y CULTURAL DOÑA FRANCISCA",CLUB DOÑA FRANCISCA,65.227.699-7,PROGS,OSC
2c1581ae-895a-476c-b1f4-69af071eb16d,AGRUPACIÓN DE MUJERES LAS ESTRELLITAS DE LONQUÉN,AGRUPACIÓN DE MUJERES LAS ESTRELLITAS DE LONQUÉN,AGRUPACIÓN MUJERES ESTRELLITAS LONQUÉN,65.163.487-3,PROGS,OSC
0e1a0d5f-3392-4a89-b09f-475279e33069,FUNDACIÓN DEPORTIVA SOCIAL Y CULTURAL SAN FABIÁN,FUNDACIÓN DEPORTIVA SOCIAL Y CULTURAL SAN FABIÁN,FUNDACIÓN SAN FABIÁN,65.185.773-2,PROGS,OSC
f760b015-4d80-4d96-b368-53080788cb8b,COMITE DE AGUA POTABLE RURAL SAN LUIS MILLAUQUEN,COMITE DE AGUA POTABLE RURAL SAN LUIS MILLAUQUEN,COMITE AGUA POTABLE RURAL SAN LUIS MILLAUQUEN,65.055.517-1,PROGS,OSC
30107c6b-9088-496e-a4ba-f8d602a49497,COMITÉ DE ADELANTO Y DESARROLLO GABRIELA MISTRAL,COMITÉ DE ADELANTO Y DESARROLLO GABRIELA MISTRAL,COMITÉ ADELANTO DESARROLLO GABRIELA MISTRAL,65.189.608-8,PROGS,OSC
f75bf338-1605-4332-bac7-86eedccc6da8,COMITÉ DE ADELANTO Y DESARROLLO POB. LA ARAUCANA,COMITÉ DE ADELANTO Y DESARROLLO POB. LA ARAUCANA,COMITÉ ADELANTO DESARROLLO POB ARAUCANA,65.466.070-0,PROGS,OSC
3253337e-f391-47de-9042-652b16ccb3bc,COMITÉ DE VIVIENDA Y URBANIZACIÓN YUNGAY ORIENTE,COMITÉ DE VIVIENDA Y URBANIZACIÓN YUNGAY ORIENTE,COMITÉ VIVIENDA URBANIZACIÓN YUNGAY ORIENTE,75.926.200-K,PROGS,OSC
94ac83b5-1e6b-4eef-a0ff-af89a407267e,COMITÉ DE DUEÑAS DE CASA LAS ORQUIDEAS DE PEMUCO,COMITÉ DE DUEÑAS DE CASA LAS ORQUIDEAS DE PEMUCO,COMITÉ DUEÑAS CASA ORQUIDEAS PEMUCO,65.042.691-6,PROGS,OSC
e32ecd27-488f-4148-8bd6-c3d8977c56f2,JUNTA DE VECINOS SARITA GAJARDO Y AMPLIACIONES 2,JV SARITA GAJARDO Y AMPLIACIONES 2,JV SARITA GAJARDO AMPLIACIONES 2,75.396.700-1,PROGS,OSC
20e6b8d4-8122-4f7d-b044-e257fc42e434,GRUPO DE ADULTO MAYOR NUESTRA SEÑORA DEL CARMEN,GRUPO DE ADULTO MAYOR NUESTRA SEÑORA DEL CARMEN,GRUPO NUESTRA SEÑORA CARMEN,65.940.030-8,PROGS,OTROS
e8e6c86d-a208-4d6f-8b3d-cd6aab43db86,CLUB DE ADULTO MAYOR LOS AÑOS DORADOS DE NINHUE,CLUB DE ADULTO MAYOR LOS AÑOS DORADOS DE NINHUE,CLUB AÑOS DORADOS NINHUE,75.987.590-7,PROGS,OSC
e355fd7b-4612-4680-9337-1cd934d67bd3,CLUB DE ADULTO MAYOR SUEÑOS CUMPLIDOS DE PANGUE,CLUB DE ADULTO MAYOR SUEÑOS CUMPLIDOS DE PANGUE,CLUB SUEÑOS CUMPLIDOS PANGUE,65.025.672-7,PROGS,OSC
f50e08f5-d10d-4c95-b0ae-9a71551d68e9,CLUB DE ADULTO MAYOR NUEVO AMANECER DE PEÑAFLOR,CLUB DE ADULTO MAYOR NUEVO AMANECER DE PEÑAFLOR,CLUB NUEVO AMANECER PEÑAFLOR,75.425.600-1,PROGS,OSC
a6259ac0-9576-4d26-8f9d-0505d894cb0d,CLUB DE ADULTO MAYOR LOS AÑOS DORADOS DE CHACAY,CLUB DE ADULTO MAYOR LOS AÑOS DORADOS DE CHACAY,CLUB AÑOS DORADOS CHACAY,65.050.348-1,PROGS,OSC
9d3199a4-048e-415e-8947-2967c1437fd8,CLUB DEPORTIVO ADULTO MAYOR LUCERO DEL AMANECER,CD ADULTO MAYOR LUCERO DEL AMANECER,CD LUCERO AMANECER,65.048.732-K,PROGS,OSC
389d50e5-21a7-4eef-942d-4b7dffa75e51,"AGRUPACION SOCIAL Y CULTURAL ""CUATRO ELEMENTOS""","AGRUPACION SOCIAL Y CULTURAL ""CUATRO ELEMENTOS""",AGRUPACION CUATRO ELEMENTOS,65.382.170-0,PROGS,OSC
cb4471ef-a993-4077-b813-f6093d4b9605,CENTRO DE PADRES ESCUELA ROSARIO CHACÓN BERRIOS,CENTRO DE PADRES ESCUELA ROSARIO CHACÓN BERRIOS,CENTRO PADRES ESCUELA ROSARIO CHACÓN BERRIOS,65.173.934-9,PROGS,OSC
8bd888df-95b1-42c7-96e2-6d8b5821fef2,GRUPO FOLCLORICO DEL ADULTO MAYOR REMINISCENCIA,GRUPO FOLCLORICO DEL ADULTO MAYOR REMINISCENCIA,GRUPO REMINISCENCIA,65.513.650-9,PROGS,OTROS
235484d4-bf57-4963-a509-fbb9825a3cae,CLUB DEPORTIVO UNIÓN CORDILLERA MINAS DEL PRADO,CD UNIÓN CORDILLERA MINAS DEL PRADO,CD UNIÓN CORDILLERA MINAS PRADO,73.194.200-5,PROGS,OSC
160859a9-4846-4d45-b101-6ef23242ab8c,CLUB DEPORTIVO ALIANZA DE LA UNIDAD VECINAL N°6,CD ALIANZA DE LA UNIDAD VECINAL N°6,CD ALIANZA UNIDAD N°6,65.216.738-1,PROGS,OSC
646049d8-2af5-4399-a717-5b5b49744c94,COMITÉ DE MUJERES CAMPESINAS LUCHADORAS LOURDES,COMITÉ DE MUJERES CAMPESINAS LUCHADORAS LOURDES,COMITÉ MUJERES CAMPESINAS LUCHADORAS LOURDES,65.577.620-6,PROGS,OSC
0df5b3c6-c682-4faf-a294-85cf031fd6be,JUNTA DE VECINOS LA GLORIA ARRIBA INDEPENDIENTE,JV LA GLORIA ARRIBA INDEPENDIENTE,JV GLORIA ARRIBA INDEPENDIENTE,65.044.589-9,PROGS,OSC
c39f0e95-1ff6-4724-b1c4-80e6728039c8,COMITÉ DE MEJORAMIENTO Y ADELANTO LOMAS DEL SOL,COMITÉ DE MEJORAMIENTO Y ADELANTO LOMAS DEL SOL,COMITÉ MEJORAMIENTO ADELANTO LOMAS SOL,65.100.827-1,PROGS,OSC
5161f0df-3442-4a86-aef3-abdcee19dede,COMITE DE ADELANTO RENACER Y PROGRESO LAS DUMAS,COMITE DE ADELANTO RENACER Y PROGRESO LAS DUMAS,COMITE ADELANTO RENACER PROGRESO DUMAS,65.048.379-0,PROGS,OSC
ec3f4cbb-3e5e-46df-901e-bcbffd62e841,JUNTA DE VECINOS CHILLANCITO UNIDAD VECINAL N°8,JV CHILLANCITO UNIDAD VECINAL N°8,JV CHILLANCITO UNIDAD N°8,65.444.450-1,PROGS,OSC
e282ea7b-d756-4fc3-9f2e-4dfa7728ae51,CLUB DE DIABETICOS E HIPERTENSOS NUEVO AMANECER,CLUB DE DIABETICOS E HIPERTENSOS NUEVO AMANECER,CLUB DIABETICOS E HIPERTENSOS NUEVO AMANECER,65.882.450-3,PROGS,OSC
b7865811-6bf9-4b87-a943-9e08420309c0,AGRUPACIÓN DE DISCAPACITADOS CORAZÓN DE LLAHUEN,AGRUPACIÓN DE DISCAPACITADOS CORAZÓN DE LLAHUEN,AGRUPACIÓN DISCAPACITADOS CORAZÓN LLAHUEN,65.162.998-5,PROGS,OSC
7a9f3201-1e1e-476d-8002-ee007a304f53,ASOCIACIÓN DE PROPIETARIOS POBLACIÓN JUAN XXIII,ASOCIACIÓN DE PROPIETARIOS POBLACIÓN JUAN XXIII,ASOCIACIÓN PROPIETARIOS POBLACIÓN JUAN XXIII,75.411.900-4,PROGS,OSC
8d4219f1-7c2c-4d41-b934-0bb30b7c100f,COMITÉ DE APOYO AL ADULTO MAYOR LUZ DEL FUTURO,COMITÉ DE APOYO AL ADULTO MAYOR LUZ DEL FUTURO,COMITÉ APOYO AL LUZ FUTURO,75.546.300-0,PROGS,OSC
d9ead723-6e5b-446c-8c9d-758645237e53,CLUB DE ADULTO MAYOR NUEVO AMANECER DE RELOCA.,CLUB DE ADULTO MAYOR NUEVO AMANECER DE RELOCA.,CLUB NUEVO AMANECER RELOCA,65.780.570-K,PROGS,OSC
89f274be-e0e8-4378-91c2-d4982c0ea4ea,CLUB ADULTO MAYOR AÑORADA JUVENTUD DE ILLINOIS,CLUB ADULTO MAYOR AÑORADA JUVENTUD DE ILLINOIS,CLUB AÑORADA JUVENTUD ILLINOIS,65.181.018-3,PROGS,OSC
79a9d429-d191-4d77-b89b-3e486de8b79e,AGRUPACION DE ADULTOS MAYORES VINCULOS RANQUIL,AGRUPACION DE ADULTOS MAYORES VINCULOS RANQUIL,AGRUPACION ADULTOS MAYORES VINCULOS RANQUIL,65.191.756-5,PROGS,OSC
75616033-bd0d-45dc-aab4-7932e07011d6,ASOCIACIÓN COMUNAL DE CLUB DE HUASOS DE NINHUE,ASOCIACIÓN COMUNAL DE CLUB DE HUASOS DE NINHUE,ASOCIACIÓN COMUNAL CLUB HUASOS NINHUE,65.020.628-2,PROGS,OSC
266c9145-e9f8-4884-9e92-c609e7d64549,GRUPO FOLCLORICO MUNICIPAL RAICES DE MI TIERRA,GRUPO FOLCLORICO MUNICIPAL RAICES DE MI TIERRA,GRUPO MUNICIPAL RAICES MI TIERRA,65.612.590-K,PROGS,MUNICIPALIDAD
a6117ef3-7e78-4ef2-9a68-f984bdd026c5,CLUB DE HUASO PASIÓN Y ALMA CORRALERA DE ÑIPAS,CLUB DE HUASO PASIÓN Y ALMA CORRALERA DE ÑIPAS,CLUB HUASO PASIÓN ALMA CORRALERA ÑIPAS,65.203.236-2,PROGS,OSC
d0046063-2523-4fb1-ab9c-456dfcbae836,CLUB DEPORTIVO SOCIAL Y CULTURAL REAL ZARAGOZA,CD SOCIAL Y CULTURAL REAL ZARAGOZA,CD REAL ZARAGOZA,75.905.900-K,PROGS,OSC
d1de8fff-353d-4366-af84-78be7fc6575d,UNION COMUNAL DE CLUBES DEPORTIVOS SAN NICOLAS,UNION COMUNAL DE CLUBES DEPORTIVOS SAN NICOLAS,UNION COMUNAL CLUBES DEPORTIVOS SAN NICOLAS,72.500.300-5,PROGS,OSC
ff7c8c87-462e-40ab-8ed2-47a7a53260b8,ASOCIACION DEPORTIVA DE FUTBOL AMATEUR CHILLAN,ASOC DEPORTIVA DE FUTBOL AMATEUR CHILLAN,ASOC FUTBOL AMATEUR CHILLAN,73.983.300-0,PROGS,OSC
52425df1-9c42-4ee8-9b74-999d362a6a2f,CENTRO DE PADRES Y APODERADOS ESCUELA EL SAUCE,CENTRO DE PADRES Y APODERADOS ESCUELA EL SAUCE,CENTRO PADRES APODERADOS ESCUELA SAUCE,65.038.242-0,PROGS,OSC
caea47ea-294a-4a67-a4ee-0ac5c62797d3,CLUB DEPORTIVO SOCIAL Y CULTURAL CRICKET ÑUBLE,CD SOCIAL Y CULTURAL CRICKET ÑUBLE,CD CRICKET,65.193.129-0,PROGS,OSC
4d623b42-2b53-4f03-ae7f-27beae820f4f,AGRUPACION DE MUJERES LAS GOLONDRINAS DE HUARO,AGRUPACION DE MUJERES LAS GOLONDRINAS DE HUARO,AGRUPACION MUJERES GOLONDRINAS HUARO,65.460.890-3,PROGS,OSC
fe5efc57-65fb-4653-a8df-76ad389e4b03,UNIÓN COMUNAL DE TALLERES DE MUJERES DE NINHUE,UNIÓN COMUNAL DE TALLERES DE MUJERES DE NINHUE,UNIÓN COMUNAL TALLERES MUJERES NINHUE,65.081.646-3,PROGS,OSC
53d3c0cb-fe7f-43b5-823e-d8bd030c94af,COMITE DE AGUA RURAL LOS ACACIOS DE LA CRUZADA,COMITE DE AGUA RURAL LOS ACACIOS DE LA CRUZADA,COMITE AGUA RURAL ACACIOS CRUZADA,65.189.601-0,PROGS,OSC
aa1c78d1-81d2-4839-8c24-0a2141d8ac47,JUNTA DE VECINOS ALCALDE GUILLERMO NAVAS SILVA,JV ALCALDE GUILLERMO NAVAS SILVA,JV ALCALDE GUILLERMO NAVAS SILVA,73.775.800-1,PROGS,OSC
5dc74c14-7a86-458a-8891-653bdd9cb951,CUERPO DE BOMBEROS DE LA COMUNA DE SAN NICOLAS,CUERPO DE BOMBEROS DE LA COMUNA DE SAN NICOLAS,CUERPO BOMBEROS COMUNA SAN NICOLAS,75.763.300-0,PROGS,OSC
7e77cc03-ad44-4ba7-869f-fca748489547,COMITE DE ADELANTO Y DESARROLLO LOS CARDENALES,COMITE DE ADELANTO Y DESARROLLO LOS CARDENALES,COMITE ADELANTO DESARROLLO CARDENALES,65.594.730-2,PROGS,OSC
d1887a0a-a669-43e5-a2b4-0ac6f12c7ac2,COMITÉ DE AGUA POTABLE RURAL PORTAL DE LA LUNA,COMITÉ DE AGUA POTABLE RURAL PORTAL DE LA LUNA,COMITÉ AGUA POTABLE RURAL PORTAL LUNA,65.659.900-6,PROGS,OSC
09bede96-3d3d-4415-a005-839b626a3b16,COMITÉ DE ADELANTO Y DESARROLLO SANTA FILOMENA,COMITÉ DE ADELANTO Y DESARROLLO SANTA FILOMENA,COMITÉ ADELANTO DESARROLLO SANTA FILOMENA,65.509.100-9,PROGS,OSC
48bd91de-55d7-4771-9e6f-1d20c778b0b7,COMITÉ DE ADELANTO Y DESARROLLO LOS PARCELEROS,COMITÉ DE ADELANTO Y DESARROLLO LOS PARCELEROS,COMITÉ ADELANTO DESARROLLO PARCELEROS,65.209.295-0,PROGS,OSC
8d4a2455-6f76-473e-aaca-d37a83d65a50,SOCIEDAD DE SOCORROS MUTUOS BERNARDO O'HIGGINS,SOCIEDAD DE SOCORROS MUTUOS BERNARDO O'HIGGINS,SOCIEDAD SOCORROS MUTUOS BERNARDO O'HIGGINS,75.323.200-1,PROGS,EMPRESA
eb86d3e3-95a4-4391-8a2d-9f1241402400,CLUB DE ADULTO MAYOR JUAN PABLO II DE COYANCO,CLUB DE ADULTO MAYOR JUAN PABLO II DE COYANCO,CLUB JUAN PABLO II COYANCO,65.521.520-4,PROGS,OSC
dec57829-fbfa-4403-a655-889ade9a456b,CLUB ADULTO MAYOR FRATERNIDAD DE BUENOS AIRES,CLUB ADULTO MAYOR FRATERNIDAD DE BUENOS AIRES,CLUB FRATERNIDAD BUENOS AIRES,65.471.410-K,PROGS,OSC
8a67ee9c-9e0b-4043-8eb9-481476ae4330,CENTRO DE PADRES Y APODERADOS REINO DE SUECIA,CENTRO DE PADRES Y APODERADOS REINO DE SUECIA,CENTRO PADRES APODERADOS REINO SUECIA,75.162.500-6,PROGS,OSC
501102a2-d605-44d1-be09-0730c952ef98,AGRUPACIÓN CULTURAL CÍRCULO LITERARIO COELEMU,AGRUPACIÓN CULTURAL CÍRCULO LITERARIO COELEMU,AGRUPACIÓN CÍRCULO LITERARIO COELEMU,65.166.363-6,PROGS,OSC
c07bfeb4-cdee-44ed-87e3-813339088b86,CLUB DEPORTIVO Y CULTURAL AMANECER DE MONTAÑA,CD Y CULTURAL AMANECER DE MONTAÑA,CD AMANECER MONTAÑA,65.194.121-0,PROGS,OSC
aff23452-0951-4247-b22f-be4f6e62fc1b,CENTRO GENERAL DE PADRES LICEO C-91 DE NINHUE,CENTRO GENERAL DE PADRES LICEO C-91 DE NINHUE,CENTRO PADRES LICEO C 91 NINHUE,65.722.210-0,PROGS,OTROS
ca818026-b468-4e5f-ac03-11ec64aef242,GRUPO DE AUTOAYUDA LA ESPERANZA DE QUIRIQUINA,GRUPO DE AUTOAYUDA LA ESPERANZA DE QUIRIQUINA,GRUPO AUTOAYUDA ESPERANZA QUIRIQUINA,65.107.457-6,PROGS,OTROS
96977db4-da3b-40c9-b59d-b00b14655058,AGRUPACION DE MUJERES CAMPESINAS LA ESPERANZA,AGRUPACION DE MUJERES CAMPESINAS LA ESPERANZA,AGRUPACION MUJERES CAMPESINAS ESPERANZA,53.334.820-3,PROGS,OSC
b2cb520d-1058-4614-a617-6cf1f4ce3006,COMITE FEMENINO LOS VECINOS DE LOS TORONJILES,COMITE FEMENINO LOS VECINOS DE LOS TORONJILES,COMITE FEMENINO VECINOS TORONJILES,65.713.530-5,PROGS,OSC
7030d788-5e5e-4942-860a-89fef151e935,AGRUPACIÓN DE MUJERES LA ESPERANZA DE LA ISLA,AGRUPACIÓN DE MUJERES LA ESPERANZA DE LA ISLA,AGRUPACIÓN MUJERES ESPERANZA ISLA,65.657.040-7,PROGS,OSC
42cefcda-f2a2-4506-95c0-71dd163c07c8,AGRUPACIÓN DE SEÑORAS EMPRENDEDORAS DE CHACAY,AGRUPACIÓN DE SEÑORAS EMPRENDEDORAS DE CHACAY,AGRUPACIÓN SEÑORAS EMPRENDEDORAS CHACAY,65.100.062-9,PROGS,OSC
5229409d-c531-4014-90e4-696e5ebe0dbd,JUNTA DE VECINOS LAS CARMELITAS LAS NIEVES 5R,JV LAS CARMELITAS LAS NIEVES 5R,JV CARMELITAS NIEVES 5R,65.605.190-6,PROGS,OSC
a83d0866-beb7-4247-9db3-3d4d1f1054c8,JUNTA DE VECINOS COYANCO UNIDAD VECINAL NRO.6,JV COYANCO UNIDAD VECINAL NRO.6,JV COYANCO UNIDAD NRO 6,73.721.400-1,PROGS,OSC
bd20f9b4-1652-44fe-b36f-91809f7dc318,COMITÉ DE AGUA POTABLE RURAL VILLA SANTA ROSA,COMITÉ DE AGUA POTABLE RURAL VILLA SANTA ROSA,COMITÉ AGUA POTABLE RURAL VILLA SANTA ROSA,65.315.110-1,PROGS,OSC
4a2424ba-2404-4c75-aae9-2316df2e9bb8,JUNTA DE VECINOS N°12 VILLA GALILEA - CHILLÁN,JV N°12 VILLA GALILEA - CHILLÁN,JV N°12 VILLA GALILEA CHILLÁN,75.992.000-7,PROGS,OSC
3660bb64-8488-48fe-9ff5-dbd3540d54b7,COMITÉ DE AGUA POTABLE RURAL CARAN EL ROSARIO,COMITÉ DE AGUA POTABLE RURAL CARAN EL ROSARIO,COMITÉ AGUA POTABLE RURAL CARAN ROSARIO,65.088.395-0,PROGS,OSC
fe1cdd98-aff2-4cbb-bbc2-8b330b35ce8c,COMITÉ AGUA POTABLE RURAL EL MODELO LAS MIRAS,COMITÉ AGUA POTABLE RURAL EL MODELO LAS MIRAS,COMITÉ AGUA POTABLE RURAL MODELO MIRAS,65.007.568-4,PROGS,OSC
5b42f9a2-8e65-4d1a-a63a-072ca88da976,COMITE DE ADELANTO Y DESARROLLO LAS FRUTILLAS,COMITE DE ADELANTO Y DESARROLLO LAS FRUTILLAS,COMITE ADELANTO DESARROLLO FRUTILLAS,65.187.191-3,PROGS,OSC
c942724d-61f8-4342-85eb-45ab1354cbac,JUNTA DE VECINOS VILLA CORDILLERA CHILLÁN S/I,JV VILLA CORDILLERA CHILLÁN S/I,JV VILLA CORDILLERA CHILLÁN S I,65.015.159-3,PROGS,OSC
a04d5876-ca5b-4144-94ad-d2f1d7d61d75,COMITE DE ALLEGADOS Y ADELANTO VILLA OHIGGINS,COMITE DE ALLEGADOS Y ADELANTO VILLA OHIGGINS,COMITE ALLEGADOS ADELANTO VILLA OHIGGINS,65.030.370-9,PROGS,OSC
8f71a9e8-f07f-48e0-9f78-997686eeb837,JUNTA DE VECINOS PALLAHUALA UNIDAD VECINAL 2R,JV PALLAHUALA UNIDAD VECINAL 2R,JV PALLAHUALA UNIDAD 2R,74.037.700-0,PROGS,OSC
3b4bf492-866a-4195-a9d9-140a396d221e,JUNTA DE VECINOS POBLACIÓN MATÍAS MADARIAGA 1,JV POBLACIÓN MATÍAS MADARIAGA 1,JV POBLACIÓN MATÍAS MADARIAGA 1,65.174.873-9,PROGS,OSC
27f1a85e-fdb6-49d8-9d15-d8ad38ba2767,COMITÉ ADELANTO Y DESARROLLO COLLIGUAY CENTRO,COMITÉ ADELANTO Y DESARROLLO COLLIGUAY CENTRO,COMITÉ ADELANTO DESARROLLO COLLIGUAY CENTRO,65.104.091-4,PROGS,OSC
758e99b2-5b05-44f2-8f70-742d9b001b29,CONSEJO DE DESARROLLO LOCAL POSTA LOS REMATES,CONSEJO DE DESARROLLO LOCAL POSTA LOS REMATES,CONSEJO DESARROLLO LOCAL POSTA REMATES,65.214.767-4,PROGS,OSC
880ce728-cb1a-4031-8730-252b6361d338,COMITÉ DE EMPRENDEDORAS EL FRUTO DE MIS MANOS,COMITÉ DE EMPRENDEDORAS EL FRUTO DE MIS MANOS,COMITÉ EMPRENDEDORAS FRUTO MIS MANOS,65.072.975-7,PROGS,OSC
77ddc1fd-497b-4940-adec-ccb5184f6b22,CONSEJO DESARROLLO CENTRO CESFAM LOS VOLCANES,CONSEJO DESARROLLO CENTRO CESFAM LOS VOLCANES,CONSEJO DESARROLLO CENTRO CESFAM VOLCANES,65.562.430-9,PROGS,OTROS
2487b1df-65e3-453e-9328-94381cb1e024,CLUB DE ADULTO MAYOR LOS PUMAS DE PANGUILEMU,CLUB DE ADULTO MAYOR LOS PUMAS DE PANGUILEMU,CLUB PUMAS PANGUILEMU,65.068.999-2,PROGS,OSC
dcb07bd1-5755-4d4b-8acb-bf5a572a1123,AGRUPACION ADULTO MAYOR RECUERDOS DE TOTORAL,AGRUPACION ADULTO MAYOR RECUERDOS DE TOTORAL,AGRUPACION RECUERDOS TOTORAL,65.072.051-2,PROGS,OSC
1ca4c65f-3dec-49db-a3ff-c98451bc4ac4,CLUB DE ADULTO MAYOR EL ESFUERZO RINCOMAVIDA,CLUB DE ADULTO MAYOR EL ESFUERZO RINCOMAVIDA,CLUB ESFUERZO RINCOMAVIDA,65.079.059-6,PROGS,OSC
268471b6-3579-4346-89f9-300c0597bed7,CENTRO DE ADULTO MAYOR ARCOÍRIS DE PARRALITO,CENTRO DE ADULTO MAYOR ARCOÍRIS DE PARRALITO,CENTRO ARCOÍRIS PARRALITO,65.101.881-1,PROGS,OTROS
3770b28d-ba92-411c-88e7-63bf84334888,CLUB ADULTO MAYOR DE AMIGOS DE ANA Y JOAQUÍN,CLUB ADULTO MAYOR DE AMIGOS DE ANA Y JOAQUÍN,CLUB AMIGOS ANA JOAQUÍN,65.830.880-7,PROGS,OSC
01bf8184-6078-4309-a73c-534c1a12e172,CLUB ADULTO MAYOR NUEVA ESPERANZA LOS AROMOS,CLUB ADULTO MAYOR NUEVA ESPERANZA LOS AROMOS,CLUB NUEVA ESPERANZA AROMOS,65.302.190-9,PROGS,OSC
590e5564-2382-4f74-a5ba-e8337fe724b9,COMITÉ CAMPESINO LA ESPERANZA DE SAN IGNACIO,COMITÉ CAMPESINO LA ESPERANZA DE SAN IGNACIO,COMITÉ ESPERANZA SAN IGNACIO,65.161.269-1,PROGS,OSC
f7a3907a-338c-46c0-ad05-c034d62bfc71,COMITÉ MERCADO CAMESINO N°1 COMUNA DE ÑIQUEN,COMITÉ MERCADO CAMESINO N°1 COMUNA DE ÑIQUEN,COMITÉ MERCADO CAMESINO N°1 COMUNA ÑIQUEN,65.152.129-7,PROGS,OSC
df16eca5-a4d7-4f1e-b2c1-f7994fb489fb,CLUB DEPORTIVO 21 DE MAYO – SECTOR EL RINCON,CD 21 DE MAYO – SECTOR EL RINCON,CD 21 MAYO – SECTOR RINCON,65.125.708-5,PROGS,OSC
2952d728-79d7-47f8-8967-3cc30094acc7,CLUB DEPORTIVO FEMENINO LAS AGUILAS DE PINTO,CD FEMENINO LAS AGUILAS DE PINTO,CD FEMENINO AGUILAS PINTO,65.144.393-8,PROGS,OSC
4ab1d90a-817f-4b08-a6b7-a58442a15a1c,CENTRO DE MADRES LAS HORMIGUITAS DE EL SAUCE,CENTRO DE MADRES LAS HORMIGUITAS DE EL SAUCE,CENTRO MADRES HORMIGUITAS SAUCE,65.866.500-6,PROGS,OTROS
e735e3cb-389f-469a-9038-902ee4b50c69,CLUB DEPORTIVO SOCIAL Y CULTURAL EL ORATORIO,CD SOCIAL Y CULTURAL EL ORATORIO,CD ORATORIO,65.090.401-K,PROGS,OSC
7eba1493-af2e-4ecf-a175-18bd2a882f71,ESCUELA DE FUTBOL UNION FUTURO DE CAMPANARIO,ESCUELA DE FUTBOL UNION FUTURO DE CAMPANARIO,ESCUELA FUTBOL UNION FUTURO CAMPANARIO,65.162.908-K,PROGS,OTROS
887a7df4-1185-45a9-9780-fe3bf9fd6a95,COMITÉ DE MUJERES DE SAN JOSÉ LAS ESMIRNITAS,COMITÉ DE MUJERES DE SAN JOSÉ LAS ESMIRNITAS,COMITÉ MUJERES SAN JOSÉ ESMIRNITAS,65.151.167-4,PROGS,OSC
7c5f9a42-9081-4de8-b507-c56ea0d49455,JUNTA DE VECINOS AMPLIACION 18 DE SEPTIEMBRE,JV AMPLIACION 18 DE SEPTIEMBRE,JV AMPLIACION 18 SEPTIEMBRE,65.256.540-9,PROGS,OSC
367ad2f8-5292-4a62-9512-bcb340175bdf,JUNTA DE VECINOS MONTERRICO U V N - 15 RURAL,JV MONTERRICO U V N - 15 RURAL,JV MONTERRICO U V N 15 RURAL,74.089.300-9,PROGS,OSC
eb1ea7de-003d-43d5-941f-8710e0563044,COMITE DE ADELANTO Y DESARROLLO LOS NARANJOS,COMITE DE ADELANTO Y DESARROLLO LOS NARANJOS,COMITE ADELANTO DESARROLLO NARANJOS,65.117.408-2,PROGS,OSC
c5458fd6-7eea-4f6a-9294-d1a4db2d7bdc,JUNTA DE VECINOS SECTOR NORTE DE QUINCHAMALÍ,JV SECTOR NORTE DE QUINCHAMALÍ,JV SECTOR NORTE QUINCHAMALÍ,65.186.820-3,PROGS,OSC
838d4a2b-d225-4030-8c3e-e5d37c837133,COMITÉ DE VIVIENDA VILLA FABIÁN DE LA FUENTE,COMITÉ DE VIVIENDA VILLA FABIÁN DE LA FUENTE,COMITÉ VIVIENDA VILLA FABIÁN FUENTE,65.535.660-6,PROGS,OSC
83b1d5e4-3e57-4792-b05b-00e66fef1619,UNIÓN COMUNAL DE JUNTAS DE VECINOS DE ÑIQUÉN,UNIÓN COMUNAL DE JUNTAS DE VECINOS DE ÑIQUÉN,UNIÓN COMUNAL JUNTAS VECINOS ÑIQUÉN,65.440.220-5,PROGS,OSC
712e8ebb-70f2-4b14-b479-0e912aa66106,GRUPO DESARROLLO PERSONAL ESPERANZA DE MUJER,GRUPO DESARROLLO PERSONAL ESPERANZA DE MUJER,GRUPO DESARROLLO PERSONAL ESPERANZA MUJER,65.028.399-6,PROGS,OTROS
a9c420e0-c457-40af-98f5-b2eea4147d75,ORGANIZACIÓN DE ADULTO MAYOR NUEVO AMANECER,ORGANIZACIÓN DE ADULTO MAYOR NUEVO AMANECER,ORGANIZACIÓN NUEVO AMANECER,65.194.710-3,PROGS,OTROS
