id,codigo_normalizado,cod_unico_idis,codigo_convenios,codigo_fril,codigo_progs,nombre_iniciativa,bip,tipologia,etapa,origen,unidad_tecnica,provincia,comuna,fuente_principal,tipo_ipr,mecanismo_id
687327b7-bfc6-4f36-bc17-c5c7c8e92090,1,1-2019,,,,PROGRAMA DE EMPLEO INVERSIÓN EN LA COMUNIDAD PARA EL AÑO 2019,1,PROGRAMA,EJECUCIÓN,SECTORIAL / OTRO,,REGIONAL,REGIONAL,IDIS,PROGRAMA,MEC-005
11f82dbd-dd63-4ad7-bdf9-f0b8ab807fbf,2,2-2020,,,,PROGRAMA EMPLEO SEGUNDO SEMESTRE 2020,2,PROGRAMA,EJECUCIÓN,SECTORIAL / OTRO,,REGIONAL,REGIONAL,IDIS,PROGRAMA,MEC-005
2ea96553-837c-413f-8440-e7226bd7b5aa,20119065,20119065-2020,20119065,,,CONSTRUCCION HOGAR DE ANCIANOS COMUNA DE SAN IGNACIO,20119065,MIDESO,DISEÑO,MUNICIPIO,,DIGUILLÍN,SAN IGNACIO,IDIS,PROYECTO,MEC-001
6ce54b9d-6ac3-4976-a620-105c190007c6,20189410,20189410-2019,,,,CONSTRUCCION PISCINA MUNICIPAL DE COIHUECO,20189410,MIDESO,DISEÑO,MUNICIPIO,,PUNILLA,COIHUECO,IDIS,PROYECTO,MEC-001
65b3aa9d-8741-4114-b196-86538dc3c4e1,20210001,20210001-2021,,,,PROGRAMA INVERSIÓN EN LA COMUNIDAD (PROEMPLEO 1° SEM 2021),20210001,TRANSFERENCIA,EJECUCIÓN,SECTORIAL / OTRO,,REGIONAL,REGIONAL,IDIS,PROGRAMA,MEC-005
a761be6f-7d29-407b-a664-4a383e163956,20210002,20210002-2022,,,,PROGRAMA INVERSIÓN EN LA COMUNIDAD (PROEMPLEO II-2021),20210002,TRANSFERENCIA,EJECUCIÓN,SECTORIAL / OTRO,,REGIONAL,REGIONAL,IDIS,PROGRAMA,MEC-005
ef099d4c-22e0-4c40-bb3d-688cba209727,30002297,30002297-2021,,,,REPOSICION GIMNASIO MUNICIPAL DE COIHUECO,30002297,MIDESO,EJECUCIÓN,MUNICIPIO,,PUNILLA,COIHUECO,IDIS,PROYECTO,MEC-001
9679f2ee-ff4e-496c-a1b3-5e7d45a700fc,30069728,30069728-2019,,,,"REPOSICIÓN CENTRO DE SALUD FAMILIAR, COMUNA DE PINTO",30069728,MIDESO,DISEÑO,MUNICIPIO,,DIGUILLÍN,PINTO,IDIS,PROGRAMA,MEC-005
69e34f9d-1c34-4e63-aa75-733048d17702,30072326,30072326-2019,,,,REPOSICION AMPLIADA EDIFICIO CONSISTORIAL MUNICIP. SAN NICOLAS,30072326,MIDESO,EJECUCIÓN,MUNICIPIO,,PUNILLA,SAN NICOLÁS,IDIS,PROYECTO,MEC-001
86717886-3de2-46df-b7df-fd19f41730c4,30075322,30075322-2019,,,,"NORMALIZACION LICEO JOSE MANUEL PINTO ARIAS, COMUNA DE PINTO",30075322,MIDESO,DISEÑO,MUNICIPIO,,DIGUILLÍN,PINTO,IDIS,PROYECTO,MEC-001
b06caea3-5116-4859-888f-bd6a8817bb91,30095321,30095321-2019,,,,"REPOSICION POSTA DE SALUD RURAL VEGAS DE ITATA, COMUNA DE COELEMU",30095321,MIDESO,DISEÑO,MUNICIPIO,,ITATA,COELEMU,IDIS,PROYECTO,MEC-001
6650c2bf-1ba0-4ee1-a7a3-072af37137b4,30095514,30095514-2019,,,,"CONSTRUCCION MUROS DE CONTENCION POBLACION VILLA MADERA, COELEMU",30095514,MIDESO,EJECUCIÓN,MUNICIPIO,,ITATA,COELEMU,IDIS,PROYECTO,MEC-001
cc8f6e3c-2444-4a00-95e1-d2ca68c0d29d,30095718,30095718-2019,,,,"CONSTRUCCION EDIFICIO CONSISTORIAL, COMUNA DE QUIRIHUE",30095718,MIDESO,EJECUCIÓN,MUNICIPIO,,ITATA,QUIRIHUE,IDIS,PROYECTO,MEC-001
48931d6d-9f34-44f2-a3f9-00826eb97505,30103660,30103660-2019,,,,"MEJORAMIENTO PLAZA DE ARMAS, COMUNA DE BULNES",30103660,MIDESO,DISEÑO,MUNICIPIO,,DIGUILLÍN,BULNES,IDIS,PROYECTO,MEC-001
e24f0eb0-7d03-4763-af59-ab4c0ccc4636,30103782,30103782-2019,,,,RESTAURACION CAPILLA HOSPITAL SAN JUAN DE DIOS DE CHILLÁN,30103782,MIDESO,EJECUCIÓN,SECTORIAL / OTRO,,DIGUILLÍN,CHILLÁN,IDIS,PROYECTO,MEC-001
273f2f1e-0605-4e8c-ae38-6b6ab35c1b6a,30113947,30113947-2020,,,,CONSTRUCCION CAMARINES ESTADIO MUNICIPAL YUNGAY,30113947,FRIL,EJECUCIÓN,MUNICIPIO,,DIGUILLÍN,YUNGAY,IDIS,PROYECTO,MEC-001
b261e60f-fdb3-40f0-b2c5-114b64f294e6,30119286,30119286-2020,,,,"REPOSICIÓN CESFAM FEDERICO PUGA BORNE, CHILLÁN VIEJO",30119286,MIDESO,EJECUCIÓN,MUNICIPIO,,DIGUILLÍN,CHILLÁN VIEJO,IDIS,PROYECTO,MEC-001
77a27394-8838-450b-b2fc-760c7f98ecf0,30119618,30119618-2019,,,,"CONSTRUCCION SERVICIO APR SECTOR LAS ROSAS, COMUNA DE SAN IGNACIO",30119618,MIDESO,EJECUCIÓN,MUNICIPIO,,DIGUILLÍN,SAN IGNACIO,IDIS,PROYECTO,MEC-001
3563b112-1d8d-4ee4-8f91-7e407f6d8b5b,30119692,30119692-2019,,,,NORMALIZACION UNID FARMACIA Y DISPENS.DE FARMACOS HOSP. EL CARMEN,30119692,MIDESO,DISEÑO,SECTORIAL / OTRO,,DIGUILLÍN,EL CARMEN,IDIS,PROYECTO,MEC-001
8d0b9d6c-1b1a-402c-bde1-9e66eef442c2,30122860,30122860-2019,,,,"CONSTRUCCION CANCHA PASTO SINTÉTICO 22 DE AGOSTO, CHILLAN",30122860,FRIL,EJECUCIÓN,MUNICIPIO,,DIGUILLÍN,CHILLÁN,IDIS,PROYECTO,MEC-001
63068489-2fcc-4a4b-be95-9baac002c2aa,30126289,30126289-2019,,,,NORMALIZACION SISTEMAS ELECTRICOS EN ESTAB PENIT. CCP BULNES,30126289,MIDESO,EJECUCIÓN,SECTORIAL / OTRO,,DIGUILLÍN,BULNES,IDIS,PROYECTO,MEC-001
50c9e15d-68ce-4123-81ac-bd17ed6852e3,30126533,30126533-2019,,,,NORMALIZACION REDES ELÉCTRICOS CENTRO DETENCION PREVENTIVA YUNGAY,30126533,MIDESO,EJECUCIÓN,SECTORIAL / OTRO,,DIGUILLÍN,YUNGAY,IDIS,PROGRAMA,MEC-005
c2bb691b-e170-46ca-8c6c-85bd5eda069c,30126592,30126592-2019,,,,NORMALIZACION REDES ELÉCTRICAS CENTRO DETENCION PREVENTIVA SAN CARLOS,30126592,MIDESO,EJECUCIÓN,SECTORIAL / OTRO,,PUNILLA,SAN CARLOS,IDIS,PROGRAMA,MEC-005
ce8d5f05-5a93-4328-af48-1d550363ce14,30128024,30128024-2022,,,,REPOSICION Y EQUIPAMIENTO SERVICIO MÉDICO LEGAL DE CHILLÁN,30128024,MIDESO,EJECUCIÓN,SECTORIAL / OTRO,GORE-DIDESO,REGIONAL,REGIONAL,IDIS,PROYECTO,MEC-001
6ddc7520-d5d6-47ad-9a04-e23f8b4ced1e,30130455,30130455-2022,30130455,,,"ADQUISICION CAMIÓN ALJIBE, CHILLAN VIEJO",30130455,C-33,EJECUCIÓN,MUNICIPIO,MUNICIP. CHILLÁN VIEJO,DIGUILLÍN,CHILLÁN VIEJO,IDIS,PROYECTO,MEC-001
8493aeae-d0a7-41a0-a630-b5d012d84031,30131927,30131927-2019,,,,"REPOSICION MAQUINARIA MUNICIPAL PARA MANTENCION DE LA RED VIAL, COMUNA DE COIHUECO",30131927,C-33,EJECUCIÓN,MUNICIPIO,,PUNILLA,COIHUECO,IDIS,PROYECTO,MEC-001
4918e1f9-c32d-45f5-ba0a-b37daea748b3,30132368,30132368-2020,,,,"MEJORAMIENTO AVDA. VICENTE MENDEZ, PAUL HARRIS Y LAS ROSAS, CHILLÁN",30132368,MIDESO,DISEÑO,SECTORIAL / OTRO,,DIGUILLÍN,CHILLÁN,IDIS,PROYECTO,MEC-001
4fb56e07-f20c-4035-92f1-bc6a865ea6e3,30132719,30132719-2019,,,,"REPOSICION EDIFICIO CONSISTORIAL, EL CARMEN",30132719,MIDESO,EJECUCIÓN,MUNICIPIO,,DIGUILLÍN,EL CARMEN,IDIS,PROYECTO,MEC-001
8341bde9-0f27-4f09-a3a2-6773e8becc6a,30133087,30133087-2019,,,,"NORMALIZACION CESFAM DE SANTA CLARA, BULNES",30133087,MIDESO,DISEÑO,MUNICIPIO,,DIGUILLÍN,BULNES,IDIS,PROYECTO,MEC-001
c100b542-fc34-4ac9-baa6-fc7ae0b024cf,30133374,30133374-2019,,,,"REPOSICION GIMNASIO MUNICIPAL ROBERTO MARCELO DIAZ RABANAL,COELEMU",30133374,MIDESO,DISEÑO,MUNICIPIO,,ITATA,COELEMU,IDIS,PROYECTO,MEC-001
224d9cdb-c46a-477d-a9b9-0c754affe2cc,30133425,30133425-2019,,,,"MEJORAMIENTO ACERAS SECTOR CENTRO, CHILLAN",30133425,MIDESO,EJECUCIÓN,MUNICIPIO,,DIGUILLÍN,CHILLÁN,IDIS,PROYECTO,MEC-001
d98ce703-5424-469e-9831-4bd2f3c27a43,30133593,30133593-2021,,,,"MEJORAMIENTO CENTRO CÍVICO PLAZA DE ARMAS, CHILLÁN",30133593,MIDESO,DISEÑO,MUNICIPIO,,DIGUILLÍN,CHILLÁN,IDIS,PROYECTO,MEC-001
bb22acce-a037-440a-9689-50c11af3bec1,30134669,30134669-2019,,,,RESTAURACION IGLESIA DE LA VIRGEN DEL CARMEN DE CHILLÁN,30134669,MIDESO,EJECUCIÓN,SECTORIAL / OTRO,,DIGUILLÍN,CHILLÁN,IDIS,PROYECTO,MEC-001
a6d1e3b8-6916-4be0-80e5-34769c1e6ca5,30164123,30164123-2019,,,,"ADQUISICIÓN MATERIAL MENOR, BOMBEROS ASOC. PUNILLA",30164123,C-33,EJECUCIÓN,MUNICIPIO,,PUNILLA,PUNILLA,IDIS,PROYECTO,MEC-001
15ef3a9e-a92d-448d-ac43-53848503e879,30183222,30183222-2019,,,,"HABILITACION ENSEÑANZA MEDIA ESCUELA EL PORVENIR DE CATO, COIHUECO",30183222,MIDESO,DISEÑO,MUNICIPIO,,PUNILLA,COIHUECO,IDIS,PROYECTO,MEC-001
78c67a8f-d38f-439f-a75b-5c4191879d96,30195772,30195772-2019,,,,ADQUISICION 4 FURGONES COMUNA DE QUIRIHUE,30195772,C-33,EJECUCIÓN,MUNICIPIO,,ITATA,QUIRIHUE,IDIS,PROYECTO,MEC-001
4da6365b-15e3-4999-9d9b-3fd71fdfdc48,30202824,30202824-2019,,,,REPOSICION CENTRO DE SALUD FAMILIAR SAN FABIAN DE ALICO,30202824,MIDESO,DISEÑO,MUNICIPIO,,PUNILLA,SAN FABIÁN,IDIS,PROYECTO,MEC-001
deefbe5c-97aa-485e-a103-888afef9048a,30216322,30216322-2019,,,,CONSTRUCCION RED ALCANTARILLADO A.S. CALLES 18 SEPT. Y OTRAS QUILLÓN,30216322,MIDESO,EJECUCIÓN,MUNICIPIO,,DIGUILLÍN,QUILLÓN,IDIS,PROYECTO,MEC-001
bcf17a67-b716-4b29-a754-2a8a33f65e0b,30231222,30231222-2022,,,,ADQUISICION DE 4 VEHICULOS TRASLADO PACIENTES POSTRADOS Y DISCAP.,30231222,C-33,EJECUCIÓN,MUNICIPIO,ASOCIACIÓN PUNILLA,PUNILLA,PUNILLA,IDIS,PROYECTO,MEC-001
b12f1e43-5741-4a58-bbaa-76aa226de1df,30245474,30245474-2019,,,,CONSTRUCCION CUARTEL DE BOMBEROS COMUNA DE SAN NICOLÁS,30245474,MIDESO,EJECUCIÓN,MUNICIPIO,,PUNILLA,SAN NICOLÁS,IDIS,PROYECTO,MEC-001
9383ca0d-7b70-4bb3-b723-5f49b0a25f8b,30252122,30252122-2019,,,,"CONSTRUCCION SEDE SOCIAL HUAPE, CHILLAN",30252122,FRIL,EJECUCIÓN,MUNICIPIO,,DIGUILLÍN,CHILLÁN,IDIS,PROYECTO,MEC-001
1460504a-6ca7-44ba-83dd-37c26ac4e357,30261675,30261675-2019,,,,"CONSTRUCCION SEDE SOCIAL VILLA FRESIA, COMUNA DE BULNES",30261675,FRIL,EJECUCIÓN,MUNICIPIO,,DIGUILLÍN,BULNES,IDIS,PROYECTO,MEC-001
83fa9e3b-2d7d-4a82-9870-695550dbf324,30261772,30261772-2020,,,,"SANEAMIENTO TÍTULOS DERECHOS DE AGUA, COMUNAS ASOCIACIÓN PUNILLA",30261772,MIDESO,EJECUCIÓN,MUNICIPIO,,PUNILLA,PUNILLA,IDIS,PROYECTO,MEC-001
b7b8880f-9443-4eec-bcda-1028f0fb1de1,30268372,30268372-2020,,,,"NORMALIZACION LICEO DIEGO PORTALES P., SAN CARLOS",30268372,MIDESO,EJECUCIÓN,MUNICIPIO,,PUNILLA,SAN CARLOS,IDIS,PROYECTO,MEC-001
5d850b65-e6a9-45ac-bc14-cd835f65e00e,30268473,30268473-2019,,,,CONSTRUCCIÓN MEDIALUNA COMPLEJO DEPORTIVO ESCOLAR,30268473,MIDESO,EJECUCIÓN,MUNICIPIO,,ITATA,QUIRIHUE,IDIS,PROYECTO,MEC-001
2624db5f-791c-4f5c-ba70-8e93199da858,30268474,30268474-2019,,,,CONSTRUCCIÓN COMPLEJO DEPORTIVO ESCOLAR FRANCÉS,30268474,MIDESO,DISEÑO,MUNICIPIO,,ITATA,QUIRIHUE,IDIS,PROYECTO,MEC-001
54bd2bcc-a604-41e6-afad-035ebcdafddb,30275184,30275184-2021,,,,"CONSTRUCCION SANEAMIENTO SANITARIO SECTOR MONTERRICO Y LOS PROFESORES, CHILLÃN",30275184,MIDESO,DISEÑO,MUNICIPIO,,DIGUILLÍN,CHILLÁN,IDIS,PROYECTO,MEC-001
4aeac32e-0f58-461a-81e2-4a9680b7a7d0,30281327,30281327-2019,,,,REPOSICION GIMNASIO MUNICIPAL COMUNA DE SAN NICOLÁS,30281327,MIDESO,DISEÑO,MUNICIPIO,,PUNILLA,SAN NICOLÁS,IDIS,PROYECTO,MEC-001
9f18adf7-43d9-4e2b-91df-9a9985f57e85,30282925,30282925-2022,,,,"MEJORAMIENTO PUENTES RURALES DIVERSOS SECTORES, ASOCIACION PUNILLA",30282925,C-33,EJECUCIÓN,MUNICIPIO,MOP-VIALIDAD,PUNILLA,PUNILLA,IDIS,PROYECTO,MEC-001
98eb3f63-2298-4a67-b719-bb93c8cb82c4,30286222,30286222-2020,,,,CONSTRUCCION POLIDEPORTIVO MUNICIPAL DE SAN CARLOS,30286222,MIDESO,EJECUCIÓN,MUNICIPIO,,PUNILLA,SAN CARLOS,IDIS,PROYECTO,MEC-001
693bb4dc-4ae3-485d-8fa1-d64d91f89e64,30287328,30287328-2019,,,,"CONSERVACION PAVIMENTO AV. SEPÚLVEDA BUSTOS, CHILLÁN",30287328,C-33,EJECUCIÓN,MUNICIPIO,,DIGUILLÍN,CHILLÁN,IDIS,PROYECTO,MEC-001
a73d18e1-32eb-4701-ae0d-c57bd18110c2,30288425,30288425-2019,,,,"NORMALIZACION EXTENSIÃ¿N ELECTRIFICACIÃ¿N DOMIC.RURAL DIV.SECT., COMUNA DE COELEMU",30288425,MIDESO,EJECUCIÓN,MUNICIPIO,,ITATA,COELEMU,IDIS,PROYECTO,MEC-001
bf6bfd36-122f-4eac-89d4-7b8ee8e381c1,30289022,30289022-2019,,,,RESTAURACION TEMPLO CATOLICO PARROQUIAL COMUNA DE PEMUCO,30289022,MIDESO,DISEÑO,MUNICIPIO,,DIGUILLÍN,PEMUCO,IDIS,PROYECTO,MEC-001
62bd7e7c-960d-4382-94bf-53caf7a02474,30289072,30289072-2019,,,,"MEJORAMIENTO SISTEMA DE APR CHOLGUAN NORTE - PEDREGAL , YUNGAY",30289072,MIDESO,EJECUCIÓN,MUNICIPIO,,DIGUILLÍN,YUNGAY,IDIS,PROYECTO,MEC-001
0c797df8-60fd-45b8-b0ef-01e2a32739ab,30289424,30289424-2019,,,,REPOSICION EDIFICIO CONSISTORIAL SAN FABIÁN,30289424,MIDESO,DISEÑO,MUNICIPIO,,PUNILLA,SAN FABIÁN,IDIS,PROYECTO,MEC-001
e30e819b-ca6a-49bc-8bfe-01707c8251ce,30291125,30291125-2019,,,,"HABILITACION SISTEMA DE MONITOREO DE TRAFICO UOCT ÑUBLE, CHILLÁN",30291125,MIDESO,EJECUCIÓN,SECTORIAL / OTRO,,DIGUILLÍN,DIGUILLIN,IDIS,PROYECTO,MEC-001
84141da1-af98-453b-bc18-57b377151d84,30292030,30292030-2022,,,,REPOSICION DE VEHICULOS DE TRANSPORTE DE PERSONAS PARA LA RED DE SALUD DE ÑUBLE,30292030,C-33,EJECUCIÓN,SECTORIAL / OTRO,S.SALUD ÑUBLE,REGIONAL,REGIONAL,IDIS,PROYECTO,MEC-001
617e993a-c6e2-44c5-916f-f60875354db7,30318923,30318923-2019,,,,"CONSTRUCCION PASARELA PEATONAL PORTAL DE LA LUNA, SAN NICOLAS",30318923,MIDESO,EJECUCIÓN,MUNICIPIO,,PUNILLA,SAN NICOLÁS,IDIS,PROYECTO,MEC-001
7ff15c6c-5cf3-4ceb-a9c0-5c1e7467b84d,30318924,30318924-2021,,,,MEJORAMIENTO ACERAS AV. OHIGGINS COMUNA SAN NICOLAS,30318924,MIDESO,EJECUCIÓN,MUNICIPIO,,PUNILLA,SAN NICOLÁS,IDIS,PROYECTO,MEC-001
60ac9ccd-3f80-4950-93ee-f4d93e4189aa,30347030,30347030-2019,,,,"REPOSICION CAMIÓN TOLVA MANTENCION ACCESO CAMINOS RURALES, QUILLÓN",30347030,C-33,EJECUCIÓN,MUNICIPIO,,DIGUILLÍN,QUILLÓN,IDIS,PROYECTO,MEC-001
86114e66-4766-42f3-810f-13adff58a042,30347224,30347224-2019,,,,"CONSERVACION BIBLIOTECA MUNICIPAL, COMUNA DE PINTO",30347224,C-33,EJECUCIÓN,MUNICIPIO,,DIGUILLÍN,PINTO,IDIS,PROYECTO,MEC-001
3d1e8921-c53b-431e-af90-3a44bf4a7460,30348177,30348177-2021,,,,"ADQUISICION MOTONIVELADORA MANT. CAMINOS, ZONAS AFECTADAS INCENDIOS",30348177,C-33,EJECUCIÓN,MUNICIPIO,,ITATA,QUIRIHUE,IDIS,PROYECTO,MEC-001
c1ab42ad-1356-46f2-9447-d583a9d4d6f9,30363922,30363922-2019,,,,"CONSTRUCCION CICLOVIAS RURALES , COMUNAS ASOCIACION PUNILLA",30363922,MIDESO,DISEÑO,MUNICIPIO,,PUNILLA,PUNILLA,IDIS,PROYECTO,MEC-001
e212691b-49e6-4839-bb13-9255e3ecd144,30380682,30380682-2019,,,,ADQUISICION CAMION ALZA HOMBRE PARA LA MUNICIPALIDAD DE TREHUACO,30380682,C-33,EJECUCIÓN,MUNICIPIO,,ITATA,TREGUACO,IDIS,PROYECTO,MEC-001
2d2ee073-5674-4639-88ce-a950fda3e102,30385675,30385675-2019,,,,CONSTRUCCION CAMARINES SECTOR LLAHUEN Y MULTICANCHA PORTEZUELO,30385675,FRIL,EJECUCIÓN,MUNICIPIO,,ITATA,PORTEZUELO,IDIS,PROYECTO,MEC-001
53a62c71-82cf-4ca2-863c-07bae84d2781,30386273,30386273-2019,,,,CONSTRUCCION SERVICIO ALIMENTACION Y SEDILE HOSPITAL EL CARMEN,30386273,MIDESO,DISEÑO,SECTORIAL / OTRO,,DIGUILLÍN,EL CARMEN,IDIS,PROYECTO,MEC-001
f6452dd4-9076-4079-9491-cea35f8ad1fa,30386411,30386411-2021,,,,REPOSICION LICEO A-17 COMUNA DE YUNGAY,30386411,MIDESO,DISEÑO,MUNICIPIO,,DIGUILLÍN,YUNGAY,IDIS,PROYECTO,MEC-001
755af8ce-0b58-493f-803b-91569fa25765,30387725,30387725-2019,,,,NORMALIZACIÓN ESCUELA DAFNE ZAPATA ROZAS,30387725,MIDESO,EJECUCIÓN,MUNICIPIO,,DIGUILLÍN,PEMUCO,IDIS,PROYECTO,MEC-001
fb2810a9-c831-444e-95e7-7702cdc0d7a3,30391922,30391922-2019,,,,"REPOSICION PISTA BMX QUILAMAPU, CHILLÁN.",30391922,MIDESO,EJECUCIÓN,MUNICIPIO,,DIGUILLÍN,CHILLÁN,IDIS,PROYECTO,MEC-001
c17ad7f6-c5ea-40b3-b52c-aebad8a96574,30392992,30392992-2019,,,,ADQUISICION RODILLO COMPACTADOR PARA LA COMUNA DE SAN IGNACIO,30392992,C-33,EJECUCIÓN,MUNICIPIO,,DIGUILLÍN,SAN IGNACIO,IDIS,PROYECTO,MEC-001
0c95a129-9b14-456c-b088-ba652c01f5f2,30399331,30399331-2020,,,,"CONSTRUCCION REFUGIOS PEATONALES Y BAHIAS DE DETENCION, ASOC. PUNILL",30399331,MIDESO,EJECUCIÓN,MUNICIPIO,,PUNILLA,PUNILLA,IDIS,PROYECTO,MEC-001
c61e7e13-cb42-4e81-a4bf-d7e8053264fd,30399737,30399737-2022,,,,"MEJORAMIENTO ESTADIO MUNICIPAL, COMUNA DE BULNES",30399737,MIDESO,EJECUCIÓN,MUNICIPIO,MUNICIP. BULNES,DIGUILLÍN,BULNES,IDIS,PROYECTO,MEC-001
86733198-a95e-4e36-ae0e-15410120b567,30403274,30403274-2019,,,,CONSTRUCCION C. DIALISIS HOSPITAL DE SAN CARLOS,30403274,MIDESO,DISEÑO,SECTORIAL / OTRO,,PUNILLA,SAN CARLOS,IDIS,PROYECTO,MEC-001
03c22e23-a29a-463c-91f6-84d98b366dd0,30407488,30407488-2019,,,,CONSERVACION INFRAESTRUCTURA HORIZONTAL AD. BERNARDO OHIGGINS,30407488,C-33,EJECUCIÓN,SECTORIAL / OTRO,,REGIONAL,REGIONAL,IDIS,PROYECTO,MEC-001
56581bf7-78b1-4d81-8c13-d179c18fa791,30426879,30426879-2019,,,,"ACTUALIZACION PLADECO, COMUNA DE SAN FABIÁN",30426879,MIDESO,EJECUCIÓN,MUNICIPIO,,PUNILLA,SAN FABIÁN,IDIS,PROYECTO,MEC-001
fa597ff2-ef72-4f76-83c4-0e9410fa2158,30440323,30440323-2019,,,,"NORMALIZACIÓN LICEO CLAUDIO ARRAU LEÓN, COMUNA DE COIHUECO",30440323,MIDESO,DISEÑO,MUNICIPIO,,PUNILLA,COIHUECO,IDIS,PROYECTO,MEC-001
0448fad4-d2e9-4715-ac9a-89f2902d62cd,30445572,30445572-2020,,,,CONSTRUCCION ESPACIOS DEPORTIVOS CON CERCO PERIMETRAL DIV. SECTORES DE COIHUECO,30445572,FRIL,EJECUCIÓN,MUNICIPIO,,PUNILLA,COIHUECO,IDIS,PROYECTO,MEC-001
8cbdbf60-a476-4b8f-a816-a346078399fb,30451322,30451322-2019,,,,"MEJORAMIENTO RUTAS N-460, N-470 Y N-476 TREHUACO-PORTEZUELO, ÑUBLE",30451322,MIDESO,DISEÑO,SECTORIAL / OTRO,,ITATA,ITATA,IDIS,PROYECTO,MEC-001
c8e48e39-0c51-47ec-b2a6-6b5c42d53a91,30451574,30451574-2019,,,,"HABILITACION PLAZA Y FERIA LIBRE EMILIO BASTIAS, SAN CARLOS",30451574,MIDESO,EJECUCIÓN,MUNICIPIO,,PUNILLA,SAN CARLOS,IDIS,PROYECTO,MEC-001
1d72b26b-ac29-4c01-88a6-461c2c6b5708,30454978,30454978-2019,,,,NORMALIZACION LICEO JORGE ALESSANDRI DE SAN FABIÁN,30454978,MIDESO,DISEÑO,MUNICIPIO,,PUNILLA,SAN FABIÁN,IDIS,PROYECTO,MEC-001
8303b24d-af8b-4d12-9f28-cc9c930ae984,30459136,30459136-2019,,,,"CONSTRUCCION MULTICANCHA SECTOR LOS AROMOS, SAN NICOLAS",30459136,FRIL,EJECUCIÓN,MUNICIPIO,,PUNILLA,SAN NICOLÁS,IDIS,PROYECTO,MEC-001
e1ed2497-e87e-4119-8125-089581bcb671,30459225,30459225-2019,,,,CONSTRUCCIÓN ALCANTARILLADO Y PLANTA DE TRATAMIENTO VILLA LOS ANDES DE CACHAPOAL,30459225,MIDESO,EJECUCIÓN,MUNICIPIO,,PUNILLA,SAN CARLOS,IDIS,PROYECTO,MEC-001
0ff55e19-e2f0-4d9c-a528-13e227aefb79,30459228,30459228-2019,,,,CONSTRUCCION SEDE SOCIAL JVV SAN MARTIN COMUNA DE PEMUCO,30459228,FRIL,EJECUCIÓN,MUNICIPIO,,DIGUILLÍN,PEMUCO,IDIS,PROYECTO,MEC-001
708b1465-46e3-4a3b-91aa-f6d4419fd715,30459391,30459391-2019,,,,CONSTRUCCIONES CAMARINES CLUB TRES JOTAS,30459391,FRIL,EJECUCIÓN,MUNICIPIO,,DIGUILLÍN,BULNES,IDIS,PROYECTO,MEC-001
6a49bdb2-c03e-498c-89eb-09fefa68e8b3,30459410,30459410-2020,,,,CONSTRUCCION SEDE SOCIAL RELOCA BAJO COMUNA DE NINHUE,30459410,FRIL,EJECUCIÓN,MUNICIPIO,,ITATA,NINHUE,IDIS,PROYECTO,MEC-001
36515288-d860-4340-9764-03c6515fc4b1,30459578,30459578-2020,,,,"CONSTRUCCION PISCINA RECREATIVA, COMUNA DE QUIRIHUE",30459578,FRIL,EJECUCIÓN,MUNICIPIO,,ITATA,QUIRIHUE,IDIS,PROYECTO,MEC-001
a30eea63-85dd-4212-810b-eb1a1c28bc50,30459605,30459605-2020,,,,REPARACION VEREDAS EN DIVERSOS SECTORES DE QUIRIHUE,30459605,FRIL,EJECUCIÓN,MUNICIPIO,,ITATA,QUIRIHUE,IDIS,PROYECTO,MEC-001
b999b616-12fc-4b20-b1ab-4295a53032e1,30459636,30459636-2019,,,,MEJORAMIENTO CIRCUITO POBLACION IRARRAZABAL PARQUE ESTADIO MUNICIPAL,30459636,FRIL,EJECUCIÓN,MUNICIPIO,,DIGUILLÍN,YUNGAY,IDIS,PROYECTO,MEC-001
721a1846-10dd-4b50-bca8-d0aa07d4ab1b,30459724,30459724-2019,,,,REPOSICION CENTRAL DE ESTERILIZACIÓN H SAN CARLOS,30459724,MIDESO,DISEÑO,SECTORIAL / OTRO,,PUNILLA,SAN CARLOS,IDIS,PROYECTO,MEC-001
306f2038-7a9e-43b9-9695-951054c3f664,30459763,30459763-2021,30459763,,,"CONSTRUCCIÓN SISTEMA COLECTIVO DE AGUAS SERVIDAS SECTOR SAN MIGUEL, COMUNA DE SAN IGNACIO",30459763,MIDESO,EJECUCIÓN,MUNICIPIO,,DIGUILLÍN,SAN IGNACIO,IDIS,PROYECTO,MEC-001
93a6d7ae-4deb-433d-917e-d1e445596968,30460161,30460161-2022,,,,NORMALIZACION AERODROMO LOS MORROS DE COBQUECURA,30460161,MIDESO,DISEÑO,SECTORIAL / OTRO,MOP-AEROPUERTOS,ITATA,COBQUECURA,IDIS,PROYECTO,MEC-001
6b088bd7-a1c4-48b2-9aee-42ae6d692def,30462091,30462091-2019,,,,"CONSERVACION VEREDAS SECTOR LIBERTAD ORIENTE Y OTROS SECTORES, CHIL",30462091,C-33,EJECUCIÓN,MUNICIPIO,,DIGUILLÍN,CHILLÁN,IDIS,PROYECTO,MEC-001
04c268ff-4bbb-4912-b3b8-8a2579301675,30462242,30462242-2019,,,,HABILITACION DE PABELLONES U. QUIRURGICA GINECO OBSTETRICA HCHM,30462242,MIDESO,EJECUCIÓN,SECTORIAL / OTRO,,REGIONAL,REGIONAL,IDIS,PROYECTO,MEC-001
9d3abf73-ed26-47c2-be4b-5c5e5db91eca,30462265,30462265-2019,,,,REPOSICION SALA REHABILITACION KINESICA H. DE BULNES,30462265,MIDESO,DISEÑO,SECTORIAL / OTRO,,DIGUILLÍN,BULNES,IDIS,PROYECTO,MEC-001
af3f7d4b-1b30-478a-be72-982b9e557c82,30462276,30462276-2020,,,,ADQUISICION EQUIP. S.S.PEDIATRIA-CIRUGIA INFANTIL HOSP. H.MARTIN,30462276,C-33,EJECUCIÓN,SECTORIAL / OTRO,,DIGUILLÍN,CHILLÁN,IDIS,PROYECTO,MEC-001
e45521f0-139c-4127-be09-2394bae355a9,30462322,30462322-2019,,,,"CONSTRUCCION DISEÑO SANEAMIENTO SANITARIO SECTOR EL CARDAL, COMUNA DE YUNGAY.",30462322,MIDESO,DISEÑO,MUNICIPIO,,DIGUILLÍN,YUNGAY,IDIS,PROYECTO,MEC-001
59fbb5a4-101d-4623-a5df-034d284ff66c,30462394,30462394-2019,,,,AMPLIACION Y NORMALIZACION LICEO POLIVALENTE JUVENAL HERNANDEZ J.,30462394,MIDESO,DISEÑO,MUNICIPIO,,DIGUILLÍN,EL CARMEN,IDIS,PROYECTO,MEC-001
adc078b4-8e73-4fb5-8005-01c406354f2b,30462396,30462396-2020,,,,REPOSICION LABORATORIO HOSPITAL DE COELEMU,30462396,MIDESO,DISEÑO,SECTORIAL / OTRO,,ITATA,COELEMU,IDIS,PROYECTO,MEC-001
90366659-505b-496f-ba3d-a5b469445013,30462398,30462398-2019,,,,REPOSICION LABORATORIO HOSPITAL DE QUIRIHUE,30462398,MIDESO,DISEÑO,SECTORIAL / OTRO,,ITATA,QUIRIHUE,IDIS,PROYECTO,MEC-001
45651c20-a3cf-43af-a778-6347d19af9a6,30462419,30462419-2019,,,,CONSTRUCCION CENTRO LOGISTICO RESERVA DE LA BIOSFERA VALLE DE ATACALCO,30462419,MIDESO,DISEÑO,MUNICIPIO,,DIGUILLÍN,EL CARMEN,IDIS,PROYECTO,MEC-001
9eb861e7-0c6d-4f00-a11b-cbf8a7573def,30462481,30462481-2019,,,,"CONSTRUCCION DISEÑO DE CONTENCIÓN CALLE CHIPANA, COMUNA DE YUNGAY",30462481,MIDESO,DISEÑO,MUNICIPIO,,DIGUILLÍN,YUNGAY,IDIS,PROYECTO,MEC-001
5885ebbe-b8f1-4768-8207-fc83eb6220dc,30462486,30462486-2019,,,,CONSERVACION PLAZA DE ARMAS COMUNA DE PEMUCO,30462486,C-33,EJECUCIÓN,MUNICIPIO,,DIGUILLÍN,PEMUCO,IDIS,PROYECTO,MEC-001
4187ad17-7747-4c1f-a0d4-b7a3e8cdb338,30466085,30466085-2019,,,,ADQUISICION ANGIOGRAFO RETINAL HOSPITAL DE SAN CARLOS,30466085,C-33,EJECUCIÓN,SECTORIAL / OTRO,,PUNILLA,SAN CARLOS,IDIS,PROYECTO,MEC-001
1a412a6e-32ae-4ebe-806f-07faaaf2c342,30479589,30479589-2020,,,,"CONSERVACION CAMINO VECINAL DE LLOLLINCO, CHILLAN VIEJO",30479589,C-33,EJECUCIÓN,MUNICIPIO,,DIGUILLÍN,CHILLÁN VIEJO,IDIS,PROYECTO,MEC-001
53bbabe0-5eb1-4884-8937-b77d23d241fb,30479748,30479748-2019,,,,"NORMALIZACIÓN ES. BASICA GUILLERMINA DRAKE WOOD, COMUNA COIHUECO",30479748,MIDESO,DISEÑO,MUNICIPIO,,PUNILLA,COIHUECO,IDIS,PROYECTO,MEC-001
80f7f6de-6667-460f-87c4-42413d9919f3,30479894,30479894-2019,,,,"CONSTRUCCION SEMAFORIZ. INTERSEC AV.BRASIL-CONSTITUCIÓN Y OTROS,CHILLAN",30479894,MIDESO,EJECUCIÓN,MUNICIPIO,,DIGUILLÍN,CHILLÁN,IDIS,PROYECTO,MEC-001
48f061c1-557d-43f0-910b-fe0544b169e6,30479895,30479895-2019,,,,"MEJORAMIENTO PARQUE SARITA GAJARDO, CHILLAN",30479895,MIDESO,DISEÑO,SECTORIAL / OTRO,,DIGUILLÍN,CHILLÁN,IDIS,PROYECTO,MEC-001
f23c0e01-9a8f-4e49-a25a-8261404d73c3,30479905,30479905-2021,,,,"MEJORAMIENTO APR CAPILLA COX, CHILLÁN",30479905,MIDESO,DISEÑO,MUNICIPIO,,DIGUILLÍN,CHILLÁN,IDIS,PROYECTO,MEC-001
01d649b0-51ee-46eb-a420-eb09cfb61ea7,30479957,30479957-2020,,,,"ADQUISICION CAMIÓN DE LIMPIEZA Y SUCCIÓN, COMUNA DE SAN IGNACIO",30479957,C-33,EJECUCIÓN,MUNICIPIO,,DIGUILLÍN,SAN IGNACIO,IDIS,PROYECTO,MEC-001
5d2e0242-3d08-4985-9696-e8abcf9299c8,30480002,30480002-2019,,,,"CONSTRUCCIÓN SISTEMA DE APR LA INVERNADA, COMUNA DE PINTO",30480002,MIDESO,EJECUCIÓN,MUNICIPIO,,DIGUILLÍN,PINTO,IDIS,PROYECTO,MEC-001
f4280ba9-db70-4422-ab2e-a0c8f99e0739,30480618,30480618-2020,,,,"REPOSICION CAMION RECOLECTOR DE BASURA, COMUNA DE SAN IGNACIO",30480618,C-33,EJECUCIÓN,MUNICIPIO,,DIGUILLÍN,SAN IGNACIO,IDIS,PROYECTO,MEC-001
f462ee63-6163-4e8c-b943-a73b1de3486a,30480621,30480621-2021,,,,"ADQUISICIÓN GABINETE PSICOTÉCNICO, COMUNA DE SAN IGNACIO",30480621,C-33,EJECUCIÓN,MUNICIPIO,,DIGUILLÍN,SAN IGNACIO,IDIS,PROYECTO,MEC-001
c3112681-0ddf-4cbf-a140-9cfa8db38c7d,30480682,30480682-2021,,,,"CONSTRUCCION APERTURA Y PAVIMENTACIÓN CALLE SCHLEYER, CHILLÁN",30480682,MIDESO,EJECUCIÓN,MUNICIPIO,,DIGUILLÍN,CHILLÁN,IDIS,PROYECTO,MEC-001
8b30d926-0a46-4d54-a0f4-aad640feb8de,30480687,30480687-2021,30480687,,,"MEJORAMIENTO ESTADIO MUNICIPAL DE RECINTO, COMUNA DE PINTO",30480687,MIDESO,EJECUCIÓN,MUNICIPIO,,DIGUILLÍN,PINTO,IDIS,PROYECTO,MEC-001
dd6f4263-dbc7-4f9f-8583-adb067fdffe8,30480688,30480688-2019,,,,REPOSICION Y ADQUISICIÓN AMBULANCIAS COMUNA DE PEMUCO,30480688,C-33,EJECUCIÓN,MUNICIPIO,,DIGUILLÍN,PEMUCO,IDIS,PROYECTO,MEC-001
ccd0fe3d-7c40-4f09-9362-3fcf6e386e0f,30480902,30480902-2019,,,,CONSTRUCCION Y EQUIPAMIENTO NUEVO PARQUE MUJNICIPAL DE NINHUE,30480902,MIDESO,DISEÑO,MUNICIPIO,,ITATA,NINHUE,IDIS,PROYECTO,MEC-001
77e2ad40-05ed-49d2-ac15-9b09af89d468,30480903,30480903-2020,,,,MEJORAMIENTO PLANTA DE TRATAMIENTO AGUAS SERVIDAS SAN NICOLAS,30480903,MIDESO,EJECUCIÓN,MUNICIPIO,,PUNILLA,SAN NICOLÁS,IDIS,PROYECTO,MEC-001
daa74b7a-59cc-4b56-ada6-af2ceab0e604,30480963,30480963-2021,,,,REPOSICION CESFAM COMUNA DE PORTEZUELO,30480963,MIDESO,DISEÑO,MUNICIPIO,,ITATA,PORTEZUELO,IDIS,PROYECTO,MEC-001
4ec96bf4-b8ad-4842-8f50-7fd3f18af48f,30480977,30480977-2019,,,,CONSTRUCCION PAVIMENTOS DIVERSAS CALLES COMUNA DE PEMUCO,30480977,MIDESO,EJECUCIÓN,MUNICIPIO,,DIGUILLÍN,PEMUCO,IDIS,PROYECTO,MEC-001
c9f29b72-1e84-4b84-9d80-77641632dae2,30480993,30480993-2019,,,,ADQUISICION CAMIÓN LIMPIA FOSA PARA LA MUNICIPALIDAD DE TREHUACO,30480993,C-33,EJECUCIÓN,MUNICIPIO,,ITATA,TREGUACO,IDIS,PROYECTO,MEC-001
54d6a271-c933-415c-8f17-3fdb0dee3806,30481004,30481004-2019,,,,"REPOSICION PARCIAL, NORMALIZACIÓN Y AMPLIACIÓN LICEO MANUEL JESÚS ORTIZ",30481004,MIDESO,DISEÑO,MUNICIPIO,,DIGUILLÍN,SAN IGNACIO,IDIS,PROYECTO,MEC-001
c5e9180c-fa31-4ae9-8fe2-ed7f4d24d811,30481716,30481716-2019,,,,"CONSTRUCCION GRADERIAS DIVERSAS CANCHAS DE FUTBOL RURALES, COIHUECO",30481716,FRIL,EJECUCIÓN,MUNICIPIO,,PUNILLA,COIHUECO,IDIS,PROYECTO,MEC-001
e52ec708-5c95-4051-857a-af0aa7b94f20,30482161,30482161-2019,,,,"CONSTRUCCION PLAZA DE AGUA PARQUE VIOLETA PARRA, SAN CARLOS",30482161,FRIL,EJECUCIÓN,MUNICIPIO,,PUNILLA,SAN CARLOS,IDIS,PROYECTO,MEC-001
b432ca77-8184-4164-8008-0e26888f9380,30482363,30482363-2019,,,,"CONSTRUCCION MULTICANCHA SECTOR LOS GUINDOS, COMUNA DE ÑIQUEN",30482363,FRIL,EJECUCIÓN,MUNICIPIO,,PUNILLA,ÑIQUÉN,IDIS,PROYECTO,MEC-001
482a4ef4-d68c-4f41-b253-cac339b8fdf6,30482365,30482365-2019,,,,"CONSTRUCCION TECHADO PLAZA DE ARMAS SAN GREGORIO, COMUNA DE ÑIQUEN",30482365,FRIL,EJECUCIÓN,MUNICIPIO,,PUNILLA,ÑIQUÉN,IDIS,PROYECTO,MEC-001
52ac14ed-2de6-426e-9ee5-7a0ae66c75e7,30482782,30482782-2019,,,,"CONSTRUCCION SEDE SOCIAL POBLACIÓN PABLO NERUDA, QUIRIHUE",30482782,FRIL,EJECUCIÓN,MUNICIPIO,,ITATA,QUIRIHUE,IDIS,PROYECTO,MEC-001
da34641e-00cf-47a9-925e-a25cce6fccaa,30482911,30482911-2020,,,,"CONSTRUCCION SEDE SOCIAL PILICURA, COMUNA DE COBQUECURA",30482911,FRIL,EJECUCIÓN,MUNICIPIO,,ITATA,COBQUECURA,IDIS,PROYECTO,MEC-001
