id,nombre_original,nombre_normalizado,nombre_nlp,rut,fuente_original,tipo_institucion
e18ee083-1967-4ea1-8f25-e0cffcdbcc27,CLUB DEPORTIVO SAETURY CHILLAN,CD SAETURY CHILLAN,CD SAETURY CHILLAN,65.160.831-7,PROGS,OSC
ba245b60-1aaf-4746-a64a-1dfdef7f9dae,CLUB DE CAZA Y PESCA DIGUILLIN,CLUB DE CAZA Y PESCA DIGUILLIN,CLUB CAZA PESCA DIGUILLIN,65.055.211-3,PROGS,OSC
3947f3b3-765a-4d30-aa1b-c2c41328c44d,CLUB DEPORTIVO PANGAL DEL LAJA,CD PANGAL DEL LAJA,CD PANGAL LAJA,65.195.774-K,PROGS,OSC
28a4d7db-f139-4ee5-889b-44b6ed3966ed,CLUB DEPORTIVO BOCA ITATA AZUL,CD BOCA ITATA AZUL,CD BOCA ITATA AZUL,65.097.752-1,PROGS,OSC
2458fb61-c214-4dee-b3ad-401e9c2e917b,UNION COMUNAL DE FUTBOL NINHUE,UNION COMUNAL DE FUTBOL NINHUE,UNION COMUNAL FUTBOL NINHUE,65.168.222-3,PROGS,OSC
755a091c-5bbf-4be0-a06f-24f1e1cac1a7,CLUB DEPORTIVO ÑIQUÉN ESTACIÓN,CD ÑIQUÉN ESTACIÓN,CD ÑIQUÉN ESTACIÓN,65.004.037-6,PROGS,OSC
f7ae80c0-f5fd-4250-b854-3ca00146945e,CLUB SOCIAL DEPORTIVO COIHUECO,CLUB SOCIAL DEPORTIVO COIHUECO,CLUB COIHUECO,71.768.500-8,PROGS,OSC
6706e2a3-c35d-49d3-960e-0cae00ddcb5f,CLUB DE DEPORTES UNION ZAÑARTU,CLUB DE DEPORTES UNION ZAÑARTU,CLUB DEPORTES UNION ZAÑARTU,73.286.300-1,PROGS,OSC
8fe42775-821d-4758-9fa3-07ae23ef4c53,CLUB DEPORTIVO NUEVA ESPERANZA,CD NUEVA ESPERANZA,CD NUEVA ESPERANZA,65.067.120-1,PROGS,OSC
04701265-b103-479d-823d-9011a4e022e9,CLUB DEPORTIVO Y SOCIAL TIGRES,CD Y SOCIAL TIGRES,CD TIGRES,65.195.661-7,PROGS,OSC
76c6fb2c-472c-4686-89d1-a6996fca0f37,CLUB DE CAZA Y PESCA AVE Y PEZ,CLUB DE CAZA Y PESCA AVE Y PEZ,CLUB CAZA PESCA AVE PEZ,65.041.181-1,PROGS,OSC
771fa3d4-f1c8-4074-b00d-f1d041a2e557,ESCUELA DE FÚTBOL GENERAL CRUZ,ESCUELA DE FÚTBOL GENERAL CRUZ,ESCUELA FÚTBOL CRUZ,65.164.215-9,PROGS,OTROS
1f78a4c9-3653-4fe3-8819-d5724cdd81c0,CLUB DEPORTIVO GUARILIHUE BAJO,CD GUARILIHUE BAJO,CD GUARILIHUE BAJO,75.476.500-3,PROGS,OSC
1af5174a-9530-46d9-a41d-c3f57725d978,COMITE AGUA POTABLE LOS AROMOS,COMITE AGUA POTABLE LOS AROMOS,COMITE AGUA POTABLE AROMOS,65.426.110-5,PROGS,OSC
694d3a92-2406-4efa-b7ac-06379fcbd137,CLUB DEPORTIVO BERNARDO OLALDE,CD BERNARDO OLALDE,CD BERNARDO OLALDE,72.745.600-7,PROGS,OSC
d55061c1-9f01-41c9-a4e9-dfb50d08523e,COMITÉ FEMENINO SANTA TERESITA,COMITÉ FEMENINO SANTA TERESITA,COMITÉ FEMENINO SANTA TERESITA,73.300.200-K,PROGS,OSC
34ed5971-cd1c-45ed-b449-6b0e7bbd0f36,COMITÉ DE DAMAS RENÉ SCHNEIDER,COMITÉ DE DAMAS RENÉ SCHNEIDER,COMITÉ DAMAS RENÉ SCHNEIDER,74.983.500-1,PROGS,OSC
1493a408-fafc-4b69-834f-b33f4751618e,TALLER DE MANUALIDADES RENACER,TALLER DE MANUALIDADES RENACER,TALLER MANUALIDADES RENACER,65.121.786-5,PROGS,OSC
e912df5f-1978-466f-9900-a8043bdc6ec9,COMITÉ FEMENINO LAS CARMELITAS,COMITÉ FEMENINO LAS CARMELITAS,COMITÉ FEMENINO CARMELITAS,75.476.700-6,PROGS,OSC
f8ea889e-d2db-4481-8548-b66bef7b7e53,CLUB DE LA AMISTAD DE QUIRIHUE,CLUB DE LA AMISTAD DE QUIRIHUE,CLUB AMISTAD QUIRIHUE,65.534.060-2,PROGS,OSC
1f15b1a4-db30-4aff-bf9a-0997f07e4126,TALLER DE MUJERES LAS CHINITAS,TALLER DE MUJERES LAS CHINITAS,TALLER MUJERES CHINITAS,65.030.142-0,PROGS,OSC
eb18ed20-fcf3-46fb-b3b0-4be74e963183,JUNTA DE VECINOS LLAHUEN CHICO,JV LLAHUEN CHICO,JV LLAHUEN CHICO,64.014.186-5,PROGS,OSC
4bb25f26-541e-44ac-9171-d83d47076640,COMITE DE ADELANTO DE CALABOZO,COMITE DE ADELANTO DE CALABOZO,COMITE ADELANTO CALABOZO,74.042.900-0,PROGS,OSC
29d5a401-8ae2-4148-8cb9-ac1d5cf82394,JUNTA DE VECINOS CARTAGO N 9 R,JV CARTAGO N 9 R,JV CARTAGO N 9 R,72.618.900-5,PROGS,OSC
60e53293-cf0c-4f4e-a197-039a6c047941,JUNTA DE VECINOS BLANCA ALAMOS,JV BLANCA ALAMOS,JV BLANCA ALAMOS,73.625.700-9,PROGS,OSC
71415390-9684-4495-afd7-0a3909abd018,JUNTA DE VECINOS VILLA PRIMERA,JV VILLA PRIMERA,JV VILLA PRIMERA,65.383.330-K,PROGS,OSC
ecd3fe5e-ee9a-4274-b4bc-493141bcbbfd,JUNTA DE VECINOS PADRE HURTADO,JV PADRE HURTADO,JV PADRE HURTADO,65.252.490-7,PROGS,OSC
25fba4c2-ac91-450b-92f3-ffb7087d4050,JUNTA DE VECINOS VILLA PARAISO,JV VILLA PARAISO,JV VILLA PARAISO,65.021.115-4,PROGS,OSC
41b42c87-1349-467f-943d-656e469534a3,JUNTA DE VECINOS N 3 EL RINCON,JV N 3 EL RINCON,JV N 3 RINCON,74.478.000-4,PROGS,OSC
4a362d93-af42-46f2-8504-af717249d44f,JUNTA DE VECINO 4-U CAMPANARIO,JUNTA DE VECINO 4-U CAMPANARIO,JUNTA VECINO 4 U CAMPANARIO,71.436.900-8,PROGS,OTROS
52500a5f-4f8f-48bd-bc02-689315bc8d2a,JUNTA DE VECINOS LA CONCEPCIÓN,JV LA CONCEPCIÓN,JV CONCEPCIÓN,74.095.300-1,PROGS,OSC
e58bd3bd-8a26-47a1-944d-0526220bf49e,JUNTA DE VECINOS MARIANO EGAÑA,JV MARIANO EGAÑA,JV MARIANO EGAÑA,74.784.200-0,PROGS,OSC
1727bb63-a7b3-4cf7-b194-72830e0f2459,JUNTA DE VECINOS VILLA RENACER,JV VILLA RENACER,JV VILLA RENACER,65.225.306-7,PROGS,OSC
f23d72b4-0561-49cb-8a44-859897ef53f8,CUERPO DE BOMBEROS DE QUIRIHUE,CUERPO DE BOMBEROS DE QUIRIHUE,CUERPO BOMBEROS QUIRIHUE,71.452.800-9,PROGS,OSC
1a3a3fc1-b490-41b4-abb4-b8231144dd4c,JUNTA DE VECINOS MONTELEON SUR,JV MONTELEON SUR,JV MONTELEON SUR,65.043.246-0,PROGS,OSC
487faa03-be7f-414b-a996-161f8952de83,JUNTA DE VECINOS TRES ESQUINAS,JV TRES ESQUINAS,JV TRES ESQUINAS,73.234.400-4,PROGS,OSC
d8befaca-5711-40fb-9b34-d70436969c25,JUNTA DE VECINOS LOS ESTANQUES,JV LOS ESTANQUES,JV ESTANQUES,73.577.400-K,PROGS,OSC
29a2cc6f-2812-4fd3-9747-f0bc1d3a24f3,COMITE DE DESARROLLO SAN RAMON,COMITE DE DESARROLLO SAN RAMON,COMITE DESARROLLO SAN RAMON,65.172.021-4,PROGS,OSC
54b9fe9e-b312-4151-9ffc-eb39b85e57da,JUNTA DE VECINOS FRUTILLAR SUR,JV FRUTILLAR SUR,JV FRUTILLAR SUR,65.185.240-4,PROGS,OSC
dd4f4c8a-22ef-4c57-aedb-e76d26026574,JUNTA DE VECINOS LOS RASTROJOS,JV LOS RASTROJOS,JV RASTROJOS,65.587.940-4,PROGS,OSC
e61ba33f-426c-4b2e-9b4f-152e2cd0c317,JUNTA DE VECINOS MONTAÑA GARAY,JV MONTAÑA GARAY,JV MONTAÑA GARAY,65.960.890-1,PROGS,OSC
dc3da7c7-f4af-4e76-8bc8-5b5773470306,JUNTA DE VECINOS ISLAS DEL SUR,JV ISLAS DEL SUR,JV ISLAS SUR,65.261.450-7,PROGS,OSC
aa29756d-5d23-45f3-89e4-c965096161f1,JUNTA DE VECINOS LAS ARBOLEDAS,JV LAS ARBOLEDAS,JV ARBOLEDAS,73.399.200-K,PROGS,OSC
5af4bd17-c4e8-482c-855b-fcb966afec99,JUNTA DE VECINOS RISCO EL LEON,JV RISCO EL LEON,JV RISCO LEON,65.894.410-K,PROGS,OSC
cd480058-339c-44ee-a201-084a983e281b,JUNTA DE VECINOS 12 DE OCTUBRE,JV 12 DE OCTUBRE,JV 12 OCTUBRE,74.095.100-9,PROGS,OSC
2a03d094-1c8d-497f-b2f9-dac79988f313,UNION COMUNAL JUNTA DE VECINOS,UNION COMUNAL JUNTA DE VECINOS,UNION COMUNAL JUNTA VECINOS,71.435.900-2,PROGS,OSC
d59c71fc-9c8d-470d-a7a0-ed72c29de2a2,JUNTA DE VECINOS DE LAS NIEVES,JV DE LAS NIEVES,JV NIEVES,72.113.600-0,PROGS,OSC
a8f874d6-dd93-40d1-bf99-8c121f2123f5,JUNTA DE VECINOS MONTE EL LEON,JV MONTE EL LEON,JV MONTE LEON,72.297.700-9,PROGS,OSC
4d5a5b29-4af4-4011-b899-17bc279d9618,COMITE DE ADELANTO EL ESFUERZO,COMITE DE ADELANTO EL ESFUERZO,COMITE ADELANTO ESFUERZO,65.178.413-1,PROGS,OSC
cb461fe7-a201-47da-a554-f2964fddb8f8,COMITE DE VIVIENDA VILLA ALICO,COMITE DE VIVIENDA VILLA ALICO,COMITE VIVIENDA VILLA ALICO,75.034.100-4,PROGS,OSC
86ce2508-77c5-4763-b984-e7406d3f2516,TALLER DE MUJERES SANA ADRIANA,TALLER DE MUJERES SANA ADRIANA,TALLER MUJERES SANA ADRIANA,65.077.433-7,PROGS,OSC
908dd8a3-902a-4bc1-a4b3-64ad1368f1cf,CLUB DEPORTIVO 21 DE DICIEMBRE,CD 21 DE DICIEMBRE,CD 21 DICIEMBRE,74.911.300-6,PROGS,OSC
78a62c39-e02b-469e-a6ab-8af0886d0be1,CORPORACION SOCIAL ÑUBLE MAYOR,CORPORACION SOCIAL ÑUBLE MAYOR,CORPORACION MAYOR,65.198.507-2,PROGS,OSC
d7f2434f-d2a6-42d9-9ad4-a567de766690,JUNTA DE VECINOS PAN DE AZUCAR,JV PAN DE AZUCAR,JV PAN AZUCAR,65.123.238-4,PROGS,OSC
d3156d14-dd51-458d-8086-f88a43a1810a,CLUB DE ADULTO MAYOR LIBERTAD,CLUB DE ADULTO MAYOR LIBERTAD,CLUB LIBERTAD,62.634.443-K,PROGS,OSC
d06288bb-63bd-4102-8fce-64187b2fa486,CLUB DEL ADULTO MAYOR EMANUEL,CLUB DEL ADULTO MAYOR EMANUEL,CLUB EMANUEL,65.092.294-8,PROGS,OSC
c3a3ac4f-ae41-4f05-86d8-620dbd918519,CLUB ADULTO MAYOR GRUPO CORAL,CLUB ADULTO MAYOR GRUPO CORAL,CLUB GRUPO CORAL,65.743.460-4,PROGS,OSC
99f87005-1b68-4380-9af5-e576d319defd,CLUB ADULTO MAYOR LAS TABITAS,CLUB ADULTO MAYOR LAS TABITAS,CLUB TABITAS,65.060.386-9,PROGS,OSC
29fbe44d-d5fa-4bf6-b493-e8eb8401321a,CLUB DE CUECA HERNÁN TRONCOSO,CLUB DE CUECA HERNÁN TRONCOSO,CLUB CUECA HERNÁN TRONCOSO,65.184.078-3,PROGS,OSC
e4ebc173-7946-4e7b-91a7-4f12d71704fe,TALLER DE MUJERES CRISTO VIVO,TALLER DE MUJERES CRISTO VIVO,TALLER MUJERES CRISTO VIVO,65.069.420-1,PROGS,OSC
92fb3973-0f6a-4dc5-8780-e3f080c97cac,TALLER LABORAL DAMAS DEL ARTE,TALLER LABORAL DAMAS DEL ARTE,TALLER LABORAL DAMAS ARTE,65.317.120-K,PROGS,OSC
a0e400ee-0a47-429e-8d31-cb781a6a794d,CLUB DE RAYUELA UNION COELEMU,CLUB DE RAYUELA UNION COELEMU,CLUB RAYUELA UNION COELEMU,65.059.734-6,PROGS,OSC
ab42abeb-5642-4453-9b7c-5bd4f841ae0c,JUNTA DE VECINOS CALLE ALEGRE,JV CALLE ALEGRE,JV CALLE ALEGRE,65.001.440-5,PROGS,OSC
b08542e8-dd2b-4c2c-bc29-e5a13a494c2d,JUNTA DE VECINOS 3 DE OCTUBRE,JV 3 DE OCTUBRE,JV 3 OCTUBRE,65.416.740-0,PROGS,OSC
4d9f50d2-10a0-428e-8d68-5e5ef08841d3,CLUB DEPORTIVO REAL BAQUEDANO,CD REAL BAQUEDANO,CD REAL BAQUEDANO,74.475.000-8,PROGS,OSC
1b885fb4-cb98-43f8-aadb-52e5215aba3a,CLUB DEPORTIVO UNIÓN CATÓLICA,CD UNIÓN CATÓLICA,CD UNIÓN CATÓLICA,65.132.910-8,PROGS,OSC
46eb47f5-832f-4ba7-bb76-97510b4791c5,CLUB DEPORTIVO UNIÓN MARDONES,CD UNIÓN MARDONES,CD UNIÓN MARDONES,65.043.140-5,PROGS,OSC
d33301f8-0352-4ff3-9810-59c8ea26084a,CLUB DEPORTIVO JUVENIL OBRERO,CD JUVENIL OBRERO,CD OBRERO,71.490.600-3,PROGS,OSC
d1caa76b-9b7a-4084-874a-a6e57e90458c,CLUB DE AJEDREZ CHILLAN VIEJO,CLUB DE AJEDREZ CHILLAN VIEJO,CLUB AJEDREZ CHILLAN VIEJO,65.069.740-5,PROGS,OSC
604f0e36-cc75-4f37-b273-4f30b9ef45f8,CLUB DEPORTIVO ROBERTO MATEOS,CD ROBERTO MATEOS,CD ROBERTO MATEOS,65.035.049-9,PROGS,OSC
c38f24ea-689c-43f6-8703-3f9703eaa1fc,COMITÉ FEMENINO LAS MARIPOSAS,COMITÉ FEMENINO LAS MARIPOSAS,COMITÉ FEMENINO MARIPOSAS,65.824.620-8,PROGS,OSC
a36a0a6a-80a7-4d8a-8934-fe2bd24aea28,JUNTA DE VECINOS PASO EL LEON,JV PASO EL LEON,JV PASO LEON,72.486.300-0,PROGS,OSC
08eb068e-f55f-4122-98ea-bfeb17585888,CENTRO DE MADRES CUNA DE PRAT,CENTRO DE MADRES CUNA DE PRAT,CENTRO MADRES CUNA PRAT,73.472.200-6,PROGS,OTROS
5cd1c4ad-22a9-4b9e-8cd5-5cc782382edf,JUNTA DE VECINOS SAN GREGORIO,JV SAN GREGORIO,JV SAN GREGORIO,65.190.186-3,PROGS,OSC
331b73f7-640a-4a34-8d93-82b8afd633c6,CENTRO DE MADRES LAS VIOLETAS,CENTRO DE MADRES LAS VIOLETAS,CENTRO MADRES VIOLETAS,65.010.846-9,PROGS,OTROS
5768d203-5e84-4732-a5be-b63497d21f06,JUNTA DE VECINOS UVAS BLANCAS,JV UVAS BLANCAS,JV UVAS BLANCAS,74.039.800-8,PROGS,OSC
44859b10-8863-4275-9303-ed3f2abae809,JUNTA DE VECINOS CERRO NINHUE,JV CERRO NINHUE,JV CERRO NINHUE,65.598.590-5,PROGS,OSC
58118666-ed30-4e6c-9f26-d4dc3597f4bc,JUNTA DE VECINOS LA MARAVILLA,JV LA MARAVILLA,JV MARAVILLA,75.946.250-5,PROGS,OSC
e1a9a22b-4715-4921-9028-37208053edcf,JUNTA DE VECINOS BUENOS AIRES,JV BUENOS AIRES,JV BUENOS AIRES,72.146.800-3,PROGS,OSC
2d2692d1-cc0e-4754-a35c-b9a72afb22ae,JUNTA DE VECINOS SAN FERNANDO,JV SAN FERNANDO,JV SAN FERNANDO,65.465.960-5,PROGS,OSC
ea44c679-43fd-43ef-8bd7-e07ee395e9d5,COMITE DE DESARROLLO LA BALSA,COMITE DE DESARROLLO LA BALSA,COMITE DESARROLLO BALSA,65.066.032-3,PROGS,OSC
a1dac053-a781-4c93-a46e-bca32b30d2ee,JUNTA DE VECINOS SANTA ELVIRA,JV SANTA ELVIRA,JV SANTA ELVIRA,65.261.390-K,PROGS,OSC
8e488dd0-ed64-4bac-b689-10566769d3f7,JUNTA DE VECINOS BULI CASERIO,JV BULI CASERIO,JV BULI CASERIO,65.284.390-5,PROGS,OSC
c2a25199-0ecd-4230-9d5f-6b7e67e4e803,JUNTA DE VECINOS 7R HUACAMALA,JV 7R HUACAMALA,JV 7R HUACAMALA,72.924.800-2,PROGS,OSC
8b91794c-a08e-42ab-85a8-4ad364ea0dcc,COMITÉ DE VIVIENDA BUCHUPUREO,COMITÉ DE VIVIENDA BUCHUPUREO,COMITÉ VIVIENDA BUCHUPUREO,65.443.920-6,PROGS,OSC
760f591c-0010-4eec-b6f4-9b0c7ab14180,JUNTA DE VECINOS VILLA ALEGRE,JV VILLA ALEGRE,JV VILLA ALEGRE,73.723.800-8,PROGS,OSC
1bc23fb9-4f62-4803-a379-bbeb22032a97,JUNTA DE VECINOS TORREÓN BAJO,JV TORREÓN BAJO,JV TORREÓN BAJO,75.657.200-8,PROGS,OSC
4df46759-ef51-4c3a-8828-b5d91e21342a,JUNTA DE VECINOS ORILLA ITATA,JV ORILLA ITATA,JV ORILLA ITATA,72.393.300-5,PROGS,OSC
0fd44d0e-6543-44eb-ad90-82ac456b8502,JUNTA DE VECINOS BULI ORIENTE,JV BULI ORIENTE,JV BULI ORIENTE,73.717.600-2,PROGS,OSC
a9dcccdd-650f-4b0a-bb33-e0721781222a,JUNTA DE VECINOS PUENTE ITATA,JV PUENTE ITATA,JV PUENTE ITATA,74.041.500-K,PROGS,OSC
dbe74217-aedf-46d7-b2cf-32841822b487,JUNTA DE VECINOS RIOS DEL SUR,JV RIOS DEL SUR,JV RIOS SUR,65.264.400-7,PROGS,OSC
b7369715-c3a9-46c1-920e-ae3a02ba8af5,COMITE DE AGUA FINA DE BATUCO,COMITE DE AGUA FINA DE BATUCO,COMITE AGUA FINA BATUCO,65.202.170-0,PROGS,OSC
60398308-1389-401a-b233-958795c81d3d,JUNTA DE VECINOS LOS PUELCHES,JV LOS PUELCHES,JV PUELCHES,65.902.380-6,PROGS,OSC
8286d1a7-d712-42b6-8624-5f16929cc1e8,JUNTA DE VECINOS PASO PERALES,JV PASO PERALES,JV PASO PERALES,65.294.320-9,PROGS,OSC
59ebbcb0-5e4d-41d2-9e61-fc949f40f52d,JUNTA DE VECINOS SANTA AMELIA,JV SANTA AMELIA,JV SANTA AMELIA,65.172.671-9,PROGS,OSC
4badb9da-e435-40dc-832e-dee4a86b9f38,JUNTA DE VECINOS COLEAL NORTE,JV COLEAL NORTE,JV COLEAL NORTE,65.034.120-1,PROGS,OSC
51e4adac-3b12-4ca9-9fe8-38d185a9adcf,JUNTA DE VECINOS VEGAS VERDES,JV VEGAS VERDES,JV VEGAS VERDES,65.340.060-8,PROGS,OSC
e1a3f3e3-17a3-4c6d-8e7d-2bc8e0f9c567,JUNTA DE VECINOS 5R HUECHUPÍN,JV 5R HUECHUPÍN,JV 5R HUECHUPÍN,65.900.950-1,PROGS,OSC
1f853708-7cc8-4e14-8ce2-08983e702e58,JUNTA DE VECINOS LOS COPIHUES,JV LOS COPIHUES,JV COPIHUES,65.006.581-6,PROGS,OSC
b181df31-318a-4b86-bf0a-dde8ce6e39a7,JUNTA DE VECINOS Nº 9 R HUAPE,JV Nº 9 R HUAPE,JV Nº 9 R HUAPE,65.843.840-9,PROGS,OSC
128cb38c-0e16-4666-87a5-8b4ccb0e1f18,JUNTA DE VECINOS NRO.1 URBANA,JV NRO.1 URBANA,JV NRO 1 URBANA,71.984.300-K,PROGS,OSC
309d3bff-a291-4308-ba0c-e585928e73a6,JUNTA DE VECINOS LOS NARANJOS,JV LOS NARANJOS,JV NARANJOS,65.429.580-8,PROGS,OSC
3e5505ad-22da-4898-925a-5dd3a7ad5d55,JUNTA DE VECINOS PABLO NERUDA,JV PABLO NERUDA,JV PABLO NERUDA,65.185.504-7,PROGS,OSC
42fd40cc-0378-4ea1-9531-de10b6db7ad4,JUNTA DE VECINOS VILLA MADRID,JV VILLA MADRID,JV VILLA MADRID,65.091.190-3,PROGS,OSC
f6132f1e-1a84-4d9a-8fcc-4e61b6b4c871,JUNTA DE VECINOS AGUAS AZULES,JV AGUAS AZULES,JV AGUAS AZULES,65.566.090-9,PROGS,OSC
ffdfab85-704b-4469-8e86-100b673f35ba,JUNTA DE VECINOS EL MEMBRILLO,JV EL MEMBRILLO,JV MEMBRILLO,65.005.660-4,PROGS,OSC
8faa266e-4804-47a8-b3d7-a2418a2bbd4c,JUNTA DE VECINOS LLAHUEN BAJO,JV LLAHUEN BAJO,JV LLAHUEN BAJO,72.192.600-1,PROGS,OSC
d08f0f70-5e64-4b82-bdc2-dbd737c79a22,JUNTA DE VECINOS VALLE ALEGRE,JV VALLE ALEGRE,JV VALLE ALEGRE,74.730.400-9,PROGS,OSC
f2daef74-c195-4495-8e01-2b1ed5c4891d,AGRUPACION DE ARTESANOS KELLU,AGRUPACION DE ARTESANOS KELLU,AGRUPACION ARTESANOS KELLU,65.213.304-5,PROGS,OSC
af3a8d60-2148-4e40-bb24-7b0f45686293,CENTRO DE MADRES PUEBLO PINTO,CENTRO DE MADRES PUEBLO PINTO,CENTRO MADRES PUEBLO PINTO,73.947.000-5,PROGS,OTROS
54705621-1fa9-4964-80dc-351fd876785d,JUNTA DE VECINOS LAS VIOLETAS,JV LAS VIOLETAS,JV VIOLETAS,65.107.586-6,PROGS,OSC
2e84aa98-4996-4db3-928f-eee4d191ab3b,AGRUPACION MANOS DE ARTESANAS,AGRUPACION MANOS DE ARTESANAS,AGRUPACION MANOS ARTESANAS,65.146.242-8,PROGS,OSC
215c72fd-f6c1-466a-8415-a3e62639da46,CLUB ADULTO MAYOR LUZ Y VIDA,CLUB ADULTO MAYOR LUZ Y VIDA,CLUB LUZ VIDA,65.024.185-1,PROGS,OSC
349aeb60-1455-429b-bb42-0d87ab9a3ab0,GRUPO ADULTO MAYOR ARCO IRIS,GRUPO ADULTO MAYOR ARCO IRIS,GRUPO ARCO IRIS,65.650.970-8,PROGS,OTROS
91de9901-90e1-441e-ab5a-a69583f0b47f,CLUB ADULTO MAYOR SANTA INES,CLUB ADULTO MAYOR SANTA INES,CLUB SANTA INES,65.075.806-4,PROGS,OSC
0a86a536-1792-49d3-a84b-29f2ebd25df7,CLUB ADULTO MAYOR EL QUILLAY,CLUB ADULTO MAYOR EL QUILLAY,CLUB QUILLAY,65.125.220-2,PROGS,OSC
a8d23fde-bd72-4f39-a493-686964bc0b51,FERIA CAMPESINA MAR Y TIERRA,FERIA CAMPESINA MAR Y TIERRA,FERIA MAR TIERRA,65.184.099-6,PROGS,OTROS
a0f2ad83-3c59-4290-911f-9e45a75ed99d,ASOCIACIÓN INDÍGENA ANTU WAW,ASOCIACIÓN INDÍGENA ANTU WAW,ASOCIACIÓN INDÍGENA ANTU WAW,65.180.868-5,PROGS,OSC
9f159059-ba41-46f2-a5f3-ff14c3f8dbbb,COMITE DE VIVIENDA ESPERANZA,COMITE DE VIVIENDA ESPERANZA,COMITE VIVIENDA ESPERANZA,65.211.798-8,PROGS,OSC
68c7aefc-5cfb-4b6f-8a7b-c49a90cbde88,JUNTA DE VECINOS BARRIO ALTO,JV BARRIO ALTO,JV BARRIO ALTO,65.702.060-5,PROGS,OSC
eeb1b4bc-078f-4bf5-9810-6d1e6adc62ec,ASOCIACIÓN INDÍGENA COIHUECO,ASOCIACIÓN INDÍGENA COIHUECO,ASOCIACIÓN INDÍGENA COIHUECO,65.110.126-3,PROGS,OSC
5cc4848c-eef9-4990-ad52-bdf8033812b3,CLUB DEPORTIVO HERNAN BRAÑAS,CD HERNAN BRAÑAS,CD HERNAN BRAÑAS,74.787.600-2,PROGS,OSC
222524f1-fff7-4077-9951-2356822a51b0,ESCUELA DE TAEKWONDO HWARANG,ESCUELA DE TAEKWONDO HWARANG,ESCUELA TAEKWONDO HWARANG,65.160.979-8,PROGS,OTROS
9cacea3e-925c-4cd6-95f0-cd4ab413b1b1,ASOCIACIÓN DE FUTBOL RANQUIL,ASOCIACIÓN DE FUTBOL RANQUIL,ASOCIACIÓN FUTBOL RANQUIL,75.095.000-0,PROGS,OSC
144b3793-12da-4139-aa80-2170980cbd88,ASOCIACION DE FUTBOL QUILLON,ASOC FUTBOL QUILLON,ASOC FUTBOL QUILLON,65.032.455-2,PROGS,OSC
2a703976-6eb5-42a9-b422-3fc24cab5580,CLUB DEPORTIVO CERRO PORTEÑO,CD CERRO PORTEÑO,CD CERRO PORTEÑO,65.080.060-5,PROGS,OSC
e67ee709-311e-4d8c-a17f-096c93fd3fdc,CLUB DEPORTIVO FUTURO ALEGRE,CD FUTURO ALEGRE,CD FUTURO ALEGRE,65.448.820-7,PROGS,OSC
0f720bf3-00be-4148-b487-4e91e2d03a07,CLUB DEPORTIVO LOS CRISTALES,CD LOS CRISTALES,CD CRISTALES,65.250.460-4,PROGS,OSC
559b063a-0967-4295-b681-adacf96f835e,CLUB DEPORTIVO CHILLÁN VIEJO,CD CHILLÁN VIEJO,CD CHILLÁN VIEJO,71.109.900-K,PROGS,OSC
d0112802-6d99-4f92-af40-229cf1102524,ASOCIACION DE FUTBOL VECINAL,ASOC FUTBOL VECINAL,ASOC FUTBOL,75.937.680-3,PROGS,OSC
86395233-75b8-4bee-8841-bef0ff3fb507,CLUB DEPORTIVO LAS ARBOLEDAS,CD LAS ARBOLEDAS,CD ARBOLEDAS,71.378.900-3,PROGS,OSC
7d4942f8-f963-47ee-9503-2cd2ca4fdff8,CLUB DEPORTIVO COSMOS JUNIOR,CD COSMOS JUNIOR,CD COSMOS JUNIOR,65.021.104-9,PROGS,OSC
a9e85814-2ffb-457a-8a80-386f919b852f,ESCUELA DE FUTBOL BARRABASES,ESCUELA DE FUTBOL BARRABASES,ESCUELA FUTBOL BARRABASES,65.419.420-3,PROGS,OTROS
f694173c-28fc-4336-bf5c-575ce3f7a2c4,ASOCIACION DE FUTBOL COELEMU,ASOC FUTBOL COELEMU,ASOC FUTBOL COELEMU,65.138.750-7,PROGS,OSC
5ab2880f-7ec1-4e05-9dc2-fbb0c6d8747f,CLUB DEPORTIVO TRES ESQUINAS,CD TRES ESQUINAS,CD TRES ESQUINAS,65.769.560-2,PROGS,OSC
fb9ae636-ccc3-4ec2-b490-18875a2fe089,COMITÉ DE MUJERES PROYECCIÓN,COMITÉ DE MUJERES PROYECCIÓN,COMITÉ MUJERES PROYECCIÓN,65.444.560-5,PROGS,OSC
a1222291-843f-44e9-a58d-288bc4b2a635,JUNTA DE VECINOS LOS REMATES,JV LOS REMATES,JV REMATES,71.885.500-4,PROGS,OSC
0115e8c2-d6a6-4618-84f4-337a1ee23621,CENTRO DE MADRES DE TREHUACO,CENTRO DE MADRES DE TREHUACO,CENTRO MADRES TREHUACO,74.784.300-7,PROGS,OTROS
37fd3cb1-87b0-4d17-ba07-af4c26ac3e51,ASOCIACIÓN INDIGENA WENGAMEN,ASOCIACIÓN INDIGENA WENGAMEN,ASOCIACIÓN INDIGENA WENGAMEN,65.179.313-0,PROGS,OSC
6f7c9d11-e84a-4bd9-b004-9401417b681b,GRUPO DE MUJERES EL PROGRESO,GRUPO DE MUJERES EL PROGRESO,GRUPO MUJERES PROGRESO,65.103.494-9,PROGS,OTROS
45b58407-bc75-4cb0-9711-58879a0909e5,TALLER DE MUJERES SANTA INÉS,TALLER DE MUJERES SANTA INÉS,TALLER MUJERES SANTA INÉS,65.507.370-1,PROGS,OSC
90104d5f-ed25-4a11-ba13-5e140b759b4a,"JUNTA VECINAL N°15, ESFUERZO","JUNTA VECINAL N°15, ESFUERZO",JUNTA N°15 ESFUERZO,72.875.700-0,PROGS,OTROS
3f7cc026-7fef-42c7-837a-bc14748d3222,JUNTA DE VECINOS LOS GUINDOS,JV LOS GUINDOS,JV GUINDOS,65.314.810-0,PROGS,OSC
e4e590cd-28f5-4ec5-a27c-f9c1dedc03f1,JUNTA DE VECINOS EL CASTILLO,JV EL CASTILLO,JV CASTILLO,72.341.200-5,PROGS,OSC
c0032933-dbd3-404f-abcb-197237f2d7f0,JUNTA DE VECINOS LOS NOGALES,JV LOS NOGALES,JV NOGALES,65.214.903-0,PROGS,OSC
ee8772ae-e6ad-4547-a421-b8e18be7981c,JUNTA DE VECINOS SANTA SOFIA,JV SANTA SOFIA,JV SANTA SOFIA,65.295.630-0,PROGS,OSC
ae98a7ad-d7ad-4ddc-b39e-688c7f79f3c0,JUNTA DE VECINOS PAQUE NORTE,JV PAQUE NORTE,JV PAQUE NORTE,65.449.040-6,PROGS,OSC
2f163fe6-e716-445b-91ab-bb62ec90fc02,JUNTA DE VECINOS SANTA CLARA,JV SANTA CLARA,JV SANTA CLARA,65.045.240-2,PROGS,OSC
fca23ae3-d05a-4263-97c5-6495baedb9e7,JUNTA DE VECINOS VILLA ITATA,JV VILLA ITATA,JV VILLA ITATA,71.907.200-3,PROGS,OSC
8287b25f-0514-43b9-9ad2-3ad1d177b5b1,JUNTA DE VECINOS CARAVANCHEL,JV CARAVANCHEL,JV CARAVANCHEL,72.257.600-4,PROGS,OSC
2e09ad97-b09e-4e24-a30e-726294e29f71,JUNTA DE VECINOS EL ORATORIO,JV EL ORATORIO,JV ORATORIO,73.776.300-5,PROGS,OSC
fd54459f-a4a3-4b1a-855d-1929e2b2c3db,JUNTA DE VECINOS SANTA ELENA,JV SANTA ELENA,JV SANTA ELENA,65.586.070-3,PROGS,OSC
c0fd08cb-30db-4b0b-82fb-79273aaca607,JUNTA DE VECINOS EL AMANECER,JV EL AMANECER,JV AMANECER,65.269.950-2,PROGS,OSC
668134b4-6bd7-4533-a74e-08caabc7eb41,JUNTA DE VECINOS LOS CANELOS,JV LOS CANELOS,JV CANELOS,65.055.670-4,PROGS,OSC
a944d64b-641e-4e4e-b9a2-67a12a6b5eec,CLUB DEPORTIVO RODEO CHILENO,CD RODEO CHILENO,CD RODEO CHILENO,73.624.400-4,PROGS,OSC
c5f3c72b-2581-4995-aac9-3cc470ce1f65,JUNTA DE VECINOS VALLE VERDE,JV VALLE VERDE,JV VALLE VERDE,65.110.546-3,PROGS,OSC
800103b1-bcff-4df3-847d-274213a21a5f,JUNTA DE VECINOS SANTA JUANA,JV SANTA JUANA,JV SANTA JUANA,75.997.050-0,PROGS,OSC
1b08d374-20a0-488f-b7d8-88cb6d92d7d9,JUNTA DE VECINOS VISTA BELLA,JV VISTA BELLA,JV VISTA BELLA,65.699.430-4,PROGS,OSC
e99c7bf1-6639-4963-bc42-897cf3d6efd0,JUNTA DE VECINOS EL PEDREGAL,JV EL PEDREGAL,JV PEDREGAL,73.982.300-5,PROGS,OSC
f54f8f87-1848-473c-980a-b6ad1b751820,JUNTA DE VECINOS LLAHUMAVIDA,JV LLAHUMAVIDA,JV LLAHUMAVIDA,65.459.030-0,PROGS,OSC
b5e1a94c-367f-4b86-a390-5a66b811ed51,JUNTA DE VECINOS SAN AGUSTIN,JV SAN AGUSTIN,JV SAN AGUSTIN,65.987.300-1,PROGS,OSC
c6cf726e-1138-4e0b-be80-8300990abe94,CUERPO DE BOMBEROS DE BULNES,CUERPO DE BOMBEROS DE BULNES,CUERPO BOMBEROS BULNES,70.009.000-0,PROGS,OSC
acf726f0-0a7f-4be0-b531-93aaa433a94d,JUNTA DE VECINOS LA PALMERAS,JV LA PALMERAS,JV PALMERAS,65.183.550-K,PROGS,OSC
6a62b108-e0ca-435d-be87-a8910c21c1eb,JUNTA DE VECINOS MONTEBLANCO,JV MONTEBLANCO,JV MONTEBLANCO,72.925.800-8,PROGS,OSC
6189fdb7-d867-4acc-b6dc-504ae0443207,JUNTA DE VECINOS LOS VARONES,JV LOS VARONES,JV VARONES,65.615.710-0,PROGS,OSC
98fc90f3-0bfc-4304-aba1-697d6a083a40,JUNTA DE VECINOS CARRULLANCA,JV CARRULLANCA,JV CARRULLANCA,72.439.800-6,PROGS,OSC
7b39ca51-07c5-46a3-aa7f-a841d09097aa,JUNTA DE VECINOS Nº 10 PURÉN,JV Nº 10 PURÉN,JV Nº 10 PURÉN,71.769.000-1,PROGS,OSC
84b8ed5f-c0d9-4652-9a77-fe1f6b852c8d,CENTRO DE MADRES 27 DE ABRIL,CENTRO DE MADRES 27 DE ABRIL,CENTRO MADRES 27 ABRIL,65.874.330-9,PROGS,OTROS
85dbb765-458b-4c91-af0c-9c89c154cd25,JUNTA VECINAL N°6 LA CENTRAL,JUNTA VECINAL N°6 LA CENTRAL,JUNTA N°6 CENTRAL,74.144.200-0,PROGS,OTROS
cd20d781-5a36-43be-b465-dce9bbd7f5c5,JUNTA DE VECINOS SAN ESTEBAN,JV SAN ESTEBAN,JV SAN ESTEBAN,65.116.059-6,PROGS,OSC
041f4c86-8323-4549-bba8-7306496d2848,CLUB ADULTO MAYOR MAYULERMO,CLUB ADULTO MAYOR MAYULERMO,CLUB MAYULERMO,65.064.921-4,PROGS,OSC
06c7e2ea-21a8-498e-932a-3e7747ec9100,CLUBADULTOMAYOR ROCA FUERTE,CLUBADULTOMAYOR ROCA FUERTE,CLUBADULTOMAYOR ROCA FUERTE,65.188.048-3,PROGS,OTROS
e816f5be-7057-4c4c-902a-67a79448ea67,CLUB DE HUASOS CAIMA CAHUIN,CLUB DE HUASOS CAIMA CAHUIN,CLUB HUASOS CAIMA CAHUIN,65.470.330-2,PROGS,OSC
63a89daf-ec81-443d-826a-aad2bff10ba7,ESCUELA DE ROCK RANQUILINOS,ESCUELA DE ROCK RANQUILINOS,ESCUELA ROCK RANQUILINOS,65.225.641-4,PROGS,OTROS
d9947dab-d776-4d8e-842e-ece4b3b7118c,JUNTA DE VECINOS BOCA ITATA,JV BOCA ITATA,JV BOCA ITATA,65.565.960-9,PROGS,OSC
f7c062bc-c3e8-4546-a067-12e1a9c64ac4,COMITE DE FERIANTES COFENIN,COMITE DE FERIANTES COFENIN,COMITE FERIANTES COFENIN,65.103.223-7,PROGS,OSC
3a16c05e-d10d-4b4a-9ebc-b0759861d67c,TALLER LABORAL SANTA IRMINA,TALLER LABORAL SANTA IRMINA,TALLER LABORAL SANTA IRMINA,65.555.950-7,PROGS,OSC
5b71155d-2593-409c-a153-94bc8afc316c,CLUB DE HUASOS EL SEMBRADOR,CLUB DE HUASOS EL SEMBRADOR,CLUB HUASOS SEMBRADOR,65.076.630-K,PROGS,OSC
0ac1f8ef-4fd3-4ae2-9c2d-bf77a5d4f8c8,CLUB DE HUASOS MONTE BLANCO,CLUB DE HUASOS MONTE BLANCO,CLUB HUASOS MONTE BLANCO,65.093.450-4,PROGS,OSC
d3a0625e-678f-46cf-9be9-77fb22024301,CLUB DEPORTIVO AURA FITNESS,CD AURA FITNESS,CD AURA FITNESS,65.206.386-1,PROGS,OSC
38a6147d-3e59-45a8-8014-97f7076ea65e,CLUB DEPORTIVO REAL CONTACT,CD REAL CONTACT,CD REAL CONTACT,65.035.676-4,PROGS,OSC
bcfb9335-2d06-41b0-9d95-2dce39cedda2,CLUB DEPORTIVO LOS MAITENES,CD LOS MAITENES,CD MAITENES,65.187.584-6,PROGS,OSC
159c0b02-9166-4605-9342-6d78a08095d7,CLUB DEPORTIVO LAS CAMELIAS,CD LAS CAMELIAS,CD CAMELIAS,65.118.120-8,PROGS,OSC
156bde40-315c-4b8c-a41c-b13b2873a560,CLUB DEPORTIVO RAMÓN ZÚÑIGA,CD RAMÓN ZÚÑIGA,CD RAMÓN ZÚÑIGA,65.205.824-8,PROGS,OSC
b63b9972-f7af-4c70-8df4-c7cde7bcbc6b,ESCUELA DE FUTBOL LOS PUMAS,ESCUELA DE FUTBOL LOS PUMAS,ESCUELA FUTBOL PUMAS,65.177.840-9,PROGS,OTROS
c6eff9b3-fd13-4999-9108-2bef71989556,CLUB DEPORTIVO UNIÓN CONDOR,CD UNIÓN CONDOR,CD UNIÓN CONDOR,71.834.800-5,PROGS,OSC
4817027f-2018-413f-91a5-4352532a2901,CLUB DEPORTIVO SANTA AMELIA,CD SANTA AMELIA,CD SANTA AMELIA,65.043.366-K,PROGS,OSC
8edbcb23-928d-4a66-a5f3-780fd884782e,CLUB DEPORTIVO PUENTE ÑUBLE,CD PUENTE ÑUBLE,CD PUENTE,65.178.530-8,PROGS,OSC
7fea8834-fbf2-493f-a95e-c59b704bb81c,CLUB DE DEPORTES BUSTAMANTE,CLUB DE DEPORTES BUSTAMANTE,CLUB DEPORTES BUSTAMANTE,72.422.000-2,PROGS,OSC
7f26a315-3275-4a38-bcd0-e726250c011a,CLUB DE RAYUELA TALCAMAVIDA,CLUB DE RAYUELA TALCAMAVIDA,CLUB RAYUELA TALCAMAVIDA,65.098.642-3,PROGS,OSC
8e0a93d5-fb8c-44de-aef9-5c14a8226bb8,AGRUPACION DEPORTES COELEMU,AGRUPACION DEPORTES COELEMU,AGRUPACION DEPORTES COELEMU,65.185.514-4,PROGS,OSC
99e8f913-8bea-425d-95db-9659eb0445a2,CLUB DEPORTIVO UNIÓN BATUCO,CD UNIÓN BATUCO,CD UNIÓN BATUCO,65.158.330-6,PROGS,OSC
a548d368-dbbb-42c8-95fc-2f27eca072cb,COMITE FEMENINO LAS CATITAS,COMITE FEMENINO LAS CATITAS,COMITE FEMENINO CATITAS,65.717.890-K,PROGS,OSC
7a8bfb7c-f7c5-4cb4-9c9a-2436e55931ca,JUNTA DE VECINOS CHORRILLOS,JV CHORRILLOS,JV CHORRILLOS,73.812.200-3,PROGS,OSC
36d4c1eb-29b1-470f-82bc-f6dd1e85507b,JUNTA DE VECINOS SANTA CRUZ,JV SANTA CRUZ,JV SANTA CRUZ,65.026.570-K,PROGS,OSC
5a0a161d-0f55-4e2e-baa8-1fc15021bd9f,JUNTA DE VECINOS TINAJACURA,JV TINAJACURA,JV TINAJACURA,65.004.631-5,PROGS,OSC
48d3b729-b0ca-4d1d-adc2-3609bee9251e,JUNTA DE VECINOS ANTIQUEREO,JV ANTIQUEREO,JV ANTIQUEREO,65.098.874-4,PROGS,OSC
