id,codigo_normalizado,cod_unico_idis,codigo_convenios,codigo_fril,codigo_progs,nombre_iniciativa,bip,tipologia,etapa,origen,unidad_tecnica,provincia,comuna,fuente_principal,tipo_ipr,mecanismo_id
9f13d098-0eac-4b09-bf74-d553e4956485,40011045,40011045-2019,,,,"MEJORAMIENTO REVESTIMIENTO DE FONDO CANAL LURÍN, SECTOR ALAMEDA, SAN CARLOS",40011045,FRIL,EJECUCIÓN,MUNICIPIO,,PUNILLA,SAN CARLOS,IDIS,PROYECTO,MEC-001
3f50a285-c95c-4abd-9b6e-2cae6f6fa935,40011048,40011048-2019,,,,"CONSTRUCCION DE MULTICANCHAS VILLAS PORTAL DEL SUR Y VIRGEN DEL CAMINO, SAN CARLOS.",40011048,FRIL,EJECUCIÓN,MUNICIPIO,,PUNILLA,SAN CARLOS,IDIS,PROYECTO,MEC-001
949166bc-d02f-40c4-801c-01da8645f03a,40011051,40011051-2019,,,,"MEJORAMIENTO DE PLAZA VILLA VISIÓN MUNDIAL, SAN CARLOS.",40011051,FRIL,EJECUCIÓN,MUNICIPIO,,PUNILLA,SAN CARLOS,IDIS,PROYECTO,MEC-001
a22b9fb1-ec77-4ba8-9893-3d2525891f84,40011055,40011055-2019,,,,"CONSTRUCCION DE GRADERÍAS CLUB DEPORTIVO NAVOTAVO Y CRUZ AZUL, SAN CARLOS.",40011055,FRIL,EJECUCIÓN,MUNICIPIO,,PUNILLA,SAN CARLOS,IDIS,PROYECTO,MEC-001
c6f456f0-a4a9-427d-951b-c965bfd26a81,40011142,40011142-2020,,,,ANALISIS Y CARACTERIZACIÓN DEL ACUIFERO DE LA CUENCA DEL RIO ITATA,40011142,MIDESO,EJECUCIÓN,SECTORIAL / OTRO,,REGIONAL,REGIONAL,IDIS,PROYECTO,MEC-001
e6b52717-66ed-459e-bc60-8c57ac576409,40011187,40011187-2019,,,,TRANSFERENCIA PROGRAMA PARA MEJORAR LA FORMULACIÓN DE PROYECTOS DE APR PARA LA REGION DE ÑUBLE,40011187,GLOSA 5.1,EJECUCIÓN,SECTORIAL / OTRO,,REGIONAL,REGIONAL,IDIS,PROGRAMA,MEC-005
6b6a73bf-02c7-4252-9430-9d8d3687d0d6,40011188,40011188-2020,,,,AMPLIACION RED DE ALUMBRADO PUBLICO DISTINTOS SECTORES DE LA COMUNA DE RANQUIL,40011188,FRIL,EJECUCIÓN,MUNICIPIO,,ITATA,RÁNQUIL,IDIS,PROYECTO,MEC-001
81d5c551-8b46-4a87-8bf4-7e5858379766,40011213,40011213-2019,,,,CAPACITACIÓN TALLERES DE PARTICIPACIÓN CIUDADANA PARA PROMOVER EL LIDERAZGO,40011213,GLOSA 5.1,EJECUCIÓN,SECTORIAL / OTRO,,REGIONAL,REGIONAL,IDIS,PROGRAMA,MEC-005
a9055637-6e87-48e9-9d6e-ab7482c08e3b,40011215,40011215-2020,,,,"MEJORAMIENTO CALLE SAN IGNACIO, COMUNA DE CHILLAN",40011215,MIDESO,EJECUCIÓN,MUNICIPIO,,DIGUILLÍN,CHILLÁN,IDIS,PROYECTO,MEC-001
f2ce6868-f76c-42dc-8a7d-87efa1320a60,40011224,40011224-2019,,,,CONSTRUCCION SEDE SOCIAL VILLA EMMANUEL,40011224,FRIL,EJECUCIÓN,MUNICIPIO,,DIGUILLÍN,CHILLÁN,IDIS,PROYECTO,MEC-001
07247067-25e4-4c05-9ddb-d54273971f99,40011232,40011232-2021,,,,"MEJORAMIENTO ACCESO A ÑIPAS, COMUNA DE RANQUIL",40011232,FRIL,EJECUCIÓN,MUNICIPIO,,ITATA,RÁNQUIL,IDIS,PROYECTO,MEC-001
aa9ac128-d422-4fe8-b2b7-e70d4aadb4d6,40011235,40011235-2021,,,,"CONSTRUCCION CENTRO COMUNITARIO DOÑA ROSA, CHILLAN",40011235,MIDESO,DISEÑO,MUNICIPIO,,DIGUILLÍN,CHILLÁN,IDIS,PROYECTO,MEC-001
b546c442-629b-4b87-ac50-c057c872e647,40011237,40011237-2019,,,,"REPOSICION CALLE VEGAS DE SALDIAS Y CALLE SGTO. ALDEA, CHILLAN",40011237,C-33,EJECUCIÓN,MUNICIPIO,,DIGUILLÍN,CHILLÁN,IDIS,PROYECTO,MEC-001
15f029eb-3865-4ba5-ac56-10c67df5aa15,40011254,40011254-2020,,,,CONSERVACIÓN CAMINO A LAS MARIPOSAS,40011254,C-33,EJECUCIÓN,MUNICIPIO,,DIGUILLÍN,CHILLÁN,IDIS,PROYECTO,MEC-001
4d16c2bb-80a9-4db2-9032-104aaa442acc,40011276,40011276-2019,,,,"REPOSICION PAVIMENTO AV. SEPULVEDA BUSTOS, CHILLAN",40011276,C-33,EJECUCIÓN,MUNICIPIO,,DIGUILLÍN,CHILLÁN,IDIS,PROYECTO,MEC-001
2843ae1f-c89b-4d8a-b082-955c3acb2873,40011279,40011279-2019,,,,"MEJORAMIENTO ACCESIBILIDAD BARCELONA, CHILLÃN",40011279,MIDESO,EJECUCIÓN,MUNICIPIO,,DIGUILLÍN,CHILLÁN,IDIS,PROYECTO,MEC-001
768f1e75-f2cb-40db-8a02-23df098a895e,40011293,40011293-2019,,,,"REPOSICION 2 CAMIONES TOLVA, COMUNA DE SAN NICOLÁS",40011293,C-33,EJECUCIÓN,MUNICIPIO,,PUNILLA,SAN NICOLÁS,IDIS,PROYECTO,MEC-001
4b52502b-1407-43d6-a18e-5dddab17aa68,40011321,40011321-2019,,,,"DIAGNOSTICO DESARROLLO RIEGO EN SAN FABIAN, SECTOR 6 EMBALSE PUNILLA",40011321,MIDESO,EJECUCIÓN,SECTORIAL / OTRO,,PUNILLA,SAN FABIÁN,IDIS,PROGRAMA,MEC-005
a786b9eb-2685-4a64-bd47-fd46a1254b18,40011332,40011332-2019,,,,CONSTRUCCION APERTURA Y PAVIMENTACIÓN CALLE PALERMO,40011332,MIDESO,DISEÑO,MUNICIPIO,,DIGUILLÍN,CHILLÁN,IDIS,PROYECTO,MEC-001
3a2852a5-0d57-4f0a-ab00-0d6ef0fd3c5e,40011333,40011333-2019,,,,CAPACITACION TALLERES DE FORTALECIMIENTO CIUDADANO PARA ADULTOS MAYORES,40011333,GLOSA 5.1,EJECUCIÓN,SECTORIAL / OTRO,,REGIONAL,REGIONAL,IDIS,PROGRAMA,MEC-005
672b6b97-454f-450f-9bf8-3888f3ac21c7,40011339,40011339-2020,,,,ADQUISICION 2 CAMIONES TOLVA COMUNA DE NINHUE,40011339,C-33,EJECUCIÓN,MUNICIPIO,,ITATA,NINHUE,IDIS,PROYECTO,MEC-001
73e6fc50-b489-4716-98b0-4bcc1833e9ad,40011345,40011345-2019,,,,CAPACITACION E IMPLEMENTACIÓN DEPORTISTAS DEPORTES ESTRATÉGICOS. DE LA REGIÓN DE ÑUBLE,40011345,GLOSA 5.1,EJECUCIÓN,SECTORIAL / OTRO,,REGIONAL,REGIONAL,IDIS,PROGRAMA,MEC-005
a8857ee1-d81c-4d79-b393-3c44c0ba07bc,40011348,40011348-2019,,,,DIFUSION Y PROMOCIÓN DE LA ACTIVIDAD FÍSICA EN EL TERRITORIO DE ÑUBLE.,40011348,GLOSA 5.1,EJECUCIÓN,SECTORIAL / OTRO,,REGIONAL,REGIONAL,IDIS,PROGRAMA,MEC-005
3e9f14be-1e71-4f8e-af88-f4dffaf8bc52,40011379,40011379-2019,,,,"ADQUISICION EXCAVADORA HIDRAULICA Y CAMA BAJA MUNICIPALIDAD DE SAN CARLOS, ASOC. PUNILLA",40011379,C-33,EJECUCIÓN,MUNICIPIO,,PUNILLA,SAN CARLOS,IDIS,PROYECTO,MEC-001
12c0becd-9063-47f5-805e-702b1989547f,40011412,40011412-2020,,,,CONSERVACION CAMINO BÁSICO SAN CARLOS – TRAPICHE - CRUCE M-730-M (POCILLAS),40011412,C-33,EJECUCIÓN,SECTORIAL / OTRO,,PUNILLA,SAN CARLOS,IDIS,PROYECTO,MEC-001
c3140284-4bf8-4133-ae5d-b17119000126,40011415,40011415-2019,,,,"CONSERVACION CAMINO BÁSICO CRUCE RUTA 126S-BOCA ITATA-MELA-COLMUYAO-CRUCE N-40, TRAMO II",40011415,C-33,EJECUCIÓN,SECTORIAL / OTRO,,REGIONAL,COBQUECURA,IDIS,PROYECTO,MEC-001
c9cec672-f9cd-46d4-9bdd-18d48fa0793b,40011417,40011417-2019,,,,CONSERVACION CAMINO BÁSICO CRUCE N-335 (LAS DUNAS) – CRUCE N-335 (EL TORREON),40011417,C-33,EJECUCIÓN,SECTORIAL / OTRO,,REGIONAL,SAN CARLOS,IDIS,PROYECTO,MEC-001
e4f68439-94b0-4fc9-a4f3-2605df41350c,40011419,40011419-2019,,,,"CONSERVACION CAMINO BÁSICO CRUCE RUTA 5 (PASO GRAL. CRUZ) - LIUCURA - CRUCE N-48-O, TRAMO II",40011419,C-33,EJECUCIÓN,SECTORIAL / OTRO,,REGIONAL,QUILLÓN,IDIS,PROYECTO,MEC-001
0384dd24-4245-4e72-adbb-ef5c0764ae4d,40011424,40011424-2021,,,,CONSERVACION CAMINO BÁSICO CRUCE RUTA 5 (SAN GREGORIO) – ÑIQUEN - CRUCE - M-750 (SAN PEDRO),40011424,C-33,EJECUCIÓN,SECTORIAL / OTRO,,PUNILLA,ÑIQUÉN,IDIS,PROYECTO,MEC-001
7b8d1557-5712-4ad9-8bb8-cfb7e92709ee,40011444,40011444-2019,,,,"CONSERVACION CAMINO BÁSICO CRUCE RUTA 5 (PASO GRAL. CRUZ) - LIUCURA - CRUCE N-48-O, TRAMO I",40011444,C-33,EJECUCIÓN,SECTORIAL / OTRO,,REGIONAL,PEMUCO,IDIS,PROYECTO,MEC-001
4664a289-ef13-486b-b925-025c19477d7c,40011447,40011447-2019,,,,CONSERVACION CAMINO BÁSICO CRUCE N-335 (MONTE BLANCO) - PUENTE EL CABALLO,40011447,C-33,EJECUCIÓN,SECTORIAL / OTRO,,REGIONAL,SAN CARLOS,IDIS,PROYECTO,MEC-001
3edee9d2-0528-41cb-a589-99b72a5e9695,40011448,40011448-2019,,,,CONSERVACION CAMINO BÁSICO CRUCE RUTA 126S-BOCA ITATA-MELA-COLMUYAO-CRUCE N-40 (COBQUECURA),40011448,C-33,EJECUCIÓN,SECTORIAL / OTRO,,REGIONAL,COBQUECURA,IDIS,PROYECTO,MEC-001
d036b9f3-07de-4544-a36a-0d396443fc9a,40011449,40011449-2021,,,,CONSERVACION CAMINO BÁSICO CRUCE N-643 (TRES ESQUINAS) - LOS MARCOS - CRUCE N-773 (LOS TILOS),40011449,C-33,EJECUCIÓN,SECTORIAL / OTRO,,REGIONAL,BULNES,IDIS,PROYECTO,MEC-001
767e1d36-9a3a-4ad6-8c11-8d80324ed7c8,40011454,40011454-2019,,,,REPOSICION CAMIONETAS TODO TERRENO PARA LA MUNICIPALIDAD DE TREHUACO,40011454,C-33,EJECUCIÓN,MUNICIPIO,,ITATA,TREGUACO,IDIS,PROYECTO,MEC-001
2fbf4233-1a07-4d9b-b811-f3896b8b7811,40011463,40011463-2019,,,,"REPOSICION DE 2 CAMIONES RECOLECTORES DE RESIDUOS SOLIDOS DOMICILIARIOS, COMUNA DE SAN FABI",40011463,C-33,EJECUCIÓN,MUNICIPIO,,PUNILLA,SAN FABIÁN,IDIS,PROYECTO,MEC-001
1e053bff-375a-42e1-a4f4-ef90844242d5,40011464,40011464-2020,,,,REPOSICIÓN DE FLOTA DE TRANSPORTE ESCOLAR PARA LA COMUNA DE TREHUACO,40011464,C-33,EJECUCIÓN,MUNICIPIO,,ITATA,TREGUACO,IDIS,PROYECTO,MEC-001
94777659-8726-4860-a3a7-f1c002cbe285,40011521,40011521-2019,,,,ADQUISICION RETROEXCAVADORA COMUNA DE NINHUE,40011521,C-33,EJECUCIÓN,MUNICIPIO,,ITATA,NINHUE,IDIS,PROYECTO,MEC-001
390f7662-c90f-4a51-889c-d57b8dfd7efa,40011525,40011525-2019,,,,"ADQUISICION JEEP DEPARTAMENTO DE PLANIFICACIÓN DE LA MUNICIPALIDAD DE NINHUE, COMUNA NINHUE",40011525,C-33,EJECUCIÓN,MUNICIPIO,,ITATA,NINHUE,IDIS,PROYECTO,MEC-001
eab44f72-832b-4440-b93d-968037b7eb73,40011537,40011537-2019,,,,INSTALACION LUMINARIAS CON PANEL EN DIVERSOS SECTORES DE LA COMUNA DE ÑIQUEN,40011537,FRIL,EJECUCIÓN,MUNICIPIO,,PUNILLA,ÑIQUÉN,IDIS,PROYECTO,MEC-001
f925372b-7edd-42c7-9488-0d660c9f372c,40011540,40011540-2019,,,,"CONSTRUCCION MULTICANCHA EN SECTOR MAITENES, COMUNA DE ÑIQUÉN",40011540,FRIL,EJECUCIÓN,MUNICIPIO,,PUNILLA,ÑIQUÉN,IDIS,PROYECTO,MEC-001
9b062d6a-c0d4-4dd3-b35a-4a6af9692086,40011541,40011541-2019,,,,"CONSTRUCCION DE TORRE Y ESTANQUE PARA A.P.R. SAN ROQUE-SAN JORGE, COMUNA DE ÑIQUEN",40011541,FRIL,EJECUCIÓN,MUNICIPIO,,PUNILLA,ÑIQUÉN,IDIS,PROYECTO,MEC-001
d62636f3-7e3f-4d40-9d40-2da0afe92052,40011544,40011544-2019,,,,"CONSTRUCCION SEDE EN SECTOR TIUQUILEMU CENTRO, COMUNA DE ÑIQUÉN",40011544,FRIL,EJECUCIÓN,MUNICIPIO,,PUNILLA,ÑIQUÉN,IDIS,PROYECTO,MEC-001
10f4d132-3a57-4ab8-9050-66d5fee43497,40011546,40011546-2019,,,,"CONSTRUCCION VEREDA EN SECTOR SAN FERNANDO DE ZEMITA, COMUNA DE ÑIQUÉN",40011546,FRIL,EJECUCIÓN,MUNICIPIO,,PUNILLA,ÑIQUÉN,IDIS,PROYECTO,MEC-001
a3b856cf-09b6-4301-97c2-82831fb6a735,40011549,40011549-2019,,,,"CONSTRUCCION VEREDAS EN SECTOR EL PEUMO DE ZEMITA, COMUNA DE ÑIQUÉN",40011549,FRIL,EJECUCIÓN,MUNICIPIO,,PUNILLA,ÑIQUÉN,IDIS,PROYECTO,MEC-001
01d1dac8-6db7-4463-8843-a1887c5efcb4,40011557,40011557-2019,,,,"ADQUISICION DE MINIBUS PARA LA MUNICIPALIDAD DE NINHUE, COMUNA DE NINHUE",40011557,C-33,EJECUCIÓN,MUNICIPIO,,ITATA,NINHUE,IDIS,PROYECTO,MEC-001
1290ebc8-bac8-486d-a786-034df84d6933,40011582,40011582-2019,,,,REPOSICION MINIBUS DEL CESFAM DE LA COMUNA DE NINHUE,40011582,C-33,EJECUCIÓN,MUNICIPIO,,ITATA,NINHUE,IDIS,PROYECTO,MEC-001
23638b19-2d93-43a8-bae9-b8b876744355,40011610,40011610-2019,,,,"CONSTRUCCION E INSTALACION DE SEÑALETICA, COMUNAS ASOC. PUNILLA, REGION DE ÑUBLE",40011610,MIDESO,EJECUCIÓN,MUNICIPIO,,PUNILLA,PUNILLA,IDIS,PROYECTO,MEC-001
51cf4e0f-6ac2-4759-a211-cf81cfd12259,40011622,40011622-2019,,,,"ACTUALIZACION PLAN REGULADOR COMUNAL, EL CARMEN",40011622,MIDESO,EJECUCIÓN,MUNICIPIO,,DIGUILLÍN,EL CARMEN,IDIS,PROYECTO,MEC-001
d96b6f2f-324c-4fcb-80e0-7191532e9c33,40011644,40011644-2019,,,,CAPACITACION PROGRAMA DE EDUCACIÓN Y SENSIBILIZACIÓN AMBIENTAL EN LA COMUNIDAD DE SAN NICOLÁS,40011644,GLOSA 5.1,EJECUCIÓN,MUNICIPIO,,PUNILLA,SAN NICOLÁS,IDIS,PROGRAMA,MEC-005
ed1831fd-a50c-4a97-a58d-735a3906f046,40011681,40011681-2019,,,,"ADQUISICION JEEP PARA LA MUNICIPALIDAD DE NINHUE, COMUNA DE NINHUE",40011681,C-33,EJECUCIÓN,MUNICIPIO,,ITATA,NINHUE,IDIS,PROYECTO,MEC-001
3e6acb7c-e4c5-4296-b200-571ab8c7de62,40011689,40011689-2019,,,,"NORMALIZACION VIALIDAD URBANA, ACCESIBILIDAD UNIVERSAL MUNICIPALIDAD DE QUILLÓN",40011689,FRIL,EJECUCIÓN,MUNICIPIO,,DIGUILLÍN,QUILLÓN,IDIS,PROYECTO,MEC-001
4bc03de7-f2a3-44ed-80fe-22cd7a8314b2,40011706,40011706-2020,,,,"REPOSICION Y NORMALIZACIÓN ACCESO PRINCIPAL ESTADIO MUNICIPAL, QUILLÓN",40011706,FRIL,EJECUCIÓN,MUNICIPIO,,DIGUILLÍN,QUILLÓN,IDIS,PROYECTO,MEC-001
8f77ab03-56ea-4aca-b3a4-befe05cc8a5f,40011707,40011707-2021,,,,"CONSTRUCCION CUARTEL 2DA COMPAÑIA DE BOMBEROS NUEVA ALDEA, COMUNA DE RANQUIL",40011707,FRIL,EJECUCIÓN,MUNICIPIO,,ITATA,RÁNQUIL,IDIS,PROYECTO,MEC-001
f0e6b282-f9e4-4f21-8880-90ab4e91766e,40011713,40011713-2019,,,,DIAGNOSTICO PLADETUR COMUNA DE COELEMU,40011713,MIDESO,EJECUCIÓN,MUNICIPIO,,ITATA,COELEMU,IDIS,PROGRAMA,MEC-005
b21d51c2-15f5-45c0-8241-77b1208ed611,40011727,40011727-2019,,,,"CONSTRUCCION ESPACIO PUBLICO VALLE VERDE - EL REFUGIO SECTOR NORTE, QUILLÓN",40011727,FRIL,EJECUCIÓN,MUNICIPIO,,DIGUILLÍN,QUILLÓN,IDIS,PROYECTO,MEC-001
5f185cd0-a985-46d3-9ff7-a9a9c4292bc8,40011730,40011730-2019,,,,"ADQUISICION CARRO BOMBA FORESTAL 4X4 CUERPO DE BOMBEROS , COMUNA DE COELEMU",40011730,C-33,EJECUCIÓN,MUNICIPIO,,ITATA,COELEMU,IDIS,PROYECTO,MEC-001
0b70aa28-3a05-47ba-a0fc-8da5f35b4f7c,40011731,40011731-2019,,,,"CONSTRUCCION VEREDAS SECTOR SUR URBANO, QUILLÓN",40011731,FRIL,EJECUCIÓN,MUNICIPIO,,DIGUILLÍN,QUILLÓN,IDIS,PROYECTO,MEC-001
ff2911c0-bbae-47b3-88d8-735fd52f7b90,40011738,40011738-2020,,,,"CONSTRUCCION CENTRO FUNDACIÓN ELEVA, CHILLÁN",40011738,FRIL,EJECUCIÓN,MUNICIPIO,,DIGUILLÍN,CHILLÁN,IDIS,PROYECTO,MEC-001
57684805-ac0a-4efc-abde-c8342eea1d1f,40011740,40011740-2019,,,,TRANSFERENCIA INVERSIÓN Y FOMENTO AL RIEGO,40011740,GLOSA 5.1,EJECUCIÓN,SECTORIAL / OTRO,,REGIONAL,REGIONAL,IDIS,PROGRAMA,MEC-005
29376821-64e1-496a-9d0d-f624a1fe8507,40011742,40011742-2019,,,,"CONSTRUCCION SEDE SOCIAL VILLA CHILOE, CHILLAN",40011742,FRIL,EJECUCIÓN,MUNICIPIO,,DIGUILLÍN,CHILLÁN,IDIS,PROYECTO,MEC-001
ef0b7bae-36b0-4c3e-9a92-4243a9923f62,40011768,40011768-2019,,,,"REPOSICION 3 VEHICULOS MUNICIPALES, COMUNA DE PINTO",40011768,C-33,EJECUCIÓN,MUNICIPIO,,DIGUILLÍN,PINTO,IDIS,PROYECTO,MEC-001
e59fb196-cc59-4bcd-8c1f-a7b676709729,40011782,40011782-2019,,,,REPOSICION MOTONIVELADORA COMUNA DE SAN NICOLÁS,40011782,C-33,EJECUCIÓN,MUNICIPIO,,PUNILLA,SAN NICOLÁS,IDIS,PROYECTO,MEC-001
b29b0f71-e2df-417e-9226-5187ce866168,40011790,40011790-2019,,,,MEJORAMIENTO ESCUELA ARTÍSTICA CLAUDIO ARRAU LEÓN,40011790,MIDESO,DISEÑO,MUNICIPIO,,DIGUILLÍN,CHILLÁN,IDIS,PROYECTO,MEC-001
e81c942a-335c-4031-82d2-00d405db1403,40011799,40011799-2019,,,,"CONSTRUCCION PISCINA TEMPERADA PARQUE DEPORTIVO QUILAMAPU, CHILLAN.",40011799,MIDESO,EJECUCIÓN,MUNICIPIO,,DIGUILLÍN,CHILLÁN,IDIS,PROYECTO,MEC-001
37c8e04f-6d40-4dd7-80af-9d73e43d6ebf,40011844,40011844-2019,,,,TRANSFERENCIA REGIÓN DE ÑUBLE SUSTENTABLE,40011844,GLOSA 5.1,EJECUCIÓN,SECTORIAL / OTRO,,REGIONAL,REGIONAL,IDIS,PROGRAMA,MEC-005
4bde74fc-d71b-4930-8f18-97b1ad1e8164,40011866,40011866-2019,,,,CONSTRUCCION MASTIL BANDERA REGIONAL ÑUBLE,40011866,MIDESO,EJECUCIÓN,SECTORIAL / OTRO,,REGIONAL,REGIONAL,IDIS,PROYECTO,MEC-001
83df1629-94c4-4bff-b5b8-4fef26454674,40011878,40011878-2019,,,,"CONSTRUCCION SEDE SOCIAL SECTOR CHILLINHUE, COMUNA DE COIHUECO",40011878,FRIL,EJECUCIÓN,MUNICIPIO,,PUNILLA,COIHUECO,IDIS,PROYECTO,MEC-001
34ed1031-10de-40e8-a0ac-1207e7d4f48a,40011880,40011880-2019,,,,"CONSTRUCCION CANCHA DE TENIS, ESTADIO MUNICIPAL DE COIHUECO",40011880,FRIL,EJECUCIÓN,MUNICIPIO,,PUNILLA,COIHUECO,IDIS,PROYECTO,MEC-001
c9a761b4-e83d-4a9e-b475-1f92754f99df,40011883,40011883-2019,,,,"REPOSICION SEDE SOCIAL JUNTA DE VECINOS CENTRAL, COMUNA DE COIHUECO",40011883,FRIL,EJECUCIÓN,MUNICIPIO,,PUNILLA,COIHUECO,IDIS,PROYECTO,MEC-001
93d8bc7f-ba2b-47c4-9c6b-067625fa0b37,40011889,40011889-2019,,,,"CONSTRUCCION MULTICANCHA SECTOR TRES ESQUINAS DE CATO, COMUNA DE COIHUECO",40011889,FRIL,EJECUCIÓN,MUNICIPIO,,PUNILLA,COIHUECO,IDIS,PROYECTO,MEC-001
e2825fda-3e35-44d8-9cd3-c9ace064ee58,40011892,40011892-2019,,,,"CONSTRUCCION MULTICANCHA SECTOR PRIMERA HIJUELA, COMUNA DE COIHUECO",40011892,FRIL,EJECUCIÓN,MUNICIPIO,,PUNILLA,COIHUECO,IDIS,PROYECTO,MEC-001
d9088a93-095f-4642-b7e7-04891fdcc2ca,40011942,40011942-2020,,,,CONSTRUCCION PROTECCIONES TRAS PORTERIAS DIVERSAS CANCHAS DE FUTBOL DE COIHUECO,40011942,FRIL,EJECUCIÓN,MUNICIPIO,,PUNILLA,COIHUECO,IDIS,PROYECTO,MEC-001
1ea7ebe9-e8af-4286-a382-37e7c0df43d3,40011947,40011947-2019,,,,"ADQUISICION RETROEXCAVADORA, SAN NICOLÁS",40011947,C-33,EJECUCIÓN,MUNICIPIO,,PUNILLA,SAN NICOLÁS,IDIS,PROYECTO,MEC-001
0e15ee93-3596-42ba-9d09-6584369829b0,40011948,40011948-2019,,,,"CONSTRUCCION CAMARINES C.D. BERNARDO OLALDE, SECTOR FRUTILLAR SUR, COMUNA DE COIHUECO",40011948,FRIL,EJECUCIÓN,MUNICIPIO,,PUNILLA,COIHUECO,IDIS,PROYECTO,MEC-001
812b66f2-d8d5-4327-b03d-a33776711fa3,40011949,40011949-2019,,,,"CONSTRUCCION CAMARINES C.D. SAN ANTONIO DE CATO, COMUNA DE COIHUECO",40011949,FRIL,EJECUCIÓN,MUNICIPIO,,PUNILLA,COIHUECO,IDIS,PROYECTO,MEC-001
f1d5753f-c2f9-4a1d-b94a-b76dfd7b37ae,40011993,40011993-2019,,,,"CONSTRUCCION SEDE SOCIAL DE LIBUY, BULNES",40011993,FRIL,EJECUCIÓN,MUNICIPIO,,DIGUILLÍN,BULNES,IDIS,PROYECTO,MEC-001
390776fa-a119-4a9e-a755-4488813d79a8,40012001,40012001-2019,,,,CAPACITACION Y ACTIVACIÓN DEPORTIVA PARA EL ADULTO MAYOR DE ÑUBLE,40012001,GLOSA 5.1,EJECUCIÓN,SECTORIAL / OTRO,,REGIONAL,REGIONAL,IDIS,PROGRAMA,MEC-005
58fc8a5f-16ba-41fb-8e22-bd8272f57f7b,40012013,40012013-2020,,,,"CONSTRUCCION CONECTIVIDAD RUTA ACCESIBLE PLAZA DE ARMAS, QUILLÓN",40012013,FRIL,EJECUCIÓN,MUNICIPIO,,DIGUILLÍN,QUILLÓN,IDIS,PROYECTO,MEC-001
3c74ba47-5f16-409f-a52f-4d6fe349db1a,40012020,40012020-2019,,,,"CONSTRUCCION CAMARINES CLUB DEPORTIVO SECTOR CALLE ALEGRE, COMUNA DE SAN IGNACIO",40012020,FRIL,EJECUCIÓN,MUNICIPIO,,DIGUILLÍN,SAN IGNACIO,IDIS,PROYECTO,MEC-001
c9f30672-215b-480a-b7ae-33569da06991,40012022,40012022-2021,,,,"MEJORAMIENTO ACCESO LAGUNA AVENDAÑO AVDA ALESSANDRI, QUILLON",40012022,FRIL,EJECUCIÓN,MUNICIPIO,,DIGUILLÍN,QUILLÓN,IDIS,PROYECTO,MEC-001
0e8bd7e3-d65c-4489-a652-a65ec66a185c,40012026,40012026-2019,,,,"CONSTRUCCION CAMARINES ESTADIO MUNICIPAL DE PUEBLO SECO, COMUNA DE SAN IGNACIO",40012026,FRIL,EJECUCIÓN,MUNICIPIO,,DIGUILLÍN,SAN IGNACIO,IDIS,PROYECTO,MEC-001
a356cdef-57f9-42d5-90b0-b42d2ac7e83c,40012028,40012028-2019,,,,"CONSTRUCCION GRADERÍAS DIVERSAS CANCHAS DE FÚTBOL, COMUNA DE SAN IGNACIO",40012028,FRIL,EJECUCIÓN,MUNICIPIO,,DIGUILLÍN,SAN IGNACIO,IDIS,PROYECTO,MEC-001
cf85d6f1-12e5-4ea4-90a3-8aac388f3533,40012039,40012039-2019,,,,CAPACITACION ACADEMIA DETECCIÓN Y FORMACIÓN DE DEPORTISTAS DE ALTO RENDIMIENTO,40012039,GLOSA 5.1,EJECUCIÓN,SECTORIAL / OTRO,,REGIONAL,REGIONAL,IDIS,PROGRAMA,MEC-005
e11b2143-b58d-4e01-bbb6-614ab1a0797c,40012042,40012042-2019,,,,"CONSTRUCCION SEDE SOCIAL JUAN DE DIOS DAVILA, COMUNA DE SAN IGNACIO",40012042,FRIL,EJECUCIÓN,MUNICIPIO,,DIGUILLÍN,SAN IGNACIO,IDIS,PROYECTO,MEC-001
f9623736-ea5c-4c2e-9d77-7ea67823fea0,40012156,40012156-2019,,,,"TRANSFERENCIA FOMENTO, DESARROLLO Y SOSTENIBILIDAD DE LA ACTIVIDAD PESQUERA",40012156,GLOSA 5.1,EJECUCIÓN,SECTORIAL / OTRO,,ITATA,ITATA,IDIS,PROGRAMA,MEC-005
e01538fa-d272-4944-917c-8bca531ebe06,40012163,40012163-2019,,,,"CONSTRUCCION OFICINAS MUNICIPALES SECPLAN OBRAS, COMUNA DE SAN FABIÁN",40012163,FRIL,EJECUCIÓN,MUNICIPIO,,PUNILLA,SAN FABIÁN,IDIS,PROYECTO,MEC-001
de546df3-21b8-47ac-8679-325612ae5170,40012166,40012166-2020,,,,CONSTRUCCION CAPTACION DE AGUA SECTOR EL TOLLO,40012166,FRIL,EJECUCIÓN,MUNICIPIO,,ITATA,COBQUECURA,IDIS,PROYECTO,MEC-001
099a154b-8100-4291-b5f1-9b76520f35c5,40012175,40012175-2019,,,,"REPOSICION MULTICANCHA ESCUELA DE TRABUNCURA, COMUNA DE SAN FABIÁN",40012175,FRIL,EJECUCIÓN,MUNICIPIO,,PUNILLA,SAN FABIÁN,IDIS,PROYECTO,MEC-001
7e5d6203-cb95-4e01-8609-567ef0dbf547,40012176,40012176-2019,,,,"ADQUISICION MATERIAL MENOR , BOMBEROS TERRITORIO PUNILLA",40012176,C-33,EJECUCIÓN,MUNICIPIO,,PUNILLA,PUNILLA,IDIS,PROYECTO,MEC-001
4020cbf7-69da-463e-8704-489724b395bf,40012183,40012183-2019,,,,"CONSTRUCCION ILUMINACIÓN CANCHA DE FUTBOL CD ARTURO PRAT, COMUNA DE COIHUECO",40012183,FRIL,EJECUCIÓN,MUNICIPIO,,PUNILLA,COIHUECO,IDIS,PROYECTO,MEC-001
ed7c88fa-7ee0-4866-9208-5ded4537f397,40012197,40012197-2020,,,,ADQUISICION CAMION LIMPIAFOSAS MUNICIPALIDAD DE PORTEZUELO,40012197,C-33,EJECUCIÓN,MUNICIPIO,,ITATA,PORTEZUELO,IDIS,PROYECTO,MEC-001
d174b836-a869-495c-83d6-bddf12a27301,40012202,40012202-2019,,,,ADQUISICION VEHICULO TRASLADO DISCAPACITADOS MUNICIPALIDAD DE PORTEZUELO,40012202,C-33,EJECUCIÓN,MUNICIPIO,,ITATA,PORTEZUELO,IDIS,PROYECTO,MEC-001
a5172083-d827-41b2-981f-305114f0347a,40012204,40012204-2019,,,,REPOSICION REPOSICION BUS MUNICIPAL. DE PORTEZUELO,40012204,C-33,EJECUCIÓN,MUNICIPIO,,ITATA,PORTEZUELO,IDIS,PROYECTO,MEC-001
85529f59-18da-4197-a1f6-8905202174b5,40012246,40012246-2019,,,,"CONSTRUCCION SEÑALÉTICA TURÍSTICA VIAL, COMUNA DE SAN FABIÁN",40012246,FRIL,EJECUCIÓN,MUNICIPIO,,PUNILLA,SAN FABIÁN,IDIS,PROYECTO,MEC-001
a8866d37-5999-4deb-83cb-ce2e5ff69f60,40012249,40012249-2019,,,,"CONSTRUCCION LABORATORIO LICEO CAMPANARIO, COMUNA DE YUNGAY",40012249,FRIL,EJECUCIÓN,MUNICIPIO,,DIGUILLÍN,YUNGAY,IDIS,PROYECTO,MEC-001
c51f99f3-f257-406b-81e6-b13d08029f06,40012252,40012252-2019,,,,"CONSERVACION CAMINOS BÁSICOS DIVERSAS COMUNAS DE LA REGIÓN DE ÑUBLE, ETAPA I. SAN NICOLAS RUTA N-346",40012252,C-33,EJECUCIÓN,SECTORIAL / OTRO,,PUNILLA,SAN NICOLÁS,IDIS,PROYECTO,MEC-001
c2ee7bb9-1c31-40c5-88d5-b65111c8c070,40012256,40012256-2019,,,,"CONSTRUCCION MULTITALLER ESCUELA LOS MAYOS , COMUNA DE YUNGAY",40012256,FRIL,EJECUCIÓN,MUNICIPIO,,DIGUILLÍN,YUNGAY,IDIS,PROYECTO,MEC-001
774fe0f7-6689-425f-8570-6bb48d13e40d,40012258,40012258-2019,,,,CONSTRUCCION SEDE COMUNITARIA SECTOR VILLA CORDILLERA,40012258,FRIL,EJECUCIÓN,MUNICIPIO,,DIGUILLÍN,YUNGAY,IDIS,PROYECTO,MEC-001
0286dba7-54c5-4d03-9189-a863b6eb76c7,40012266,40012266-2019,,,,CONSTRUCCION SEDE COMUNITARIA SECTOR TAUCÚ,40012266,FRIL,EJECUCIÓN,MUNICIPIO,,ITATA,COBQUECURA,IDIS,PROYECTO,MEC-001
58ad68c3-1b37-422a-949e-58f02dd0a71f,40012269,40012269-2019,,,,"REPOSICION DE ACERAS EN CALLE ARTURO PRAT, ENTRE CALLE TACNA Y PISAGUA , YUNGAY",40012269,FRIL,EJECUCIÓN,MUNICIPIO,,DIGUILLÍN,YUNGAY,IDIS,PROYECTO,MEC-001
52e4be38-1b72-4740-b12b-9f0d0550680d,40012271,40012271-2019,,,,"CONSTRUCCION SEDE COMUNITARIA SECTOR CURAPASO, COMUNA DE YUNGAY",40012271,FRIL,EJECUCIÓN,MUNICIPIO,,DIGUILLÍN,YUNGAY,IDIS,PROYECTO,MEC-001
64a52656-e955-4b93-8221-df83e6319c21,40012276,40012276-2019,,,,"CONSTRUCCION CUBIERTA MULTICANCHA ESCUELA LOS PUQUIOS, COMUNA DE SAN FABIÁN",40012276,FRIL,EJECUCIÓN,MUNICIPIO,,PUNILLA,SAN FABIÁN,IDIS,PROYECTO,MEC-001
80140080-d85d-4afe-bf5b-778f32c9be53,40012289,40012289-2019,,,,"NORMALIZACION Y AMPLIACION LICEO NIBALDO SEPULVEDA, COMUNA DE PORTEZUELO",40012289,MIDESO,EJECUCIÓN,MUNICIPIO,,ITATA,PORTEZUELO,IDIS,PROYECTO,MEC-001
0a41151d-2116-461d-9926-b2d601203a23,40012302,40012302-2019,,,,"CONSTRUCCION POZO VILLA ALICO, COMUNA DE SAN FABIÁN",40012302,FRIL,EJECUCIÓN,MUNICIPIO,,PUNILLA,SAN FABIÁN,IDIS,PROYECTO,MEC-001
3e06af47-4bde-4207-9a7e-1d9cb3efeb6e,40012317,40012317-2019,,,,"CONSTRUCCION POZO SECTOR MAITENAL, COMUNA DE SAN FABIÁN",40012317,FRIL,EJECUCIÓN,MUNICIPIO,,PUNILLA,SAN FABIÁN,IDIS,PROYECTO,MEC-001
781ef721-2665-4186-97c7-1fa644af00a6,40012441,40012441-2019,,,,"CONSTRUCCION RECAMBIO DE LUMINARIAS LED DIVERSOS SECTORES, COMUNA DE SAN FABIÁN",40012441,FRIL,EJECUCIÓN,MUNICIPIO,,PUNILLA,SAN FABIÁN,IDIS,PROYECTO,MEC-001
2af1ba46-923c-4db4-a5b8-bfe0fad788e2,40012448,40012448-2019,,,,CONSTRUCCION MULTICANCHA VILLA EL BOSQUE,40012448,FRIL,EJECUCIÓN,MUNICIPIO,,ITATA,COBQUECURA,IDIS,PROYECTO,MEC-001
969683be-36c1-4d1d-9731-3b0437b20364,40012449,40012449-2019,,,,MEJORAMIENTO CAPTACIÓN APR SERICHE,40012449,FRIL,EJECUCIÓN,MUNICIPIO,,ITATA,COBQUECURA,IDIS,PROYECTO,MEC-001
d4588369-9ed4-4e49-854f-b52910d97f10,40012460,40012460-2019,,,,REPARACION COMPLEJO DEPORTIVO MUNICIPAL,40012460,FRIL,EJECUCIÓN,MUNICIPIO,,PUNILLA,SAN FABIÁN,IDIS,PROYECTO,MEC-001
55ae6418-caf1-408f-bf0f-d0478775ba66,40012499,40012499-2019,,,,CONSTRUCCION E INSTALACION CARPETA SINTETICA ESTADIO LLAHUEN - PORTEZUELO,40012499,MIDESO,EJECUCIÓN,MUNICIPIO,,ITATA,PORTEZUELO,IDIS,PROYECTO,MEC-001
fec4fe6c-8ba5-4f30-8056-64588759ab4a,40012508,40012508-2019,,,,"CONSTRUCCION ALUMBRADO PÚBLICO CALLE ALEGRE - SAN ANTONIO, COMUNA DE SAN IGNACIO",40012508,FRIL,EJECUCIÓN,MUNICIPIO,,DIGUILLÍN,SAN IGNACIO,IDIS,PROYECTO,MEC-001
f18630c1-b5a9-43ea-bef0-fd9b07757950,40012509,40012509-2019,,,,TRANSFERENCIA GENERACIÓN Y FORTALECIMIENTO PARA LA INTERNACIONALIZACIÓN DE ÑUBLE,40012509,GLOSA 5.1,EJECUCIÓN,SECTORIAL / OTRO,,REGIONAL,REGIONAL,IDIS,PROGRAMA,MEC-005
96c54efd-8215-4732-9681-63e70aebd693,40012571,40012571-2019,,,,"CONSERVACION VEREDAS DISTINTOS SECTORES, QUILLÓN",40012571,FRIL,EJECUCIÓN,MUNICIPIO,,DIGUILLÍN,QUILLÓN,IDIS,PROYECTO,MEC-001
5679ea3f-d75c-4a4d-8f33-d3cdda7acf5d,40012574,40012574-2019,,,,"REPOSICION MULTICANCHA VILLA PORTAL DEL VALLE, QUILLÓN",40012574,FRIL,EJECUCIÓN,MUNICIPIO,,DIGUILLÍN,QUILLÓN,IDIS,PROYECTO,MEC-001
99fb1d65-ae69-4285-8a28-a7a165501720,40012576,40012576-2019,,,,CONSTRUCCION CAMARINES ACCESO SUR-ESTADIO COBQUECURA,40012576,FRIL,EJECUCIÓN,MUNICIPIO,,ITATA,COBQUECURA,IDIS,PROYECTO,MEC-001
c188a37f-e689-459b-a94b-9a75754c8788,40012580,40012580-2019,,,,MEJORAMIENTO DEMARCACION Y REPOSICION SEÑALETICA VIAL COMUNA DE COBQUECURA,40012580,FRIL,EJECUCIÓN,MUNICIPIO,,ITATA,COBQUECURA,IDIS,PROYECTO,MEC-001
dfe20044-268d-4abc-936c-3f452fa956c0,40012599,40012599-2020,,,,"CONSTRUCCION CANCHA CLUB APOLO ANDES UNIDO, COMUNA DE COIHUECO.",40012599,MIDESO,DISEÑO,MUNICIPIO,,PUNILLA,COIHUECO,IDIS,PROYECTO,MEC-001
2943f92c-f630-478a-81a6-da0070d8d8dc,40012603,40012603-2019,,,,"MEJORAMIENTO PLAZOLETA SECTOR LAS TRANCAS, COMUNA DE PINTO",40012603,FRIL,EJECUCIÓN,MUNICIPIO,,DIGUILLÍN,PINTO,IDIS,PROYECTO,MEC-001
0fbdd538-2e64-4416-aa65-61c39b8ef8bb,40012616,40012616-2020,,,,"MEJORAMIENTO CANCHA SINTÉTICA SECTOR CIRUELO,COMUNA DE PINTO",40012616,FRIL,EJECUCIÓN,MUNICIPIO,,DIGUILLÍN,PINTO,IDIS,PROYECTO,MEC-001
a9194501-0fd1-4387-bcba-d41f091afd61,40012618,40012618-2019,,,,"MEJORAMIENTO CANCHA SINTÉTICA SECTOR LOMA ALTA, PINTO",40012618,FRIL,EJECUCIÓN,MUNICIPIO,,DIGUILLÍN,PINTO,IDIS,PROYECTO,MEC-001
7c953fb8-8c8c-484b-9e61-4f315070a79b,40012619,40012619-2020,,,,"MEJORAMIENTO CANCHA SINTÉTICA SECTOR LLEUQUES BAJO, COMUNA DE PINTO",40012619,FRIL,EJECUCIÓN,MUNICIPIO,,DIGUILLÍN,PINTO,IDIS,PROYECTO,MEC-001
94ce5ec5-1b01-44cf-96f3-4ccad215268d,40012620,40012620-2019,,,,"MEJORAMIENTO CANCHA SINTÉTICA SECTOR EL ROSAL, PINTO",40012620,FRIL,EJECUCIÓN,MUNICIPIO,,DIGUILLÍN,PINTO,IDIS,PROYECTO,MEC-001
557afa2e-9efc-4e1b-9a54-98dac50073a3,40012621,40012621-2020,,,,"MEJORAMIENTO AREA VERDE SECTOR LOS LLEUQUES, COMUNA DE PINTO",40012621,FRIL,EJECUCIÓN,MUNICIPIO,,DIGUILLÍN,PINTO,IDIS,PROYECTO,MEC-001
