id,codigo_normalizado,cod_unico_idis,codigo_convenios,codigo_fril,codigo_progs,nombre_iniciativa,bip,tipologia,etapa,origen,unidad_tecnica,provincia,comuna,fuente_principal,tipo_ipr,mecanismo_id
6d39bae1-9d3e-476f-8fe1-50bcbe09e725,40056507,40056507-2023,40056507,,,"CONSERVACION CAMINO A LOS MONTES, CHILLÁN",40056507,FRIL,EJECUCIÓN,MUNICIPIO,MUNICIP. CHILLÁN,DIGUILLÍN,CHILLÁN,IDIS,PROYECTO,MEC-001
9fa5944c-12ed-4a2f-ab6d-00887aec9391,40054718,40054718-2023,40054718,,,"CONSTRUCCION SEDE SOCIAL SECTOR EL CAPE, SAN CARLOS",40054718,FRIL,EJECUCIÓN,MUNICIPIO,MUNICIP. SAN CARLOS,PUNILLA,SAN CARLOS,IDIS,PROYECTO,MEC-001
fd8e1383-e351-4299-a5e4-b74de8c75e7b,40054723,40054723-2023,40054723,,,"CONSTRUCCION SEDE SOCIAL CAMARICO, SAN CARLOS",40054723,FRIL,EJECUCIÓN,MUNICIPIO,MUNICIP. SAN CARLOS,PUNILLA,SAN CARLOS,IDIS,PROYECTO,MEC-001
b65b290b-0709-4483-a857-04439f319c8a,40054746,40054746-2023,40054746,,,"CONSTRUCCION SEDE SOCIAL VILLA NUEVA PRIMAVERA, SAN CARLOS",40054746,FRIL,EJECUCIÓN,MUNICIPIO,MUNICIP. SAN CARLOS,PUNILLA,SAN CARLOS,IDIS,PROYECTO,MEC-001
2504941d-d875-4103-af4b-9b3d8e6aa1f8,40056455,40056455-2023,40056455,,,"MEJORAMIENTO PLAZA VILLA VISIÓN MUNDIAL, SAN CARLOS",40056455,FRIL,EJECUCIÓN,MUNICIPIO,MUNICIP. SAN CARLOS,PUNILLA,SAN CARLOS,IDIS,PROYECTO,MEC-001
3f5658d9-1759-4fae-bf7f-4fd3d8c409ab,40055011,40055011-2023,40055011,,,"CONSTRUCCION CAMARINES SECTOR CASTAÑAL, COMUNA EL CARMEN",40055011,FRIL,EJECUCIÓN,MUNICIPIO,MUNICIP. EL CARMEN,DIGUILLÍN,EL CARMEN,IDIS,PROYECTO,MEC-001
3e6cc521-d2c1-48b0-9407-52bcd0ae7c17,40056493,40056493-2023,,,,"MEJORAMIENTO ESPACIO PUBLICO VILLA NUEVO AMANECER, SAN NICOLÁS",40056493,FRIL,EJECUCIÓN,MUNICIPIO,MUNICIP. SAN NICOLÁS,PUNILLA,SAN NICOLÁS,IDIS,PROYECTO,MEC-001
c6ca8e4d-b6a6-4b42-a102-7c92da0253cb,40056370,40056370-2023,40056370,,,"CONSTRUCCION AREAS VERDES POBLACION LOS AROMOS DE MILAHUE, COMUNA DE BULNES",40056370,FRIL,EJECUCIÓN,MUNICIPIO,MUNICIP. BULNES,DIGUILLÍN,BULNES,IDIS,PROYECTO,MEC-001
3008132b-4f69-4007-9244-30db79461646,40056381,40056381-2023,40056381,,,MEJORAMIENTO PATIO ESCUELA NUEVA AMERICA COMUNA DE QUIRIHUE,40056381,FRIL,EJECUCIÓN,MUNICIPIO,MUNICIP. QUIRIHUE,ITATA,QUIRIHUE,IDIS,PROYECTO,MEC-001
fc6d01d0-93da-4f7b-a1cb-11faeb571b11,40055692,40055692-2023,40055692,,,"CONSTRUCCION SEDE SOCIAL BOSQUES DEL ARRAYAN, CHILLAN",40055692,FRIL,EJECUCIÓN,MUNICIPIO,MUNICIP. CHILLÁN,DIGUILLÍN,CHILLÁN,IDIS,PROYECTO,MEC-001
96adaac7-ed31-49e4-92b7-2a2491765d44,40056283,40056283-2023,40056283,,,NORMALIZACION ELECTRICA ALA SUR CESFAM DE COBQUECURA,40056283,FRIL,EJECUCIÓN,MUNICIPIO,MUNICIP. COBQUECURA,ITATA,COBQUECURA,IDIS,PROYECTO,MEC-001
f2c7be3a-97e3-4934-b059-b8e940c23b54,40056282,40056282-2023,,,,CONSERVACION GIMNASIO MUNICIPAL COMUNA DE COBQUECURA,40056282,FRIL,EJECUCIÓN,MUNICIPIO,MUNICIP. COBQUECURA,ITATA,COBQUECURA,IDIS,PROYECTO,MEC-001
216aabfe-043d-4f93-add9-16deaebd37f2,40056281,40056281-2023,40056281,,,"CONSERVACION GIMNASIO DE COLMUYAO, COMUNA DE COBQUECURA",40056281,FRIL,EJECUCIÓN,MUNICIPIO,MUNICIP. COBQUECURA,ITATA,COBQUECURA,IDIS,PROYECTO,MEC-001
7cb1c1b0-8d8b-441b-a486-5cf48310c6fa,40056617,40056617-2023,,,,"MEJORAMIENTO PLAZA BUCHUPUREO, COMUNA DE COBQUECURA",40056617,FRIL,EJECUCIÓN,MUNICIPIO,MUNICIP. COBQUECURA,ITATA,COBQUECURA,IDIS,PROYECTO,MEC-001
b77ea731-87ca-4904-b311-34723af3a907,40056218,40056218-2023,40056218,,,TRANSFERENCIA PARA EL ACCESO CULTURAL EN LA REGIÓN DE ÑUBLE,40056218,TRANSFERENCIAS,EJECUCIÓN,SECTORIAL / OTRO,,PUNILLA,SAN CARLOS,IDIS,PROGRAMA,MEC-005
3d2e67e1-03c0-48c7-be83-3a85c5455665,40056265,40056265-2023,,,,"CONSTRUCCION PISTA DE PATINAJE, COMUNA DE QUILLÓN",40056265,FRIL,EJECUCIÓN,MUNICIPIO,MUNICIP. QUILLÓN,DIGUILLÍN,QUILLÓN,IDIS,PROYECTO,MEC-001
8a9cac8f-b54f-429e-b8be-6f5f2ff1e399,40056264,40056264-2023,40056264,,,"CONSTRUCCION PATIO TECHADO ESCUELA PUERTO FRUTALES DE COYANCO, QUILLÓN",40056264,FRIL,EJECUCIÓN,MUNICIPIO,MUNICIP. QUILLÓN,DIGUILLÍN,QUILLÓN,IDIS,PROYECTO,MEC-001
f9b2549d-958f-46ae-b0a3-f7df3e4b717e,40056270,40056270-2023,,,,"MEJORAMIENTO PISTA ATLÉTICA ESTADIO MUNICIPAL, QUILLÓN",40056270,FRIL,EJECUCIÓN,MUNICIPIO,MUNICIP. QUILLÓN,DIGUILLÍN,QUILLÓN,IDIS,PROYECTO,MEC-001
1046fe71-9e65-4949-b5c9-9179933d0723,40056272,40056272-2023,,,,"MEJORAMIENTO ESPACIO PÚBLICO VILLA EL ARRAYÁN, QUILLÓN",40056272,FRIL,EJECUCIÓN,MUNICIPIO,MUNICIP. QUILLÓN,DIGUILLÍN,QUILLÓN,IDIS,PROYECTO,MEC-001
309d18d0-40bb-4c56-9e70-a5bd32389af4,40056271,40056271-2023,40056271,,,"MEJORAMIENTO VEREDAS SECTOR NORTE, QUILLÓN",40056271,FRIL,EJECUCIÓN,MUNICIPIO,MUNICIP. QUILLÓN,DIGUILLÍN,QUILLÓN,IDIS,PROYECTO,MEC-001
f386250d-2b12-4515-8d6d-2697e5c7c1ef,40056269,40056269-2023,40056269,,,"REPOSICION SEÑALÉTICAS TURÍSTICAS E IDENTIFICACIÓN DE CALLES, QUILLÓN",40056269,FRIL,EJECUCIÓN,MUNICIPIO,MUNICIP. QUILLÓN,DIGUILLÍN,QUILLÓN,IDIS,PROYECTO,MEC-001
aec93e6d-edac-46a6-b4e3-11ddbe07d97c,40056128,40056128-2023,,,,"CONSTRUCCION SEDE COMUNITARIA SECTOR LAGUNA AZUL, COMUNA DE YUNGAY",40056128,FRIL,EJECUCIÓN,MUNICIPIO,MUNICIP. YUNGAY,DIGUILLÍN,YUNGAY,IDIS,PROYECTO,MEC-001
05af3c08-64a1-40a0-878a-5a6dd4760976,40056129,40056129-2023,40056129,,,"CONSTRUCCION CIERRES PERIMETRALES EN RECINTOS MUNICIPALES , COMUNA DE YUNGAY",40056129,FRIL,EJECUCIÓN,MUNICIPIO,MUNICIP. YUNGAY,DIGUILLÍN,YUNGAY,IDIS,PROYECTO,MEC-001
e4d2c001-a6d3-44de-b643-8893b8971f7d,40056127,40056127-2023,,,,"CONSTRUCCION CASA DE LA DISCAPACIDAD , COMUNA DE YUNGAY",40056127,FRIL,EJECUCIÓN,MUNICIPIO,MUNICIP. YUNGAY,DIGUILLÍN,YUNGAY,IDIS,PROYECTO,MEC-001
430dd482-5191-495a-a704-d885470a1ac2,40056671,40056671-2023,,,,"REPOSICION DE PAVIMENTO PASAJE JUVENAL HERNANDEZ, POB. EL ROBLE, COMUNA DE YUNGAY",40056671,FRIL,EJECUCIÓN,MUNICIPIO,MUNICIP. YUNGAY,DIGUILLÍN,YUNGAY,IDIS,PROYECTO,MEC-001
0a5601d7-5923-4337-bc7f-0190e42bf319,40056626,40056626-2023,,,,HABILITACION 1RA EXPO SEGURIDAD CHILLAN VIEJO-ÑUBLE 2023,40056626,TRANSFERENCIAS,EJECUCIÓN,MUNICIPIO,MUNICIP. CHILLÁN VIEJO,DIGUILLÍN,CHILLÁN VIEJO,IDIS,PROYECTO,MEC-001
1e6d1c1e-def7-41aa-9067-aaeb34065501,40056957,40056957-2023,40056957,,,"ACTUALIZACION PLAN DE DESARROLLO COMUNAL, YUNGAY 2024-2028",40056957,MIDESO,EJECUCIÓN,MUNICIPIO,MUNICIP. YUNGAY,DIGUILLÍN,YUNGAY,IDIS,PROGRAMA,MEC-005
5d17c2ec-d873-4312-8155-a2ba270c61bf,40056975,40056975-2023,40056975,,,ADQUISICIÓN EQUIPAMIENTO PARA HABILITACIÓN CAMAS PSIQUIATRÍA INFANTO-ADOLESCENTE HCHM,40056975,C-33,EJECUCIÓN,SECTORIAL / OTRO,S.SALUD ÑUBLE,DIGUILLÍN,CHILLÁN,IDIS,PROYECTO,MEC-001
5eaab0f5-e91f-408a-957a-a1af1d6a8f36,40056384,40056384-2023,40056384,,,TRANSFERENCIA PROGRAMAS ESPECIALES DE FOMENTO PRODUCTIVO PARA LA REGION DE ÑUBLE,40056384,TRANSFERENCIAS,EJECUCIÓN,SECTORIAL / OTRO,SERCOTEC,REGIONAL,REGIONAL,IDIS,PROGRAMA,MEC-005
d911f5f2-a9b4-461f-9c18-afb96d02d73c,40056531,40056531-2023,,,,"ADQUISICION DE RETROEXCAVADORA, COMUNA DE TREHUACO",40056531,C-33,EJECUCIÓN,MUNICIPIO,MUNICIP. TREHUACO,ITATA,TREGUACO,IDIS,PROYECTO,MEC-001
2029e886-d882-4a7b-bee7-2c2b5a565d7c,40057131,40057131-2023,40057131,,,"MEJORAMIENTO POSTA DE SALUD RURAL NUEVA ALDEA, COMUNA DE RÁNQUIL",40057131,FRIL,EJECUCIÓN,MUNICIPIO,MUNICIP. RÁNQUIL,ITATA,RÁNQUIL,IDIS,PROYECTO,MEC-001
ebfaeae5-216a-4735-b871-1c690e0b478d,40056897,40056897-2023,,,,TRANSFERENCIA VALORIZACIÓN DE ESPECIES NATIVAS,40056897,TRANSFERENCIAS,EJECUCIÓN,SECTORIAL / OTRO,,REGIONAL,REGIONAL,IDIS,PROGRAMA,MEC-005
8dfc4fbc-7309-4a24-b4eb-df1e3f07bf7f,40021911,40021911-2023,40021911,,,"REPOSICIÓN TOTAL ESCUELA FELIPE CUBILLOS SIGAL, COMUNA DE COELEMU",40021911,MIDESO,EJECUCIÓN,MUNICIPIO,MUNICIP. COELEMU,ITATA,COELEMU,IDIS,PROYECTO,MEC-001
72944a77-91a3-4cca-b052-eea8558123d5,40056994,40056994-2023,,,,"ADQUISICIÓN RODILLO COMPACTADOR 10 TONELADAS, CON CARRO DE TRANSPORTE, CHILLÁN",40056994,C-33,EJECUCIÓN,MUNICIPIO,MUNICIP. CHILLÁN,DIGUILLÍN,CHILLÁN,IDIS,PROYECTO,MEC-001
b7e151e5-f7f3-4a05-aa10-6097524262c7,40057879,40057879-2023,,,,"ADQUISICION VEHICULOS DE EMERGENCIA PARA BOMBEROS, COMUNAS ASOCIACION PUNILLA",40057879,C-33,EJECUCIÓN,SECTORIAL / OTRO,ASOCIACIÓN PUNILLA,PUNILLA,PUNILLA,IDIS,PROYECTO,MEC-001
2c09c3e0-eaa6-4b85-b8b6-4d1a22c8a40c,40052458,40052458-2023,40052458,,,"CONSTRUCCIÓN CUBIERTA MULTICANCHA, ESCUELA LAS CANOAS, CHILLÁN",40052458,FRIL,EJECUCIÓN,MUNICIPIO,MUNICIP. CHILLÁN,DIGUILLÍN,CHILLÁN,IDIS,PROYECTO,MEC-001
d3c43b33-2403-48b1-bfc8-9d8a505510ee,40058071,40058071-2023,,,,TRANSFERENCIA DESARROLLO CIENTÍFICO TECNOLÓGICO DE ÑUBLE Y DIVULGACIÓN DE LAS CIENCIAS,40058071,TRANSFERENCIAS,EJECUCIÓN,SECTORIAL / OTRO,,REGIONAL,REGIONAL,IDIS,PROGRAMA,MEC-005
c4402a96-52e6-4d66-9094-d7d16f07b000,40058389,40058389-2023,40058389,,,"TRANSFERENCIA TRANSFERENCIA FORTALECIMIENTO TURISMO DEPORTIVO, REGIÓN DE ÑUBLE",40058389,TRANSFERENCIAS,EJECUCIÓN,SECTORIAL / OTRO,SERNATUR,REGIONAL,REGIONAL,IDIS,PROGRAMA,MEC-005
8734ac8d-ef44-4029-a8a3-1a554a36f5a0,30207422,30207422-2023,,,,"REPOSICION Y AMPLIACION DEPENDENCIAS EDIFICIO CONSISTORIAL, COMUNA DE COIHUECO",30207422,MIDESO,EJECUCIÓN,MUNICIPIO,MUNICIP. COIHUECO,DIGUILLÍN,COIHUECO,IDIS,PROYECTO,MEC-001
40cbfd54-f5be-4a84-a193-2094a51d8171,40058408,40058408-2023,40058408,,,"MEJORAMIENTO DE CAMINOS, COMUNA DE QUIRIHUE",40058408,FRIL,EJECUCIÓN,MUNICIPIO,MUNICIP. QUIRIHUE,ITATA,QUIRIHUE,IDIS,PROYECTO,MEC-001
73aea7e7-1f06-493e-9144-6eaf24baf3f4,40058421,40058421-2023,40058421,,,CONSTRUCCION PISCINAS ACUMULADORAS DE AGUA EN 6 SECTORES DE ÑIQUEN PARA COMBATIR INCENDIOS.,40058421,FRIL,EJECUCIÓN,MUNICIPIO,MUNICIP. ÑIQUÉN,ITATA,ÑIQUÉN,IDIS,PROYECTO,MEC-001
7f44a1a5-a72f-46a3-b29c-0ed2a0bdd2e4,40058376,40058376-2023,40058376,,,"CONSERVACION DISTINTOS CAMINOS RURALES SECTOR SUR, COMUNA EL CARMEN",40058376,FRIL,EJECUCIÓN,MUNICIPIO,MUNICIP. EL CARMEN,DIGUILLÍN,EL CARMEN,IDIS,PROYECTO,MEC-001
3dc9a10d-c98e-42f5-b5ab-d9fea1db643f,40058467,40058467-2023,,,,"CONSTRUCCION FAJA SEGURIDAD VIAL Y ACCIONES DE PREVENCIÓN DE INCENDIOS, COMUNA DE COIHUECO",40058467,FRIL,EJECUCIÓN,MUNICIPIO,MUNICIP. COIHUECO,DIGUILLÍN,COIHUECO,IDIS,PROYECTO,MEC-001
147d7282-a900-4db7-a094-2360d0124cc7,40058439,40058439-2023,40058439,,,MEJORAMIENTO Y LIMPIEZA DE DIVERSOS CAMINOS DE LA COMUNA DE BULNES,40058439,FRIL,EJECUCIÓN,MUNICIPIO,MUNICIP. BULNES,DIGUILLÍN,BULNES,IDIS,PROYECTO,MEC-001
7ffebfa6-0345-4f42-ad83-48102ce09383,40058401,40058401-2023,40058401,,,"HABILITACION PUNTOS DE ABASTECIMIENTO CONTRA INCENDIOS, SAN NICOLÁS",40058401,FRIL,EJECUCIÓN,MUNICIPIO,MUNICIP. SAN NICOLÁS,PUNILLA,SAN NICOLÁS,IDIS,PROYECTO,MEC-001
5063ab6a-6f1a-4700-a8bb-124ba2104e60,40058515,40058515-2023,,,,"MEJORAMIENTO DE DIVERSOS CAMINOS VECINALES, COMUNA DE PORTEZUELO",40058515,FRIL,EJECUCIÓN,MUNICIPIO,MUNICIP. PORTEZUELO,ITATA,PORTEZUELO,IDIS,PROYECTO,MEC-001
0ca70b37-402f-401e-a607-ab6cfa53cf29,40058479,40058479-2023,40058479,,,"MEJORAMIENTO VARIOS CAMINOS , COMUNA DE SAN CARLOS",40058479,FRIL,EJECUCIÓN,MUNICIPIO,MUNICIP. SAN CARLOS,PUNILLA,SAN CARLOS,IDIS,PROYECTO,MEC-001
7fd0b6c9-e5e7-4ae1-ad45-e0d090761c87,40058441,40058441-2023,40058441,,,"MEJORAMIENTO FAJA DE CAMINOS DE EMERGENCIA E INFRAESTRUCTURA CRITICA, COMUNA DE COBQUECURA",40058441,FRIL,EJECUCIÓN,MUNICIPIO,MUNICIP. COBQUECURA,ITATA,COBQUECURA,IDIS,PROYECTO,MEC-001
720a5153-ccd4-4f0a-9333-98d540edc005,40058521,40058521-2023,40058521,,,"CONSERVACION DE CAMINOS VECINALES, COMUNA DE NINHUE",40058521,FRIL,EJECUCIÓN,MUNICIPIO,MUNICIP. NINHUE,ITATA,NINHUE,IDIS,PROYECTO,MEC-001
eab20bdb-a484-433b-9931-73c72a87e4e8,40058534,40058534-2023,40058534,,,"CONSTRUCCION ACUMULADORES DE AGUA Y ACCION DE PREVENCION DE INCENDIOS, COMUNA DE RÁNQUIL",40058534,FRIL,EJECUCIÓN,MUNICIPIO,MUNICIP. RÁNQUIL,ITATA,RÁNQUIL,IDIS,PROYECTO,MEC-001
34b03317-b936-430c-a413-4cd2a6573f7c,40058496,40058496-2023,40058496,,,"HABILITACION DE CAMINOS Y ESPACIOS PUBLICO PARA LA PREVENCION DE INCENDIOS, EN L",40058496,FRIL,EJECUCIÓN,MUNICIPIO,MUNICIP. TREHUACO,ITATA,TREGUACO,IDIS,PROYECTO,MEC-001
8159c71d-51a4-4cb4-8522-c9dba85444a5,40058468,40058468-2023,40058468,,,"CONSTRUCCION SISTEMA ACUMULACIÓN AGUA RESPUESTA A INCENDIOS DIVERSOS SECTORES, SAN FABIAN",40058468,FRIL,EJECUCIÓN,MUNICIPIO,MUNICIP. SAN FABIÁN,DIGUILLÍN,SAN FABIÁN,IDIS,PROYECTO,MEC-001
afee810f-3e90-4ba0-927e-d80c3b556076,40058431,40058431-2023,,,,"ADQUISICION OFICINA MOVIL, SLEP PUNILLA CORDILLERA",40058431,C-33,EJECUCIÓN,SECTORIAL / OTRO,ASOCIACIÓN PUNILLA,PUNILLA,PUNILLA,IDIS,PROYECTO,MEC-001
f824db05-9f98-4a0c-a246-5deeaebb0099,40055927,40055927-2023,,,,"TRANSFERENCIA DESARROLLO DE EMPRENDIMIENTOS A ORILLA DE CARRETERA, DE LA ZONA DE REZAGO REGIÓN DE ÑUBLE",40055927,TRANSFERENCIAS,EJECUCIÓN,SECTORIAL / OTRO,FOSIS,REGIONAL,REGIONAL,IDIS,PROGRAMA,MEC-005
2909ec85-7bd1-4e93-bd16-620e9b084d02,40058640,40058640-2023,40058640,,,"CONSERVACION CAMINOS VECINALES, COMUNA SAN IGNACIO",40058640,FRIL,EJECUCIÓN,MUNICIPIO,MUNICIP. SAN IGNACIO,DIGUILLÍN,SAN IGNACIO,IDIS,PROYECTO,MEC-001
cea6d49f-aaa8-4a92-8e11-6d45540f6651,40058470,40058470-2023,40058470,,,"REPARACION DIVERSOS CAMINOS RURALES, QUILLÓN",40058470,FRIL,EJECUCIÓN,MUNICIPIO,MUNICIP. QUILLÓN,DIGUILLÍN,QUILLÓN,IDIS,PROYECTO,MEC-001
03999bdb-41a8-4785-b7c1-576565e76a95,40058522,40058522-2023,40058522,,,"MEJORAMIENTO Y LIMPIEZA CAMINOS RURALES, COMUNA DE COELEMU",40058522,FRIL,EJECUCIÓN,MUNICIPIO,MUNICIP. COELEMU,ITATA,COELEMU,IDIS,PROYECTO,MEC-001
0c297c0c-c99f-4607-b34c-9ff68ace0e26,40058665,40058665-2023,40058665,,,"CONSTRUCCION CORTAFUEGOS Y LIMPIEZA EN DISTINTOS SECTORES DE LA COMUNA, CHILLAN VIEJO",40058665,FRIL,EJECUCIÓN,MUNICIPIO,MUNICIP. CHILLÁN VIEJO,DIGUILLÍN,CHILLÁN VIEJO,IDIS,PROYECTO,MEC-001
004ba548-f082-476d-963c-46279b66b79c,40058701,40058701-2023,40058701,,,"ADQUISICION CONTENEDORES BRIGADAS DE PREVENCIÓN Y COMBATE DE INCENDIO FORESTALES, DE NINHUE",40058701,C-33,EJECUCIÓN,SECTORIAL / OTRO,CONAF,ITATA,NINHUE,IDIS,PROYECTO,MEC-001
a35945a3-3db3-484f-a3d7-0069d75579ec,30483016,30483016-2023,30483016,,,"CONSTRUCCION GRADERÍAS MEDIALUNA SECTOR EL MANZANO, SAN NICOLÁS",30483016,FRIL,EJECUCIÓN,MUNICIPIO,MUNICIP. SAN NICOLÁS,PUNILLA,SAN NICOLÁS,IDIS,PROYECTO,MEC-001
1d0f7f1f-7903-4620-8073-3abcc08cb5d7,40058702,40058702-2023,40058702,,,TRANSFERENCIA PREVENCIÓN Y DETECCIÓN PRECOZ DE CÁNCER COLORRECTAL PARA LA REGIÓN DE ÑUBLE,40058702,FIC,EJECUCIÓN,SECTORIAL / OTRO,UBB,REGIONAL,REGIONAL,IDIS,PROGRAMA,MEC-005
85add582-6181-4215-80fb-86b05b7bf0bb,40058654,40058654-2023,40058654,,,"TRANSFERENCIA PLATAFORMA INTEROPERABLE, PARA EL MANEJO DE LISTAS DE ESPERA EN ÑUBLE",40058654,FIC,EJECUCIÓN,SECTORIAL / OTRO,UBB,REGIONAL,REGIONAL,IDIS,PROGRAMA,MEC-005
741bd774-fbc0-414a-ba5b-69db6597d683,40058700,40058700-2023,40058700,,,TRANSFERENCIA INDUSTRIALIZACIÓN DE LA VIVIENDA EN MADERA DE LA REGIÓN ÑUBLE,40058700,FIC,EJECUCIÓN,SECTORIAL / OTRO,UBB,REGIONAL,REGIONAL,IDIS,PROGRAMA,MEC-005
fa5b0be4-8174-4b88-aeaf-69db59779ae0,40058721,40058721-2023,40058721,,,TRANSFERENCIA PROGRAMA DE APOYO INTEGRAL PARA RESIDENCIAS DE PROTECCIÓN DE LA REGIÓN DE ÑUBLE,40058721,FIC,EJECUCIÓN,SECTORIAL / OTRO,UBB,REGIONAL,REGIONAL,IDIS,PROGRAMA,MEC-005
dd074bc4-f2ca-4a9a-a537-6eb0bc5743d8,40058767,40058767-2023,,,,TRANSFERENCIA AURA: MODELO DE SIMULACIÓN DEL CLIMA URBANO,40058767,FIC,EJECUCIÓN,SECTORIAL / OTRO,UDECH,DIGUILLÍN,CHILLÁN,IDIS,PROGRAMA,MEC-005
5dc3d07b-cf42-4bb7-ac4e-acc5db469965,40058771,40058771-2023,40058771,,,TRANSFERENCIA SISTEMA DE DIAGNÓSTICO Y RECOMENDACIÓN NUTRICIONAL INTEGRADA EN AVELLANO EUROPEO,40058771,TRANSFERENCIAS,EJECUCIÓN,SECTORIAL / OTRO,UTALCA,REGIONAL,REGIONAL,IDIS,PROGRAMA,MEC-005
f0968286-d9de-4730-9096-984d81178a48,40058752,40058752-2023,40058752,,,TRANSFERENCIA PLATAFORMA WEB-APP MÓVIL INTEGRADA EN RED PARA REDUCIR MORTALIDAD/MORBILIDAD POR,40058752,FIC,EJECUCIÓN,SECTORIAL / OTRO,UNIV. ADVENTISTA,REGIONAL,REGIONAL,IDIS,PROGRAMA,MEC-005
f951fa71-1667-44c4-bd15-ab3cbe0a1099,40057900,40057900-2023,40057900,,,TRANSFERENCIA LA PAJA DE TRIGO DEL VALLE DEL ITATA: UNA OPORTUNIDAD DE DESARROLLO DE ECONOMIA CIRCULAR Y SOSTENIB,40057900,FIC,EJECUCIÓN,SECTORIAL / OTRO,UDECH,ITATA,ITATA,IDIS,PROGRAMA,MEC-005
457f8020-2e6d-4d3c-a2cf-adbe7f1da653,40057788,40057788-2023,40057788,,,TRANSFERENCIA Gestión colaborativa en Salud Pública (Polo de Salud) para la Región de Ñuble,40057788,FIC,EJECUCIÓN,SECTORIAL / OTRO,UBB,REGIONAL,REGIONAL,IDIS,PROGRAMA,MEC-005
2de92338-eefd-46b3-bfe6-47c1edeb7d12,40058410,40058410-2023,,,,"ADQUISICIÓN RETROEXCAVADORA, PARA MUNICIPALIDAD DE BULNES",40058410,C-33,EJECUCIÓN,MUNICIPIO,MUNICIP. BULNES,DIGUILLÍN,BULNES,IDIS,PROYECTO,MEC-001
f17290f6-e8b0-44b7-8302-af88c6ef03af,40058836,40058836-2023,40058836,,,TRANSFERENCIA FORTALECIMIENTO DEL TURISMO SOCIAL EN LA REGIÓN DE ÑUBLE.,40058836,TRANSFERENCIAS,EJECUCIÓN,SECTORIAL / OTRO,SERNATUR,REGIONAL,REGIONAL,IDIS,PROGRAMA,MEC-005
fb273c0c-6a74-4d92-a201-bff7ac855232,40058764,40058764-2023,40058764,,,TRANSFERENCIA RED DE PRODUCTORES AGRÍCOLAS PARA LAS COMPRAS PÚBLICAS PARA LA REGIÓN DE ÑUBLE,40058764,FIC,EJECUCIÓN,SECTORIAL / OTRO,,REGIONAL,REGIONAL,IDIS,PROGRAMA,MEC-005
01f0a9e2-6af8-4ccb-a45f-da18389cddd7,40058688,40058688-2023,40058688,,,"TRANSFERENCIA DESARROLLO DE COMPETENCIAS Y, DIFUSIÓN Y PROMOCIÓN TURÍSTICA NACIONAL E INTERNAC",40058688,TRANSFERENCIAS,EJECUCIÓN,SECTORIAL / OTRO,SERNATUR,REGIONAL,REGIONAL,IDIS,PROGRAMA,MEC-005
82469f68-fb87-477c-b94c-8e2e42cc4287,40039418,40039418-2023,,,,CONSTRUCCION EXTENSIÓN ELECTRICA DISTINTOS SECTORES COMUNA DE SAN NICOLÁS,40039418,MIDESO,EJECUCIÓN,MUNICIPIO,MUNICIP. SAN NICOLÁS,PUNILLA,SAN NICOLÁS,IDIS,PROYECTO,MEC-001
0d114d2a-43e6-499b-b9ef-7c817e377b9f,40059039,40059039-2023,,,,"ADQUISICION DE 2 MINIBUSES PARA EL TRASLADO DE PERSONAS CON MOVILIDAD REDUCIDA, COMUNA DE COELEMU",40059039,C-33,EJECUCIÓN,MUNICIPIO,MUNICIP. COELEMU,ITATA,COELEMU,IDIS,PROYECTO,MEC-001
f09f74f7-e443-499c-952a-f616d890ae22,40057780,40057780-2023,,,,TRANSFERENCIA CIUDADANÍA Y MOVILIDAD ACTIVA PARA VIVIR MEJOR EN ÑUBLE,40057780,TRANSFERENCIAS,EJECUCIÓN,SECTORIAL / OTRO,GORE-DIT,REGIONAL,REGIONAL,IDIS,PROGRAMA,MEC-005
4c21ff73-bec2-40d0-8195-dd8252d6066d,40057478,40057478-2023,,,,TRANSFERENCIA RENUEVA TU BICI REGIÓN DE ÑUBLE,40057478,TRANSFERENCIAS,EJECUCIÓN,SECTORIAL / OTRO,GORE-DIT,REGIONAL,REGIONAL,IDIS,PROGRAMA,MEC-005
512fa3e8-cad7-4adf-a509-bfb948408eff,40058614,40058614-2023,,,,TRANSFERENCIA CIRCUITO DE FAMILIA DE ACOGIDAS DE ÑUBLE,40058614,TRANSFERENCIAS,EJECUCIÓN,SECTORIAL / OTRO,MEJOR NIÑEZ,REGIONAL,REGIONAL,IDIS,PROGRAMA,MEC-005
e84b67e3-e55d-4830-bbf5-f8b73cb13430,40058617,40058617-2023,,,,TRANSFERENCIA PROGRAMA DE REPARACIÓN DEL MALTRATO SERVICIO DE PROTECCIÓN ESPECIALIZADA,40058617,TRANSFERENCIAS,EJECUCIÓN,SECTORIAL / OTRO,,REGIONAL,REGIONAL,IDIS,PROGRAMA,MEC-005
5e5521e9-e114-4b35-8403-f66b08602b16,40059056,40059056-2023,,,,ADQUISICION VEHÍCULOS PARA PREVENCIÓN Y COMBATE REGIÓN DE ÑUBLE,40059056,C-33,EJECUCIÓN,SECTORIAL / OTRO,CONAF,REGIONAL,REGIONAL,IDIS,PROYECTO,MEC-001
444a9df1-02df-4fc6-a6b1-670bc901c1a8,40059053,40059053-2023,40059053,,,TRANSFERENCIA GESTORES DE LA PREVENCIÓN ANTE INCENDIOS FORESTALES DE LA REGIÓN DE ÑUBLE,40059053,TRANSFERENCIAS,EJECUCIÓN,SECTORIAL / OTRO,CONAF,REGIONAL,REGIONAL,IDIS,PROGRAMA,MEC-005
6b282948-d1b6-40e2-b94e-1c133cbfae1e,40059014,40059014-2023,,,,TRANSFERENCIA FORTALECIMIENTO RED DE SERVICIOS DE INFORMACIÓN AL TURISTA REGION DE ÑUBLE,40059014,TRANSFERENCIAS,EJECUCIÓN,SECTORIAL / OTRO,SERNATUR,REGIONAL,REGIONAL,IDIS,PROGRAMA,MEC-005
3aedd96a-45b0-4413-a31e-686a1fc368ca,40059004,40059004-2023,,,,TRANSFERENCIA PROTECCIÓN INTEGRAL PARA PERSONAS MAYORES DE LA REGIÓN DE ÑUBLE,40059004,TRANSFERENCIAS,EJECUCIÓN,SECTORIAL / OTRO,,REGIONAL,REGIONAL,IDIS,PROGRAMA,MEC-005
12452835-5230-46f0-ad47-ee11290b486b,40059005,40059005-2023,40059005,,,"PROTECCION CENTRO INTEGRAL DE ATENCION PARA LA MUJER, CHILLÁN VIEJO",40059005,GLOSAS COMUNES,EJECUCIÓN,MUNICIPIO,MUNICIP. CHILLÁN VIEJO,DIGUILLÍN,CHILLÁN VIEJO,IDIS,PROYECTO,MEC-001
244b0f76-d8eb-4789-9729-2f7492d9c3ff,40059046,40059046-2023,40059046,,,TRANSFERENCIA PROGRAMA REGIONAL DE APOYO PROFESIONAL PARA PERSONAS CON DISCAPACIDAD,40059046,TRANSFERENCIAS,EJECUCIÓN,SECTORIAL / OTRO,,REGIONAL,REGIONAL,IDIS,PROGRAMA,MEC-005
f9350b9b-8e2a-401f-92fd-f149efbb52d4,40048507,40048507-2023,40048507,,,"TRANSFERENCIA TRANSFERENCIA PARA EL FOMENTO AL RIEGO, REGION DE ÑUBLE",40048507,TRANSFERENCIAS,EJECUCIÓN,SECTORIAL / OTRO,CNR,REGIONAL,REGIONAL,IDIS,PROGRAMA,MEC-005
93570640-acab-40b7-bf00-a2b232dc148f,40059166,40059166-2023,40059166,,,ADQUISICION DE VEHÍCULOS MUNICIPALES COMUNA DE TREHUACO,40059166,C-33,EJECUCIÓN,MUNICIPIO,MUNICIP. TREHUACO,ITATA,TREGUACO,IDIS,PROYECTO,MEC-001
ca0facfa-062b-4089-aaea-a00ef52b945d,40058914,40058914-2023,40058914,,,"REPOSICION 2 AMBULANCIAS AEB 4X2, COMUNA DE SAN IGNACIO",40058914,C-33,EJECUCIÓN,MUNICIPIO,MUNICIP. SAN IGNACIO,DIGUILLÍN,SAN IGNACIO,IDIS,PROYECTO,MEC-001
357f5844-56b2-47ac-836b-fa73623e2a5f,40059287,40059287-2023,40059287,,,TRANSFERENCIA PROGRAMA INVERSIÓN A LA COMUNIDAD REGIÓN DE ÑUBLE AÑO 2024,40059287,TRANSFERENCIAS,EJECUCIÓN,SECTORIAL / OTRO,GORE-DIT,REGIONAL,REGIONAL,IDIS,PROGRAMA,MEC-005
d270895f-73a7-478e-a717-7bc948f6bc4d,40059040,40059040-2023,,,,ADQUISICION DE VEHÍCULOS PARA PREVENCIÓN Y COMBATE DE INCENDIOS FORESTALES PROVINCIALES,40059040,C-33,EJECUCIÓN,SECTORIAL / OTRO,CONAF,REGIONAL,REGIONAL,IDIS,PROYECTO,MEC-001
b9c64b66-5d2b-4a26-9cae-eb866affab99,40059030,40059030-2023,,,,"ADQUISICION DE EQUIPAMIENTO PARA LOGÍSTICA, COORDINACIÓN Y COMBATE, REGIÓN DE ÑUBLE",40059030,C-33,EJECUCIÓN,SECTORIAL / OTRO,CONAF,REGIONAL,REGIONAL,IDIS,PROYECTO,MEC-001
a1965cfa-3435-4f37-bf05-9b345bb39013,40058988,40058988-2023,,,,"ADQUISICION CONTENEDORES BRIGADA PREVENCIÓN Y COMBATE DE INCENDIOS FORESTALES, PROVINCIA DE DIGUILLÍN",40058988,C-33,EJECUCIÓN,SECTORIAL / OTRO,CONAF,DIGUILLÍN,DIGUILLÍN,IDIS,PROYECTO,MEC-001
f7b6fb6c-418f-4a56-8ddb-6e00395a3827,40059029,40059029-2023,40059029,,,ADQUISICION CUATRIMOTOS PARA EL CONTROL DE ÁREAS SILVESTRES PROTEGIDAS REGIÓN DE ÑUBLE,40059029,C-33,EJECUCIÓN,SECTORIAL / OTRO,CONAF,REGIONAL,REGIONAL,IDIS,PROYECTO,MEC-001
8854f659-71b2-4467-990e-d96e75cfa084,40059006,40059006-2023,,,,"ADQUISICION DRONES PARA LA PROSPECCIÓN, FISCALIZACIÓN Y MONITOREO DE ALERTA TEMPRANA REGIÓN",40059006,C-33,EJECUCIÓN,SECTORIAL / OTRO,CONAF,REGIONAL,REGIONAL,IDIS,PROYECTO,MEC-001
45c7f679-3229-4d55-99e6-2217c935543a,40058915,40058915-2023,,,,ADQUISICION EQUIPO PARA REDUCCIÓN DE COMBUSTIBLES ZONAS DE INTERFAZ REGIÓN DE ÑUBLE,40058915,C-33,EJECUCIÓN,SECTORIAL / OTRO,CONAF,REGIONAL,REGIONAL,IDIS,PROYECTO,MEC-001
f440b0a0-1b1b-4fde-bf05-244b64aa777e,40059096,40059096-2023,40059096,,,"CONSTRUCCION LUMINARIAS EN VARIOS SECTORES RURALES, COMUNA DE NINHUE",40059096,FRIL,EJECUCIÓN,MUNICIPIO,MUNICIP. NINHUE,ITATA,NINHUE,IDIS,PROYECTO,MEC-001
f573b95e-ffad-4cdf-9383-c78d1f6460c5,40058625,40058625-2023,,,,"ADQUISICION DE MAMOGRAFO PARA EL CESFAM VIOLETA PARRA, CHILLAN",40058625,C-33,EJECUCIÓN,SECTORIAL / OTRO,S.SALUD ÑUBLE,DIGUILLÍN,CHILLÁN,IDIS,PROYECTO,MEC-001
ffe2f863-6a06-4187-be71-6e1745678a71,40058502,40058502-2023,,,,"ADQUISICION DE MAMÓGRAFO PARA EL CESFAM MICHELL CHANDÍA ALARCÓN, COIHUECO",40058502,C-33,EJECUCIÓN,SECTORIAL / OTRO,S.SALUD ÑUBLE,DIGUILLÍN,COIHUECO,IDIS,PROYECTO,MEC-001
0c375995-45e8-4c19-9e9c-f8b136b588ee,40055655,40055655-2023,40055655,,,"ADQUISICION DE MAMOGRAFO PARA EL HOSPITAL COMUNITARIO DE YUNGAY, YUNGAY",40055655,C-33,EJECUCIÓN,SECTORIAL / OTRO,S.SALUD ÑUBLE,DIGUILLÍN,YUNGAY,IDIS,PROYECTO,MEC-001
062d9a03-d470-479b-b01f-ae006927d2f4,40059494,40059494-2023,40059494,,,"CONSTRUCCIÓN ILUMINACIÓN SOLAR Y TELEVIGILANCIA DIVERSOS SECTORES, COMUNA DE SAN IGNACIO",40059494,FRIL,EJECUCIÓN,MUNICIPIO,MUNICIP. SAN IGNACIO,DIGUILLÍN,SAN IGNACIO,IDIS,PROYECTO,MEC-001
2871545d-8799-4762-b2bd-ec10613f3ff7,40059560,40059560-2023,40059560,,,"INSTALACIÓN LUMINARIAS DE EMERGENCIA SOLAR PÚBLICA, COMUNA DE COBQUECURA",40059560,FRIL,EJECUCIÓN,MUNICIPIO,MUNICIP. COBQUECURA,ITATA,COBQUECURA,IDIS,PROYECTO,MEC-001
cb6765b6-0869-49a9-abd4-b83f55839217,40059652,40059652-2023,40059652,,,CONSTRUCCIÓN LUMINARIA FOTOVOLTAICA Y SISTEMA DE TELEVIGILANCIA COMUNA DE TREHUACO,40059652,FRIL,EJECUCIÓN,MUNICIPIO,MUNICIP. TREHUACO,ITATA,TREGUACO,IDIS,PROYECTO,MEC-001
2d2047fe-0d3d-48c4-a22d-909a37a42b06,40058969,40058969-2023,,,,ADQUISICION CARRO DE ABASTECIMIENTO Y SEGUNDO SOCORRO,40058969,C-33,EJECUCIÓN,MUNICIPIO,MUNICIP. CHILLÁN VIEJO,DIGUILLÍN,CHILLÁN VIEJO,IDIS,PROYECTO,MEC-001
c6935b2c-13f6-4057-95f7-6ed07667df63,40059697,40059697-2024,40059697,,,"CONSTRUCCION ESCUELA DE FORMACIÓN DE CARABINEROS, SEDE ÑUBLE",40059697,MIDESO,DISEÑO,SECTORIAL / OTRO,CARABINEROS,REGIONAL,REGIONAL,IDIS,PROYECTO,MEC-001
42eeae35-e742-4615-b0c9-56fae39ff030,40052487,40052487-2024,,,,SANEAMIENTO DERECHOS DE AGUA DE LA REGIÓN DE ÑUBLE,40052487,TRANSFERENCIAS,EJECUCIÓN,SECTORIAL / OTRO,MOP-DGA,REGIONAL,REGIONAL,IDIS,PROYECTO,MEC-001
aad6e7ca-78e5-4e45-86f3-abc24e1e02ec,40059771,40059771-2024,40059771,,,"CONSTRUCCION CANCHA DE FUTBOL, SECTOR HUALTE, COMUNA DE NINHUE",40059771,MIDESO,DISEÑO,MUNICIPIO,MUNICIP. NINHUE,ITATA,NINHUE,IDIS,PROYECTO,MEC-001
72f6ab69-6a37-4bb9-9ffe-8211b49f5cad,40058882,40058882-2024,,,,"CONSTRUCCIÓN SISTEMA DE AGUA POTABLE RURAL SECTOR SAN RAMÓN SUR, MUNICIPALIDAD DE QUILLÓN",40058882,MIDESO,EJECUCIÓN,MUNICIPIO,MUNICIP. QUILLÓN,DIGUILLÍN,QUILLÓN,IDIS,PROYECTO,MEC-001
20c5e28d-3b5f-4d1b-b2b8-b4a146021e54,40045333,40045333-2024,,,,REPOSICIÓN OFICINA REGISTRO CIVIL COIHUECO,40045333,MIDESO,DISEÑO,SECTORIAL / OTRO,REGISTRO CIVIL,DIGUILLÍN,COIHUECO,IDIS,PROYECTO,MEC-001
aaaa441b-a1b3-4376-8cf5-6bd9c4b71657,40061272,40061272-2024,40061272,,,"MEJORAMIENTO CAMINOS CON APLICACION DE SUPRESOR DE POLVO, COMUNA DE QUIRIHUE",40061272,FRIL,EJECUCIÓN,MUNICIPIO,MUNICIP. QUIRIHUE,ITATA,QUIRIHUE,IDIS,PROYECTO,MEC-001
