1030,REND ,2401M0082,18-11-2024,20-11-2024,20-11-2024,AGRUPACION ECOLOGICA RESCATE ANIMAL BULNES ,"FOMENTANDO LA TENENCIA RESPONSABLE, EL RESCATE ES ENTRE TODOS ",,,
1031,REND ,2401AM0199,20-11-2024,20-11-2024,20-11-2024,VOLUNTARIADO ADULTO MAYOR ,TRANSFORMANDO VIDAS ALIMENTANDO SUEÑOS EN EL COMEDOR SOLIDARIO DE QUILLON ,,,
1032,REND ,2401EG0043,20-11-2024,20-11-2024,20-11-2024,AGRUPACION DE MUJERES CAMPESINAS EL CARMEN ,MUJERES CAMPESINAS CAMINANDO HACIA LA AGRICULTURA SOSTENIBLE ,,,
1033,REND ,2401SC0417,20-11-2024,20-11-2024,20-11-2024,JUNTA DE VECINOS GOROPEUMO VEGA LOS REYES ,ENERGIA SOLAR LED PARA GOROPEUMO ,,,
1034,REND ,2401M0017,20-11-2024,20-11-2024,20-11-2024,COMITE AGROECOLOGICO PUENTE ÑUBLE ,CULTIVANDO CAMBIOS: SEMINARIO DE AGROECOLOGIA Y RESPONSABILIDAD AMBIENTAL ,,,
1035,REND ,2401AM0175,20-11-2024,20-11-2024,20-11-2024,CLUB ADULTO MAYOR SANTA INES ,RECARGANDO ENERGIAS ,,,
1036,REND ,2401AM0103,14-11-2024,20-11-2024,20-11-2024,CLUB ADULTO MAYOR NUEVO AMANECER ,FELICIDAD Y BIENESTAR ,,,
1037,REND ,2401AM0019,14-11-2024,20-11-2024,20-11-2024,CLUB ADULTO MAYOR MAYULERMO ,ENERGIA Y VITALIDAD ,,,
1038,REND ,2401AM0182,14-11-2024,20-11-2024,20-11-2024,CLUB ADULTO MAYOR ARCOIRIS ,LAS TERMAS Y SUS PROPIEDADES PARA LA SALUD ,,,
1039,REND ,2401AM0016,14-11-2024,20-11-2024,20-11-2024,CLUB ADULTO MAYOR MARIA DORILA ,RECREACION COMO EN FAMILIA ,,,
1040,REND ,2401AM0003,11-11-2024,20-11-2024,21-11-2024,CLUB DE ADULTO MAYOR LOS BUENOS VECINOS ,DISFRUTAR DE SALUD Y BIENESTAR ,,,
1041,REND ,2401AM0002,14-11-2024,20-11-2024,21-11-2024,CLUB ADULTO MAYOR JUAN DE DIOS DAVILA ,CONOCIMIENTO CULTURAL,,,
1042,REND ,2401D0012,19-11-2024,20-11-2024,21-11-2024,CLUB DE RAYUELA SAN MIGUEL ,LA RAYUELA DEPORTE NACIONAL ,,,
1043,REND ,2401AM0151,20-11-2024,21-11-2024,21-11-2024,CLUB DE ADULTO MAYOR DR. ISIDORO TOHA ,RECORDANDO EL RAMAL DE CONSTITUCION ,,,
1044,REND ,2401AM0096,20-11-2024,21-11-2024,21-11-2024,CLUB DE ADULTO MAYOR VIDA NUEVA ,LA SERENA Y VIDA NUEVA VIVEN SUS ENCANTOS ,,,
1045,REND ,2401D0189,15-11-2024,21-11-2024,21-11-2024,CLUB DEPORTIVO Y RAYUELA DIEGO DE ALMAGRO ,EL CLUB DE RAYUELA DIEGO DE ALMAGRO SE IMPLEMENTA Y PARTICIPA EN EL CAMPEONATO OFICIAL DE RAYUELA 2024,,,
1046,REND ,2401SC0618,22-11-2024,22-11-2024,22-11-2024,CENTRO GENERAL DE PADRES Y APODERADOS DEL LICEO POLIVALENTE REPUBLUCA DE PARAGUAY,CONSTRUYENDO UNA COMUNIDAD ESCOLAR SEGURA ,,,
1047,REND ,2401SC0261,22-11-2024,22-11-2024,22-11-2024,JJ.VV ROBINSON RAMIREZ ,CASAS MAS SEGURAS VILLA ROBINSON RAMIREZ ,,,
1048,REND ,CVC-AD-25,22-11-2024,22-11-2024,22-11-2024,CLUB SOCIAL CULTURAL Y DEPORTIVO DEL RODEO CHILENO ARTURO PRAT DE NINHUE ,RODEO DE PRIMERA CLUB ARTURO PRAT DE NINHUE,,,
1049,REND ,2401AM0255,21-11-2024,22-11-2024,22-11-2024,CLUB DE ANCIANOS LOS PEREGRINOS DE EMAUS ,TERAPIAS NATURALES PARA LAS PERSONAS MAYORES DE BULNES ,,,
1050,REND ,2401AM0046,22-11-2024,22-11-2024,22-11-2024,CLUB DE ADULTO MAYOR VOLVER A NACER ,CURANIPE Y SUS ENCANTOS ,,,
1051,REND ,2401C0099,22-11-2024,22-11-2024,22-11-2024,JJ.VV LARQUI PONIENTE ,IV VERSION FIESTA DE LA CAZUELA DE CAMPO ,,,
1052,REND ,2401C0163,21-11-2024,22-11-2024,22-11-2024,AGRUPACION CULTURAL CON MANOS DE MUJER ,"TALLER DE PINTURA, EXPLORANDO NUEVAS TECNICAS ",,,
1053,REND ,2401AM0049,21-11-2024,22-11-2024,22-11-2024,CLUB DE ADULTO MAYOR QUELTEHUE ,"CON ESTE VIAJE TERAPEUTICO, LAS SOCIAS Y SOCIOS DEL CLUB DEL ADULTO MAYOR QUELTEHUE MEJORAMOS NUESTRA CALIDAD DE VIDA ",,,
1054,REND ,2401EG0011,25-11-2024,25-11-2024,25-11-2024,COMITE DE MUJERES LAS NIEVES ,JUNTAS APRENDEMOS A SOÑAR ,,,
1055,REND ,2401S0141,22-11-2024,25-11-2024,25-11-2024,COMITE DE MANUALIDADES CREACIONES ,CREANDO EN EL TELAR ,,,
1056,REND ,2401D0196,26-11-2024,25-11-2024,25-11-2024,CLUB DEPORTIVO RENACER ,SEGUNDA ESCUELA FORMATIVA DEL CLUB DEPORTIVO RENACER 2024,,,
1057,REND ,2401D0041,24-11-2024,25-11-2024,25-11-2024,ASOCIACION DE ARBITROS SAN CARLOS ÑUBLE ,CERTIFICACION FIFA E IMPLEMENTACION DEPORTIVA PARA ARBITROS DE PUNILLA ,,,
1058,REND ,2401M0035,24-11-2024,25-11-2024,25-11-2024,JUNTA DE VECINOS TIUQUILEMU CENTRO ,TALLERES DE PRODUCCION ORGANICA DE HUERTAS ,,,
1059,REND ,2401SC0329,25-11-2024,25-11-2024,25-11-2024,JUNTA DE VECINOS SOL DE CHILLAN ,ILUMINANDO TU SECTOR ,,,
1060,REND ,2401EG0091,25-11-2024,25-11-2024,25-11-2024,COMITE DE DESARROLLO MANOS MAGICAS ,COSIENDO LOS CAMINOS A NUEVAS OPORTUNIDADES ,,,
1061,REND ,2401EG0041,25-11-2024,25-11-2024,25-11-2024,COMITE DE MUJERES CAMPESINAS LA GREDA ,CREANDO DE BUZOS DEPORTIVOS ,,,
1062,REND ,2201D0060,25-11-2024,25-11-2024,25-11-2024,CLUB DEPORTIVO EL FARO ,COPA CLUB DEPORTIVO EL FARO ,,,
1063,REND ,2401AM0043,25-11-2024,25-11-2024,25-11-2024,CLUB ADULTO MAYOR AÑOS DORADOS ,COBQUECURA ENCANTO Y CULTURA ,,,
1064,REND ,2401AM0173,25-11-2024,25-11-2024,25-11-2024,CLUB ADULTO MAYOR REVIVIR ,REVIVIENDO TIEMPOS EN AGUA LINDA ,,,
1065,REND ,2401AM0167,25-11-2024,25-11-2024,25-11-2024,TALLER DE APOYO AL ADULTO MAYOR ,APOYANDONOS ENTRE NOSOTROS Y A LOS DEMAS ,,,
1066,REND ,2301ADNCS003,22-11-2024,25-11-2024,25-11-2024,COOPERATIVA DE CONSUMO DE ENERGIA ELECTRICA CHILLAN ,CONFERENCIA LATINOAMERICANA ,,,
1067,REND ,2401C0120,25-11-2024,25-11-2024,25-11-2024,JUNTA DE VECINOS PANIAGUA ,II VERSION FIESTA CULTURAL BENDICION DE TRIGO ,,,
1068,REND ,2401C0020,25-11-2024,25-11-2024,25-11-2024,JUNTA DE VECINOS COBQUECURA URBANO ,"BANQUETERIA: SABOR, SAZON Y DELICIAS EN LA 18 DE SEPTIEMBRE ",,,
1069,REND ,2401SC0057,25-11-2024,25-11-2024,25-11-2024,JUNTA DE VECINOS EL CASTILLO ,EL CASTILLO REACCIONA A LAS EMERGENCIAS Y CATASTROFES,,,
1070,REND ,2401C0015,25-11-2024,25-11-2024,25-11-2024,JUNTA DE VECINOS PILICURA ,2DA FIESTA COSTUMBRISTA MAR Y TIERRA EN PILICURA ,,,
1071,REND ,2401SC0503,12-11-2024,25-11-2024,25-11-2024,JUNTA DE VECINOS PUERTAS DE VIRGUIN ,VECINOS PROTEGIDOS ,,,
1072,REND ,2401EG0020,25-11-2024,25-11-2024,25-11-2024,JUNTA DE VECINOS EL TOLLO ,TEJIENDO MIS RAICES ,,,
1073,REND ,2401EG0052,25-11-2024,25-11-2024,25-11-2024,CENTRO ARTESANAL SAN JOSE ,MANOS TEJEDORAS DE COBQUECURA ,,,
1074,REND ,2401SC0595,25-11-2024,25-11-2024,25-11-2024,JUNTA DE VECINOS COMILLAUN-MALOCAVEN,LUMINARIAS DEL CORE PARA COMILLAUN ,,,
1075,REND ,2401AM0189,20-11-2024,25-11-2024,25-11-2024,ADULTOS MAYORES AL ALERO DEL TANGO ,"VIAJE CULTURAL , RECREATIVO Y DE EXPERIMENTO SOCIAL ",,,
1076,REND ,2401D0156,25-11-2024,25-11-2024,25-11-2024,CLUB DEPORTIVO HALCONES ROJOS DE TALQUIPEN ,"CLUB DEPORTIVO HALCONES ROJOS DE TALQUIPEN PARTICIPAN EN EL CAMPEONATO DE FUTBOL COMUNAL, COIHUECO 2024""",,,
1077,REND ,2401D0084,25-11-2024,25-11-2024,25-11-2024,CLUB DEPORTIVO SOCIAL Y CULTURAL TAEKWONDO KIMS ÑUBLE ,FORMACION PARA FUTUROS ARBITROS DE TAEKWONDO ,,,
1078,REND ,2401AM0126,25-11-2024,25-11-2024,25-11-2024,UNION COMUNAL DE ADULTOS MAYORES ,LOS PLATOS TIPICOS VII VERSION ,,,
1079,REND ,2401AM0112,25-11-2024,25-11-2024,25-11-2024,CLUB DE ADULTO MAYOR SOL NACIENTE ,DE TOUR ME VOY A VALDIVIA ,,,
1080,REND ,2401EG0015,25-11-2024,25-11-2024,25-11-2024,JUNTA DE VECINOS TAUCU ,"SEMBRANDO Y CULTIVANDO ESPERANZA, HUERTOS TAUCU ",,,
1081,REND ,2401EG00833,25-11-2024,26-11-2024,26-11-2024,COMITE LA ESPERANZA DE ZAPALLAR ,HACIENDO REALIDAD NUESTRO SUEÑO ,"$2,998,837.00",,
1082,REND ,2401S0088,25-11-2024,26-11-2024,26-11-2024,COMITE DE MUJERES EMPRENDEDORAS RANCHILLO BAJO ,DEDAL MAGICO ,"$2,999,490.00",,
1083,REND ,2401AM0123,25-11-2024,26-11-2024,26-11-2024,CENTRO CULTURAL ESFUERZO Y CANTO DE LOS ADULTOS MAYORES ,EXPLORANDO RAICES CULTURALES E HISTORICAS ,"$1,860,000.00",,
1084,REND ,2401EG0120,25-11-2024,26-11-2024,26-11-2024,CLUB DE HUASOS SAN RAFAEL DE DUCHA URREJOLA ,CABALGANDO HACIA LA SORORIDAD EN EL MUNDO RURAL ,"$2,997,500.00",,
1085,REND ,2401S0149,22-11-2024,26-11-2024,26-11-2024,TALLER BORDADO SUEÑOS ,BORDANDO RECURDOS ,"$2,999,940.00",,
1086,REND ,2401SC0120,25-11-2024,26-11-2024,26-11-2024,"JUNTA DE VECINOS N°12 ""MARTIN RUIZ DE GAMBOA"" CHILLAN ",IMPLEMENTANDO MEJOR SEGURIDAD PARA TODOS ,"$3,993,000.00",,
1087,REND ,2401M0013,26-11-2024,26-11-2024,26-11-2024,JUNTA DE VECINOS LOMAS COLORADAS ,LOMAS COLORADAS RENACE RESPETANDO EL MEDIO AMBIENTE ,"$2,953,990.00",,
1088,REND ,2401M0111,25-11-2024,26-11-2024,26-11-2024,CENTRO GENERAL DE PADRES Y APODERADOS ESCUELA LOS OLIVOS DE BATUCO ,ESCUELA LOS OLIVOS DE BATUCO,"$2,997,338.00",,
1089,REND ,2401C0019,26-11-2024,26-11-2024,26-11-2024,ESCUELA DE ROCK RANQUILINOS ,GENERACION 23 EL PROYECTO MUSICAL ,"$3,489,920.00",,
1090,REND ,2401SC0050,26-11-2024,26-11-2024,26-11-2024,JUNTA DE VECINOS LAS ROSAS  ,SECTOR LAS ROSAS MAS SEGURO ,"$3,898,431.00",,
1091,REND ,2401S0035,25-11-2024,26-11-2024,26-11-2024,AGRUPACION DE PRODUCTORES Y EMPRENDEDORES ITINERANTES DE RANQUIL ,SALUD ITINERANTE PARA RANQUIL ,"$2,996,850.00",,
1092,REND ,2401C0016,25-11-2024,26-11-2024,26-11-2024,TALLER DE ARTESANAS DE LA COMUNA DE RANQUIL ,MUESTRA Y TALLERES DE ARTESANIA IDENTITARIA DE RANQUIL ,"$3,500,000.00",,
1093,REND ,2401C0145,25-11-2024,26-11-2024,26-11-2024,COMITE PRODUCTIVO EL PINO HUACHO ,ENTRE PAÑUELOS Y ESPUELAS ,"$2,495,000.00",,
1094,REND ,2401C0142,25-11-2024,26-11-2024,26-11-2024,CENTRO GENERAL DE PADRES Y APODERADOS ESCUELA DE NUEVA ALDEA ,ESCUELA NUEVA ALDEA VIVE LA CHILENIDAD ,"$2,498,300.00",,
1095,REND ,2401S0069,25-11-2024,26-11-2024,26-11-2024,COMITE DE MANUALIDADES LAS BUENAS AMIGAS ,COCIENDO CON AMOR ,"$3,000,000.00",,
1096,REND ,2401M0122,26-11-2024,26-11-2024,26-11-2024,JUNTA DE VECINOS VILLA PACIFICO ,VILLA PACIFICO CUIDANDO MI ENTORNO,"$2,406,630.00",,
1097,REND ,2401M0100,26-11-2024,26-11-2024,26-11-2024,JUNTA DE VECINOS LAS VERTIENTES ,VILLA LAS VERTIENTES MEJORA SU BARRIO ,"$2,539,190.00",,
1098,REND ,2401SC0036,26-11-2024,26-11-2024,26-11-2024,PRESIDENTE JUNTA DE VECINOS COYANCO UNIDAD VECINAL NRO 6,PREPARADOS Y EQUIPADOS PARA EVITAR LOS INCENDIOS ,"$3,990,096.00",,
1099,REND ,2401C0153,26-11-2024,26-11-2024,26-11-2024,CLUB DEPORTIVO SOCIAL Y CULTURAL CABALGADORES EL AMANECER LOURDES ,FIESTA COSTUMBRISTA DEL CABALLO ,"$2,500,000.00",,
1100,REND ,2401AM0157,22-11-2024,26-11-2024,26-11-2024,CASA ADULTO MAYOR CHILLAN ,PREVENCION Y FUNCIONES EJECUTIVAS ,"$1,779,960.00",,
1101,REND ,2401C0176,26-11-2024,26-11-2024,26-11-2024,CLUB DE HUASOS EL SEMBRADOR,ENCUENTRO POR LAS TRADICIONES CRIOLLAS ,"$2,459,430.00",,
1102,REND ,2401AM0125,26-11-2024,26-11-2024,26-11-2024,CENTRO DE ADULTO MAYOR LOS ROBLES ,FOLCLORE VIVO: RENANCIENDO RAICES ,"$1,820,004.00",,
1103,REND ,2401EG0037,26-11-2024,26-11-2024,26-11-2024,CENTRO DE MADRES ETELVIDA DE FUENTES ,JUNTAS HACIENDO UN HORIZONTE: FORTALECIMIENTO LA COMUNIDAD FEMENINA ,"$2,688,000.00",,
1104,REND ,2401SC0287,25-11-2024,26-11-2024,26-11-2024,COMITE DE RIEGO CARRULLANCA ,ACUMULANDO AGUA EN CARRULLANCA ,"$3,435,686.00",,
1105,REND ,2401M0012,26-11-2024,26-11-2024,26-11-2024,JUNTA DE VECINOS LOS MAQUIS ,RECOLENTANDO MIS DESECHOS DOMICILIARIOS ,"$2,485,551.00",,
1106,REND ,2401SC0536,26-11-2024,26-11-2024,26-11-2024,JUNTA DE VECINOS LO RAMIREZ ,EN LO RAMIREZ ACTUAMOS CONTRA LOS INCENDIOS ,"$1,669,651.00",,
1107,REND ,2401SC0093,25-11-2024,26-11-2024,26-11-2024,JUNTA DE VECINOS PANGUILEMU ,VECINOS DE PANGUILEMU UNIDOS CONTRA LOS INCENDIOS ,"$1,506,000.00",,
1108,REND ,2401EG0140,27-11-2024,26-11-2024,26-11-2024,AGRUPACION DE MUJERES LAS EVITAS ,AUTONOMIA FINANCIERA PARA LAS EVITAS II,"$3,000,000.00",,
1109,REND ,2401EG0145,27-11-2024,26-11-2024,26-11-2024,CENTRO DE MADRES LAS VIOLETAS ,EL ARTE DE LA COSTURA ,"$2,550,000.00",,
1110,REND ,2401M0080,27-11-2024,26-11-2024,26-11-2024,JJ.VV 5-R LAS MARIPOSAS-BULNES ,PROTEGIENDO EL MEDIO AMBIENTE EN LAS MARIPOSAS ,"$2,150,650.00",,
1111,REND ,2401C0064,12-11-2024,26-11-2024,26-11-2024,JUNTA DE VECINOS BOCA ITATA ,6° VERSION: LA CULTURA Y TRADICIONES SE VIVEN EN EL CAMPO ,"$2,500,000.00",,
1112,SUBS,2401AM0119,7-11-2024,26-11-2024,26-11-2024,CLUB DE ADULTO MAYOR BELLO HORIZONTE ,AGUAS DE BIENESTAR ,"$17,711.00",,
1113,SUBS,2401SC0417,26-11-2024,26-11-2024,26-11-2024,JUNTA DE VECINOS GOROPEUMO VEGA LOS REYES ,ENERGIA SOLAR LED PARA GOROPEUMO ,"$200,000.00",,
1114,REND ,2401S0061,19-11-2024,26-11-2024,26-11-2024,JUNTA DE VECINOS UNION Y PROGRESO HUEMUL ,EN HUEMUL NOS CUIDAMOS TODOS ,"$2,997,518.00",,
1115,SUBS,2401EG0025,26-11-2024,26-11-2024,26-11-2024,COMITE DE MUJERES LAS GOLONDRINAS ,LAS GOLONDRINAS EXPLORAN LA RESINA ,$0.00,,
1116,REND ,2401SC0623,26-11-2024,26-11-2024,26-11-2024,COMITE DE ADELANTO Y DESARROLLO DE VILLA LOS ALAMOS ,PROMOVIENDO INICIATIVAS PARA MEJORAR LA SEGURIDAD COMUNITARIA ,"$3,351,551.00",,
1117,REND ,2401S0151,22-11-2024,27-11-2024,27-11-2024,TALLER DE MANUALIDADES LAS MARAVILLAS DE SAN ANTONIO ,LA MAGIA DEL TELAR ARTESANAL ,"$3,000,000.00",,
1118,REND ,2401AM0105,27-11-2024,27-11-2024,27-11-2024,GRUPO ADULTO MAYOR PAZ Y AMISTAD ,UNA EXPERIENCIA MAYOR DE TURISMO CULTURAL ,"$1,575,936.00",,
1119,REND ,2401AM0093,27-11-2024,27-11-2024,27-11-2024,COMITE DE ADULTO MAYOR EL TRIGAL LOMA DE HORNO ,UN RESPIRO PARA EL ALMA ,"$1,461,572.00",,
1120,REND ,2401AM0078,27-11-2024,27-11-2024,27-11-2024,GRUPO ADULTO MAYOR LA AURORA DE PAL PAL,POR UN CUERPO Y MENTE SANA ,"$1,924,464.00",,
1121,REND ,2401AM0087,27-11-2024,27-11-2024,27-11-2024,CLUB DE ADULTO MAYOR HILDA SANDOVAL VARGAS ,VIAJANDO EN LA HISTORIA ,"$1,376,200.00",,
1122,REND ,2401AM0101,27-11-2024,27-11-2024,27-11-2024,AGRUPACION DE ADULTOS MAYORES LOS AÑOS DORADOS ,ADULTOS MAYORES DE CAPILLA NORTE CONOCIENDO LA RUTA PATRIMONIAL DE NINHUE ,"$819,180.00",,
1123,REND ,2401M0044,25-11-2024,27-11-2024,27-11-2024,JUNTA DE VECINOS VILLA ARTURO PRAT,NUESTRA VILLA PRAT MAS LIMPIA ,"$1,681,570.00",,
1124,REND ,2401SC0077,25-11-2024,27-11-2024,27-11-2024,JUNTA DE VECINOS SANTA JOSEFINA ,"SANTA JOSEFINA, MAS SEGURO","$3,566,073.00",,
1125,REND ,2401S0159,25-11-2024,27-11-2024,27-11-2024,AGRUPACION MANOS DE ARTESANA ,"MUJERES APRENDIENDO, MUJERES AVANZANDO ","$3,000,000.00",,
1126,REND ,2401M0066,22-11-2024,27-11-2024,27-11-2024,COMITE AGUA POTABLE RURAL NUEVA ALDEA- LA CONCEPCION ,"NUEVA ALDEA FRENTE A LA SEQUIA, SE CAPACITA PARA EL MANEJO SUSTENTABLE DEL AGUA ","$2,090,409.00",,
1127,REND ,2401AM0221,27-11-2024,27-11-2024,27-11-2024,CLUB DE ADULTO MAYOR AÑORADA JUVENTUD DE ILLINOIS ,FORTALECIENDO LAS TECNICAS CULINARIAS ,"$2,000,000.00",,
1128,REND ,2401SC0066,27-11-2024,27-11-2024,27-11-2024,JUNTA DE VECINOS LAGOS DE CHILE ,POR UNA JUNTA DE VECINOS VILLA LAGOS DE CHILE MAS SEGURA ,"$3,862,799.00",,
1129,REND ,2401AM0158,27-11-2024,27-11-2024,27-11-2024,AGRUPACION ADULTO MAYOR AVE FENIX,EXPLORANDO JUNTOS; EL VIAJE DE AVE FENIX ,"$1,584,000.00",,
1130,REND ,2401M0117,14-11-2024,27-11-2024,27-11-2024,JUNTA DE VECINOS SAN MARTIN   ,JUNTA DE VECINOS SAN MARTIN CUIDA LA NATURALEZA ,"$2,451,200.00",,
1131,SUBS,2401C0099,27-11-2024,27-11-2024,27-11-2024,JUNTA DE VECINOS LARQUI PONIENTE 9-R,"IV VERSION DE LA FIESTRA CRIOLLA DE LA CAZUELA DE CAMPO, LARQUI PONIENTE ",$0.00,,
1132,REND ,2401AM0110,22-11-2024,27-11-2024,27-11-2024,AGRUPACION ADULTO MAYOR EL PROGRESO ,ENTRE RELIQUIAS Y RECUERDOS ,"$1,995,795.00",,
1133,REND ,2401SC0142,21-11-2024,27-11-2024,27-11-2024,JUNTA DE VECINOS EL ESPINAR ,CON EXTINTORES EL ESPINAR MAS SEGURO ,"$1,360,000.00",,
1134,REND ,2401C0162,27-11-2024,27-11-2024,27-11-2024,JUNTYA DE VECINOS N°5 SAN BERNARDO ,FIESTA DEL CORDERO DE LA JUNTA DE VECINOS N°5 SAN BERNARDO ,"$2,500,000.00",,
1135,REND ,2401M0128,27-11-2024,27-11-2024,27-11-2024,COMITE HUMANITARIO GENERAL CRUZ ,BASURA SEGURA ,"$2,792,260.00",,
1136,REND ,2401AM0094,27-11-2024,27-11-2024,27-11-2024,CORO ADULTO MAYOR VOCES MAGICAS DEL AYER,DIA MAGICO EN CURANIPE ,"$1,996,160.00",,
1137,REND ,2401SC0284,27-11-2024,27-11-2024,27-11-2024,JUNTA DE VECINOS SANTA ELENA ,NUESTRA VILLA MAS SEGURA ,"$3,666,601.00",,
1138,REND ,2401EG0028,25-11-2024,27-11-2024,27-11-2024,COMITE DE AVES CAMPESINAS JUNTAS VOLAREMOS MAYULERMO ,GUARDERIA DE POLLITOS ,"$2,413,500.00",,
1139,REND ,2401C0152,25-11-2024,27-11-2024,27-11-2024,COMITE CAMPESINO LA ESPERANZA DE SAN IGNACIO ,"EXPO SAN IGNACIO, AGRICULTURA FAMILIAR CAMPESINA ","$2,442,940.00",,
1140,REND ,2401M0029,22-11-2024,27-11-2024,27-11-2024,JUNTA DE VECINOS LARQUI CHICO ,LARQUI CHICO CUIDA SU ENTORNO ,"$2,932,000.00",,
1141,REND ,2401M0022,15-11-2024,27-11-2024,27-11-2024,JUNTA DE VECINOS SAN PEDRO ,POR UN SAN PEDRO MAS LIMPIO ,"$1,910,100.00",,
1142,REND ,2401M0056,21-11-2024,27-11-2024,27-11-2024,JUNTA DE VECINOS SAN IGNACIO DE LOYOLA ,SAN IGNACIO RECUPERA SUS AREAS VERDES ,"$2,861,860.00",,
1143,REND ,2401M0018,13-11-2024,27-11-2024,27-11-2024,JUNTA DE VECINOS SAN SEBASTIAN SAN ANTONIO ,SAN ANTONIO SE HACE CARGO DE SUS RESIDUOS ,"$2,728,835.00",,
1144,REND ,2401C0143,25-11-2024,27-11-2024,27-11-2024,MOVIMIENTO SOCIAL EN DEFENSA DEL RIO ÑUBLE ,TALLERES Y REENCUENTRO DE CULTURAMBIENTAL ,"$2,500,000.00",,
1145,REND ,2401SC0565,27-11-2024,27-11-2024,27-11-2024,JJ.VV VALLE TEMPLADO ,CONTINUEMOS DURMIENDO TRANQUILOS JUNTO A NUESTRAS ALARMAS COMUNITARIAS EN NUESTRO VALLE TEMPLADO YUNGAY ,"$4,000,000.00",,
1146,REND ,2401ADNCD04,27-11-2024,27-11-2024,27-11-2024,ASOCIACION DE TENIS DE MESA CHILLAN ,DEPORTISTAS PARALIMPICAS EN EVENTOS INTERNACIONALES DE TENIS DE MESA 2023,"$600,000.00",,
1147,REND ,2401SC0343,27-11-2024,27-11-2024,27-11-2024,JUNTA DE VECINOS N°2 LOS RISCOS ,LOS RISCOS ACTUA CONTRA LOS INCENDIOS ,"$2,636,050.00",,
1148,REND ,2401AM0059,27-11-2024,27-11-2024,27-11-2024,CLUB DE ADULTO MAYOR LOS VIEJOS ESTANDARTES DE EL ESPINAL ,YOGA PARA MEJORAR LA SALUD Y BIENESTAR DE LAS SOCIAS Y SOCIOS DEL CLUB DE ADULTO MAYOR LOS VIEJOS ESTANDARTES ,"$1,697,500.00",,
1149,REND ,2401AM0091,24-11-2024,27-11-2024,27-11-2024,CLUB DE ADULTO MAYOR NUEVA ESPERANZA DE LIUQUILEMU ,LAS SOCIAS Y SOCIOS DEL CLUB DE ADULTO MAYOR NUEVA ESPERANZA DE TIUQUILEMU CONOCEMOS NUESTRO PATRIMONIO Y CULTURA RECORRIENDO LOTA,"$1,953,000.00",,
1150,REND ,2401EG0128,24-11-2024,27-11-2024,27-11-2024,MESA DE LA MUJER CAMPESINA ,MUJERES CAMPESINAS CAPACITADAS ,"$2,309,700.00",,
1151,REND ,2401AM0275,24-11-2024,27-11-2024,27-11-2024,UNION COMUNAL DEL ADULTO MAYOR DE ÑIQUEN ,LA UCAM DE ÑIQUEN A COLCHAGUA ,"$1,964,000.00",,
1152,REND ,2401C0202,24-11-2024,27-11-2024,27-11-2024,COMITE MERCADO CAMPESINO N°1 DE ÑIQUEN ,TALLER DE CULTURA GASTRONOMICA TIPICA CHILENA CON EL GORE DE ÑUBLE,"$1,841,290.00",,
1153,REND ,2401EG0010,11-11-2024,27-11-2024,27-11-2024,AGRUPACION DE MUJERES LAS FRUTILLAS DE LA GLORIA ,"FRUTILLITAS TEJEDORAS, BORDAMOS NUESTROS SUEÑOS ","$1,929,190.00",,
1154,REND ,2401AM0218,24-11-2024,27-11-2024,27-11-2024,CLUB DE ADULTO MAYOR LAS ENCINAS DE LLAHUIMAVIDA ,LAS ENCINAS DE LLAHUIMAVIDA REALIZAN UN VIAJE TERAPEUTICO ,"$1,698,000.00",,
1155,REND ,2401AM0205,24-11-2024,27-11-2024,27-11-2024,CLUB DE ADULTO MAYOR EL SOL DE EL MODELO ,VIAJE TERAPEUTICO DE EL SOL DEL MODELO ,"$1,597,000.00",,
1156,REND ,2401AM0279,24-11-2024,27-11-2024,27-11-2024,CONJUNTO FOLCLORICO VOCES DE ÑIQUEN ,VIAJE TERAPEUTICO CON VOCES DE ÑIQUEN ,"$1,176,400.00",,
1157,REND ,24010085,27-11-2024,27-11-2024,27-11-2024,CLUB DE ADULTO MAYOR LA AMISTAD,RUTA PATRIMONIAL Y CULTURAL A TOME Y SUS ALREDEDORES ,"$2,006,935.00",,
1158,REND ,2401M0110,26-11-2024,27-11-2024,27-11-2024,JUNTA DE VECINOS SANTA MARGARITA ,EN SANTA MARGARITA CUIDAMOS EL MEDIO AMBIENTE ,"$2,445,072.00",,
1159,REND ,2401M0125,27-11-2024,27-11-2024,27-11-2024,JUNTA DE VECINOS LOS LAURELES ,PUEBLO PINTO SUSTENTABLE ,"$1,134,100.00",,
1160,REND ,2401EG0139,27-11-2024,27-11-2024,27-11-2024,AGRUPACION ACHAWALL ,ENTRELAZANDO SUEÑOS ,"$2,674,300.00",,
1161,REND ,2401EG0058,27-11-2024,27-11-2024,27-11-2024,JUNTA DE VECINOS BOCA ITATA LA PLAYA ,SABOR Y EQUIDAD: REPOSTERIA PARA BOCA ITATA ,"$2,717,351.00",,
1162,REND ,2401D0074,27-11-2024,27-11-2024,27-11-2024,JUNTA DE VECINOS HUENUTIL CENTRO,BIENESTAR Y VIDA SALUDABLE MEDIANTE EL YOGA ,"$1,629,990.00",,
1163,REND ,2401M0098,27-11-2024,27-11-2024,27-11-2024,JUNTA DE VECINOS VILLA EL SOL SAN MIGUEL DE DIGUILLIN ,VILLA EL SOL CUIDA SU ENTORNO ,"$2,839,000.00",,
1164,REND ,2401M0130,27-11-2024,27-11-2024,27-11-2024,JUNTA DE VECINOS LA UNION DE SAN MIGUEL ,VILLA UNION CUIDANDO NUESTRO ENTORNO JUNTOS ,"$2,888,450.00",,
1165,REND ,2401C0200,27-11-2024,27-11-2024,27-11-2024,CLUB DEPORTIVO SOCIAL Y CULTURAL GRUPO ECUESTRE CAMPESINO SAN MIGUEL ,"ENCUENTRO ENTRE RIENDAS, CUTURA ENCUESTRE ","$2,500,000.00",,
1166,REND ,2401AM0017,27-11-2024,27-11-2024,27-11-2024,CLUB DE ADULTO MAYOR NUESTRA PRIMAVERA ,VIAJE CULTURAL Y RECREATIVO A LA QUINTA REGION ,"$2,000,000.00",,
1167,REND ,2401AM0204,27-11-2024,27-11-2024,27-11-2024,CLUB DE ADULTO MAYOR SAN PEDRO NOLASCO ,HISTORIA Y PATRIMONIO DE NUESTRO SUR DE CHILE ,"$1,945,601.00",,
1168,REND ,2401M0103,26-11-2024,27-11-2024,27-11-2024,CENTRO DE PADRES Y APODERADOS ESCUELA DE LENGUAJE PINARES ,CREANDO CONCIENCIA EN EL BUEN USO DE LA ENERGIA EN NIÑOS Y NIÑAS ,"$3,000,000.00",,
1169,REND ,2401M0121,25-11-2024,27-11-2024,27-11-2024,COMITE DE ADELANTO CAMPESINO LA UNION ,ILUMINACION RURAL DE PRECORDILLERA RANCHILLO ALTO POR LA ILUMINACION ,"$3,000,000.00",,
1170,REND ,2401M0073,26-11-2024,27-11-2024,28-11-2024,RED DE TURISMO YUNGAY ,"HUELLA VERDE, RECICLAJE PARA EL TURISMO ","$3,000,000.00",,
1171,REND ,2401SC0544,26-11-2024,27-11-2024,28-11-2024,COMITE VILLA PAJARITO ,"VILLA SEGURA, YUNGAY SEGURO ","$4,000,000.00",,
1172,REND ,2401M0095,27-11-2024,27-11-2024,28-11-2024,JUNTA DE VECINOS LAGUNA BLANCA,"LAGUNA BLANCA REDUCE SUS RESIDUOS, PROYECTO DE MEDIOAMBIENTE SECTOR URBANO DE YUNGAY ","$3,000,000.00",,
1173,REND ,2401M0141,25-11-2024,27-11-2024,28-11-2024,JUNTA DE VECINOS SAN MIGUEL DE ITATA ,ILUMINACION SOLAR PARA LOS VECINOS DE SAN MIGUEL DE ITATA ,"$3,000,000.00",,
1174,REND ,2401EG0144,26-11-2024,27-11-2024,27-11-2024,COMITE DE MUJERES CAMPESINAS DE HORTALIZAS AVES Y FRUTOS DE LA TIERRA DE CAMPANARIO ,CULTIVANDO CON SABIDURIA DE LA MUJER ,"$3,000,000.00",,
1175,REND ,2401M0127,26-11-2024,27-11-2024,28-11-2024,AGRUPACION LOS QUIJOTES ,HUERTO ESCOLAR AGROECOLOGICO VERDE EUREKA ,"$3,000,000.00",,
1176,REND ,2401M0123,25-11-2024,27-11-2024,28-11-2024,JUNTA DE VECINOS LOS MAYOS,LOS MAYOS ILUMINA LA NOCHE ,"$3,000,000.00",,
1177,REND ,2401M0091,26-11-2024,27-11-2024,28-11-2024,COMITE DE ADELANTO TRES RANCHOS ,"LA BASURA SE QUEDA EN EL CONTENEDOR, PROYECTO DE GESTION DE RESIDUOS EN TRES RANCHOS ","$3,000,000.00",,
1178,REND ,2401M0108,26-11-2024,27-11-2024,28-11-2024,AGRUPACION DE DEFENSA Y CONSERVACION DE LA FLORA Y FAUNA DE YUNGAY ,IMPLEMENTACION DE CULTIVOS HIDROPONICOS EN EL LICEO DE YUNGAY ,"$3,000,000.00",,
1179,REND ,2401M0113,26-11-2024,27-11-2024,28-11-2024,JUNTA DE VECINOS SANTA LUCIA BAJO ,SANTA LUCIA BAJO A FAVOR DE LAS ENERGIAS LIMPIAS ,"$3,000,000.00",,
1180,REND ,2401M0089,18-11-2024,27-11-2024,28-11-2024,JUNTA DE VECINOS LOS LAURELES ,LOS LAURELES SE EQUIPA CON ENERGIA RURAL Y RENOVABLE ,"$3,000,000.00",,
1181,REND ,2401C0030,27-11-2024,27-11-2024,28-11-2024,CENTRO DE PADRES Y APODERADOS LICEO MANUEL JESUS ORTIZ ,"FESTIVAL ""VOCES DE DIGUILLIN"" 2° VERSION ","$2,499,999.00",,
1182,REND ,2401SC0018,28-11-2024,27-11-2024,28-11-2024,JUNTA DE VECINOS NAVIDAD ,NAVIDAD CONTRA LOS INCENDIOS ,"$3,743,325.00",,
1183,REND ,2401M0101,27-11-2024,27-11-2024,28-11-2024,JUNTA DE VECINOS ARTURO CARRASCO ,"NO MAS BOLSAS ROTAS, CONTENEDORES A LA VISTA ","$2,331,000.00",,
1184,REND ,2401M0138,26-11-2024,27-11-2024,28-11-2024,UNION COMUNAL DE CENTRO DE MADRES Y APODERADOS DE PEMUCO ,PEMUCO: VALORANDO Y CUIDANDO EL MEDIO AMBIENTE ,"$2,031,570.00",,
1185,REND ,2401EG0036,22-11-2024,27-11-2024,28-11-2024,CENTRO DE MADRES LAS MARIANITAS ,NUEVAS EXPERIENCIAS EN PUNTADAS ,"$2,838,608.00",,
1186,REND ,2401EG0021,25-11-2024,27-11-2024,28-11-2024,CENTRO DE MADRES RENACER DE PEMUCO,PERFECCIONANDONOS EN TALABARTERIA ,"$2,985,242.00",,
1187,REND ,2401M0034,27-11-2024,27-11-2024,28-11-2024,JUNTA DE VECINOS HUALTE ,CAMPOS VERDES SIN PLASTICOS ,"$2,087,049.00",,
1188,REND ,2401C0065,29-10-2024,27-11-2024,28-11-2024,ASOCIACION CULTURAL DE CARRUAJES BICENTENARIO ,CIRCULO CULTURAL ANIVERSARIO DE CARRUAJES BICENTENARIOS ,"$3,448,100.00",,
1189,REND ,2401M0015,20-11-2024,27-11-2024,28-11-2024,COMITE PRODUCTIVO DE ELABORADORAS DE QUESILLO ,APRENDIENDO A HACER USO EFICIENTE DE NUESTROS PREDIOS ,"$2,966,200.00",,
1190,REND ,2401M0002,26-11-2024,27-11-2024,28-11-2024,COMITE CAMPESINO DADINCO ,"VIDA MAS SALUDABLE, CON FERTILIZANTES NATURALES ","$2,877,600.00",,
1191,REND ,2401C0018,10-10-2024,27-11-2024,28-11-2024,COMITE COORDINADOR CAMPESINO COMUNAL SAN NICOLAS ,COCINANDO EL PAVO DE CAMPO ,"$3,498,000.00",,
1192,REND ,2401C0036,30-10-2024,27-11-2024,28-11-2024,COMITE CAMPESINO ESMERALDA DE LONQUEN ,RESCATANDO LS SEMILLAS ANCESTRALES ,"$3,480,000.00",,
1193,REND ,24010007,25-10-2024,27-11-2024,28-11-2024,COMITE CAMPESINO EL ALMENDRO ,PRODUCIMOS NUESTRAS HORTALIZAS CON NUESTROS FERTILIZANTES NATURALES ,"$2,987,000.00",,
1194,REND ,2401AM0129,28-11-2024,28-11-2024,28-11-2024,CENTRO CULTURAL DE ADULTO MAYOR UNA MIRADA DIFERENTE ,SEMBRANDO EL BIENESTAR FISICO-OGNITIVO ENTRE NUESTROS SOCIOS ,"$1,722,000.00",,
1195,REND ,2401AM0122,28-11-2024,28-11-2024,28-11-2024,GRUPO ADULTO MAYOR SANTA ISABEL CHAMIZAL ,ENVEJECIMIENTO ACTIVO DESDE LA SALUD Y EL AUTOCUIDADO,"$1,665,620.00",,
1196,REND ,2401AM0120,28-11-2024,28-11-2024,28-11-2024,CLUB DE ADULTO MAYOR LAS ARAÑITAS LABORIOSAS ,UNA ARAÑITA EN ACCION UN MURAL EN CONSTRUCCION ,"$2,000,000.00",,
1197,REND ,2401SC0614,27-11-2024,28-11-2024,28-11-2024,JUNTA DE VECINOS MAULE ,PREVENCION DOMICILIARIA EN INCENDIOS FORESTALES Y DOMICILIARIOS ,"$2,593,750.00",,
1198,REND ,2401AM0155,28-11-2024,28-11-2024,28-11-2024,CLUB DE ADULTO MAYOR VALLE VERDE CACHAPOAL ,SABIDURIA INTERCAMBIADA: TEJIENDO LAZOS CULTURALES EN QUILLON ,"$1,810,000.00",,
1199,REND ,2401C0059,28-11-2024,28-11-2024,28-11-2024,JUNTA DE VECINOS SECTOR LOS AROMOS ,MAS CULTURA PARA LOS VECINOS DE MONTELEON ,"$2,500,000.00",,
1200,REND ,2401AM0104,28-11-2024,28-11-2024,28-11-2024,CLUB DE ADULTO MAYOR PROFESORES EN RECREO ,"CUANDO EL CAMINAR SE HACE LENTO, SEGUIMOS CULTURIZANDONOS ","$2,000,000.00",,
