501,REND,2301EG0042,15/05/2024,17/05/2024,20/05/2024,MESA DE LA MUJER CAMPESINAS DE ÑIQUEN ,MUJERES CAMPESINAS DE ÑIQUEN AUTONOMAS,$0.00,,
502,REND,2301SP0435,16/05/2024,16/05/2024,20/05/2024,CORPORACION NACIONAL FORESTAL ,"ENTRE TODOS Y TODAS, PREVENIMOS LOS INCENDIOS FORESTALES EN ÑUBLE",$0.00,,
503,REND,2301S0092,15/05/2024,17/05/2024,20/05/2024,CLUB DE LEONES CHILLAN,"ADQUISICION DE EQUIPAMIENTO, MATERIALES E INSUMOS PARA ACTIVIDADES DE PREVENCION DE DIABETES Y MEDICION DE PRESION OCULAR A POBLACION VULNERABLE DE LA COMUNA DE CHILLAN Y ALREDEDORES","$3,000,000.00",,
504,REND,2301C0059,17/05/2024,17/05/2024,20/05/2024,AGRUPACION CULTURAL CIRCULO LITERARIO DE COELEMU,POESIAS Y ENCANTOS DE COELEMU,$0.00,,
505,REND,2301C004,17/05/2024,17/05/2024,20/05/2024,AGRUPACION SOCIOCULTURAL DE EMPRENDEDORAS Y FERIANTES DE SAN MIGUEL ,FERIA MULTICULTURAL Y NOCHE RANCHERA ,$0.00,,
506,REND,2301SP0152,17/05/2024,20/05/2024,20/05/2024,JUNTA DE VECINOS LOS COPIHUES,LOS COPIHUES MAS SEGURO,"$4,500,000.00",,
507,REND,2301EG0076,20/05/2024,20/05/2024,20/05/2024,COMITE DE DESARROLLO DE LA MUJER LAS EMPRENDEDORAS,BORDANDO NUESTROS SUEÑOS,$0.00,,
508,REND,2301C0183,03/05/2024,17/05/2024,20/05/2024,CONJUNTO FOLCLORICO PILLMAIKEN DE CHILLAN,ENCUENTRO INTERREGIONAL DE CANTOS Y DANZAS TRADICIONALES,"$3,489,491.00",,
509,REND,2301D0129,01/05/2024,08/05/2024,17/05/2024,CLUB DEPORTIVO SANTA AMELIA,CAMPEONATO 2023.,$0.00,,
510,REND ,2301CO138,20/05/2024,20/05/2024,20/05/2024,CLUB DE HUASOS SANTA RITA,CABALGATA DE LA FE ,$0.00,,
511,REND,2301AM0024,20/05/2024,20/05/2024,20/05/2024,CLUB ADULTO MAYOR MARIA DE LA MERCED,CANTOS Y DANZAS CON EL ADULTO MAYOR ,$0.00,,
512,SUBS,2301EG0106,20/05/2024,20/05/2024,20/05/2024,JUNTA DE VECINOS LA PAMPA,MI HUERTA A LA MESA,$0.00,,
513,REND,2301D0191,20/05/2024,20/05/2024,20/05/2024,CLUB DEPORTIVO Y CULTURAL AMANERCER DE MONTAÑA ,CAMINANDO CON AMANECER DE MONTAÑA Y GORE ÑUBLE,$0.00,,
514,REND,2301AM0006,17/05/2024,17/05/2024,20/05/2024,CLUB DE ADULTO MAYOR SOL Y LUNA ,PREVENCION TEMPRANA EN LA AUDICION DEL ADULTO MAYOR,$0.00,,
515,REND,2301C0069,17/05/2024,17/05/2024,20/05/2024,JUNTA DE VECINOS MEIPO,SEGUNDA VERSION FIESTA DEL LIMON MEIPO Y PANGUE,"$2,500,000.00",,
516,REND,2301SP0569,13/05/2024,22/05/2024,22/05/2024,AMIGOS SEGUNDA CB COELEMU,COELEMU SE PREPARA PARA COMBATIR LOS INCENDIOS FORESTALES,"$3,927,040.00",,
517,REND,2301SP0569,20/05/2024,20/05/2024,22/05/2024,AMIGOS SEGUNDA CB COELEMU,COELEMU SE PREPARA PARA COMBATIR LOS INCENDIOS FORESTALES,"$3,927,040.00",,
518,REND,2301EG0045,22/05/2024,22/05/2024,22/05/2024,ORGANIZACION DE MUJERES LAS FRUTILLITAS DE LA GLORIA/ÑIQUEN,FRUTILLITAS AUTONOMAS,$0.00,,
519,REND,2301AM0117,22/05/2024,22/05/2024,22/05/2024,CLUB DEL ADULTO MAYOR QUELTEHUE,EMOCIONES POSITIVAS EN EL ADULTO MAYOR,,,
520,REND,2301S0064,16/05/2024,22/05/2024,22/05/2024,JUNTA DE VECINOS ORTIZ DE ROZAS QUIRIHUE ,--,,,
521,REND,1901SA0316,22/05/2024,22/05/2024,23/05/2024,CLUB DE ADULTO MAYOR LOS PLACERES ,"MENTE, CUERPO Y ESPIRITU SANO A TRAVES DEL YOGA PARA ADULTOS MAYORES ","$80,015.00",,
522,REND,2301AM0142,16/05/2024,22/05/2024,23/05/2024,CLUB ADULTOR MAYOR LOS COPIHUES ,TRAVESIA DE LA HISTORIA Y RECREACION,"$1,419,955.00",,
523,REND,2301AM0142,16/05/2024,22/05/2024,23/05/2024,CLUB ADULTOR MAYOR LOS COPIHUES ,TRAVESIA DE LA HISTORIA Y RECREACION,"$1,419,955.00",,
524,REND ,2301AM0129,16/05/2024,22/05/2024,23/05/2024,UCAM PINTO ,VIAJANDO DE CORDILLERA A MAR ,"$1,400,000.00",,
525,REND ,2301EG0058,17/05/2024,22/05/2024,23/05/2024,UNIVERSIDAD ADVENTISTA DE CHILE,INCLUSION FINANCIERA PARA EL EMPODERAMIENTO Y AUTONOMIA DE EMPRENDEDORAS MUJERES JEFAS DE HOGAR DE TREHUACO ,"$5,805,790.00",,
526,REND ,2301AM0077,MAYO--2024,23/05/2024,23/05/2024,CLUB ADULTO MAYOR MARAVILLAS DE VIVIR ,SUEÑOS CONFECCIONADOS CON CARIÑO ,$0.00,,
527,REND ,2301AM156,MAYO ,23/05/2024,23/05/2024,UNION COMUNAL DE ADULTOS MAYORES DE COELEMU ,NOS ENCONTRAMOS TODOS JUNTOS ENTORNO A LA COSTURA ,"$1,750,000.00",,
528,REND ,2301S0067,MAYO ,23/05/2024,23/05/2024,JUNTA DE VECINOS ALTO PERALES ,RECUPERANDO LA CONVIVENCIA SIN VIOLENCIA ,"$2,889,960.00",,
529,REND ,2301C0112,06/05/2024,23/05/2024,23/05/2024,JUNTA DE VECINOS SAN BERNARDO,SEGUNDA FIESTA COSTUMBRISTA DEL CORDERO SAN BERNARDINO ,,,
530,REND,2301C0066,23/05/2024,23/05/2024,23/05/2024,CELEBRACION DIA DEL HUASO,CLUB DE HUASOS DADINCO,"$2,500,001.00",,
531,REND ,2301EG0027,S/F,24/05/2024,24/05/2024,,,,,
532,REND ,2201D0030,22/05/2024,24/05/2024,24/05/2024,CLUB DE ADULTO MAYOR EL BIENESTAR DE LONQUEN,TALLER DE ACONDICIONAMIENTO FISICO ,$0.00,,
533,REND ,2301EG0089,24/05/2024,24/05/2024,24/05/2024,CENTRO DE MADRES BRISAS DEL MAR DE PUAHUN,FORTALECIENDO LA AUTONOMIA DE NUESTRAS SOCIAS ,$0.00,,
534,REND ,2301EG0110,24/05/2024,24/05/2024,24/05/2024,UNION COMUNAL DE MUJERES LAUTARO,"TEJIENDO SUEÑOS, CAPACITACION, PRODUCCION Y PARTICIPACION EN FERIAS",$0.00,,
535,REND ,2301SP0496,10/05/2024,23/05/2024,24/05/2024,JUNTA DE VECINOS SARGENTO ALDEA,UN BARRIO LIMPIO PARA LOS VECINOS,"$4,346,673.00",,
536,REND ,2301AM0107,S/F,23/05/2024,24/05/2024,CLUB DE TERCERA EDAD NUEVA VIDA ,FORTALECIENDO MIS HABILIDADES COGNITIVAS Y MOTRICES CON TERAPIA CULINARIA ,"$504,000.00",,
537,REND,2301AM0099,23/05/2024,24/05/2024,24/05/2024,COMITE DEL ADULTO MAYOR NUEVA VIDA SAN GREGORIO ,YOGA PARA MEJORAR LA SALUD Y BIENESTAR DE LAS SOCIAS Y SOCIOS DEL COMITE DEL ADULTO MAYOR NUEVA VIDA SAN GREGORIO,$0.00,,
538,REND,2301C0180,24/05/2024,24/05/2024,24/05/2024,CENTRO CULTURAL AMIGOS DE LA ORQUESTA SAGRADO CORAZON ,"MUSICA QUE ABRE CAMINOS. NUEVAS METAS Y HORIZONTES PARA NIÑOS, JOVENES SANCARLINOS Y FORTALECIMIENTO DE LAZOS CON LA COMUNIDAD DE LAS OVEJAS, ARGENTINA, A TRAVES DE GIRA MUSICAL",$0.00,,
539,REND,2301SP0073,12/05/2024,24/05/2024,24/02/2024,JUNTA DE VECINOS 4-U MANUEL BULNES,MAYOR SEGURIDAD PARA LOS VECINOS,$0.00,,
540,REND,2301C0077,30/04/2024,24/05/2024,24/05/2024,CENTRO CULTURAL Y SOCIAL LONCONAO,ENCUENTRO DE BANDAS ESCOLARES DE LA REGION DE ÑUBLE,$0.00,,
541,REND ,2301AM0124,13/05/2024,24/05/2024,24/05/2024,CAM LA RIBERA DEL ITATA,EDUCACION NUTRICIONAL PARA CAM LA RIBERA DEL ITATA,$0.00,,
542,REND ,2301AM0020,20/05/2024,24/05/2024,24/05/2024,LA ALEGRIA DE EJERCITARNOS EN CAÑA DULCE,CAM LA ALEGRIA DE VIVIR EN CAÑA DULCE,,,
543,REND ,2301SO160,S/F,24/05/2024,24/05/2024,EL ESFUERZO DEL ARRAYAN ,SABORES SALUDABLES EL ARRAYAN,,,
544,REND ,2301EG0051,S/F,24/05/2024,24/05/2024,CLUB AUTOAYUDA ,CLUB AUTOAYUDA MUJERES BORDANDO ESPERANZA,$0.00,,
545,REND ,2301AM0028,23/05/2024,24/05/2024,27/05/2024,ASOCIACION DE PENSIONADOS DE TEMUCO,SUMANDO TALENTOS Y EXPERIENCIAS,,,
546,REND ,2301EG0048,27/03/2024,27/05/2024,27/05/2024,FERIA CAMPESINA EL ESFUERZO,EL ESFUERZO SE EMBELLECE ,$0.00,,
547,REND ,2301EG0069,28/05/2024,27/05/2024,27/05/2024,FUNDACION CRECER EN EQUIDAD,CUIDANDO AL QUE CUIDA,$0.00,,
548,REND ,2301AM0041,24/05/2024,27/05/2024,27/05/2024,CLUB DE ADULTO MAYOR LA ERA ENCANTADA,ENVEJECIMNIENTO ACTIVO DE PERSONAS MAYORES DEL CLUB DE ADULTO MAYOR LA ERA ENCANTADA DE LA LOCALIDAD DE PULLAY DE LA COMUNA DE COBQUECURA,$0.00,,
549,REND ,2301EG0049,27/05/2024,27/05/2024,27/05/2024,CENTRO DE MADRES LAS HORMIGUITAS DE EL SAUCE,MAS AUTONOMIA PARA LAS HORMIGUITAS DE EL SAUCE,$0.00,0,
550,REND ,2301EG0043,23/05/2024,27/05/2024,27/05/2024,COMITE FEMENINO SANTA TERESITA,ENTRE ENHEBRES Y REMIENDOS DISEÑAMOS EL FUTURO,$0.00,,
551,REND ,2301EG0105,23/05/2024,27/05/2024,27/05/2024,UNION COMUNAL DE ORGANIZACIONES FEMENINAS DE SAN FABIAN,TRENZANDO ANHELOS DE INNOVACION Y ESPERANZA,$0.00,,
552,REND ,2301EG0035,24/05/2024,27/05/2024,27/05/2021,AGRUPACION DE ARTESANOS EL PUELCHE,AL FRAGOR DEL PUELCHE,$0.00,,
553,REND ,2301EG0039,23/05/2024,27/05/2024,27/05/2024,COMITE FEMENINO EL MAITENAL,CONFECCIONANDO DESEOS DE MUJERES EMPODERADAS,$0.00,,
554,REND ,2301EG0038,24/05/2024,27/05/2024,27/05/2024,COMITE FEMENINO LAS CATITAS,AL COMPAS DE LAS COSTURAS... ENFRENTAMOS EL MAÑANA,$0.00,,
555,REND ,2301AM0091,24/05/2024,27/05/2024,27/05/2024,CENTRO DE ADULTO MAYOR EL GRUPO DE LA AMISTAD,ALEGRIA DE REUNIRNOS,"$1,898,341.00",,
556,REND ,2301EG0036,27/05/2024,27/05/2024,27/05/2024,CENTRO DE MADRES 27 DE ABRIL,CREANDO NUEVAS IDEAS,"$2,832,528.00",,
557,REND ,2301S0045,MAYO,27/05/2024,27/05/2024,CLUB DE PERSONAS MAYORES VOLVER A NACER,NUESTROS TALENTOS VUELVEN A NACER,$0.00,,
558,REND ,2301M0060,24/05/2024,27/05/2024,27/05/2024,CENTRO DE PADRES Y APODERADOS JARDIN EL TRIGAL ,GUARDIANES DE LA NATURALEZA,"$2,835,001.00",,
559,REND ,2301AM0065,29/04/2024,27/05/2024,27/05/2024,UNION COMUNAL DE ADULTO MAYOR EL ULTIMO RECREO SAN IGNACIO ,ATENCION PODOLOGICA PARA PERSONAS MAYORES,"$2,000,000.00",,
560,REND,2301EG0035,24/05/2024,27/05/2024,27/05/2024,ALDEAS INFANTILES SOS CHILE,EDUCACION FINANCIERA PARA MUJERES EMPRENDEDORAS,"$5,990,050.00",,
561,REND ,2201M0055,03/05/2024,27/05/2024,28/05/2024,JUNTA DE VECINOS CARRULLANCA,EN CARRULLANCA CONTRIBUIMOS CON EL MEDIO AMBIENTE,$0.00,,
562,REND,2301C0078,23/05/2024,27/05/2024,28/05/2024,COMITE COORDINADOR CAMPESINO DE PORTEZUELO,TRECEAVA VERSION DEL ENCUENTRO CON EL MUNDO RURAL DE PORTEZUELO,$0.00,,
563,REND ,2301EG0098,24/05/2024,27/05/2024,28/05/2024,UNION COMUNAL DE ORGANIZACIONES DE MUJERES DE PORTEZUELO,MUJERES EN CAMINO A LA CONFECCION DE LANA,$0.00,,
564,REND,2301D0239,22/05/2024,28/05/2024,28/05/2024,LA LIGA DEPORTIVA FEMENINA DE EL CARMEN ORGANIZA CAMPEONATO OFICIAL DE FUTBOL A NIVEL COMPETITIVO 2023,LIGA DEPORTIVA FEMENINA DE EL CARMEN,$0.00,,
565,REND ,2301SP0192,27/05/2024,28/05/2024,28/05/2024,JJVV VILLA VIRGEN DEL CAMINO,SEGURIDAD VECINAL EN LA VIRGEN DEL CAMINO,$0.00,,
566,REND ,2301AM0079,S/F,28/05/2024,28/05/2024,CLUB DE ADULTO MAYOR ARMONIA DE ÑIQUEN ESTACION,GENERANDO CONCIENCIA DE MI SALUD CARDIOVASCULAR A TRAVES DE LA ALIMENCION EN SOCIOS Y FAMILIA DEL CLUIB DE ADULTO MAYOR ARMONIA DE ÑIQUEN ESTACION ,$0.00,,
567,REND ,2301SP0050,28/05/2024,28/05/2024,28/05/2024,JUNTA DE VECINOS N°2 PASO EL ROBLE,CHILLANCITO CONTRA INCENDIOS,$0.00,,
568,REND ,2301D0097,27/05/2024,29/05/2024,30/05/2024,CLUB DEPORTIVO CHACAY,ESCUELA DE FUTBOL 2023 CLUB DEPORTIVO CHACAY,$0.00,,
569,REND ,2301AM0189,27/05/2024,30/05/2024,30/05/2024,CLUB DE ADULTO MAYOR LOS AÑOS DORADOS DE COELEMU,MULTITALLERES MIS AÑOS DORADOS EN RANGUELMO,$0.00,,
570,REND ,2301AM0207,27/05/2024,30/05/2024,30/05/2024,CLUB DE ADULTO MAYOR LOS AÑOS HERMOSOS,CREANDO EN MIS AÑOS HERMOSOS,$0.00,,
571,REND ,2301EG0072,29/05/2024,30/05/2024,30/05/2024,ASOCIACION INDIGENA WENGAMEN,BORDANDO SIMBOLOS ANCESTRALES ,$0.00,,
572,REND ,2301EG0015,30/05/2024,30/05/2024,30/05/2024,FERIA CAMPESINA LAS GOLONDRINAS,MUJERES RURALES TEJIENDO SUEÑO,$0.00,,
573,REND ,2301EG0075,30/05/2024,30/05/2024,30/05/2024,COMITE DE DAMAS RENE SCHNEIDER,CONSTRUYENDO SUEÑOS EN VELLON,$0.00,,
574,REND,23011ADNCC011,30/05/2024,30/05/2024,30/05/2024,CORPORACION CULTURAL Y SOCIAL ARTE Y VIDA DE COELEMU,LA CULTURA VIVE EN TU BARRIO,$0.00,,
575,REND,2301EG0007,29/05/2024,30/05/2024,30/05/2024,COMITE CAMPESINO LA FERIA,MUJER CAMPESINA Y EL ARTE DE LA COSTURA,$0.00,,
576,REND,2301AM0119,30/05/2024,30/05/2024,31/05/2024,COMITE DEL ADULTO MAYOR BUENA UNION DE HUACALEMU,FORTALECIENDO LAS FUNCIONES COGNITIVAS MEJORAMOS LA CALIDAD DE VIDA DE LAS PERSONAS MAYORES,$0.00,,
577,SUBS,2301AM0018,31/05/2024,31/05/2024,31/05/2024,CLUB DE ADULTO MAYOR ANGEL HERNANDEZ RINCONADA DE CATO.,APOYO ALIMENTARIO PARA EL ADULTO MAYOR.,$1.941.910,,
578,SUBS,2301M0020,30/05/2024,31/05/2024,31/05/2024,JJ.VV. LA ORILLA,NUESTRA ORILLA MAS LIMPIA,$2.946.270,,
579,REND,2301G0065,29/05/2024,31/05/2024,31/05/2024,COMITÉ DE MUJERES SEMILLAS DE MECO,PINTANDO NUESTRA AUTONOMÍA.,$0.00,,
580,REND,2301EG0064,S/F,31/05/2024,31/05/2024,SINDICATO MONTE BLANCO.,POTENCIANDO AUTONOMÍA MUJERES EMPRENDEDORAS RESCATE LANA DE OVEJA.,$2.875.110,,
581,REND,2301SP0062,S/F,31/05/2024,31/05/2024,COMITÉ DE ADELANTO Y DESARROLLO SAN MATÍAS,SIN NOMBRE DE INICIATIVA.,$0.00,,
582,REND,2301SP0560,30/05/2024,31/05/2024,31/05/2024,JJ.VV. VILLA LAS PALEMRAS.,VILLA LAS PALMERAS UN BARRIO SEGURO.,$4.490.179,,
583,REND,2301D0018,S/F,31/05/2024,31/05/2024,CLUB DEPORTIVO SOCIAL Y CULTURAL COMERCIO DE BULNES.,ESCUELA DE FUTBOL INCLUSIVA PARA NIÑOS 2023.,$2.886.829,,
584,REND,2101D0195,31/05/2024,31/05/2024,04/06/2024,CLUB DEPORTIVO SANTA LAURA.,SANTA LAURA SE REFUERZA PARA TORNEO DE FÚTBOL ALFUR 2023.,$440.00,,
585,REND,2301D0158,03/06/2024,03/06/2024,04/06/2024,ESCUELA DE FÚTBOL FUTUROS CRACKS.,,$845.25,,
586,REINT,2301SP0487,31/05/2024,03/06/2024,04/06/2024,JJ.VV. CANTARANA.,PREVENCIÓN Y SEGURIDAD EN MI HOGAR.,$6.70,,
587,CARTA,2301SP0062,03/06/2024,03/06/2024,04/06/2024,COMITÉ DE ADELANTO Y DESARROLLO SAN MATÍAS,SEGURIDAD Y PROTECCIÓN TAREA DE TODOS.,$0.00,,
588,SUBS,2301EG0009,31/05/2024,03/06/2024,04/06/2024,AGRUPACIÓN DE ADELANTO VUELTA LA RAMA.,CONFECCIONANDO SUEÑOS E ILUSIONES.,$0.00,,
589,REND,2301M0032,29/05/2024,03/06/2024,04/06/2024,AGRUPACIÓN DE MUJERES LAS MANZANITAS.,SEGUNDA VIDA DE TELAS.,$0.00,,
590,SUBS,2301EG0044,31/05/2024,03/06/2024,04/06/2024,AGRUPACIONES DE MUJERES CAMPESINAS LAS AZUCENAS DE LOS REMATES.,EMPRENDIMIENTO DE MUJERES DE QUIRIHUE.,$0.00,,
591,SUBS,2301EG0011,03/06/2024,03/06/2024,04/06/2024,CENTRO DE MADRES LAS MARIANITAS.,TEJIENDO COLORES.,$0.00,,
592,SUBS,2301EG0102,03/06/2024,03/06/2024,04/06/2024,CENTRO DE MADRES CAMARICO.,EMPRENDAMOS JUNTAS POR UN CAMARICO MEJOR.,$0.00,,
593,REND,2301M0053,31/05/2024,03/06/2024,04/06/2024,JJ.VV. TRES ESQUINAS DE CATO.,"CATO SE ORGANIZA, RECICLA Y PLANTA.",$33.79,,
594,ANEXO,2301M0056,03/06/2024,03/06/2024,04/06/2024,JJ.VV. LA PALMA.,DE LA BASURA AL COMPOST.,$960.00,,
595,REND,2301ADNC05,31/05/2024,03/06/2024,04/06/2024,CONJUNTO DE FOLCLOR PALOMAR DE CHILLÁN.,ITINERANCIA 40 AÑOS DE CANTO Y AMISTAD.,$7.215.001,,
596,REND,2301EG0108,03/06/2024,03/06/2024,04/06/2024,CENTRO DE MADRES ALEGRE DESPERTAR.,ESCULPIENDO REDES PARA UN FUTURO LIBRE DE VIOLENCIA: TALLER DE CERÁMICA PARA MUJERES DE CHILLANCITO.,$2.728.895,,
597,FORM,,04/06/2024,04/06/2024,04/06/2024,KARATE DO SHOTOKAN CRECEMOS.,CON EL KARATE CRECEMOS.,$2.985.000,,
598,REND,2301M0064,31/05/2024,04/06/2024,04/06/2024,JJ.VV. VEGAS DE NIBLINTO.,COIHUECO MAS VERDE PROGRAMA DE RECICLAJE.,$0.00,,
599,REND,2301D0193,04/06/2024,04/06/2024,04/06/2024,CLUB DEPORTIVO HUACAMALA.,PARTICIPACIÓN EN EL CAMPEONATO DE FÚTBOL QUILLÓN 2023.,$1.800.000,,
600,SUBS,2301EG0082,04/06/2024,04/06/2024,04/06/2024,AGRUPACIÓN DE MUJERES CAMPESINAS LA ESPERANZA.,MUJERES CAMPESINAS UNIDAS POR LA ESPERANZA.,$0.00,,
601,ANEXO,2301EG0114,04/06/2024,04/06/2024,04/06/2024,AGRUPACIÓN FEMENINA LOBA NEGRA,ENCUENTRO COMUNAL DE MUJERES INTERGENERACIONAL.,$2.994.918,,
602,REND,2301EG0012,04/06/2024,04/06/2024,04/06/2024,"AGRUPACIÓN SOCIAL, CULTURAL Y DEPORTIVA EL ESFUERZO FEMENINO QUIRIHUE.",TEJIENDO TELAR EN COMUNIDAD.,$49.50,,
603,REND,2301D0129,01/05/2024,04/06/2024,04/06/2024,CLUB DEPORTIVO SANTA AMELIA.,SANTA AMELIA CAMPEONATO 2023.,$0.00,,
604,REND,2301EG0093,04/06/2024,04/06/2024,05/06/2024,AGRUPACIÓN DE MUJERES SOLIDARIAS EL TORREÓN.,ESTRATEGIA PARA FORTALECER EL EMPRENDIMIENTO.,$1.01,,
605,SUBS,2301EG0119,04/06/2024,04/06/2024,05/06/2024,COMITÉ DE AVES CAMPESINAS LAS BUENAS PONEDORAS PIEDRAS MAULE.,INSTALACIÓN INVERNADERO PARA NUESTRO COMITÉ.,$0.00,,
606,REND,2301D0218,05/06/2024,05/06/2024,05/06/2024,CLUB DEPORTIVO RENACER.,PRIMERA ESCUELA FORMATIVA DE FÚTBOL CLUB DEPORTIVO RENACER.,$0.00,,
607,REND,2301D0065,05/06/2024,05/06/2024,05/06/2024,CLUB DEPORTIVO LA MONTAÑA.,CUADRANGULAR DE FÚTBOL DESDE LA MONTAÑA,$1.800.000,,
608,REND,2201SC0033,06/06/2024,06/06/2024,06/06/2024,JJ.VV. VILLA TRILALEO.,CÁMARAS DE VIGILANCIA VILLA TRILALEO.,$0.00,,
609,REND,2301EG0047,30/05/2024,06/06/2024,06/06/2024,COMITÉ FEMENINO SOL NACIENTE.,SOBRE RETAZOS Y TEXTURAS SE POSA EL SOL NACIENTE.,$0.00,,
610,SUBS,2301EG0058,07/06/2024,06/06/2024,06/06/2024,UNIVERSIDAD ADVENTISTA DE CHILE.,INCLUSIÓN FINANCIERA PARA EL EMPODERAMIENTO Y AUTONOMÍA DE EMPRENDEDORAS MUJERES JEFAS DE HOGAR DE TREHUACO.,$0.00,,
611,REND,2301EG0094,29/04/2024,06/06/2024,06/06/2024,ALDEAS INFANTILES SOS CHILE,EDUCACIÓN FINANCIERA PARA MUJERES EMPRENDEDORAS,$5.990.050,,
612,SUBS,2301AM0175,04/06/2024,07/06/2024,07/06/2024,CLUB DEL ADULTO MAYOR LOS VIEJOS ESTANDARTES DEL ESPINAL.,BIENESTAR Y VIDA SALUDABLE MEDIANTE EL YOGA PARA EL CLUB DE ADULTO MAYOR LOS VIEJOS ESTANDARTES DEL ESPINAL.,$0.00,,
613,SUBS,2301AM0150,30/05/2024,07/06/2024,07/06/2024,CLUB DEL ADULTO MAYOR LOS QUINCERAÑEROS DE MAITENES.,"RECORRIENDO NUESTRAS RUTAS PATRIMONIALES, LOS QUINCEAÑEROS DE MAITENES AMPLIAMOS NUESTROS CONOCIMIENTOS.",$0.00,,
614,REND,2301SP0178,07/06/2024,07/06/2024,07/06/2024,JJ.VV. ORIENTE N°9.,POR UN BARRIO MAS SEGURO.,$4.346.310,,
615,SUBS,2301ADNCC0177,06/06/2024,07/06/2024,07/06/2024,AGRUPACIÓN FOLKLORE Y CULTURA MAPUKETRAN.,MAPUKETRAN LE CANTA A ÑUBLE.,$2.900.000,,
616,SUBS,2301AM0118,07/06/2024,07/06/2024,07/06/2024,AGRUPACIÓN PROFESORES JUBILADOS VIDA NUEVA.,ENFERMEDADES CRÓNICAS ENFOQUE AUTOCUIDADO.,$0.00,,
617,REND,2301D0136,07/06/2024,07/06/2024,07/06/2024,CLUB DEPORTIVO AERÓBICAS LAS VENCEDORAS.,AL RITMO DE ZUMBA LAS VENCEDORAS MEJORAN SU CALIDAD DE VIDA.,$0.00,,
618,SUBS,2301AM0145,06/06/2024,07/06/2024,07/06/2024,CLUB DE ADULTO MAYOR SOL NACIENTE.,A CONOCER RÍOS Y MONTAÑAS VAMOS A SAN FABIÁN.,$0.00,,
619,SUBS,2301AM0030,07/06/2024,07/06/2024,07/06/2024,CLUB ADULTO MAYOR LOS MUCHACHOS DE AGOSTO.,APRENDIENDO ALFABETIZACIÓN DIGITAL CONOCEMOS EL CONGRESO.,$1.999.010,,
620,SUBS,2301AM0191,07/06/2024,07/06/2024,07/06/2024,FEDERACIÓN PROVINCIAL DE UNIONES COMUNALES DE ADULTOS MAYORES ÑUBLE.,AVANZANDO CON LIDERAZGO PARA SER UN BUEN DIRIGIENTE.,$1.974.718,,
621,SUBS,2301AM0084,07/06/2024,07/06/2024,07/06/2024,CLUB ADULTO MAYOR NUEVA PROYECCIÓN.,TRABAJANDO LA COMUNICACIÓN CONOCEMOS VALDIVIA.,$1.988.950,,
622,SUBS,2301D0093,07/06/2024,07/06/2024,07/06/2024,CLUB DEPORTIVO SAN LUIS.,ESCUELA DE FÚTBOL EN LOS VOLCANES.,$0.00,,
623,SUBS,2301AM0038,03/06/2024,07/06/2024,07/06/2024,CLUB DEPORTIVO DE ADULTO MAYOR LA ALEGRIA DE VIVIR.,ALEGRÍA DE VIVIR SANAMENTE.,$0.00,,
624,SUBS,2301EG0036,04/06/2024,07/06/2024,07/06/2024,CENTRO DE MADRES 27 DE ABRIL.,CREANDO NUEVAS IDEAS.,$0.00,,
625,REND,2301EG0030,07/06/2024,07/06/2024,07/06/2024,FUNDACIÓN CHILENA PARA LA DISCAPACIDAD.,PREVENCIÓN DE LA VIOLENCIA CONTRA MUJERES EM SITUACIÓN DE DISCAPACIDAD EN LA COMUNA DE QUILLÓN.,$4.353.711,,
626,SUBS,2301D0074,07/06/2024,07/06/2024,07/06/2024,CUERPO DE ÁRBITROS NUEVA IMAGEN DE CHILLÁN.,"ADQUISICIÓN DE INDUMENTARIA DEPORTIVA PARA DAR UNIFORMIDAD A LOS ASOCIADOS AL LLEGAR, DIRIGIR E IMPARTIR JUSTICIA EN LOS DIFERENTES TERRENOS DE JUEGO DE LA REGIÓN.",$0.00,,
627,REND,2301EG0044,07/06/2024,07/06/2024,10/06/2024,AGRUPACIÓN DE MUJERES CAMPESINAS LAS AZUCENAS DE LOS REMATES.,EMPRENDIMIENTO DE MUJERES DE QUIRIHUE.,$0.00,,
628,REND,2301EG0009,07/06/2024,07/06/2024,10/06/2024,AGRUPACIÓN DE ADELANTO VUELTA LA RAMA.,CONFECCIONANDO SUEÑOS E ILUSIONES.,$0.00,,
629,REND,2301D0163,23/04/2024,10/06/2024,10/06/2024,CLUB DE TENIS DE MESA UNIVERSIDAD DEL BIO BIO.,CAMPEONATO DE TENIS DE MESA FENAUDE 2023.,$1.800.002,,
630,SUBS,2301D0163,10/06/2024,10/06/2024,10/06/2024,CLUB DE TENIS DE MESA UNIVERSIDAD DEL BIO BIO.,CAMPEONATO DE TENIS DE MESA FENAUDE 2023.,$1.800.002,,
631,REND,2301D0268,24/04/2024,10/06/2024,10/06/2024,ASOCIACIÓN DE FUTBOL AMATEUR DE CHILLÁN.,ANFA + DEPORTE - VIOLENCIA.,$810.05,,
632,SUBS,2301D0201,10/06/2024,10/06/2024,10/06/2024,CLUB DEPORTIVO ATLANTA.,ESCUELA DE FUTBOL Y FORMACIÓN INICIAL CLUB DEPORTIVO ATLANTA.,$0.00,,
633,SUBS,2301D0009,09/06/2024,10/06/2024,10/06/2024,CLUB DEPORTIVO DRAGONES BLANCOS DE CHILLAN.,FOMENTANDO VIDA SALUDABLE DESDE LA NIÑEZ A TRAVES DEL TAEKWONDO.,$0.00,,
634,SUBS,2301AM0224,07/06/2024,10/06/2024,10/06/2024,CLUB DE ADULTO MAYOR SOR TERESA DE CALCUTA.,"ENVEJECIENDO ACTIVO ADE LAS PERSONAS MAYORES, JUNTO NOS CUIDAMOS Y EJERCITAMOS.",$212.66,,
635,SUBS,2301D0030,07/06/2024,10/06/2024,10/06/2024,CLUB CUMBRES SUR.,HOCKEY CESPED PARA TODOS.,$0.00,,
636,SUBS,2301D0030,07/06/2024,10/06/2024,10/06/2024,CLUB CUMBRES SUR.,HOCKEY CESPED PARA TODOS.,$0.00,,
637,REND,2301D0030,07/06/2024,10/06/2024,10/06/2024,CLUB CUMBRES SUR.,HOCKEY CESPED PARA TODOS.,$0.00,,
638,SUBS,2301D0030,07/06/2024,10/06/2024,10/06/2024,CLUB CUMBRES SUR.,HOCKEY CESPED PARA TODOS.,$0.00,,
639,REND,2301EG0115,23/05/2024,10/06/2024,10/06/2024,AGRUPACIÓN SOLIDARIA DE MUJERES.,"POTENCIANDO VALOREZ, ANTRELAZANDO DIVERSIDAD.",$963.81,,
640,SUBS,2301D0053,11/06/2024,10/06/2024,10/06/2024,CLUB ATLETICO TRES RUNNERS.,ESCUELA FORMATIVA DE RUNNING.,$0.00,,
641,SUBS,2301S0111,24/05/2024,10/06/2024,10/06/2024,TALLER LABORAL EMPRENDEDORAS DEL PORTAL.,TALLER DE REPOSTERIA FOMENTANDO LA PARTICIPACION EN LA COMUNIDAD.,$0.00,,
642,REND,2301D0115,11/06/2024,11/06/2024,11/06/2024,CLUB DE SURF OLAS ALTAS BUCHUPUREO.,SURF COMO ACTIVIDAD FISICA EN COBQUECURA.,$0.00,,
643,SUBS,2301D0058,10/06/2024,11/06/2024,11/06/2024,CONSEJO DE DESARROLLO LOCAL POSTA LOS REMATES.,MANTENTE EN MOVIMIENTO PARA MEJORAR TU SALUD.,$1.791.400,,
644,SUBS,2301D0087,11/06/2024,11/06/2024,11/06/2024,CLUB DEPORTIVO TRIATLÓN QUILLÓN.,PARTICIPACIÓN EN CAMPEONATO DE TRIATLÓN PUCÓN 2024.,$0.00,,
645,REND,2301D0253,07/06/2024,11/06/2024,11/06/2024,JUVENTUS FC DE COYANCO.,CUADRANGULAR DEMOSTRATIVO SERIE HONOR 40.,$0.00,,
646,SUBS,2301D0049,11/06/2024,11/06/2024,11/06/2024,CLUB DEPORTIVO ARTURO PRAT DE NINHUE.,ESCUELA DE FÚTBOL ARTURO PRAT 2023,$0.00,,
647,SUBS,2301D0219,10/06/2024,11/06/2024,11/06/2024,ESCUELA DE FÚTBOL LOS PUMAS DE YUNGAY.,TRABAJANDO POR LOS NIÑOS DE YUNGAY.,$2.996.002,,
648,REND,2301D0219,10/06/2024,11/06/2024,11/06/2024,ESCUELA DE FÚTBOL LOS PUMAS DE YUNGAY.,TRABAJANDO POR LOS NIÑOS DE YUNGAY.,$2.996.002,,
649,SUBS,2301D0250,07/06/2024,11/06/2024,11/06/2024,CLUB DEPORTIVO REAL BAQUEDANO.,JUNTOS SEGUIMOS CRECIENDO.,$0.00,,
650,SUBS,2301D0183,10/06/2024,12/06/2024,12/06/2024,CLUB DEPORTIVO NACIONAL DE CATO.,EL CLUB DE CATO PROMUEVE E INCENTIVA LA PARTICIPACIÓN EN EL CAMPEONATO DE FÚTBOL RURAL 2023.,$1.800.001,,
651,SUBS,2301D0295,10/06/2024,12/06/2024,12/06/2024,CONSEJO LOCAL DE DEPORTES DE CHILLÁN.,EL COLODEP CHILLÁN PROMUEVE Y FORTALECE LA ACTIVIDAD FÍSICA A TRAVÉS DE LA NATACIÓN.,$0.00,,
652,SUBS,2301D0078,12/06/2024,12/06/2024,12/06/2024,CLUB DE DEPORTES UNION.,"BUSCANDO ESPACIOS PARA QUE NUESTROS NIÑOS Y JÓVENES UNIONINOS, SE DESARROLLEN DE MANERA INTEGRAL EN UN AMBIENTE LIBRE DE ALCOHOL, DROGAS Y EN BASE A UNA BUENA ALIMENTACIÓN.",$0.00,,
653,SUBS,2301D0045,08/06/2024,12/06/2024,12/06/2024,CLUB DEPORTIVO LOS MAYOS.,IMPLEMENTANDO AL CLUB DEPORTIVO.,$1.800.000,,
654,SUBS,2301D0227,12/06/2024,12/06/2024,12/06/2024,"CLUB DEPORTIVO, SOCIAL, CULTURAL Y AMBIENTAL SANFITNESS.",SANFITNESS SE ACTIVA CON EL DEPORTE.,$1.970.445,,
655,REND,2301D0169,10/06/2024,12/06/2024,12/06/2024,CLUB DEPORTIVO SAN MIGUEL CENTRAL.,ESCUELA DE FÚTBOL SAN MIGUEL CENTRAL.,$0.00,,
656,SUBS,2301D0080,12/06/2024,12/06/2024,12/06/2024,CLUB DEPORTIVO EL ESFUERZO DE QUINQUEHUA.,EL ESFUERZO DE QUINQUEHUA POR EL FUTBOL SECANO 2023.,$0.00,,
657,REND,2301D0318,12/06/2024,12/06/2024,12/06/2024,CLUB DEPORTIVO ARTURO PRAT COELEMU.,ESCUELA DE FUTBOL FORMATIVO ARTURO PRAT.,$0.00,,
658,SUBS,2301D0128,12/06/2024,12/06/2024,12/06/2024,CLUB DEPORTIVO CULTURAL Y SOCIAL ANTÜ.,IMPLEMENTACIÓN DEPORTIVA PARA MEJORAR RESULTADOS.,$0.00,,
659,SUBS,2301D0120,10/06/2024,12/06/2024,12/06/2024,CLUB DEPORTIVO HERNAN BRAÑAS.,SEMBRANDO PORTUNIDADES II,$0.00,,
660,SUBS,2301D0208,12/06/2024,12/06/2024,12/06/2024,CLUB DEPORTIVO ESCOLAR INSAMACH.,COPA INSAMACH.,$0.00,,
661,SUBS,2301D0239,10/06/2024,12/06/2024,12/06/2024,LIGA DEPORTIVA FEMENINA DE EL CARMEN.,LA LIGA FEMENINA DE EL CARMEN ORGANIZA CAMPEONATO OFICIAL DE FUTBOL A NIVEL COMPETITIVO.,$0.00,,
662,SUBS,2301D0266,11/06/2024,12/06/2024,12/06/2024,CLUB DEPORTIVO QUIRIQUINA.,"ESCUELA DE FUTBOL CD QUIRIQUINA: CONTINUAMOS ENTREGANDO HERRAMIENTAS TECNICAS Y VALORICAS A NUESTROS JOVENES, NIÑOS/AS.",$0.00,,
663,REND,2301D0306,11/06/2024,12/06/2024,12/06/2024,CLUB DEPORTIVO EL CALVARIO.,ESCUELA FORMATIVA DE FUTBOL.,$2.900.000,,
664,REND,2301D0317,12/06/24,12/06/2024,12/06/2024,CLUB DEPORTIVO BALON MANO SAN CARLOS,ESCUELA DE MINIBALONMANO,$0.00,,
665,SUBS,2301D0107,12/06/2024,12/06/2024,12/06/2024,JUNTA DE VECINOS TALQUIPEN CENTRAL,TALLER DE BAILE ENTRETENIDO EN JUNTO DE VECINOS TALQUIPEN CENTRAL,"$109,990.00",,
666,SUBS,2301D0247,11/06/2024,12/06/2024,12/06/2024,CLUB DEPORTIVO UNION BERNARDO O´HIGGINS DE CAPILLA COX CHILLÁN.,EL CLUB DEPORTIVO CAPILLA COX COMPITE Y ENGRANDECE EL FUTBOL RURAL.,$1.792.000,,
667,SUBS,2301D0283,11/06/2024,12/06/2024,12/06/2024,CLUB DEPORTIVO DE RAYUELA SANTOS.,EL CLUB DE RAYUELA CONTINUA FOMENTANDO LA RAYUELA A NIVEL COMPETITIVO.,$0.00,,
668,SUBS,2301D0269,11/06/2024,12/06/2024,12/06/2024,ASOCIACION DEPORTIVA KARATE-DO CHILLAN.,LA ASOCIACION DE KARATE-DO FORMA CAMPEONES PARA ÑUBLE.,$0.00,,
669,SUBS,2301D0077,12/06/2024,13/06/2024,13/06/2024,CLUB DEPORTIVO UNIÓN JUVENTUD.,FOMENTANDO EL DEPORTE EN NUESTRA COMUNA.,$0.00,,
670,SUBS,2301D0186,06/06/2024,13/06/2024,13/06/2024,CLUB MAXIBASQUETBOL CHILLÁN,RUMBO AL NACIONAL DE MAXIBASQUETBOL PUERTO MONTT 2023,$0.00,,
671,SUBS,2301D0008,11/06/2024,13/06/2024,13/06/2024,CLUB DEPORTIVO AURA FITNESS.,ESCUELA FORMATIVA DE CROSSFIT AURA FITNESS.,$0.00,,
672,SUBS,2301D0092,13/06/2024,13/06/2024,13/06/2024,CLUB DE BASQUETBALL CHILLAN VIEJO.,PRIEMRA ESCUELA DE BASKETBALL PARA NIÑOS Y NIÑAS DEL CLUB DE BASKETBALL CHILLAN VIEJO.,$0.00,,
673,SUBS,2301D0063,12/06/2024,13/06/2024,13/06/2024,CLUB DEPORTIVO SAN MIGUEL.,CAMPEONATO CLAUSURA 2023 EN COIHUECO DEL CLUB DEPORTIVO SAN MIGUEL.,$0.00,,
674,SUBS,2301D0066,12/06/2024,13/06/2024,13/06/2024,CLUB DEPORTIVO BUSTAMANTE.,PARTICIPACION CAMPEONATO CLAUSUSRA 2023 EN COIHUECO DEL CLUB DEPORTIVO BUSTAMANTE.,$0.00,,
