1694,REND ,2401C0106,28-11-2024,13-12-2024,16-12-2024,CONJUNTO FOLCLORICO LOS DEL VALLE ,FORTALECIENDO NUESTRAS PRESENTACIONES ,"$2,007,290.00",,
1695,REND ,2401D0332,13-12-2024,13-12-2024,16-12-2024,UNION COMUNAL CLUBES DEPORTIVOS URBANOS DE YUNGAY ,PREMIACION PARA CAMPEONES 2024,"$4,000,000.00",,
1696,REND ,2401SC0237,5-12-2024,13-12-2024,16-12-2024,COMITE VILLA LAS TORRES CHOLGUAN NORTE ,CADA DIA MAS ILUMINADA MI VILLA ,"$4,000,000.00",,
1697,REND ,2401D0109,13-12-2024,13-12-2024,16-12-2024,CLUB DEPORTIVO CULTURAL Y SOCIAL ANTÜ,IMPLEMENTACION DEPORTIVA PARA FOMENTAR LA PRACTICA Y EL APRENDIZAJE FORMATIVO DEL BALONCESTO EN LA COMUNA DE CHILLAN VIEJO ,"$3,960,700.00",,
1698,REND ,2401D0001,13-12-2024,13-12-2024,16-12-2024,CLUB DEPORTIVO LA ISLA ,ACTIVANDO EL FUTBOL DE NUESTRO CLUB DEPORTIVO LA ISLA ,"$1,725,500.00",,
1699,REND ,2401SC0247,6-12-2024,13-12-2024,16-12-2024,JUNTA DE VECINOS N°5 MANZANARES ,ENTRE TODOS NOS CUIDAMOS ,"$3,050,955.00",,
1700,REND ,2401SC0012,6-12-2024,13-12-2024,16-12-2024,JUNTA D EVECINOS CERRO NINHUE ,EL SOL TRAE SEGURIDAD PARA CERRO NINHUE ,"$3,936,520.00",,
1701,REND ,2401D0003,13-12-2024,13-12-2024,16-12-2024,CLUB DE MOUNTAIN BIKE DE NINHUE ,NINHUE CERRO BAJO 2024,"$1,790,230.00",,
1702,REND ,2401D0018,13-12-2024,13-12-2024,16-12-2024,CLUB DEPORTIVO COBRELOA DE NINHUE ,POR MAS DEPORTE Y UNION DEL CLUB DEPORTIVO COBRELOA ,"$1,798,260.00",,
1703,REND ,2401D0063,13-12-2024,13-12-2024,16-12-2024,CLUB DEPORTIVO LIBERTADOR BERNARDO O´HIGGINS ,REMACHES HACIA EL FUTURO ,"$3,609,700.00",,
1704,REND ,2401D0278,13-12-2024,13-12-2024,16-12-2024,CLUB DEPORTIVO ALIANZA DE LA UNIDAD VECINAL N°6,FORMANDO TALENTOS ,"$4,000,000.00",,
1705,REND ,2401D0061,13-12-2024,13-12-2024,16-12-2024,PANTERAS FUTBOL CLUB ,ESCUELA DE FUTBOL FEMENINO PANTERAS ,"$4,000,000.00",,
1706,REND ,2401D0053,12-12-2024,13-12-2024,16-12-2024,CLUB DEPORTIVO ALIANZA DE YUNGAY ,IMPLEMNTACION DEPORTIVA CLUB DEPORTIVO ALIANZA ,"$1,800,000.00",,
1707,REND ,2401D0036,13-12-2024,13-12-2024,16-12-2024,CLUB TRIATLON QUILLON ,ESCUELA FORMATIVA DE CICLISMO PARA DEPORTISTAS DE LA COMUNA DE QUILLON ,"$3,907,970.00",,
1708,REND ,2401C0199,9-12-2024,13-12-2024,16-12-2024,CLUB DE HUASOS MONTEBLANCO ,CLUTIVANDO TRADICIONES DE MONTEBLANCO ,"$2,427,500.00",,
1709,REND ,2401D0071,13-12-2024,13-12-2024,16-12-2024,CLUB DEPORTIVO CATOLICA DE PEMUCO ,ESCUELA DE FUTBOL CATOLICA DE PEMUCO ,$0.00,,
1710,REND ,2401D0180,13-12-2024,13-12-2024,16-12-2024,CLUB DE BASKETBALL CHILLAN VIEJO ,PRIMER CUADRANGULAR DE BASKETBALL INFANTIL DEL CLUB CHILLAN VIEJO ,"$3,314,921.00",,
1711,REND ,2401EG0109,13-12-2024,13-12-2024,16-12-2024,CLUB DE AMISTAD DE QUIRIHUE ,"VIAJE PARA FOMENTAR Y GENERAR ESPACIOS DE CONVERSACION, PARA REFORZAR NUESTRA IDENTIDAD COMO AGRUPACION DE MUJERES ","$2,572,000.00",,
1712,REND ,2401AM0072,13-12-2024,13-12-2024,16-12-2024,CLUB ADULTO MAYOR LOS COPIHUES ,TRAVESIA OCEANICA JUNTO A LOS COPIHUES ,"$1,982,110.00",,
1713,REND ,2401AM0024,13-12-2024,13-12-2024,16-12-2024,UNION COMUNAL DE ADULTOS MAYORES ,TRAS LAS HUELLAS DEL PASADO EN LOTA ,"$1,982,110.00",,
1714,REND ,2401SC0605,11-12-2024,13-12-2024,16-12-2024,JUNTA DE VECINOS AGUAS AZULES ,SECTOR AGUAS AZULES CONTRA EL FUEGO ,"$1,810,900.00",,
1715,REND ,2401SC0233,5-12-2024,13-12-2024,16-12-2024,JUNTA DE VECINOS LA CONCEPCION ,CADA DIA LA CONCEPCION MAS PROTEGIDA ,"$4,000,000.00",,
1716,REND ,2401D0043,11-12-2024,13-12-2024,16-12-2024,ASOCIACION FUTBOL RURAL SANTA CLARA ,CAMPEONATO ASOCIACION FUTBOL RURAL SANTA CLARA ,"$3,960,000.00",,
1717,REND ,2401AM0116,11-12-2024,13-12-2024,16-12-2024,CLUB DE ADULTO MAYOR ATARDECER FELIZ ,PROMOVIENDO EL ACERVO CULTURAL; CHILE RAICES VIVIENTES PARA LAS PERSONAS MAYORES ,$0.00,,
1718,REND ,2401SC0027,26-11-2024,13-12-2024,16-12-2024,JUNTA DE VECINOS LAS MIRAS ,"CON ILUMINACION PUBLICA, LA JUNTA DE VECINOS LAS MIRAS NOS SENTIMOS MAS SEGUROS ","$3,703,000.00",,
1719,REND ,2401D0320,13-12-2024,13-12-2024,16-12-2024,CLUB DE RODEO CHILENO DE PEMUCO RIO PAL PAL ,PEMUCO TIERRA DE RODEO CHILENO ,"$1,798,000.00",,
1720,REND ,2401AM0223,13-12-2024,13-12-2024,16-12-2024,CONAPRAN PEMUCO ,CONAPRAN PRENDE Y APRENDE ,"$1,990,842.00",,
1721,REND ,2401D0293,10-12-2024,13-12-2024,16-12-2024,ASOCIACION DE FUTBOL COELEMU ,FINAL DE LIGUILLA COELEMU ,"$3,978,554.00",,
1722,REND ,2401D0198,13-12-2024,13-12-2024,16-12-2024,CLUB DEPORTIVO EL SAUCE ,ESCUELA FORMATIVA DE FUTBOL EL SAUCE ,"$3,658,840.00",,
1723,REND ,2401D0322,13-12-2024,13-12-2024,16-12-2024,CLUB DEPORTIVO UNION FERROVIARIO ,ESCUELA DE FUTBOL; DE L MANO CON LOS VALORES LA MEDIDA DE NIÑOS Y JOVENES ,"$3,413,178.00",,
1724,REND ,2401SC0185,16-12-2024,16-12-2024,17-12-2024,COMITE DE MEJORAMIENTO Y ADELANTO LOMAS DEL SOL ,"CON TU LUZ, CAMINO SEGURO EN LOMAS DEL SOL ","$4,000,000.00",,
1725,REND ,2401S0044,16-12-2024,16-12-2024,17-12-2024,CONSEJO DE DESARROLLO HOSPITAL DE YUNGAY,"EL CONSEJO DE DESARROLLO YUNGAY, AYUDA EN EL AUTOCUIDADO DE TU SALUD ","$2,987,900.00",,
1726,SUBS ,2301SP0158,16-12-2024,16-12-2024,17-12-2024,JUNTA DE VECINOS LA UNION DEL SUR ,CONTROL DE INCENDIOS EN LA UNION NINQUIHUE ,$0.00,,
1727,SUBS ,2401C0145,16-12-2024,16-12-2024,17-12-2024,COMITE PRODUCTIVO EL PINO HUACHO ,ENTRE PAÑUELOS Y ESPUELAS ,$0.00,,
1728,SUBS ,2401D0198,16-12-2024,16-12-2024,17-12-2024,CLUB DEPORTIVO EL SAUCE ,ESCUELA FORMATIVA DE FUTBOL EL SAUCE ,"$352,001.00",,
1729,REND ,2401AM0098,16-12-2024,16-12-2024,17-12-2024,CLUB SONRISA DEL ADULTO MAYOR ,RECORRIENDO CHILE ,"$849,450.00",,
1730,REND ,2401M0069,10-12-2024,16-12-2024,17-12-2024,AGRUPACION FERIA LIBRE PINTO ,FERIA LIBRE PINTO CUIDA SU MEDIO AMBIENTE ,"$3,000,000.00",,
1731,REND ,2401D0033,9-12-2024,16-12-2024,17-12-2024,CLUB DEPORTIVO TAEKWONDO QUILLON ,FORMANDO DEPORTISTAS DE ALTA COMPETENCIA PARA LA REGION DE ÑUBLE ,"$3,865,000.00",,
1732,REND ,2401D0091,16-12-2024,16-12-2024,17-12-2024,CLUB DEPORTIVO JUNQUILLO ,CLUB DEPORTIVO JUNQUILLO PRESENTE EN EL CAMPEONATO FUSEC 2024,"$1,761,980.00",,
1733,REND ,2401EG0112,16-12-2024,16-12-2024,17-12-2024,ASOCIACION INDIGENA WENGAMEN ,BORDANDO SIMBOLOS ANCESTRAL 3,"$3,000,000.00",,
1734,SUBS ,2401D0056,16-12-2024,16-12-2024,17-12-2024,CLUB DEPORTIVO HERNAN BRAÑAS,SEMBRANDO OPORTUNIDADES III ,$0.00,,
1735,REND ,2401S0027,16-12-2024,16-12-2024,17-12-2024,JUNTA DE VECINOS VILLA UNION DE DELBUN ,EQUIPAMIENTO SOCIAL PARA VILLA UNION DE RELBUN ,"$1,255,910.00",,
1736,REND ,2401D0319,13-12-2024,16-12-2024,17-12-2024,CLUB DEPORTIVO REAL SOCIEDAD DE PEMUCO ,REAL SOCIEDAD SE EQUIPA PARA EL FUTBOL PEMUCANO ,"$1,800,000.00",,
1737,REND ,2401S0010,12-12-2024,16-12-2024,17-12-2024,JUNTA DE VECINOS QUITRIPIN BAJO ,ILUMINANDO LA SEGURIDAD DE MI BARRIO ,"$3,135,770.00",,
1738,REND ,2401D0104,16-12-2024,16-12-2024,17-12-2024,UNION COMUNAL DE FUTBOL NINHUE ,CAMPEONATO DE FUTBOL COMUNAL FNDR NINHUE ,"$3,900,000.00",,
1739,REND ,2401SC0269,16-12-2024,16-12-2024,17-12-2024,JUNTA DE VEINOS BOYEN 3R,HAGASE LA LUNA EN BOYEN ,"$4,000,000.00",,
1740,SUBS ,2401C0007,16-12-2024,16-12-2024,17-12-2024,JUNTA DE VECINOS GUARILIHUE BAJO ,CANTO Y COPLAS AL VINO ,$0.00,,
1741,SUBS ,2401SC0132,16-12-2024,16-12-2024,17-12-2024,JUNTA DE VECINOS N°36 SAN FRANCISCO ,SEGURIDAD PARA LOS VECINOS DE SAN FRANCISCO ,$0.00,,
1742,REND ,2401SC0154,16-12-2024,16-12-2024,17-12-2024,JUNTA DE VECINOS CHUPALLAR ,MAS AGUA PARA EMERGENCIAS ,"$3,407,490.00",,
1743,REND ,2401SC0275,16-12-2024,16-12-2024,17-12-2024,JUNTA DE VECINOS CHECURA ,CHECURA EN ALERTA ,"$3,839,890.00",,
1744,REND ,2401SC0262,9-12-2024,16-12-2024,17-12-2024,JJ.VV ALEJANDRO PEREZ ,COMUNIDAD SEGURA ,"$4,000,000.00",,
1745,REND ,2401SC0241,11-12-2024,16-12-2024,17-12-2024,JUNTA DE VECINOS PUENTE ITATA ,ALARMAS PARA PUENTE ITATA MANTENIENDO UN BARRIO MAS SEGURO ,"$4,000,000.00",,
1746,REND ,2401SC0055,5-12-2024,16-12-2024,17-12-2024,JUNTA DE VECINOS POBLACION RENE SHCNEIDER ,COMPARTIENDO SEGURIDAD CON NUESTROS VECINOS ,"$3,999,942.00",,
1747,REND ,2401SC0239,12-11-2024,16-12-2024,17-12-2024,JUNTA DE VECINOS VALLE LOS CASTAÑOS ,VALLE LOS CASTAÑOS SEGURO,"$3,999,999.00",,
1748,REND ,2401SC0150,12-11-2024,16-12-2024,17-12-2024,COMITE DE ADELANTO MAGDALENA ALTO ,MAGDALENA ALTO CON + SEGURIDAD ,"$3,553,920.00",,
1749,REND ,2401SC0256,12-11-2024,16-12-2024,17-12-2024,JUNTA DE VECINOS CARAVANCHEL ,"EN CARAVANCHEL MAS UNIDOS, MAS SEGUROS ","$3,998,750.00",,
1750,REND ,2401SC0134,12-11-2024,16-12-2024,17-12-2024,JUNTA DE VECINOS VILLA EL CONQUISTADOR ,EL CONQUISTADOR EN ALERTA ,"$4,000,000.00",,
1751,REND ,2401SC0034,16-12-2024,16-12-2024,17-12-2024,JUNTA DE VECINOS RENACER DE VILLA MADERA ,YO CUIDO A MIS VECINOS ,"$3,968,835.00",,
1752,REND ,2401SC0112,16-12-2024,16-12-2024,17-12-2024,JUNTA DE VECINOS TUBUL ,TODOS JUNTOS CONTRA EL FUEGO,"$2,990,160.00",,
1753,REND ,2401ADCC010,16-12-2024,16-12-2024,17-12-2024,ASOCIACION ÑUBLE AUDIOVISUAL ,CINE EN TU COMUNA 5° FESTIVAL DE CINE NACIONAL DE ÑUBLE ,$0.00,,
1754,REND ,2401D0073,16-12-2024,16-12-2024,17-12-2024,"AGRUPACION SOCIAL, CULTURAL, DEDUCATIVA Y DEPORTIVA SIPALKI-DO CHILE ",ESCUELA DE FORMACION DE SIPALKI-DO PARA LA COMUNIDAD QUIRIHUANA ,"$3,977,510.00",,
1755,SUBS ,2401C0176,16-12-2024,16-12-2024,17-12-2024,CLUB DE HUASOS EL SEMBRADOR ,ENCUENTRO POR LAS TRADICIONES CRIOLLAS ,$0.00,,
1756,REND ,2401M0043,16-12-2024,16-12-2024,17-12-2024,JUNTA DE VECINOS LAS COMPUERTAS ,COSECHANDO LIMPIEZA ,"$3,000,000.00",,
1757,REND ,CVC-AD-24-1,11-12-2024,16-12-2024,17-12-2024,ILUSTRE MUNICIPALIDAD DE QUIRIHUE ,"SEGUNDA VERSION FIESTA PATRIMONIAL DE LA CHILENIDAD, QUIRIHUE 2024","$16,308,000.00",,
1758,REND ,2401M0115,16-12-2024,16-12-2024,17-12-2024,JUNTA DE VECINOS LOMAS NUEVO AMANECER ,LOMAS NUEVO AMANECER UNA JUNTA DE VECINOS COMPROMETIDOS CON LA ECONOMIA CIRCULAR ,"$2,504,700.00",,
1759,REND ,2401M0065,17-12-2024,16-12-2024,17-12-2024,COMITE DE AGUA POTABLE DE CARAVANCHEL ,CARAVANCHEL LIMPIO Y SEGURO ,"$1,966,830.00",,
1760,REND ,2401SC0551,16-12-2024,16-12-2024,17-12-2024,COMITE DE AGUA POTABLE RURAL CANCHA LOS BOTONES ,CANCHA LOS BOTONES CONTRA EL DEFICIT HIDRICO ,"$3,052,570.00",,
1761,REND ,2401EG0079,16-12-2024,16-12-2024,17-12-2024,AGRUPACION DE MUJERES PRIMAVERAS DE RAHUIL,MUJERES QUE TRANSFORMAN EL MUNDO ,"$2,998,100.00",,
1762,REND ,2401S0103,17-12-2024,17-12-2024,18-12-2024,JUNTA DE VECINOS BUREO BAJO ,"COIHUECO FORTALECE EL TRABAJO COMUNITARIO E IGUALDAD DE CONDICIONES, TALLER DE COCINA PARA LA COMUNIDAD DE BUREO BAJO","$3,000,000.00",,
1763,REND ,2401M0140,17-12-2024,17-12-2024,18-12-2024,COMITE DE ADELANTO VILLA LUNA ,VECINA Y VECINA DE VILLA LUNA MAS SUSTENTABLE ,"$3,000,000.00",,
1764,REND ,2401D0133,17-12-2024,17-12-2024,18-12-2024,CLUB DEPORTIVO ESCOLAR INSAMACH ,"BASQUETBALL, MUJERES A LA CANCHA ","$3,902,700.00",,
1765,REND ,2401ADNCD009,17-12-2024,17-12-2024,18-12-2024,UNION COMUNAL DE CLUBES DEPORTIVOS ASOCIACION DE FUTBOL RURAL PONIENTE ,MEJORANDO LA PARTICIPACION EN CAMPEONATOS LOCALES Y REGIONALES DE LOS CLUBES DEPORTIVOS DE LA COMUNA DE SAN CARLOS ,"$5,000,000.00",,
1766,REND ,2401SC0356,17-12-2024,17-12-2024,18-12-2024,JUNTA DE VECINOS LAS BRISAS ,COIHUECO TE PROTEGE SISTEMA DE TELEVIGILANCIA EN LAS BRISAS ,"$4,000,000.00",,
1767,REND ,2401SC0452,17-12-2024,17-12-2024,18-12-2024,JUNTA DE VECINOS LAS LUMAS ,COIHUECO TE PROTEGE SISTEMA DE TELEVIGILANCIA EN LAS LUMAS ,"$4,000,000.00",,
1768,REND ,2401SC0373,17-12-2024,17-12-2024,18-12-2024,JUNTA DE VECINOS EL MAITEN CHICO ,"COIHUECO TE PROTEGE, SISTEMA DE ILUMINACION VECINAL EN EL MAITEN CHICO ","$4,000,000.00",,
1769,REND ,2401SC0366,17-12-2024,17-12-2024,18-12-2024,COMITE DE ADELANTO Y DESARROLLO PERQUINCO ,COIHUECO TE PROTEGE SISTEMA DE TELEVIGILANCIA EN PERQUINCO ,"$4,000,000.00",,
1770,REND ,2401EG0119,17-12-2024,17-12-2024,18-12-2024,JUNTA DE VECINOS FRUTILLAR CENTRLA ,"COIHUECO EN EQUIDAD, TALLER DE CNSERVAS Y MERMELADAS PARA LAS MUJERES DE FRUTILLAR CENTRAL ","$3,000,000.00",,
1771,REND ,2401M0135,17-12-2024,17-12-2024,18-12-2024,JUNTA DE VECINOS LAS PATAGUAS ,"JJ.VV LAS PATAGUAS, COMPOSTAJE Y EDUCACION PARA REDUCIR LOS RESIDUOS DOMICILIARIOS ","$2,966,794.00",,
1772,REND ,2401M0143,17-12-2024,17-12-2024,18-12-2024,JUNTA DE VECINOS UNION EN EMBALSE ,JJ.VV EL EMBALSE CUIDA SU SECTOR Y EL MEDIO AMBIENTE ,"$3,000,000.00",,
1773,REND ,2401EG0095,17-12-2024,17-12-2024,18-12-2024,JUNTA DE VECINOS ALTOS DE COIHUECO ,COIHUECO EN EQUIDAD TALLERES DE REPOSTERIA PARA LAS MUJERES DE LA COMUNIDAD DE ALTOS DE COIHUECO ,"$3,000,000.00",,
1774,REND ,2401M0116,13-12-2024,17-12-2024,18-12-2024,JUNTA D EVECINOS CENTRAL ,COIHUECO PROMUEVE EL RECICLAJE EN JJ.VV CENTRAL,"$3,000,000.00",,
1775,REND ,2401S0101,17-12-2024,17-12-2024,18-12-2024,JUNTA DE VECINOS ROBLERIA ,"COIHUECO FORTALECE EL TRABAJO COMUNITARIO , TALLERES DE REPOSTERIA EN ROBLERIA ","$3,000,000.00",,
1776,REND ,2401M0106,17-12-2024,17-12-2024,18-12-2024,JUNTA DE VECINOS NAHUELTORO INTERIOR ,"JJ.VV NAHUELTORO SUSTENTABLE, HUMUS PARA NUESTROS ALIMENTOS ","$2,962,364.00",,
1777,REND ,2401M0126,13-12-2024,17-12-2024,18-12-2024,JUNTA DE VECINOS UNION CANCHA EL ALAMO ,"JJ.VV CANCHA EL ALAMO MAS ORGANICO; FERTILIZANTES, FUNGICIDAD Y ECONOMIA CIRCULAR ","$2,904,889.00",,
1778,SUBS ,CVC-AD-15,17-12-2024,17-12-2024,18-12-2024,CLUB DEPORTIVO SAN MARTIN ,CATEGORIA SERIE DE HONOR SAN MARTIN 2024,$0.00,,
1779,REND ,2401SC0037,27-11-2024,17-12-2024,18-12-2024,JUNTA DE VECINOS N3R QUINTERO ,ILUMINANDO Y SEGURIDAD PARA QUITENTO,"$2,997,250.00",,
1780,REND ,2401SC0414,29-11-2024,17-12-2024,18-12-2024,JUNTA DE VECINOS LOS ALTOS DE TREHUACO ,CAMARAS DE TELEVIGILANCIA PARA ALTOS DE TREHUACO ,"$4,000,000.00",,
1781,SUBS ,2401SC0433,12-12-2024,17-12-2024,19-12-2024,COMITE DE ADELANTO Y DESARROLLO LOS ALTOS AMANECER DE PORTEZUELO ,CUIDEMOS EL PLANETA A TRAVES DE LA ILUMINACION SOLAR ,$0.00,,
1782,SUBS ,2401SC0527,6-12-2024,17-12-2024,19-12-2024,JUNTA DE VECINOS EL SAUCE ,ILUMIANDO NUESTRO SECTOR RURAL DEL SAUCE ,$0.00,,
1783,REND ,2401M0031,9-12-2024,17-12-2024,19-12-2024,JUNTA DE VECINOS EL CIPRES ,MEJORANDO EL MANEJO DE RESIDUOS ,"$2,256,200.00",,
1784,SUBS ,2301EG0011,17-12-2024,17-12-2024,19-12-2024,CENTRO DE MADRES LAS MARIANITAS ,TEJIENDO COLORES ,$0.00,,
1785,REND ,2401D0172,13-12-2024,17-12-2024,19-12-2024,CLUB DEPORTIVO RENACER LOS HERORES ,ESCUELA DE FUTBOL RENACER LOS HEROES ,"$3,997,080.00",,
1786,REND ,2401EG0067,17-12-2024,17-12-2024,19-12-2024,COMITE FEMENINO LAS ARAÑITAS DE LA VEGA ,JUNTAS NOS CREAMOS UN MEJOR VIVIR ,"$1,621,680.00",,
1787,SUBS ,2401SC0412,29-11-2024,17-12-2024,19-12-2024,JUNTA D EVECINOS POBLACION HERNAN BRAÑAS ,RECUPERACION DE ESPACIOS PUBLICOS HERNAN BRAÑAS PARTE 2,"$60,000.00",,
1788,REND ,2401M0131,17-12-2024,17-12-2024,19-12-2024,JUNTA DE VECINOS EL CARACOL ,CUIDANDO NUESTRO ENTORNO PARA EL MAÑANA ,"$2,575,000.00",,
1789,REND ,2401SC0451,17-12-2024,17-12-2024,19-12-2024,JUNTA DE VECINOS JAVIERA CARRERA AMPLIACION PUREN 2,TRABAJANDO REDES DE APOYO ENTRE LOS VECINOS DE AMPLITUD PUREN 2 PARA AUXILIARSE ANTE EMERGENCIAS ,"$4,000,000.00",,
1790,REND ,2401S0096,13-12-2024,17-12-2024,19-12-2024,CENTRO DE PADRES Y APODERADOS ESCUELA 134 NINQUIHUE ,"ENCUENTRO COMUNIDAD EDUCATIVA Y VECINAL DE NINQUIHUE Y ALREDEDORES, FOMENTANDO LA PARTICIPACION A TRAVES DE LA CONVIVENCIA COMUNITARIA ","$2,969,917.00",,
1791,REND ,2401EG0111,12-12-2024,17-12-2024,19-12-2024,UNIVERSIDAD ADVENTISTA DE CHILE ,INCLUSION FINANCIERA PARA EL EMPODERAMIENTO Y AUTONOMIA DE MICRO EMPRENDEDORAS DE YUNGAY ,"$5,099,661.00",,
1792,REND ,2401SC0383,12-12-2024,17-12-2024,19-12-2024,COMITE DE ADELANTO ALTOS DEL PAJONAL ,"DAR MAYOR SEGURIDAD A LOS VECINOS Y VECINAS DE SECTOR RURAL, CON LA INSTALACION DE LUMINARIAS ","$4,000,000.00",,
1793,SUBS ,2401D0166,17-12-2024,17-12-2024,19-12-2024,CLUB DEPORTIVO SANTA AMELIA ,SANTA AMELIA CON EL DEPORTE ,$0.00,,
1794,SUBS ,2301M0003,18-12-2024,17-12-2024,19-12-2024,JUNTA DE VECINOS PANGUILEMU ,PANGUILEMU SE UNE POR EL CUIDADO DEL MEDIO AMBIENTE ,$0.00,,
1795,SUBS ,2301S0018,18-12-2024,17-12-2024,19-12-2024,JUNTA DE VECINOS TRANCOYAN ,TRANCOYAN SE CAPACITA POR UNA VIDA MAS SALUDABLE ,"$90,000.00",,
1796,SUBS ,2301M0005,18-12-2024,17-12-2024,19-12-2024,JUNTA DE VECINOS CUCHA URREJOLA ,EDUCACION AMBIENTAL PARA NUESTRA COMUNIDAD DE CUCHA URREJOLA ,$0.00,,
1797,REND ,2401M0142,13-12-2024,17-12-2024,19-12-2024,COMITE DE ADELANTO VILLA SAN CRISTOBAL ,PROYECTO DE ILUMINACION SOLAR EN VILLA SAN CRISTOBAL ,"$3,000,000.00",,
1798,SUBS ,2401SC0117,17-12-2024,17-12-2024,19-12-2024,JUNTA DE VECINOS SANTA ELVIRA ,LUMINARIAS PARA LA JUNTA DE VECINOS SANTA ELVIRA ,$0.00,,
1799,REND ,2401EG0137,16-12-2024,17-12-2024,19-12-2024,CORPORACION EDUCACIONAL PERSEVERA ,"MADRES CUIDADORAS DEL PERSEVERA, MUJERES LIDERESAS ","$6,000,000.00",,
1800,REND ,2401C0105,17-12-2024,17-12-2024,19-12-2024,COMITE DE MUJERES INCLUSIVAS PUEBLO SECO ,"MANOS DE TRADICION, RESCATE Y VALORIZACION DE LA ORFEBRERIA ","$2,498,420.00",,
1801,REND ,2401EG0133,17-12-2024,17-12-2024,19-12-2024,JUNTA VECINAL JERUSALEN 2,APRENDER MANICURE Y MAQUILLAJE PARA EMPRENDER Y CRECER ,"$2,860,522.00",,
1802,REND ,2401EG0064,16-12-2024,17-12-2024,19-12-2024,ORGANIZACION DE LA MUJER RURAL DE PINTO ,MUESTRA GASTRONOMICA MUJER RURAL ,"$2,772,270.00",,
1803,REND ,2401SC0005,16-12-2024,17-12-2024,19-12-2024,JUNTA DE VECINOS VILLA LOS CORTESES ,LA ECOLOGIA EN LA VILLA ,"$3,917,175.00",,
1804,SUBS ,2401SC0397,17-12-2024,17-12-2024,19-12-2024,JUNTA DE VECINOS VILLA LAS ARAUCARIAS ,EXTINGAMOS EL FUEGO EN COMUNIDAD ,$0.00,,
1805,SUBS ,2401SP0380,17-12-2024,17-12-2024,19-12-2024,JJ.VV RENACER DE COPIHUAL , PREVENCION DE INCENDIOS DOMICILIARIOS ,"$209,491.00",,
1806,REND ,2401SC0263,17-12-2024,17-12-2024,19-12-2024,COMITE DE ADELANTO Y DESARROLLO AGUAS CLARAS QUILAMAPU ,CRECIENDO EN UN ENTORNO ENTRETENIDO Y SEGURO ,"$3,784,860.00",,
1807,REND ,2401SC0065,17-12-2024,17-12-2024,19-12-2024,PRESIDENTE JJ.VV LOS NOGALES CHILLAN ,SISTEMA DE VIDEO VIGILANCIA COMUNITARIA ,"$4,000,000.00",,
1808,REND ,2401S0015,16-12-2024,17-12-2024,19-12-2024,UNION COMUNAL DE JUNTA DE VECINOS COELEMU ,LIDERAZGO Y EMPODERAMIENTO TECNOLOGICO ,"$2,370,570.00",,
1809,SUBS ,2401SC0337,17-12-2024,17-12-2024,19-12-2024,VILLA CORDILLERA N°12,CORDILLERA GRITA POR LA SEGURIDAD ,$0.00,,
1810,SUBS ,2301D0287,17-12-2024,17-12-2024,19-12-2024,ESCUELA DE FUTBOL EL REY ARTURO VIDAL ,"SEGUNDA ESCUELA DE FUTBOL, REY ARTURO VIDAL 2023",$0.00,,
1811,REND ,2401EG0057,16-12-2024,17-12-2024,19-12-2024,JUNTA DE VECINOS LOS REMATES ,MUJERES RURALES EMPRENDEDORAS DE LOS REMATES-PUÑOS DE ESPERANZA ,"$2,997,183.00",,
1812,REND ,2401C0141,17-12-2024,17-12-2024,19-12-2024,CENTRO DE PADRES Y APODERADOS ESCUELA LAS QUILAS DE LA UNIDAD VECINAL N°10 COMUNA DE SAN IGNACIO ,ESTUDIANTES CONOCIENDO MAS ,"$2,500,000.00",,
1813,REND ,2401M0071,16-12-2024,17-12-2024,19-12-2024,AGRUPACION FERIA EMPRENDEDORES DE PINTO ,ECOFERIA IMPULSO EMPRENDEDOR SOSTENIBLE ,"$3,000,000.00",,
1814,REND ,2401S0100,9-12-2024,17-12-2024,19-12-2024,JUNTA DE VECINOS COPIHUAL ,TALLER DE FORMULACION Y ELABORACION DE PROYECTOS ,"$2,999,946.00",,
1815,REND ,2401M0026,17-12-2024,17-12-2024,19-12-2024,JUNTA DE VECINOS VILLA PADRE HURTADO 1,VILLA PADRE HURTADO RECICLANDO CON CONSCIENCIA ,"$2,999,208.00",,
1816,REND ,2401M0025,17-12-2024,17-12-2024,19-12-2024,JUNTA DE VECINOS PROYECTO O´HIGGINS ,O´GGINS MI PROYECTO VERDE ,"$2,998,252.00",,
1817,REND ,2401SC0553,17-12-2024,17-12-2024,19-12-2024,SUPERINTENDENTE DEL CUERPO DE BOMBEROS DE BULNES ,PREPARANDO A LA COMUNIDAD EN SITUACIONES DE EMERGENCIA EN BULNES ,"$4,130,847.00",,
1818,REND ,2401M0079,17-12-2024,17-12-2024,19-12-2024,JUNTA DE VECINOS VEGAS DE NIBLINTO ,CREACION DE HUERTOS ECOLOGICOS ,"$3,000,000.00",,
1819,REND ,2401D0323,10-12-2024,18-12-2024,19-12-2024,CENTRO DE PADRES Y APODERADOS LICEO POLIVALENTE JUAN ARTURO PACHECO ALTAMIRANO ,IMPLEMENTACION TALLER DE HALTEROGRAFIA ,"$3,613,401.00",,
1820,REND ,2401C0064,13-12-2024,18-12-2024,19-12-2024,JUNTA DE VECINOS BOCA ITATA ,6° VERSION: LA CULTURA Y TRADICIONES SE VIVEN EN EL CAMPO ,"$2,500,000.00",,
1821,SUBS ,2401SC0151,18-12-2024,18-12-2024,19-12-2024,JUNTA DE VECINOS LONQUEN ,ALARMAS COMUNITARIAS PARA LONQUEN ,$0.00,,
1822,SUBS ,2401C0145,18-12-2024,18-12-2024,19-12-2024,COMITE PRODUCTIVO EL PINO HUACHO ,ENTRE PAÑUELOS Y ESPUELAS ,$0.00,,
1823,REND ,2401SC0404,13-12-2024,18-12-2024,19-12-2024,JUNTA DE VECINOS QUILMO SUR ORIENTE ,ALARMAS COMUNITARIAS PARA QUILMO SUR ORIENTE ,"$4,000,000.00",,
1824,REND ,2401SC0487,13-12-2024,18-12-2024,19-12-2024,JUNTA DE VECINOS N°13 PUEBLO SECO ,ALARMAS COMUNITARIAS PARA PUEBLO SECO III,"$4,000,000.00",,
1825,REND ,2401SC0468,5-12-2024,18-12-2024,19-12-2024,JUNTA DE VECINOS PORTAL DEL LIBERTADOR ,SISTEMA DE TELEVIGILANCIA PORTAL DEL LIBERTADOR ,"$4,000,000.00",,
1826,REND ,2401SC0548,13-12-2024,18-12-2024,19-12-2024,JUNTA DE VECINOS PUEBLO SECO PONIENTE ,CON CAMARAS NOS CUIDAMOS TODOS ,"$4,000,000.00",,
1827,REND ,2401SC0348,7-12-2024,18-12-2024,19-12-2024,JUNTA D EVECINOS POBLACION FERRETERA ,SISTEMA DE ALARMAS POBLACION FERRETERA ,"$4,000,000.00",,
1828,REND ,2401SC0473,5-12-2024,18-12-2024,19-12-2024,JUNTA DE VECINOS LLAHUIMAVIDA ORIENTE ,SISTEMA DE VIGILANCIA PARA HUILLAMAVIDA ,"$4,000,000.00",,
1829,REND ,2401SC0575,10-12-2024,18-12-2024,19-12-2024,JUNTA DE VECINOS LAS PALMERAS ,ALARMAS COMUNITARIAS PARA LAS PALMERAS ,"$4,000,000.00",,
1830,REND ,2401SC0455,5-12-2024,18-12-2024,19-12-2024,COMITE DE AGUA POTABLE RURAL EL MAITEN ,CAMARAS DE SEGURIDAD PARA EL MAITEN ,"$4,000,000.00",,
1831,REND ,2401SC0393,10-12-2024,18-12-2024,19-12-2024,JUNTA DE VECINOS VISTA DE SCHLEYER ,LUMINARIAS PARA JUNTA DE VECINOS VISTA SCHELEYER ,"$4,000,000.00",,
1832,SUBS ,2401SC0430,18-12-2024,18-12-2024,19-12-2024,JUNTA DE VECINOS VILLA LAS ARAUCARIAS ,TELEVIGILANCIA PARA VILLA LAS ARAUCARIAS ,$0.00,,
1833,SUBS ,2401SC0585,18-12-2024,18-12-2024,19-12-2024,COMITE DE AGUA POTABLE RURAL VILLA LAS ARAUCARIAS ,JUNTOS EVITANDO LOS INCENDIOS ,$0.00,,
1834,SUBS ,2401SC0474,18-12-2024,18-12-2024,19-12-2024,JUNTA DE VECINOS VILLA LAS ARAUCARIAS ,VILLA LAS ARAUCARIAS ,$0.00,,
1835,SUBS ,2401S0065,18-12-2024,18-12-2024,19-12-2024,JUNTA DE VECINOS VILLA LOMAS DE MAPON ,TALLERES DE MANUALIDADES Y ORIENTACIO SOCIAL ,$0.00,,
1836,REND ,CVC-AD-7,18-12-2024,18-12-2024,19-12-2024,FUNDACION MITEA ,JUNTOS AVANZANDO EN LA INCLUSION ,"$16,342,576.00",,
1837,REND ,2401C0155,18-12-2024,18-12-2024,19-12-2024,TALLER LABORAL SANTA IRMINA ,RESCATANDO EL ARTE DE LA LANIGRAFIA ,"$3,480,310.00",,
1838,REND ,2401D0083,18-12-2024,18-12-2024,19-12-2024,CLUB DEPORTIVO SAN EDUARDO ,IMPLEMENTACION PARA NUESTRAS SERIES DEL CDSE ,"$1,759,903.00",,
1839,REND ,2401SC0042,16-12-2024,18-12-2024,19-12-2024,JUNTA DE VECINOS EL SAUCE ,MAYOR SEGURIDAD Y PROTECCION PARA EL SECTOR EL SAUCE ,"$3,999,300.00",,
1840,REND ,2401AM0010,16-12-2024,18-12-2024,19-12-2024,GRUPO ADULTO MAYOR LAS ARBOLEDAS ,CULTIVANDO TALENTOS EN EL ADULTO MAYOR ,"$1,999,550.00",,
1841,REND ,2401AM0099,10-12-2024,18-12-2024,19-12-2024,GRUPO DE ADULTO MAYOR SANTA AMELIA EL SAUCE ,SANTA AMALIA EN ACCION ,"$1,975,550.00",,
1842,REND ,2301D0050,18-12-2024,18-12-2024,19-12-2024,CLUB DEPORTIVO SAN LUIS DE ARIZONA ,SAN LUIS COMPROMETIDOS CON EL DEPORTE ,"$1,560,000.00",,
1843,REND ,2401D0051,18-12-2024,18-12-2024,19-12-2024,CLUB DEPORTIVO SANTA JUANA DE LA UNION VECINAL N°8,ESCUELA DE FUTBOL SAMTA JUANA INFANTIL ,"$4,000,000.00",,
1844,REND ,2401AM0181,18-12-2024,18-12-2024,19-12-2024,GRUPO DE ADULTO MAYOR MANANTIAL DE ARCOIRIS ,SALIDA PATRIMONIAL Y CULTURAL DEL CAM MANANTIAL DE ARCOIRIS,"$1,958,310.00",,
1845,SUBS ,2401AM0181,19-12-2024,19-12-2024,19-12-2024,GRUPO DE ADULTO MAYOR MANANTIAL DE ARCOIRIS ,SALIDA PATRIMONIAL Y CULTURAL DEL CAM MANANTIAL DE ARCOIRIS,$0.00,,
1846,REND ,2401SC0074,18-12-2024,18-12-2024,19-12-2024,JUNTA DE VECINOS EL SALTILLO ,UN SALTILLO DE LUZ Y SEGURIDAD ,"$2,373,250.00",,
1847,REND ,2401SC0540,16-12-2024,18-12-2024,19-12-2024,JUNTA DE VECINOS CHANCO ,MEJORANDO LA SEGURIDAD Y PREVENCION EN EL SECTOR DE CHANCO ,"$3,775,000.00",,
1848,REND ,2401SC0131,17-12-2024,18-12-2024,19-12-2024,JUNTA DE VECINOS COPIULEMU ,COPIULEMU MAS ILUMINADO ,"$3,587,000.00",,
1849,REND ,2401SC0149,17-12-2024,18-12-2024,19-12-2024,JUNTA DE VECINOS EL MOLINO ,ILUMINANDO MI COMUNIDAD EL MOLINO ,"$3,894,894.00",,
1850,REND ,2401SC0130,18-12-2024,18-12-2024,19-12-2024,COMITE DE VIVIENDA BUCHUPUREO ,ILUMINANDO NUESTRO SECTOR COMITE DE VIVIENDA BUCHUPUREO ,"$3,374,396.00",,
1851,REND ,2401SC0286,18-12-2024,18-12-2024,19-12-2024,COMITE DE AGUA POTABLE SECTORES DE SAN JOSE-LA ACHIRA ,COMITE DE AGUA POTABLE RURAL DE SEGURIDAD CON EXTINTORES ,"$3,735,240.00",,
1852,REND ,2401S0045,9-12-2024,18-12-2024,19-12-2024,SINDICATO DE TRABAJADORES INDEPENDIENTES DE RECOLECTORES DE ORILLA DEMAR SECTOR SUR-COLMUYAO ,LOS RECOLECTTORES DE ORILLA DE MAS SECTOR SUR-COLMUYAO: DEL MAR A LA MESA ,"$2,990,300.00",,
1853,REND ,2401C0054,11-12-2024,18-12-2024,19-12-2024,JUNTA DE VECINOS NEGUINTO ,PEÑA FOLCLORICA EN NEGUINTO ,"$2,497,600.00",,
1854,REND ,2401C0012,17-12-2024,18-12-2024,19-12-2024,JUNTA DE VECINOS LOS MAQUIS BAJOS ,TERCERA FERIA CAMPESINA DE LA PAPA EN LOS MAQUIS BAJO ,"$2,305,230.00",,
1855,REND ,2401C0156,17-12-2024,18-12-2024,19-12-2024,JUNTA DE VECINOS LOS MAQUIS ALTO ,SABORES DE NUESTRA TIERRA ,"$1,602,538.00",,
1856,SUBS ,2401C0173,18-12-2024,18-12-2024,19-12-2024,JUNTA DE VECINOS VILLA EL BOSQUE ,MAS IDENTIDAD A NUESTRA VILLA ,$0.00,,
1857,SUBS ,2401SC0079,16-12-2024,18-12-2024,19-12-2024,JUNTA DE VECINOS AMPLIACION 18 DE SEPTIEMBRE ,CAMARAS DE SEGURIDAD PARA JUNTA DE VECINOS AMPLIACION 18 DE SEPTIEMBRE ,$0.00,,
1858,REND ,2401D0138,13-12-2024,18-12-2024,19-12-2024,CLUB DEPORTIVO FUTURO ALEGRE ,EQUIPADOS Y LISTOS PARA CAMPEONAR ,"$1,515,590.00",,
1859,REND ,2401S0007,18-12-2024,18-12-2024,19-12-2024,JUNTA DE VECINOS RELBUN ,COCINA EQUIPADA RELBUN ,"$2,947,739.00",,
1860,SUBS ,2301S0159,17-12-2024,18-12-2024,19-12-2024,COMITE FEMENINO LAS ARAÑITAS DE LA VEGA ,COSTUREANDO NOS GENERAMOS UNA NUEVA OPORTUNIDAD ,$0.00,,
