SUBVENCIONES 2024,,,,,,,,,,
,,,,,,,,,,
,,,,,,,,,,
CORRELATIVO,TIPO DOCUMENTO,CÓDIGO,FECHA DCTO,FECHA INGRESO,FECHA ENTREGA ,NOMBRE INSTITUCIÓN ,NOMBRE DE LA INICIATIVA,MONTO DE LA RENDICIÓN,RECEPCIONADO POR,FIRMA
s/n,REND,2301C0179,26-abr-24,26-abr-24,3-may-24,CENTRO DE PADRES Y APODERADOS ESCUELA MONTE BLANCO ,GRAN FIESTA COSTUMBRISTA ,"$2,350,180.00",FERNANDO RIQUELME ,
s/n,REND,2301M092,23-abr-24,26-abr-24,3-may-24,JUNTA DE VECINOS PIEDRAS MAULE,ILUMINA Y CONCIENTIZA CON PIEDRAS MAULE,"$2,948,620.00",FERNANDO RIQUELME ,
s/n,REND,2301M0080,18-mar-24,26-abr-24,3-may-24,JUNTA DE VECINOS CANTA RANA,CANTA RANA CUIDA EL MEDIO AMBIENTE,"$2,946,640.00",FERNANDO RIQUELME ,
s/n,REND,2301D0261,24-abr-24,26-abr-24,3-may-24,CLUB DE BOCCIAS PEMUCO,CAMPEONATO REGIONAL BOCCIAS FRONTON,"$1,760,000.00",FERNANDO RIQUELME ,
s/n,REND,2301M066,22-ene-24,26-abr-24,3-may-24,JUNTA DE VECINOS SAN IGNACIO DE LOYOLA,"MENOS BASURA, MAS VIDA: INICIATIVA DE CONTENEDORES","$2,832,000.00",FERNANDO RIQUELME ,
s/n,REND,2301D0115,1-abr-24,26-abr-24,3-may-24,CLUB DE SURF BUCHUPUREO,SURF COMO ACTIVIDAD FISICA EN COBQUECURA,"$2,988,932.00",FERNANDO RIQUELME ,
s/n,REND,2301D0251,26-abr-24,26-abr-24,3-may-24,CLUB DEPORTIVO DE CICLISMO MTB PEMUCO,FORMACION DE FUTUROS CICLISTAS PARA LA COMUNA DE PEMUCO,"$3,000,000.00",FERNANDO RIQUELME ,
1,REND.,2301D0255,29-abr-24,29-abr-24,30-abr-24,CLUB DE AJEDREZ CHILLAN VIEJO,TALLERES Y COMPETENCIA PROFESIONAL,"$2,213,150.00",FERNANDO RIQUELME ,
2,REND.,2301AM0186,S/F,29-abr-24,30-abr-24,CLUB ADULTO ESPERANZA DE LA COSTA,POR UN ADULTO MAYOR DE LA COSTA MAS SALUDABLE,"$1,524,662.00",FERNANDO RIQUELME ,
3,REND.,2301AM0195,S/F,29-abr-24,30-abr-24,CLUB DE ADULTO MAYOR GRACIAS A LA VIDA,REACTIVANDO EL DEPORTE CON GRACIAS A LA VIDA,"$1,578,781.00",FERNANDO RIQUELME ,
4,REND.,2301D0108,S/F,29-abr-24,30-abr-24,CLUB DEPORTIVO CATÓLICA DE TEMUCO,TARDE DEPORTIVA DE FUTBOL,"$1,726,000.00",FERNANDO RIQUELME ,
5,REND.,2301D0091,29-abr-24,29-abr-24,30-abr-24,UNION COMUNAL DE CLUBES DEPORTIVOS DE PEMUCO,ENCUENTRO FUTBOLISTICO DE CLUBES DEPORTIVOS,"$2,182,460.00",FERNANDO RIQUELME ,
6,REND.,2301AM0207,26-abr-24,29-abr-24,30-abr-24,CLUB ADULTO MAYOR AÑOS LOS HERMOSOS,CREANDO EN MIS AÑOS HERMOSOS,"$2,005,756.00",FERNANDO RIQUELME ,
7,REND.,2301AM0189,29-abr-24,29-abr-24,30-abr-24,CLUB DE ADULTO MAYOR LOS AÑOS DORADOS DE COELEMU,MULTI-TALLERES MIS AÑOS DORADOS,"$1,994,500.00",FERNANDO RIQUELME ,
8,REND.,2301AM0220,26-abr-24,29-abr-24,30-abr-24,CLUB ADULTO MAYOR LA EDAD DORADA,NOS VESTIMOS PARA HACER DEPORTE,"$1,820,019.00",FERNANDO RIQUELME ,
9,REND.,230150034,29-abr-24,,30-abr-24,JUNTA DE VECINOS LEONERA,LEONERA CUIDA A SUS MASCOTAS,"$2,880,001.00",FERNANDO RIQUELME ,
10,REND.,2301D0106,29-abr-24,29-abr-24,30-abr-24,CDSC BASQUETBOL COELEMU,NUEVOS BASQUETBOLISTAS PARA COELEMU,"$2,571,198.00",FERNANDO RIQUELME ,
11,ANEXO DE RENDICION,2301SP0193,,29-abr-24,30-abr-24,JJVV HUENUTIL CENTRO,ALARMAS COMUNITARIAS HUENUTIL CENTRO,,FERNANDO RIQUELME ,
12,REND.,2301D0169,29-abr-24,29-abr-24,30-abr-24,CLUB DEPORTIVO SAN MIGUEL CENTRAL,ESCUELA DE FUTBOL SAN MIGUEL CENTRAL,"$3,000,000.00",FERNANDO RIQUELME ,
13,REND.,2301M0058,26-abr-24,29-abr-24,30-abr-24,CENTRO DE PADRES ESCUELA BÁSICA PUEBLO SECO,CUIDEMOS EL MEDIO AMBIENTE A TRAVES DE LA SUSTENTABILIDAD,"$2,993,937.00",FERNANDO RIQUELME ,
14,REND.,2301SP0290,30-abr-24,29-abr-24,30-abr-24,COMITÉ APR AGUAS LINDAS,PREVENCION DEFICIT HIDRICO DE QUILLAHUE,"$4,500,000.00",FERNANDO RIQUELME ,
15,REND.,2301SP0360,29-abr-24,29-abr-24,30-abr-24,JJVV VILLA PRAT,SEGURIDAD VECINAL VILLA PRAT,"$4,496,251.00",FERNANDO RIQUELME ,
16,REND.,2301AM0076,29-abr-24,29-abr-24,30-abr-24,CLUB ADULTO MAYOR SURCO Y SEMILLA,SALUD MENTAL Y EMOCIONAL COMO EJE DE NUESTRO PROYECTO DE VIDA,"$1,731,102.00",FERNANDO RIQUELME ,
17,REND.,2301SP0449,S/F,29-abr-24,30-abr-24,JJVV VILLA LOS EVANGELISTAS,VIGILANCIA Y SEGURIDAD LOS EVANGELISTAS,"$4,425,838.00",FERNANDO RIQUELME ,
18,REND.,2301M0042,27-abr-24,29-abr-24,30-abr-24,JJVV SUIZA ,MANEJO DE RESIDUOS DOMICILIARIOS Y COMPRA DE CONTENEDORES EN JJVV SUIZA,"$2,750,230.00",FERNANDO RIQUELME ,
19,REND.,2301AM0183,17-abr-24,29-abr-24,30-abr-24,COMITÉ ADULTO MAYOR MANOS UNIDAS EN FAMILIA,ENTRENANDO LAS HABILIDADES COGNITIVAS,"$1,911,050.00",FERNANDO RIQUELME ,
20,REND.,2301D0023,26-abr-24,29-abr-24,30-abr-24,CLUB DEPORTIVO COLO COLO SAN NICOLAS,CUADRANGULAR DEPORTIVO CLUB DEPORTIVO COLO COLO SAN NICOLÁS,"$1,580,400.00",JUAN PARADA,
21,REND.,2301EG0072,29-abr-24,29-abr-24,30-abr-24,ASOCIACION INDIGENA WENGAMEN,BORDANDO SIMBOLOS ANCESTRALES 2,"$3,000,000.00",JUAN PARADA,
22,REND.,2301C0182,25-abr-24,29-abr-24,30-abr-24,JJVV LARQUI PONIENTE 9-R,III VERSION DE FIESTA CRIOLLA DE LA CAZUELA DE CAMPO,"$2,350,102.00",JUAN PARADA,
23,REND.,2301C0080,29-abr-24,29-abr-24,30-abr-24,CORPORACION ALICO,REVISTA ALICO: HISTORIA CULTURA Y TRADICIONES  DE SAN FABIÁN,"$5,939,235.00",JUAN PARADA,
24,SUBS,2301SP0025,S/F,29-abr-24,30-abr-24,JJVV LA ESPERANZA,NUEVA VIDA LA ESPERANZA,,JUAN PARADA,
25,SUBS,2301AM0057,25-abr-24,29-abr-24,30-abr-24,UNION COMUNAL DE ADULTOS MAYORES,LOS PLATOS TIPICOS VI VERSION 2023,,JUAN PARADA,
26,REND.,2301AM0041,29-abr-24,29-abr-24,30-abr-24,CLUB ADULTO MAYOR LA ERA ENCANTADA,ENVEJECIMIENTO ACTIVO DE PERSONAS MAYORES DEL CLUB DE ADULTO MAYOR LA ERA ENCANTADA  DE LA LOCALIDAD DE PULLAY DE LA COMUNA DE COBQUECURA,"$1,864,890.00",JUAN PARADA,
27,SUBS,2301D0124,25-abr-24,29-abr-24,30-abr-24,CLUB DEPORTIVO SOCIAL Y CULTURAL EL ORATORIO,CLUB DEPORTIVO SOCIAL Y CULTURAL EL ORATORIO JUEGA CAMPEONATO DE FUTBOL LIGA ANDABA SAN NICOLAS,,JUAN PARADA,
28,REND.,2301AM0129,26-abr-24,29-abr-24,30-abr-24,UNION COMUNAL ADULTO MAYOR PINTO,VIAJANDO DE CORDILLERA A MAR,"$1,400,020.00",JUAN PARADA,
29,REND.,2301AM0142,26-abr-24,29-abr-24,30-abr-24,CLUB ADULTO MAYOR LOS COPIHUES,TRAVESIA DE LA HISTORIA Y RECREACIÓN,"$1,419,952.00",JUAN PARADA,
30,REND.,2301C0059,27-abr-24,29-abr-24,30-abr-24,AGRUPACIÓN CULTURAL CIRCULO LITERARIO COELEMU,POESIAS Y EN-CANTOS DE COELEMU ,"$3,500,015.00",JUAN PARADA,
31,REND.,2301SP0255,S/F,29-abr-24,30-abr-24,JJVV ROBINSON RAMIREZ,VILLA ROBINSON RAMIREZ UN ENTORNO MAS SEGURO,"$4,463,237.00",JUAN PARADA,
32,REND.,2301SP0349,24-abr-24,29-abr-24,30-abr-24,COMITÉ DE ADELANTO LA MORTANDAD,SIN EXTINTORES LOS RIESGOS DE INCENDIOS SON MAYORES,"$1,104,497.00",JUAN PARADA,
33,REND.,2301C0036,29-abr-24,29-abr-24,30-abr-24,CLUB DE CUECA HERNÁN TRONCOSO,ALMA Y FOLCLORE EN LA TIERRA DE NICANOR,"$3,129,280.00",JUAN PARADA,
34,REND.,2301M0015,10-abr-24,29-abr-24,30-abr-24,JJVV PASO ANCHO ,PASO ANCHO CUIDA Y PROTEGE SU MEDIO AMBIENTE,"$2,933,770.00",JUAN PARADA,
35,REND.,2301M0047,10-abr-24,29-abr-24,30-abr-24,COMITÉ DE ADELANTO LOS TORONJILES,POR UN BARRIO MAS LIMPIO ,"$2,439,495.00",JUAN PARADA,
36,REND.,2301M0028,10-abr-24,29-abr-24,30-abr-24,COMITÉ DE ADELANTO TRABUNCURA,NUESTRO ENTORNO LIMPIO Y SEGURO,"$2,349,596.00",JUAN PARADA,
37,REND.,2301EG0043,19-abr-24,29-abr-24,30-abr-24,COMITÉ FEMENINO SANTA TERESITA,ENTRE ENHEBRES Y REMIENDOS DISEÑAMOS EL FUTURO,"$3,150,377.00",JUAN PARADA,
38,REND.,2301EG0105,12-abr-24,29-abr-24,30-abr-24,UNION COMUNAL FEMENINA ,TRENZANDO ANHELOS DE INNOVACION Y ESPERANZA,"$2,830,000.00",JUAN PARADA,
39,REND.,2301EG0047,12-abr-24,29-abr-24,30-abr-24,COMITÉ FEMENINO SOL NACIENTE,SOBRE RETAZOS Y TEXTURAS SE POSA EL SOL NACIENTE ,"$2,981,047.00",JUAN PARADA,
40,REND.,2301EG0035,19-abr-24,29-abr-24,30-abr-24,AGRUPACION DE ARTESANOS EL PUELCHE,AL FRAGOR DEL PUELCHE URDIMOS NUESTROS SUEÑOS,"$2,901,150.00",JUAN PARADA,
41,REND.,2301M0025,10-abr-24,29-abr-24,30-abr-24,JJVV TRABUNCURA,CUIDEMOS NUESTRA TIERRA TODOS SOMOS PARTE DE LA NATURALEZA,"$2,865,429.00",JUAN PARADA,
42,REND.,2301SP0339,30-abr-24,29-abr-24,30-abr-24,COMITÉ PRO ADELANTO VILLA QUILLON,COMITÉ PRO ADELANTO MAS SEGURO,"$4,495,003.00",JUAN PARADA,
43,REND.,2301SP0202,9-abr-24,29-abr-24,30-abr-24,JJVV VALLE TEMPLADO,DUERMO TRANQUILO JUNTO A MI ALARMA VALLE TEMPLADO,"$4,500,003.00",JUAN PARADA,#REF!
44,REND.,2301AM0147,S/F,29-abr-24,30-abr-24,CLUB DE ADULTO MAYOR RENACER,RENACIENDO DE MANERA SALUDABLE,"$1,717,784.00",,
45,REND.,2301AM0185,18-mar-24,29-abr-24,30-abr-24,CLUB ADULTO MAYOR BROTES DE ESPERANZA,RITMOS TRADICIONALES; PASOS QUE UNEN NUESTRAS RAÍCES,"$1,708,344.00",,
46,REND.,2301C0201,26-abr-24,29-abr-24,30-abr-24,CLUB CULTURAL Y DEPORTIVO ARTURO PRAT CHACON,"CUENTOS, HISTORIA Y MITOS DE COIHUECO","$1,800,000.00",,
47,REND.,2301S0067,S/F,29-abr-24,30-abr-24,JJVV ALTO PERALES,RECUPERANDO LA CONVIVENCIA SIN VIOLENCIA,"$2,889,960.00",,
48,REND.,2301EG0016,S/F,29-abr-24,30-abr-24,GRUPO AGROECOLOGICO GOTAS DE AGUA,RECUPERANDO LA AGRICULTURA FAMILIAR,"$2,873,099.00",,
49,REND.,2301EG0055,S/F,29-abr-24,30-abr-24,AGRUPACIÓN DE MUJERES FLOR DE PRIMAVERA,LA PRIMAVERA MAS DULCE EN MEIPO,"$2,794,650.00",,
50,REND.,2301EG0034,S/F,29-abr-24,30-abr-24,COMITÉ AGROECOLOGICO LAS SEMILLITAS,RECUPERANDO EL TEJIDO CON AMOR ,"$2,932,147.00",,
51,REND.,2301EG0037,S/F,29-abr-24,30-abr-24,UNION COMUNAL DE GRUPOS AGROECOLOGICOS,FOMENTANDO LA AGRICULTURA FAMILIAR,"$2,990,858.00",,
52,REND.,2301D0054,30-abr-24,30-abr-24,30-abr-24,CLUB DEPORTIVO DE TAEKWONDO ESPIRITU INDOMABLE DE CHILLAN,CAMPEONATO REGIONAL DE TAEKWONDO,"$1,800,000.00",,
53,REND.,2301C0127,30-abr-24,30-abr-24,30-abr-24,ASOCIACION INDIGENA PETU MONGELEIÑ,RESCATANDO NUESTRA CULTURA EN LANAS,"$2,318,487.00",,
54,REND.,2301SP0160,S/F,29-abr-24,30-abr-24,COMITÉ DE EMERGENCIA Y SOCIAL DE RANGUELMO,PREPARANDO LA COMUNIDAD SIN INCENDIO,"$3,733,960.00",,
55,REND.,2301EG0013,S/F,29-abr-24,30-abr-24,AGRUPACION DE MUJERES SABIAS DE RANGUELMO,MAS SABIDURIA MAS COSTURA,"$2,697,580.00",,
56,REND.,2301C0069,S/F,29-abr-24,30-abr-24,JJVV MEIPO N11,2DA VERSION FIESTA DEL LIMON DE MEIPO Y PANGUE,"$2,500,000.00",,
57,REND.,2301C0138,15-abr-24,29-abr-24,30-abr-24,CLUB DE HUASOS CHILENOS SANTA RITA,CABALGATA DE FE,"$2,483,198.00",,
58,REND.,2301EG0042,24-abr-24,29-abr-24,30-abr-24,MESA DE LA MUJER CAMPESINA DE ÑIQUEN,MUJERES CAMPESINAS DE ÑIQUEN AUTONOMAS,"$2,048,751.00",,
59,REND.,2301AM0092,23-abr-24,29-abr-24,30-abr-24,CLUB ADULTO MAYOR AVANCEMOS UNIDOS DE LA GLORIA,"AVANZANDO UNIDOS, RESCATAMOS NUESTRAS TRADICIONES","$1,879,001.00",,
60,REND.,2301EG0045,23-abr-24,29-abr-24,30-abr-24,ORGANIZACIÓN DE MUJERES LAS FRUTILLAS DE LA GLORIA,FRUTILLITAS AUTONOMAS,"$1,874,879.00",,
61,REND.,2301AM0117,22-abr-24,29-abr-24,30-abr-24,CLUB DE ADULTO MAYOR QUELTEHUE,EMOCIONES POSITIVAS EN EL ADULTO MAYOR,"$1,649,281.00",,
62,REND.,2301AM0104,25-abr-24,29-abr-24,30-abr-24,CLUB DE ADULTO MAYOR FLOR EN PRIMAVERA DE HUENUTIL,"TELARES CON FLORES DE PRIMAVERA, SEGUNDA PARTE","$1,729,951.00",,
63,REND.,2301S0130,29-abr-24,29-abr-24,30-abr-24,FUNDACION YO TE CREO,"APOYO E INCLUSION PARA NIÑOS EN CONDICION TEA, COMUNA DE BULNES","$2,937,500.00",,
64,SUBS.,2301D0040,29-abr-24,29-abr-24,30-abr-24,CLUB DEPORTIVO FEMENINO LAS AGUILAS DE PINTO.,CUADRANGULAR FEMENINO MUJER Y DEPORTE EN ÑUBLE,,,
65,REND.,2301SP0440,29-abr-24,29-abr-24,30-abr-24,COMITÉ DE ADELANTO Y DESARROLLO VILLA OLIMPICA,VILLA OLIMPICA SEGURA ,"$4,456,850.00",FERNANDO RIQUELME ,
66,REND.,2301AM0032,29-abr-24,29-abr-24,30-abr-24,GRUPO DE ADULTO MAYOR RENOVANDO JUVENTUD,TALLER DE MOVILIDAD FISICA E HIDROTERAPIA PARA EL ADULTO MAYOR,"$1,600,991.00",FERNANDO RIQUELME ,
67,REND.,2301D0120,25-abr-24,29-abr-24,30-abr-24,CLUB DEPORTIVO HERNAN BRAÑAS,SEMBRANDO OPORTUNIDADES II,"$2,195,300.00",FERNANDO RIQUELME ,
68,REND.,2301M0029,23-abr-24,29-abr-24,30-abr-24,CENTRO DE PADRES Y APODERADOS ESCUELA EL SAUCE,SEMILLITAS EL SAUCE,"$2,794,762.00",FERNANDO RIQUELME ,
69,REND.,2301D0117,23-abr-24,29-abr-24,30-abr-24,CLUB DEPORTIVO EL MOLINO,ESCUELA DE FUTBOL PARA NIÑOS DE JOVENES DE LA COMUNA DE COBQUECURA,"$2,365,480.00",FERNANDO RIQUELME ,
70,REND.,2301D0183,23-abr-24,29-abr-24,30-abr-24,CLUB DEPORTIVO NACIONAL DE CATO,EL CLUB DEPORTIVO CATO PROMUEVE E INCENTIVA LA PARTICIPACION EN EL CAMPEONATO DE FUTBOL RURAL 2023,"$1,800,001.00",FERNANDO RIQUELME ,
71,REND.,2301D0288,22-abr-24,29-abr-24,30-abr-24,CLUB DEPORTIVO SOCIAL Y CULTURAL COMUNIDAD INTEGRADA,PRIMER ENCUENTRO DE FUTBOL COIHUECO 2023,"$3,000,001.00",FERNANDO RIQUELME ,
72,REND.,2301D0295,19-abr-24,29-abr-24,30-abr-24,CONSEJO LOCAL DE DEPORTES DE CHILLAN,EL COLODEP CHILLAN PROMUEVE Y FORTALECE LA ACTIVIDAD FISICA A TRAVES DE LA NATACION,"$3,996,000.00",FERNANDO RIQUELME ,
73,REND.,2301D0136,29-abr-24,29-abr-24,30-abr-24,CLUB DEPORTIVO AEROBICAS LAS VENCEDORAS,AL RITMO DE LA ZUMBA LAS VENCEDORAS MEJORAN SU CALIDAD DE VIDA,"$1,792,861.00",FERNANDO RIQUELME ,
74,REND.,2301SP0268,29-abr-24,29-abr-24,30-abr-24,JJVV VILLA DOÑA FRANCISCA LAS MARIPOSAS,INSTALACION DE CAMARAS DE VIGILANCIA PARA LA VILLA DOÑA FRANCISCA 1 Y 2,"$4,446,999.00",FERNANDO RIQUELME ,
75,REND.,2301SP0553,24-abr-24,29-abr-24,30-abr-24,JJVV CLAUDIO ARRAU,TODOS UNIDOS Y PROTEGIDOS ,"$4,499,995.00",FERNANDO RIQUELME ,
76,REND.,2301AM0155,10-abr-24,29-abr-24,30-abr-24,CLUB ADULTOS MAYORES LOS COPIHUES,NUNCA ES TARDE PARA VIAJAR Y SANAR,"$1,769,000.00",FERNANDO RIQUELME ,
77,REND.,2301AM0227,26-abr-24,29-abr-24,30-abr-24,CLUB ADULTO MAYOR SOL NACIENTE,TERAPIAS FISICAS Y EMOCIONALES,"$1,932,500.00",FERNANDO RIQUELME ,
78,REND.,2301C0155,26-abr-24,29-abr-24,30-abr-24,AGRUPACION FOLCLORICA ANDALICAN,BAILANDO Y DANZANDO CON ANDALICAN,"$3,450,001.00",FERNANDO RIQUELME ,
79,REND.,2301AM0073,16-abr-24,29-abr-24,30-abr-24,CLUB ADULTO MAYOR TRES ESQUINAS,VIAJANDO SANAMENTE,"$1,509,688.00",FERNANDO RIQUELME ,
80,REND.,2301AM0110,16-abr-24,29-abr-24,30-abr-24,GRUPO ADULTO MAYOR LAS VIOLETAS,MANOS CREATIVAS,"$1,959,450.00",FERNANDO RIQUELME ,
81,REND.,2301SP0455,29-abr-24,29-abr-24,30-abr-24,JJVV PABLO NERUDA,"POR UN BARRIO SEGURO, OCUPA TU ALARMA","$4,185,000.00",FERNANDO RIQUELME ,
82,REND.,2301SP0444,S/F,29-abr-24,30-abr-24,JJVV POBLACION BARTOLUCCI,CUIDANDO A NUESTROS VECINOS Y VECINAS,"$4,446,999.00",FERNANDO RIQUELME ,
83,REND.,2301D0276,29-abr-24,29-abr-24,30-abr-24,CLUB PATINAJE ARTISTICO SOCIAL CULTURAL Y DEPORTIVO AYUWN,PATINA Y VIVE SANO… AYUWN PROMOVIENDO EL DEPORTE EN LOS ESTUDIANTES DE LA REGION DE ÑUBLE,"$2,999,640.00",FERNANDO RIQUELME ,
84,REND.,2301SP0168,29-abr-24,29-abr-24,30-abr-24,COMITÉ DE ADELANTO Y DESARROLLO LOS ALTOS AMANECER DE PORTEZUELO,DISUADIENDO LOS DELITOS DE NUESTRA COMUNIDAD ,"$3,791,750.00",FERNANDO RIQUELME ,
85,SUBS.,2301S0147,S/F,29-abr-24,30-abr-24,MESA INTERSECTORIAL DE PERSONAS MAYORES DE BULNES,APOYO SOCIO SANITARIO A PERSONAS MAYORES VULNERABLES DE LA COMUNA DE BULNES,,FERNANDO RIQUELME ,
86,REND.,2301D0155,29-abr-24,29-abr-24,30-abr-24,CLUB DEPORTIVO SOCIAL Y CULTURAL TAEKWONDO KIMS ÑUBLE,FORMACION Y CRECIMIENTO INTEGRAL DE DEPORTISTAS POR MEDIO DE LA ESCUELA DEPORTIVA DE TAEKWONDO,"$2,278,000.00",FERNANDO RIQUELME ,
87,REND.,2301SP0047,29-abr-24,30-abr-24,2-may-24,JJVV SAN MIGUEL DE ARCÁNGEL,IMPLEMENTACION DE CAMARAS DE VIGILANCIA EN VILLA SAN MIGUEL DE ARCÁNGEL,"$4,499,990.00",JUAN PARADA,
88,REND.,2301C0170,30-abr-24,30-abr-24,2-may-24,"JJVV N3 SAN MIGUEL, COMUNA DE SAN IGNACIO",TALLER DE GUITARRA CON RAICES FOLCLORICAS DE CHILE,"$2,249,630.00",JUAN PARADA,
89,REND.,2301SP0378,29-abr-24,30-abr-24,2-may-24,JJVV TOQUIHUA,TOQUIHUA VIGILADO,"$4,481,814.00",JUAN PARADA,
90,REND.,2301SP0158,29-abr-24,30-abr-24,2-may-24,JJVV LA UNION DEL SUR,CONTROL DE INCENDIOS EN LA UNION NINQUIHUE,"$4,500,000.00",JUAN PARADA,
91,REND.,2301SP0258,25-abr-24,29-abr-24,2-may-24,JJVV PURALIHUE,PURALIHUE CON ENERGIA SUSTENTABLE TODO EL AÑO,"$3,749,300.00",JUAN PARADA,
92,REND.,2301EG0083,26-abr-24,29-abr-24,2-may-24,CENTRO DE MADRES LAS VIOLETAS DE  DENECAN,CONFECCIONANDO SUEÑOS,"$3,000,000.00",JUAN PARADA,
93,REND.,2301D0118,26-abr-24,29-abr-24,2-may-24,CLUB DEPORTIVO BOCA ITATA AZUL,CUADRANGULAR DE FUTBOL AZUL,"$1,727,780.00",JUAN PARADA,
94,REND.,2301EG0110,S/F,29-abr-24,2-may-24,UNION COMUNAL MUJERES LAUTARO,AUTONOMIA FINANCIERA,"$3,002,950.00",JUAN PARADA,
95,REND.,2301M0031,26-abr-24,29-abr-24,2-may-24,CENTRO GENERAL DE PADRES Y APODERADOS ESCUELA ESPECIAL DE LENGUAJE,CRECIENDO CON CONCIENCIA VERDE LIMPIA,"$1,804,893.00",JUAN PARADA,
96,REND.,2301S0069,17-abr-24,29-abr-24,2-may-24,JJVV EL AROMO,DULCES TRADICIONES EL AROMO,"$3,000,401.00",JUAN PARADA,
97,REND.,2301AM124,24-abr-24,29-abr-24,2-may-24,CAM LA RIBERA DEL ITATA ,EDUCACION NUTRICIONAL PARA CAM LA RIBERA DEL ITATA,"$1,882,200.00",JUAN PARADA,
98,REND.,2301AM0020,25-abr-24,29-abr-24,2-may-24,LA ALEGRIA DE VIVIR EN CAÑA DULCE,LA ALEGRIA DE EJERCITARNOS EN CAÑA DULCE,"$1,760,992.00",JUAN PARADA,
99,REND.,2301D0246,29-abr-24,29-abr-24,2-may-24,CLUB DE RAYUELA SAN IGNACIO,SEGUNDO TORNEO DE RAYUELA VERANIEGO,"$1,636,000.00",JUAN PARADA,
100,REND.,2301D0101,S/F,29-abr-24,2-may-24,CLUB DEPORTIVO EL SAUCE,PARTICIPANDO POR EL CAMPEONATO DE FUTBOL DEL ALFUR,,JUAN PARADA,
101,REND.,2301EG003,S/F,29-abr-24,2-may-24,COMITÉ CAMPESINO SAN PEDRO EL PILME,PILME LUCHA POR LA EQUIDAD DE GÉNERO,"$2,387,950.00",JUAN PARADA,
102,REND.,2301D0045,29-abr-24,29-abr-24,2-may-24,CLUB DEPORTIVO LOS MAYOS,IMPLEMENTANDO AL CLUB DEPORTIVO ,"$1,800,000.00",JUAN PARADA,
103,REND.,2301SP0292,24-abr-24,29-abr-24,2-may-24,UNION COMUNAL DE JUNTAS DE VECINOS RURAL - SECTOR SUR QUILLON,"COMUNICANDONOS POR TU SEGURIDAD, A TRAVES DE UN SISTEMA DE RADIOCOMUNICACION UNION COMUNAL","$4,495,003.00",JUAN PARADA,
104,REND.,2301AM0024,S/F,29-abr-24,2-may-24,CLUB ADULTO MAYOR MARIA DE LA MERCED,CANTOS Y DANZAS CON EL ADULTO MAYOR,"$1,962,894.00",JUAN PARADA,
105,REND.,2301D0026,S/F,29-abr-24,2-may-24,LIGA ANDABA OHIGGINS CH. VIEJO,MEJORAMIENTO DE RECURSOS PARA LA LIGA ANDABA OHIGGINS DE CHILLAN VIEJO ,,JUAN PARADA,
106,REND.,2301D0296,S/F,29-abr-24,2-may-24,CLUB DEPORTIVO SAN IGNACIO,PRIMERA ESCUELA DE FUTBOL SAN IGNACIO,"$2,874,370.00",JUAN PARADA,
107,REND.,2301SP0187,S/F,29-abr-24,2-may-24,"JJVV N16 SUR PONIENTE ""EL TEJAR""",MEJORANDO LA SEGURIDAD DEL SECTOR,"$4,458,245.00",JUAN PARADA,
108,REND.,2301D0310,29-abr-24,29-abr-24,2-may-24,CENTRO DE PADRES Y APODERADOS DINABEC COLLEGE,CORRIDA FAMILIAR POR UNA VIDA EN MOVIMIENTO,"$1,764,000.00",JUAN PARADA,
109,REND.,2301D0049,29-abr-24,29-abr-24,2-may-24,CLUB DEPORTIVO ARTURO PRAT DE NINHUE,ESCUELA DE FUTBOL ARTURO PRAT 2023,"$2,897,760.00",JUAN PARADA,
110,REND.,2301S0044,5-abr-24,29-abr-24,2-may-24,UNION DE DISCAPACITADOS DE NINHUE,DESDE LA INCLUSION SE COCINA MEJOR,"$2,997,600.00",JUAN PARADA,
111,REND.,2301AM0161,2-abr-24,29-abr-24,2-may-24,CLUB DE ADULTO MAYOR MARIA ELENA VALDES,EL CLUB DE ADULTO MAYOR MARIA ELENA VALDES SE REJUVENECE EN LAS TERMAS,"$1,991,004.00",JUAN PARADA,
112,REND.,2301AM0018,4-mar-24,29-abr-24,2-may-24,CLUB DE ADULTO MAYOR JUAN PABLO II DE COYANCO,ALIMENTANDO EL ALMA SALUDABLEMENTE,"$1,974,790.00",JUAN PARADA,
113,REND.,2301AM0203,17-abr-24,29-abr-24,2-may-24,CLUB DE ADULTO MAYOR DE CHEQUEN,DULZURA SALUDABLE PARA LOS ADULTOS MAYORES DE CHEQUEN,"$1,996,003.00",JUAN PARADA,
114,REND.,2301S0049,25-abr-24,29-abr-24,2-may-24,COMITÉ DE MANUALIDADES LAS HORMIGUITAS,COCIENDO COMO HORMIGUITAS,"$2,807,780.00",JUAN PARADA,
115,REND.,2301D0211,26-abr-24,29-abr-24,2-may-24,CLUB DEPORTIVO UNION SANTA INES,"ESCUELA DE FUTBOL SANTA INES ""SEMILLERO DE CAMPEONES""","$2,985,100.00",JUAN PARADA,
116,REND.,2301D0306,29-abr-24,29-abr-24,2-may-24,CLUB DEPORTIVO EL CALVARIO,ESCUELA DE FUTBOL FORMATIVA EL CALVARIO,"$2,900,000.00",JUAN PARADA,
117,REND.,2301SP0226,29-abr-24,29-abr-24,2-may-24,JJVV LA HORCA ,EN LA HORCA JUNTOS DERROTAMOS LA DELINCUENCIA,"$4,108,650.00",JUAN PARADA,
118,REND.,2301AM0013,25-abr-24,29-abr-24,2-may-24,UNION COMUNAL ADULTO MAYOR QUIRIHUE,LA VEJEZ TIENE SUS PLACERES,"$1,849,000.00",JUAN PARADA,
119,REND.,2301EG0006,26-abr-24,29-abr-24,2-may-24,AGRUPACION DE MUJERES LAS MANZANITAS,SEGUNDA VIDA DE TELAS,"$1,299,452.00",JUAN PARADA,
120,REND.,2301EG0044,24-abr-24,29-abr-24,2-may-24,AGRUPACION DE MUJERES CAMPESINAS,EMPRENDIMIENTO DE MUJERES DE QUIRIHUE ,"$2,158,530.00",JUAN PARADA,
121,REND.,2301C0037,29-abr-24,29-abr-24,2-may-24,JJVV LA QUEBRADA PACHAGUA,SEXTA VERSION DE LA FERIA DE LA VENDIMIA CAMPESINA EN LA QUEBRADA DE PACHAGUA,"$2,500,000.00",JUAN PARADA,
122,REND.,2301EG0012,15-abr-24,29-abr-24,2-may-24,"AGRUPACION SOCIAL, CULTURAL Y DEPORTIVA EL ESFUERZO FEMENINO QUIRIHUE",TEJIENDO TELAR EN COMUNIDAD,"$2,992,478.00",JUAN PARADA,
123,REND.,2301EG0009,29-abr-24,29-abr-24,2-may-24,AGRUPACION DE ADELANTO VUELTA LA RAMA,CONFECCIONANDO SUEÑOS E ILUSIONES,"$2,743,460.00",JUAN PARADA,
124,REND.,2301S0054,29-abr-24,29-abr-24,2-may-24,AGRUPACIÓN DE JOVENES UNIDOS DISCAPACITADOS DE COELEMU,CON NUESTRA ARTE LA DISCAPACIDAD SE VIVE EN VOLORES,"$2,814,210.00",JUAN PARADA,
125,REND.,2301S0056,29-abr-24,29-abr-24,2-may-24,AGRUPACION DE CIEGOS Y LIMITADOS VISUALES DE COELEMU,NUESTRAS MANOS SON LOS OJOS DE NUESTRA ALMA,"$2,514,903.00",JUAN PARADA,
126,REND.,2301S0051,29-abr-24,29-abr-24,2-may-24,AGRUPACION DE PERSONAS CON DISCAPACIDAD DE LA COSTA,CREANDO Y POTENCIANDO MIS HABILIDADES,"$2,581,843.00",JUAN PARADA,
127,REND.,2301EG0075,29-abr-24,29-abr-24,2-may-24,COMITÉ DE DAMAS RENÉ SCHNEIDER,CONSTRUYENDO SUEÑOS EN VELLÓN,"$2,777,373.00",JUAN PARADA,
128,REND.,2301SP0323,30-abr-24,29-abr-24,2-may-24,JJVV PORTEÑA ALESSANDRI,VECINOS PROTEGIDOS DE LOS DELINCUENTES CON ALARMAS COMUNITARIAS,"$4,495,003.00",JUAN PARADA,
129,REND.,2301SP0429,29-abr-24,29-abr-24,2-may-24,JJVV VILLA LOS ANDES,VILLA LOS ANDES PREOCUPADOS POR SU GENTE,"$4,495,003.00",JUAN PARADA,
130,REND.,2301C0118,22-abr-24,29-abr-24,2-may-24,CLUB DE HUASOS PUELCHE DE MALALCURA,FIESTA COSTUMBRISTA PUELCHE DE MALALCURA EN PRIMAVERA,"$2,493,213.00",JUAN PARADA,
131,REND.,2301EG0114,26-abr-24,29-abr-24,2-may-24,AGRUPACIÓN FEMENINA LOBA NEGRA,ENCUENTRO COMUNAL DE MUJERES INTERGENERACIONAL,"$2,994,918.00",JUAN PARADA,
132,REND.,2301EG0051,29-abr-24,29-abr-24,2-may-24,CLUB AUTOAYUDA MUJERES BORDANDO ESPERANZA,BORDANDO PAISAJES TRADICIONALES CHILENOS,"$2,932,971.00",JUAN PARADA,
133,REND.,2301S0093,S/F,29-abr-24,2-may-24,AGRUPACION DE PACIENTES Y FAMILIARES CON PARKINSON,HABILITACION FUNCIONAL EN LA PERSONA CON ENFERMEDAD DE PARKINSON,"$2,966,000.00",JUAN PARADA,
134,REND.,2301D0318,29-abr-24,29-abr-24,2-may-24,CLUB DEPORTIVO ARTURO PRAT COELEMU,ESCUELA DE FUTBOL FORMATIVO ARTURO PRAT,"$3,000,000.00",JUAN PARADA,
135,REND.,2301S0123,25-abr-24,29-abr-24,2-may-24,CENTRO DE PADRES Y APODERADOS COLEGIO NUEVA ESPERANZA,ACTIVANDO NUESTROS SENTIDOS,"$3,000,000.00",JUAN PARADA,
136,REND.,2301C0123,29-abr-24,29-abr-24,2-may-24,AGRUPACION FOLKLORICA CANTARES DE YUNGAY,CANTARES DE YUNGAY RECORRIENDO ÑUBLE,"$3,299,400.00",JUAN PARADA,
137,REND.,2301S0080,26-abr-24,29-abr-24,2-may-24,TALLER LABORAL LA HERMANDAD,TEJIENDO SOMOS MAS FELICES,"$2,442,299.00",JUAN PARADA,
138,REND.,2301SP0568,30-abr-24,29-abr-24,2-may-24,JJVV LOS MARIA MERCEDES,MEJORANDO LA SEGURIDAD FAMILIAR,"$3,881,000.00",JUAN PARADA,
139,REND.,2301SP0539,30-abr-24,29-abr-24,2-may-24,JJVV N10 MAIPO ARRIBA,MAIPO ARRIBA CONTRA LOS INCENDIOS,"$2,483,100.00",JUAN PARADA,
140,REND.,2301D0032,S/F,29-abr-24,2-may-24,CLUB DEPORTIVO FC REAL BRISAS,EQUIPAMIENTO Y PARTICIPACIÓN PARA EL CLUB DEPORTIVO FC REAL BRISAS,"$1,800,000.00",JUAN PARADA,
141,REND.,2301S0142,S/F,29-abr-24,2-may-24,ASOCIACION DE DISCAPACITADOS DE SAN IGNACIO,MEJOR SALUD Y BIENESTAR PARA NUESTRAS VIDAS,"$3,000,922.00",JUAN PARADA,
142,REND.,2301EG0069,29-abr-24,29-abr-24,2-may-24,FUNDACION CRECER EN EQUIDAD,CUIDANDO AL QUE CUIDA TALLERES PSICOEDUCATIVOS,"$4,462,796.00",JUAN PARADA,
143,REND.,2301SP0062,S/F,30-abr-24,2-may-24,COMITÉ DE ADELANTO Y DESARROLLO SANTA MARÍA - LOZIER,SEGURIDAD EN MIS CALLES,"$4,500,000.00",JUAN PARADA,
144,REND.,2301SP0319,30-abr-24,30-abr-24,2-may-24,SEGUNDA COMPAÑÍA DE BOMBEROS DE YUNGAY,AYUDENOS A AYUDAR,"$4,140,179.00",JUAN PARADA,
145,REND.,2301SP0058,26-abr-24,30-abr-24,2-may-24,JJVV VILLA LOS REGIDORES,UNIDOS POR LA SEGURIDAD,"$4,500,000.00",JUAN PARADA,
146,REND.,2301M0060,16-abr-24,30-abr-24,2-may-24,CENTRO DE PADRES Y APODERADOS JARDIN EL TRIGAL,GUARDIANES DE LA NATURALEZA,"$2,850,000.00",JUAN PARADA,
147,REND.,2301SP0471,29-abr-24,30-abr-24,2-may-24,JJVV LOS COPIHUES DE CERRO NINHUE,MAS VALE PREVENIR QUE LAMENTAR ,"$3,047,000.00",JUAN PARADA,
148,REND.,2301D0034,29-abr-24,30-abr-24,2-may-24,UNION COMUNAL DE FUTBOL NINHUE,CAMPEONATO DE FUTBOL COMUNAL FNDR NINHUE,"$3,913,500.00",JUAN PARADA,
149,REND.,2301SP0242,26-abr-24,30-abr-24,2-may-24,JJVV VILLA ARTURO PRAT,VILLA ARTURO PRAT MAS SEGURA,"$2,768,435.00",JUAN PARADA,
150,REND.,2301AM119,29-abr-24,30-abr-24,2-may-24,COMITÉ DE ADULTO MAYOR BUENA UNION DE HUACALEMU ,FORTALECIENDO LAS FUNCIONES COGNITIVAS MEJORAMOS LA CALIDAD DE VIDA DE LAS PERSONAS MAYORES,"$1,283,611.00",JUAN PARADA,
151,REND.,2301D0268,29-abr-24,30-abr-24,2-may-24,ASOCIACION DE FUTBOL AMATEUR CHILLAN,ANFA SUMA +DEPORTE -VIOLENCIA,"$2,920,053.00",JUAN PARADA,
152,REND.,2301D0219,30-abr-24,30-abr-24,2-may-24,ESCUELA DE FUTBOL LOS PUMAS,TRABAJANDO POR LOS NIÑOS DE YUNGAY,"$2,996,000.00",JUAN PARADA,
153,REND.,2301D0250,30-abr-24,30-abr-24,2-may-24,CLUB DEPORTIVO REAL BAQUEDANO,JUNTOS SEGUIMOS CRECIENDO,"$1,800,000.00",JUAN PARADA,
154,REND.,2301D0123,30-abr-24,30-abr-24,2-may-24,CLUB DEPORTIVO SOCIAL Y CULTURAL TAEKWONDO DRAGONES BLANCOS SUR,TALLERES FORMATIVOS DE TAEKWONDO EN SAN CARLOS,"$2,993,000.00",JUAN PARADA,
155,REND.,2301D0252,30-abr-24,30-abr-24,2-may-24,CLUB DE VOLEIBOL SAN FABIAN,FORMACION CLUB DE VOLEIBOL SAN FABIAN,"$3,000,972.00",JUAN PARADA,
156,REND.,2301SP0442,30-abr-24,30-abr-24,2-may-24,JJVV PABLO NERUDA QUIRIHUE,JUNTOS MEJORAMOS LA SEGURIDAD EN PABLO NERUDA,"$4,466,150.00",JUAN PARADA,
157,REND.,2301S0113,26-abr-24,30-abr-24,2-may-24,CLUB DEPORTIVO EL TEJAR,CLUB DEPORTIVO EL TEJAR JUNTO A LA COMIDA SALUDABLE,"$2,989,880.00",JUAN PARADA,
158,REND.,2301M0089,24-abr-24,30-abr-24,2-may-24,JJVV DADINCO,NATURALMENTE DADINCO,"$2,628,230.00",JUAN PARADA,
159,REND.,2301C0163,29-abr-24,30-abr-24,2-may-24,AGRUPACION CULTURAL CON MANOS DE MUJER,TALLER DE PINTURA AL OLEO,"$3,500,000.00",JUAN PARADA,
